index,url,valid,domain,title,description,image,published,archive,content,quote,language,term,topic,feed,country,ipcc,continent
https://www.aljazeera.com/news/2025/10/1/at-least-9-dead-in-severe-weather-in-ukraines-odesa-as-war-rumbles-on,https://www.aljazeera.com/news/2025/10/1/at-least-9-dead-in-severe-weather-in-ukraines-odesa-as-war-rumbles-on,0,www.aljazeera.com,At least nine dead in severe weather in Ukraine’s Odesa as war rumbles on,More than 350 people have been rescued after southern Ukrainian city was hit by two months of rain in just seven hours.,https://www.aljazeera.com/wp-content/uploads/2025/10/reuters_68dcc6c0-1759299264.jpg?resize=1920%2C1372,2025-10-01T06:39:11Z,,"At least nine people, including one child, have been killed after a severe rainstorm and flooding in the southern Ukrainian city of Odesa, according to the countrys emergency services.
A total of 36… [+3075 chars]",,en,Severe Weather Southern,Thunderstorm,wmo,Malawi,ESAF,Africa
https://www.nzherald.co.nz/nz/ryan-bridge-reacts-as-tiktok-fans-swoon-over-viral-earthquake-broadcast/KMCJDRVHIJBH7BCMP2XK5FFV4Q/,https://www.nzherald.co.nz/nz/ryan-bridge-reacts-as-tiktok-fans-swoon-over-viral-earthquake-broadcast/KMCJDRVHIJBH7BCMP2XK5FFV4Q/,0,www.nzherald.co.nz,Ryan Bridge reacts as TikTok fans swoon over viral earthquake broadcast,"The clip of Ryan Bridge has drawn nearly 910,000 views on TikTok.",https://www.nzherald.co.nz/resizer/v2/YH4W55P4YRGINGSHZTDSBH2LRU.JPG?auth=72500de59136c4f1aaa8631cb9dee4a5995eb903c7e6876f52226333470aedae&width=1200&height=675&quality=70&focal=1456%2C540&smart=false,2025-10-01T07:00:00Z,,"New Zealand, youve been holding out on us, another said.
Another lamented, We dont have reporters like this in Canada.
The barrage of admiration came as a shock to Kiwis, who are used to seeing Bri… [+2022 chars]",,en,earthquake,Earthquake,random,,,
https://www.aljazeera.com/news/2025/10/1/deadly-earthquake-hits-philippines-what-we-know-so-far,https://www.aljazeera.com/news/2025/10/1/deadly-earthquake-hits-philippines-what-we-know-so-far,0,www.aljazeera.com,Deadly earthquake hits Philippines: What we know so far,Local authorities say nearly 70 people have been killed and hospitals in the Cebu province are overwhelmed.,https://www.aljazeera.com/wp-content/uploads/2025/10/AFP__20251001__77BP4FG__v2__HighRes__TopshotPhilippinesQuake-1759305174.jpg?resize=1920%2C1440,2025-10-01T09:43:11Z,,"A magnitude 6.9 earthquake hit the central Philippines late on Tuesday night, killing at least 69 people and injuring more than 140, according to local authorities.
Here is more about what happened … [+6941 chars]",,en,Earthquake Philippines,Earthquake,usgs,Philippines,SEA,Asia
https://www.cbsnews.com/news/hospitals-flood-risk-trump-climate/,https://www.cbsnews.com/news/hospitals-flood-risk-trump-climate/,0,www.cbsnews.com,These hospitals face major flood risk. Experts say Trump is making it worse.,"Hospitals across the U.S. are at risk of significant flooding, and climate experts warn that the Trump administration's cuts leave the nation less prepared.",https://assets3.cbsnewsstatic.com/hub/i/r/2025/09/25/d000be6a-c607-42f0-a471-0f6251ea250f/thumbnail/1200x630/43c3f260f187712944bd2c10c05683fe/hospital-flood-risk10.jpg,2025-10-01T10:00:18Z,,"LOUISVILLE, Tenn. — When a big storm hits, Peninsula Hospital could be underwater.
At this decades-old psychiatric hospital on the edge of the Tennessee River, an intense storm could submerge the bu… [+23631 chars]",,en,flooding,ice jam,random,,,
https://www.jsonline.com/story/news/local/2025/10/01/how-to-apply-for-small-business-loans-for-flood-relief-in-wisconsin/86442163007/,https://www.jsonline.com/story/news/local/2025/10/01/how-to-apply-for-small-business-loans-for-flood-relief-in-wisconsin/86442163007/,0,www.jsonline.com,The SBA has already distributed $6.4 million in flood relief in Wisconsin. Here's how to apply.,"As of Sept. 30, the SBA said it had provided more than $6.1 million to residents and $317,500 to businesses in the wake of the August floods.",https://s.yimg.com/ny/api/res/1.2/9n3Yj4Hoe6.B4gDpSnjNFw--/YXBwaWQ9aGlnaGxhbmRlcjt3PTEyMDA7aD04NjE7Y2Y9d2VicA--/https://media.zenfs.com/en/milwaukee_journal_sentinel_natl_articles_362/83785278316d6a37bf1f178dc228da7b,2025-10-01T10:04:32Z,,"The U.S. Small Business Administration has distributed more than $6.4 million in federal disaster loans to Wisconsin businesses, nonprofits, homeowners, and renters affected by the historic August fl… [+3787 chars]",,en,Flood Wisconsin,Flood,fema,United States,ENA,North-America
https://abcnews.go.com/International/wireStory/hurricane-imelda-rumbles-bermuda-airport-schools-government-offices-126110756,https://abcnews.go.com/International/wireStory/hurricane-imelda-rumbles-bermuda-airport-schools-government-offices-126110756,0,abcnews.go.com,"Hurricane Imelda rumbles toward Bermuda as airport, schools, government offices close",Hurricane Imelda is barreling toward Bermuda as forecasters warn it would swipe past the tiny British territory as a Category 2 storm,https://i.abcnewsfe.com/a/118f7d32-e25f-49ea-981d-7fde9087f76a/wirestory_c6760b885b541c2154dcb1b5b9bcf163_16x9.jpg?w=1600,2025-10-01T12:49:02Z,,"SAN JUAN, Puerto Rico -- SAN JUAN, Puerto Rico (AP) Hurricane Imelda barreled toward Bermuda on Wednesday as forecasters warned that it could swipe past the tiny British territory as a Category 2 sto… [+4042 chars]",,en,storm,Storm,random,,,
https://www.forbes.com/sites/michellebruton/2025/10/01/these-16-freeskiers-will-join-shaun-whites-snow-league-in-december/,https://www.forbes.com/sites/michellebruton/2025/10/01/these-16-freeskiers-will-join-shaun-whites-snow-league-in-december/,0,www.forbes.com,These 16 Freeskiers Will Join Shaun White’s Snow League In December,"Sixteen freeskiers, eight men and eight women, will join the 36 snowboarders competing in the first season of Shaun White's Snow League at a December event in China.",https://imageio.forbes.com/specials-images/imageserve/68dca2402d146ea0f0699a1c/0x0.jpg?format=jpg&height=900&width=1600&fit=bounds,2025-10-01T13:00:00Z,,"Eileen Gu of China competes during the Women's Freeski Halfpipe Final on day three of 2024/25 FIS Snowboard &amp; Freeski Halfpipe World Cup at Secret Garden on December 7, 2024 in Zhangjiakou, Hebei… [+4472 chars]",,en,Snow China,Snow&Ice,wmo,China,EAS,Asia
https://www.aljazeera.com/video/between-us/2025/10/1/capturing-resilience-in-afghanistan,https://www.aljazeera.com/video/between-us/2025/10/1/capturing-resilience-in-afghanistan,0,www.aljazeera.com,Capturing resilience in Afghanistan,"In Afghanistan’s earthquake aftermath, Sorin Furcoi captures both the loss and the hope of people rebuilding.",https://www.aljazeera.com/wp-content/uploads/2025/10/Capturing-post-Afghanistan-quakeBus-16x9-copy-1759326094.png?resize=1920%2C1080&quality=80,2025-10-01T13:48:25Z,,"Between Us
Read moreIn the wake of Afghanistans deadly earthquake, Al Jazeeras photojournalist Sorin Furcoi captures both the devastation left behind and the strength of those determined to rebuild.",,en,earthquake,Earthquake,random,,,
https://journals.plos.org/plosone/article?id=10.1371/journal.pone.0331854,https://journals.plos.org/plosone/article?id=10.1371/journal.pone.0331854,0,journals.plos.org,"Bacteria isolated from the grape phyllosphere capable of degrading guaiacol, a main volatile phenol associated with smoke taint in wine","Recent wildfires near vineyards in the Pacific United States have caused devastating financial losses due to smoke taint in wine. When wine grapes (Vitis vinifera) are exposed to wildfire smoke, their berries absorb volatile phenols derived from the lignin of…",https://journals.plos.org/plosone/article/figure/image?id=10.1371/journal.pone.0331854.g006&size=inline,2025-10-01T14:00:00Z,,"Abstract
Recent wildfires near vineyards in the Pacific United States have caused devastating financial losses due to smoke taint in wine. When wine grapes (Vitis vinifera) are exposed to wildfire s… [+63714 chars]",,en,wildfire,Wildfire,random,,,
https://www.tmz.com/2025/10/01/thomas-markle-not-trapped-earthquake-philippines/,https://www.tmz.com/2025/10/01/thomas-markle-not-trapped-earthquake-philippines/,0,www.tmz.com,"Thomas Markle Not Trapped After Philippines Earthquake, Despite Claims","Meghan Markle's dad, Thomas, wants to set the record straight after claims he was left helpless in the Philippines during this week's earthquake -- cause he tells TMZ he's safe and mobile. Thomas tells TMZ ... he's safe in his hotel room, and in no…",https://imagez.tmz.com/image/ce/16by9/2025/10/01/cedd313ba7404f418786ffc435ef04ce_xl.jpg,2025-10-01T18:00:37Z,,"Meghan Markle's dad, Thomas,wants to set the record straight after claims he was left helpless in the Philippines during this week's earthquake -- cause he tells TMZ he's safe and mobile.
Thomas tel… [+935 chars]",,en,Earthquake Philippines,Earthquake,usgs,Philippines,SEA,Asia
https://www.abc.net.au/news/2025-10-02/qld-flood-apartments-ipswich-development-approvals/105820118,https://www.abc.net.au/news/2025-10-02/qld-flood-apartments-ipswich-development-approvals/105820118,0,www.abc.net.au,Hundreds of units proposed on land that faces 'extreme potential flood levels',"A major developer wants to build 500 apartments on the banks of a river to Brisbane's south, but some concerned residents say the flooding risk is too high.",https://live-production.wcms.abc-cdn.net.au/dc1293751344c3702e20668429ecead5?impolicy=wcms_watermark_news&cropH=2813&cropW=5000&xPos=0&yPos=260&width=862&height=485&imformat=generic,2025-10-01T19:39:30Z,,"More than 1,000 low-income, vulnerable residents would be forced to evacuate a proposed affordable housing development when major flood warnings are issued, if the project is approved by a south-east… [+5507 chars]",,en,river flooding,Flood,random,,,
https://www.thestar.com.my/news/world/2025/10/02/sudan-urges-flood-precautions-as-river-levels-continue-to-rise,https://www.thestar.com.my/news/world/2025/10/02/sudan-urges-flood-precautions-as-river-levels-continue-to-rise,0,www.thestar.com.my,Sudan urges flood precautions as river levels continue to rise,"KHARTOUM, Oct. 1 (Xinhua) -- Sudan's Ministry of Agriculture and Irrigation on Wednesday urged all citizens living along the banks of the Nile River to take necessary precautions to protect their lives and property, as river levels are rising to flood stage i…",https://cdn.thestar.com.my/Themes/img/newTsol_logo_socmedia.png,2025-10-01T21:53:00Z,,"KHARTOUM, Oct. 1 (Xinhua) -- Sudan's Ministry of Agriculture and Irrigation on Wednesday urged all citizens living along the banks of the Nile River to take necessary precautions to protect their liv… [+1598 chars]",,en,Flood Sudan,Flood,relief,Sudan,SAH,Africa
https://www.bbc.com/news/articles/c2lxvjypxreo,https://www.bbc.com/news/articles/c2lxvjypxreo,0,www.bbc.com,Hurricane season brings financial fears in the Caribbean,"As islands brace for this year's big storms, many homes don't have household insurance.",https://ichef.bbci.co.uk/news/1024/branded_news/6dfc/live/2a9d06a0-9951-11f0-9ab8-fd188b933226.jpg,2025-10-01T23:02:08Z,,"Gemma HandyBusiness reporter, St Johns, Antigua 
Homes in Barbuda were flattened by 2017's Hurricane Irma
For some Barbudans, thunderstorms still trigger flashbacks of the night in September 2017 w… [+6664 chars]",,en,storm,Storm,random,,,
https://financialpost.com/pmn/business-wire-news-releases-pmn/avalanche-treasury-co-announces-675-million-business-combination-with-mountain-lake-acquisition-corp-with-goal-to-build-1-billion-ecosystem-treasury,https://financialpost.com/pmn/business-wire-news-releases-pmn/avalanche-treasury-co-announces-675-million-business-combination-with-mountain-lake-acquisition-corp-with-goal-to-build-1-billion-ecosystem-treasury,0,financialpost.com,Avalanche Treasury Co. Announces $675 Million+ Business Combination with Mountain Lake Acquisition Corp. with Goal to Build $1 Billion+ Ecosystem Treasury,"Exclusive relationship with Avalanche Foundation, beginning with $200 million discounted token sale at announcement $675 million+ transaction, including approximately $460 million in treasury assets following equity private placement financing, assuming no ML…",,2025-10-01T23:05:29Z,,"<ul><li>Exclusive relationship with Avalanche Foundation, beginning with $200 million discounted token sale at announcement</li><li>$675 million+ transaction, including approximately $460 million in … [+8347 chars]",,en,avalanche,Snow&Ice,random,,,
https://www.irishtimes.com/environment/2025/10/02/plans-for-dealing-with-future-extreme-weather-events-not-yet-finalised/,https://www.irishtimes.com/environment/2025/10/02/plans-for-dealing-with-future-extreme-weather-events-not-yet-finalised/,0,www.irishtimes.com,Plans for dealing with future extreme weather events not yet finalised,"‘Significant shortcomings’ seen in State’s responses to storms Éowyn and Darragh, says climate advisory body",https://www.irishtimes.com/resizer/v2/5B6C6FY3IVGMXAKJQJRDXX7ZEY.JPG?smart=true&auth=84d23081bbc9373548ee81a00a9d62d3c611d123881d1d747bbfbafab6a226c0&width=1200&height=630,2025-10-02T05:00:00Z,,"Storm season is almost upon us, leaving thousands of homes and businesses up and down the country fearful of what the weather will bring over the autumn and winter months.
Those households and busin… [+8338 chars]",,en,storm,Storm,random,,,
https://www.nakedcapitalism.com/2025/10/how-climate-change-is-driving-home-insurance-turmoil.html,https://www.nakedcapitalism.com/2025/10/how-climate-change-is-driving-home-insurance-turmoil.html,0,www.nakedcapitalism.com,How Climate Change Is Driving Home Insurance Turmoil,Climate-fueled storms and wildfires are increasing costs and pushing insurers to the limit. What happens if the market breaks?,https://www.nakedcapitalism.com/wp-content/uploads/2025/10/Screenshot-2025-10-01-at-11.13.37 PM.png,2025-10-02T05:07:36Z,,"This is Naked Capitalism fundraising week. 554 donors have already invested in our efforts to combat corruption and predatory conduct, particularly in the financial realm. Please join us and particip… [+16986 chars]",,en,storm,Storm,random,,,
https://abcnews.go.com/International/wireStory/imelda-descends-bermuda-category-2-hurricane-damaging-wind-126141880,https://abcnews.go.com/International/wireStory/imelda-descends-bermuda-category-2-hurricane-damaging-wind-126141880,0,abcnews.go.com,Imelda descends on Bermuda as Category 2 hurricane with damaging wind and waves,Hurricane Imelda is descending on Bermuda as a Category 2 storm that forecasters have warned is expected to bring potentially destructive weather to the British territory,https://i.abcnewsfe.com/a/3b5c0428-af8a-4ed1-9460-e3afb5b62140/wirestory_e4f8c67898e8cbde12ff775bdea2ba8c_16x9.jpg?w=1600,2025-10-02T05:34:44Z,,"SAN JUAN, Puerto Rico -- SAN JUAN, Puerto Rico (AP) Hurricane Imelda was descending on Bermuda late Wednesday as a Category 2 storm that forecasters warned was expected to bring potentially destructi… [+2577 chars]",,en,storm,Storm,random,,,
https://www.abc.net.au/news/2025-10-02/barkly-fire-killed-thousands-of-cattle-review-finds/105842564,https://www.abc.net.au/news/2025-10-02/barkly-fire-killed-thousands-of-cattle-review-finds/105842564,0,www.abc.net.au,"Review highlights 'near misses' in bushfire that killed 37,000 cattle","The fire threatened communities, destroyed more than 3,500km of fencing and cost the NT's cattle industry an estimated $120 million.",https://live-production.wcms.abc-cdn.net.au/7923ce613dc96bcf83586d05ec0d64dc?impolicy=wcms_watermark_news&cropH=864&cropW=1536&xPos=0&yPos=775&width=862&height=485&imformat=generic,2025-10-02T06:38:20Z,,"An independent review into the 2023 bushfires that burnt more than 2.7 million hectares in the Barkly region of the Northern Territory has highlighted a wide range issues, but not ""assigned blame"". … [+4250 chars]",,en,bushfire,Wildfire,random,,,
https://www.globenewswire.com/news-release/2025/10/02/3160129/28124/en/India-Air-Conditioner-Market-Analysis-Report-2025-2033-Rising-Urbanization-Heatwaves-and-Energy-Efficient-Technologies-Drive-Demand.html,https://www.globenewswire.com/news-release/2025/10/02/3160129/28124/en/India-Air-Conditioner-Market-Analysis-Report-2025-2033-Rising-Urbanization-Heatwaves-and-Energy-Efficient-Technologies-Drive-Demand.html,0,www.globenewswire.com,"India Air Conditioner Market Analysis Report 2025-2033: Rising Urbanization, Heatwaves and Energy-Efficient Technologies Drive Demand","The India Air Conditioner Market, estimated at USD 3.88 billion in 2024, is projected to soar to USD 13.43 billion by 2033 with a CAGR of 14.78% from 2025 to 2033. This robust growth is spurred by urbanization, rising middle-class incomes, and a surging need …",https://ml.globenewswire.com/Resource/Download/908fb457-7f8e-4a08-9081-5565e3dfb3d7,2025-10-02T08:03:00Z,,"Dublin, Oct. 02, 2025 (GLOBE NEWSWIRE) -- The ""India Air Conditioner Market Size and Share Analysis - Growth Trends and Forecast Report 2025-2033"" report has been added to ResearchAndMarkets.com's of… [+7439 chars]",,en,heat wave,Heat Wave,random,,,
https://www.ibtimes.com/meghan-markles-dad-trapped-philippines-after-69-quake-half-sisters-post-sparks-concern-3785225,https://www.ibtimes.com/meghan-markles-dad-trapped-philippines-after-69-quake-half-sisters-post-sparks-concern-3785225,0,www.ibtimes.com,Is Meghan Markle's Dad Trapped In The Philippines After 6.9 Quake? Half-Sister's Post Sparks Concern,Meghan Markle's father Thomas Markle confirms he is safe in Cebu after daughter Samantha claimed he was trapped during deadly 6.9 earthquake in Philippines.,https://d.ibtimes.com/en/full/4625228/thomas-markle-meghan-markle.png,2025-10-02T10:43:05Z,,Confusion rippled across social media this week after claims suggested Meghan Markle's father had become trapped on the 19th floor of a building in the Philippines following a deadly 6.9 magnitude ea… [+3595 chars],,en,earthquake,Earthquake,random,,,
https://www.channelnewsasia.com/sport/australia-nzealand-shoot-rugby-championship-silverware-in-perth-finale-5381966,https://www.channelnewsasia.com/sport/australia-nzealand-shoot-rugby-championship-silverware-in-perth-finale-5381966,0,www.channelnewsasia.com,"Australia, N.Zealand shoot for Rugby Championship silverware in Perth finale","Australia and New Zealand meet again at a sold-out Perth Stadium on Saturday, a week after a bruising battle at Eden Park, hoping to lay claim to the Rugby Championship trophy, if only temporarily.The champagne will be on ice for the victors, though, with Sou…","https://dam.mediacorp.sg/image/upload/s--VP5fQiqM--/c_fill,g_auto,h_676,w_1200/fl_relative,g_south_east,l_mediacorp:cna:watermark:2024-04:reuters_1,w_0.1/f_auto,q_auto/v1/one-cms/core/2025-10-02T111239Z_1_LYNXNPEL910FK_RTROPTP_3_RUGBY-UNION-CHAMPIONSHIP-AUS-NZL.JPG?itok=kX6p13qR",2025-10-02T11:12:39Z,,"Australia and New Zealand meet again at a sold-out Perth Stadium on Saturday, a week after a bruising battle at Eden Park, hoping to lay claim to the Rugby Championship trophy, if only temporarily.
… [+3051 chars]",,en,Ice Australia,Snow&Ice,wmo,Australia,CAU,Oceania
https://weather.com/storms/hurricane/video/typhoon-bualoi-landslide-hits-suv-in-vietnam,https://weather.com/storms/hurricane/video/typhoon-bualoi-landslide-hits-suv-in-vietnam,0,weather.com,See The Moment A Landslide Pushes An SUV Over A Slope,"Typhoon Bualoi hit northern Vietnam with deadly force, leaving at least three dozen dead and nearly two dozen missing. A massive landslide crashed into one...",https://s.yimg.com/ny/api/res/1.2/KRJBzJP_hD6tISFKPxTRCA--/YXBwaWQ9aGlnaGxhbmRlcjt3PTEyMDA7aD02NzU7Y2Y9d2VicA--/https://media.zenfs.com/en/the_weather_channel_videos_110/db1c23a8168a9647b1ad9099a0ca51db,2025-10-02T15:06:59Z,,"Typhoon Bualoi hit northern Vietnam with deadly force, leaving at least three dozen dead and nearly two dozen missing. A massive landslide crashed into one SUV trying to navigate a narrow, mountain r… [+70 chars]",,en,Landslide Vietnam,Landslide,relief,Vietnam,SEA,Asia
https://www.thestar.com.my/news/world/2025/10/03/severe-flooding-aid-cuts-deepen-hunger-crisis-in-south-sudan-charity,https://www.thestar.com.my/news/world/2025/10/03/severe-flooding-aid-cuts-deepen-hunger-crisis-in-south-sudan-charity,0,www.thestar.com.my,"Severe flooding, aid cuts deepen hunger crisis in South Sudan: charity","JUBA, Oct. 2 (Xinhua) -- Widespread flooding for the sixth consecutive year in South Sudan, combined with aid cuts, is aggravating the country's hunger crisis, international charity Save the Children said on Thursday. Read full story",https://cdn.thestar.com.my/Themes/img/newTsol_logo_socmedia.png,2025-10-02T17:14:00Z,,"JUBA, Oct. 2 (Xinhua) -- Widespread flooding for the sixth consecutive year in South Sudan, combined with aid cuts, is aggravating the country's hunger crisis, international charity Save the Children… [+1278 chars]",,en,Flood South Sudan,Flood,relief,South Sudan,NEAF,Africa
https://phys.org/news/2025-10-world-ablaze-1980s.html,https://phys.org/news/2025-10-world-ablaze-1980s.html,0,phys.org,Study shows the world is far more ablaze now with damaging fires than in the 1980s,"Earth's nastiest and costliest wildfires are blazing four times more often now than they did in the 1980s because of human-caused climate change and people moving closer to wildlands, a new study found.",https://scx2.b-cdn.net/gfx/news/hires/2025/study-shows-the-world.jpg,2025-10-02T19:16:13Z,,"Earth's nastiest and costliest wildfires are blazing four times more often now than they did in the 1980s because of human-caused climate change and people moving closer to wildlands, a new study fou… [+5815 chars]",,en,wildfire,Wildfire,random,,,
https://abcnews.go.com/US/wireStory/study-shows-world-ablaze-now-damaging-fires-1980s-126159726,https://abcnews.go.com/US/wireStory/study-shows-world-ablaze-now-damaging-fires-1980s-126159726,0,abcnews.go.com,Study shows the world is far more ablaze now with damaging fires than in the 1980s,A new study shows that the world's most damaging wildfires are happening four times more often now compared to the 1980s,https://s.abcnews.com/images/US/abc_news_default_2000x2000_update_16x9_992.jpg,2025-10-02T20:11:09Z,,"WASHINGTON -- Earths nastiest and costliest wildfires are blazing four times more often now than they did in the 1980s because of human-caused climate change and people moving closer to wildlands, a … [+5085 chars]",,en,wildfire,Wildfire,random,,,
https://dailycaller.com/2025/10/02/typhoon-bualoi-landslide-suv-mountain-road-vietnam/,https://dailycaller.com/2025/10/02/typhoon-bualoi-landslide-suv-mountain-road-vietnam/,0,dailycaller.com,Landslide Sends SUV Flying Off Mountain Road As Typhoon Bualoi Strikes Vietnam,"Taking place Monday in Vietnam, a landslide suddenly happened on National Highway 4D, which is around the O Quy Ho Pass in Sa Pa Ward.","https://images.dailycaller.com/image/width=1280,height=549,fit=cover,format=webp,f=auto/https://cdn01.dailycaller.com/wp-content/uploads/2025/10/Untitled-design-160-e1759443996393.png",2025-10-02T22:39:40Z,,"Taking place Monday in Vietnam, a landslide suddenly happened on National Highway 4D, which is around the O Quy Ho Pass in Sa Pa Ward, located in the Lao Cairns Province. The landslide sent upper slo… [+1658 chars]",,en,Landslide Vietnam,Landslide,relief,Vietnam,SEA,Asia
https://crooksandliars.com/2025/10/have-you-noticed-kash-patel-idiot,https://crooksandliars.com/2025/10/have-you-noticed-kash-patel-idiot,0,crooksandliars.com,Have You Noticed Kash Patel Is An Idiot?,"You know what’s a great thing to do when you’re visiting a foreign country in a diplomatic role as part of a joint effort to fight crime? Bring some illegal weapons.
At least that’s what FBI Director Kash Patel apparently believes.
When visiting New Zealand t…",https://crooksandliars.com/files/primary_image/25/10/53860348595_5269ae4a81_z.jpg,2025-10-03T00:19:39Z,,"You know whats a great thing to do when youre visiting a foreign country in a diplomatic role as part of a joint effort to fight crime? Bring some illegal weapons.
At least thats what FBI Director K… [+3209 chars]",,en,Ice New Zealand,Snow&Ice,wmo,New Zealand,NZ,Oceania
https://www.bbc.com/news/articles/cp8wrnn7nego,https://www.bbc.com/news/articles/cp8wrnn7nego,0,www.bbc.com,Amber wind warning issued for parts of NI ahead of Storm Amy,The Met Office warns of gusts of 60-70 mph inland and up to 80 mph along some more exposed coasts.,https://ichef.bbci.co.uk/news/1024/branded_news/1dfe/live/3f07a680-9f88-11f0-a934-075243299099.jpg,2025-10-03T06:34:41Z,,"Cecilia DalyBBC News NI weather presenter
People at Portstewart run for cover during Storm Floris in August
The Met Office is warning of disruption to parts of Northern Ireland on Friday as Storm A… [+3731 chars]",,en,storm,Storm,random,,,
https://www.aljazeera.com/features/2025/10/3/death-of-a-rainmaker-when-drought-means-murder-in-south-sudan,https://www.aljazeera.com/features/2025/10/3/death-of-a-rainmaker-when-drought-means-murder-in-south-sudan,0,www.aljazeera.com,Death of a rainmaker: When drought means murder in South Sudan,"For a group of people whose job means life, climate change can spell death.",https://www.aljazeera.com/wp-content/uploads/2025/08/IMG_2695-1755762024.jpg?resize=1920%2C1440,2025-10-03T06:52:57Z,,"Torit, South Sudan Solomon Oture was on the run.
As a rainmaker, his job was to summon rain the lifeblood of his small farming community through prayer and ritual.
list of 3 itemsend of list
But a… [+19086 chars]",,en,Drought Sudan,Drought,edo,Sudan,SAH,Africa
