index,url,valid,domain,title,description,image,published,archive,content,quote,language,term,topic,feed,country,ipcc,continent
https://www.nhc.noaa.gov/refresh/graphics_ep3+shtml/204727.shtml?cone,https://www.nhc.noaa.gov/refresh/graphics_ep3+shtml/204727.shtml?cone,0,www.nhc.noaa.gov,Tropical Storm Cristina Graphics,"Wind Speed Probabilities last updated Mon, 08 Jun 2026 20:37:52 GMT",,2026-06-08T20:47:27Z,,"Watches/Warnings Forecast Cone for Storm Center
Description of this new graphic: National Hurricane Center Experimental Tropical Cyclone Forecast Cone Graphic
NWS Public Information Statement:
htt… [+3287 chars]",,en,Tropical Storm Cristina,Tropical Cyclone,eonet,,SCA,North-America
https://www.nhc.noaa.gov/refresh/graphics_ep3+shtml/113728.shtml?cone,https://www.nhc.noaa.gov/refresh/graphics_ep3+shtml/113728.shtml?cone,0,www.nhc.noaa.gov,Tropical Storm Cristina Graphics,"Wind Speed Probabilities last updated Tue, 09 Jun 2026 09:27:24 GMT",,2026-06-09T11:37:28Z,,"Watches/Warnings Forecast Cone for Storm Center
Description of this new graphic: National Hurricane Center Experimental Tropical Cyclone Forecast Cone Graphic
NWS Public Information Statement:
htt… [+3287 chars]",,en,Tropical Storm Cristina,Tropical Cyclone,eonet,,SCA,North-America
https://punchng.com/central-america-on-alert-as-tropical-storm-cristina-approaches/,https://punchng.com/central-america-on-alert-as-tropical-storm-cristina-approaches/,0,punchng.com,Central America on alert as Tropical Storm Cristina approaches,"Central American nations are on high alert as Tropical Storm Cristina brings heavy rain and potential storm surges. Learn about the impact and safety measu

Read More: https://punchng.com/central-america-on-alert-as-tropical-storm-cristina-approaches/",https://cdn.punchng.com/wp-content/uploads/2026/02/01083620/AFP__20260131__94PJ6TL__v1__Mockup__ColdFrontSweepsBigPartOfUsa-1200x630.jpg,2026-06-09T13:09:34Z,,"Four Central American countries were on alert on Tuesday for the approach of Tropical Storm Cristina, forecast to bring heavy rain and possible storm surges, civil protection agencies said.
El Salva… [+1422 chars]",,en,Storm Surge Central,Storm,wmo,Montenegro,MED,Europe
https://www.foxweather.com/weather-news/tropical-storm-eastern-pacific-mexico-heavy-rain#google_vignette,https://www.foxweather.com/weather-news/tropical-storm-eastern-pacific-mexico-heavy-rain#google_vignette,0,www.foxweather.com,"Tropical Depression Boris, Tropical Storm Cristina bringing flooding rain to Mexico, Central America","The NHC said Cristina could bring heavy rain and life-threatening flash flooding to Costa Rica, Nicaragua, Honduras, El Salvador and Guatemala through mid-week.",https://nypost.com/wp-content/uploads/sites/2/2026/06/130368823.jpg?quality=75&strip=all&w=1200,2026-06-09T16:12:08Z,,"MEXICO – Tropical Storm Boris weakened to a tropical depression as it moved farther inland, bringing flooding rain to southern Mexico, while Tropical Storm Cristina drifts off the coast of Nicaragua … [+2520 chars]",,en,Tropical Storm Boris,Tropical Cyclone,eonet,,SCA,North-America
https://www.news24.com/world/central-america-on-alert-as-tropical-storm-cristina-approaches-20260609-0790,https://www.news24.com/world/central-america-on-alert-as-tropical-storm-cristina-approaches-20260609-0790,0,www.news24.com,News24 | Central America on alert as Tropical Storm Cristina approaches,"Four Central American countries were on alert on Tuesday as Tropical Storm Cristina approached, forecast to bring heavy rain and possible storm surges, civil protection agencies said.",https://news24cobalt.24.co.za/resources/02a6-20d4493cd7b8-d6adf740c75a-1000/format/inline/gettyimages-476447890.jpeg,2026-06-09T19:02:20Z,,"Four Central American countries were on alert on Tuesday as Tropical Storm Cristina approached, forecast to bring heavy rain and possible storm surges, civil protection agencies said. 
El Salvadors … [+1461 chars]",,en,tropical storm,Tropical Cyclone,random,,,
https://www.nhc.noaa.gov/refresh/graphics_ep3+shtml/092217.shtml?cone,https://www.nhc.noaa.gov/refresh/graphics_ep3+shtml/092217.shtml?cone,0,www.nhc.noaa.gov,Tropical Storm Cristina Graphics,"Wind Speed Probabilities last updated Wed, 10 Jun 2026 09:22:17 GMT",,2026-06-10T09:22:17Z,,"Watches/Warnings Forecast Cone for Storm Center
Description of this new graphic: National Hurricane Center Experimental Tropical Cyclone Forecast Cone Graphic
NWS Public Information Statement:
htt… [+3287 chars]",,en,tropical storm,Tropical Cyclone,random,,,
https://www.metafilter.com/213474/Endangered-turtle-found-to-have-survived-record-breaking-flood,https://www.metafilter.com/213474/Endangered-turtle-found-to-have-survived-record-breaking-flood,0,www.metafilter.com,Endangered turtle found to have survived record-breaking flood,"Endangered turtle found to have survived record-breaking flood.

Experts are relieved to see the number of endangered Manning River turtles holding steady, a year after devastating flooding in northern New South Wales.",https://cdn.mefi.us/images/mefi/apple-touch-icon.png,2026-06-10T13:24:08Z,,MetaFilter is a weblog that anyone can contribute a link or a comment to. A typical weblog is one person posting their thoughts on the unique things they find on the web. This website exists to break… [+120 chars],,en,flooding New South Wales,Flood,acwe,Australia,EAU,Oceania
https://www.bleepingcomputer.com/news/security/china-linked-jdy-botnet-expands-targeting-of-us-military-networks/,https://www.bleepingcomputer.com/news/security/china-linked-jdy-botnet-expands-targeting-of-us-military-networks/,0,www.bleepingcomputer.com,China-linked JDY botnet expands targeting of U.S. military networks,"The JDY botnet, a malware network previously associated with Chinese threat actors like Volt Typhoon, has significantly expanded its targeting scope and reconnaissance efforts. [...]",https://www.bleepstatic.com/content/hl-images/2025/03/05/chinese-hacker-flag.jpg,2026-06-10T15:00:00Z,,"The JDY botnet, a malware network previously associated with Chinese threat actors like Volt Typhoon, has significantly expanded its targeting scope and reconnaissance efforts.
According to research… [+3972 chars]",,en,typhoon,Tropical Cyclone,random,,,
https://www.barchart.com/story/news/2404462/sugar-prices-undercut-by-brazilian-real-weakness,https://www.barchart.com/story/news/2404462/sugar-prices-undercut-by-brazilian-real-weakness,0,www.barchart.com,Sugar Prices Undercut by Brazilian Real Weakness,"July NY world sugar #11 (SBN26 ) today is down -0.06 (-0.43%), and Aug London ICE white sugar #5 (SWQ26 ) is up +0.20 (+0.04%). Sugar prices are mixed today,...",https://s.yimg.com/ny/api/res/1.2/882AdCkcYWUJq37DN7EKtw--/YXBwaWQ9aGlnaGxhbmRlcjt3PTEyMDA7aD03Nzk-/https://media.zenfs.com/en/barchart_com_477/022a93cafde4f37766f1e3fd653e8612,2026-06-10T16:25:44Z,,"July NY world sugar #11 (SBN26) today is down -0.06 (-0.43%), and Aug London ICE white sugar #5 (SWQ26) is up +0.20 (+0.04%).
Sugar prices are mixed today, with NY sugar matching a 6-week low.  Weak… [+4927 chars]",,en,Ice Brazil,Snow&Ice,wmo,Brazil,SAM,South-America
https://www.newsweek.com/german-world-cup-tourist-road-trip-through-america-is-taking-us-by-storm-12058738,https://www.newsweek.com/german-world-cup-tourist-road-trip-through-america-is-taking-us-by-storm-12058738,0,www.newsweek.com,German World Cup tourist on road trip through America is taking US by storm,The German fan has captured the hearts of people across the U.S. as he explores American culture.,https://s.yimg.com/cv/apiv2/sports/share/PD_010626-Social_Share_GENRIC_YAHOO_SPORTS-1200x630.jpg,2026-06-11T11:37:00Z,,A German soccer fans cross-country road trip ahead of the 2026 World Cup is capturing America’s heartdrawing attention from top U.S. figuresafter his enthusiastic posts about everyday American experi… [+5413 chars],,en,storm,Storm,random,,,
https://www.bbc.co.uk/news/articles/c75ylx7g00xo,https://www.bbc.co.uk/news/articles/c75ylx7g00xo,0,www.bbc.co.uk,"El Niño has begun, scientists say, and could bring record heat","An El Niño event has officially started, say US scientists, raising fears of extreme weather and higher temperatures.",https://ichef.bbci.co.uk/ace/branded_news/1200/cpsprodpb/7013/live/60986300-6573-11f1-8424-e7da9f0754bf.jpg,2026-06-11T13:01:27Z,,"No two El Niños are alike, but the disruption is felt most sharply in the tropics.
Flooding is common in northern Peru and southern Ecuador, and can reach parts of East Africa, Central Asia and the … [+2011 chars]",,en,heat,Heat Wave,random,,,
https://nypost.com/2026/06/12/us-news/tornadoes-pummel-communities-outside-chicago-tearing-up-homes-and-toppling-power-poles/,https://nypost.com/2026/06/12/us-news/tornadoes-pummel-communities-outside-chicago-tearing-up-homes-and-toppling-power-poles/,0,nypost.com,"Tornadoes pummel communities outside Chicago, tearing up homes and toppling power poles","At least three tornadoes battered communities outside Chicago on Thursday, leveling homes and ripping down trees and power poles, while storms grounded flights for some and knocked out power for hundreds of thousands in the Midwest and Northeast.",https://nypost.com/wp-content/uploads/sites/2/2026/06/130669454-1.jpg?quality=75&strip=all&w=1200,2026-06-12T06:43:39Z,,"At least three tornadoes battered communities outside Chicago on Thursday, leveling homes and ripping down trees and power poles, while storms grounded flights for some and knocked out power for hund… [+6093 chars]",,en,tornado,Storm,random,,,
https://www.digitaljournal.com/article/alaskas-accelerating-glacier-melt-offers-canada-a-warning-from-the-north/,https://www.digitaljournal.com/article/alaskas-accelerating-glacier-melt-offers-canada-a-warning-from-the-north/,0,www.digitaljournal.com,Alaska’s accelerating glacier melt offers Canada a warning from the North,"Alaska’s glaciers are proving to be highly sensitive to warming temperatures and this has implications for Canada's own issues with global heating.
The post Alaska’s accelerating glacier melt offers Canada a warning from the North appeared first on Digital Jo…",https://www.digitaljournal.com/wp-content/uploads/2025/03/c1d081127efd47f9f6f8e6f22697041f085b4bc2.jpg,2026-06-12T20:14:41Z,,"Alaskas glaciers are sending a stark climate signal, and Canada should pay close attention. In a new study based on synthetic aperture radar (SAR) observations, researchers found that each 1°C rise i… [+6497 chars]",,en,heat,Heat Wave,random,,,
https://www.challies.com/a-la-carte/weekend-a-la-carte-june-13-2026/,https://www.challies.com/a-la-carte/weekend-a-la-carte-june-13-2026/,0,www.challies.com,Weekend A La Carte (June 13),"Egg freezing is a booming business / Talk to the A.I. me / Is aging becoming optional? / Feminism and the Fall / The lie of living your truth / Moving on from the Christian Nationalism moment / and more.See Also
<ul><li>Weekend A La Carte (May 23)</li><li>We…",https://www.challies.com/media/2026/05/Weekend-1.jpg,2026-06-13T04:01:00Z,,"Welcome to Weekend A La Carte! These weekend editions focus on long-form content and think pieces. Theres plenty of good material here, so Im sure youll find something thats of interest.
For some of… [+7696 chars]",,en,freezing,Snow&Ice,random,,,
https://futurism.com/science-energy/scientists-huge-heatwave-antarctica-glacier,https://futurism.com/science-energy/scientists-huge-heatwave-antarctica-glacier,0,futurism.com,Scientists Horrified as Huge Heatwave Hits Antarctica,"""This is absolutely crazy.""
The post Scientists Horrified as Huge Heatwave Hits Antarctica appeared first on Futurism.",https://futurism.com/wp-content/uploads/2026/06/scientists-huge-heatwave-antarctica-glacier.jpg?quality=85&w=1200,2026-06-14T13:45:00Z,,"Can’t-miss innovations from the bleeding edge of science and tech
When you’re studying weather patterns across Antarctica, recording breaking heat is pretty much one of the last things you want to s… [+3390 chars]",,en,heat wave,Heat Wave,random,,,
https://nationalpost.com/news/canada/success-frozen-eggs-to-baby-unknown,https://nationalpost.com/news/canada/success-frozen-eggs-to-baby-unknown,0,nationalpost.com,How successful is egg freezing? Fertility clinics don't have to say,"In the United Kingdom and United States, public registries offer up success rates for individual clinics. Canada has no such requirement",https://smartcdn.gprod.postmedia.digital/nationalpost/wp-content/uploads/2026/05/Fertility-Inc_Melika-Dolaty.jpg,2026-06-15T11:00:08Z,,"Vancouvers Olive Fertility, which says it has among the best pregnancy success rates in Canada, does have this information.
After following 646 egg-freezing patients from 2013 to 2022, Olive doctors… [+3220 chars]",,en,Freezing United States,Snow&Ice,wmo,United States,CNA,North-America
https://backpackinglight.com/podcast-episode-148-rain-jackets-mountain-minimalism/,https://backpackinglight.com/podcast-episode-148-rain-jackets-mountain-minimalism/,0,backpackinglight.com,Episode 148 | Rain Jackets for Mountain Minimalism,"How to choose rain gear for mountain minimalism based on exposure, retreat options, wind, abrasion, and thermal margin.
The post Episode 148 | Rain Jackets for Mountain Minimalism appeared first on Backpacking Light.",https://backpackinglight.com/wp-content/uploads/2026/06/podcast-episode-148-rain-jackets-mountain-minimalism-1.jpg,2026-06-15T14:45:59Z,,"How to Subscribe
Apple Podcasts | Spotify | RSS
More Episodes
Backpacking Light Podcast Index
Credits
Executive Producer - Backpacking Light; Show Director and Host - Ryan Jordan; Producer - Cha… [+923 chars]",,en,Rain Mali,Precipitation,wmo,Mali,SAH,Africa
https://www.thenation.com/?post_type=article&p=601223,https://www.thenation.com/?post_type=article&p=601223,0,www.thenation.com,Cuba’s Humanitarian Crisis: The United Nations’ Response,"Peter Kornbluh



The UN confronts a “perfect storm” of US-sponsored deprivation on the island.




The post Cuba’s Humanitarian Crisis: The United Nations’ Response appeared first on The Nation.",https://www.thenation.com/wp-content/uploads/2026/06/digging-through-trash.jpg,2026-06-16T09:00:00Z,,"The UN confronts a perfect storm of US-sponsored deprivation on the island.
Ad Policy
A man searches through trash in the dark in Havana, Cuba, on June 11, 2026, as widespread shortages affect dail… [+8213 chars]",,en,storm,Storm,random,,,
https://biztoc.com/x/7782b4e3c8b97c9e,https://biztoc.com/x/7782b4e3c8b97c9e,0,biztoc.com,Coffee Prices Surge as Rain Delays Brazil Harvest,"on Tuesday closed up +14.30 (+5.44%), and July ICE robusta coffee (RMN26) closed up +62 (+1.72%).
Coffee prices surged to 5-week highs on Tuesday and settled sharply higher. Coffee prices are supported by concerns that persistent rain in Brazil will delay the…",https://biztoc.com/cdn/7782b4e3c8b97c9e_s.webp,2026-06-16T18:57:30Z,,"on Tuesday closed up +14.30 (+5.44%), and July ICE robusta coffee (RMN26) closed up +62 (+1.72%).Coffee prices surged to 5-week highs on Tuesday and settled sharply higher. Coffee prices are supporte… [+144 chars]",,en,Ice Brazil,Snow&Ice,wmo,Brazil,SAM,South-America
https://nationalpost.com/news/steep-costs-women-egg-freezing,https://nationalpost.com/news/steep-costs-women-egg-freezing,0,nationalpost.com,'Outrageous' egg-freezing costs force some women to take drastic steps for pregnancy,"Some would-be mothers reported doing free social media promos for clinics in exchange for lower fees. One woman travelled to Brazil, where costs were cheaper",https://smartcdn.gprod.postmedia.digital/nationalpost/wp-content/uploads/2026/06/Fertility-Inc-pregnant-belly.jpg,2026-06-17T10:30:44Z,,"Dr. Arthur Leader, a University of Ottawa emeritus professor of obstetrics and gynecology who has worked in fertility for 45 years, said he has seen no studies that prove the necessity of Violet AI t… [+3299 chars]",,en,freezing,Snow&Ice,random,,,
https://biztoc.com/x/1a00929e7edd1641,https://biztoc.com/x/1a00929e7edd1641,0,biztoc.com,Brazil Rains Delay the Coffee Harvest and Support Prices,"today is up +1.40 (+0.50%), and July ICE robusta coffee (RMN26) is up +26 (+0.71%).
Coffee prices extended this week’s rally today and posted fresh 5-week highs. Coffee prices are climbing over concerns that persistent rain in Brazil will delay the coffee har…",https://biztoc.com/cdn/1a00929e7edd1641_s.webp,2026-06-17T16:09:38Z,,"today is up +1.40 (+0.50%), and July ICE robusta coffee (RMN26) is up +26 (+0.71%).Coffee prices extended this weeks rally today and posted fresh 5-week highs. Coffee prices are climbing over concern… [+145 chars]",,en,Ice Brazil,Snow&Ice,wmo,Brazil,SAM,South-America
https://biztoc.com/x/bacfeebbdbfd2477,https://biztoc.com/x/bacfeebbdbfd2477,0,biztoc.com,Tighter Supplies and Brazil Harvest Delays Boost Coffee Prices,"on Wednesday closed up +0.60 (+0.22%), and July ICE robusta coffee (RMN26) closed up +11 (+0.30%).
Coffee prices on Wednesday extended this week’s rally and posted fresh 5-week highs. Coffee prices are climbing over concerns that persistent rain in Brazil wil…",https://biztoc.com/cdn/bacfeebbdbfd2477_s.webp,2026-06-17T18:57:35Z,,"on Wednesday closed up +0.60 (+0.22%), and July ICE robusta coffee (RMN26) closed up +11 (+0.30%).Coffee prices on Wednesday extended this weeks rally and posted fresh 5-week highs. Coffee prices are… [+143 chars]",,en,Ice Brazil,Snow&Ice,wmo,Brazil,SAM,South-America
https://www.carryology.com/liking/brands/c-c-filson-the-man-the-coat-and-the-company-he-left-behind/,https://www.carryology.com/liking/brands/c-c-filson-the-man-the-coat-and-the-company-he-left-behind/,0,www.carryology.com,"C.C. Filson: The Man, the Coat, and the Company He Left Behind","It’s winter 1898 somewhere along the freezing Chilkoot Pass. The man ahead has lost feeling in...
The post C.C. Filson: The Man, the Coat, and the Company He Left Behind appeared first on Carryology.",https://www.carryology.com/wp-content/uploads/2026/06/Filson-feature.jpg,2026-06-18T03:44:45Z,,"It’s winter 1898 somewhere along the freezing Chilkoot Pass. The man ahead has lost feeling in his fingers. All around, the mountainside tells its own story: empty champagne crates, cast-iron stoves,… [+16342 chars]",,en,freezing,Snow&Ice,random,,,
https://timesofindia.indiatimes.com/tv/news/hindi/taarak-mehta-ka-ooltah-chashmahs-tanuj-mahashabde-aka-mr-iyer-reveals-his-spiritual-side-in-viral-video/articleshow/131816636.cms,https://timesofindia.indiatimes.com/tv/news/hindi/taarak-mehta-ka-ooltah-chashmahs-tanuj-mahashabde-aka-mr-iyer-reveals-his-spiritual-side-in-viral-video/articleshow/131816636.cms,0,timesofindia.indiatimes.com,Taarak Mehta Ka Ooltah Chashmah's Tanuj Mahashabde Aka Mr Iyer reveals his spiritual side in viral video,"In a heartwarming display of devotion, Tanuj Mahashabde, who portrays Mr. Iyer on Taarak Mehta Ka Ooltah Chashmah, has taken the internet by storm with a heartwarming video of him engaging in religious chants. Fans have praised his genuine simplicity and warm…","https://static.toiimg.com/thumb/msid-131816680,width-1280,height-720,resizemode-6,overlay-toi_sw,pt-32,y_pad-600/photo.jpg",2026-06-18T04:06:49Z,,"<ul><li>News</li>
<li>tv</li>
<li>Taarak Mehta Ka Ooltah Chashmah's Tanuj Mahashabde Aka Mr Iyer reveals his spiritual side in viral video</li></ul>
Follow Us On Social Media
'Alpha' star Alia Bh… [+1916 chars]",,en,storm,Storm,random,,,
https://skepticalscience.com/new_research_2026_25.html,https://skepticalscience.com/new_research_2026_25.html,0,skepticalscience.com,Skeptical Science New Research for Week #25 2026,"Open access notables
Rapid rebound hides glacier mass loss from satellite observations in Alaska and Iceland, Sasgen et al., Communications Earth & Environment

Time-variable satellite gravimetry constrains global glacier mass change, but requires correction …",https://skepticalscience.com/public/assets/images/og/button_sks_200.jpg,2026-06-18T05:35:04Z,,"Posted on 18 June 2026 by Doug Bostrom, Marc Kodack
Open access notables
Rapid rebound hides glacier mass loss from satellite observations in Alaska and Iceland, Sasgen et al., Communications Earth… [+56095 chars]",,en,Ice Iceland,Snow&Ice,wmo,Iceland,GIC,Europe
https://www.dailymail.com/sport/football/article-15907131/Furious-South-Korea-vow-stop-media-duties-jibes-Son-Heung-mins-exemption-military-service-theyre-ready-anger-showdown-Mexico.html,https://www.dailymail.com/sport/football/article-15907131/Furious-South-Korea-vow-stop-media-duties-jibes-Son-Heung-mins-exemption-military-service-theyre-ready-anger-showdown-Mexico.html,0,www.dailymail.com,Furious South Korea vow to stop all media duties over jibes about Son Heung-min's exemption from military service... and they're ready to take out their anger in showdown with Mexico,"'Beware Son Heung-min' were the first serious words Mexico's manager spoke to his team in the Azteca Stadium dressing room, once the celebrations abated after victory over South Africa.",https://i.dailymail.com/1s/2026/06/17/12/109410039-0-image-m-19_1781696108071.jpg,2026-06-18T11:00:49Z,,"Beware Son Heung-min were the first serious words Mexicos manager spoke to his team in the Azteca Stadium dressing room here, once the roaring celebrations and delirious congratulations abated after … [+3574 chars]",,en,Ice South Africa,Snow&Ice,wmo,South Africa,WSAF,Africa
https://www.dailymail.com/news/article-15911287/Girl-13-drowned-getting-difficulty-river-day-celebrating-birthday-inquest-hears.html,https://www.dailymail.com/news/article-15911287/Girl-13-drowned-getting-difficulty-river-day-celebrating-birthday-inquest-hears.html,0,www.dailymail.com,"Girl, 13, drowned after getting into difficulty in river on day out celebrating her birthday, inquest hears","'Beautiful spirit' Palwasha Akbar was playing in the River Wharfe at Burnsall, North Yorks, on the day before her 14th birthday during the heatwave last month.",https://i.dailymail.com/1s/2026/06/18/16/109445419-0-image-a-11_1781796115513.jpg,2026-06-18T15:25:11Z,,"A 13-year-old girl drowned after getting into difficulty in a river during a day out to celebrate her birthday, an inquest has heard.
Beautiful spirit Palwasha Akbar was playing in the River Wharfe … [+2830 chars]",,en,Heat Wave heatwave,Heat Wave,wmo,India,SAS,Asia
https://fstoppers.com/originals/everyone-assumes-first-weather-satellites-used-film-real-story-far-stranger-902758,https://fstoppers.com/originals/everyone-assumes-first-weather-satellites-used-film-real-story-far-stranger-902758,0,fstoppers.com,Everyone Assumes the First Weather Satellites Used Film. The Real Story Is Far Stranger.,"When Hurricane Camille filled the Gulf of Mexico in August 1969, satellites watched it the entire way in. The storm came ashore on the Mississippi coast as a Category 5 with sustained winds of 175 mph and a storm surge of more than 24 feet, and it killed more…",https://cdn.fstoppers.com/styles/medium/s3/lead/2026/05/hurricane_camille_16_aug_1969_2340z.jpg?itok=wBh4xves,2026-06-19T16:03:01Z,,"When Hurricane Camille filled the Gulf of Mexico in August 1969, satellites watched it the entire way in. The storm came ashore on the Mississippi coast as a Category 5 with sustained winds of 175 mp… [+10899 chars]",,en,storm surge,Storm,random,,,
https://www.skysports.com/football/news/12309/13553624/world-cup-2026-brazil-3-0-haiti-matheus-cunha-nets-twice-as-vinicius-junior-strikes-again-to-earn-much-needed-victory,https://www.skysports.com/football/news/12309/13553624/world-cup-2026-brazil-3-0-haiti-matheus-cunha-nets-twice-as-vinicius-junior-strikes-again-to-earn-much-needed-victory,0,www.skysports.com,Cunha strikes twice as Brazil earn comfortable win over Haiti,Matheus Cunha kick-started Brazil’s World Cup campaign by scoring twice in a comfortable 3-0 victory over Haiti in Group C.,https://e0.365dm.com/26/06/1600x900/skysports-matheus-cunha-brazil_7278316.jpg?20260620020737,2026-06-20T02:15:00Z,,"Matheus Cunha kick-started Brazils World Cup campaign by scoring twice in a comfortable 3-0 victory over Haiti in Group C.
Carlo Ancelotti's side needed a response after drawing with Morocco in thei… [+2679 chars]",,en,Ice Brazil,Snow&Ice,wmo,Brazil,SAM,South-America
https://www.ibtimes.com.au/brazil-dominates-haiti-fifa-world-cup-1870947,https://www.ibtimes.com.au/brazil-dominates-haiti-fifa-world-cup-1870947,0,www.ibtimes.com.au,(VIDEO) Brazil Routs Haiti 3-0 as Matheus Cunha Scores Twice to Lift Seleção Atop Group C,"Brazil defeated Haiti 3-0 in the 2026 FIFA World Cup, with Matheus Cunha scoring twice. The win places Brazil at the top of Group C, despite an injury concern for Raphinha.",https://d.ibtimes.com.au/en/full/1894785/matheus-cunha.jpg,2026-06-20T08:09:31Z,,"PHILADELPHIA — Brazil eliminated Haiti from the 2026 FIFA World Cup with a comfortable 3-0 win Friday, a victory that could have been even more lopsided had Carlo Ancelotti's side shown greater urgen… [+4101 chars]",,en,Ice Brazil,Snow&Ice,wmo,Brazil,SAM,South-America
