index,url,valid,domain,title,description,image,published,archive,content,quote,language,term,topic,feed,country,ipcc,continent
https://abcnews.go.com/International/tropical-storm-melissa-expected-intensify-strength-weekend/story?id=126857615,https://abcnews.go.com/International/tropical-storm-melissa-expected-intensify-strength-weekend/story?id=126857615,0,abcnews.go.com,Tropical Storm Melissa expected to intensify in strength over weekend,It 's very close to becoming the fifth hurricane of the season.,https://s.yimg.com/ny/api/res/1.2/8AYgI0Oiba.KRcpWFLum3Q--/YXBwaWQ9aGlnaGxhbmRlcjt3PTEyMDA7aD04MDA7Y2Y9d2VicA--/https://media.zenfs.com/en/us.abcnews.gma.com/7adc5f440e950eef3b782db326b18249,2025-10-25T10:48:13Z,,"Tropical Storm Melissa continues to slowly move northwest with sustained winds near 70 mph -- just shy of becoming the fifth hurricane of this Atlantic season.
The storm was located about 165 miles … [+2470 chars]",,en,storm,Storm,random,,,
https://www.nbcnews.com/weather/storms/tropical-storm-melissa-hurricane-updates-rcna239732,https://www.nbcnews.com/weather/storms/tropical-storm-melissa-hurricane-updates-rcna239732,0,www.nbcnews.com,"Tropical Storm Melissa, forecast to become major hurricane, barrels toward Jamaica and Cuba","Tropical Storm Melissa is expected to intensify into a hurricane in the Caribbean on Saturday, bringing with it catastrophic flash flooding and potential landslides","https://media-cldnry.s-nbcnews.com/image/upload/t_nbcnews-fp-1200-630,f_auto,q_auto:best/rockcms/2025-10/251025-Tropical-Storm-Melissa-ch-0929-4faa60.jpg",2025-10-25T14:31:31Z,,"Tropical Storm Melissa is expected to intensify into a hurricane in the Caribbean on Saturday, bringing with it catastrophic flash flooding and potential landslides.
The slow-moving storm is already… [+1514 chars]",,en,Storm LiD,Storm,wmo,Norway,NEU,Europe
https://www.usatoday.com/story/news/weather/2025/10/25/tropical-storm-melissa-hurricane-spaghetti-models-path-tracker/86877702007/,https://www.usatoday.com/story/news/weather/2025/10/25/tropical-storm-melissa-hurricane-spaghetti-models-path-tracker/86877702007/,0,www.usatoday.com,Tropical Storm Melissa set to become a major hurricane. See path.,Track Tropical Storm Melissa as it's forecast to become a major hurricane over the weekend.,https://media.zenfs.com/en/usa_today_news_641/0af031d82491bb7030447ff21da051ee,2025-10-25T14:38:27Z,,"Tropical Storm Melissa continued its slow slog across the Caribbean Sea on the morning of Oct. 25, and forecasters said the storm is expected to rapidly intensify over the next 24 hours, potentially … [+5373 chars]",,en,tropical storm,Tropical Cyclone,random,,,
https://www.cbc.ca/news/world/tropical-storm-melissa-hurrican-strength-caribbean-9.6953570,https://www.cbc.ca/news/world/tropical-storm-melissa-hurrican-strength-caribbean-9.6953570,0,www.cbc.ca,Tropical storm Melissa drops torrential rain on Caribbean as it nears hurricane strength,"Tropical storm Melissa neared hurricane strength Saturday and was expected to rapidly intensify this weekend, as forecasters warned of massive rainfall and life-threatening flooding and landslides in the northern Caribbean.","https://i.cbc.ca/ais/17615150-cf3f-440c-87ee-4feade0931e2,1761402402566/full/max/0/default.jpg?im=Crop%2Crect%3D%280%2C276%2C5293%2C2977%29%3BResize%3D620",2025-10-25T14:56:13Z,,"Tropical storm Melissa neared hurricane strength Saturday and was expected to rapidly intensify this weekend, as forecasters warned of massive rainfall and life-threatening flooding and landslides in… [+3399 chars]",,en,hurricane,Tropical Cyclone,random,,,
https://financialpost.com/pmn/environment-canada-warns-of-high-winds-power-outages-snowfall-on-b-c-highways,https://financialpost.com/pmn/environment-canada-warns-of-high-winds-power-outages-snowfall-on-b-c-highways,0,financialpost.com,"Environment Canada warns of high winds, power outages, snowfall on B.C. highways","BC Hydro crews were at the ready to deal with power outages as a fall storm hit parts of British Columbia this weekend with high winds and heavy rains, downing trees and knocking out power for thousands of customers. Spokeswoman Mora Scott said Saturday that …",,2025-10-26T00:14:09Z,,"BC Hydro crews were at the ready to deal with power outages as a fall storm hit parts of British Columbia this weekend with high winds and heavy rains, downing trees and knocking out power for thousa… [+5058 chars]",,en,storm,Storm,random,,,
https://www.cbsnews.com/video/jamaica-braces-hurricane-melissa-after-passes-dominican-republic/,https://www.cbsnews.com/video/jamaica-braces-hurricane-melissa-after-passes-dominican-republic/,0,www.cbsnews.com,Jamaica braces for Hurricane Melissa after it passes by Dominican Republic,"Kingston's waterfront in Jamaica was empty on Saturday, with the first bands of rain from Hurricane Melissa hitting the island. But in some parts of the city, they are still racing to prepare for the storm. Jason Allen reports.",https://assets2.cbsnewsstatic.com/hub/i/r/2025/10/26/1439c532-f2c6-4048-8311-8655a23fce00/thumbnail/1200x630/4725192ef4bf21b32350eb3c84c3a3ef/gettyimages-2242964943.jpg,2025-10-26T00:30:00Z,,Copyright ©2025 CBS Interactive Inc. All rights reserved.,,en,Storm Da an City,Storm,wmo,China,EAS,Asia
https://www.npr.org/2025/10/25/nx-s1-5586114/melissa-expected-to-rapidly-intensify-into-major-hurricane-in-the-caribbean,https://www.npr.org/2025/10/25/nx-s1-5586114/melissa-expected-to-rapidly-intensify-into-major-hurricane-in-the-caribbean,0,www.npr.org,Melissa expected to rapidly intensify into major hurricane in the Caribbean,"Cuba, the Dominican Republic, Haiti and Jamaica are bracing for Hurricane Melissa. The storm is expected to quickly grow into a powerful category 3 or stronger hurricane.",https://npr.brightspotcdn.com/dims3/default/strip/false/crop/897x505+0+116/resize/1400/quality/100/format/png/?url=http%3A%2F%2Fnpr-brightspot.s3.amazonaws.com%2F7a%2Fda%2F2fabeb3a47e99a06f18c6479704f%2Fnhc-melissa-cone-8pm-saturday.png,2025-10-26T01:31:15Z,,"Hurricane Melissa is expected to rapidly intensify into a major hurricane on Sunday. According to the National Hurricane Center in Miami, the hurricane is likely to bring life-threatening and catastr… [+2602 chars]",,en,Storm Jamaica,Storm,wmo,Jamaica,CAR,North-America
https://indianexpress.com/article/world/melissa-grows-category-3-hurricane-unleashing-torrential-rain-north-caribbean-10327432/,https://indianexpress.com/article/world/melissa-grows-category-3-hurricane-unleashing-torrential-rain-north-caribbean-10327432/,0,indianexpress.com,Melissa grows into Category 3 hurricane while unleashing torrential rain in north Caribbean,Melissa became a hurricane on Saturday and then intensified rapidly into a major storm. US forecasters have issued a hurricane warning for Jamaica and say Melissa could further strengthen into a Category 4 storm.,https://images.indianexpress.com/2025/10/Dominican-Republic-Extreme-Weather.jpg,2025-10-26T04:23:51Z,,"Hurricane Melissa strengthened into a major Category 3 hurricane late Saturday, unleashing torrential rain and threatening to cause catastrophic flooding in the northern Caribbean, including Haiti an… [+3843 chars]",,en,Storm Jamaica,Storm,wmo,Jamaica,CAR,North-America
https://dailycaller.com/2025/10/26/hurricane-melissa-rapid-intensification-major-category-3-5-jamaica/,https://dailycaller.com/2025/10/26/hurricane-melissa-rapid-intensification-major-category-3-5-jamaica/,0,dailycaller.com,Hurricane Melissa Rapidly Intensifies To Major Storm Before Category 5 Landfall In Jamaica,"Already deadly as a tropical storm, Melissa rapidly intensified to a Category 3 hurricane late Saturday night, officially upgrading it to major status.","https://images.dailycaller.com/image/width=1280,height=549,fit=cover,format=webp,f=auto/https://cdn01.dailycaller.com/wp-content/uploads/2025/10/GettyImages-2176954319-e1761453408730.jpg",2025-10-26T04:39:41Z,,"Already deadly as a tropical storm, Melissa rapidly intensified to a Category 3 hurricane late Saturday night, officially upgrading the system to major status to ratchet up forecasts for Jamaica, Hai… [+1282 chars]",,en,storm,Storm,random,,,
https://abcnews.go.com/US/hurricane-melissa-upgraded-category-4-expected-strengthen-jamaica/story?id=126873184,https://abcnews.go.com/US/hurricane-melissa-upgraded-category-4-expected-strengthen-jamaica/story?id=126873184,0,abcnews.go.com,"Hurricane Melissa upgraded to Category 4, expected to strengthen on Jamaica approach",Hurricane Melissa strengthened into a Category 4 storm as it churned northwest through the Caribbean Sea on Sunday.,https://i.abcnewsfe.com/a/a8ea0cef-c3bd-4152-b21f-98af181b3715/Hurricane-Melissa-DB-251026_1761471674601_hpMain_16x9.jpg?w=1600,2025-10-26T09:52:27Z,,"Hurricane Melissa strengthened into a Category 4 storm as it churned northwest through the Caribbean Sea on Sunday, according to the latest advisory from the National Hurricane Center.
A Hurricane W… [+1797 chars]",,en,Storm Jamaica,Storm,wmo,Jamaica,CAR,North-America
https://phys.org/news/2025-10-hurricane-melissa-jamaica.html,https://phys.org/news/2025-10-hurricane-melissa-jamaica.html,0,phys.org,Hurricane Melissa strengthens as it crawls toward Jamaica,"Hurricane Melissa was cutting a deadly path through the Caribbean on Sunday, strengthening into a Category 4 storm as it crawled along a worryingly slow course toward Jamaica and the island of Hispaniola.",https://scx2.b-cdn.net/gfx/news/2025/rammbcira-handout-sate.jpg,2025-10-26T11:30:01Z,,"Hurricane Melissa was cutting a deadly path through the Caribbean on Sunday, strengthening into a Category 4 storm as it crawled along a worryingly slow course toward Jamaica and the island of Hispan… [+3065 chars]",,en,Storm Jamaica,Storm,wmo,Jamaica,CAR,North-America
https://www.today.com/video/hurricane-melissa-strengthens-to-category-4-where-is-it-headed-250651717580,https://www.today.com/video/hurricane-melissa-strengthens-to-category-4-where-is-it-headed-250651717580,0,www.today.com,Hurricane Melissa Strengthens to Category 4: Where Is it Headed?,"Hurricane Melissa has strengthened into a Category 4 storm and is headed directly for Jamaica. The storm’s outer bands have already led to several deaths in Haiti, and it's expected to cause potentially deadly flooding and mudslides once it hits land. NBC’s A…","https://media-cldnry.s-nbcnews.com/image/upload/t_social_share_1200x630_center,f_auto,q_auto:best/mpx/2704722219/2025_10/1761481816652_tdy_sun_lassman_wx_melissa_251026_1920x1080-rbzp74.jpg",2025-10-26T12:30:22Z,,"Hurricane Melissa has strengthened into a Category 4 storm and is headed directly for Jamaica. The storms outer bands have already led to several deaths in Haiti, and it's expected to cause potential… [+126 chars]",,en,Storm LiD,Storm,wmo,Norway,NEU,Europe
https://www.usatoday.com/story/news/weather/2025/10/26/hurricane-melissa-spaghetti-models-path-tracker/86900864007/,https://www.usatoday.com/story/news/weather/2025/10/26/hurricane-melissa-spaghetti-models-path-tracker/86900864007/,0,www.usatoday.com,Hurricane Melissa strengthens to Category 4 storm as it nears Jamaica. See path.,Hurricane Melissa is expected to continue to gain force as it threatens catastrophic damage to Jamaica. Latest updates.,https://s.yimg.com/cv/apiv2/social/images/yahoo_default_logo-1200x1200.png,2025-10-26T12:58:02Z,,"Hurricane Melissa, now a Category 4 storm, is expected to gain force as it threatens catastrophic damage to Jamaica and other Caribbean islands. Forecasters expect it will reach Category 5 intensity … [+3653 chars]",,en,Storm Jamaica,Storm,wmo,Jamaica,CAR,North-America
https://www.cbsnews.com/news/hurricane-melissa-flooding-rain-landslides-jamaica-haiti-caribbean/,https://www.cbsnews.com/news/hurricane-melissa-flooding-rain-landslides-jamaica-haiti-caribbean/,0,www.cbsnews.com,Hurricane Melissa threatens to bring catastrophic flooding to Jamaica,"Hurricane Melissa strengthened into a Category 4 storm on Sunday, unleashing torrential rain and threatening to bring catastrophic flooding to the northern Caribbean.",https://assets3.cbsnewsstatic.com/hub/i/r/2025/10/26/0998566e-78f5-46b8-9341-7a27c4711686/thumbnail/1200x630/0ce7347a014c30f61c53516d3ec2fe96/ap25298071082668.jpg,2025-10-26T15:41:25Z,,"Hurricane Melissa strengthened into a major Category 4 hurricane on Sunday, unleashing torrential rain and threatening to bring flash flooding and landslides to the northern Caribbean, the Miami-base… [+3906 chars]",,en,Storm Jamaica,Storm,wmo,Jamaica,CAR,North-America
https://www.cbc.ca/news/world/jamaica-hurricane-melissa-9.6954264,https://www.cbc.ca/news/world/jamaica-hurricane-melissa-9.6954264,0,www.cbc.ca,Jamaica braces for arrival of strengthening Hurricane Melissa,"Hurricane Melissa strengthened into a major Category 4 hurricane, with the possibility of intensifying to a Category 5 storm on Sunday night, unleashing torrential rain and threatening to cause catastrophic flooding in the northern Caribbean, including Haiti …","https://i.cbc.ca/ais/2210e02f-9d2e-4f23-b86b-f5868fb0ec25,1761499105224/full/max/0/default.jpg?im=Crop%2Crect%3D%280%2C83%2C1748%2C983%29%3BResize%3D620",2025-10-26T18:05:32Z,,"Hurricane Melissa strengthened into a major Category 4 hurricane, with the possibility of intensifying to a Category 5 storm on Sunday night, unleashing torrential rain and threatening to cause catas… [+4338 chars]",,en,storm,Storm,random,,,
https://www.yahoo.com/news/articles/powerful-hurricane-melissa-strengthens-heads-162507814.html,https://www.yahoo.com/news/articles/powerful-hurricane-melissa-strengthens-heads-162507814.html,0,www.yahoo.com,Powerful Hurricane Melissa strengthens as it heads for Jamaica,"Hurricane Melissa, already a major category 4 storm, gathered steam Sunday as it took aim at Jamaica and other parts of the Caribbean, with forecasters...",https://media.zenfs.com/en/afp.com/5b55438596c75dec12115241fb86b259,2025-10-26T21:21:31Z,,"Hurricane Melissa, already a major category 4 storm, gathered steam Sunday as it took aim at Jamaica and other parts of the Caribbean, with forecasters predicting catastrophic flooding and urging res… [+3639 chars]",,en,Storm Jamaica,Storm,wmo,Jamaica,CAR,North-America
https://7news.com.au/news/possible-tornado-tens-of-thousands-left-without-power-as-full-extent-of-wild-storms-is-exposed-c-20481067,https://7news.com.au/news/possible-tornado-tens-of-thousands-left-without-power-as-full-extent-of-wild-storms-is-exposed-c-20481067,0,7news.com.au,"Possible tornado, tens of thousands left without power as full extent of wild storms is exposed","Possible tornado, tens of thousands left without power as full extent of wild storms is exposed7news.com.au",https://images.7news.com.au/publication/C-20481067/3c67ca5bf7a2dac89101e25dd65112fc4a09eda6-16x9-x0y0w1280h720.jpg?imwidth=1200,2025-10-26T23:57:59Z,,"A tornado has ripped through parts of Melbourne as tens of thousands of homes have been left without power in a major thunderstorm event that has smashed parts of eastern Australia.
Severe thunderst… [+2990 chars]",,en,tornado,Storm,random,,,
https://www.ndtvprofit.com/nation/cyclonic-storm-montha-likely-to-hit-indias-east-coast-on-oct-28-how-are-cyclones-named,https://www.ndtvprofit.com/nation/cyclonic-storm-montha-likely-to-hit-indias-east-coast-on-oct-28-how-are-cyclones-named,0,www.ndtvprofit.com,Cyclonic Storm Montha Likely To Hit India's East Coast On Oct. 28: How Are Cyclones Named?,"Several eastern states have been placed on high alert as a deep depression over the Bay of Bengal strengthens into a severe cyclone. The cyclonic storm has been named 'Montha'. As per the latest forecast by the India Meteorological Department (IMD), the cyclo…",https://media.assettype.com/bloombergquint%2F2025-10-27%2F3ce448nh%2FWhatsApp-Image-2025-10-27-at-09.41.45.jpeg?w=1200&auto=format%2Ccompress&ogImage=true,2025-10-27T04:14:33Z,,"A bunch of countries from Asia and the Indian Ocean, including Bangladesh, India, Sri Lanka, Thailand, Myanmar, Oman, Pakistan and the Maldives, came together in 2000 to introduce a system for naming… [+1942 chars]",,en,storm,Storm,random,,,
https://7news.com.au/news/new-bureau-of-meteorology-radar-caused-confusion-after-storms-rip-through-queensland-and-victoria-c-20482752,https://7news.com.au/news/new-bureau-of-meteorology-radar-caused-confusion-after-storms-rip-through-queensland-and-victoria-c-20482752,0,7news.com.au,New Bureau of Meteorology radar caused confusion after storms rip through Queensland and Victoria,New Bureau of Meteorology radar caused confusion after storms rip through Queensland and Victoria7news.com.au,https://images.7news.com.au/publication/C-20482752/891a627d7ce22cf3d29dec1fbe2187b2b78a235c-16x9-x0y0w1280h720.jpg?imwidth=1200,2025-10-27T05:17:31Z,,"There are calls for Australias national weather service to re-examine key tools used by members of the public, days after a new website launched just shy of an explosive start to storm season.
The B… [+7758 chars]",,en,storm,Storm,random,,,
https://financialpost.com/globe-newswire/one-in-three-canadians-targeted-by-scam-texts-in-just-three-months-equifax-canada-survey-finds,https://financialpost.com/globe-newswire/one-in-three-canadians-targeted-by-scam-texts-in-just-three-months-equifax-canada-survey-finds,0,financialpost.com,"One in Three Canadians Targeted by Scam Texts in Just Three Months, Equifax Canada Survey Finds","– Canadians continue to report feeling vulnerable to scams and identity threats – TORONTO, Oct. 27, 2025 (GLOBE NEWSWIRE) — Canadians are facing a flood of scam attempts, with one in three reporting fraudulent job or CRA-related texts in the past three months…",,2025-10-27T09:02:19Z,,"Canadians continue to report feeling vulnerable to scams and identity threats 
THIS CONTENT IS RESERVED FOR SUBSCRIBERS ONLY
Subscribe now to read the latest news in your city and across Canada.
<… [+5657 chars]",,en,Flood Canada,Flood,wmo,Canada,NEN,North-America
https://www.bbc.com/news/articles/c2dr0z57nygo,https://www.bbc.com/news/articles/c2dr0z57nygo,0,www.bbc.com,Hurricane Melissa could be strongest to ever hit Jamaica,Melissa has been upgraded to a category five storm and could become Jamaica's strongest on record.,https://ichef.bbci.co.uk/news/1024/branded_news/1e13/live/9c4a7270-b322-11f0-8419-83f831593ad2.jpg,2025-10-27T10:54:19Z,,"Residents in Kingston prepare for the storm with sandbags
People in Jamaica are bracing for the impact of Hurricane Melissa, which is forecast to unleash destructive winds and bring catastrophic flo… [+2591 chars]",,en,Hurricane Jamaica,Tropical Cyclone,wmo,Jamaica,CAR,North-America
https://biztoc.com/x/fa9f26c45d799dbf,https://biztoc.com/x/fa9f26c45d799dbf,0,biztoc.com,Hurricane Melissa Churns Toward Jamaica as a Category 5 Storm,,https://biztoc.com/cdn/fa9f26c45d799dbf_s.webp,2025-10-27T13:24:25Z,,"{ window.open(this.href, '_blank'); }, 200); return false;""&gt;What caused last week's AWS outage? { window.open(this.href, '_blank'); }, 200); return false;""&gt;How will US-China trade deal impact m… [+734 chars]",,en,storm,Storm,random,,,
https://abcnews.go.com/International/wireStory/british-prime-minister-starmer-arrives-turkey-discuss-eurofighter-126896879,https://abcnews.go.com/International/wireStory/british-prime-minister-starmer-arrives-turkey-discuss-eurofighter-126896879,0,abcnews.go.com,British Prime Minister Starmer arrives in Turkey to discuss Eurofighter jet deal,British Prime Minister Keir Starmer has arrived in Turkey to advance negotiations on a multi-billion-dollar sale of Eurofighter Typhoon jets to Ankara,https://i.abcnewsfe.com/a/1d43b57d-0f3d-40e7-bb93-f0d33b13fd16/wirestory_da7fdc869a48f0f905b08bd4287772b2_16x9.jpg?w=1600,2025-10-27T15:17:33Z,,"ANKARA, Turkey -- British Prime Minister Keir Starmer arrived in Turkey on Monday aiming to advance negotiations on a multi-billion-dollar sale of Eurofighter Typhoon jets to enhance Ankaras air capa… [+2811 chars]",,en,typhoon,Tropical Cyclone,random,,,
https://www.pbs.org/newshour/science/how-climate-change-is-fueling-hurricane-melissas-ferocity,https://www.pbs.org/newshour/science/how-climate-change-is-fueling-hurricane-melissas-ferocity,0,www.pbs.org,How climate change is fueling Hurricane Melissa’s ferocity,"The warming of the world's oceans caused by climate change helped double Hurricane Melissa's wind speed in less than 24 hours over the weekend, climate scientists said Monday.",https://d3i6fh83elv35t.cloudfront.net/static/2025/10/2025-10-26T163100Z_520186099_RC2KJHAHVKM0_RTRMADP_3_STORM-MELISSA-1024x683.jpg,2025-10-27T16:53:16Z,,"The warming of the world’s oceans caused by climate change helped double Hurricane Melissa’s wind speed in less than 24 hours over the weekend, climate scientists said Monday.
LIVE MAP: Track the pa… [+5882 chars]",,en,Hurricane Fu an City,Tropical Cyclone,wmo,China,EAS,Asia
https://theaviationist.com/2025/10/27/turkey-signs-for-eurofighter-typhoons/,https://theaviationist.com/2025/10/27/turkey-signs-for-eurofighter-typhoons/,0,theaviationist.com,Turkey Signs £8bn Deal With UK for 20 Eurofighter Typhoons,"The agreement was signed as the UK Prime Minister, Sir Keir Starmer, visited Ankara and met with Turkish President Recep Tayyip Erdoğan while touring Turkish aerospace facilities. An official release by the UK Government says the deal will guarantee the reten…",https://theaviationist.com/wp-content/uploads/2025/10/TurkeyUKTyphoonDeal_1.jpg,2025-10-27T17:02:43Z,,"An official release by the UK Government says the deal will guarantee the retention of as many as 20,000 British jobs and sustain the Typhoon production line at BAE Systems’ Warton airfield, along wi… [+4095 chars]",,en,typhoon,Tropical Cyclone,random,,,
https://aviationweek.com/defense/aircraft-propulsion/turkey-uk-sign-11-billion-eurofighter-deal,https://aviationweek.com/defense/aircraft-propulsion/turkey-uk-sign-11-billion-eurofighter-deal,0,aviationweek.com,"Turkey, UK Sign $11 Billion Eurofighter Deal","Turkey, UK Sign $11 Billion Eurofighter Deal
hockensmithawi…
Mon, 10/27/2025 - 18:19


 Turkey has signed a long-anticipated £8 billion ($11 billion) deal to acquire Eurofighter Typhoons, the first major export contract for the four-nation combat aircraft sin…",https://aviationweek.com/sites/default/files/2025-10/typhoon_1600px.jpg,2025-10-27T18:19:46Z,,"Turkey, UK Sign $11 Billion Eurofighter Deal is published in Aerospace Daily &amp; Defense Report, an Aviation Week Intelligence Network (AWIN) Market Briefing and is included with your AWIN membersh… [+307 chars]",,en,typhoon,Tropical Cyclone,random,,,
https://www.bbc.com/news/articles/cvgk8zz7r5lo,https://www.bbc.com/news/articles/cvgk8zz7r5lo,0,www.bbc.com,UK signs £8bn Typhoon fighter jet deal with Turkey,"The agreement will support thousands of jobs across the UK, the government says.",https://ichef.bbci.co.uk/news/1024/branded_news/8cf8/live/213ce6b0-b36a-11f0-a5ed-d926a0229916.jpg,2025-10-27T19:58:25Z,,"The UK has secured a deal worth up to £8m to supply Turkey with 20 Typhoon fighter jets. 
During a visit to Ankara to sign the agreement on Monday, Prime Minister Sir Keir Starmer described it as ""a… [+2187 chars]",,en,typhoon,Tropical Cyclone,random,,,
https://www.theweathernetwork.com/ca/news/article/storm-on-deck-for-b-c-could-swing-through-with-impactful-winds-alpine-snow,https://www.theweathernetwork.com/ca/news/article/storm-on-deck-for-b-c-could-swing-through-with-impactful-winds-alpine-snow,0,www.theweathernetwork.com,"Storm on deck for B.C. could swing through with impactful winds, alpine snow","A vigorous low approaching the B.C. coast on Tuesday will generate intense, possibly damaging winds and waves, alongside heavy alpine snow for the mountain...",https://s.yimg.com/ny/api/res/1.2/M8LMtC3uAgmSN9OrsWhu6w--/YXBwaWQ9aGlnaGxhbmRlcjt3PTEyMDA7aD02Nzg7Y2Y9d2VicA--/https://media.zenfs.com/en/the_weather_network_616/ceff02d1c105430ec6d7dce39b2936be,2025-10-28T00:16:19Z,,"B.C. can expect more stormy weather this week as an active pattern sticks around, with unsettled conditions anticipated in the days up to and on Halloween, too--and beyond.
A powerful Pacific storm … [+3255 chars]",,en,storm,Storm,random,,,
https://economictimes.indiatimes.com/news/new-updates/cyclone-montha-how-did-the-storm-get-its-name-and-what-does-it-mean/articleshow/124862598.cms,https://economictimes.indiatimes.com/news/new-updates/cyclone-montha-how-did-the-storm-get-its-name-and-what-does-it-mean/articleshow/124862598.cms,0,economictimes.indiatimes.com,Cyclone Montha: How did the storm get its name and what does it mean?,"Cyclone Montha is poised to intensify into a severe cyclonic storm, with landfall expected Tuesday, bringing heavy rains to Andhra Pradesh, Tamil Nadu, and Odisha. The World Meteorological Organization assigns names to cyclones to prevent confusion and aid di…","https://img.etimg.com/thumb/msid-124862743,width-1200,height-630,imgsize-50246,overlay-economictimes/articleshow.jpg",2025-10-28T03:06:51Z,,"Cyclone Montha is set to intensify into a severe cyclonic storm and make a landfall on Tuesday, bringing heavy rainfall over Andhra Pradesh, Tamil Nadu and Odisha. Each tropical storm is given a name… [+1804 chars]",,en,storm,Storm,random,,,
