index,url,valid,domain,title,description,image,published,archive,content,quote,language,term,topic,feed,country,ipcc,continent
https://indianexpress.com/article/world/typhoon-fung-wong-brings-floods-to-taiwan-thousands-evacuated-10360481/,https://indianexpress.com/article/world/typhoon-fung-wong-brings-floods-to-taiwan-thousands-evacuated-10360481/,0,indianexpress.com,"Typhoon Fung-wong brings floods to Taiwan, thousands evacuated","Television images showed severe floods in parts of the largely rural eastern county of Yilan, with waters neck-deep as soldiers mounted rescue efforts for those stranded.",https://images.indianexpress.com/2025/11/fung-wong.jpg,2025-11-12T03:00:20Z,,"Taiwan evacuated more than 8,300 people ahead of Wednesday’s arrival of a much weakened Typhoon Fung-wong that brought heavy downpours to the mountainous east coast and unleashed floods that ran neck… [+1305 chars]",,en,typhoon,Tropical Cyclone,random,,,
https://www.rte.ie/news/asia/2025/1112/1543473-typhoon-fung-wong/,https://www.rte.ie/news/asia/2025/1112/1543473-typhoon-fung-wong/,0,www.rte.ie,Typhoon brings floods to Taiwan as thousands evacuated,"Taiwan evacuated more than 8,300 people ahead of the arrival of a much weakened Typhoon Fung-wong that brought record downpours to the mountainous east coast and unleashed floods that rose neck-high in places.",https://www.rte.ie/images/00237797-1600.jpg,2025-11-12T04:49:58Z,,"Taiwan evacuated more than 8,300 people ahead of the arrival of a much weakened Typhoon Fung-wong that brought record downpours to the mountainous east coast and unleashed floods that rose neck-high … [+1762 chars]",,en,typhoon,Tropical Cyclone,random,,,
https://abcnews.go.com/International/wireStory/taiwan-evacuates-8300-shuts-schools-tropical-storm-brushes-127437671,https://abcnews.go.com/International/wireStory/taiwan-evacuates-8300-shuts-schools-tropical-storm-brushes-127437671,0,abcnews.go.com,"Taiwan evacuates 8,300 and shuts schools before tropical storm brushes island","Taiwan has evacuated 8,300 people and closed schools before a tropical storm brushes the southern part of the island later Wednesday",https://i.abcnewsfe.com/a/e1c2b1a7-4d2e-4219-9140-0956f3c6a5d6/wirestory_7132e0f350bb0b84a4e6c7a0e1642a0d_16x9.jpg?w=1600,2025-11-12T05:17:22Z,,"TAIPEI, Taiwan -- Taiwan evacuated more than 8,300 people from coastal and mountainous areas and closed schools before a tropical storm brushes the southern part of the island later Wednesday.
Fung-… [+2008 chars]",,en,tropical storm,Tropical Cyclone,random,,,
https://www.globalsecurity.org/military/library/news/2025/11/mil-251111-unnews05.htm,https://www.globalsecurity.org/military/library/news/2025/11/mil-251111-unnews05.htm,0,www.globalsecurity.org,Hurricane Melissa: Relief efforts intensify as damage across Caribbean grows,"Two weeks after Hurricane Melissa tore through the Caribbean, governments and aid agencies are still struggling to reach communities left without homes, healthcare and basic services, as damage assessments in Cuba, Jamaica and Haiti continue to rise, the UN s…",,2025-11-12T06:03:16Z,,"By Vibhu Mishra11 November 2025 - Two weeks after Hurricane Melissa tore through the Caribbean, governments and aid agencies are still struggling to reach communities left without homes, healthcare a… [+3076 chars]",,en,Hurricane Jamaica,Tropical Cyclone,wmo,Jamaica,CAR,North-America
https://www.aljazeera.com/news/2025/11/12/thousands-evacuated-in-taiwan-as-tropical-storm-fung-wong-closes-in,https://www.aljazeera.com/news/2025/11/12/thousands-evacuated-in-taiwan-as-tropical-storm-fung-wong-closes-in,0,www.aljazeera.com,Thousands evacuated in Taiwan as Tropical Storm Fung-wong closes in,The slow-moving storm is due to make landfall on Wednesday night after departing the Philippines.,https://www.aljazeera.com/wp-content/uploads/2025/11/2025-11-11T052648Z_132071190_RC23UHAHE1W9_RTRMADP_3_ASIA-WEATHER-TAIWAN-1762923874.jpg?resize=1920%2C1365,2025-11-12T06:05:16Z,,"Taipei, Taiwan More than 3,300 people in Taiwan have been evacuated from their homes as Tropical Storm Fung-Wong closes in on the island, bringing heavy rain and strong winds, according to Taiwans Ce… [+2093 chars]",,en,Tropical Storm Fung Wong,Tropical Cyclone,eonet,,NPO,Pacific Ocean
https://www.dw.com/en/taiwan-thousands-evacuated-ahead-of-typhoon-fung-wong/a-74708040,https://www.dw.com/en/taiwan-thousands-evacuated-ahead-of-typhoon-fung-wong/a-74708040,0,www.dw.com,Taiwan: Thousands evacuated ahead of Typhoon Fung-wong,"Fung-wong has brought heavy rains and triggered floods in Taiwan, with water rising above waist level in several parts of the country.",https://static.dw.com/image/74707728_6.jpg,2025-11-12T06:55:00Z,,"More than 8,300 people have been evacuated from their homes in Taiwan ahead of the weakened typhoon Fung-wong's arrival in the southern part of the island on Wednesday.
As many as 51 people were rep… [+1495 chars]",,en,typhoon,Tropical Cyclone,random,,,
https://www.cbc.ca/news/canada/ottawa/ottawa-filipinos-watch-as-typhoon-fung-wong-devastates-homeland-9.6975187,https://www.cbc.ca/news/canada/ottawa/ottawa-filipinos-watch-as-typhoon-fung-wong-devastates-homeland-9.6975187,0,www.cbc.ca,‘It breaks my heart’: Ottawa Filipinos watch as Typhoon Fung-wong devastates homeland,"Ottawa's Filipino community is watching with anguish as Typhoon Fung-wong ravages the Philippines. Members of a local church are sending money to loved ones, while a business in the Byward Market is sending the proceeds of some products toward relief efforts.","https://i.cbc.ca/ais/d9074a46-b0ee-492a-a4d9-3d5118759841,1762893564194/full/max/0/default.jpg?im=Crop%2Crect%3D%28450%2C427%2C5241%2C2948%29%3BResize%3D620",2025-11-12T09:00:00Z,,"Members of Ottawas Filipino community say theyre heartbroken watching Typhoon Fung-wong devastate their homeland.
The storm departed the Philippines on Monday after causing floods, landslides, and p… [+2844 chars]",,en,Typhoon Philippines,Tropical Cyclone,wmo,Philippines,SEA,Asia
https://www.ibtimes.com/typhoon-fung-wong-forces-mass-evacuations-taiwan-flights-cancelled-power-lines-down-3790160,https://www.ibtimes.com/typhoon-fung-wong-forces-mass-evacuations-taiwan-flights-cancelled-power-lines-down-3790160,0,www.ibtimes.com,"Typhoon Fung-Wong Forces Mass Evacuations in Taiwan — Flights Cancelled, Power Lines Down","Typhoon Fung-wong forces mass evacuations in Taiwan as torrential rains and fierce winds cause blackouts, flight cancellations, and severe flooding across southern and eastern regions.",https://d.ibtimes.com/en/full/4633838/typhoon-fung-wong-taiwan.jpg,2025-11-12T13:07:31Z,,"Taiwan is reeling from the impact of Typhoon Fung-wong, which tore through the island with violent winds and relentless rain, forcing thousands to evacuate and crippling transport and power networks.… [+4772 chars]",,en,Torrential Rain Eastern region,Precipitation,wmo,North Macedonia,MED,Europe
https://www.dw.com/en/russias-strikes-threaten-ukraines-nuclear-safety/a-74713399,https://www.dw.com/en/russias-strikes-threaten-ukraines-nuclear-safety/a-74713399,0,www.dw.com,Russia's strikes threaten Ukraine's nuclear safety,"Russia is ramping up missile attacks on substations at Ukrainian nuclear power plants. Experts tell DW why this new tactic is dangerous — and how it can be prevented. In the fourth winter of Russia's war of aggression, Ukraine's energy infrastructure has alre…",https://static.dw.com/image/66491861_6.jpg,2025-11-12T19:05:00Z,,"In the fourth winter of Russia's war of aggression, Ukraine's energy infrastructure has already been severely damaged. Now, its resilience is being further tested by a new wave of missile strikes. Ru… [+5958 chars]",,en,Rain Russia,Precipitation,wmo,Russia,ESB,Europe
https://www.cbc.ca/news/business/us-shutdown-economy-tariffs-9.6976669,https://www.cbc.ca/news/business/us-shutdown-economy-tariffs-9.6976669,0,www.cbc.ca,A post-shutdown fog will hang over the U.S. economy for months,"Key economic data was not gathered during the U.S. government shut down — casting a fog of uncertainty over the state of the U.S. economy at a crucial time. The Canada-U.S. trade war has dragged on and the tariffs have begun to bite, but no one can say for ce…","https://i.cbc.ca/ais/c34cf384-657a-453b-9abd-d1dcd160cd8a,1762995484996/full/max/0/default.jpg?im=Crop%2Crect%3D%280%2C416%2C5788%2C3255%29%3BResize%3D620",2025-11-13T09:00:00Z,,"The longest government shutdown in U.S. history concluded last night, after Congress passed a bill, which was quickly signed into law, to restore government functions and resume normal activity. But … [+4190 chars]",,en,Fog Canada,Fog,wmo,Canada,NEN,North-America
https://biztoc.com/x/f0a3f85eb0d377a3,https://biztoc.com/x/f0a3f85eb0d377a3,0,biztoc.com,A post-shutdown fog will hang over the U.S. economy for months,"Key economic data was not gathered during the U.S. government shut down — casting a fog of uncertainty over the state of the U.S. economy at a crucial time. The Canada-U.S. trade war has dragged on and the tariffs have begun to bite, but no one can say for ce…",https://biztoc.com/cdn/f0a3f85eb0d377a3_s.webp,2025-11-13T09:04:23Z,,Key economic data was not gathered during the U.S. government shut down casting a fog of uncertainty over the state of the U.S. economy at a crucial time. The Canada-U.S. trade war has dragged on and… [+139 chars],,en,Fog Canada,Fog,wmo,Canada,NEN,North-America
https://news.un.org/en/story/2025/11/1166365,https://news.un.org/en/story/2025/11/1166365,0,news.un.org,From Haiti to Ethiopia: voices of climate displacement at COP30,"Floods, heatwaves, droughts and storms are forcing millions from their homes every year. Most never cross a border; they remain internally displaced yet uprooted all the same. But experts warn that in the not-so-distant future, entire nations could disappear …",https://global.unitednations.entermediadb.net/assets/mediadb/services/module/asset/downloads/preset/Libraries/Production%20Library/16-06-2022_IOM_PapuaNewGuinea.jpg/image770x420cropped.jpg,2025-11-13T12:00:00Z,,"At COP30 in Belém, Brazil, the UN International Organization for Migration (IOM) is pressing negotiators to make climate mobility a core part of adaptation plans.
People and communities who choose t… [+3209 chars]",,en,Drought Ethiopia,Drought,edo,Ethiopia,NEAF,Africa
https://phys.org/news/2025-11-remote-islands-vulnerability-sea.html,https://phys.org/news/2025-11-remote-islands-vulnerability-sea.html,0,phys.org,Study provides new forecasts of remote islands' vulnerability to sea level rise,"In the summer of 2022, 20 islands in the Maldives were flooded when a distant swell event in the Indian Ocean coincided with an extremely high tide level.",https://scx2.b-cdn.net/gfx/news/hires/2025/study-provides-new-for.jpg,2025-11-13T12:12:04Z,,"In the summer of 2022, 20 islands in the Maldives were flooded when a distant swell event in the Indian Ocean coincided with an extremely high tide level.
A new and detailed analysis of that inciden… [+5475 chars]",,en,Flood India,Flood,wmo,India,SAS,Asia
https://metalinjection.net/news/ac-dcs-show-in-melbourne-was-so-loud-it-caused-an-earthquake,https://metalinjection.net/news/ac-dcs-show-in-melbourne-was-so-loud-it-caused-an-earthquake,0,metalinjection.net,AC/DC's Show In Melbourne Was So Loud It Caused An Earthquake,"""If everyone's sort of bouncing in unison, it tends to amplify the signal so we can pick it up a little bit better.""
The post AC/DC's Show In Melbourne Was So Loud It Caused An Earthquake appeared first on Metal Injection.",https://cdn-p.smehost.net/sites/7f9737f2506941499994d771a29ad47a/wp-content/uploads/2024/12/ACDC-2025.jpg,2025-11-13T16:06:50Z,,"AC/DC just played their first Australian concert in a decade on November 12 at the Melbourne Cricket Ground in Melbourne and it shook the Earth. I mean literally, it shook the Earth.
According to Ad… [+2277 chars]",,en,earthquake,Earthquake,random,,,
https://www.abc.net.au/news/2025-11-14/supercell-risk-storm-outbreak-across-australia/106007402,https://www.abc.net.au/news/2025-11-14/supercell-risk-storm-outbreak-across-australia/106007402,0,www.abc.net.au,Supercell risk as 72-hour storm outbreak to light up skies,"Peak severe weather season is arriving, and an influx of tropical moisture will fuel thunderstorms in all Australian states and territories between Friday and Sunday.",https://live-production.wcms.abc-cdn.net.au/8b561b22844560578bc1878bc8d188ba?impolicy=wcms_watermark_news&cropH=1133&cropW=2014&xPos=55&yPos=0&width=862&height=485&imformat=generic,2025-11-13T19:07:33Z,,"Peak severe weather season is arriving, and an influx of tropical moisture will fuel thunderstorms in all Australian states and territories between Friday and Sunday.
The outbreak includes the risk … [+5364 chars]",,en,tropical storm,Tropical Cyclone,random,,,
https://www.cnbc.com/2025/11/13/trump-tariffs-high-beef-prices.html,https://www.cnbc.com/2025/11/13/trump-tariffs-high-beef-prices.html,0,www.cnbc.com,Trump tariffs are helping drive U.S. beef prices to new highs,"President Trump's tariffs are adding to higher beef prices, along with drought and parasites in a stressed U.S. beef supply chain.",https://image.cnbcfm.com/api/v1/image/108225751-1763069191237-gettyimages-2226529539-jr_10110_x7mfbjw2.jpeg?v=1763069205&w=1920&h=1080,2025-11-13T22:01:13Z,,"President Donald Trump is blaming the meat packers and U.S. cattlemen for rising beef prices, but the tariffs on beef from Brazil, Australia, New Zealand, Uruguay, feed, farm equipment and machinery … [+5616 chars]",,en,drought,Drought,random,,,
https://www.npr.org/2025/11/14/nx-s1-5605864/jordan-prays-for-rain-as-drought-hits-olive-harvest,https://www.npr.org/2025/11/14/nx-s1-5605864/jordan-prays-for-rain-as-drought-hits-olive-harvest,0,www.npr.org,Jordan prays for rain as drought hits olive harvest,"As world leaders meet in Brazil to discuss climate change, Jordanians pray for rain.",https://media.npr.org/include/images/facebook-default-wide-s1400-c100.jpg,2025-11-14T21:04:30Z,,"As world leaders meet in Brazil to discuss climate change, Jordanians pray for rain.",,en,Drought Jordan,Drought,edo,Jordan,MED,Asia
https://www.abc.net.au/news/2025-11-16/gold-coast-schoolies-scaled-back-and-subdued/106012262,https://www.abc.net.au/news/2025-11-16/gold-coast-schoolies-scaled-back-and-subdued/106012262,0,www.abc.net.au,Gold Coast Schoolies celebrations set to be scaled back and subdued,Schoolies celebrations on the Gold Coast will look different this year due to beach erosion in the wake of Cyclone Alfred.,https://live-production.wcms.abc-cdn.net.au/55a5e09afd1d2978c4973edfa1540a7e?impolicy=wcms_watermark_news&cropH=844&cropW=1500&xPos=0&yPos=118&width=862&height=485&imformat=generic,2025-11-15T20:58:40Z,,"Schoolies celebrations on the Gold Coast will be scaled back for the first time this year due to ongoing beach erosion in the wake of Tropical Cyclone Alfred.
The state government and Gold Coast Cou… [+3991 chars]",,en,cyclone,Tropical Cyclone,random,,,
https://economictimes.indiatimes.com/news/india/delhi-shivers-at-9c-coldest-november-night-in-three-years-aqi-still-very-poor/articleshow/125379434.cms,https://economictimes.indiatimes.com/news/india/delhi-shivers-at-9c-coldest-november-night-in-three-years-aqi-still-very-poor/articleshow/125379434.cms,0,economictimes.indiatimes.com,"Delhi shivers at 9°C: Coldest November night in three years, AQI still 'very poor'","Delhi experienced its chilliest November night in three years, with temperatures dipping to 9°C. Despite meeting cold wave criteria at two stations, it hasn't been officially declared due to the requirement of two consecutive days. Clear skies and cold winds …","https://img.etimg.com/thumb/msid-125379439,width-1200,height-630,imgsize-15316,overlay-economictimes/articleshow.jpg",2025-11-17T07:21:24Z,,"The national capital experienced its chilliest November night in three years on Sunday, with the temperature at Safdarjung Delhis main weather station dipping to 9°C, which is 4.5 degrees below norma… [+2938 chars]",,en,coldest day,Cold Wave,random,,,
https://economictimes.indiatimes.com/news/india/cold-wave-warning-for-4-odisha-districts-g-udaygiri-coldest-place-in-state-at-5-4-degree-celsius/articleshow/125383684.cms,https://economictimes.indiatimes.com/news/india/cold-wave-warning-for-4-odisha-districts-g-udaygiri-coldest-place-in-state-at-5-4-degree-celsius/articleshow/125383684.cms,0,economictimes.indiatimes.com,"Cold wave warning for 4 Odisha districts, G Udaygiri coldest place in state at 5.4 degree Celsius","A chilling cold wave has enveloped Odisha, prompting the India Meteorological Department to alert several districts. G Udaygiri has plunged to a frigid 5.4 degrees Celsius, marking a stark reminder of winter's bite. Bhubaneswar is experiencing its coldest Nov…","https://img.etimg.com/thumb/msid-125383727,width-1200,height-630,imgsize-4228,overlay-economictimes/articleshow.jpg",2025-11-17T10:58:16Z,,"The IMD on Monday issued a cold wave warning for four districts, including Bhubaneswar, while G Udaygiri was the coldest place in the state at 5.4 degree Celsius.The IMD in its mid-day bulletin issue… [+1677 chars]",,en,Cold Wave Lin an District,Cold Wave,wmo,China,EAS,Asia
https://economictimes.indiatimes.com/news/new-updates/school-assembly-news-headlines-for-18th-november-top-national-international-sports-and-business-update/articleshow/125384122.cms,https://economictimes.indiatimes.com/news/new-updates/school-assembly-news-headlines-for-18th-november-top-national-international-sports-and-business-update/articleshow/125384122.cms,0,economictimes.indiatimes.com,"School Assembly News Headlines for 18th November: Top national, international, sports and business update",India and the US are nearing a trade deal. A cold wave is expected in Odisha. The Supreme Court has criticized Rajasthan for river pollution. Anil Ambani has again skipped an ED summons. Russia hopes for a Putin-Trump summit. Ousted Bangladesh PM Sheikh Hasin…,"https://img.etimg.com/thumb/msid-125384151,width-1200,height-630,imgsize-14776,overlay-economictimes/articleshow.jpg",2025-11-17T11:18:55Z,,"Heres your quick round-up of all the important news headlines for school assembly on 18 November 2025, covering national, international, and sports updates. These stories will help students stay info… [+3941 chars]",,en,cold wave,Cold Wave,random,,,
https://www.nzherald.co.nz/nz/weather-atmospheric-river-to-bring-heavy-rain-muggy-temperatures-for-much-of-new-zealand/I7LXZOY6XRFDXDMEAGXV7NKL7A/,https://www.nzherald.co.nz/nz/weather-atmospheric-river-to-bring-heavy-rain-muggy-temperatures-for-much-of-new-zealand/I7LXZOY6XRFDXDMEAGXV7NKL7A/,0,www.nzherald.co.nz,"Weather: Atmospheric river to bring heavy rain, muggy temperatures for much of New Zealand","""I would be shocked if anywhere on the North Island managed to skip out on rain.""",https://www.nzherald.co.nz/resizer/v2/TQVXD3JH5VCJ3JHMTGFXCIGVBE.png?auth=b1dc9496603e9fac1f11297d4137369d6861031c42fce1bebd7756ba3a69323c&width=1200&height=675&quality=70&focal=352%2C308&smart=false,2025-11-17T16:00:00Z,,"MetService forecaster Alec Holden told the Herald a lot of rain was spread across the North Island.
MetService has issued a series of heavy rain watches and warnings across the centre of the North I… [+1993 chars]",,en,Rain New Zealand,Precipitation,wmo,New Zealand,NZ,Oceania
https://www.abc.net.au/news/2025-11-18/asx-market-sump-worst-since-liberation-day-tariffs-nov-16/106020676,https://www.abc.net.au/news/2025-11-18/asx-market-sump-worst-since-liberation-day-tariffs-nov-16/106020676,0,www.abc.net.au,Tech stocks lead $59bn ASX slump on 'perfect storm' of fears,"The Australian share market posts its worst one-day loss since the fallout from Donald Trump's Liberation Day tariff announcement in early April, with more than $59 billion wiped off the value of listed companies.",https://live-production.wcms.abc-cdn.net.au/53bd1a387addb50c1c51dba7b7498757?impolicy=wcms_watermark_news&cropH=3419&cropW=6079&xPos=471&yPos=265&width=862&height=485&imformat=generic,2025-11-17T20:52:35Z,,"The ASX 200 has fallen to its lowest point in almost five months, sliding as much as 2.16 per cent to an intraday low of 8,450 points, before finishing the day down 1.94 per cent at 8,469 points.
Th… [+18334 chars]",,en,storm,Storm,random,,,
https://www.abc.net.au/news/2025-11-18/tropical-low-cyclone-nt-bureau-of-meteorology-/106023036,https://www.abc.net.au/news/2025-11-18/tropical-low-cyclone-nt-bureau-of-meteorology-/106023036,0,www.abc.net.au,Category two cyclone predicted off NT coast by Thursday,"The Bureau of Meteorology has issued its first forecast track map for a tropical low over the NT, showing the system is expected to strengthen into a category two cyclone by Thursday night.",https://live-production.wcms.abc-cdn.net.au/02ce96f9dc39b2139631790825bde52a?impolicy=wcms_watermark_news&cropH=360&cropW=640&xPos=0&yPos=60&width=862&height=485&imformat=generic,2025-11-18T03:04:08Z,,"A tropical low sitting off the Northern Territory coast is forecast to become a category two cyclone by Thursday, the Bureau of Meteorology (BOM) says.
The BOM issued its first forecast track map fo… [+3510 chars]",,en,cyclone,Tropical Cyclone,random,,,
https://timesofindia.indiatimes.com/life-style/travel/imd-forecasts-persistent-rainfall-for-south-india-severe-cold-conditions-to-sweep-through-these-central-states/articleshow/125400419.cms,https://timesofindia.indiatimes.com/life-style/travel/imd-forecasts-persistent-rainfall-for-south-india-severe-cold-conditions-to-sweep-through-these-central-states/articleshow/125400419.cms,0,timesofindia.indiatimes.com,IMD forecasts persistent rainfall for south India; severe cold conditions to sweep through these central states,"Southern India is set to endure a wet spell with persistent rains and fierce thunderstorms until November 23, particularly affecting the Andaman & Nicobar Islands with expected heavy downpours. In contrast, a chilling cold wave will sweep across central India…","https://static.toiimg.com/thumb/msid-125400419,width-1070,height-580,imgsize-101262,resizemode-75,overlay-toi_sw,pt-32,y_pad-40/photo.jpg",2025-11-18T03:30:33Z,,"The most prolonged wet spell this week is expected over Tamil Nadu, Puducherry, and Karaikal, where light to moderate rain or thunderstorms are likely at most or many places every day from November 1… [+4391 chars]",,en,thunderstorm,Thunderstorm,random,,,
https://timesofindia.indiatimes.com/etimes/trending/which-is-the-most-polluted-city-in-india-cpcb-report-reveals-greater-noida-at-the-top-followed-closely-by-ghaziabad/articleshow/125413058.cms,https://timesofindia.indiatimes.com/etimes/trending/which-is-the-most-polluted-city-in-india-cpcb-report-reveals-greater-noida-at-the-top-followed-closely-by-ghaziabad/articleshow/125413058.cms,0,timesofindia.indiatimes.com,"Which is the most polluted city in India? CPCB report reveals Greater Noida at the top, followed closely by Ghaziabad","Greater Noida has emerged as India's most polluted city, with an alarming AQI of 454, followed closely by Ghaziabad at 434, both in the 'Severe' category. High PM2.5 and PM10 levels, coupled with urban development, traffic, and winter weather, are driving the…","https://static.toiimg.com/thumb/msid-125413077,width-1070,height-580,imgsize-25714,resizemode-75,overlay-toi_sw,pt-32,y_pad-500/photo.jpg",2025-11-18T13:23:31Z,,"<ul><li>News</li>
<li>lifestyle</li>
<li>trending</li>
<li>Which is the most polluted city in India? CPCB report reveals Greater Noida at the top, followed closely by Ghaziabad</li></ul>
Greater … [+2181 chars]",,en,severe weather,Thunderstorm,random,,,
https://www.nzherald.co.nz/nz/metservice-warns-of-heavy-rain-and-flooding-risk-across-north-island-after-wild-night/WJPAQ2YGVJDU3JKB7Q6IKH7YZY/,https://www.nzherald.co.nz/nz/metservice-warns-of-heavy-rain-and-flooding-risk-across-north-island-after-wild-night/WJPAQ2YGVJDU3JKB7Q6IKH7YZY/,0,www.nzherald.co.nz,MetService warns of heavy rain and flooding risk across North Island after wild night,Auckland faces an early morning soaking as the downpour moves east.,https://www.nzherald.co.nz/resizer/v2/GPZV5XXQLVH2NET5LIGHI4WUAQ.png?auth=f8d4e43ccaa41040f7cc98a90e8b8e8f405ba8a84a080f9a4cd72ed6cc1f6d62&width=1200&height=675&quality=70&smart=true,2025-11-18T18:01:35Z,,"SH25 KAIMARAMA, BAY OF PLENTY - FLOODING- 6:30AM, WED 19 NOV 
Flooding has been reported on SH25 between Wade Rd and The 309 Rd. Consider delaying travel or be prepared to detour. ^KF pic.twitter.coâ€¦ [+2423 chars]",,en,Rain Ning er,Precipitation,wmo,China,EAS,Asia
https://www.abc.net.au/news/2025-11-19/cyclone-fina-forms-off-darwin-coast-landfall-expected-friday/106025980,https://www.abc.net.au/news/2025-11-19/cyclone-fina-forms-off-darwin-coast-landfall-expected-friday/106025980,0,www.abc.net.au,Tropical low intensifies to become Tropical Cyclone Fina off NT coast,A tropical low off the Northern Territory coast has intensified to become Tropical Cyclone Fina with potential landfall expected as early as Friday.,https://live-production.wcms.abc-cdn.net.au/592caef8b44c88003529f367c9d5d45d?impolicy=wcms_watermark_news&cropH=360&cropW=640&xPos=0&yPos=62&width=862&height=485&imformat=generic,2025-11-18T21:16:05Z,,"Tropical Cyclone Fina has formed off the Northern Territory coast and is expected to intensify to category two before potentially making landfall as early as Friday.
Forecasters at the Bureau of Met… [+726 chars]",,en,cyclone,Tropical Cyclone,random,,,
