index,url,valid,domain,title,description,image,published,archive,content,quote,language,term,topic,feed,country,ipcc,continent
https://bringatrailer.com/listing/2001-porsche-911-carrera-cabriolet-119/,https://bringatrailer.com/listing/2001-porsche-911-carrera-cabriolet-119/,0,bringatrailer.com,2001 Porsche 911 Carrera Cabriolet 6-Speed,"This 2001 Porsche 911 Carrera is a US-market cabriolet that spent its first four years registered in the US before it was registered in Canada for seven years, and the car then reentered the US in March 2012. Specified in Rain Forest Green Metallic over a Sav…",https://bringatrailer.com/wp-content/uploads/2025/10/2001_porsche_911-carrera-cabriolet_911-carrera-1807-5-of-234-16026.jpg,2025-11-05T20:00:12Z,,"This 2001 Porsche 911 Carrera is a US-market cabriolet that spent its first four years registered in the US before it was registered in Canada for seven years, and the car then reentered the US in Ma… [+2711 chars]",,en,Rain Canada,Precipitation,wmo,Canada,NEN,North-America
https://theconversation.com/we-studied-217-tropical-cyclones-globally-to-see-how-people-died-our-findings-might-surprise-you-268983,https://theconversation.com/we-studied-217-tropical-cyclones-globally-to-see-how-people-died-our-findings-might-surprise-you-268983,0,theconversation.com,We studied 217 tropical cyclones globally to see how people died. Our findings might surprise you,Tropical cyclones can be even more deadly  – and for a wider range of reasons – than we ever thought.,https://images.theconversation.com/files/700431/original/file-20251105-56-g3fgm9.jpg?ixlib=rb-4.1.0&rect=173%2C16%2C1875%2C937&q=45&auto=format&w=1356&h=668&fit=crop,2025-11-06T00:07:46Z,,"Tropical Cyclone Ita off the shore of Queensland, Australia, 2014. NASA/NOAA via NOAA Environmental Visualization Laboratory/Flickr, CC BY
Tropical cyclones – also known as hurricanes, typhoons or s… [+5407 chars]",,en,cyclone,Tropical Cyclone,random,,,
https://www.thestar.com.my/news/world/2025/11/06/typhoon-kalmaegi-leaves-114-dead-in-philippines,https://www.thestar.com.my/news/world/2025/11/06/typhoon-kalmaegi-leaves-114-dead-in-philippines,0,www.thestar.com.my,Typhoon Kalmaegi leaves 114 dead in Philippines,"MANILA, Nov. 6 (Xinhua) -- Typhoon Kalmaegi left the Philippines before dawn Thursday with 114 deaths and at least 127 missing mainly in the central Philippines, the Office of Civil Defense (OCD) said. Read full story",https://cdn.thestar.com.my/Themes/img/newTsol_logo_socmedia.png,2025-11-06T01:18:00Z,,"MANILA, Nov. 6 (Xinhua) -- Typhoon Kalmaegi left the Philippines before dawn Thursday with 114 deaths and at least 127 missing mainly in the central Philippines, the Office of Civil Defense (OCD) sai… [+477 chars]",,en,typhoon,Tropical Cyclone,random,,,
https://www.channelnewsasia.com/asia/philippines-typhoon-kalmaegi-cebu-province-death-toll-missing-5449306,https://www.channelnewsasia.com/asia/philippines-typhoon-kalmaegi-cebu-province-death-toll-missing-5449306,0,www.channelnewsasia.com,Typhoon Kalmaegi death toll tops 140 with over 100 missing in the Philippines,"Most of the deaths were reported in the central province of Cebu, which was pummelled by Kalmaegi on Tuesday, setting off flash floods and causing a river and other waterways to overflow.","https://dam.mediacorp.sg/image/upload/s--gEygY6vK--/c_crop,h_449,w_799,x_1,y_53/c_fill,g_auto,h_676,w_1200/fl_relative,g_south_east,l_mediacorp:cna:watermark:2024-04:reuters_1,w_0.1/f_auto,q_auto/v1/one-cms/core/2025-11-05T063624Z_1_LYNXMPELA409G_RTROPTP_3_ASIA-WEATHER-PHILIPPINES.JPG?itok=D-kqnnNd",2025-11-06T01:39:00Z,,"Provincial officials said Kalmaegi set off flash floods and caused a river and other waterways to swell. The resulting flooding engulfed residential communities, forcing residents to climb on their r… [+1123 chars]",,en,Typhoon Philippines,Tropical Cyclone,wmo,Philippines,SEA,Asia
https://indianexpress.com/article/world/typhoon-kalmaegi-leaves-over-100-dead-127-missing-in-philippines-10348754/,https://indianexpress.com/article/world/typhoon-kalmaegi-leaves-over-100-dead-127-missing-in-philippines-10348754/,0,indianexpress.com,"Typhoon Kalmaegi leaves 114 dead, 127 missing in Philippines, many in province recovering from quake","Most of the deaths were reported in the central province of Cebu, which was pummeled by Kalmaegi on Tuesday, setting off flash floods and causing a river and other waterways to overflow, said Bernardo Rafaelito Alejandro IV, deputy administrator of the Office…",https://images.indianexpress.com/2025/11/typhoon_7dc445.jpg,2025-11-06T02:12:58Z,,Philippine officials said Thursday the death toll from widespread flooding and devastation caused by Typhoon Kalmaegi in the countrys central region has risen to at least 114 with 127 people reported… [+4047 chars],,en,Typhoon Philippines,Tropical Cyclone,wmo,Philippines,SEA,Asia
https://www.abc.net.au/news/2025-11-06/typhoon-kalmaegi-leaves-114-dead-and-127-missing-in-philippines/105977676,https://www.abc.net.au/news/2025-11-06/typhoon-kalmaegi-leaves-114-dead-and-127-missing-in-philippines/105977676,0,www.abc.net.au,Typhoon Kalmaegi leaves 114 dead and 127 missing in Philippines,The death toll from Typhoon Kalmaegi in the Philippines has risen as the storm gathers strength and heads towards Vietnam.,https://live-production.wcms.abc-cdn.net.au/078ae26ce04d98807fcc83541b82a49c?impolicy=wcms_watermark_news&cropH=972&cropW=1728&xPos=0&yPos=180&width=862&height=485&imformat=generic,2025-11-06T02:18:24Z,,"The death toll from widespread flooding and devastation caused by Typhoon Kalmaegi in the Philippines has risen to at least 114, with 127 others reported missing, officials say.
Most of the deaths w… [+2735 chars]",,en,Typhoon Philippines,Tropical Cyclone,wmo,Philippines,SEA,Asia
https://www.bbc.com/news/articles/c62e0764e6qo,https://www.bbc.com/news/articles/c62e0764e6qo,0,www.bbc.com,At least 114 dead as Philippines reels from Typhoon Kalmaegi,Kalmaegi left the Philippines on Thursday morning and is currently moving toward central Vietnam.,https://ichef.bbci.co.uk/news/1024/branded_news/be97/live/c8cb50e0-bab5-11f0-a527-774896b114b3.jpg,2025-11-06T02:28:53Z,,"The death toll from flooding caused by one of the strongest typhoons this year in the central Philippines has risen to at least 114, authorities said on Thursday. 
Typhoon Kalmaegi has flooded entir… [+3545 chars]",,en,Typhoon Philippines,Tropical Cyclone,wmo,Philippines,SEA,Asia
https://www.digitaljournal.com/world/philippine-death-toll-tops-140-as-typhoon-heads-towards-vietnam/article,https://www.digitaljournal.com/world/philippine-death-toll-tops-140-as-typhoon-heads-towards-vietnam/article,0,www.digitaljournal.com,Philippine death toll tops 140 as typhoon heads towards Vietnam,"Typhoon Kalmaegi killed at least 140 people and left another 127 missing after unleashing devastating flooding across the central Philippines, official figures showed Thursday, as the storm headed towards Vietnam. Floodwaters described as unprecedented rushed…",https://www.digitaljournal.com/wp-content/uploads/2025/11/ea888fe96ec587a6bbc9bfcc08634b729a9d0bb3.jpg,2025-11-06T02:32:20Z,,"Piles of cars are seen in the aftermath of Typhoon Kalmaegi in Liloan, where at least 35 people died in flooding - Copyright AFP Jam STA ROSA
Typhoon Kalmaegi killed at least 140 people and left ano… [+4192 chars]",,en,Flood Vietnam,Flood,relief,Vietnam,SEA,Asia
https://biztoc.com/x/fdbe7364ac655b48,https://biztoc.com/x/fdbe7364ac655b48,0,biztoc.com,Typhoon Kalmaegi death toll hits 114 in Philippines; storm rebuilds strength as it heads to Vietnam,,https://biztoc.com/cdn/fdbe7364ac655b48_s.webp,2025-11-06T02:37:17Z,,"{ window.open(this.href, '_blank'); }, 200); return false;""&gt;Why is the US government shutdown the longest ever? { window.open(this.href, '_blank'); }, 200); return false;""&gt;How will Trump tariff… [+757 chars]",,en,Typhoon Philippines,Tropical Cyclone,wmo,Philippines,SEA,Asia
https://www.yahoo.com/news/articles/philippines-declares-state-emergency-typhoon-031641461.html,https://www.yahoo.com/news/articles/philippines-declares-state-emergency-typhoon-031641461.html,0,www.yahoo.com,Philippines declares a state of emergency after Typhoon Kalmaegi left at least 114 people dead,Philippine President Ferdinand Marcos Jr. declared a state of emergency on Thursday after Typhoon Kalmaegi left at least 114 people dead and hundreds missing...,https://s.yimg.com/ny/api/res/1.2/my33qfkOleKZMBZs47gYPQ--/YXBwaWQ9aGlnaGxhbmRlcjt3PTEyMDA7aD04MDA7Y2Y9d2VicA--/https://media.zenfs.com/en/ap.org/5a9a02aa6a2599510a4afcdcd3b733b5,2025-11-06T03:16:41Z,,"MANILA, Philippines (AP) Philippine President Ferdinand Marcos Jr. declared a state of emergency on Thursday after Typhoon Kalmaegi left at least 114 people dead and hundreds missing in central provi… [+3384 chars]",,en,typhoon,Tropical Cyclone,random,,,
https://www.staradvertiser.com/2025/11/05/breaking-news/typhoon-kalmaegi-death-toll-hits-114-in-philippines/,https://www.staradvertiser.com/2025/11/05/breaking-news/typhoon-kalmaegi-death-toll-hits-114-in-philippines/,0,www.staradvertiser.com,Typhoon Kalmaegi death toll hits 114 in Philippines | Honolulu Star-Advertiser,"CEBU, Philippines >> The death toll in the Philippines from Typhoon Kalmaegi rose to 114 with another 127 people still missing, the disaster agency said on Thursday, as the storm that devastated the country’s central regions regained strength as it headed tow…",https://www.staradvertiser.com/wp-content/uploads/2025/11/web1_2025-11-05T075522Z_1722557531_RC26QHAQFCD8_RTRMADP_3_ASIA-WEATHER-PHILIPPINES.jpg,2025-11-06T03:26:47Z,,"CEBU, Philippines &gt;&gt; The death toll in the Philippines from Typhoon Kalmaegi rose to 114 with another 127 people still missing, the disaster agency said on Thursday, as the storm that devastate… [+2282 chars]",,en,typhoon,Tropical Cyclone,random,,,
https://news.sky.com/story/at-least-114-dead-after-philippines-typhoon-as-state-of-emergency-declared-and-more-than-100-still-missing-13464723,https://news.sky.com/story/at-least-114-dead-after-philippines-typhoon-as-state-of-emergency-declared-and-more-than-100-still-missing-13464723,0,news.sky.com,At least 114 dead after Philippines typhoon,"Typhoon Kalmaegi made landfall on Tuesday, striking the country's central provinces. It is the deadliest natural disaster to hit the Philippines this year.",https://e3.365dm.com/25/11/1600x900/skynews-typhoon-kalmaegi-cebu_7073360.jpg?20251106043434,2025-11-06T04:20:00Z,,"The Philippines has declared a state of emergency after a typhoon left at least 114 dead and 127 missing.
PhilippinePresident Ferdinand Marcos Jr issued the ""state of national calamity"" declaration … [+2112 chars]",,en,typhoon,Tropical Cyclone,random,,,
https://www.abc.net.au/news/2025-11-06/wild-weather-wreaks-havoc-for-west-australian-farmers/105978410,https://www.abc.net.au/news/2025-11-06/wild-weather-wreaks-havoc-for-west-australian-farmers/105978410,0,www.abc.net.au,Hail stones and heavy rain wreak havoc for West Australian farmers,"Severe weather has swept through large parts of the Great Southern and Wheatbelt, causing significant damage to crops during the critical harvest period.",https://live-production.wcms.abc-cdn.net.au/deff1cac27034376175bac5680a52fd4?impolicy=wcms_watermark_news&cropH=652&cropW=1159&xPos=10&yPos=0&width=862&height=485&imformat=generic,2025-11-06T04:30:12Z,,"Heavy rainfall and hail that swept through parts of Western Australia's Wheatbelt overnight have wreaked havoc on local businesses and farmers in the region.
The severe thunderstorms flooded busines… [+4134 chars]",,en,Severe Weather Australia,Thunderstorm,wmo,Australia,CAU,Oceania
https://www.aljazeera.com/news/2025/11/6/typhoon-kalmaegi-bears-down-on-vietnam-after-114-killed-in-the-philippines,https://www.aljazeera.com/news/2025/11/6/typhoon-kalmaegi-bears-down-on-vietnam-after-114-killed-in-the-philippines,0,www.aljazeera.com,Typhoon Kalmaegi bears down on Vietnam after 114 killed in the Philippines,Meteorologists have warned that the typhoon has regained strength as it barrels towards Vietnam's central regions.,https://www.aljazeera.com/wp-content/uploads/2025/11/2025-11-05T111507Z_1685519312_RC25QHA5DYCS_RTRMADP_3_ASIA-WEATHER-PHILIPPINES-1762397122.jpg?resize=1920%2C1440,2025-11-06T04:46:40Z,,"The Philippines disaster agency has confirmed that at least 114 people have been killed by Typhoon Kalmaegi, with another 127 people still missing, as President Ferdinand Marcos Jr declared a state o… [+3638 chars]",,en,Typhoon Philippines,Tropical Cyclone,wmo,Philippines,SEA,Asia
https://grist.org/climate/no-doubt-about-it-climate-change-made-hurricane-melissa-way-worse/,https://grist.org/climate/no-doubt-about-it-climate-change-made-hurricane-melissa-way-worse/,0,grist.org,No doubt about it: Climate change made Hurricane Melissa way worse,"An analysis of the storm found “all aspects of this event were amplified by climate change, and that we'll see more of the same.”",https://grist.org/wp-content/uploads/2025/11/GettyImages-2243550707.jpeg?quality=75&strip=all,2025-11-06T05:01:00Z,,"Last month, forecasters watched with dread as Hurricane Melissa lumbered across the Atlantic Ocean, morphed into a monster, and took aim at the islands of the Caribbean. As predicted by the National … [+5379 chars]",,en,storm,Storm,random,,,
https://www.bbc.com/news/videos/cr5el2jm1e9o,https://www.bbc.com/news/videos/cr5el2jm1e9o,0,www.bbc.com,Watch: Cars pile up on Philippines streets after typhoon,"Floods have swept through towns, killing at least 85 people and leaving 75 others missing.",https://ichef.bbci.co.uk/news/1024/branded_news/4ed2/live/f5a75630-baca-11f0-aa13-0b0479f6f42a.jpg,2025-11-06T05:24:44Z,,"Aerial footage from the Philippines shows the destruction wrought on homes and streets by Typhoon Kalmaegi. 
It was one of the strongest typhoons in the Philippines this year. 
At least 85 people h… [+147 chars]",,en,Flood Philippines,Flood,wmo,Philippines,SEA,Asia
https://skepticalscience.com/new_research_2025_45.html,https://skepticalscience.com/new_research_2025_45.html,0,skepticalscience.com,Skeptical Science New Research for Week #45 2025,"Open access notables

Tropical cyclones expand faster at warmer relative sea surface temperature, Wang et al., Proceedings of the National Academy of Sciences

Tropical cyclone (TC) size strongly affects its hazards and impacts. This study shows that observed…",https://skepticalscience.com/public/assets/images/og/button_sks_200.jpg,2025-11-06T06:53:49Z,,"Posted on 6 November 2025 by Doug Bostrom, Marc Kodack
Open access notables
Tropical cyclones expand faster at warmer relative sea surface temperature, Wang et al., Proceedings of the National Acad… [+54329 chars]",,en,cyclone,Tropical Cyclone,random,,,
https://www.ndtvprofit.com/world/typhoon-kalmaegi-live-tracker-check-path-landfall-date-and-place-as-category-4-typhoon-bears-down-on-vietnam,https://www.ndtvprofit.com/world/typhoon-kalmaegi-live-tracker-check-path-landfall-date-and-place-as-category-4-typhoon-bears-down-on-vietnam,0,www.ndtvprofit.com,"Typhoon Kalmaegi Live Tracker: Check Path, Landfall Date And Place As Category 4 Typhoon Bears Down On Vietnam","Typhoon Kalmaegi, which has already left a deadly trail in the Philippines, is now closing in on Vietnam. According to reports, the storm has regained strength and is rapidly intensifying as it approaches Vietnam’s central coastline. As per an Al Jazeera repo…",https://media.assettype.com/bloombergquint%2F2025-11-06%2Ffgyhcars%2FWhatsApp-Image-2025-11-06-at-13.15.03.jpeg?w=1200&auto=format%2Ccompress&ogImage=true,2025-11-06T07:52:11Z,,"VN Express reported that strong winds began intensifying over the southern East Sea on the morning of Nov. 6. From Quang Tri to Khanh Hoa, including Ly Son and Cu Lao Cham Islands, wind speeds rose f… [+796 chars]",,en,Typhoon Philippines,Tropical Cyclone,wmo,Philippines,SEA,Asia
https://gizmodo.com/thunderstorms-could-turn-your-asthma-into-a-nightmare-2000682082,https://gizmodo.com/thunderstorms-could-turn-your-asthma-into-a-nightmare-2000682082,0,gizmodo.com,"When Thunderstorms Hit, Asthma Can Become an ER Nightmare",New research is the latest to find that thunderstorms can worsen your odds of a serious seasonal asthma attack.,https://gizmodo.com/app/uploads/2025/11/thunderstorm-1200x675.jpg,2025-11-06T13:00:04Z,,"Has your asthma ever acted up during or shortly after stormy weather? Turns out, there’s a perfectly good reason for that. Research out today links thunderstorms to worsening asthma attacks.
Doctors… [+4476 chars]",,en,storm,Storm,random,,,
https://www.aljazeera.com/video/newsfeed/2025/11/6/philippines-reeling-from-deadly-floods-triggered-by-typhoon-kalmaegi,https://www.aljazeera.com/video/newsfeed/2025/11/6/philippines-reeling-from-deadly-floods-triggered-by-typhoon-kalmaegi,0,www.aljazeera.com,Philippines reeling from deadly floods triggered by Typhoon Kalmaegi,"Heavy flooding in Talisay City, Cebu has destroyed homes after Typhoon Kalmaegi dumped a month’s worth of rain.",https://www.aljazeera.com/wp-content/uploads/2025/11/image-1762445467.jpg?resize=1620%2C1080&quality=80,2025-11-06T16:11:20Z,,"NewsFeed
Heavy flooding in Talisay City, Cebu has destroyed homes after Typhoon Kalmaegi dumped a months worth of rain. One person died in a low-income area that evacuated early, while dozens may be… [+95 chars]",,en,Flooding Philippines,Flood,wmo,Philippines,SEA,Asia
https://abcnews.go.com/Technology/wireStory/hurricane-cyclone-typhoon-heres-difference-127273336,https://abcnews.go.com/Technology/wireStory/hurricane-cyclone-typhoon-heres-difference-127273336,0,abcnews.go.com,Hurricane? Cyclone? Typhoon? Here’s the difference,Typhoon Kalmaegi has killed at least 114 people in the Philippines and left even more people missing as it moved on to slam Vietnam,https://i.abcnewsfe.com/a/30ff2044-da4b-4148-b357-7e659e6b0360/wirestory_72ac117cb7aa91ea4ca1539a48945ed2_16x9.jpg?w=1600,2025-11-06T20:53:48Z,,"WASHINGTON -- WASHINGTON (AP) Typhoon Kalmaegi has killed at least 114 people in the Philippines with even more missing and then hit Vietnam Friday. A second typhoon, Fong-Wong, is forecast to hit th… [+4807 chars]",,en,Hurricane Philippines,Tropical Cyclone,wmo,Philippines,SEA,Asia
https://www.pride.com/culture/sports/lgbtq-ncaa-womens-basketball-players,https://www.pride.com/culture/sports/lgbtq-ncaa-womens-basketball-players,0,www.pride.com,6 LGBTQ+ star players in the 2025-26 NCAA women’s college basketball season,These queer young women are taking the basketball world by storm!,https://www.pride.com/media-library/rori-harmon-azzi-fudd-lauren-betts.jpg?id=62084008&width=1200&height=600&coordinates=0%2C154%2C0%2C155,2025-11-06T22:29:24Z,,From left: lesbian sports power couples Megan Rapinoe and Sue Bird; DiJonai Carrington and NaLyssa Smith; Lena Oberdorf and Natalia Padilla-Bidas.Meg Oliphant/Getty Images; Erica Denhoff/Icon Sportsw… [+22019 chars],,en,storm,Storm,random,,,
https://www.sciencealert.com/giant-analysis-reveals-the-deadliest-risks-of-tropical-cyclones,https://www.sciencealert.com/giant-analysis-reveals-the-deadliest-risks-of-tropical-cyclones,0,www.sciencealert.com,Giant Analysis Reveals The Deadliest Risks of Tropical Cyclones,"Tropical cyclones – also known as hurricanes, typhoons or storms, depending on their location and intensity – are among the world's most destructive and costly climate disasters.",https://www.sciencealert.com/images/2025/11/Hurricane-satellite-view.jpg,2025-11-07T01:35:59Z,,"Tropical cyclones also known as hurricanes, typhoons or storms, depending on their location and intensity are among the world's most destructive and costly climate disasters.
Their direct physical i… [+6031 chars]",,en,cyclone,Tropical Cyclone,random,,,
https://abcnews.go.com/Business/wireStory/typhoon-kalmaegi-kills-5-people-vietnam-philippines-prepares-127285098,https://abcnews.go.com/Business/wireStory/typhoon-kalmaegi-kills-5-people-vietnam-philippines-prepares-127285098,0,abcnews.go.com,Typhoon Kalmaegi kills 5 people in Vietnam as the Philippines prepares for a new storm,"Typhoon Kalmaegi has brought fierce winds and torrential rains to Vietnam, and left at least five people dead and thousands of homes damaged before weakening into a tropical storm",https://s.abcnews.com/images/US/abc_news_default_2000x2000_update_16x9_992.jpg,2025-11-07T05:33:44Z,,"DAK LAK, Vietnam -- DAK LAK, Vietnam (AP) Typhoon Kalmaegi brought fierce winds and torrential rains to Vietnam on Friday, killing at least five people and leaving widespread damage across the countr… [+3508 chars]",,en,Rain Ning er,Precipitation,wmo,China,EAS,Asia
https://financialpost.com/pmn/business-pmn/orban-dangles-energy-deals-to-sway-trump-on-russia-oil-sanctions,https://financialpost.com/pmn/business-pmn/orban-dangles-energy-deals-to-sway-trump-on-russia-oil-sanctions,0,financialpost.com,Orban Dangles Energy Deals to Sway Trump on Russia Oil Sanctions,"Viktor Orban expected a political boon and a flood of investments after Donald Trump was re-elected to the US presidency. A year later, the Hungarian prime minister is going to the White House with cap in hand.",https://smartcdn.gprod.postmedia.digital/financialpost/wp-content/uploads/2025/11/hungary-increased-reliance-on-russian-crude-oil-after-2022-.jpg,2025-11-07T05:49:13Z,,"The deals also include defense contracts and an unspecified financial agreement, Hungarian officials have said. 
A White House official, asked to comment on the effort, said Trump had a good relatio… [+3120 chars]",,en,Flood Russia,Flood,wmo,Russia,ESB,Europe
https://www.seattlepi.com/news/world/article/typhoon-kalmaegi-kills-5-people-in-vietnam-as-the-21144887.php,https://www.seattlepi.com/news/world/article/typhoon-kalmaegi-kills-5-people-in-vietnam-as-the-21144887.php,0,www.seattlepi.com,Typhoon Kalmaegi kills 5 people in Vietnam as the Philippines prepares for a new storm,"Typhoon Kalmaegi has brought fierce winds and torrential rains to Vietnam, and left at least five people dead and thousands of homes damaged before weakening into a tropical storm. The storm moved into Cambodia on Friday. Authorities also say three people are…",https://s.hdnux.com/photos/01/55/03/44/28588301/3/rawImage.jpg,2025-11-07T05:52:00Z,,"A man walks past an uprooted tree in Dak Lak, Vietnam, on Friday, Nov. 7, 2025 after Typhoon Kalmaegi lashed the country with fierce winds and torrential rains. (Tuong Quan/VNA via AP)
Tuong Quan/AP… [+4438 chars]",,en,Rain Ning er,Precipitation,wmo,China,EAS,Asia
https://www.theatlantic.com/photography/2025/11/photos-of-the-week/684834/,https://www.theatlantic.com/photography/2025/11/photos-of-the-week/684834/,0,www.theatlantic.com,"Photos of the Week: Dinosaur Sweater, Miniature Park, Hippo Calf","The aftermath of Typhoon Kalmaegi in the Philippines, Day of the Dead celebrations in Mexico, a penny-farthing race in Prague, a mayoral election in New York City, and much more",https://cdn.theatlantic.com/thumbor/3lhlTbsBNQ2WOvpFqi6KaSrlVms=/1x334:7440x4209/1200x625/media/img/mt/2025/11/a01_G_2245355778/original.jpg,2025-11-07T14:30:00Z,,"Andrew Harnik / Getty
President Donald Trump stands by as attendees help a guest after he collapsed during an event on lowering drug prices in the Oval Office, at the White House, in Washington, D.C… [+4970 chars]",,en,Typhoon Mexico,Tropical Cyclone,relief,Mexico,NCA,North-America
https://worldsoccertalk.com/news/christian-pulisic-at-center-of-drama-usmnt-boss-mauricio-pochettino-fires-back-at-milan-after-stars-injury-storm-with-six-word-swipe/,https://worldsoccertalk.com/news/christian-pulisic-at-center-of-drama-usmnt-boss-mauricio-pochettino-fires-back-at-milan-after-stars-injury-storm-with-six-word-swipe/,0,worldsoccertalk.com,Christian Pulisic at center of drama: USMNT boss Mauricio Pochettino fires back at Milan after star’s injury storm with six-word swipe,"After weeks of criticism and speculation, Pochettino has spoken — and his response included a sharp, six-word message aimed directly at the Italian side.
 The ongoing tug-of-war between club and country, involving Christian Pulisic, Mauricio Pochettino, and M…",https://ds-images.bolavip.com/news/image?src=https://images.worldsoccertalk.com/webp/1200_740/WST_20251107_WST_602025_pulisic-pochettino-usmnt-2-1200x740.webp&width=1200&height=740,2025-11-07T20:03:11Z,,"The ongoing tug-of-war between club and country, involving Christian Pulisic, Mauricio Pochettino, and Milan, seems never to end. The United States mens national team boss found himself at the heart … [+3335 chars]",,en,storm,Storm,random,,,
https://www.ibtimes.com/typhoon-uwan-threatens-luzon-officials-warn-storm-surge-risks-exceed-30m-3789905,https://www.ibtimes.com/typhoon-uwan-threatens-luzon-officials-warn-storm-surge-risks-exceed-30m-3789905,0,www.ibtimes.com,Typhoon Uwan Threatens Luzon: Officials Warn Storm Surge Risks Exceed 3.0m,"Typhoon Uwan is set to rapidly intensify and may reach Super Typhoon status, bringing a 'life-threatening' 3.0 meters storm surge risk to Luzon and Visayas.",https://d.ibtimes.com/en/full/4633442/super-typhoon-uwan.jpg,2025-11-07T22:04:05Z,,"The situation involving Typhoon UWAN (FUNG-WONG) is escalating rapidly, demanding immediate attention across the Philippines.
As of 5:00 AM on 8 November 2025, the typhoon is actively strengthening … [+3992 chars]",,en,typhoon,Tropical Cyclone,random,,,
