index,url,valid,domain,title,description,image,published,archive,content,quote,language,term,topic,feed,country,ipcc,continent
https://www.nzherald.co.nz/nz/weather-thunderstorms-hail-rain-strong-wind-gusts-to-blast-central-new-zealand/H5GGFNVK4NHBBI6CSYSJVAJA5M/,https://www.nzherald.co.nz/nz/weather-thunderstorms-hail-rain-strong-wind-gusts-to-blast-central-new-zealand/H5GGFNVK4NHBBI6CSYSJVAJA5M/,0,www.nzherald.co.nz,"Weather: Thunderstorms, hail, rain, strong wind gusts to blast central New Zealand",Flooding is possible at the bottom of the North Island as a fierce weather system stalls.,https://www.nzherald.co.nz/resizer/v2/C3OFK6CNZNC3FE4CQ4VYTXSJU4.jpg?auth=5a1ccc70e4543b762362cdb80e07420e817a0fe3e5be7de9c1cce2902aaa99aa&width=1200&height=675&quality=70&smart=true,2024-05-01T01:11:18Z,,"Thunderstorms, hail and strong wind gusts are forecast to bear down on the centre of the country and eastern parts of the South Island in the coming hours.
Surface flooding is possible at the bottom… [+3232 chars]",,en,Storm New Zealand,Storm,wmo,New Zealand,NZ,Oceania
http://www.wwe.com/videos/thea-hail-vs-jacy-jayne-nxt-spring-breakin-highlights-april-30-2024,http://www.wwe.com/videos/thea-hail-vs-jacy-jayne-nxt-spring-breakin-highlights-april-30-2024,0,www.wwe.com,"Thea Hail vs. Jacy Jayne: NXT Spring Breakin’ highlights, April 30, 2024","Thea Hail looks to prove herself against her former friend, the villainous Jacy Jayne. Catch WWE action on Peacock, WWE Network, FOX, USA Network, Sony India and more. #WWENXT",https://www.wwe.com/f/styles/og_image/public/2024/04/20240430_NXT_Thea_Jacy--9a4d9561eb79266a925857b19eac023f.jpg,2024-05-01T01:34:00Z,,"Skip to main content
Raw exclusives: May 19, 2014
Summer Rae avoids the questions: WWE.com Exclusive, May 19, 2014
Daniel Bryan reacts to Triple H's comments about his neck injury
Sheamus vs. Ces… [+641 chars]",,en,Hail India,Thunderstorm,wmo,India,SAS,Asia
https://phys.org/news/2024-05-april-temperatures-bangladesh-hottest.html,https://phys.org/news/2024-05-april-temperatures-bangladesh-hottest.html,0,phys.org,April temperatures in Bangladesh hottest on record,"Bangladesh's weather bureau said Wednesday that last month was the hottest April on record, with the South Asian nation and much of the region still enduring a suffocating heat wave.",https://scx2.b-cdn.net/gfx/news/2024/a-vehicle-of-the-dhaka.jpg,2024-05-01T08:10:01Z,,"Bangladesh's weather bureau said Wednesday that last month was the hottest April on record, with the South Asian nation and much of the region still enduring a suffocating heat wave.
Extensive scien… [+3169 chars]",,en,Heat Wave Heat wave,Heat Wave,wmo,India,SAS,Asia
https://www.aljazeera.com/news/2024/5/1/blame-the-government-kenyans-bemoan-lack-of-support-amid-record-flooding,https://www.aljazeera.com/news/2024/5/1/blame-the-government-kenyans-bemoan-lack-of-support-amid-record-flooding,0,www.aljazeera.com,‘Blame the government’: Kenyans bemoan lack of support amid record flooding,"In Mathare, one of the largest slums in Nairobi, residents grapple with flood damage, loss and lack of state assistance.",https://www.aljazeera.com/wp-content/uploads/2024/04/2024-04-24T145143Z_623948173_RC21D7A2HTBL_RTRMADP_3_KENYA-FLOODS-1714493114.jpg?resize=1920%2C1440,2024-05-01T08:18:03Z,,"Nairobi, Kenya Collins Obondo stood atop the rubble of a house in Mathare, one of the largest informal settlements in Kenyas capital Nairobi, surveying the aftermath of a flood that destroyed his nei… [+11046 chars]",,en,flooding,Flood,random,,,
https://theconversation.com/kenyas-devastating-floods-expose-decades-of-poor-urban-planning-and-bad-land-management-229015,https://theconversation.com/kenyas-devastating-floods-expose-decades-of-poor-urban-planning-and-bad-land-management-229015,0,theconversation.com,Kenya’s devastating floods expose decades of poor urban planning and bad land management,There’s been an increase in the amount of runoff generated from rainfall as land is altered by settlement and deforestation.,https://images.theconversation.com/files/591199/original/file-20240430-18-huzgaf.jpg?ixlib=rb-4.1.0&q=45&auto=format&w=1356&h=668&fit=crop,2024-05-01T09:17:13Z,,Floods in Kenya killed at least 169 people between March and April 2024. The most catastrophic of these deaths occurred after a flash flood swept through a rural village killing 42 people. Death and … [+5762 chars],,en,Rain Kenya,Precipitation,wmo,Kenya,SEAF,Africa
https://www.bbc.co.uk/news/world-africa-68920702,https://www.bbc.co.uk/news/world-africa-68920702,0,www.bbc.co.uk,Floods maroon tourists in Kenya's Maasai Mara,Helicopters have been deployed to evacuate tourists trapped in the famous game reserve.,https://ichef.bbci.co.uk/news/1024/branded_news/5109/production/_133254702_countyz.jpg,2024-05-01T12:32:42Z,,"Tourists are being evacuated from Kenya's popular Maasai Mara game reserve after floods left parts of it submerged. 
More than 10 lodges and camps have been flooded after the nearby Talek River burs… [+1854 chars]",,en,Flood Kenya,Flood,relief,Kenya,SEAF,Africa
https://economictimes.indiatimes.com/news/international/world-news/saudi-arabia-heavy-rains-flood-roads-in-capital-riyadh/videoshow/109757708.cms,https://economictimes.indiatimes.com/news/international/world-news/saudi-arabia-heavy-rains-flood-roads-in-capital-riyadh/videoshow/109757708.cms,0,economictimes.indiatimes.com,Saudi Arabia: Heavy rains flood roads in capital Riyadh,Flash floods inundate roads in Riyadh in the latest instance of heavy rains disrupting life in Saudi Arabia. Saudi Arabian authorities shuttered schools in several regions following flash floods in the desert Gulf. The National Meteorological Centre issued re…,"https://img.etimg.com/thumb/msid-109757708,width-1070,height-580,overlay-economictimes/photo.jpg",2024-05-01T13:15:45Z,,Flash floods inundate roads in Riyadh in the latest instance of heavy rains disrupting life in Saudi Arabia. Saudi Arabian authorities shuttered schools in several regions following flash floods in t… [+427 chars],,en,heavy rain,Precipitation,random,,,
https://www.forbes.com/sites/arielcohen/2024/05/01/elon-musks-hail-mary-in-china/,https://www.forbes.com/sites/arielcohen/2024/05/01/elon-musks-hail-mary-in-china/,0,www.forbes.com,Elon Musk’s Hail Mary In China,Tesla was once the undisputed global leader in electric vehicles. Those days are now distant as the company grapples with mounting competition.,https://imageio.forbes.com/specials-images/imageserve/66321900ad2d968ec6b01b0d/0x0.jpg?format=jpg&height=900&width=1600&fit=bounds,2024-05-01T13:30:00Z,,"Chinese Premier Li Qiang (R) meets Elon Musk, CEO of the U.S. electric carmaker Tesla, in Beijing, ... [+] China, April 28, 2024.
Copyright Wang Ye/Xinhua
Tesla was once the undisputed global leade… [+7194 chars]",,en,hail,Thunderstorm,random,,,
https://phys.org/news/2024-05-kenya-devastating-expose-decades-poor.html,https://phys.org/news/2024-05-kenya-devastating-expose-decades-poor.html,0,phys.org,Kenya's devastating floods expose decades of poor urban planning and bad land management,"Floods in Kenya killed at least 169 people between March and April 2024. The most catastrophic of these deaths occurred after a flash flood swept through a rural village killing 42 people. Death and destruction have also occurred in the capital, Nairobi, a st…",https://scx2.b-cdn.net/gfx/news/hires/2024/flood-kenya.jpg,2024-05-01T14:46:04Z,,"This article has been reviewed according to Science X's 
editorial process
and policies.
Editors have highlighted
the following attributes while ensuring the content's credibility:
fact-checked… [+6046 chars]",,en,Flood Kenya,Flood,relief,Kenya,SEAF,Africa
https://www.irishtimes.com/world/africa/2024/05/01/kenya-flooding-death-toll-rises-to-181-with-homes-and-roads-destroyed/,https://www.irishtimes.com/world/africa/2024/05/01/kenya-flooding-death-toll-rises-to-181-with-homes-and-roads-destroyed/,0,www.irishtimes.com,Kenya: Flooding death toll rises to 181 with homes and roads destroyed,Dozens more killed in neighbouring Tanzania and Burundi as torrential rain washes away infrastructure,https://www.irishtimes.com/resizer/64_iIUNSqUXzONAFqKKTQrnWTAk=/1200x630/filters:format(jpg):quality(70)/cloudfront-eu-central-1.images.arcpublishing.com/irishtimes/OE3D6B4AJVD7PBINZY7EQMLQPM.jpg,2024-05-01T15:04:44Z,,"Floods and landslides across Kenya have killed 181 people since March, with hundreds of thousands forced to leave their homes, the government and Red Cross said on Wednesday, as dozens more were kill… [+1746 chars]",,en,Flood Burundi,Flood,relief,Burundi,SEAF,Africa
https://www.startribune.com/heavy-rains-in-brazils-south-kill-at-least-8-people-leave-21-missing-civil-defense-says/600363021/,https://www.startribune.com/heavy-rains-in-brazils-south-kill-at-least-8-people-leave-21-missing-civil-defense-says/600363021/,0,www.startribune.com,"Heavy rains in Brazil's south kill at least 8 people, leave 21 missing, civil defense says","Heavy rains in Brazil's southern Rio Grande do Sul state have killed at least eight people and left 21 missing since Monday, the country's civil defense said Wednesday.",https://www.startribune.com/static/img/branding/logos/strib-social-card.png?d=1713369823,2024-05-01T15:19:04Z,,"RIO DE JANEIRO Heavy rains in Brazil's southern Rio Grande do Sul state have killed at least eight people and left 21 missing since Monday, the country's civil defense said Wednesday.
An additional … [+1375 chars]",,en,heavy rain,Precipitation,random,,,
https://abcnews.go.com/International/wireStory/heavy-rains-brazils-south-kill-8-people-leave-109827342,https://abcnews.go.com/International/wireStory/heavy-rains-brazils-south-kill-8-people-leave-109827342,0,abcnews.go.com,"Heavy rains in Brazil’s south kill at least 8 people, leave 21 missing, civil defense says",Heavy rains in Brazil’s southern Rio Grande do Sul state have killed at least eight people and left 21 missing since Monday,https://s.abcnews.com/images/US/abc_news_default_2000x2000_update_16x9_992.jpg,2024-05-01T15:34:03Z,,"RIO DE JANEIRO -- Heavy rains in Brazils southern Rio Grande do Sul state have killed at least eight people and left 21 missing since Monday, the country's civil defense said Wednesday.
An additiona… [+1377 chars]",,en,Rain Brazil,Precipitation,wmo,Brazil,SAM,South-America
https://www.cbsnews.com/news/kenya-floods-2024-massai-mara-game-reserve-tourists-trapped-evacuated-by-helicopter/,https://www.cbsnews.com/news/kenya-floods-2024-massai-mara-game-reserve-tourists-trapped-evacuated-by-helicopter/,0,www.cbsnews.com,Tourist camps swept away as Kenya floods hit renowned game park,Kenya's Red Cross says it helped rescue dozens of people from the Maasai Mara game park as deadly floods spreads across the region.,https://assets1.cbsnewsstatic.com/hub/i/r/2024/05/01/bac1ffda-c835-4800-8269-8b22ae11849b/thumbnail/1200x630/8094270cef496c1bfcc315b6963effea/kenya-flood-ap24122452874234.jpg?v=5b44a284b59f1e101ea6bf2f76b493fc,2024-05-01T16:43:12Z,http://archive.md/20240501182914/https://www.cbsnews.com/news/kenya-floods-2024-massai-mara-game-reserve-tourists-trapped-evacuated-by-helicopter/,Johannesburg — Tourists were evacuated by helicopter on Wednesday from Kenya's Maasai Mara National Reserve as devastating flooding in the east African nation hit the renowned wildlife sanctuary. Mor… [+2876 chars],,en,Flood Kenya,Flood,relief,Kenya,SEAF,Africa
https://www.dw.com/en/kenyan-floods-leave-tourists-stranded-at-iconic-maasai-mara/a-68973411,https://www.dw.com/en/kenyan-floods-leave-tourists-stranded-at-iconic-maasai-mara/a-68973411,0,www.dw.com,Kenyan floods leave tourists stranded at iconic Maasai Mara,"The world-famous wildlife reserve is the latest area of Kenya to be affected by torrential rains that have claimed more than 170 lives and displaced more than 195,000 people across the nation.",https://static.dw.com/image/68973159_6.jpg,2024-05-01T19:25:00Z,,"Around 100 tourists were among those stranded in Kenya's Maasai Mara game reserve on Wednesday amid ongoing floods that have devastated the country.
Torrential rains, amplified by the El Nino weathe… [+1572 chars]",,en,Flood Kenya,Flood,relief,Kenya,SEAF,Africa
https://www.foxnews.com/world/heavy-rains-leave-10-dead-southern-brazil,https://www.foxnews.com/world/heavy-rains-leave-10-dead-southern-brazil,0,www.foxnews.com,Heavy rains leave at least 10 dead in southern Brazil,"Heavy rains in Brazil's Rio Grande do Sul state have left at least 10 people dead and 21 others missing since Monday, according to national authorities.",https://static.foxnews.com/foxnews.com/content/uploads/2024/05/brazilian_flag.jpg,2024-05-01T21:08:38Z,,"Heavy rains in Brazils southern Rio Grande do Sul state have killed at least 10 people and left 21 missing since Monday, the country's civil defense said Wednesday.
An additional 11 people were inju… [+1785 chars]",,en,Rain Brazil,Precipitation,wmo,Brazil,SAM,South-America
https://www.sacbee.com/news/california/article288204795.html,https://www.sacbee.com/news/california/article288204795.html,0,www.sacbee.com,"4.1-magnitude earthquake shakes thousands in Southern California, USGS says. ‘Big jolt’","More than 6,000 people from as far away as Palmdale and San Diego reported feeling the tremor to the agency.",https://media.zenfs.com/en/sacramento_bee_mcclatchy_569/5427e1ed39423e455a5db6a4ed68d187,2024-05-01T21:58:51Z,,"A 4.1-magnitude earthquake shook the Southern California area, the U.S. Geological Survey reported.
The nearly 1-mile deep quake hit about 5 1/2 miles southwest from Corona in Riverside County, abou… [+2832 chars]",,en,earthquake,Earthquake,random,,,
https://www.foxnews.com/us/tourists-airlifted-kenyan-reserve-freak-floods-continue,https://www.foxnews.com/us/tourists-airlifted-kenyan-reserve-freak-floods-continue,0,www.foxnews.com,Tourists airlifted from Kenyan reserve as freak floods continue,Tourists were evacuated by air Wednesday from the Maasai Mara national reserve in Kenya as devastating flash floods continued encroaching on the African nation.,https://static.foxnews.com/foxnews.com/content/uploads/2024/05/kenya_flooding.jpg,2024-05-01T22:24:50Z,,"Tourists were evacuated by air from Kenya's Maasai Mara national reserve Wednesday after more than a dozen hotels, lodges and camps were flooded as heavy rains battered the country.
Tourist accommod… [+1589 chars]",,en,Flash Flood Kenya,Precipitation,relief,Kenya,SEAF,Africa
https://www.globalsecurity.org/military/library/news/2024/05/mil-240501-unnews03.htm,https://www.globalsecurity.org/military/library/news/2024/05/mil-240501-unnews03.htm,0,www.globalsecurity.org,"World News in Brief: UN supporting East Africa flood victims, dozens more migrant deaths at sea, disinformation in Myanmar","The UN and humanitarian partners have provided emergency support for over 124,000 people in Kenya, where heavy rains continue to cause chaos, the UN said on Wednesday, as the UN chief extended his condolences to countries across the region where hundreds of l…",,2024-05-02T08:42:37Z,,"1 May 2024 - The UN and humanitarian partners have provided emergency support for over 124,000 people in Kenya, where heavy rains continue to cause chaos, the UN said on Wednesday, as the UN chief ex… [+6004 chars]",,en,Flood Myanmar,Flood,relief,Myanmar,SAS,Asia
https://www.marketscreener.com/quote/stock/SNOW-LAKE-RESOURCES-LTD-129457809/news/Snow-Lake-Views-the-United-States-Law-Banning-Russian-Uranium-Imports-as-Supportive-of-Its-Two-Urani-46602006/,https://www.marketscreener.com/quote/stock/SNOW-LAKE-RESOURCES-LTD-129457809/news/Snow-Lake-Views-the-United-States-Law-Banning-Russian-Uranium-Imports-as-Supportive-of-Its-Two-Urani-46602006/,0,www.marketscreener.com,Snow Lake Views the United States Law Banning Russian Uranium Imports as Supportive of Its Two Uranium Projects,"(marketscreener.com) Snow Lake Resources Ltd., d/b/a Snow Lake Energy believes that The Prohibiting Russian Uranium Imports Act , passed by the United States and banning the import of enriched uranium from Russia into the United States, is supportive of the e…",https://www.marketscreener.com/images/twitter_MS_fdblanc.png,2024-05-02T10:05:07Z,,"Winnipeg, Manitoba--(Newsfile Corp. - May 2, 2024) - Snow Lake Resources Ltd., d/b/a Snow Lake Energy (NASDAQ: LITM) (""Snow Lake"" or the ""Company"") believes that The Prohibiting Russian Uranium Impor… [+8395 chars]",,en,Snow Russia,Snow&Ice,wmo,Russia,ESB,Europe
https://www.rt.com/africa/596868-kenya-flood-death-toll-increases/,https://www.rt.com/africa/596868-kenya-flood-death-toll-increases/,0,www.rt.com,Death toll in flooded Kenya climbs above 180,Kenya’s government has warned of further disruption in the country; 181 have died due to torrential rain Read Full Article at RT.com,https://mf.b37mrtl.ru/files/2024.05/article/663363c385f54032cc5a2d9e.jpg,2024-05-02T10:12:29Z,,"More than 180 people have been killed and thousands of others displaced amid heavy flooding and landslide disasters across Kenya since March, the East African nation’s government and the Red Cross re… [+2006 chars]",,en,Flood Kenya,Flood,relief,Kenya,SEAF,Africa
https://www.ibtimes.com/kenya-floods-death-toll-rises-188-heavy-rains-persist-3731101,https://www.ibtimes.com/kenya-floods-death-toll-rises-188-heavy-rains-persist-3731101,0,www.ibtimes.com,Kenya Floods Death Toll Rises To 188 As Heavy Rains Persist,"The number of people who have lost their lives in devastating floods in Kenya since March has risen to 188, with dozens still missing, the interior ministry said on Thursday.",https://d.ibtimes.com/en/full/4524339/nairobi-slum-mathare-suffered-heavy-flooding.jpg,2024-05-02T11:21:10Z,,"The number of people who have lost their lives in devastating floods in Kenya since March has risen to 188, with dozens still missing, the interior ministry said on Thursday.
Torrential rains in Ken… [+3679 chars]",,en,Flood Kenya,Flood,relief,Kenya,SEAF,Africa
https://www.bbc.co.uk/news/av/world-africa-68943941,https://www.bbc.co.uk/news/av/world-africa-68943941,0,www.bbc.co.uk,‘What do I do now that my sons have been swept away?’,Two of Grishon Waiganjo's sons were swept away in recent flooding in Kenya that has killed hundreds of people.,https://ichef.bbci.co.uk/news/1024/branded_news/4FC0/production/_133261402_p0hvk8qg.jpg,2024-05-02T11:40:26Z,,"Grishon Waiganjo lost two sons in recent flooding in Kenya which has seen many parts of the country inundated and struggling to cope.
Hundreds of people are now known to have died, and nearly 200,00… [+84 chars]",,en,flooding,Flood,random,,,
https://www.ozbargain.com.au/node/843977,https://www.ozbargain.com.au/node/843977,0,www.ozbargain.com.au,Free Entry Ticket to Snow Travel Expo in Melbourne and Sydney,"Free Ticketed Entry to the Snow Travel Expo
Melbourne 19 May 9 am to 4 pm
MCEC, Southbank Door 10
Sydney 26 May 9 am to 4 pm
ICC Sydney, Darling Harbour Hall 7

Register at: https://snowtravelexpo.com.au/

Meet 70+ Global Resorts; Japan, Canada, USA, Europe, …",https://files.ozbargain.com.au/n/77/843977x.jpg?h=da348e0e,2024-05-02T11:45:48Z,,"Free Ticketed Entry to the Snow Travel ExpoMelbourne 19 May 9 am to 4 pmMCEC, Southbank Door 10Sydney 26 May 9 am to 4 pmICC Sydney, Darling Harbour Hall 7
Register at: https://snowtravelexpo.com.au… [+243 chars]",,en,Snow Canada,Snow&Ice,wmo,Canada,NEN,North-America
https://phys.org/news/2024-05-kenya-death-toll-heavy-persist.html,https://phys.org/news/2024-05-kenya-death-toll-heavy-persist.html,0,phys.org,Kenya floods death toll rises to 188 as heavy rains persist,"The number of people who have lost their lives in devastating floods in Kenya since March has risen to 188, with dozens still missing, the interior ministry said on Thursday.",https://scx2.b-cdn.net/gfx/news/2024/dozens-of-villagers-di.jpg,2024-05-02T11:57:43Z,,"The number of people who have lost their lives in devastating floods in Kenya since March has risen to 188, with dozens still missing, the interior ministry said on Thursday.
Torrential rains in Ken… [+4049 chars]",,en,Flood Kenya,Flood,relief,Kenya,SEAF,Africa
https://www.voanews.com/a/kenya-floods-death-toll-rises-to-188-as-heavy-rains-persist-/7594872.html,https://www.voanews.com/a/kenya-floods-death-toll-rises-to-188-as-heavy-rains-persist-/7594872.html,0,www.voanews.com,Kenya floods death toll rises to 188 as heavy rains persist,"Nairobi — The number of people who have lost their lives in devastating floods in Kenya since March has risen to 188, with dozens still missing, the interior ministry said on Thursday.



Torrential rains in Kenya and other countries in East Africa have cause…",https://gdb.voanews.com/4EB92904-2E67-430A-887F-3AA53B63D628.jpg,2024-05-02T12:37:10Z,,"Nairobi  The number of people who have lost their lives in devastating floods in Kenya since March has risen to 188, with dozens still missing, the interior ministry said on Thursday.
Torrential rai… [+3786 chars]",,en,Flood Kenya,Flood,relief,Kenya,SEAF,Africa
https://www.cbsnews.com/news/heat-wave-asia-2024-deaths-india-severe-weather-climate-change/,https://www.cbsnews.com/news/heat-wave-asia-2024-deaths-india-severe-weather-climate-change/,0,www.cbsnews.com,"Summer heat waves already deadly in Asia, and it's still spring","Much of Asia is sweltering under a heat wave that one expert calls ""by far the most extreme event in world climatic history.""",https://assets3.cbsnewsstatic.com/hub/i/r/2024/05/02/ae19733b-0ff3-4415-b64d-22d25d7034b0/thumbnail/1200x630g8/0109c43e4e9c651203b459b9c6ff5d0a/india-heat-wave-2024-2150522006.jpg?v=1d6c78a71b7b6252b543a329b3a5744d,2024-05-02T12:37:58Z,http://archive.md/20240502183655/https://www.cbsnews.com/news/heat-wave-asia-2024-deaths-india-severe-weather-climate-change/,"New Delhi — It's still spring but hundreds of millions of people across South and Southeast Asia have already faced scorching hot temperatures. The summer heat has arrived early, setting records and … [+6939 chars]",,en,heat,Heat Wave,random,,,
https://www.ibtimes.com.au/kenya-floods-death-toll-rises-188-heavy-rains-persist-1847868,https://www.ibtimes.com.au/kenya-floods-death-toll-rises-188-heavy-rains-persist-1847868,0,www.ibtimes.com.au,Kenya Floods Death Toll Rises To 188 As Heavy Rains Persist,"The number of people who have lost their lives in devastating floods in Kenya since March has risen to 188, with dozens still missing, the interior ministry said on Thursday.",https://d.ibtimes.com.au/en/full/1848982/nairobi-slum-mathare-suffered-heavy-flooding.jpg,2024-05-02T13:13:12Z,,"The number of people who have lost their lives in devastating floods in Kenya since March has risen to 188, with dozens still missing, the interior ministry said on Thursday.
Torrential rains in Ken… [+3679 chars]",,en,Flood Kenya,Flood,relief,Kenya,SEAF,Africa
https://www.marketscreener.com/quote/commodity/WTI-2355639/news/ICE-Canada-Morning-Comment-More-Advances-for-Canola-46606683/,https://www.marketscreener.com/quote/commodity/WTI-2355639/news/ICE-Canada-Morning-Comment-More-Advances-for-Canola-46606683/,0,www.marketscreener.com,ICE Canada Morning Comment: More Advances for Canola,"(marketscreener.com) 
 WINNIPEG, Manitoba--Intercontinental Exchange canola futures were higher Thursday morning, building on Wednesday's gains. 

 Increases in the Chicago soy complex, European rapeseed and Malaysian palm oil lent support to the Canadian oil…",https://www.marketscreener.com/images/reuters/2016-11-10T015815Z_1006950001_LYNXMPECA902D_RTROPTP_2_CBUSINESS-US-GLOBAL-OIL.JPG,2024-05-02T14:03:26Z,,"WINNIPEG, Manitoba--Intercontinental Exchange canola futures were higher Thursday morning, building on Wednesday's gains. 
Increases in the Chicago soy complex, European rapeseed and Malaysian palm … [+995 chars]",,en,Ice Canada,Snow&Ice,wmo,Canada,NEN,North-America
https://press.un.org/en/2024/sgsm22211.doc.htm,https://press.un.org/en/2024/sgsm22211.doc.htm,0,press.un.org,"Secretary-General Extends Condolences to Governments, People of East Africa Affected by Heavy Flooding",The following statement was issued today by the Spokesman for UN Secretary-General António Guterres:,,2024-05-02T15:52:18Z,,"The following statement was issued today by the Spokesman for UN Secretary-General António Guterres:
The Secretary-General is deeply distressed to hear of the hundreds of lives lost and many others … [+701 chars]",,en,flooding,Flood,random,,,
https://www.bbc.co.uk/news/articles/c72plp66g5no,https://www.bbc.co.uk/news/articles/c72plp66g5no,0,www.bbc.co.uk,Kenya orders flood evacuations as it warns dams could spill,Residents near 178 bodies of water have been told to leave as flooding is set to worsen.,https://ichef.bbci.co.uk/news/1024/branded_news/b086/live/a76a4b50-08c7-11ef-b89c-3bf358a2ed5f.jpg,2024-05-02T21:38:15Z,,"It stressed that the evacuations should not take place at night, but begin from 06:00 on Friday.
The ministry added that it had established temporary shelters, food and essentials for evacuees, whic… [+1269 chars]",,en,Flooding Kenya,Flood,relief,Kenya,SEAF,Africa
