index,url,valid,domain,title,description,image,published,archive,content,quote,language,term,topic,feed,country,ipcc,continent
https://checkyourfact.com/2024/11/04/fact-check-recent-spain-flood/,https://checkyourfact.com/2024/11/04/fact-check-recent-spain-flood/,0,checkyourfact.com,FACT CHECK: Does Video Show A Recent Flood In Spain?,"A post shared on social media purportedly shows a video of a massive flood that occurred in Spain recently. Verdict: Misleading The video is from 2023. Fact Check: Clay Aiken and Tyler Hubbard are set to perform during a hurricane relief benefit broadcast, CB…",https://cdn01.dailycaller.com/wp-content/uploads/2024/10/GettyImages-2177097692-scaled-e1728654984613.jpg,2024-11-04T14:58:35Z,,"A post shared on social media purportedly shows a video of a massive flood that occurred in Spain recently.
Verdict: Misleading
The video is from 2023.
Fact Check:
Clay Aiken and Tyler Hubbard ar… [+1213 chars]",,en,Flood Spain,Flood,cmeter,Spain,MED,Europe
https://www.espn.com/soccer/story/_/id/42189336/copa-del-rey-games-postponed-again-due-spain-floods,https://www.espn.com/soccer/story/_/id/42189336/copa-del-rey-games-postponed-again-due-spain-floods,0,www.espn.com,Spain floods see Copa games postponed again,Five of seven Copa del Rey matches have been postponed again by the Spanish football federation after Spain's worst flash floods in modern history killed at least 217 people.,https://a.espncdn.com/combiner/i?img=%2Fphoto%2F2024%2F1104%2Fr1410280_1296x729_16%2D9.jpg,2024-11-04T15:39:02Z,,"Five Copa del Rey games which were postponed after deadly flooding in Valencia have been rescheduled for a second time, as recovery efforts continue in the region.
The first round matches -- includi… [+1343 chars]",,en,Flood Spain,Flood,cmeter,Spain,MED,Europe
https://oilprice.com/Geopolitics/Middle-East/Is-This-The-Eye-Of-The-Coming-Israeli-Storm-Of-Attacks-Directly-On-Iran.html,https://oilprice.com/Geopolitics/Middle-East/Is-This-The-Eye-Of-The-Coming-Israeli-Storm-Of-Attacks-Directly-On-Iran.html,0,oilprice.com,Is This The Eye Of The Coming Israeli Storm Of Attacks Directly On Iran?,"In recent weeks, Israel has neutralised all the top leadership of Iran’s key proxy terrorist organisations Hamas and Hezbollah which pose the main local threat to its territory. It has done the same with several top leaders in Iran’s own Islamic Revolutionary…",https://d32r1sh890xpii.cloudfront.net/article/718x300/2024-11-04_rnruao4qvy.jpg,2024-11-04T16:00:00Z,,"The parallels between the onset…
Chinas largesse when it comes…
The U.S. can help Iraq…
By Simon Watkins - Nov 04, 2024, 10:00 AM CSTIn recent weeks, Israel has neutralised all the top leadership … [+8875 chars]",,en,storm,Storm,random,,,
https://www.livescience.com/planet-earth/weather/earth-from-space-watch-valencia-disappear-under-a-sea-of-mud-during-deadly-spanish-floods,https://www.livescience.com/planet-earth/weather/earth-from-space-watch-valencia-disappear-under-a-sea-of-mud-during-deadly-spanish-floods,0,www.livescience.com,Earth from space: Watch Valencia disappear under a sea of mud during deadly Spanish floods,Satellite images show the true extent of the flash flooding in Valencia during a freak weather event that killed at least 214 people across Spain.,https://cdn.mos.cms.futurecdn.net/irPGsp9cthzxYiXJn5JDDk-1200-80.jpg,2024-11-04T16:32:30Z,http://wayback.archive-it.org/all/20241106232520/https://www.livescience.com/planet-earth/weather/earth-from-space-watch-valencia-disappear-under-a-sea-of-mud-during-deadly-spanish-floods,"Where is it? Valencia, Spain [39.41027594, -0.3414715083]
What's in the photo? Muddy flood water covering large parts of the city
Which satellite took the photo? Landsat 8
When was it taken? Oct. … [+3253 chars]",,en,flash flood,Flood,random,,,
https://www.aljazeera.com/news/2024/11/4/late-season-caribbean-hurricane-expected-to-hit-cuba-this-week,https://www.aljazeera.com/news/2024/11/4/late-season-caribbean-hurricane-expected-to-hit-cuba-this-week,0,www.aljazeera.com,Late-season Caribbean hurricane expected to hit Cuba this week,"If it forms, Rafael would be the 11th hurricane of the 2024 season and could strike western Cuba as a Category 1 storm.",https://www.aljazeera.com/wp-content/uploads/2024/11/AP24308803352697-1730735319.jpg?resize=1920%2C1440,2024-11-04T16:43:30Z,,"Miami, Florida, United States A hurricane is expected to form in the Caribbean and bring heavy rain and mudslides to Cuba before heading into the warm waters of the Gulf of Mexico, according to the U… [+2825 chars]",,en,hurricane,Tropical Cyclone,random,,,
https://www.thestar.com.my/news/world/2024/11/05/cuba-braces-for-second-hurricane-amid-power-crisis,https://www.thestar.com.my/news/world/2024/11/05/cuba-braces-for-second-hurricane-amid-power-crisis,0,www.thestar.com.my,Cuba braces for second hurricane amid power crisis,HAVANA (Reuters) - Cuba began preparing on Monday for the predicted arrival of a strengthening tropical depression in the southern Caribbean Sea even as emergency workers are still responding to a nationwide blackout and hurricane just two weeks before. Read …,https://apicms.thestar.com.my/uploads/images/2024/11/05/3000849.jpg,2024-11-04T17:03:00Z,,HAVANA (Reuters) - Cuba began preparing on Monday for the predicted arrival of a strengthening tropical depression in the southern Caribbean Sea even as emergency workers are still responding to a na… [+1919 chars],,en,hurricane,Tropical Cyclone,random,,,
https://www.insurancejournal.com/news/southeast/2024/11/04/799986.htm,https://www.insurancejournal.com/news/southeast/2024/11/04/799986.htm,0,www.insurancejournal.com,Will People Leave Florida After Hurricanes? History Suggests Not,"ORLANDO, Fla. (AP) — The news rippled through Treasure Island, Florida, almost like a third storm: The mayor planned to move off the barrier island a month after Hurricane Helene flooded tens of thousands of homes along the Gulf Coast …",https://www.insurancejournal.com/app/uploads/2024/11/treasure-island-sand.jpg,2024-11-04T17:47:44Z,,"ORLANDO, Fla. (AP) The news rippled through Treasure Island, Florida, almost like a third storm: The mayor planned to move off the barrier island a month after Hurricane Helene flooded tens of thousa… [+6018 chars]",,en,Florida Hurricane Helene,Tropical Cyclone,fema,United States,ENA,North-America
https://www.yahoo.com/news/where-hurricane-rafael-likely-hit-184032310.html,https://www.yahoo.com/news/where-hurricane-rafael-likely-hit-184032310.html,0,www.yahoo.com,"Here’s Where Hurricane Rafael Is Likely To Hit The US, Models Say","The storm is heading to these states. The post Here’s Where Hurricane Rafael Is Likely To Hit The US, Models Say appeared first on Mandatory.",https://media.zenfs.com/en/mandatory_995/8dbe0c6196116777f7b2b16a5463688b,2024-11-04T18:40:32Z,,"The strength of Hurricane Rafael, which is projected to develop from Tropical Depression 18 in the Caribbean, has been steadily building over the weekend. Since Fridays predictions, various models an… [+1882 chars]",,en,hurricane,Tropical Cyclone,random,,,
https://gcaptain.com/late-season-hurricane-could-hit-gulf-oil-and-gas-production/,https://gcaptain.com/late-season-hurricane-could-hit-gulf-oil-and-gas-production/,0,gcaptain.com,Late-Season Hurricane Could Hit Gulf Oil and Gas Production,"An are of thunderstorms south of Jamaica is forecast to intensify into Tropical Storm Rafael some time Monday, with further strengthening into a hurricane expected by late Tuesday as it...",https://gcaptain.com/wp-content/uploads/2024/11/180231_5day_cone_no_line_and_wind.png,2024-11-04T18:50:09Z,,"An are of thunderstorms south of Jamaica is forecast to intensify into Tropical Storm Rafael some time Monday, with further strengthening into a hurricane expected by late Tuesday as it moves over th… [+2358 chars]",,en,Storm Jamaica,Storm,wmo,Jamaica,CAR,North-America
https://www.newsweek.com/full-list-tornado-warning-texas-oklahoma-1980026,https://www.newsweek.com/full-list-tornado-warning-texas-oklahoma-1980026,0,www.newsweek.com,Tornado watch: Full List of Oklahoma and Texas Counties on Alert,"Until 6 p.m. CST on Monday, 24 counties in Texas and 40 in Oklahoma will be under a tornado warning.",https://d.newsweek.com/en/full/2512055/nws-oklahoma-tornado.png,2024-11-04T20:53:15Z,,"A tornado warning has been issued across Texas and Oklahoma, with the National Weather Service (NWS) warning residents to take cover immediately.
The Texan counties currently under a tornado watch w… [+3405 chars]",,en,tornado,Storm,random,,,
https://gizmodo.com/after-hurricane-helenes-destruction-voters-in-key-swing-states-are-showing-up-in-force-2000520345,https://gizmodo.com/after-hurricane-helenes-destruction-voters-in-key-swing-states-are-showing-up-in-force-2000520345,0,gizmodo.com,"After Hurricane Helene’s Destruction, Voters in Key Swing States Are Showing Up in Force",Record early voting in Georgia and North Carolina highlights the storm’s impact and the high stakes of the election.,https://gizmodo.com/app/uploads/2024/11/voting-presidential-election.jpg,2024-11-04T21:00:44Z,,"Its been a little over a month since Hurricane Helene ripped through the southeastern United States, claiming hundreds of lives and causing an estimated $53 billion dollars in damages. In addition to… [+7328 chars]",,en,hurricane,Tropical Cyclone,random,,,
https://www.nbcnews.com/weather/hurricanes/tropical-storm-rafael-forms-expected-hurricane-rcna178632,https://www.nbcnews.com/weather/hurricanes/tropical-storm-rafael-forms-expected-hurricane-rcna178632,0,www.nbcnews.com,Tropical Storm Rafael forms in the Caribbean and is expected to become a hurricane,Tropical Storm Rafael formed in the Caribbean on Monday and is forecast to become a hurricane on Tuesday. It could approach the U.S. by mid to late week.,"https://media-cldnry.s-nbcnews.com/image/upload/t_nbcnews-fp-1200-630,f_auto,q_auto:best/rockcms/2024-11/241104-tropical-storm-rafael-se-1106a-985635.jpg",2024-11-04T21:33:21Z,,"A disturbance in the Caribbean strengthened into Tropical Storm Rafael on Monday afternoon. The storm is forecast to become a hurricane on Tuesday. 
Rafael, previously known as Potential Tropical Cy… [+2132 chars]",,en,tropical storm,Tropical Cyclone,random,,,
https://press.un.org/en/2024/db241104.doc.htm,https://press.un.org/en/2024/db241104.doc.htm,0,press.un.org,Daily Press Briefing by the Office of the Spokesperson for the Secretary-General,"In West and Central Africa, the Office for the Coordination of Humanitarian Affairs reports that the region continues to experience catastrophic flooding, with more than 7 million people impacted across 16 countries. Chad, Niger, Nigeria and the Democratic Re…",,2024-11-04T21:34:14Z,,"The following is a near-verbatim transcript of todays noon briefing by Stéphane Dujarric, Spokesman for the Secretary-General.
**Briefing Today
Just back to our usual programming.  Just to say that… [+22409 chars]",,en,Flood Nigeria,Flood,relief,Nigeria,WAF,Africa
https://www.cbc.ca/news/world/cuba-tropical-depression-rafael-1.7373386,https://www.cbc.ca/news/world/cuba-tropical-depression-rafael-1.7373386,0,www.cbc.ca,"Tropical storm Rafael predicted to strengthen, likely hit Cuba as hurricane","The storm formed Monday in the Caribbean and will bring heavy rain to Jamaica and the Cayman Islands before strengthening into a hurricane and likely hitting Cuba, forecasters said.",https://i.cbc.ca/1.7373411.1730755582!/fileImage/httpImage/image.JPG_gen/derivatives/16x9_620/2-residents-of-playa-baracoa-cuba-watch-tv-news-program.JPG,2024-11-04T22:19:34Z,,"Tropical storm Rafael formed Monday in the Caribbean and will bring heavy rain to Jamaica and the Cayman Islands before strengthening into a hurricane and likely hitting Cuba, forecasters said.
Late… [+3205 chars]",,en,Storm Jamaica,Storm,wmo,Jamaica,CAR,North-America
https://radaronline.com/p/donald-trump-victory-branded-five-alarm-five-robert-reich/,https://radaronline.com/p/donald-trump-victory-branded-five-alarm-five-robert-reich/,0,radaronline.com,Trump Victory Branded a 'Five-Alarm Fire' and 'Category 5 Hurricane' By One of America's Greatest Political Strategists: 'He's the Bully of all Bullies',Political strategist Robert Reich warned U.S. voters to not sit out the election as he called Donald Trump a 'bully' and threat to democracy.,https://media.radaronline.com/brand-img/KBA_nCipz/1200x628/donald-trump-ex-advisers-brand-him-fascist-1-1730764194037.png,2024-11-05T01:45:00Z,,"In a new op-ed, Reich detailed how dangerous he viewed the ex-president, who has been branded a ""fascist"" by his former chief of staff, John Kelly, as well as his former chairman of the Joint Chiefs … [+342 chars]",,en,hurricane,Tropical Cyclone,random,,,
https://www.dailysignal.com/2024/11/04/stay-strong-hill-country-one-volunteers-perspective-devastation-north-carolina-hurricane-helene/,https://www.dailysignal.com/2024/11/04/stay-strong-hill-country-one-volunteers-perspective-devastation-north-carolina-hurricane-helene/,0,www.dailysignal.com,‘Stay Strong Hill Country’: One Volunteer’s Perspective on the Devastation in North Carolina After Hurricane Helene,"Beside a lonely road in Boone, North Carolina, Styrofoam stood, balanced on cardboard and weighed down by a rock. Scrawled on it in faded black,... Read More
The post ‘Stay Strong Hill Country’: One Volunteer’s Perspective on the Devastation in North Carolina…",https://www.dailysignal.com/wp-content/uploads/2024/11/Helene-victim.jpg,2024-11-05T02:22:00Z,,"Beside a lonely road in Boone, North Carolina, Styrofoam stood, balanced on cardboard and weighed down by a rock. Scrawled on it in faded black, yellow, and orange markers read the message, I thank t… [+3957 chars]",,en,hurricane,Tropical Cyclone,random,,,
https://www.espn.com/mens-college-basketball/story/_/id/42198059/men-college-basketball-day-1-reactions-teams-players-storylines-watching,https://www.espn.com/mens-college-basketball/story/_/id/42198059/men-college-basketball-day-1-reactions-teams-players-storylines-watching,0,www.espn.com,"Men's hoops Day 1 takeaways: Flagg, Kansas, court-storming and more","A slow burn in the Duke phenom's college debut, plus the first court-storm, other impressive freshmen, and more from the 2024-25 season's opening night.",https://a.espncdn.com/combiner/i?img=%2Fphoto%2F2024%2F1105%2Fr1410540_1296x729_16%2D9.jpg,2024-11-05T03:31:56Z,,"And just like that, we're back. The 2024-25 men's college basketball season began Monday, as some of the top teams in America, impactful transfers and new faces made their debuts. We could have calle… [+12668 chars]",,en,storm,Storm,random,,,
https://www.insurancejournal.com/news/southcentral/2024/11/05/800090.htm,https://www.insurancejournal.com/news/southcentral/2024/11/05/800090.htm,0,www.insurancejournal.com,"Severe Storms and Tornadoes Hit Oklahoma, Leaving 11 Hospitalized","OKLAHOMA CITY (AP) — Severe storms and tornadoes battered Oklahoma early Sunday, tossing cars and ripping roofs off buildings in the middle of the night and leaving tens of thousands of homes and businesses without power. Among numerous injuries, 11 …",https://www.insurancejournal.com/app/uploads/2024/11/AP24309097153028-scaled.jpg,2024-11-05T05:10:05Z,,"OKLAHOMA CITY (AP) Severe storms and tornadoes battered Oklahoma early Sunday, tossing cars and ripping roofs off buildings in the middle of the night and leaving tens of thousands of homes and busin… [+3658 chars]",,en,storm,Storm,random,,,
https://www.voanews.com/a/tropical-storm-rafael-forms-in-the-caribbean-and-could-hit-cuba-as-a-hurricane/7851785.html,https://www.voanews.com/a/tropical-storm-rafael-forms-in-the-caribbean-and-could-hit-cuba-as-a-hurricane/7851785.html,0,www.voanews.com,Tropical Storm Rafael forms in the Caribbean and could hit Cuba as a hurricane,"SAN JUAN, Puerto Rico — Tropical Storm Rafael formed Monday in the Caribbean and will bring heavy rain to Jamaica and the Cayman Islands before strengthening into a hurricane and likely hitting Cuba, forecasters said.


Later in the week it also is expected t…",https://gdb.voanews.com/ad307d4e-7f03-4d70-a8a2-2418096f6670_cx0_cy10_cw0_w1200_r1.jpg,2024-11-05T07:08:49Z,,"SAN JUAN, Puerto Rico  Tropical Storm Rafael formed Monday in the Caribbean and will bring heavy rain to Jamaica and the Cayman Islands before strengthening into a hurricane and likely hitting Cuba, … [+2699 chars]",,en,Storm Cuba,Storm,emdat,Cuba,CAR,North-America
https://www.cnn.com/2024/11/05/us/tropical-storm-rafael-forecast-hurricane-hnk/index.html,https://www.cnn.com/2024/11/05/us/tropical-storm-rafael-forecast-hurricane-hnk/index.html,0,www.cnn.com,Tropical Storm Rafael to become a hurricane before Cuba landfall Wednesday | CNN,"While Tropical Storm Rafael winds remained consistent Monday night, the storm is forecast to strengthen Tuesday and become a hurricane Wednesday, bringing destructive winds and heavy rainfall to the western Caribbean and southern Florida by midweek.","https://media.cnn.com/api/v1/images/stellar/prod/2024-11-04t200207z-1812715103-rc2hyaa0mdu8-rtrmadp-3-storm-rafael-cuba.jpg?c=16x9&q=w_800,c_fill",2024-11-05T07:35:06Z,http://archive.md/20241105155511/https://www.cnn.com/2024/11/05/us/tropical-storm-rafael-forecast-hurricane-hnk/index.html,"Tropical Storm Rafael has begun to strengthen in the Caribbean Sea, and it is expected to reach hurricane strength by Wednesday and bring destructive winds and heavy rainfall to the region.
Rafael w… [+3639 chars]",,en,Tropical Storm Rafael,Tropical Cyclone,eonet,,CAR,North-America
https://www.newsweek.com/tropical-storm-rafael-path-update-tracker-warning-florida-1980211,https://www.newsweek.com/tropical-storm-rafael-path-update-tracker-warning-florida-1980211,0,www.newsweek.com,"Tropical Storm Rafael Path Update, Tracker as Warning Issued to Florida",The severe weather system is expected to intensify rapidly in the coming days as it approaches the mainland U.S.,https://d.newsweek.com/en/full/2512368/rafael-map.png,2024-11-05T09:14:02Z,,"The 17th named storm of the 2024 Atlantic hurricane season, Tropical Storm Rafael, has formed in the Atlantic Ocean and is expected to intensify into a hurricane this week.
The storm is predicted to… [+3820 chars]",,en,Tropical Storm Rafael,Tropical Cyclone,eonet,,CAR,North-America
https://biztoc.com/x/bac7d11913df6ed9,https://biztoc.com/x/bac7d11913df6ed9,0,biztoc.com,Spain approves €10.6B in flood relief,Spanish Prime Minister Pedro Sanchez announced on Tuesday a package worth €10.6 billion for those impacted by deadly floods that hit the country last week. The decision follows unrest and anger direct...,https://biztoc.com/cdn/bac7d11913df6ed9_s.webp,2024-11-05T13:50:15Z,,Spanish Prime Minister Pedro Sanchez announced on Tuesday a package worth 10.6 billion for those impacted by deadly floods that hit the country last week. The decision follows unrest and anger direct… [+68 chars],,en,Flood Spain,Flood,cmeter,Spain,MED,Europe
https://abcnews.go.com/US/developing-storm-rafael-hit-gulf-coast-week-latest/story?id=115462321,https://abcnews.go.com/US/developing-storm-rafael-hit-gulf-coast-week-latest/story?id=115462321,0,abcnews.go.com,"Tropical Storm Rafael slams Caribbean, may head to Gulf Coast this weekend",Tropical Storm Rafael is barreling through the Caribbean and may impact the U.S. Gulf Coast this weekend.,https://i.abcnewsfe.com/a/90fde277-2186-4e78-a4bd-c1d3f4b861bd/rafael-ht-bb-241105_1730812880169_hpMain_16x9.jpg?w=1600,2024-11-05T14:10:15Z,http://wayback.archive-it.org/all/20241105151434/https://abcnews.go.com/US/developing-storm-rafael-hit-gulf-coast-week-latest/story?id=115462321,"Tropical Storm Rafael is barreling through the Caribbean and may impact the U.S. Gulf Coast this weekend.
Rafael is bringing gusty winds and heavy rain to Jamaica on Tuesday morning.
The storm is f… [+743 chars]",,en,storm,Storm,random,,,
https://www.gadgets360.com/science/news/hunga-volcano-eruption-2022-public-observations-aid-scientific-data-on-tonga-eruptions-global-impact-6941086,https://www.gadgets360.com/science/news/hunga-volcano-eruption-2022-public-observations-aid-scientific-data-on-tonga-eruptions-global-impact-6941086,0,www.gadgets360.com,How the Tonga volcano eruption's shockwave taught us about geohazards,"The Hunga volcano eruption near Tonga on January 15, 2022, sent shockwaves and tsunamis across the globe, creating low, booming sounds heard as far away as Alaska. In New Zealand, more than 2,100 public observations of the eruption, from rumbling sounds to an…",https://i.gadgets360cdn.com/large/4-nov_artical_1_full_img_1730716378772.jpg,2024-11-05T14:30:01Z,,"On January 15, 2022, the Hunga volcano near Tonga erupted in an explosive event that sent shockwaves across the planet. The eruption happened around the same time as Cyclone Cody. It created a shockw… [+1921 chars]",,en,volcano,Volcano,random,,,
https://www.disneyfoodblog.com/2024/11/05/national-hurricane-center-warns-caribbean-and-southern-florida-to-brace-for-tropical-storm-rafael/,https://www.disneyfoodblog.com/2024/11/05/national-hurricane-center-warns-caribbean-and-southern-florida-to-brace-for-tropical-storm-rafael/,0,www.disneyfoodblog.com,National Hurricane Center Warns Caribbean and Southern Florida to Brace for Tropical Storm Rafael,"Warnings are in place throughout the Caribbean, as well as parts of Florida.
The post National Hurricane Center Warns Caribbean and Southern Florida to Brace for Tropical Storm Rafael first appeared on the disney food blog.",https://www.disneyfoodblog.com/wp-content/uploads/2024/11/national-hurricane-center-rafael-projection-2024-700x574.png,2024-11-05T15:25:35Z,,"A potentially dangerous storm is brewing in the Atlantic.
©National Hurricane Center
While the Atlantic Hurricane Season is technically almost over (technically ending November 30th), that doesnt m… [+2085 chars]",,en,Storm Florida,Storm,fema,United States,ENA,North-America
https://www.ibtimes.com/late-season-storm-expected-strengthen-hurricane-3749590,https://www.ibtimes.com/late-season-storm-expected-strengthen-hurricane-3749590,0,www.ibtimes.com,Late Season Storm Expected To Strengthen Into Hurricane,A tropical storm that's headed towards Jamaica is expected to strengthen into a hurricane by Wednesday.,https://d.ibtimes.com/en/full/4559300/storm-surge.jpg,2024-11-05T15:43:22Z,,"Tropical storm Rafael is currently passing southwest of Jamaica and expected to strengthen into a hurricane.
A hurricane warning is in effect for the Cayman Islands, parts of Cuba (such as the provi… [+1780 chars]",,en,Storm Jamaica,Storm,wmo,Jamaica,CAR,North-America
https://www.aljazeera.com/news/2024/11/5/rafael-expected-to-strengthen-into-hurricane-before-making-landfall-in-cuba,https://www.aljazeera.com/news/2024/11/5/rafael-expected-to-strengthen-into-hurricane-before-making-landfall-in-cuba,0,www.aljazeera.com,Rafael expected to strengthen into hurricane before making landfall in Cuba,Tropical Storm Rafael is set to become a hurricane near the Cayman Islands on Tuesday night before reaching Cuba.,https://www.aljazeera.com/wp-content/uploads/2024/11/145218_5day_cone_no_line_and_wind-1730820680.png?resize=1200%2C675,2024-11-05T16:11:36Z,,"Tropical Storm Rafael is expected to strengthen into a hurricane in the northwestern Caribbean near the Cayman Islands with further strengthening anticipated before it makes landfall in Cuba, the Uni… [+4123 chars]",,en,Storm Cuba,Storm,emdat,Cuba,CAR,North-America
https://www.newsherald.com/story/news/local/2024/11/05/tropical-storm-rafael-impacts-for-panama-city-updates-on-nov-5-2024/76066316007/,https://www.newsherald.com/story/news/local/2024/11/05/tropical-storm-rafael-impacts-for-panama-city-updates-on-nov-5-2024/76066316007/,0,www.newsherald.com,How will Tropical Storm Rafael affect Panama City and Bay County? Here's the latest.,"Potential impacts from Tropical Storm Rafael on Panama City Beach as of Nov. 5, 2024.",https://media.zenfs.com/en/panama-city-news-herald/82d67676e2852aa99914228fbfc27927,2024-11-05T16:35:34Z,https://web.archive.org/web/20241106215336/https://www.newsherald.com/story/news/local/2024/11/05/tropical-storm-rafael-impacts-for-panama-city-updates-on-nov-5-2024/76066316007/,"Today may be Election Day, but Bay County residents are keeping a wary eye on Tropical Storm Rafael.
The county still sits well outside of the National Hurricane Center's cone of uncertainty. The ea… [+7168 chars]",,en,storm,Storm,random,,,
https://www.newsweek.com/tropical-storm-rafael-project-path-shift-1980556,https://www.newsweek.com/tropical-storm-rafael-project-path-shift-1980556,0,www.newsweek.com,Tropical Storm Rafael's Projected Path Shifts,"New ""spaghetti"" mapping suggests the storm may move up eastward toward Alabama and Georgia.",https://d.newsweek.com/en/full/2512799/tropical-tidbits-2.png,2024-11-05T16:49:43Z,,"Storm Rafael's projected path appears to have shifted, according to new hurricane ""spaghetti"" models.
Rafael formed over the Caribbean yesterday and is predicted to reach hurricane intensity tonight… [+3547 chars]",,en,Storm Alabama,Storm,fema,United States,ENA,North-America
