index,url,valid,domain,title,description,image,published,archive,content,quote,language,term,topic,feed,country,ipcc,continent
https://www.bostonglobe.com/2024/01/05/metro/mass-residents-urged-to-use-caution-during-weekend-storm/,https://www.bostonglobe.com/2024/01/05/metro/mass-residents-urged-to-use-caution-during-weekend-storm/,0,www.bostonglobe.com,Mass. residents urged to use caution during weekend storm,Boston and state officials on Friday urged Massachusetts residents to exercise caution during an expected weekend storm that could drop a couple of inches of snow on Boston and up to a foot on other parts of the Commonwealth.,https://bostonglobe-prod.cdn.arcpublishing.com/resizer/EA5UpPek1FxraHJssDerasRRRFo=/506x0/cloudfront-us-east-1.images.arcpublishing.com/bostonglobe/XUDILUZZ5IC5WOFV53JTLYVHZY.jpg,2024-01-05T18:40:16Z,,"Wu said the city has significantly expanded shelter capacity in preparation for heightened winter demand. Shelters are working to manage capacity and create overflow space where necessary, she said.… [+3352 chars]",,en,storm,Storm,random,,,
https://www.voanews.com/a/global-food-prices-decline-from-record-highs-in-2022-un-says-except-for-two-staples-/7428630.html,https://www.voanews.com/a/global-food-prices-decline-from-record-highs-in-2022-un-says-except-for-two-staples-/7428630.html,0,www.voanews.com,"Global Food Prices Decline From Record Highs in 2022, UN Says — Except for Two Staples","rome — Global prices for food commodities like grain and vegetable oil fell last year from record highs in 2022, when Russia’s war in Ukraine, drought and other factors helped worsen hunger worldwide, the U.N. Food and Agriculture Organization said Friday.

T…",https://gdb.voanews.com/0524DBC8-19DD-4170-AC8A-B91F22ED779B.jpg,2024-01-05T22:06:55Z,,"rome  Global prices for food commodities like grain and vegetable oil fell last year from record highs in 2022, when Russias war in Ukraine, drought and other factors helped worsen hunger worldwide, … [+2642 chars]",,en,Drought Russia,Drought,edo,Russia,GIC,Atlantic Ocean
https://www.businessinsider.com/japan-earthquake-safety-disaster-preparedness-2024-1,https://www.businessinsider.com/japan-earthquake-safety-disaster-preparedness-2024-1,0,www.businessinsider.com,Japan takes earthquake safety seriously. Here's how its culture of preparedness keeps so many people alive.,"Japan is a hot spot for earthquakes, and it's spent decades becoming one of the best-prepared countries for natural disasters to keep residents safe.",https://i.insider.com/659723c71c5c7b8c9a0e1ef1?width=1200&format=jpeg,2024-01-05T22:26:09Z,,"A 2024 earthquake collapsed a building in Wajima, Ishikawa prefecture, Japan.Kyodo via REUTERS
<ul><li>Japan is still coping with the aftermath of a powerful earthquake earlier this month.</li><li>W… [+8398 chars]",,en,Earthquake Ie,Earthquake,usgs,Japan,EAS,Asia
https://biztoc.com/x/05bf88201b864f39,https://biztoc.com/x/05bf88201b864f39,0,biztoc.com,Japan takes earthquake safety seriously. Here's how its culture of preparedness keeps so many people alive,"A 2024 earthquake collapsed a building in Wajima, Ishikawa prefecture, Japan. Kyodo via REUTERS Japan is still coping with the aftermath of a powerful earthquake earlier this month. With its history of natural disasters, Japan is one of the countries best pre…",https://c.biztoc.com/p/05bf88201b864f39/s.webp,2024-01-05T22:34:07Z,,"A 2024 earthquake collapsed a building in Wajima, Ishikawa prefecture, Japan.Kyodo via REUTERSJapan is still coping with the aftermath of a powerful earthquake earlier this month.With its history of … [+286 chars]",,en,Earthquake Japan,Earthquake,usgs,Japan,EAS,Asia
https://sputnikglobe.com/20240106/shadow-of-january-6-capitol-riot-looming-large-over-us-democracy-three-years-after-1116011104.html,https://sputnikglobe.com/20240106/shadow-of-january-6-capitol-riot-looming-large-over-us-democracy-three-years-after-1116011104.html,0,sputnikglobe.com,Shadow of January 6 Capitol Riot Looming Large Over US Democracy Three Years After,"WASHINGTON(Sputnik) - Three years after the January 6 storming of the US Capitol after then-US President Donald Trump's election defeat, the United States appears to remain in a sort of Cold Civil War, analysts told Sputnik.",https://cdn1.img.sputnikglobe.com/images/sharing/article/eng/1116011104.jpg?10964085671704528387,2024-01-06T08:06:28Z,,"Enjoy in-depth, acute analysis of the most pressing local, regional and global trends at Sputnik!
https://sputnikglobe.com/20240106/shadow-of-january-6-capitol-riot-looming-large-over-us-democracy-t… [+10861 chars]",,en,Storm United States,Storm,wmo,United States,CNA,North-America
https://www.dw.com/en/germanys-flooded-farmers-brace-for-winter-frost/a-67905471,https://www.dw.com/en/germanys-flooded-farmers-brace-for-winter-frost/a-67905471,0,www.dw.com,Germany's flooded farmers brace for winter frost,"After weeks of rain and flooding, a dry spell and frost are welcome, but the problems are not over yet. And it seems unlikely that the already squeezed government budget will be able to help.",https://static.dw.com/image/67898513_6.jpg,2024-01-06T10:55:00Z,,"The German Weather Service (DWD) announced the arrival of frost in the north of the country on Saturday as large areas of land remain covered in flood water.
While the below-freezing temperatures ar… [+4799 chars]",,en,Rain Flood Germany,Precipitation,meteo,Germany,NEU,Europe
https://www.news.com.au/technology/environment/victorians-battle-severe-storms-leading-to-intense-rainfall-and-life-threatening-flooding/news-story/45e870d47c58aaf0735b274d5bef0bff,https://www.news.com.au/technology/environment/victorians-battle-severe-storms-leading-to-intense-rainfall-and-life-threatening-flooding/news-story/45e870d47c58aaf0735b274d5bef0bff,0,www.news.com.au,"Victoria flash flooding: Severe storms in Shepparton, Gippsland bring floods and torrential rainfall, threatening lives",Victorians are currently under threat from dangerous flash flooding brought by severe storms which are pelting residents with severe rain and thousands of lightning strikes.,https://content.api.news/v3/images/bin/9d20193d569a5de7e40e13e4b202f67a,2024-01-07T23:16:03Z,,"Victorians are currently under threat from dangerous flash flooding brought by severe storms which are pelting residents with severe rain and thousands of lightning strikes. 
A strong and slow movin… [+3560 chars]",,en,flooding,Flood,random,,,
https://www.irishtimes.com/ireland/2024/01/08/snow-and-ice-warning-issued-as-cold-weather-alert-in-place-across-ireland-for-week-ahead/,https://www.irishtimes.com/ireland/2024/01/08/snow-and-ice-warning-issued-as-cold-weather-alert-in-place-across-ireland-for-week-ahead/,0,www.irishtimes.com,Snow and ice warning issued as cold weather alert in place across Ireland for week ahead,"Weather to remain cold with fog, ice and snow conditions across country until Friday, says Met Éireann",https://www.irishtimes.com/resizer/43y43OR765eM7IhylojhYdq7aek=/1200x630/filters:format(jpg):quality(70):focal(2425x1295:2435x1305)/cloudfront-eu-central-1.images.arcpublishing.com/irishtimes/VKTDUVTLIBVVEUWZZTWE3RHNFI.jpg,2024-01-08T06:44:56Z,,"A snow and ice warning has been issued across the State by Met Éireann. The status yellow alert is in place until 10am on Monday morning.
Frost, icy patches and dense fog can be expected, leading to… [+871 chars]",,en,Fog Ireland,Fog,meteo,Ireland,NEU,Europe
https://abcnews.go.com/International/wireStory/hundreds-evacuate-homes-38-rescued-floods-southeast-australia-106185964,https://abcnews.go.com/International/wireStory/hundreds-evacuate-homes-38-rescued-floods-southeast-australia-106185964,0,abcnews.go.com,"Hundreds evacuate homes, 38 rescued from floods in southeast Australia after heavy storms",Hundreds of people were ordered to evacuate their homes on Monday after parts of Victoria state were inundated by flooding as wild weather continues to batter Australia’s southeast,https://i.abcnewsfe.com/a/4dfeb7d2-80ab-4bfd-9442-e53127df63a4/wirestory_6fa6a386d715fb62fc0c46c47a9b5298_16x9.jpg?w=992,2024-01-08T07:02:28Z,,"MELBOURNE, Australia -- Hundreds of people were ordered to evacuate their homes on Monday after flooding inundated parts of Victoria state, as wild weather continues to batter Australias southeast.
… [+1498 chars]",,en,flood Australia,Flood,aidr,Australia,SAU,Oceania
https://variety.com/2024/film/global/sunny-side-of-the-doc-2024-global-pitch-projects-1235864503/,https://variety.com/2024/film/global/sunny-side-of-the-doc-2024-global-pitch-projects-1235864503/,0,variety.com,"Swimming Camels, Radiation, Drought, AI and Climate Change Among Sunny Side of the Doc 2024 Global Pitch Themes","The documentary projects vying for the 2024 Sunny Side of the Doc Global Pitch for Global Change award examine a range of topics linked to the sustainable development goals defined by the United Nations. On Feb. 6 and 7, the 12 selected projects will be pitch…",https://variety.com/wp-content/uploads/2024/01/Camels-of-the-Sea.jpg?w=1000&h=563&crop=1,2024-01-08T09:59:22Z,,The documentary projects vying for the 2024 Sunny Side of the Doc Global Pitch for Global Change award examine a range of topics linked to the sustainable development goals defined by the United Nati… [+7161 chars],,en,drought,Drought,random,,,
https://www.irishtimes.com/ireland/2024/01/08/new-status-yellow-fog-and-ice-warning-issued-as-cold-weather-alert-in-place-for-week-ahead/,https://www.irishtimes.com/ireland/2024/01/08/new-status-yellow-fog-and-ice-warning-issued-as-cold-weather-alert-in-place-for-week-ahead/,0,www.irishtimes.com,New status yellow fog and ice warning issued as cold weather alert in place for week ahead,"Weather Ireland: Dangerous travelling conditions and low temperatures expected in the coming days, Met Éireann says",https://www.irishtimes.com/resizer/RbLX84_eD0Wr4C2PxtOf_yRw5xk=/1200x630/filters:format(jpg):quality(70):focal(4402x3666:4412x3676)/cloudfront-eu-central-1.images.arcpublishing.com/irishtimes/53YQQMNJDNGC5HTJXKGE4MBVEE.JPG,2024-01-08T11:18:49Z,,"Met Éireann has issued a new status yellow low temperature and ice warning across the State from tonight into tomorrow morning.
The warning is valid from 9pm on Monday night to 10am on Tuesday.
Tem… [+1870 chars]",,en,Ice Ireland,Snow&Ice,wmo,Ireland,NEU,Europe
https://www.newsweek.com/winter-storm-brings-tornado-warnings-across-gulf-coast-states-1858768,https://www.newsweek.com/winter-storm-brings-tornado-warnings-across-gulf-coast-states-1858768,0,www.newsweek.com,Winter Storm Finn Sparks Warnings About Tornadoes in Five States,"The storm is expected to bring severe thunderstorms capable of strong wind gusts, in addition to tornadoes.",https://d.newsweek.com/en/full/2332736/winter-storm.jpg,2024-01-08T17:16:31Z,,"A winter storm making its way across the U.S. brought tornado warnings across five states on Monday.
The National Weather Service (NWS) has issued a warning for parts of the states as severe thunder… [+3138 chars]",,en,tornado,Storm,random,,,
https://www.abc.net.au/news/rural/2024-01-09/rain-flash-floods-force-victorian-towns-seymour-yea-to-evacuate/103293338,https://www.abc.net.au/news/rural/2024-01-09/rain-flash-floods-force-victorian-towns-seymour-yea-to-evacuate/103293338,0,www.abc.net.au,Regional Victorians brace for flood peak expected to inundate homes as townships evacuate,"The Campaspe River is forecast to peak above the major flood level in the Central Victorian town of Rochester this morning, following days of recording-breaking rain across the state.",https://live-production.wcms.abc-cdn.net.au/06edee8f6c05b959c83bb56e91ec9e53?impolicy=wcms_crop_resize&cropH=980&cropW=1742&xPos=137&yPos=0&width=862&height=485,2024-01-08T18:18:18Z,http://wayback.archive-it.org/all/20240109173245/https://www.abc.net.au/news/rural/2024-01-09/rain-flash-floods-force-victorian-towns-seymour-yea-to-evacuate/103293338,"Residents in Victoria are on edge as they wait for forecast major flood peaks this morning, following days of recording-breaking rain across the state.
Key points:
<ul><li>People in the townships o… [+5199 chars]",,en,Flood Chester,Flood,wmo,United States,CNA,North-America
https://www.cbsnews.com/news/maps-snowfall-total-inches-winter-storm-january-2024/,https://www.cbsnews.com/news/maps-snowfall-total-inches-winter-storm-january-2024/,0,www.cbsnews.com,How much snow did you get? Maps show snowfall inches from winter storm,"After winter storms hit the Northeast and other parts of the country, these maps show how much total snowfall accumulation was recorded in different areas.",https://assets3.cbsnewsstatic.com/hub/i/r/2024/01/08/58172210-d53e-4be5-89cc-811578f52d96/thumbnail/1200x630/f4633550e9d94d9c8ff981fc9f84d20b/72-hour.png?v=3638d056f7798fc8425d74271bc0b398,2024-01-08T19:44:30Z,,"Two weather systems hit the United States over the weekend, bringing snow, rain and heavy wind to vast stretches of the country, particularly the Northeast and parts of the West and Midwest. Maps ill… [+6129 chars]",,en,storm,Storm,random,,,
https://www.npr.org/2024/01/08/1223525948/us-severe-weather-winter-storm-blizzard,https://www.npr.org/2024/01/08/1223525948/us-severe-weather-winter-storm-blizzard,0,www.npr.org,Large swaths of the U.S. are facing severe weather. Here's what to know,"Blizzard conditions are expected in the Great Plains and the Pacific Northwest, while the Northeast braces for more precipitation following weekend snowfall.",https://media.npr.org/assets/img/2024/01/08/gettyimages-1907427260_wide-4ccd9b130f3b9be42e1c57d75dbdba1ff4564367-s1400-c100.jpg,2024-01-08T19:49:48Z,,"A person uses a snowblower to clear snow in front of a home in Methuen, Mass., on Sunday.
Joseph Prezioso/AFP via Getty Images
Severe weather is already battering parts of the U.S. or will in the c… [+3368 chars]",,en,blizzard,Storm,random,,,
https://www.westernjournal.com/weather-abnormality-pushing-deadly-cold-system-us-start-preparing-now/,https://www.westernjournal.com/weather-abnormality-pushing-deadly-cold-system-us-start-preparing-now/,0,www.westernjournal.com,Weather Abnormality Pushing Deadly Cold System Into US - Start Preparing Now,Coastal states are asked to prepare for damaging winds and tornadoes from the Texas coast to North Carolina.,https://www.westernjournal.com/wp-content/uploads/2024/01/weather-pattern.jpg,2024-01-08T21:03:51Z,,Millions of Americans are being asked to prepare for a weather anomaly that is expected to blanket the central United States with frigid temperatures and could see people across the Southeast facing … [+5289 chars],,en,tornado,Storm,random,,,
https://www.independent.ie/weather/weather-ireland-met-eireann-warns-motorists-of-hazardous-driving-conditions-due-to-ice-and-cold-weather-alert/a1173330108.html,https://www.independent.ie/weather/weather-ireland-met-eireann-warns-motorists-of-hazardous-driving-conditions-due-to-ice-and-cold-weather-alert/a1173330108.html,0,www.independent.ie,Weather Ireland: Met Éireann warns motorists of ‘hazardous’ driving conditions due to ice and cold weather alert,"A status yellow low temperature and ice warning is in place for the entire country until 10am, with temperatures of between just 2C and 6C expected.",https://focus.independent.ie/thumbor/4dSnjrb9KUOKgOGqjBPFLFYHh9s=/60x0:735x450/675x450/prod-mh-ireland/33e645b2-76f8-4e49-93cf-8aee5a9f9287/424b1476-bf67-4ee6-aea4-0f3bed961e2e/video/video.jpg,2024-01-09T02:30:00Z,,"A status yellow low temperature and ice warning is in place for the entire country until 10am, with temperatures of between just 2C and 6C expected.The country is also under a cold weather advisory f… [+2559 chars]",,en,Ice Ireland,Snow&Ice,wmo,Ireland,NEU,Europe
https://www.hurriyetdailynews.com/turkiye-grapples-with-new-cold-wave-heavy-rains-189497,https://www.hurriyetdailynews.com/turkiye-grapples-with-new-cold-wave-heavy-rains-189497,0,www.hurriyetdailynews.com,"Türkiye grapples with new cold wave, heavy rains","With a new cold wave coming from Iceland to hit the country, the Turkish State Meteorology Service warns of heavy precipitation and snowfall ahead as temperatures will further go down in the coming days.",https://image.hurimg.com/i/hurriyet/75/200x200/659cc8763e249be91208953a.jpg,2024-01-09T04:15:56Z,,"ISTANBUL
With a new cold wave coming from Iceland to hit the country, the Turkish State Meteorology Service warns of heavy precipitation and snowfall ahead as temperatures will further go down in th… [+1480 chars]",,en,Snow Iceland,Snow&Ice,wmo,Iceland,GIC,Europe
https://allafrica.com/stories/202401090013.html,https://allafrica.com/stories/202401090013.html,0,allafrica.com,Rice to the Rescue - a WFP Project Changes Lives and Diets in Flood-Hit South Sudan,"[WFP] Reaching hundreds of families in two South Sudanese states, the initiative is part of a broader bid to build resilience to a growing climate crisis",https://cdn08.allafrica.com/static/images/structure/aa-logo-rgba-no-text-square.png,2024-01-09T04:51:26Z,,"Reaching hundreds of families in two South Sudanese states, the initiative is part of a broader bid to build resilience to a growing climate crisis
It is midday in Halbul, in northern South Sudan, a… [+5603 chars]",,en,Flood Sudan,Flood,relief,Sudan,SAH,Africa
https://backlinko.com/podcast-stats,https://backlinko.com/podcast-stats,0,backlinko.com,13 Podcast Statistics You Need To Know,"In recent years, podcasts have taken the digital world by storm. With more than 460 million listeners worldwide, the podcast industry provides lucrative opportunities for both podcasters and marketers alike and offers an effective way for you to connect with …",https://api.backlinko.com/app/uploads/2023/12/podcast-stats-blog-post-header.png,2024-01-09T05:39:20Z,,"In recent years, podcasts have taken the digital world by storm.
With more than 460 million listeners worldwide, the podcast industry provides lucrative opportunities for both podcasters and markete… [+18478 chars]",,en,storm,Storm,random,,,
https://www.irishtimes.com/ireland/2024/01/09/ice-and-low-temperature-warning-in-place-across-ireland/,https://www.irishtimes.com/ireland/2024/01/09/ice-and-low-temperature-warning-in-place-across-ireland/,0,www.irishtimes.com,Ice and low temperature warning in place across Ireland,Cold weather expected to stay until Friday night,https://www.irishtimes.com/resizer/d8_fU_aRPb0JOr5hYPl3CAm8QX8=/1200x630/filters:format(jpg):quality(70):focal(1045x2210:1055x2220)/cloudfront-eu-central-1.images.arcpublishing.com/irishtimes/QCQ2OVYK4BFGVHCWSPUF6AQT7Q.jpg,2024-01-09T07:06:21Z,,"A yellow low temperature and ice warning is in place across Ireland until 10am on Tuesday morning.
It will be a cold and frosty to start to the morning with some good sunny spells developing across … [+1030 chars]",,en,Ice Ireland,Snow&Ice,wmo,Ireland,NEU,Europe
https://www.newsweek.com/snow-map-depth-across-us-multiple-winter-storms-1858939,https://www.newsweek.com/snow-map-depth-across-us-multiple-winter-storms-1858939,0,www.newsweek.com,Snow Map Shows Depth Across US as Multiple Winter Storms to Hit,"As much as 100 inches of snow may have fallen in parts of the Northwest, with more expected across the U.S. this week.",https://d.newsweek.com/en/full/2332968/snow-massachusetts.jpg,2024-01-09T10:12:48Z,,"A map of estimated snow depths across the contiguous U.S. shows the impact multiple winter storms are having, with the heaviest snowfall across mountain ranges in the West.
The model, produced by th… [+3218 chars]",,en,storm,Storm,random,,,
https://www.cnn.com/2024/01/09/weather/winter-storm-forecast-blizzard-flooding-tuesday/index.html,https://www.cnn.com/2024/01/09/weather/winter-storm-forecast-blizzard-flooding-tuesday/index.html,0,www.cnn.com,Winter storm to blast Midwest with blizzard conditions and threaten Southeast with tornadoes and floods,"A massive and exceptionally powerful winter storm continues to pummel much of the eastern half of the country as it treks from the Southwest and up through the Northeast this week, knocking out power in several states and prompting the closure of roads, schoo…","https://media.cnn.com/api/v1/images/stellar/prod/240108204215-02-winter-weather-0108-iowa.jpg?c=16x9&q=w_800,c_fill",2024-01-09T10:33:01Z,,"A wide-reaching winter storm continues to pummel much of the eastern half of the country as it journeys from the Midwest up through the Northeast this week, knocking out power in several states and p… [+6786 chars]",,en,tornado,Storm,random,,,
https://www.cnn.com/us/live-news/eastern-us-snow-storm-01-09-24/index.html,https://www.cnn.com/us/live-news/eastern-us-snow-storm-01-09-24/index.html,0,www.cnn.com,Winter storm slams central and eastern US,"A fast-moving storm will unload strong winds, possible strong tornadoes, serious flooding, snow and blizzard conditions across the central and eastern US. Follow here for the latest.",https://cdn.cnn.com/cnnnext/dam/assets/240108121059-01-winter-weather-0108-iowa-super-tease.jpg,2024-01-09T11:14:03Z,,"A vast and disruptive storm is set to whip up miserable morning commutes as it blasts the Midwest with heavy snow and blizzard conditions while also blanketing the Southeast with damaging winds, rain… [+2895 chars]",,en,tornado,Storm,random,,,
https://www.insurancejournal.com/news/international/2024/01/09/754948.htm,https://www.insurancejournal.com/news/international/2024/01/09/754948.htm,0,www.insurancejournal.com,"Floods Strand Cows, Damage Crops as Wild Weather Hits Australia","Heavy rains and flooding across Australia’s southern state of Victoria has damaged crops and stranded cattle as a months-long run of wild weather on the nation’s east coast leaves a trail of destruction. Severe storms have lashed Victoria since October, …",https://www.insurancejournal.com/app/uploads/2024/01/floods-rochester-victoria-australia-getty.jpg,2024-01-09T13:42:27Z,,Heavy rains and flooding across Australia’s southern state of Victoria has damaged crops and stranded cattle as a months-long run of wild weather on the nation’s east coast leaves a trail of destruct… [+3113 chars],,en,heavy rain Victoria,Precipitation,acwe,Australia,SAU,Oceania
https://checkyourfact.com/2024/01/09/fact-check-video-japanese-tsunami/,https://checkyourfact.com/2024/01/09/fact-check-video-japanese-tsunami/,0,checkyourfact.com,FACT CHECK: Video Claims To Show Japanese Tsunami,The video is from an Indonesia earthquake. It is not related to the recent tsunami in Japan,https://cdn01.dailycaller.com/wp-content/uploads/2024/01/GettyImages-1904717685-scaled-e1704296024328.jpg,2024-01-09T17:33:56Z,,"A video shared on X, formerly Twitter, claims to show the recent tsunami in Japan.
Don’t ever do this during #tsunami. Stay home stay safe. #earthquake Footage earthquake occurred in #Japan. Footage… [+1567 chars]",,en,Tsunami Indonesia,Tsunami,usgs,Indonesia,SEA,Asia
https://www.businessinsider.com/ukrainian-soldiers-move-on-foot-because-of-exploding-drone-threat-2024-1,https://www.businessinsider.com/ukrainian-soldiers-move-on-foot-because-of-exploding-drone-threat-2024-1,0,www.businessinsider.com,Ukrainian soldiers say they're having to abandon vehicles and hike for miles to the front lines thanks to exploding Russian drones,"Russia's exploding drones are forcing Ukrainian soldiers to move on foot and abandon vehicles, troops told The New York Times.",https://i.insider.com/659d6b99dcdb354a9855e0fe?width=1200&format=jpeg,2024-01-09T18:47:08Z,,"Soldiers at the training ground calibrate their machine guns after going into combat on January 9, 2024, in Lyman district, Ukraine.Kostiantyn Liberov/Libkos/Getty Images
<ul><li>Ukrainian soldiers … [+3563 chars]",,en,Rain Russia,Precipitation,wmo,Russia,ESB,Europe
https://www.bbc.co.uk/programmes/p0h2z4gp,https://www.bbc.co.uk/programmes/p0h2z4gp,0,www.bbc.co.uk,Solutions Journalism: Building a future for cyclone-hit Mozambique,"Five years after reporting on one of Mozambique’s worst cyclones, the BBC’s Nomsa Maseko returns to the city of Beira to meet the people on the frontline of climate change. With scientists predicting that such storms will become more powerful and dangerous be…",https://ichef.bbci.co.uk/images/ic/1200x675/p0css1dx.jpg,2024-01-10T01:30:00Z,,"Five years after reporting on one of Mozambiques worst cyclones, the BBCs Nomsa Maseko returns to the city of Beira to meet the people on the frontline of climate change. With scientists predicting t… [+443 chars]",,en,cyclone,Tropical Cyclone,random,,,
https://www.aljazeera.com/news/2024/1/10/ten-killed-gangs-unleash-terror-as-ecuador-declares-state-of-emergency,https://www.aljazeera.com/news/2024/1/10/ten-killed-gangs-unleash-terror-as-ecuador-declares-state-of-emergency,0,www.aljazeera.com,"Ten killed, gangs unleash terror as Ecuador declares state of emergency","Gunmen storm TV station during live broadcast, more than 20 violent incidents reported as country lurches into crisis.",https://www.aljazeera.com/wp-content/uploads/2024/01/34CC2F7-highres-1704873563.jpg?resize=1920%2C1440,2024-01-10T09:17:23Z,,"At least 10 people have been killed in Ecuador in a series of attacks blamed on armed gangs, as the country plunges into chaos in what the new president has called an internal armed conflict.
Presid… [+4551 chars]",,en,storm,Storm,random,,,
