index,url,valid,domain,title,description,image,published,archive,content,quote,language,term,topic,feed,country,ipcc,continent
https://www.bostonherald.com/2025/10/06/india-landslides/,https://www.bostonherald.com/2025/10/06/india-landslides/,0,www.bostonherald.com,Rescuers in India search for missing after landslides kill 24 in Darjeeling region,"Extreme weather triggered flooding in India's Darjeeling region, while a snowstorm trapped hikers in Tibet.",https://www.bostonherald.com/wp-content/uploads/2025/10/India_Extreme_Weather_Landslides_12530-1.jpg?w=1024&h=576,2025-10-06T21:23:08Z,,NEW DELHI (AP) Rescuers were scouring Indias northeastern tea-growing hill district of Darjeeling on Monday for those reported missing a day after landslides triggered by heavy downpours killed at le… [+2724 chars],,en,Land Slide India,Landslide,relief,India,SAS,Asia
https://www.abc.net.au/news/2025-10-07/queensland-fires-floods-storm-seasonemergency-season-prep/105860906,https://www.abc.net.au/news/2025-10-07/queensland-fires-floods-storm-seasonemergency-season-prep/105860906,0,www.abc.net.au,Dozens of fires burn across Queensland as severe weather season looms,"Parts of the state are still reeling from last season's flooding, storms and rainfall, with the majority of council areas disaster-declared already.",https://live-production.wcms.abc-cdn.net.au/83e1843f2a77f662fa74e36005554c11?impolicy=wcms_watermark_news&cropH=2268&cropW=4032&xPos=0&yPos=378&width=862&height=485&imformat=generic,2025-10-07T01:33:52Z,,"Just a day after crews contained an out-of-control bushfire and with 60 fires currently burning across the state Queenslanders are being urged to prepare for an impending severe weather season. 
Par… [+4474 chars]",,en,flooding Queensland,Flood,acwe,Australia,CAU,Oceania
https://theconversation.com/extreme-weather-now-costs-australians-4-5b-a-year-better-insurance-options-and-loans-would-help-us-adapt-266886,https://theconversation.com/extreme-weather-now-costs-australians-4-5b-a-year-better-insurance-options-and-loans-would-help-us-adapt-266886,0,theconversation.com,Extreme weather now costs Australians $4.5b a year. Better insurance options and loans would help us adapt,Nearly eight in ten homes facing severe to extreme flood risk are now not insured. We need to rethink how to keep communities safe.,https://images.theconversation.com/files/694730/original/file-20251007-56-8e4i8t.jpg?ixlib=rb-4.1.0&rect=0%2C16%2C3000%2C1500&q=45&auto=format&w=1356&h=668&fit=crop,2025-10-07T03:35:13Z,,"Today’s release of the Insurance Council of Australia’s report puts Australia on the spot: we rank second in the world in extreme weather-related losses. As the Insurance Council puts it, this is not… [+5525 chars]",,en,Flood Australia,Flood,wmo,Australia,CAU,Oceania
https://www.usatoday.com/story/news/weather/2025/10/07/tropical-storm-jerry-path-tracker-atlantic/86561650007/,https://www.usatoday.com/story/news/weather/2025/10/07/tropical-storm-jerry-path-tracker-atlantic/86561650007/,0,www.usatoday.com,Tropical Storm Jerry forms in the Atlantic. See its potential path.,The National Hurricane Center said Tropical Storm Jerry has formed in the Atlantic Ocean on Oct. 7. Here's where it's headed.,https://media.zenfs.com/en/usa_today_news_641/af935f1a64a8fd46385469991c1594e8,2025-10-07T12:18:48Z,,"Tropical Storm Jerry has formed in the Atlantic Ocean.
The National Hurricane Center said in an advisory on Tuesday, Oct. 7 the Atlantic hurricane season's 10th named storm was located about 1,315 m… [+5249 chars]",,en,National Hurricane Center,Tropical Cyclone,random,,,
https://freerepublic.com/focus/f-chat/4344825/posts,https://freerepublic.com/focus/f-chat/4344825/posts,0,freerepublic.com,"New Tactics, But Climate Crusaders Running Out of Options","Desperate to stay relevant, climate activists now claim they can trace individual heat waves to specific oil companies—just as Washington steps away from their agenda. In the wake of a federal government no longer serving as its obedient lapdog, the desperate…",,2025-10-07T13:04:01Z,,"Skip to comments.
New Tactics, But Climate Crusaders Running Out of OptionsAmerican Greatness ^
 | 7 Oct, 2025
 | Gary Abernathy
Posted on 10/07/2025 6:04:01 AM PDT by MtnClimber
Desperate to st… [+6865 chars]",,en,heat wave,Heat Wave,random,,,
https://www.core77.com/posts/136086/Design-Postcard-Mashpi-Lodge-Ecuador,https://www.core77.com/posts/136086/Design-Postcard-Mashpi-Lodge-Ecuador,0,www.core77.com,"Design Postcard: Mashpi Lodge, Ecuador","If you are into convenient package price holidays to relax on a deck chair by the pool, this might not be the place for you. The Mashpi Lodge in the Chocó-Darién rainforest in Ecuador, a 3-to-4-hour bumpy drive from Quito (depending on the rain and roads) is …",https://s3files.core77.com/blog/images/lead_n_spotlight/1763503_lead_400_136086_.jpg,2025-10-07T13:07:00Z,,"If you are into convenient package price holidays to relax on a deck chair by the pool, this might not be the place for you. The Mashpi Lodge in the Chocó-Darién rainforest in Ecuador, a 3-to-4-hour … [+6726 chars]",,en,Rain Ecuador,Precipitation,wmo,Ecuador,NWS,South-America
https://www.barchart.com/story/news/35285342/brazil-rain-forecasts-undercut-coffee-prices,https://www.barchart.com/story/news/35285342/brazil-rain-forecasts-undercut-coffee-prices,0,www.barchart.com,Brazil Rain Forecasts Undercut Coffee Prices,"December arabica coffee (KCZ25 ) today is down -5.50 (-1.44%), and November ICE robusta coffee (RMX25 ) is down -43 (-0.96%). Coffee prices are sliding for a...",https://s.yimg.com/ny/api/res/1.2/Dp3zsenWTENKAyvT3ROW8w--/YXBwaWQ9aGlnaGxhbmRlcjt3PTEyMDA7aD04MDA-/https://media.zenfs.com/en/barchart_com_477/2501d56324e46d38e340b7dfefba9ac5,2025-10-07T15:52:24Z,,"December arabica coffee (KCZ25) today is down -5.50 (-1.44%), and November ICE robusta coffee (RMX25) is down -43 (-0.96%).
Coffee prices are sliding for a second day today.  The forecast for rain i… [+3883 chars]",,en,Rain Brazil,Precipitation,wmo,Brazil,SAM,South-America
https://ohnotheydidnt.livejournal.com/131292207.html,https://ohnotheydidnt.livejournal.com/131292207.html,0,ohnotheydidnt.livejournal.com,Introducing HOT ice cream—the viral Australian sensation from Tyra Banks!,"No, it's not a latte. And no, you heathen, it's not hot chocolate. It is incredibly important that you understand this. It's HOT
 ice cream—""something that has not been done before""—as invented by the one and only Tyra Banks! ""It's the same ice cream she's b…",https://l-files.livejournal.net/og_image/3616053/512860?v=1759860467,2025-10-07T18:07:43Z,,"No, it's not a latte. And no, you heathen, it's not hot chocolate. It is incredibly important that you understand this. It's HOT ice cream""something that has not been done before""as invented by the o… [+754 chars]",,en,Ice Australia,Snow&Ice,wmo,Australia,CAU,Oceania
https://www.barchart.com/story/news/35288683/coffee-prices-retreat-on-rain-forecasts-for-brazil,https://www.barchart.com/story/news/35288683/coffee-prices-retreat-on-rain-forecasts-for-brazil,0,www.barchart.com,Coffee Prices Retreat on Rain Forecasts for Brazil,"December arabica coffee (KCZ25 ) on Tuesday closed down -5.95 (-1.56%), and November ICE robusta coffee (RMX25 ) closed down -57 (-1.27%). Coffee prices...",https://s.yimg.com/ny/api/res/1.2/XqHUPdzzds0RspCwGp9h7Q--/YXBwaWQ9aGlnaGxhbmRlcjt3PTEyMDA7aD04MDE-/https://media.zenfs.com/en/barchart_com_477/0ac1c7b99f0f4d4e1e54226c95d0dd36,2025-10-07T18:24:25Z,,"December arabica coffee (KCZ25) on Tuesday closed down -5.95 (-1.56%), and November ICE robusta coffee (RMX25) closed down -57 (-1.27%).
Coffee prices retreated for a second day on Tuesday.  Forecas… [+3894 chars]",,en,Rain Brazil,Precipitation,wmo,Brazil,SAM,South-America
https://biztoc.com/x/7e53936005273e50,https://biztoc.com/x/7e53936005273e50,0,biztoc.com,Priscilla nears major hurricane status in Pacific as new tropical storm swirls in the Atlantic,,https://biztoc.com/cdn/950/og.png,2025-10-07T21:30:29Z,,"{ window.open(this.href, '_blank'); }, 200); return false;""&gt;Why did Tesla shares fall after unveiling cheaper models? { window.open(this.href, '_blank'); }, 200); return false;""&gt;How is the US g… [+764 chars]",,en,tropical storm,Tropical Cyclone,random,,,
https://www.forbes.com/sites/marshallshepherd/2025/10/07/hurricane-season-isnt-shutdown-a-busy-week-looms-for-meteorologists/,https://www.forbes.com/sites/marshallshepherd/2025/10/07/hurricane-season-isnt-shutdown-a-busy-week-looms-for-meteorologists/,0,www.forbes.com,Hurricane Season Isn’t Shutdown. A Busy Week Looms For Meteorologists,"Hurricane season is not shutdown. Meteorologists are tracking Hurricane Priscilla, Tropical Storm Jerry, and a future hybrid Nor'easter off the U.S. East Coast.",https://imageio.forbes.com/specials-images/imageserve/68e5a66f195295a612debc36/0x0.jpg?format=jpg&height=900&width=1600&fit=bounds,2025-10-08T00:11:53Z,,"Tropical Storm Jerry on Tuesday on October, 7, 2025.
Tropical Tidbits website and NOAA
The Atlantic hurricane season continues to be active as we enter the second week of October. Tropical Storm Je… [+3736 chars]",,en,Tropical Storm Jerry,Tropical Cyclone,eonet,,NAO,Atlantic Ocean
https://appadvice.com/post/hurricane-tracking-and-widgets-highlight-mercury-weather-update/782418,https://appadvice.com/post/hurricane-tracking-and-widgets-highlight-mercury-weather-update/782418,0,appadvice.com,Hurricane Tracking and Widgets Highlight Mercury Weather Update,"Mercury Weather has everything you’re probably looking for in a weather app. With a clean and beautiful design, the app has accurate forecasts, radar, and much more.
The app has just been updated to version 3.0 with a number of new and notable features. 
Hurr…",https://springboard-cdn.appadvice.com/wp-content/appadvice-v2-media/2025/10/mw1_d0acc5739323bbfe6718d2baa413fa59.jpg,2025-10-08T02:52:31Z,,"The app has just been updated to version 3.0 with a number of new and notable features. 
Hurricane trackers will enjoy two of the new features. A new storm layers on the map screen will show live hu… [+1167 chars]",,en,hurricane,Tropical Cyclone,random,,,
https://financialpost.com/pmn/florida-county-battered-by-2024-hurricanes-spends-125m-on-beach-restoration,https://financialpost.com/pmn/florida-county-battered-by-2024-hurricanes-spends-125m-on-beach-restoration,0,financialpost.com,Florida county battered by 2024 hurricanes spends $125M on beach restoration,"INDIAN ROCKS BEACH, Fla. (AP) — The white sandy beaches along a swath of Florida’s Gulf Coast were battered by three hurricanes last year, leading to a multimillion-dollar effort to repair a coastline that is the region’s economic engine. Crews are working wi…",,2025-10-08T04:10:45Z,,"INDIAN ROCKS BEACH, Fla. (AP) The white sandy beaches along a swath of Floridas Gulf Coast were battered by three hurricanes last year, leading to a multimillion-dollar effort to repair a coastline t… [+5164 chars]",,en,hurricane,Tropical Cyclone,random,,,
https://www.irishtimes.com/sport/rugby/2025/10/08/james-lowe-ready-for-the-storm-after-the-calm-as-leinster-face-sharks-at-home/,https://www.irishtimes.com/sport/rugby/2025/10/08/james-lowe-ready-for-the-storm-after-the-calm-as-leinster-face-sharks-at-home/,0,www.irishtimes.com,James Lowe ready for the storm after the calm as Leinster face Sharks at home,"Rested after bruising Lions tour, winger knows he has to ‘show up physically’ in his opening game for Leinster",https://www.irishtimes.com/resizer/v2/3KAPROYVIFH4TATPYHWRNP4YUI.jpg?smart=true&auth=72b53baa23c07e21bbf88d39cc629e88e509f348bad68704fe1960bd2dd706e5&width=1200&height=630,2025-10-08T05:00:01Z,,"James Lowe has had his calm before the storm of a new rugby season. 
With his opening game for Leinster against Sharks on Saturday, the first home game will be fraught after a nervy start and two ea… [+4075 chars]",,en,storm,Storm,random,,,
https://ryueyes11.tistory.com/511917,https://ryueyes11.tistory.com/511917,0,ryueyes11.tistory.com,급진 우파의 민주주의는 결국 독재,"Seven-figure salaries await those who manage the fortunes of the ultra-rich -- if they're lucky enough to be based in the US https://t.co/0e6jLVeIWk— Bloomberg (@business) October 7, 2025 Tropical Storm Jerry formed in the Atlantic east of the Caribbean, beco…",https://img1.daumcdn.net/thumb/R800x0/?scode=mtistory2&fname=https%3A%2F%2Fblog.kakaocdn.net%2Fdna%2FduuZb5%2FbtsQ4jAPhqJ%2FAAAAAAAAAAAAAAAAAAAAACBh7GhKn4BIGTju_U0YlJg3B8J2qrZJz_RTWLrAgOYk%2Fimg.jpg%3Fcredential%3DyqXZFxpELC7KVnFOS48ylbz2pIh7yKj8%26expires%3D1761922799%26allow_ip%3D%26allow_referer%3D%26signature%3DVkYgY2QGLqAOKFZdO%252BQ%252Fhmg4mBc%253D,2025-10-08T05:46:14Z,,"Seven-figure salaries await those who manage the fortunes of the ultra-rich -- if they're lucky enough to be based in the US https://t.co/0e6jLVeIWk
— Bloomberg (@business) October 7, 2025
Tropical… [+12490 chars]",,en,storm,Storm,random,,,
https://www.nakedcapitalism.com/2025/10/links-10-8-2025.html,https://www.nakedcapitalism.com/2025/10/links-10-8-2025.html,0,www.nakedcapitalism.com,Links 10/8/2025,"Our foxy daily links: >1 ton pumpkin, ineffective opioid, ocean heating, China chips advance, India econ questions, Dems to oppose Venezuela warmaking? France crisis, Iran drought, Russia battlefield account, Auerlien on operational failure, Fed worker shutdo…",https://www.nakedcapitalism.com/wp-content/uploads/2025/10/Screenshot-2025-10-08-at-3.48.02 PM.png,2025-10-08T10:55:45Z,,"This is Naked Capitalism fundraising week. 1190 donors have already invested in our efforts to combat corruption and predatory conduct, particularly in the financial realm. Please join us and partici… [+10013 chars]",,en,Drought Russia,Drought,edo,Russia,,
https://gizmodo.com/zombie-fires-and-historic-hurricanes-the-8-wildest-weather-events-of-summer-2025-2000667518,https://gizmodo.com/zombie-fires-and-historic-hurricanes-the-8-wildest-weather-events-of-summer-2025-2000667518,0,gizmodo.com,Zombie Fires and Historic Hurricanes: The 8 Wildest Weather Events of Summer 2025,A surge in zombie fires. Back-to-back black rainstorms. This summer’s weather was something else.,https://gizmodo.com/app/uploads/2025/10/canada-wildfire-1200x675.jpg,2025-10-08T11:00:50Z,,"This year has produced some really wild weather. And when I say wild, I mean truly unexpected, record-breaking, extreme events that defied our understanding of Earths climate system.
To be fair to t… [+8065 chars]",,en,storm surge,Storm,random,,,
https://thepeoplesperson.com/2025/10/08/cristiano-ronaldo-united-legend-becomes-first-billionaire-footballer-299824/,https://thepeoplesperson.com/2025/10/08/cristiano-ronaldo-united-legend-becomes-first-billionaire-footballer-299824/,0,thepeoplesperson.com,Cristiano Ronaldo: United legend becomes first billionaire footballer,"Manchester United legend Cristiano Ronaldo is no stranger to breaking records. The Portuguese took the football world by storm when he first joined the Red Devils in 2003, and although his return four years ago didn’t end on the best of terms he will always b…",https://thepeoplesperson.com/wp-content/uploads/2025/10/processed_image5.jpg,2025-10-08T15:00:00Z,,"1Manchester United legend Cristiano Ronaldo is no stranger to breaking records.
The Portuguese took the football world by storm when he first joined the Red Devils in 2003, and although his return f… [+2603 chars]",,en,storm,Storm,random,,,
https://pix11.com/news/local-news/high-impact-coastal-storm-to-slam-the-east-coast-this-weekend/,https://pix11.com/news/local-news/high-impact-coastal-storm-to-slam-the-east-coast-this-weekend/,0,pix11.com,High-impact coastal storm to slam the East Coast this weekend,NEW YORK (PIX11) – A powerful autumn cold front swept through the tri-state area Wednesday morning and will play a key role in fueling a developing coastal...,https://media.zenfs.com/en/wpix_new_york_city_ny_articles_672/66aac8977f6edd15babfeeb9fd67b633,2025-10-08T16:40:42Z,,NEW YORK (PIX11) A powerful autumn cold front swept through the tri-state area Wednesday morning and will play a key role in fueling a developing coastal storm off the North Carolina coastline by Fri… [+2435 chars],,en,storm,Storm,random,,,
https://www.cbsnews.com/news/bastian-worlds-cutest-rescue-dog-people-hurricane-florence/,https://www.cbsnews.com/news/bastian-worlds-cutest-rescue-dog-people-hurricane-florence/,0,www.cbsnews.com,Dog saved during Hurricane Florence wins People's cutest rescue dog contest,"Bastian, a 7-year-old dog rescued from Hurricane Florence floodwaters, has been named People magazine's World's Cutest Rescue Dog.",https://assets1.cbsnewsstatic.com/hub/i/r/2025/10/08/a7ae7917-9f10-4c23-8c08-1a4f77499c93/thumbnail/1200x630/485574418fc66b9aa7c969875f2dfaba/1008-cmo-dog.jpg,2025-10-08T17:02:56Z,,"A 7-year-old dog rescued from floodwaters during Hurricane Florence has been named People magazine's World's Cutest Rescue Dog. The announcement was made on Wednesday exclusively on ""CBS Mornings.""
… [+1580 chars]",,en,hurricane,Tropical Cyclone,random,,,
https://www.joblo.com/a-quiet-place-storm-warnin/,https://www.joblo.com/a-quiet-place-storm-warnin/,0,www.joblo.com,A Quiet Place franchise expands with comic book series Storm Warning,"The A Quiet Place franchise expands into the comic book world with A Quiet Place: Storm Warning from IDW Dark
The post A Quiet Place franchise expands with comic book series Storm Warning appeared first on JoBlo.",https://www.joblo.com/wp-content/uploads/2022/01/a-quiet-place-2023-delayed-featured.jpg,2025-10-08T18:52:05Z,,"Favorite Movies: The Friday the 13th franchise, Kevin Smith movies, the films of read more George A. Romero (especially the initial Dead trilogy), Texas Chainsaw Massacre 1 &amp; 2, FleshEater, Intru… [+639 chars]",,en,storm,Storm,random,,,
https://finance.yahoo.com/news/china-took-over-world-clean-220000021.html,https://finance.yahoo.com/news/china-took-over-world-clean-220000021.html,0,finance.yahoo.com,How China Took Over the World’s Clean Energy Boom,"Chinese renewables and EVs are flooding emerging markets, with exports to Africa, ASEAN, and the Middle East soaring as costs for solar panels and EV...",https://media.zenfs.com/en/oilprice.com/fa5abba5e9b4eb0fa4d64cc6279643c6,2025-10-08T22:00:00Z,,"Back in May, we reported that China is on the way to becoming the world’s first ‘‘electrostate’’ thanks to the ongoing EV boom coupled with rapid industrial electrification. According to a study by t… [+5338 chars]",,en,Flood China,Flood,wmo,China,EAS,Asia
https://www.sfchronicle.com/weather-forecast/article/typhoon-halong-recurve-california-storm-rain-snow-21090941.php,https://www.sfchronicle.com/weather-forecast/article/typhoon-halong-recurve-california-storm-rain-snow-21090941.php,0,www.sfchronicle.com,Powerful typhoon is set to trigger an unusually strong California storm,San Francisco's rainiest day since last winter is possible next week as energy from a recurving West Pacific typhoon dislodges cold air from Canada and whips...,https://s.yimg.com/ny/api/res/1.2/.GRvnFOf8OAHGdXVcuaDVA--/YXBwaWQ9aGlnaGxhbmRlcjt3PTEyMDA7aD04MDI7Y2Y9d2VicA--/https://media.zenfs.com/en/san_francisco_chronicle_hearst_178/bffd9d0704f473be01d2548f48d9fcc2,2025-10-08T23:12:58Z,,"A powerful typhoon that made a close approach to Japan is poised to energize the storm track across the Pacific Ocean and potentially bring heavy rain and snow to California next week.
Typhoon Halon… [+3994 chars]",,en,Typhoon Canada,Tropical Cyclone,wmo,Canada,NEN,North-America
https://www.thehindubusinessline.com/economy/agri-business/rain-bearing-la-nina-may-emerge-for-a-brief-period-by-december-says-australias-meteorological-organisation/article70141187.ece,https://www.thehindubusinessline.com/economy/agri-business/rain-bearing-la-nina-may-emerge-for-a-brief-period-by-december-says-australias-meteorological-organisation/article70141187.ece,0,www.thehindubusinessline.com,"Rain-bearing La Nina may emerge for a brief period by December, says Australia’s meteorological organisation","La Niña expected to bring rain and floods to Asia, with global temperatures remaining high in September 2025.",https://bl-i.thgim.com/public/news/bj9uz0/article70141203.ece/alternates/LANDSCAPE_1200/sst.jpg,2025-10-09T04:15:59Z,,"La Nina, which results in rain and floods in Asia, particularly India, could emerge for a brief period before the first half of December this year and end by February 2026, the Australian Bureau of M… [+3626 chars]",,en,Rain Ning er,Precipitation,wmo,China,EAS,Asia
https://www.abc.net.au/news/2025-10-09/nrl-melbourne-storm-nelson-asofa-solomona-contract-release/105874194,https://www.abc.net.au/news/2025-10-09/nrl-melbourne-storm-nelson-asofa-solomona-contract-release/105874194,0,www.abc.net.au,Storm veteran granted immediate release from NRL contract,Melbourne will clear Nelson Asofa-Solomona's salary from its cap after the powerful front-rower was granted a release from the final two years of his deal with the club.,https://live-production.wcms.abc-cdn.net.au/6f19c95c97874a006aed7754d0b172a6?impolicy=wcms_watermark_news&cropH=1688&cropW=3000&xPos=0&yPos=69&width=862&height=485&imformat=generic,2025-10-09T07:06:32Z,,"The Melbourne Storm will clear Nelson Asofa-Solomona's salary from its cap after the powerful front-rower was granted a release from the final two years of his contract.
The Storm approved Asofa-Sol… [+1737 chars]",,en,storm,Storm,random,,,
https://www.cbc.ca/news/politics/canada-united-states-border-bill-9.6931988,https://www.cbc.ca/news/politics/canada-united-states-border-bill-9.6931988,0,www.cbc.ca,"U.S. bill calls for more integration between Canadian, American border agents",The U.S. Congress is being asked to adopt legislation that could lead to Canada and the United States further integrating their enforcement of the border — including allowing U.S. officers to more freely operate on Canadian soil.,"https://i.cbc.ca/ais/c4f516e2-63a3-44c6-8455-8df7f9104304,1759954074019/full/max/0/default.jpg?im=Crop%2Crect%3D%280%2C87%2C1180%2C663%29%3BResize%3D620",2025-10-09T08:00:00Z,,The U.S. Congress is being asked to adopt legislation that could lead to Canada and the United States further integrating their enforcement of the border including allowing U.S. officers to more free… [+7974 chars],,en,Ice United States,Snow&Ice,wmo,United States,CNA,North-America
https://www.yahoo.com/news/articles/social-media-posts-phony-philippine-090513279.html,https://www.yahoo.com/news/articles/social-media-posts-phony-philippine-090513279.html,0,www.yahoo.com,Social media posts on 'phony Philippine project' share footage of unrelated Russian bridge,"A spiralling corruption scandal into bogus flood control projects in the Philippines has seen numerous lawmakers implicated, but a video circulating on...",https://media.zenfs.com/en/afp_factcheck_us_713/29a19d34583da53eac1cc8c14ed3f181,2025-10-09T09:05:13Z,,"A spiralling corruption scandal into bogus flood control projects in the Philippines has seen numerous lawmakers implicated, but a video circulating on social media showing a bridge swept away by hea… [+2631 chars]",,en,Flood Russia,Flood,wmo,Russia,ESB,Europe
https://www.usatoday.com/story/news/weather/2025/10/09/tropical-storm-priscilla-path-tracker-forecast-spaghetti-models/86597587007/,https://www.usatoday.com/story/news/weather/2025/10/09/tropical-storm-priscilla-path-tracker-forecast-spaghetti-models/86597587007/,0,www.usatoday.com,Tropical Storm Priscilla could bring heavy rain to parts of the US. See path.,Priscilla has weakened to a tropical storm but is still forecast to bring heavy rain to portions of the southwestern U.S. during the next few days.,https://media.zenfs.com/en/usa_today_news_641/4ead37b5da19f3992d444beada36ae8c,2025-10-09T11:58:46Z,,"Priscilla has weakened into a tropical storm but is still forecast to bring heavy rain to portions of the southwestern United States through the next few days.
The National Hurricane Center said in … [+4908 chars]",,en,tropical storm,Tropical Cyclone,random,,,
https://www.insurancejournal.com/news/national/2025/10/09/842846.htm,https://www.insurancejournal.com/news/national/2025/10/09/842846.htm,0,www.insurancejournal.com,World Is Far More Ablaze Now With Damaging Fires Than in 1980s: Study,"Earth’s nastiest and costliest wildfires are blazing four times more often now than they did in the 1980s because of human-caused climate change and people moving closer to wildlands, a new study found. A study in the journal Science looks …",https://www.insurancejournal.com/app/uploads/2025/10/Wildfire-Lahaina-Hawaii-AP-scaled.jpg,2025-10-09T12:48:04Z,,"Earth’s nastiest and costliest wildfires are blazing four times more often now than they did in the 1980s because of human-caused climate change and people moving closer to wildlands, a new study fou… [+5187 chars]",,en,wildfire,Wildfire,random,,,
