index,url,valid,domain,title,description,image,published,archive,content,quote,language,term,topic,feed,country,ipcc,continent
https://www.wired.com/story/heat-domes-are-dangerous-july-fourth-activities-make-things-worse/,https://www.wired.com/story/heat-domes-are-dangerous-july-fourth-activities-make-things-worse/,0,www.wired.com,Heat Domes Are Dangerous. July Fourth Activities Will Make Things Worse,"Long hours outdoors, day drinking, and World Cup matches are among the factors raising the risks of heat-related illness, as hot weather spreads across the eastern US.","https://media.wired.com/photos/6a4558d767fdeb11005ae06d/191:100/w_1280,c_limit/Heat-Domes-Are-Dangerous-Science-2158401574.jpg",2026-07-02T09:00:00Z,,"As New York City braces for an extreme heat wave amid the July 4th weekend and World Cup festivities, government officials and local hospitals are ramping up efforts to prevent heat-related illness.… [+3657 chars]",,en,heat,Heat Wave,random,,,
https://www.usatoday.com/story/news/world/2026/07/02/air-conditioning-europe-heat-wave/90765718007/,https://www.usatoday.com/story/news/world/2026/07/02/air-conditioning-europe-heat-wave/90765718007/,0,www.usatoday.com,Europe is fighting over air conditioning. What's going on?,"Heat has killed 200,000 in Europe in just four years, but it lags far behind the US in air conditioning adoption. It's now a political fight.",https://s.yimg.com/lo/mysterio/api/3d31f4a59491b6d5e2cca66102039f7bd445cd51453866b6a9b6eee0d1a1aab3/lightyear_networkapi/resizefill_w1200;quality_80;format_webp/https:%2F%2Fmedia.zenfs.com%2Fen%2Fusa_today_news_641%2Fadcd97011aa7aaa369cfdb1f0a39c398,2026-07-02T10:03:26Z,,"First there's the hum and then the cool air.
It's something most Americans enjoy without a moment's thought: air conditioning. In the suburbs and across major cities, the buzzing machines are everyw… [+8112 chars]",,en,heat,Heat Wave,random,,,
https://www.nakedcapitalism.com/2026/07/links-7-2-2026.html,https://www.nakedcapitalism.com/2026/07/links-7-2-2026.html,0,www.nakedcapitalism.com,Links 7/2/2026,"Our daily links, including US builds concentration camps in Gaza, data centers gobble electricity under the heat dome, UK wealth drop, and Tucker's party.",https://www.nakedcapitalism.com/wp-content/uploads/2026/07/HMHsPufW0AAPEG8-1024x683.jpeg,2026-07-02T10:55:08Z,,"Remote-controlled cockroach swarm can now breathe underwater New Scientist
2 people arrested after hanging a banner about the power of love on Empire State Building antenna AP
Supersonic Flights Ov… [+8045 chars]",,en,heat,Heat Wave,random,,,
https://financialpost.com/pmn/business-pmn/july-heat-wave-threat-to-keep-european-power-prices-elevated,https://financialpost.com/pmn/business-pmn/july-heat-wave-threat-to-keep-european-power-prices-elevated,0,financialpost.com,July Heat Wave Threat to Keep European Power Prices Elevated,The risk of more heat waves this month is keeping European power prices elevated after June’s record temperatures pushed costs to their highest levels since the 2022 energy crisis.,https://smartcdn.gprod.postmedia.digital/financialpost/wp-content/uploads/2026/07/european-power-futures-trade-at-elevated-levels.jpg,2026-07-02T11:57:57Z,,"(Bloomberg) The risk of more heat waves this month is keeping European power prices elevated after Junes record temperatures pushed costs to their highest levels since the 2022 energy crisis.
THIS C… [+4732 chars]",,en,heat,Heat Wave,random,,,
https://timesofindia.indiatimes.com/city/ranchi/imd-issues-orange-alert-for-all-24-jharkhand-districts-as-thunderstorm-lightning-and-heavy-rain-likely-july-12-13/articleshow/132141132.cms,https://timesofindia.indiatimes.com/city/ranchi/imd-issues-orange-alert-for-all-24-jharkhand-districts-as-thunderstorm-lightning-and-heavy-rain-likely-july-12-13/articleshow/132141132.cms,0,timesofindia.indiatimes.com,"IMD issues orange alert for all 24 Jharkhand districts as thunderstorm, lightning and heavy rain likely July 12-13","IMD issues orange alert for all 24 Jharkhand districts July 12-13 as thunderstorms, lightning, 40-50 kmph winds and heavy rain likely in some areas.","https://static.toiimg.com/thumb/msid-132141131,width-1280,height-720,resizemode-6,overlay-toi_sw,pt-32,y_pad-600/photo.jpg",2026-07-02T14:47:49Z,,"<ul><li>News</li>
<li>IMD issues orange alert for all 24 Jharkhand districts as thunderstorm, lightning and heavy rain likely July 12-13</li></ul>
Follow Us On Social Media
Actor moves Ernakulam c… [+1559 chars]",,en,thunderstorm,Thunderstorm,random,,,
https://gizmodo.com/unprecedented-european-heatwave-has-killed-more-than-20000-new-study-claims-2000780605,https://gizmodo.com/unprecedented-european-heatwave-has-killed-more-than-20000-new-study-claims-2000780605,0,gizmodo.com,"Unprecedented European Heatwave Has Killed More Than 20,000, New Study Claims",This preliminary estimate underscores the growing threat of deadly extreme heat events despite efforts to adapt to a warming world.,https://gizmodo.com/app/uploads/2026/07/women-cool-off-amid-heatwave-in-austria--1200x675.jpg,2026-07-02T15:10:28Z,,"For the past two weeks, Europe has been grappling with a blistering heatwave that scientists have called the worst extreme heat event on record for the continent, made possible only by climate change… [+4471 chars]",,en,heat,Heat Wave,random,,,
https://www.abc.net.au/news/2026-07-03/earthquake-rescue/106872998,https://www.abc.net.au/news/2026-07-03/earthquake-rescue/106872998,0,www.abc.net.au,Venezuela earthquake survivor pulled from rubble after eight days,A 43 year old man has been pulled from the rubble of a collapsed shopping centre after being trapped for eight days after earthquakes in Venezuela.,https://live-production.wcms.abc-cdn.net.au/d790df64412bf5c1e07eaf6e3eead943?impolicy=wcms_watermark_news&cropH=2813&cropW=5000&xPos=0&yPos=260&width=862&height=485&imformat=generic,2026-07-02T15:49:41Z,,"A 43 year old man has been pulled from the basement of a collapsed shopping centre, eight days after deadly earthquakes hit Venezuela.
Hernan Alberto Gil Flores was working a night shift as a securi… [+2566 chars]",,en,earthquake,Earthquake,random,,,
https://www.cbc.ca/news/canada/windsor/record-high-temperatures-possible-with-ongoing-extreme-heat-in-windsor-essex-9.7256212,https://www.cbc.ca/news/canada/windsor/record-high-temperatures-possible-with-ongoing-extreme-heat-in-windsor-essex-9.7256212,0,www.cbc.ca,Extreme heat pushes Windsor-Essex closer to 19th-century record temperatures,An orange heat warning continues to be in effect for Windsor-Essex with possibilities of the temperature reaching record level seen in the 1800s.,"https://i.cbc.ca/ais/fb1e2f71-0dc9-4abf-8bff-11a20ee999d4,1782758941208/full/max/0/default.jpg?im=Crop%2Crect%3D%280%2C0%2C1920%2C1080%29%3BResize%3D620",2026-07-02T18:08:41Z,,"An orange heat warning continues to be in effect for Windsor-Essex with possibilities of the temperature reaching record level seen in the 1800s.
It's continuing to be very, very hot, humid and that… [+2844 chars]",,en,record heat,Heat Wave,random,,,
https://www.aljazeera.com/news/2026/7/2/miracle-trapped-man-rescued-eight-days-after-venezuela-earthquakes,https://www.aljazeera.com/news/2026/7/2/miracle-trapped-man-rescued-eight-days-after-venezuela-earthquakes,0,www.aljazeera.com,‘Miracle’: Trapped man rescued eight days after Venezuela earthquakes,"Attention has turned to the humanitarian response after at least 2,295 people are confirmed dead, and 13,000 homeless.",https://www.aljazeera.com/wp-content/uploads/2026/07/epa_6a4699cead1a-1783011790.jpg?resize=1920%2C1440,2026-07-02T18:12:54Z,,"A man has been rescued from a collapsed building eight days after twin earthquakes devastated Venezuela.
The rescue on Thursday came as attention has begun to shift from finding survivors under the … [+3635 chars]",,en,Earthquake Venezuela,Earthquake,usgs,Venezuela,NSA,South-America
https://nypost.com/2026/07/02/us-news/mamdani-cant-even-get-city-hall-to-stick-to-his-78-degree-ac-rule-as-temps-in-building-hit-as-low-as-54/,https://nypost.com/2026/07/02/us-news/mamdani-cant-even-get-city-hall-to-stick-to-his-78-degree-ac-rule-as-temps-in-building-hit-as-low-as-54/,0,nypost.com,Mamdani can’t even get City Hall to stick to his 78-degree AC rule – as temps in building hit as low as 54,"Zo’s so cold. Temperatures inside City Hall plunged as low as 54 degrees Thursday during the ongoing heat wave — despite Mayor Zohran Mamdani urging New Yorkers to set their air conditioners to a balmy 78, The Post found. Sweaty Post reporters armed with an i…",https://nypost.com/wp-content/uploads/sites/2/2026/07/133061015.jpg?quality=75&strip=all&w=1200,2026-07-02T23:08:25Z,,"Zo’s so cold.
Temperatures inside City Hall plunged as low as 54 degrees Thursday during the ongoing heat wave — despite Mayor Zohran Mamdani urging New Yorkers to set their air conditioners to a ba… [+4812 chars]",,en,cold wave,Cold Wave,random,,,
https://economictimes.indiatimes.com/news/new-updates/delhi-ncr-weather-update-imd-issues-yellow-alert-as-monsoon-arrives-in-delhi-heavy-rain-thunderstorms-and-gusty-winds-likely-relief-from-humidity-expected/articleshow/132150866.cms,https://economictimes.indiatimes.com/news/new-updates/delhi-ncr-weather-update-imd-issues-yellow-alert-as-monsoon-arrives-in-delhi-heavy-rain-thunderstorms-and-gusty-winds-likely-relief-from-humidity-expected/articleshow/132150866.cms,0,economictimes.indiatimes.com,"Delhi-NCR weather update: IMD issues yellow alert as monsoon arrives in Delhi; heavy rain, thunderstorms and gusty winds likely, relief from humidity expected","Rain in Delhi: Delhi is bracing for heavy rainfall and thunderstorms as the India Meteorological Department has issued a yellow alert. The monsoon has officially arrived, bringing much-needed relief from humidity. Residents can expect moderate to heavy shower…","https://img.etimg.com/thumb/msid-132150980,width-1200,height-630,imgsize-316431,overlay-economictimes/articleshow.jpg",2026-07-03T02:27:52Z,,"The India Meteorological Department (IMD) has sounded a yellow alert for Delhi and its adjoining areas for July 3, Friday, forecasting a generally cloudy sky with moderate rainfall. Rain lashed sever… [+4903 chars]",,en,Thunderstorm India,Thunderstorm,wmo,India,SAS,Asia
https://www.abc.net.au/news/2026-07-03/man-rescued-from-car-rooftop-as-storm-clean-up-underway/106874578,https://www.abc.net.au/news/2026-07-03/man-rescued-from-car-rooftop-as-storm-clean-up-underway/106874578,0,www.abc.net.au,Man rescued from flood waters as SA wild weather leaves trail of damage,Storm damage have prompted extensive clean-ups across South Australia while a man had to be rescued from his vehicle's rooftop after he tried to drive through flood waters.,https://live-production.wcms.abc-cdn.net.au/d06597c4890bf3cfb8b63443ea164c77?impolicy=wcms_watermark_news&cropH=983&cropW=1747&xPos=121&yPos=58&width=862&height=485&imformat=generic,2026-07-03T04:38:09Z,,"Storm damage has prompted extensive clean-ups across South Australia while a man had to be rescued from his vehicle's rooftop after he tried to drive through flood waters.
Emergency services were ca… [+4069 chars]",,en,flood Australia,Flood,aidr,Australia,EAU,Oceania
https://www.dw.com/en/as-heat-waves-loom-scientists-wonder-how-humans-will-adapt/a-77798828,https://www.dw.com/en/as-heat-waves-loom-scientists-wonder-how-humans-will-adapt/a-77798828,0,www.dw.com,"As heat waves loom, scientists wonder how humans will adapt","Temperatures are set to soar in the US around the July 4 holiday, a week after Europe struck new records. With experts predicting more intense and more frequent heat waves in the future, can our bodies adapt?",https://static.dw.com/image/77733889_6.jpg,2026-07-03T05:51:00Z,,"Late June brought record-breaking temperatures to France, Spain, the United Kingdom, Belgium, the Netherlands, Switzerland and Germany. Germany's national weather service, DWD, reported that the coun… [+5304 chars]",,en,heat wave,Heat Wave,random,,,
https://sports.yahoo.com/articles/eastern-heat-july-4-threatens-070826878.html,https://sports.yahoo.com/articles/eastern-heat-july-4-threatens-070826878.html,0,sports.yahoo.com,Eastern heat on July 4 threatens World Cup players and fans,"Saturday's afternoon knockout round game between France and Paraguay in Philadelphia could be this World Cup tournament's hottest, posing dangers to the region as well as athletes and tens of thousands of fans in the open-air stadium. A heat wave is expected …",https://s.yimg.com/ny/api/res/1.2/iY.cHgKNQpT2Q2SpZd79Hg--/YXBwaWQ9aGlnaGxhbmRlcjt3PTEyMDA7aD04MDA7Y2Y9d2VicA--/https://media.zenfs.com/en/ap.org/7bf225017c22319d9b9e24709a2400f0,2026-07-03T07:08:26Z,,"LOS ANGELES (AP) Saturday's afternoon knockout round game between France and Paraguay in Philadelphia could be this World Cup tournament's hottest, posing dangers to the region as well as athletes an… [+5624 chars]",,en,heat,Heat Wave,random,,,
https://abcnews.com/Health/wireStory/eastern-heat-july-4-threatens-world-cup-players-134435025,https://abcnews.com/Health/wireStory/eastern-heat-july-4-threatens-world-cup-players-134435025,0,abcnews.com,Eastern heat on July 4 threatens World Cup players and fans,"Forecasters say the hottest World Cup tournament match so far this year could hit Saturday afternoon, during the knockout round game between France and Paraguay in Philadelphia",https://i.abcnewsfe.com/a/f881ecb9-00c9-465a-9a24-e8363ac20ba7/wirestory_e88edfc869146a2898928177e8c52286_16x9.jpg?w=1600,2026-07-03T07:37:18Z,,"LOS ANGELES -- Saturday's afternoon knockout round game between France and Paraguay in Philadelphia could be this World Cup tournament's hottest, posing dangers to the region as well as athletes and … [+5634 chars]",,en,heat,Heat Wave,random,,,
https://www.nationalobserver.com/2026/07/03/news/eastern-heat-july-4-threatens-world-cup-players-fans,https://www.nationalobserver.com/2026/07/03/news/eastern-heat-july-4-threatens-world-cup-players-fans,0,www.nationalobserver.com,Eastern heat on July 4 threatens the World Cup players and fans,"Saturday's afternoon knockout round game between France and Paraguay in Philadelphia could be this World Cup tournament's hottest, posing dangers to the region as well as athletes and tens of thousands of fans in the open-air stadium.",https://www.nationalobserver.com/sites/default/files/img/2026/07/03/eaa1df0f8dda47ed5e85519983b23f00a5470a420c02a8b815d4924978ba1095.jpg,2026-07-03T10:19:01Z,,"Saturday's afternoon knockout round game between France and Paraguay in Philadelphia could be this World Cup tournament's hottest, posing dangers to the region as well as athletes and tens of thousan… [+5629 chars]",,en,heat,Heat Wave,random,,,
https://www.nakedcapitalism.com/2026/07/links-7-3-2026.html,https://www.nakedcapitalism.com/2026/07/links-7-3-2026.html,0,www.nakedcapitalism.com,Links 7/3/2026,"Our daily links, including setting precedent with NATO strikes in Russia, labor participation rate collapse, Germany bans illness, and worse heat on the way.",https://www.nakedcapitalism.com/wp-content/uploads/2026/07/FpdpmbmXEAAU9BN-1024x614.jpeg,2026-07-03T10:55:51Z,,"Artificial cell manages a few rounds of cell division Ars Technica
NYC hotel evacuated after bear spray released inside, NYPD says CBS News
Mystery leak from semi-truck in Ohio turns out to be Fran… [+6519 chars]",,en,heat,Heat Wave,random,,,
https://www.nbcnews.com/news/us-news/july-fourth-celebrations-folarin-balogun-red-card-morning-rundown-rcna352845,https://www.nbcnews.com/news/us-news/july-fourth-celebrations-folarin-balogun-red-card-morning-rundown-rcna352845,0,www.nbcnews.com,July Fourth celebrations commence and Folarin Balogun’s red card sparks debate: Morning Rundown,The U.S. begins a weekend of 250th birthday celebrations amid heat alerts across much of the country.,"https://media-cldnry.s-nbcnews.com/image/upload/t_nbcnews-fp-1200-630,f_auto,q_auto:best/rockcms/2026-06/260627-great-american-state-fair-ww-1147-e74680.jpg",2026-07-03T11:01:44Z,,The U.S. begins a weekend of 250th birthday celebrations amid heat alerts across much of the country. Trumps financial disclosure reveals previously unreported stock purchases made a day before he pa… [+7016 chars],,en,heat,Heat Wave,random,,,
https://www.theatlantic.com/photography/2026/07/photos-of-the-week-world-cup-wine-battle-white-kimono/687784/,https://www.theatlantic.com/photography/2026/07/photos-of-the-week-world-cup-wine-battle-white-kimono/687784/,0,www.theatlantic.com,"Photos of the Week: World Cup, Wine Battle, White Kimono","A scorching heat wave in Europe, a bonfire celebration in Argentina, a Pride parade in Seattle, semiquincentennial celebrations across America, and much more",https://cdn.theatlantic.com/thumbor/kZcwDuVqK40MLmvh4maU1QhSPNo=/0x592:8038x4779/1200x625/media/img/mt/2026/07/a01_G_2283648383/original.jpg,2026-07-03T13:00:00Z,,"Chip Somodevilla / Getty
A rainbow arcs over the giant, crumbling concrete busts of former U.S. presidents, including George Washington, at the Presidents Heads, following an evening rain storm on J… [+7890 chars]",,en,heat wave,Heat Wave,random,,,
https://www.dw.com/en/heat-wave-european-countries-report-3700-excess-deaths/a-77823303,https://www.dw.com/en/heat-wave-european-countries-report-3700-excess-deaths/a-77823303,0,www.dw.com,"Heat wave: European countries report 3,700 excess deaths","Thousands of excess fatalities have been recorded across Europe following last week's heat wave, especially among older people. In France, the prime minister is facing a no-confidence vote over the crisis.",https://static.dw.com/image/77799859_6.jpg,2026-07-03T14:19:00Z,,"At least 3,700 excess deaths have been recorded in France, Belgium and the Netherlands alone as a result of the June heat wave that sent temperatures soaring above 40°C (104°F).
Experts have said th… [+4498 chars]",,en,Heat Wave France,Heat Wave,wmo,France,WCE,Europe
https://nypost.com/2026/07/03/us-news/4th-of-july-weather-thunderstorm-set-to-strike-nyc-during-firworks/,https://nypost.com/2026/07/03/us-news/4th-of-july-weather-thunderstorm-set-to-strike-nyc-during-firworks/,0,nypost.com,4th of July weather: Thunderstorm set to strike NYC during firworks,"“Keep an eye on the sky. Lightning is a big concern,"" said AccuWeather Senior Meteorologist Matt Benz.",https://nypost.com/wp-content/uploads/sites/2/2026/07/133148830.jpg?quality=75&strip=all&w=1200,2026-07-03T18:06:41Z,,"Mother Nature wants to put on her own fireworks show!
A booming thunderstorm is poised to strike the Big Apple during the Fourth of July fireworks festivities, as sweltering heat continues to bake t… [+2032 chars]",,en,storm,Storm,random,,,
https://www.channelnewsasia.com/sport/fifa-mulling-kickoff-time-changes-mexico-england-and-brazil-norway-sources-say-6231236,https://www.channelnewsasia.com/sport/fifa-mulling-kickoff-time-changes-mexico-england-and-brazil-norway-sources-say-6231236,0,www.channelnewsasia.com,"FIFA mulling kickoff time changes for Mexico-England and Brazil-Norway, sources say","MEXICO CITY/NEW YORK, July 3 : FIFA is considering changing the kick-off times of two World Cup last-16 matches on Sunday as severe weather, including a risk of flooding, in Mexico City threatens to disrupt the schedule, sources familiar with the matter told …","https://dam.mediacorp.sg/image/upload/s--V5jeC4qC--/c_fill,g_auto,h_676,w_1200/fl_relative,g_south_east,l_mediacorp:cna:watermark:2024-04:reuters_1,w_0.1/f_auto,q_auto/v1/one-cms/core/2026-07-03T183818Z_1_LYNXMPEM62125_RTROPTP_3_SOCCER-WORLDCUP-MEX-ECU.JPG?itok=eWERWX48",2026-07-03T18:38:18Z,,"MEXICO CITY/NEW YORK, July 3 : FIFA is considering changing the kick-off times of two World Cup last-16 matches on Sunday as severe weather, including a risk of flooding, in Mexico City threatens to … [+2996 chars]",,en,Flooding Norway,Flood,wmo,Norway,NEU,Europe
https://www.channelnewsasia.com/sport/mexico-england-game-kick-earlier-due-storm-risk-says-local-media-6231236,https://www.channelnewsasia.com/sport/mexico-england-game-kick-earlier-due-storm-risk-says-local-media-6231236,0,www.channelnewsasia.com,"Mexico-England game to kick off earlier due to storm risk, says local media","MEXICO CITY, July 3 : Mexico's clash with England in the World Cup round of 16 at the Estadio Azteca on Sunday will be moved to noon local time (1800 GMT), local media reported on Friday.The kick-off was originally scheduled for 6 p.m. local time (0000 GMT), …","https://dam.mediacorp.sg/image/upload/s--V5jeC4qC--/c_fill,g_auto,h_676,w_1200/fl_relative,g_south_east,l_mediacorp:cna:watermark:2024-04:reuters_1,w_0.1/f_auto,q_auto/v1/one-cms/core/2026-07-03T183818Z_1_LYNXMPEM62125_RTROPTP_3_SOCCER-WORLDCUP-MEX-ECU.JPG?itok=eWERWX48",2026-07-03T18:38:18Z,,"MEXICO CITY, July 3 : Mexico's clash with England in the World Cup round of 16 at the Estadio Azteca on Sunday will be moved to noon local time (1800 GMT), local media reported on Friday.
The kick-o… [+379 chars]",,en,storm,Storm,random,,,
https://www.cbssports.com/soccer/news/england-mexico-world-cup-kickoff-time-change-weather-threat/,https://www.cbssports.com/soccer/news/england-mexico-world-cup-kickoff-time-change-weather-threat/,0,www.cbssports.com,"England vs. Mexico World Cup kickoff time could be changed due to weather threat, per multiple reports",The round of 16 blockbuster at Estadio Azteca could kick off earlier than scheduled to avoid severe storms in Mexico City,https://sportshub.cbsistatic.com/i/r/2026/07/03/a0ac9c09-65d4-44d6-a589-4e20bef67d8c/thumbnail/1200x675/7deb461f1358681750c6c362d5f1feda/untitled-design-2026-07-03t153429-388.png,2026-07-03T19:38:34Z,,"England's blockbuster World Cup round of 16 date with co-hosts Mexico may be getting a major schedule shakeup, with kickoff potentially moving six hours earlier because of threatening weather in the … [+1400 chars]",,en,storm,Storm,random,,,
https://www.npr.org/2026/07/03/g-s1-131963/iran-plans-dayslong-funeral-for-supreme-leader-khamenei-after-war-death,https://www.npr.org/2026/07/03/g-s1-131963/iran-plans-dayslong-funeral-for-supreme-leader-khamenei-after-war-death,0,www.npr.org,Iran plans dayslong funeral for Supreme Leader Khamenei after war death,The country's theocracy hopes to see millions flood the streets of the capital beginning Saturday in scenes reminiscent to the burial of the late Supreme Leader Ayatollah Ruhollah Khomeini in 1989.,https://npr.brightspotcdn.com/dims3/default/strip/false/crop/6000x3375+0+313/resize/1400/quality/85/format/jpeg/?url=http%3A%2F%2Fnpr-brightspot.s3.amazonaws.com%2F5e%2Fd4%2F0bad426147199bd93d61511df106%2Fap26184127491584.jpg,2026-07-03T19:45:24Z,,"TEHRAN, Iran Iran prepared Friday for the dayslong funeral of the late Supreme Leader Ayatollah Ali Khamenei, with banners across Tehran urging the public to rise up in support of the Islamic Republi… [+5360 chars]",,en,Flood Ning er,Flood,wmo,China,EAS,Asia
https://punchng.com/england-vs-mexico-world-cup-kickoff-could-be-moved-earlier-report/,https://punchng.com/england-vs-mexico-world-cup-kickoff-could-be-moved-earlier-report/,0,punchng.com,England vs Mexico World Cup kickoff could be moved earlier — Report,"England’s World Cup last 16 match against Mexico could see an earlier kickoff due to storm and flooding risks. FIFA is reportedly discussing the schedule c

Read More: https://punchng.com/england-vs-mexico-world-cup-kickoff-could-be-moved-earlier-report/",https://punchng.com/wp-content/uploads/2026/07/AFP__20260702__pedersen-englandv260701_np0Qd__v1__Mockup__EnglandVDrCongoRoundOf32Fi_1783005657-1024x630.webp,2026-07-03T20:22:18Z,,"Elliot Anderson (England) during Round of 32 FIFA World Cup 2026, England and DR Congo, Atlanta Stadium, Atlanta, United States on July 01 2026. (Photo by Ulrik Pedersen/NurPhoto) 
England’s World C… [+611 chars]",,en,storm,Storm,random,,,
https://sports.yahoo.com/articles/france-braced-extreme-heat-threat-210239829.html,https://sports.yahoo.com/articles/france-braced-extreme-heat-threat-210239829.html,0,sports.yahoo.com,France braced for extreme heat threat in World Cup clash with Paraguay,France coach Didier Deschamps promised Friday his team would be able to adapt to the potential impact of extreme weather on their World Cup last-16 tie against Paraguay on Saturday as a brutal heatwave hits the northeastern United States.Global players union …,https://s.yimg.com/lo/mysterio/api/bcd76d96b98046d8de398ca89c70a3a0719ce38142ac53337ca64e6c8b28af9b/lightyear_networkapi/resizefill_w768_h512;quality_80;format_webp/https:%2F%2Fmedia.zenfs.com%2Fen%2Fafp.com%2Fb8910872b23cd8818cd1015ebe77d4a6,2026-07-03T21:02:39Z,,France coach Didier Deschamps promised Friday his team would be able to adapt to the potential impact of extreme weather on their World Cup last-16 tie against Paraguay on Saturday as a brutal heatwa… [+3587 chars],,en,Heat Wave United States,Heat Wave,wmo,United States,CNA,North-America
https://www.vanguardngr.com/2026/07/france-braced-for-extreme-heat-threat-in-world-cup-clash-with-paraguay/,https://www.vanguardngr.com/2026/07/france-braced-for-extreme-heat-threat-in-world-cup-clash-with-paraguay/,0,www.vanguardngr.com,France braced for extreme heat threat in World Cup clash with Paraguay,"""We knew it would be very hot. I think tomorrow it will be a little cooler than today, and I hope there are no storms this time,"" Deschamps told reporters at Lincoln Financial Field, where Saturday's game will take place.
The post France braced for extreme he…",https://cdn.vanguardngr.com/wp-content/uploads/2025/01/deschamps.jpeg,2026-07-03T21:22:48Z,,France coach Didier Deschamps promised Friday his team would be able to adapt to the potential impact of extreme weather on their World Cup last-16 tie against Paraguay on Saturday as a brutal heatwa… [+3547 chars],,en,storm,Storm,random,,,
