index,url,valid,domain,title,description,image,published,archive,content,quote,language,term,topic,feed,country,ipcc,continent
https://phys.org/news/2023-11-largest-magnetic-storms-history-quantified.html,https://phys.org/news/2023-11-largest-magnetic-storms-history-quantified.html,0,phys.org,One of the largest magnetic storms in history quantified: Aurorae from the tropics to the polar regions,"In early November of this year, aurora borealis were observed at surprisingly low latitudes, as far south as Italy and Texas. Such phenomena indicate the impacts of a solar coronal mass ejection on the Earth's magnetic field and atmosphere. Far more dramatic …",https://scx2.b-cdn.net/gfx/news/hires/2023/one-of-the-largest-mag.jpg,2023-12-01T00:00:04Z,https://web.archive.org/web/20231201002917/https://phys.org/news/2023-11-largest-magnetic-storms-history-quantified.html,"In early November of this year, aurora borealis were observed at surprisingly low latitudes, as far south as Italy and Texas. Such phenomena indicate the impacts of a solar coronal mass ejection on t… [+5595 chars]",,en,Storm Italy,Storm,wmo,Italy,MED,Europe
https://slashdot.org/firehose.pl?op=view&amp;id=172342027,https://slashdot.org/firehose.pl?op=view&amp;id=172342027,0,slashdot.org,"'Long-duration' storm to blast Pacific Northwest with flooding, snow - The Washington Post","'Long-duration' storm to blast Pacific Northwest with flooding, snowThe Washington Post Atmospheric River To Wallop The West With Flooding Rain, Feet Of Mountain SnowFOX Weather Parade of potent storms to bring wet weather to Western WAThe Seattle Times What …",,2023-12-01T03:13:48Z,,Sign up for the Slashdot newsletter! OR check out the new Slashdot job board to browse remote jobs or jobs in your areaDo you develop on GitHub? You can keep using GitHub but automatically sync your … [+268 chars],,en,Flooding Pacific,Flood,wmo,United States,CNA,North-America
https://www.news.com.au/technology/environment/40-millions-lightning-strikes-detected-in-australia-in-november/news-story/0051e8d81c6b92a8aa4534b881805506,https://www.news.com.au/technology/environment/40-millions-lightning-strikes-detected-in-australia-in-november/news-story/0051e8d81c6b92a8aa4534b881805506,0,www.news.com.au,Weather: 40 millions lightning strikes detected in Australia in November,"A tropical cyclone could form over the weekend before making its way towards the Australian far northeast coast but won’t make direct impact, the Bureau of Meteorology has warned.",https://content.api.news/v3/images/bin/9266b1d7bc99fa5c05f324e8b2ca4a6a,2023-12-01T04:44:34Z,https://web.archive.org/web/20231201030610/https://www.news.com.au/technology/environment/40-millions-lightning-strikes-detected-in-australia-in-november/news-story/0051e8d81c6b92a8aa4534b881805506,"A tropical cyclone could form over the weekend before making its way towards the Australian far northeast coast but won’t make direct impact, the Bureau of Meteorology has warned.
The alert was issu… [+4082 chars]",,en,tropical cyclone Australia,Tropical Cyclone,aidr,Australia,NAU,Oceania
https://www.globalsecurity.org/military/library/news/2023/11/mil-231130-unnews02.htm,https://www.globalsecurity.org/military/library/news/2023/11/mil-231130-unnews02.htm,0,www.globalsecurity.org,Needs rise as flooding spreads in Somalia,"Deadly torrential rains and floods have affected more than two million people in several areas of Somalia, with over 100 killed and 750,000 displaced from their homes, the authorities and humanitarian partners said on Thursday in the capital, Mogadishu.",,2023-12-01T08:09:43Z,https://web.archive.org/web/20231204105949/https://www.globalsecurity.org/military/library/news/2023/11/mil-231130-unnews02.htm,"30 November 2023 - Deadly torrential rains and floods have affected more than two million people in several areas of Somalia, with over 100 killed and 750,000 displaced from their homes, the authorit… [+2040 chars]",,en,Torrential Rain Somalia,Precipitation,relief,Somalia,NEAF,Africa
https://www.globalsecurity.org/military/library/news/2023/11/mil-231130-unocha01.htm,https://www.globalsecurity.org/military/library/news/2023/11/mil-231130-unocha01.htm,0,www.globalsecurity.org,Somalia in the midst of disaster as devastating rains and floods spread,"Six months after Somalia emerged from a historic drought that pushed the country to the brink of widespread famine, another climate shock has struck as heavy rains and floods batter several areas of the country.",,2023-12-01T08:09:49Z,https://web.archive.org/web/20231203014820/https://www.globalsecurity.org/military/library/news/2023/11/mil-231130-unocha01.htm,"UNOCHA - United Nations Office for the Coordination of Humanitarian Affairs
Mogadishu, 30 November 2023 -- Six months after Somalia emerged from a historic drought that pushed the country to the bri… [+3298 chars]",,en,Drought Somalia,Drought,relief,Somalia,NEAF,Africa
https://news.un.org/en/story/2023/12/1144247,https://news.un.org/en/story/2023/12/1144247,0,news.un.org,Unprecedented drought emergency demands urgent action,"A new report by the UN team combatting desertification reveals alarming trends over the past two years which have resulted in an unprecedented emergency due to human-induced droughts. Read Full Story on UN News
The post Unprecedented drought emergency demands…",https://global.unitednations.entermediadb.net/assets/mediadb/services/module/asset/downloads/preset/Libraries/Production%20Library/20-11-2023-UNICEF-Climate_change-UNI417897.jpg/image770x420cropped.jpg,2023-12-01T12:00:00Z,https://web.archive.org/web/20231201235036/https://news.un.org/en/story/2023/12/1144247,"Greater investments in meteorological monitoring, data collection and risk assessment can help respond quickly to drought emergencies and minimize impacts, it said, calling also for international coo… [+1868 chars]",,en,drought,Drought,random,,,
https://www.newscientist.com/article/2405887-world-must-prepare-for-frequent-and-severe-droughts-report-warns/,https://www.newscientist.com/article/2405887-world-must-prepare-for-frequent-and-severe-droughts-report-warns/,0,www.newscientist.com,"World must prepare for frequent and severe droughts, report warns","With climate change driving more intense dry spells, the world must invest in early warning systems and measures to conserve water, a UN report says",https://images.newscientist.com/wp-content/uploads/2023/11/30151429/SEI_182198651.jpg,2023-12-01T12:00:55Z,https://web.archive.org/web/20231204105900/https://www.newscientist.com/article/2405887-world-must-prepare-for-frequent-and-severe-droughts-report-warns/,"A severe drought this year affected the Rio Negro, a tributary of the Amazon, in Brazil
Andre Coelho/EPA-EFE/Shutterstock
The increasing frequency and severity of droughts across the world is an un… [+3322 chars]",,en,drought,Drought,random,,,
https://www.bbc.co.uk/news/newsbeat-67155047,https://www.bbc.co.uk/news/newsbeat-67155047,0,www.bbc.co.uk,Why weather in games is getting more realistic,"Games developers are putting more effort into recreating lifelike rain, fog and wind - but why?",https://ichef.bbci.co.uk/news/1024/branded_news/52DF/production/_131851212_forzamotorsport_keyart_1080x1920.png,2023-12-01T12:12:32Z,https://web.archive.org/web/20231201214134/https://www.bbc.co.uk/news/newsbeat-67155047,"If it's winter where you are, you might wonder why anyone would want to simulate the weather outside - but that's what many game developers are trying to do.
In their mission to make more realistic … [+5382 chars]",,en,Rain,Precipitation,wmo,Argentina,SES,South-America
https://phys.org/news/2023-12-silent-devastation-drought-globally-climate.html,https://phys.org/news/2023-12-silent-devastation-drought-globally-climate.html,0,phys.org,"'Silent devastation' of drought set to increase globally under climate change, says UN report","Recent drought-related data compiled by the UN point to ""an unprecedented emergency on a planetary scale, where the massive impacts of human-induced droughts are only starting to unfold.""",https://scx2.b-cdn.net/gfx/news/hires/2023/drought-2.jpg,2023-12-01T16:19:05Z,https://web.archive.org/web/20231201182715/https://phys.org/news/2023-12-silent-devastation-drought-globally-climate.html,"Recent drought-related data compiled by the UN point to ""an unprecedented emergency on a planetary scale, where the massive impacts of human-induced droughts are only starting to unfold.""
According … [+9715 chars]",,en,drought,Drought,random,,,
https://www.resilience.org/stories/2023-12-01/review-the-book-of-rain-by-thomas-wharton/,https://www.resilience.org/stories/2023-12-01/review-the-book-of-rain-by-thomas-wharton/,0,www.resilience.org,Review: “The Book of Rain” by Thomas Wharton,"The story takes place in a near-future version of western Canada and centers on a fictional town called River Meadows, which once served as an epicenter for the extraction and production of a fossil fuel-like substance called ghost ore. This ore is vastly mor…",https://www.resilience.org/wp-content/uploads/2023/12/Wreathed_hornbill_male_flying_in_rain_AD.jpg,2023-12-01T18:20:51Z,https://web.archive.org/web/20231201223904/https://www.resilience.org/stories/2023-12-01/review-the-book-of-rain-by-thomas-wharton/,"The Book of Rain: A NovelBy Thomas WhartonRandom House of Canada, Mar. 2023, 412 pp., ebook: $16.99, hardcover: $35.95.
Thomas Whartons The Book of Rain, a mind-bending eco-science fiction novel tha… [+6187 chars]",,en,Rain,Precipitation,wmo,Argentina,SES,South-America
https://www.cbc.ca/news/canada/british-columbia/atmospheric-river-hits-bc-december-1.7046612,https://www.cbc.ca/news/canada/british-columbia/atmospheric-river-hits-bc-december-1.7046612,0,www.cbc.ca,Southwest B.C. warned to brace for heavy rain and snow with incoming atmospheric river,Authorities in British Columbia have issued warnings to residents of the province's southwest to prepare for an atmospheric river bearing down on the area.,https://i.cbc.ca/1.6640367.1701459268!/fileImage/httpImage/image.jpg_gen/derivatives/16x9_620/atmospheric-river.jpg,2023-12-01T20:16:28Z,,"Authorities in British Columbia have issued warnings to residents of the province's southwest to prepare for an atmospheric river bearing down on the area.
The statement from the Ministry of Emergen… [+1505 chars]",,en,atmospheric river,Precipitation,random,,,
https://www.cbc.ca/news/canada/edmonton/celestial-surprise-edmonton-man-discovers-meteorite-in-his-rain-gutter-1.7046621,https://www.cbc.ca/news/canada/edmonton/celestial-surprise-edmonton-man-discovers-meteorite-in-his-rain-gutter-1.7046621,0,www.cbc.ca,Celestial surprise: Edmonton man discovers meteorite in his rain gutter,"Doug Olson discovered a pebble-sized meteorite on his roof, marking Alberta's first witnessed meteorite fall since 1977.",https://i.cbc.ca/1.7047162.1701475820!/fileImage/httpImage/image.jpg_gen/derivatives/16x9_620/doug-olson-meteorite-man.jpg,2023-12-02T00:42:11Z,,"Doug Olson heard a loud thud on his roof while folding laundry in October last year. When he went out to investigate the cause of the sound, he didn't find anything out of the ordinary. 
But earlier… [+2214 chars]",,en,Rain,Precipitation,wmo,Argentina,SES,South-America
https://slashdot.org/firehose.pl?op=view&amp;id=172348381,https://slashdot.org/firehose.pl?op=view&amp;id=172348381,0,slashdot.org,National Weather Service issues flood watch for NW Oregon - KOIN.com,"National Weather Service issues flood watch for NW OregonKOIN.com Series Of Atmospheric Rivers Take Aim At Pacific Northwest With Heavy Rain, Feet Of SnowFOX Weather Flood watch, winter storm warning in effect for Whatcom, Skagit going into weekendCascadia Da…",,2023-12-02T05:33:23Z,,Sign up for the Slashdot newsletter! OR check out the new Slashdot job board to browse remote jobs or jobs in your areaDo you develop on GitHub? You can keep using GitHub but automatically sync your … [+268 chars],,en,Flood Skagit,Flood,wmo,United States,CNA,North-America
https://www.globalsecurity.org/military/library/news/2023/12/mil-231201-unnews03.htm,https://www.globalsecurity.org/military/library/news/2023/12/mil-231201-unnews03.htm,0,www.globalsecurity.org,Unprecedented drought emergency demands urgent action,A new report by the UN team combatting desertification reveals alarming trends over the past two years which have resulted in an unprecedented emergency due to human-induced droughts.,,2023-12-02T08:38:06Z,,1 December 2023 - A new report by the UN team combatting desertification reveals alarming trends over the past two years which have resulted in an unprecedented emergency due to human-induced drought… [+3507 chars],,en,drought,Drought,random,,,
https://www.cbc.ca/news/canada/ottawa/snowfall-rain-weather-statement-1.7047348,https://www.cbc.ca/news/canada/ottawa/snowfall-rain-weather-statement-1.7047348,0,www.cbc.ca,"Mix of freezing rain, heavy snowfall expected in Ottawa this weekend","Environment Canada says significant snowfall and possible freezing rain are expected Sunday and Monday over a wide area of eastern Ontario, including Ottawa.",https://i.cbc.ca/1.6768572.1701523167!/fileImage/httpImage/image.JPG_gen/derivatives/16x9_620/ont-winter-storm-20230304.JPG,2023-12-02T13:23:25Z,,"Environment Canada says significant snowfall and possible freezing rain are expected Sunday and Monday over a wide area of eastern Ontario, including Ottawa.
The agency's special weather statement s… [+649 chars]",,en,Freezing,Snow&Ice,wmo,Argentina,SES,South-America
https://www.denverpost.com/2023/12/02/7-6-magnitude-earthquake-strikes-off-the-southern-philippines-and-a-tsunami-warning-is-issued/,https://www.denverpost.com/2023/12/02/7-6-magnitude-earthquake-strikes-off-the-southern-philippines-and-a-tsunami-warning-is-issued/,0,www.denverpost.com,7.6 magnitude earthquake strikes off the southern Philippines and a tsunami warning is issued,"An earthquake with a preliminary magnitude of 7.6 has struck off the coast of the southern Philippines island of Mindanao. A tsunami warning was issued. Based on the magnitude and location, the Pacific Tsunami Warning Center says it expects tsunami waves to h…",https://www.denverpost.com/wp-content/uploads/2020/11/denverpost.jpg,2023-12-02T15:16:04Z,,"MANILA, Philippines (AP) — A powerful earthquake with a preliminary magnitude of 7.6 struck Saturday night off the coast of the southern Philippine island of Mindanao and Philippine authorities issue… [+1377 chars]",,en,Tsunami Mindanao Philippines,Tsunami,usgs,,SEA,Asia
https://www.denverpost.com/2023/12/02/7-6-magnitude-earthquake-strikes-off-the-southern-philippines-and-tsunami-warnings-are-issued/,https://www.denverpost.com/2023/12/02/7-6-magnitude-earthquake-strikes-off-the-southern-philippines-and-tsunami-warnings-are-issued/,0,www.denverpost.com,7.6 magnitude earthquake strikes off the southern Philippines and tsunami warnings are issued,"An earthquake with a preliminary magnitude of 7.6 has struck off the coast of the southern Philippines island of Mindanao. Based on the magnitude and location, the Pacific Tsunami Warning Center said it expected tsunami waves to hit the southern Philippines a…",https://www.denverpost.com/wp-content/uploads/2020/11/denverpost.jpg,2023-12-02T15:16:04Z,,"MANILA, Philippines (AP) — A powerful earthquake with a preliminary magnitude of 7.6 struck Saturday off the southern Philippine coast, prompting many villagers to flee their homes in panic around mi… [+2103 chars]",,en,tsunami,Tsunami,random,,,
https://www.businesstoday.in/latest/world/story/magnitude-75-earthquake-strikes-mindanao-philippines-first-tsunami-waves-to-arrive-before-midnight-report-407984-2023-12-02,https://www.businesstoday.in/latest/world/story/magnitude-75-earthquake-strikes-mindanao-philippines-first-tsunami-waves-to-arrive-before-midnight-report-407984-2023-12-02,0,www.businesstoday.in,"Magnitude 7.5 earthquake strikes Mindanao, Philippines; first tsunami waves to arrive before midnight: Report",EMSC noted that the quake occurred at a depth of 63 km (39 miles).,https://akm-img-a-in.tosshub.com/businesstoday/images/story/202312/hbhjjhhjg_30-sixteen_nine.jpg,2023-12-02T15:28:00Z,,"A magnitude 7.5 earthquake hit Mindanao, Philippines, as reported by the European-Mediterranean Seismological Centre (EMSC) on Saturday.
EMSC noted that the quake occurred at a depth of 63 km (39 mi… [+475 chars]",,en,Tsunami Mindanao Philippines,Tsunami,usgs,,SEA,Asia
https://www.thestar.com.my/news/world/2023/12/02/earthquake-of-75-strikes-philippines-tsunami-expected-in-philippines-and-japan,https://www.thestar.com.my/news/world/2023/12/02/earthquake-of-75-strikes-philippines-tsunami-expected-in-philippines-and-japan,0,www.thestar.com.my,"Earthquake of 7.5 strikes Philippines, tsunami expected in Philippines and Japan","(Reuters) -An earthquake of magnitude 7.5 struck Mindanao, Philippines, on Saturday, the European-Mediterranean Seismological Centre (EMSC) said, at a depth of 63 km (39 miles), and tsunamis were expected to hit the Philippines and Japan shortly. Read full st…",https://cdn.thestar.com.my/Themes/img/newTsol_logo_socmedia.png,2023-12-02T15:34:00Z,,"(Reuters) -An earthquake of magnitude 7.5 struck Mindanao, Philippines, on Saturday, the European-Mediterranean Seismological Centre (EMSC) said, at a depth of 63 km (39 miles), and tsunamis were exp… [+640 chars]",,en,Earthquake Japan,Earthquake,usgs,Japan,NPO,Pacific Ocean
https://slashdot.org/firehose.pl?op=view&amp;id=172350711,https://slashdot.org/firehose.pl?op=view&amp;id=172350711,0,slashdot.org,"Magnitude 7.5 earthquake strikes Mindanao, Philippines - Reuters","Magnitude 7.5 earthquake strikes Mindanao, PhilippinesReuters Tsunami Warning After 7.5 Magnitude Earthquake Strikes PhilippinesNDTV Magnitude 7.5 earthquake strikes Mindanao, Philippines; tsunami warning issuedThe Hindu Earthquake of magnitude 7.5 strikes so…",,2023-12-02T15:34:59Z,,Sign up for the Slashdot newsletter! OR check out the new Slashdot job board to browse remote jobs or jobs in your areaDo you develop on GitHub? You can keep using GitHub but automatically sync your … [+268 chars],,en,Tsunami Mindanao Philippines,Tsunami,usgs,,SEA,Asia
https://www.independent.ie/world-news/powerful-magnitude-75-earthquake-strikes-off-philippines-coast-triggering-tsunami-waves-barrelling-towards-philippines-and-japan/a2144333615.html,https://www.independent.ie/world-news/powerful-magnitude-75-earthquake-strikes-off-philippines-coast-triggering-tsunami-waves-barrelling-towards-philippines-and-japan/a2144333615.html,0,www.independent.ie,Powerful magnitude 7.5 earthquake strikes off Philippines coast triggering tsunami waves barrelling towards Philippines and Japan,"An earthquake of magnitude 7.5 struck Mindanao, Philippines, on Saturday, the European-Mediterranean Seismological Centre (EMSC) said, at a depth of 63 km (39 miles), and tsunamis were expected to hit the Philippines and Japan shortly.",https://focus.independent.ie/thumbor/f8YWgGPRKlyL0fwdjii8HmUcwUQ=/0x1:4599x3067/4599x3066/prod-mh-ireland/ae912c56-b136-4c25-b1ce-f1cf1cfe2dcf/a57e8f30-afe8-49bd-8562-2bc0705020b8/ae912c56-b136-4c25-b1ce-f1cf1cfe2dcf.jpg,2023-12-02T15:35:46Z,,"Breaking | 
An earthquake of magnitude 7.5 struck Mindanao, Philippines, on Saturday, the European-Mediterranean Seismological Centre (EMSC) said, at a depth of 63 km (39 miles), and tsunamis were e… [+204 chars]",,en,Tsunami Philippines,Tsunami,usgs,Philippines,SEA,Asia
https://www.dw.com/en/tsunami-threat-recedes-after-philippines-earthquake/a-67616756,https://www.dw.com/en/tsunami-threat-recedes-after-philippines-earthquake/a-67616756,0,www.dw.com,Tsunami threat recedes after Philippines earthquake,"A powerful earthquake struck Mindanao in the southern Philippines, triggering evacuation orders for some areas of the country and the southwest Japanese coast. There was no longer a tsunami threat after a magnitude 7.6 earthquake struck off the coast of the s…",https://static.dw.com/image/67617227_6.jpg,2023-12-02T15:47:00Z,https://web.archive.org/web/20231203164711/https://www.dw.com/en/tsunami-threat-recedes-after-philippines-earthquake/a-67616756,"There was no longer a tsunami threat after a magnitude 7.6 earthquake struck off the coast of the southern Philippines island of Mindanao on Saturday, the US Tsunami Warning System said.
""Based on a… [+1764 chars]",,en,Earthquake Philippines,Earthquake,usgs,Philippines,SEA,Asia
https://www.japantimes.co.jp/news/2023/12/03/japan/quake-tsunami-japan/,https://www.japantimes.co.jp/news/2023/12/03/japan/quake-tsunami-japan/,0,www.japantimes.co.jp,Strong quake near Philippines triggers tsunami advisory in Japan,"A magnitude 7.7 earthquake struck off the coast of Mindanao Island in the Philippines at around 11:37 p.m. on Saturday, according to the Japan Meteorological Agency (JMA).",https://www.japantimes.co.jp/japantimes/uploads/images/2023/12/03/266975.png,2023-12-02T15:48:00Z,https://web.archive.org/web/20231202203412/https://www.japantimes.co.jp/news/2023/12/03/japan/quake-tsunami-japan/,"A magnitude 7.7 earthquake struck off the coast of Mindanao Island in the Philippines at around 11:37 p.m. on Saturday, according to the Japan Meteorological Agency (JMA).
Following the earthquake, … [+789 chars]",,en,Tsunami Philippines,Tsunami,usgs,Philippines,SEA,Asia
https://en.ocworkbench.com/7-6-has-struck-off-the-southern-coast-of-the-philippines-prompting-a-tsunami-alert/,https://en.ocworkbench.com/7-6-has-struck-off-the-southern-coast-of-the-philippines-prompting-a-tsunami-alert/,0,en.ocworkbench.com,"7.6 has struck off the southern coast of the Philippines, prompting a tsunami alert","A seismic event with a magnitude of 7.6 has struck off the southern coast of the Philippines, prompting a tsunami alert. The earthquake occurred near the island of Mindanao at 10:37 pm and reached a depth of 32 kilometers (20 miles). The Pacific Tsunami Warni…",,2023-12-02T15:56:36Z,,"A seismic event with a magnitude of 7.6 has struck off the southern coast of the Philippines, prompting a tsunami alert.
The earthquake occurred near the island of Mindanao at 10:37 pm and reached a… [+1437 chars]",,en,Tsunami Philippines,Tsunami,usgs,Philippines,SEA,Asia
https://timesofindia.indiatimes.com/etimes/trending/tsunami-alert-in-japan-philippines-3-feet-or-above-waves-warns-u-s-tsunami-warning-system/articleshow/105684079.cms,https://timesofindia.indiatimes.com/etimes/trending/tsunami-alert-in-japan-philippines-3-feet-or-above-waves-warns-u-s-tsunami-warning-system/articleshow/105684079.cms,0,timesofindia.indiatimes.com,"Tsunami alert in Japan, Philippines","A magnitude 7.5 earthquake struck Mindanao, Philippines, triggering a tsunami warning. The US Geographic Survey reported the earthquake as magnitude 7.6 with a depth of 32km. The waves could hit the Philippines by midnight, according to the Philippine Seismol…","https://static.toiimg.com/thumb/msid-105684071,width-1070,height-580,imgsize-1147932,resizemode-6,overlay-toi_sw,pt-32,y_pad-40/photo.jpg",2023-12-02T16:48:15Z,https://web.archive.org/web/20231203032619/https://timesofindia.indiatimes.com/etimes/trending/tsunami-alert-in-japan-philippines-3-feet-or-above-waves-warns-u-s-tsunami-warning-system/articleshow/105684079.cms,"Hania Aamir, a rising star in the Pakistani entertainment world, gained prominence with her diverse roles in both television and film. Her journey began in 2016 with the romantic comedy 'Janaan,' mar… [+576 chars]",,en,Tsunami Philippines,Tsunami,usgs,Philippines,SEA,Asia
https://www.newser.com/story/343361/tsunami-warning-issued-after-powerful-quake-in-philippines.html,https://www.newser.com/story/343361/tsunami-warning-issued-after-powerful-quake-in-philippines.html,0,www.newser.com,"First a 7.6 Magnitude Quake, Now a Tsunami Warning","A powerful earthquake with a preliminary magnitude of 7.6 struck Saturday night off the coast of the southern Philippine island of Mindanao, and Philippine authorities issued a tsunami warning. The quake struck at 10:37pm local time at a depth of 20 miles, ac…",https://img2-azrcdn.newser.com/image/1505323-12-20231202114831.jpeg,2023-12-02T17:30:00Z,,"A powerful earthquake with a preliminary magnitude of 7.6 struck Saturday night off the coast of the southern Philippine island of Mindanao, and Philippine authorities issued a tsunami warning. The q… [+1355 chars]",,en,tsunami,Tsunami,random,,,
https://freerepublic.com/focus/f-news/4200774/posts,https://freerepublic.com/focus/f-news/4200774/posts,0,freerepublic.com,Tsunami Warnings issued in Philippines after magnitude 7.6 earthquake strikes offshore,"DAVAO CITY, Philippines – Tsunami warnings have ended for parts of the coastal Philippines after a magnitude 7.6 earthquake struck off the southeastern coast Saturday night, according to the USGS. The quake struck at 10:37 p.m. local time Saturday night, or 9…",,2023-12-02T17:46:10Z,,"Skip to comments.
Tsunami Warnings issued in Philippines after magnitude 7.6 earthquake strikes offshoreFox news ^
 | 12/2/23
 | staff
Posted on 12/02/2023 9:46:10 AM PST by CFW
DAVAO CITY, Phil… [+1438 chars]",,en,tsunami,Tsunami,random,,,
