index,url,valid,domain,title,description,image,published,archive,content,quote,language,term,topic,feed,country,ipcc,continent
https://biztoc.com/x/29db31bb3b9cde55,https://biztoc.com/x/29db31bb3b9cde55,0,biztoc.com,Rafael To Strengthen Into Hurricane As US Gulf Energy Complex On High Alert,"Rafael To Strengthen Into Hurricane As US Gulf Energy Complex On High Alert
 
Tropical Storm Rafael was churning 80 miles south-southwest of Montego Bay, Jamaica, early Tuesday. It had maximum sustained winds of 60 mph and was moving northwest at 13 mph, acco…",https://biztoc.com/cdn/29db31bb3b9cde55_s.webp,2024-11-05T17:11:01Z,,"Rafael To Strengthen Into Hurricane As US Gulf Energy Complex On High Alert
Tropical Storm Rafael was churning 80 miles south-southwest of Montego Bay, Jamaica, early Tuesday. It had maximum sustain… [+139 chars]",,en,Storm VI,Storm,fema,United States,,
https://www.bbc.com/news/articles/cgejgrqvnv3o,https://www.bbc.com/news/articles/cgejgrqvnv3o,0,www.bbc.com,Voters embrace calm before the storm in battleground states,Early voting has made Election Day relatively calm - even in the hotly contested swing states that will determine the race.,https://ichef.bbci.co.uk/news/1024/branded_news/51f2/live/9dbc6ac0-9b98-11ef-8538-e1655f5a8342.jpg,2024-11-05T17:13:55Z,https://web.archive.org/web/20241105183019/https://www.bbc.com/news/articles/cgejgrqvnv3o,"Debra and Robert Kendrick voted in western North Carolina, which was hit hard by Hurricane Helene
Voting has begun in the battleground states expected to decide who will be the next US president - V… [+8168 chars]",,en,storm,Storm,random,,,
https://www.newsweek.com/tropical-storm-rafael-forces-florida-cruise-ship-change-path-1980373,https://www.newsweek.com/tropical-storm-rafael-forces-florida-cruise-ship-change-path-1980373,0,www.newsweek.com,Tropical Storm Rafael Forces Florida Cruise Ship To Change Path,The port of call itinerary has been changed on a Caribbean cruise to avoid the worst weather from Storm Rafael.,https://d.newsweek.com/en/full/2512929/cruise-ship.jpg,2024-11-05T17:25:32Z,https://web.archive.org/web/20241111211701/https://www.newsweek.com/tropical-storm-rafael-forces-florida-cruise-ship-change-path-1980373,"MSC Cruises has announced an alteration to the planned itinerary of one of its ships as Tropical Storm Rafael bears down on the Caribbean.
The storm, which formed earlier this week, and was official… [+6458 chars]",,en,storm,Storm,random,,,
https://www.newsweek.com/full-list-us-weather-warnings-election-day-1980626,https://www.newsweek.com/full-list-us-weather-warnings-election-day-1980626,0,www.newsweek.com,Full List of US Weather Warnings on Election Day,Weather warnings span from winter storm conditions in Montana to wildfire conditions in California as voters venture to the polls.,https://d.newsweek.com/en/full/2512973/full-list-us-weather-warnings.png,2024-11-05T17:53:12Z,,"National Weather Service (NWS) meteorologists have issued weather warnings across the nation as millions of voters venture out on Election Day.
As of Tuesday morning, winter storm-related warnings a… [+4612 chars]",,en,storm,Storm,random,,,
https://insidethemagic.net/2024/11/florida-hit-tropical-storm-warning-location-impact-determined-ad1/,https://insidethemagic.net/2024/11/florida-hit-tropical-storm-warning-location-impact-determined-ad1/,0,insidethemagic.net,"Florida Hit with Threatening Tropical Storm Rafael Warning, Location of Impact Determined","As we continue through a particularly active hurricane season, all eyes are on the Atlantic, where a series of storms has developed over the past few months. Recently, we saw significant storms like Hurricane Milton and Hurricane Helene, and today, another sy…",https://insidethemagic.net/wp-content/uploads/2023/12/mickey-minnie-disney-world.jpg,2024-11-05T18:33:37Z,,"As we continue through a particularly active hurricane season, all eyes are on the Atlantic, where a series of storms has developed over the past few months. Recently, we saw significant storms like … [+3836 chars]",,en,Tropical Storm Rafael,Tropical Cyclone,eonet,,CAR,North-America
https://www.cbc.ca/news/world/tropical-storm-rafael-hurricane-cuba-1.7374454,https://www.cbc.ca/news/world/tropical-storm-rafael-hurricane-cuba-1.7374454,0,www.cbc.ca,"Cuba readies for arrival of Rafael, expected to reach island as hurricane",Tropical storm Rafael was chugging past western Jamaica on Tuesday and was expected to strengthen into a hurricane as it headed toward Cuba.,https://i.cbc.ca/1.7374460.1730838060!/fileImage/httpImage/image.JPG_gen/derivatives/16x9_620/men-carrying-furniture-away-from-havana-restaurant-ahead-of-arrival-of-tropical-storm-rafael.JPG,2024-11-05T21:01:13Z,,"Tropical storm Rafael was chugging past western Jamaica on Tuesday and was expected to strengthen into a hurricane as it headed toward Cuba.
The storm was located 115 kilometres southwest of Montego… [+2663 chars]",,en,storm,Storm,random,,,
https://gcaptain.com/gulf-of-mexico-oil-and-gas-producers-cut-output-ahead-of-storm/,https://gcaptain.com/gulf-of-mexico-oil-and-gas-producers-cut-output-ahead-of-storm/,0,gcaptain.com,Gulf of Mexico Oil and Gas Producers Cut Output Ahead of Storm,Nov 5 (Reuters) – Oil and gas producers began shutting in U.S. Gulf of Mexico output and pulling workers off platforms on Tuesday ahead of a late hurricane season storm threatening offshore fields.  The U.S. National Hurricane...,https://gcaptain.com/wp-content/uploads/2024/11/Hurricane-Rachel-cone-Nov-5.png,2024-11-05T21:06:15Z,,Nov 5 (Reuters) – Oil and gas producers began shutting in U.S. Gulf of Mexico output and pulling workers off platforms on Tuesday ahead of a late hurricane season storm threatening offshore fields. ,,,,,,,,
https://slashdot.org/firehose.pl?op=view&amp;id=175410585,https://slashdot.org/firehose.pl?op=view&amp;id=175410585,0,slashdot.org,Tropical Storm Rafael gains intensity in Caribbean as it nears Cuba - The Guardian,"Tropical Storm Rafael gains intensity in Caribbean as it nears CubaThe Guardian Rafael means busy hurricane season is looking at a rare US landfall in NovemberUSA TODAY Rafael could become a hurricane soon, but the storm and its path could change drastically …",,2024-11-05T21:13:22Z,,The Fine Print: The following comments are owned by whoever posted them. We are not responsible for them in any way.,,en,landfall,Tropical Cyclone,random,,,
https://www.rigzone.com/news/wire/oil_prices_rise_amid_us_election_uncertainty_and_storm_threats-05-nov-2024-178652-article/,https://www.rigzone.com/news/wire/oil_prices_rise_amid_us_election_uncertainty_and_storm_threats-05-nov-2024-178652-article/,0,www.rigzone.com,Oil Prices Rise Amid US Election Uncertainty and Storm Threats,"Oil prices rose as election uncertainty and Tropical Storm Rafael threaten Gulf production, with potential policy shifts under either presidential outcome expected to impact the oil market further.",https://images.rigzone.com/images/news/articles/Oil-Prices-Rise-Amid-US-Election-Uncertainty-and-Storm-Threats-178652-582x327.png,2024-11-05T21:16:47Z,,Oil edged higher as the tight US presidential election looms over global markets while a tropical storm threatens production from the Gulf of Mexico.West Texas Intermediate rose 0.7% to settle near $… [+1704 chars],,en,tropical storm,Tropical Cyclone,random,,,
https://www.nhc.noaa.gov/refresh/graphics_at3+shtml/235559.shtml?cone,https://www.nhc.noaa.gov/refresh/graphics_at3+shtml/235559.shtml?cone,0,www.nhc.noaa.gov,Tropical Storm Rafael Graphics,"5-Day Uncertainty Track last updated Tue, 05 Nov 2024 23:55:59 GMT

 
Wind Speed Probabilities last updated Tue, 05 Nov 2024 21:23:04 GMT",,2024-11-05T23:55:59Z,,"Coastal Watches/Warnings and Forecast Cone for Storm Center
* If the storm is forecast to dissipate within 3 days, the ""Full Forecast"" and ""3 day"" graphic will be identical
Click Here for a 5-day C… [+2926 chars]",,en,Tropical Storm Rafael,Tropical Cyclone,eonet,,CAR,North-America
https://www.nbcnews.com/weather/hurricanes/rafael-strengthens-hurricane-rcna178791,https://www.nbcnews.com/weather/hurricanes/rafael-strengthens-hurricane-rcna178791,0,www.nbcnews.com,Rafael strengthens to a Category 1 hurricane,"Tropical Storm Rafael strengthened into a Category 1 Hurricane Tuesday evening near the Cayman Islands, the National Hurricane Center said.","https://media-cldnry.s-nbcnews.com/image/upload/t_nbcnews-fp-1200-630,f_auto,q_auto:best/rockcms/2024-11/241105-tropical-storm-rafael-al-0953-9c5f0e.jpg",2024-11-06T00:41:41Z,https://web.archive.org/web/20241107072519/https://www.nbcnews.com/weather/hurricanes/rafael-strengthens-hurricane-rcna178791,"Tropical Storm Rafael strengthened into a Category 1 Hurricane Tuesday evening near the Cayman Islands, the National Hurricane Center said.
Rafael was located 20 miles southeast of Little Cayman, wi… [+2396 chars]",,en,Tropical Storm Rafael,Tropical Cyclone,eonet,,CAR,North-America
https://www.npr.org/2024/11/05/g-s1-32656/hurricane-rafael-cayman-islands-cuba-gulf-of-mexico,https://www.npr.org/2024/11/05/g-s1-32656/hurricane-rafael-cayman-islands-cuba-gulf-of-mexico,0,www.npr.org,Hurricane Rafael forms in the Caribbean Sea and expected to enter the Gulf of Mexico,An active 2024 Atlantic Hurricane season continues as Rafael strengthens into a category 1 storm. It's expected to batter Cayman Islands and Cuba before swinging into the Gulf of Mexico.,https://npr.brightspotcdn.com/dims3/default/strip/false/crop/897x505+0+0/resize/1400/quality/100/format/png/?url=http%3A%2F%2Fnpr-brightspot.s3.amazonaws.com%2Fbd%2Ffa%2F3e3917374d5ab38bebff3163f0a4%2F235559-5day-cone-no-line-and-wind.png,2024-11-06T00:54:29Z,,"Rafael has strengthened into a hurricane
 as it moves through the southern Caribbean Sea.
The category 1 storm has maximum sustained winds of 75 mph and is approaching the Cayman Islands. It will b… [+978 chars]",,en,hurricane,Tropical Cyclone,random,,,
https://www.aljazeera.com/news/2024/11/6/excited-and-unnerved-new-yorkers-flood-the-polls-on-us-election-day,https://www.aljazeera.com/news/2024/11/6/excited-and-unnerved-new-yorkers-flood-the-polls-on-us-election-day,0,www.aljazeera.com,Excited and unnerved: New Yorkers flood the polls on US Election Day,"New York City may be a left-wing stronghold, but the diversity of its five boroughs paint a picture of a divided US.",https://www.aljazeera.com/wp-content/uploads/2024/11/C80A4097-1730844485.jpg?resize=1920%2C1440,2024-11-06T01:07:19Z,,"New York City, US As the sun rose over the five boroughs of New York City on Tuesday morning, a certain unspoken unease permeated the crisp autumn air.
New Yorkers both supporters of former Presiden… [+9603 chars]",,en,Flood New York,Flood,fema,United States,ENA,North-America
https://biztoc.com/x/c4be9f9990ba1ddc,https://biztoc.com/x/c4be9f9990ba1ddc,0,biztoc.com,Tropical storm Rafael becomes hurricane,"Tropical storm Rafael intensified into a hurricane with maximum sustained winds of 75 miles per hour, the United States National Hurricane Center (NHC) said.The storm was upgraded as it approached the...",https://biztoc.com/cdn/c4be9f9990ba1ddc_s.webp,2024-11-06T01:09:27Z,,"Tropical storm Rafael intensified into a hurricane with maximum sustained winds of 75 miles per hour, the United States National Hurricane Center (NHC) said.The storm was upgraded as it approached th… [+69 chars]",,en,Tropical Storm Rafael,Tropical Cyclone,eonet,,CAR,North-America
http://grist.org/extreme-weather/what-election-day-looked-like-for-voters-in-the-hurricane-battered-communities-of-florida-and-north-carolina/,http://grist.org/extreme-weather/what-election-day-looked-like-for-voters-in-the-hurricane-battered-communities-of-florida-and-north-carolina/,0,grist.org,What Election Day looked like for voters in hurricane-battered communities across Florida and North Carolina,"Voters showed up in droves to cast their ballots, navigating last-minute polling changes spurred by hurricanes Helene and Milton.",https://grist.org/wp-content/uploads/2024/11/GettyImages-2182494529_NC-voting-tent-1.jpg?quality=75&strip=all,2024-11-06T01:39:32Z,,"This story is part of State of Emergency, a Grist series exploring how climate disasters are impacting voting and politics. It is published with support from the CO2 Foundation.
Early Tuesday aftern… [+12584 chars]",,en,Florida Hurricane Milton,Storm,fema,United States,ENA,North-America
https://slashdot.org/firehose.pl?op=view&amp;id=175411915,https://slashdot.org/firehose.pl?op=view&amp;id=175411915,0,slashdot.org,Rafael strengthens to a Category 1 hurricane - NBC News,"Rafael strengthens to a Category 1 hurricaneNBC News Rafael will become a hurricane soon, but the storm and its path toward the US could change drasticallyCNN Tropical Storm Rafael nearing hurricane strength. See what Florida can expectNews-Press Hurricane Ra…",,2024-11-06T01:53:19Z,,The Fine Print: The following comments are owned by whoever posted them. We are not responsible for them in any way.,,en,tropical storm,Tropical Cyclone,random,,,
https://www.newsweek.com/tropical-storm-rafael-strengthens-hurricane-path-cuba-1981026,https://www.newsweek.com/tropical-storm-rafael-strengthens-hurricane-path-cuba-1981026,0,www.newsweek.com,Tropical Storm Rafael Strengthens to Hurricane on Path to Cuba,"As of Tuesday morning, the storm was positioned 20 miles (35 kilometers) southeast of Little Cayman in the Cayman Islands.",https://d.newsweek.com/en/full/2513516/tropical-storm-rafael.jpg,2024-11-06T02:14:33Z,,"Tropical Storm Rafael was upgraded to a Category 1 Hurricane this week on its current path towards Cuba.
This marked yet another setback for Cuba, already grappling with widespread blackouts and sti… [+3015 chars]",,en,tropical storm,Tropical Cyclone,random,,,
https://biztoc.com/x/4aabc356614f6005,https://biztoc.com/x/4aabc356614f6005,0,biztoc.com,Tropical Storm Rafael Strengthens to Hurricane on Path to Cuba,"Tropical Storm Rafael was upgraded to a Category 1 Hurricane this week on its current path towards Cuba.
This marked yet another setback for Cuba, already grappling with widespread blackouts and still recovering from a hurricane two weeks prior that left at l…",https://biztoc.com/cdn/4aabc356614f6005_s.webp,2024-11-06T02:16:40Z,,"Tropical Storm Rafael was upgraded to a Category 1 Hurricane this week on its current path towards Cuba.This marked yet another setback for Cuba, already grappling with widespread blackouts and still… [+144 chars]",,en,Hurricane Cuba,Tropical Cyclone,relief,Cuba,CAR,North-America
https://www.investing.com/news/press-releases/centerpoint-energy-continuing-to-plan-and-prepare-for-impacts-from-tropical-storm-rafael-across-its-multistate-gulf-coast-service-area-93CH-3704067,https://www.investing.com/news/press-releases/centerpoint-energy-continuing-to-plan-and-prepare-for-impacts-from-tropical-storm-rafael-across-its-multistate-gulf-coast-service-area-93CH-3704067,0,www.investing.com,CenterPoint Energy Continuing to Plan and Prepare for Impacts from Tropical Storm Rafael Across its Multi-State Gulf Coast Service Area,CenterPoint Energy Continuing to Plan and Prepare for Impacts from Tropical Storm Rafael Across its Multi-State Gulf Coast Service Area,https://i-invdn-com.investing.com/redesign/images/seo/investing_300X300.png,2024-11-06T03:04:04Z,,<ul><li>CenterPoint continuing to monitor the latest weather updates and forecasts to be ready to respond to the potential effects of Tropical Storm Rafael</li><li>Company continuing to communicate t… [+6967 chars],,en,Tropical Storm Rafael,Tropical Cyclone,eonet,,CAR,North-America
https://www.nhc.noaa.gov/refresh/graphics_at3+shtml/031357.shtml?cone,https://www.nhc.noaa.gov/refresh/graphics_at3+shtml/031357.shtml?cone,0,www.nhc.noaa.gov,Hurricane Rafael Graphics,"5-Day Uncertainty Track last updated Wed, 06 Nov 2024 03:13:57 GMT

 
Wind Speed Probabilities last updated Wed, 06 Nov 2024 03:23:00 GMT",,2024-11-06T03:13:57Z,,"Coastal Watches/Warnings and Forecast Cone for Storm Center
* If the storm is forecast to dissipate within 3 days, the ""Full Forecast"" and ""3 day"" graphic will be identical
Click Here for a 5-day C… [+2926 chars]",,en,hurricane,Tropical Cyclone,random,,,
https://www.thestar.com.my/news/world/2024/11/06/hurricane-rafael-barrels-through-cayman-islands,https://www.thestar.com.my/news/world/2024/11/06/hurricane-rafael-barrels-through-cayman-islands,0,www.thestar.com.my,Hurricane Rafael barrels through Cayman Islands,"(Reuters) -Hurricane Rafael is passing through the Cayman Islands in the Caribbean and is forecast to rapidly intensify before making landfall in western Cuba, according to the U.S. National Hurricane Center. Read full story",https://apicms.thestar.com.my/uploads/images/2024/11/06/3002897.jpg,2024-11-06T04:33:00Z,,"(Reuters) -Hurricane Rafael is passing through the Cayman Islands in the Caribbean and is forecast to rapidly intensify before making landfall in western Cuba, according to the U.S. National Hurrican… [+1833 chars]",,en,landfall,Tropical Cyclone,random,,,
https://theweek.com/politics/spain-flooding-protests-anger-blame,https://theweek.com/politics/spain-flooding-protests-anger-blame,0,theweek.com,Anger over flood response swells as Spain explodes in protests,The Spanish government is reeling as furious citizens look for answers in the wake of October's catastrophic flooding,https://cdn.mos.cms.futurecdn.net/j3X3RFYR8uSJZxz6WkDrhX-1200-80.jpg,2024-11-06T06:00:00Z,,There has been a shift over the past few years away from questioning whether human-driven climate change is real (although there are still plenty of people who insist it is not) to questioning what —… [+3982 chars],,en,flooding,Flood,random,,,
https://www.newsweek.com/hurricane-rafael-path-update-tracker-rare-landfall-1981094,https://www.newsweek.com/hurricane-rafael-path-update-tracker-rare-landfall-1981094,0,www.newsweek.com,"Hurricane Rafael Path Update, Tracker as Storm Set for Rare Landfall","The National Hurricane Center has said ""environmental conditions are very favorable for continued intensification.""",https://d.newsweek.com/en/full/2513741/rafael.png,2024-11-06T09:17:10Z,,"Hurricane Rafael could make landfall in the U.S. later this week, as it continues to barrel over the Gulf of Mexico.
According to the latest National Hurricane Center update, issued at 1 a.m. ET on … [+3425 chars]",,en,National Hurricane Center,Tropical Cyclone,random,,,
https://www.news-press.com/story/weather/hurricane/2024/11/06/hurricane-rafael-tracker-path-spaghetti-models-florida-impacts/76068431007/,https://www.news-press.com/story/weather/hurricane/2024/11/06/hurricane-rafael-tracker-path-spaghetti-models-florida-impacts/76068431007/,0,www.news-press.com,"Hurricane Rafael tracker: See projected path, spaghetti models, Florida impacts",Rafael is expected to be near major hurricane strength when it makes landfall in western Cuba later today.,https://media.zenfs.com/en/the-news-press/4f425af5ff1f4e6afa850531e2106e3c,2024-11-06T10:38:20Z,,"Hurricane Rafael is expected to strengthen before making landfall in western Cuba, according to the latest advisory from the National Hurricane Center.
Forecasters said Rafael could be near Category… [+1725 chars]",,en,landfall,Tropical Cyclone,random,,,
https://nypost.com/2024/11/06/sports/rutgers-star-freshmen-embracing-steve-pikiells-tough-coaching-love/,https://nypost.com/2024/11/06/sports/rutgers-star-freshmen-embracing-steve-pikiells-tough-coaching-love/,0,nypost.com,Rutgers star freshmen embracing Steve Pikiell’s tough love: ‘Take the world by storm’,Everything about Ace Bailey and Dylan Harper is different than what Rutgers is used to except the way that they want to be coached.,https://nypost.com/wp-content/uploads/sites/2/2024/11/head-coach-steve-pikiell-rutgers-91826005_a95dc0.jpg?quality=75&strip=all&w=1024,2024-11-06T11:30:00Z,,"Everything about Ace Bailey and Dylan Harper is different than what Rutgers is used to except the way that they want to be coached.
Close friends Bailey and Harper the No. 2- and No. 3-ranked recrui… [+7695 chars]",,en,storm,Storm,random,,,
https://oilprice.com/Latest-Energy-News/World-News/Hurricane-Rafael-Threatens-US-Gulf-of-Mexico-Oil-Production.html,https://oilprice.com/Latest-Energy-News/World-News/Hurricane-Rafael-Threatens-US-Gulf-of-Mexico-Oil-Production.html,0,oilprice.com,Hurricane Rafael Threatens U.S. Gulf of Mexico Oil Production,"Tropical storm Rafael has strengthened to hurricane intensity in recent hours and is still set to continue its path toward the U.S. Gulf of Mexico, where oil and gas producers have shut-in production at platforms and evacuated personnel to shore. The late-sea…",https://d32r1sh890xpii.cloudfront.net/news/718x300/2024-11-06_srbm2nnihw.jpg,2024-11-06T11:50:00Z,,"This article discusses the importance…
It was a mixed earnings…
By Tsvetana Paraskova - Nov 06, 2024, 5:50 AM CSTTropical storm Rafael has strengthened to hurricane intensity in recent hours and is… [+1967 chars]",,en,tropical storm,Tropical Cyclone,random,,,
https://www.cbsnews.com/news/hurricane-rafael-forecast-path-maps-expected-landfall-cuba/,https://www.cbsnews.com/news/hurricane-rafael-forecast-path-maps-expected-landfall-cuba/,0,www.cbsnews.com,Hurricane Rafael grows into a Category 2 storm as it bears down on Cuba,Hurricane Rafael has grown into a Category 2 storm with maximum sustained winds of 100 mph as it heads for landfall on Cuba's southern coast.,https://assets2.cbsnewsstatic.com/hub/i/r/2024/11/06/9743e647-5d7f-4d29-8851-9e5168b7c71a/thumbnail/1200x630g4/c47b97819990edfc19db73bfea743900/hurricane-rafael-nov6-7a.jpg?v=c1d30b1df13c40bf65c6c1e6d9ac4ad7,2024-11-06T12:58:07Z,https://web.archive.org/web/20241107092039/https://www.cbsnews.com/news/hurricane-rafael-forecast-path-maps-expected-landfall-cuba/,"San Juan, Puerto Rico — Hurricane Rafael swelled into a Category 2 storm early Wednesday as it swirled past the Cayman Islands, and it was forecast to rapidly intensify before making landfall later i… [+4183 chars]",,en,Hurricane Cuba,Tropical Cyclone,relief,Cuba,CAR,North-America
https://finance.yahoo.com/news/hurricane-rafael-menaces-florida-keys-004154167.html,https://finance.yahoo.com/news/hurricane-rafael-menaces-florida-keys-004154167.html,0,finance.yahoo.com,Menaces Florida Keys...,"Menaces Florida Keys...

 
 
 
 (Third column, 5th story, link)

 

 

 
 Related stories:November Hurricane in Caribbean!
CONE...
COMPUTER MODELS...",https://s.yimg.com/ny/api/res/1.2/gsPm4DAuSeBj.Fbf6y8KOA--/YXBwaWQ9aGlnaGxhbmRlcjt3PTEyMDA7aD03OTk-/https://media.zenfs.com/en/bloomberg_markets_842/09a301e42413cdf6f1fe2584bfd3b266,2024-11-06T13:31:37Z,,"(Bloomberg) -- Hurricane Rafael is quickly strengthening as it churns toward the Gulf of Mexico, threatening to bring damaging gusts and heavy rains to populated areas from the Cayman Islands to Sout… [+1761 chars]",,en,hurricane,Tropical Cyclone,random,,,
https://nypost.com/2024/11/06/world-news/rafael-strengthens-into-category-2-hurricane-as-cuba-braces-for-damaging-winds-life-threatening-storm-surge/,https://nypost.com/2024/11/06/world-news/rafael-strengthens-into-category-2-hurricane-as-cuba-braces-for-damaging-winds-life-threatening-storm-surge/,0,nypost.com,"Rafael strengthens into Category 2 hurricane as Cuba braces for damaging winds, life-threatening storm surge",Hurricane Rafael continues to intensify and is expected to be near major hurricane strength when the late-season tropical system makes landfall in Cuba on Wednesday.,https://nypost.com/wp-content/uploads/sites/2/2024/11/newspress-collage-rbavuyv58-1730899990035.jpg?quality=75&strip=all&1730882045&w=1024,2024-11-06T13:38:09Z,https://web.archive.org/web/20241108120050/https://nypost.com/2024/11/06/world-news/rafael-strengthens-into-category-2-hurricane-as-cuba-braces-for-damaging-winds-life-threatening-storm-surge/,"MIAMI Hurricane Rafael continues to intensify and is expected to be near major hurricane strength when the late-season tropical system makes landfall in Cuba on Wednesday.
Millions of people along t… [+3532 chars]",,en,tropical storm,Tropical Cyclone,random,,,
https://www.newsweek.com/hurricane-center-rafael-storm-surge-florida-keys-rainfall-flooding-cuba-1981294,https://www.newsweek.com/hurricane-center-rafael-storm-surge-florida-keys-rainfall-flooding-cuba-1981294,0,www.newsweek.com,Rafael: Hurricane Center Issues Florida Keys Storm Surge Warning,"""There is high confidence that human-caused climate change has already increased the intensity of rainfall in the storms,"" an expert told Newsweek.",https://d.newsweek.com/en/full/2514029/hurricane-rafael-path-florida-keys.jpg,2024-11-06T14:14:42Z,,"Residents in the Florida Keys have been warned that powerful storm surges could be headed their way as Hurricane Rafael barrels across the Gulf of Mexico.
Rafael, which is currently a Category 2 hur… [+4787 chars]",,en,hurricane,Tropical Cyclone,random,,,
https://www.cnn.com/2024/11/06/weather/hurricane-rafael-path-forecast-climate/index.html,https://www.cnn.com/2024/11/06/weather/hurricane-rafael-path-forecast-climate/index.html,0,www.cnn.com,Hurricane Rafael is rapidly intensifying on its path toward Cuba and the Gulf of Mexico,"The hurricane is in rarified air for storms in November, but will be in much different shape as it approaches the US.","https://media.cnn.com/api/v1/images/stellar/prod/download-1-20241106125948225.png?c=16x9&q=w_800,c_fill",2024-11-06T14:19:35Z,http://archive.md/20241106183811/https://www.cnn.com/2024/11/06/weather/hurricane-rafael-path-forecast-climate/index.html,"Hurricane Rafael is rapidly intensifying in the Caribbean and is expected to become a Category 3 hurricane before it slams into Cuba Wednesday.
As of Wednesday morning, Rafael was a Category 2 storm… [+4025 chars]",,en,Storm Mexico,Storm,wmo,Mexico,NCA,North-America
