index,url,valid,domain,title,description,image,published,archive,content,quote,language,term,topic,feed,country,ipcc,continent
http://deadline.com/2025/01/drone-crash-wildfires-guilty-plea-1236274899/,http://deadline.com/2025/01/drone-crash-wildfires-guilty-plea-1236274899/,0,deadline.com,"Ex-Skydance Executive Escapes Prison Time After Admitting To “Recklessly” Operating Drone That Crashed Into Super Scooper, Endangered LA Wildfire Fighters","A drone owned and piloted by the ex-president of Skydance Interactive damaged and temporarily grounded a Canadian Super Scooper during some of the worst and most destructive days of the wildfires that left swath of LA no more than ash, but Peter Akemann has e…",https://deadline.com/wp-content/uploads/2025/01/no-drone-zone-sign-getty.jpg?w=1024,2025-02-01T02:09:04Z,https://web.archive.org/web/20250202162131/https://deadline.com/2025/01/drone-crash-wildfires-guilty-plea-1236274899/,A drone owned and piloted by the ex-president of Skydance Interactive damaged and temporarily grounded a Canadian Super Scooper during some of the worst and most destructive days of the wildfires tha… [+4123 chars],,en,wildfire,Wildfire,random,,,
https://www.cnet.com/health/medical/doctor-approved-ways-protect-your-health-from-wildfire-smoke-poor-air-quality/,https://www.cnet.com/health/medical/doctor-approved-ways-protect-your-health-from-wildfire-smoke-poor-air-quality/,0,www.cnet.com,6 Doctor-Approved Ways to Protect Your Health From Wildfire Smoke and Poor Air Quality,"Even if you don't live in an area where wildfires are typical, it's important to know how to protect your health.",https://www.cnet.com/a/img/resize/8cf48823c6088ef787f72375339fb49322b37965/hub/2025/01/30/246f0e8f-fb35-4a8b-a2be-a66a78ec7ca3/wildfire-smoke-behind-houses.jpg?auto=webp&fit=crop&height=675&width=1200,2025-02-01T12:41:03Z,,"In the aftermath of a wildfire, many communities have to deal with residual smoke and poor air quality. Unfortunately, this problem isn't going anywhere. Regions like Southern California have seen an… [+10121 chars]",,en,wildfire,Wildfire,random,,,
https://www.cbc.ca/sports/olympics/winter/alpine-skiing/world-cup-mens-downhill-cancelled-february-1-1.7448124,https://www.cbc.ca/sports/olympics/winter/alpine-skiing/world-cup-mens-downhill-cancelled-february-1-1.7448124,0,www.cbc.ca,World Cup downhill in Garmisch cancelled after fog prevents both training runs,"Organizers have cancelled Sunday's World Cup downhill race in Garmisch-Partenkichen, Germany, after both training sessions were called off because of bad weather.",https://i.cbc.ca/1.7448126.1738419179!/fileImage/httpImage/image.jpg_gen/derivatives/16x9_1180/2196452091.jpg?im=Resize%3D620,2025-02-01T14:14:36Z,,"Organizers have cancelled Sunday's World Cup downhill race in Garmisch-Partenkichen, Germany, after both training sessions were called off because of bad weather.
Saturday's practice session was ini… [+643 chars]",,en,Fog Germany,Fog,wmo,Germany,WCE,Europe
https://www.forbes.com/sites/antoniopequenoiv/2025/02/01/california-wildfire-updates-palisades-eaton-fires-reach-full-containment/,https://www.forbes.com/sites/antoniopequenoiv/2025/02/01/california-wildfire-updates-palisades-eaton-fires-reach-full-containment/,0,www.forbes.com,"California Wildfire Updates: Palisades, Eaton Fires Reach Full Containment",The Palisades and Eaton fires in Los Angeles remained active for over three weeks.,"https://imageio.forbes.com/specials-images/imageserve/679bc879c3b037b62c575fbc/0x0.jpg?format=jpg&crop=1728,1152,x0,y0,safe&height=900&width=1600&fit=bounds",2025-02-01T19:47:25Z,http://wayback.archive-it.org/all/20250202031434/https://www.forbes.com/sites/antoniopequenoiv/2025/02/01/california-wildfire-updates-palisades-eaton-fires-reach-full-containment/,"The Palisades and Eaton fires in Los Angeles were fully contained Saturday, marking the end of a wave of historic blazes that scorched the region this month.Saturday, 11:00 a.m. PSTCal Fire data repo… [+28238 chars]",,en,EATON Wildfire Los Angeles California,Wildfire,eonet,United States,WNA,North-America
https://www.digitaljournal.com/world/for-worlds-poorest-fears-for-long-term-setbacks-after-trump-aid-cut/article,https://www.digitaljournal.com/world/for-worlds-poorest-fears-for-long-term-setbacks-after-trump-aid-cut/article,0,www.digitaljournal.com,"For world’s poorest, fears for long-term setbacks after Trump aid cut","In Uganda, millions of schoolchildren have benefitted from a universal education program backed by the United States. In South Sudan, US assistance has helped thousands of flood victims at risk of cholera. With one swoop of the pen, President Donald Trump fro…",https://www.digitaljournal.com/wp-content/uploads/2025/02/fab38a3610e95ed3308f0ec07d09f530c19368b8.jpg,2025-02-02T01:18:14Z,,"Mothers carry boxes of porridge backed by US aid in the Mutokoarea of Zimbabwe in 2019 as drought worsened hunger
 - Copyright AFP/File Jekesai NJIKIZANA
In Uganda, millions of schoolchildren have … [+4721 chars]",,en,Flood South Sudan,Flood,relief,South Sudan,NEAF,Africa
https://www.cnn.com/2025/02/02/australia/queensland-townsville-floods-climate-intl-hnk/index.html,https://www.cnn.com/2025/02/02/australia/queensland-townsville-floods-climate-intl-hnk/index.html,0,www.cnn.com,"One dead, thousands evacuated as northeast Australia battles massive floods | CNN",One person has died and thousands of others are under evacuation orders in Australia’s northeast after intense rain triggered dangerous flash floods that have inundated homes and businesses.,"https://media.cnn.com/api/v1/images/stellar/prod/screenshot-2025-02-02-at-3-22-56-am.jpg?c=16x9&q=w_800,c_fill",2025-02-02T08:16:55Z,http://archive.md/20250202174106/https://www.cnn.com/2025/02/02/australia/queensland-townsville-floods-climate-intl-hnk/index.html,"One person has died and thousands of others are under evacuation orders in Australias northeast after intense rain triggered dangerous flash floods that have inundated homes and businesses.
Flooding… [+3010 chars]",,en,flood Australia,Flood,aidr,Australia,EAU,Oceania
https://www.bbc.com/news/articles/cn4z2py8448o,https://www.bbc.com/news/articles/cn4z2py8448o,0,www.bbc.com,Thousands flee homes as floods hit Australia,Meteorologists say these could be the worst floods to hit northern Queensland in 60 years.,https://ichef.bbci.co.uk/news/1024/branded_news/61b8/live/f7f87e80-e147-11ef-999b-b95a2a33a739.jpg,2025-02-02T09:55:29Z,https://web.archive.org/web/20250202100932/https://www.bbc.com/news/articles/cn4z2py8448o,"A woman has died in Australia and thousands have been forced to flee their homes after torrential rainfall has caused flooding in northern Queensland.
Authorities are warning that flood waters could… [+943 chars]",,en,flood Australia,Flood,aidr,Australia,EAU,Oceania
https://economictimes.indiatimes.com/news/sports/politicians-join-hands-to-hail-team-indias-emphatic-win-in-womens-u19-wc-2025/articleshow/117862500.cms,https://economictimes.indiatimes.com/news/sports/politicians-join-hands-to-hail-team-indias-emphatic-win-in-womens-u19-wc-2025/articleshow/117862500.cms,0,economictimes.indiatimes.com,Politicians join hands to hail Team India's emphatic win in Women's U19 WC 2025,India's U19 Women's Cricket Team clinched the ICC Women's U19 T20 World Cup 2025 by defeating South Africa with a dominant 9-wicket win. Key contributions came from Gongadi Trisha and Sanika Chalke. Politicians across parties praised the team's exceptional ta…,"https://img.etimg.com/thumb/msid-117862581,width-1200,height-630,imgsize-58966,overlay-economictimes/articleshow.jpg",2025-02-02T15:13:37Z,https://web.archive.org/web/20250202213838/https://economictimes.indiatimes.com/news/sports/politicians-join-hands-to-hail-team-indias-emphatic-win-in-womens-u19-wc-2025/articleshow/117862500.cms,"New Delhi [India]: Politicians across political parties joined hands to congratulate Team India on winning the prestigious ICC Women's U19 World Cup 2025 on Sunday.In the battle of unbeaten sides, In… [+2756 chars]",,en,Hail South Africa,Thunderstorm,wmo,South Africa,WSAF,Africa
https://www.crikey.com.au/2025/02/03/queensland-floods-2025-climate-change/,https://www.crikey.com.au/2025/02/03/queensland-floods-2025-climate-change/,0,www.crikey.com.au,"What’s driving north Queensland’s deadly, record-breaking floods?","More extreme rainfall and higher frequencies of flooded rivers and flash floods around the world have a clear link to climate change and ongoing global heating.
The post What’s driving north Queensland’s deadly, record-breaking floods? appeared first on Crike…",https://www.crikey.com.au/wp-content/uploads/2025/02/20250201112330037407-original.jpg?quality=70,2025-02-02T23:49:29Z,,"Record-breaking floods across north Queensland have now turned deadly, with one woman drowning while being rescued on Sunday morning. And the floodwaters are still rising, with rain set to continue.… [+5479 chars]",,en,flash flood,Flood,random,,,
https://www.ibtimes.com/rising-floodwaters-force-evacuations-eastern-australian-3762083,https://www.ibtimes.com/rising-floodwaters-force-evacuations-eastern-australian-3762083,0,www.ibtimes.com,Rising Floodwaters Force Evacuations In Eastern Australian,"Fast-moving floodwaters rose Monday in northeastern Australia after forcing many to flee, blacking out homes, and sweeping away a chunk of a critical bridge.",https://d.ibtimes.com/en/full/4580192/rising-floodwaters-swamp-areas-around-townsville-northeastern-australia.jpg,2025-02-03T02:36:18Z,,"Fast-moving floodwaters rose Monday in northeastern Australia after forcing many to flee, blacking out homes, and sweeping away a chunk of a critical bridge.
Storms have already dumped more than a m… [+2206 chars]",,en,flood Australia,Flood,aidr,Australia,EAU,Oceania
https://japantoday.com/category/world/rising-floodwaters-force-evacuations-in-eastern-australian,https://japantoday.com/category/world/rising-floodwaters-force-evacuations-in-eastern-australian,0,japantoday.com,Rising floodwaters force evacuations in eastern Australian,"Fast-moving floodwaters rose Monday in northeastern Australia after forcing many to flee, blacking out homes, and sweeping away a chunk of a critical bridge. Storms have already dumped more than a meter of rain in two days in parts of Queensland, engulfing ho…",,2025-02-03T04:00:51Z,,"Fast-moving floodwaters rose Monday in northeastern Australia after forcing many to flee, blacking out homes, and sweeping away a chunk of a critical bridge.
Storms have already dumped more than a m… [+2194 chars]",,en,Flood Eastern Australia,Flood,aidr,Australia,EAU,Oceania
https://www.voanews.com/a/rising-floodwaters-force-evacuations-in-eastern-australia-/7960622.html,https://www.voanews.com/a/rising-floodwaters-force-evacuations-in-eastern-australia-/7960622.html,0,www.voanews.com,Rising floodwaters force evacuations in eastern Australia,"SYDNEY — Fast-moving floodwaters rose Monday in northeastern Australia after forcing many to flee, blacking out homes, and sweeping away a chunk of a critical bridge.


Storms have already dumped more than a meter of rain in two days in parts of Queensland, e…",https://gdb.voanews.com/90E79C78-9C52-4074-B85B-6C9722CBF04F.jpg,2025-02-03T04:10:34Z,,"SYDNEY  Fast-moving floodwaters rose Monday in northeastern Australia after forcing many to flee, blacking out homes, and sweeping away a chunk of a critical bridge.
Storms have already dumped more … [+2206 chars]",,en,Flood Eastern Australia,Flood,aidr,Australia,EAU,Oceania
https://www.channelnewsasia.com/world/northeastern-australia-floods-queensland-evacuations-rain-storms-4912666,https://www.channelnewsasia.com/world/northeastern-australia-floods-queensland-evacuations-rain-storms-4912666,0,www.channelnewsasia.com,Rising floodwaters force evacuations in eastern Australia,"SYDNEY: Fast-moving floodwaters rose on Monday (Feb 3) in northeastern Australia after forcing many to flee, blacking out homes, and sweeping away a chunk of a critical bridge. Storms have already dumped more than a metre of rain in two days in parts of Queen…","https://dam.mediacorp.sg/image/upload/s--N60kEnyI--/fl_relative,g_south_east,l_mediacorp:cna:watermark:2023-11:afp_watermark_14112023,w_0.1/f_auto,q_auto/c_fill,g_auto,h_676,w_1200/v1/mediacorp/cna/image/2025/02/03/000_36wx3hq.jpg?itok=1OZBIZFY",2025-02-03T06:56:25Z,,"SYDNEY: Fast-moving floodwaters rose on Monday (Feb 3) in northeastern Australia after forcing many to flee, blacking out homes, and sweeping away a chunk of a critical bridge.
Storms have already d… [+1386 chars]",,en,Flood Eastern Australia,Flood,aidr,Australia,EAU,Oceania
https://www.japantimes.co.jp/culture/2025/02/03/entertainment-news/photo-gallery-grammy-moments/,https://www.japantimes.co.jp/culture/2025/02/03/entertainment-news/photo-gallery-grammy-moments/,0,www.japantimes.co.jp,In pictures: The Grammys 2025 moments to remember,It was a night for recognition of music's brightest talents but also for coming together after the tragedy of the LA wildfires.,https://www.japantimes.co.jp/japantimes/uploads/images/2025/02/03/450071.JPG?v=3.1,2025-02-03T09:16:00Z,http://archive.md/20250204004844/https://www.japantimes.co.jp/culture/2025/02/03/entertainment-news/photo-gallery-grammy-moments/,"Los Angeles The 67th Grammy Awards on Sunday was a history-making evening that served as a heartfelt tribute to fire-hit Los Angeles and celebrated music's finest with dazzling performances.
It also… [+4760 chars]",,en,wildfire,Wildfire,random,,,
https://www.carriermanagement.com/news/2025/01/31/271282.htm,https://www.carriermanagement.com/news/2025/01/31/271282.htm,0,www.carriermanagement.com,Property-Catastrophe Reinsurance Rates Will Stop Dropping Post-Wildfires: Execs,"RenaissanceRe expects to incur about $750 million in losses from the January 2025 California wildfires—and anticipates that industrywide impacts should halt the drop in property-catastrophe reinsurance prices observed at 1/1. Kevin O’Donnell, president and ch…",https://www.insurancejournal.com/app/uploads/2025/02/demand-vs-supply-balance-766925853-AdobeStock-scaled.jpeg,2025-02-03T10:36:54Z,,RenaissanceRe expects to incur about $750 million in losses from the January 2025 California wildfiresand anticipates that industrywide impacts should halt the drop in property-catastrophe reinsuranc… [+13507 chars],,en,wildfire,Wildfire,random,,,
https://www.insurancejournal.com/news/international/2025/02/03/810469.htm,https://www.insurancejournal.com/news/international/2025/02/03/810469.htm,0,www.insurancejournal.com,Australia Urges Residents in Northeast to Evacuate on Flood Risk,Australian officials urged residents in the northeastern city of Townsville and adjacent areas to evacuate as torrential rains raised the risk of a flood disaster in the area. Some parts of the north in Queensland state have had more than …,https://www.insurancejournal.com/app/uploads/2025/02/storm-clouds-getty-scaled.jpg,2025-02-03T11:21:38Z,,"Australian officials urged residents in the northeastern city of Townsville and adjacent areas to evacuate as torrential rains raised the risk of a flood disaster in the area.
Some parts of the nort… [+2507 chars]",,en,Flood Eastern Australia,Flood,aidr,Australia,EAU,Oceania
https://news.sky.com/story/woman-dies-and-thousands-urged-to-move-to-higher-ground-as-record-breaking-rainfall-hits-queensland-13302383,https://news.sky.com/story/woman-dies-and-thousands-urged-to-move-to-higher-ground-as-record-breaking-rainfall-hits-queensland-13302383,0,news.sky.com,Woman dies and thousands urged to move to higher ground as 'record-breaking rainfall' hits Queensland,A woman has died and thousands of people have been urged to move to higher ground due to major flooding in northern Australia.,https://e3.365dm.com/25/02/1600x900/skynews-floods-townsville-australia_6818425.jpg?20250203104419,2025-02-03T12:47:00Z,,"A woman has died and thousands of people have been urged to move to higher ground due to major flooding in northern Australia.
Torrential rains have hammered the state of Queensland over the past th… [+3150 chars]",,en,flooding Queensland,Flood,acwe,Australia,CAU,Oceania
https://www.yahoo.com/news/6-months-rain-3-days-125104526.html,https://www.yahoo.com/news/6-months-rain-3-days-125104526.html,0,www.yahoo.com,6 Months Of Rain In 3 Days: Deadly Floods In Australia,Thousands of people across northeastern Australia have been forced out of their homes by historic flooding and the rain is not over. The flooding turned...,https://s.yimg.com/ny/api/res/1.2/kc95KsEl9hw6ripZS.xIbg--/YXBwaWQ9aGlnaGxhbmRlcjt3PTEyMDA7aD02NzU-/https://media.zenfs.com/en/the_weather_channel_videos_110/38f35566b12f04eec5c808319ea1c45b,2025-02-03T12:51:04Z,,Thousands of people across northeastern Australia have been forced out of their homes by historic flooding and the rain is not over. The flooding turned deadly in Queensland on Sunday. Watch this vid… [+17 chars],,en,flood Australia,Flood,aidr,Australia,EAU,Oceania
https://www.bbc.com/news/videos/c07kjpeglxyo,https://www.bbc.com/news/videos/c07kjpeglxyo,0,www.bbc.com,Watch: BBC reports from site of Queensland flooding,"BBC Australia reporter Simon Atkinson visits Townsville, which was hit by severe rainfall over the weekend.",https://ichef.bbci.co.uk/news/1024/branded_news/5555/live/61f79970-e237-11ef-bd1b-d536627785f2.jpg,2025-02-03T14:10:46Z,http://archive.md/20250203160815/https://www.bbc.com/news/videos/c07kjpeglxyo,"Severe flooding in Queensland has forced thousands of people to evacuate, cut power to homes and washed away sections of a vital highway. 
In Townsville, one of the hardest-hit cities in the region,… [+164 chars]",,en,flooding Australia,Flood,aidr,Australia,SAU,Oceania
https://www.bbc.com/news/articles/cn57gk917dpo,https://www.bbc.com/news/articles/cn57gk917dpo,0,www.bbc.com,"'We haven't panicked, but we are prepared': The residents waiting out Australia's floods","The BBC meets the residents of Townsville's ""black zones"" who have stayed put despite flood warnings.",https://ichef.bbci.co.uk/news/1024/branded_news/364c/live/3e654e80-e237-11ef-a819-277e390a7a08.jpg,2025-02-03T14:56:06Z,http://wayback.archive-it.org/all/20250203191006/https://www.bbc.com/news/articles/cn57gk917dpo,"Sunk into a camping chair wearing shorts and in his Led Zeppelin T-shirt, John Duric looks relaxed.
In the arm of the seat, a drinks pocket holds an icy bottle of beer. But on the ground next to him… [+2353 chars]",,en,flood Australia,Flood,aidr,Australia,EAU,Oceania
https://gizmodo.com/video-game-exec-pleads-guilty-to-crashing-drone-into-firefighting-plane-during-la-wildfires-2000558981,https://gizmodo.com/video-game-exec-pleads-guilty-to-crashing-drone-into-firefighting-plane-during-la-wildfires-2000558981,0,gizmodo.com,Video Game Exec Pleads Guilty to Crashing Drone Into Firefighting Plane During LA Wildfires,"He'll pay almost $70,000 to repair the plane and do 150 hours of community service.",https://gizmodo.com/app/uploads/2025/02/TreyarchFounderHole.jpg,2025-02-04T16:00:13Z,,"Peter T. Akemann, the co-founder of the Treyarch video game studio, has pleaded guilty to recklessly flying a drone during the California wildfire. According to his own admission, the video game exec… [+4474 chars]",,en,wildfire,Wildfire,random,,,
https://www.businessinsider.com/moved-from-iowa-to-oregon-because-of-climate-crisis-2025-2,https://www.businessinsider.com/moved-from-iowa-to-oregon-because-of-climate-crisis-2025-2,0,www.businessinsider.com,"We moved from Iowa to Oregon after floods devastated our hometown. It was a hard move, but we don't regret it.","In 2008 a flood devastated eastern Iowa. We became climate crisis movers, and decided to relocate to Oregon.",https://i.insider.com/67a0e3ccbfebcc4d029d86b8?width=1200&format=jpeg,2025-02-05T01:35:02Z,http://archive.md/20250205193615/https://www.businessinsider.com/moved-from-iowa-to-oregon-because-of-climate-crisis-2025-2,"The author and her family moved from Iowa to Oregon after the floods in 2008.Halfpoint Images/Getty Images
<ul><li>In 2008, my husband and I decided to move from Iowa to Oregon. </li><li>We picked O… [+5971 chars]",,en,Flood Oregon,Flood,fema,United States,WNA,North-America
https://theconversation.com/in-freezing-foreign-aid-the-us-leaves-people-to-die-and-allows-china-to-come-to-the-rescue-249024,https://theconversation.com/in-freezing-foreign-aid-the-us-leaves-people-to-die-and-allows-china-to-come-to-the-rescue-249024,0,theconversation.com,"In freezing foreign aid, the US leaves people to die – and allows China to come to the rescue","A$95 billion worth of USAID programs have been brought to a screeching halt. It’s a devastating decision for developing nations, but also for US foreign policy.",https://images.theconversation.com/files/646944/original/file-20250205-17-tq3j33.jpg?ixlib=rb-4.1.0&rect=0%2C797%2C4930%2C2465&q=45&auto=format&w=1356&h=668&fit=crop,2025-02-05T04:34:54Z,https://web.archive.org/web/20250205055631/https://theconversation.com/in-freezing-foreign-aid-the-us-leaves-people-to-die-and-allows-china-to-come-to-the-rescue-249024,"One of the executive orders US President Donald Trump signed the day he was inaugurated was a 90-day pause in US foreign development assistance. 

The US Agency for International Development, USAID, … [+6232 chars]",,en,freezing,Snow&Ice,random,,,
https://thediplomat.com/2025/02/in-freezing-foreign-aid-the-us-leaves-people-to-die-and-allows-china-to-come-to-the-rescue/,https://thediplomat.com/2025/02/in-freezing-foreign-aid-the-us-leaves-people-to-die-and-allows-china-to-come-to-the-rescue/,0,thediplomat.com,"In Freezing Foreign Aid, the US Leaves People to Die – and Allows China to Come to the Rescue","In the Pacific, the Biden administration made a real effort to increase U.S. presence, opening embassies and announcing USAID programs. All of this has now been squandered.",https://thediplomat.com/wp-content/uploads/2024/01/sizes/td-story-s-2/thediplomat_2024-01-24-150038.jpg,2025-02-05T13:14:57Z,http://archive.md/20250207003714/https://thediplomat.com/2025/02/in-freezing-foreign-aid-the-us-leaves-people-to-die-and-allows-china-to-come-to-the-rescue/,"One of the executive orders U.S. President Donald Trump signed the day he was inaugurated was a 90-day pause in U.S. foreign development assistance. The U.S. Agency for International Development, USA… [+12041 chars]",,en,Freezing China,Snow&Ice,wmo,China,EAS,Asia
https://www.resilience.org/stories/2025-02-05/time-is-water-a-cross-border-indigenous-alliance-works-to-save-the-amazon/,https://www.resilience.org/stories/2025-02-05/time-is-water-a-cross-border-indigenous-alliance-works-to-save-the-amazon/,0,www.resilience.org,‘Time is water’: A cross-border Indigenous alliance works to save the Amazon,The rivers in this region of northwestern Peru are running dry as the Amazon Basin experiences its most severe drought in decades.,https://www.resilience.org/wp-content/uploads/2025/02/unnamed_13_Q5fm5MX.width-2050-1.jpg,2025-02-05T15:40:18Z,https://web.archive.org/web/20250207063526/https://www.resilience.org/stories/2025-02-05/time-is-water-a-cross-border-indigenous-alliance-works-to-save-the-amazon/,"URIMAGUAS, Alto Amazonas, Peru Our boat sets sail early in the morning. The plan is to travel down the Huallaga River, reach the Marañón, then sail north along the Santiago River towards the border w… [+11524 chars]",,en,Drought Peru,Drought,edo,Peru,NWS,South-America
https://dailycoffeenews.com/2025/02/05/the-freezing-of-usaid-is-an-abject-disaster-for-the-global-coffee-sector/,https://dailycoffeenews.com/2025/02/05/the-freezing-of-usaid-is-an-abject-disaster-for-the-global-coffee-sector/,0,dailycoffeenews.com,The Freezing of USAID is an Abject Disaster for the Global Coffee Sector,"Roast Magazine’s Daily Coffee News is proud to maintain advertising partnerships with many of the world’s leading coffee companies, yet maintains a focus on fair and objective editorial content, with no sponsored content or native advertising.",https://dailycoffeenews.com/wp-content/uploads/2025/02/USAID-website.png,2025-02-05T19:06:24Z,https://web.archive.org/web/20250205225850/https://dailycoffeenews.com/2025/02/05/the-freezing-of-usaid-is-an-abject-disaster-for-the-global-coffee-sector/,"A screenshot from the USAID website on Wednesday, Feb. 5.
The phrase “political instability” is commonly cited as a threat to sustainability in coffee. Among organizations and analysts in the Global… [+5366 chars]",,en,freezing,Snow&Ice,random,,,
https://nationalpost.com/news/politics/canada-us-border-patrols,https://nationalpost.com/news/politics/canada-us-border-patrols,0,nationalpost.com,Provincial patrols at Canada-U.S. border are just 'history's most expensive taxi service': union head,"Any illegal crossers must still be delivered to federal border agents, union head says",https://smartcdn.gprod.postmedia.digital/nationalpost/wp-content/uploads/2025/01/Quebec-border-1.jpg,2025-02-06T09:00:08Z,http://archive.md/20250206101851/https://nationalpost.com/news/politics/canada-us-border-patrols,"Any illegal crossers must still be delivered to federal border agents, union head says
An RCMP officer looks over the border between Quebec and New York State on Roxham Road in St. Bernard-de-Lacoll… [+10438 chars]",,en,Ice Canada,Snow&Ice,wmo,Canada,NEN,North-America
