index,url,valid,domain,title,description,image,published,archive,content,quote,language,term,topic,feed,country,ipcc,continent
https://www.cbc.ca/news/canada/british-columbia/atmospheric-river-bc-1.7048979,https://www.cbc.ca/news/canada/british-columbia/atmospheric-river-bc-1.7048979,0,www.cbc.ca,Atmospheric river brings heavy rain and wind to coastal and southern B.C.,"The province's River Forecast Centre issued flood watches for rivers and streams in Metro Vancouver, the South Coast and the Lower Fraser regions, while Vancouver Island and the Nicola and Similkameen regions are under high streamflow advisories.",https://i.cbc.ca/1.7049014.1701735313!/cumulusImage/httpImage/image.jpg_gen/derivatives/16x9_620/atmoshperic-river.jpg,2023-12-05T00:47:22Z,,"Torrential rain, heavy snow, strong winds and high tides converged on coastal and southern British Columbia Monday.
The province's River Forecast Centre issued flood watches for rivers and streams i… [+4167 chars]",,en,Rain,Precipitation,wmo,Argentina,SES,South-America
https://slashdot.org/firehose.pl?op=view&amp;id=172365623,https://slashdot.org/firehose.pl?op=view&amp;id=172365623,0,slashdot.org,Cyclone Michaung flooding inundates Chennai airport in India as cars are swept down streets - CBS News,"Cyclone Michaung flooding inundates Chennai airport in India as cars are swept down streetsCBS News Cyclone Michaung: At least 4 dead as tropical storm approaches, floods south IndiaGlobal News Maheesh Theekshana reacts to Chennai rains: ‘Concerning footage f…",,2023-12-05T02:13:10Z,,Sign up for the Slashdot newsletter! OR check out the new Slashdot job board to browse remote jobs or jobs in your areaDo you develop on GitHub? You can keep using GitHub but automatically sync your … [+268 chars],,en,tropical storm,Tropical Cyclone,random,,,
https://slashdot.org/firehose.pl?op=view&amp;id=172365789,https://slashdot.org/firehose.pl?op=view&amp;id=172365789,0,slashdot.org,Cyclone Michaung: Heavy rains batter India's southern coast - BBC.com,Cyclone Michaung: Heavy rains batter India's southern coastBBC.com Cyclone Michaung flooding inundates Chennai airport in India as cars are swept down streetsCBS News Watch: Dramatic rescue in India during deadly Cyclone Michaung amid Chennai's 'worst' rain i…,,2023-12-05T02:52:50Z,,Sign up for the Slashdot newsletter! OR check out the new Slashdot job board to browse remote jobs or jobs in your areaDo you develop on GitHub? You can keep using GitHub but automatically sync your … [+268 chars],,en,cyclone,Tropical Cyclone,random,,,
https://abcnews.go.com/International/wireStory/6-people-died-heavy-rains-tropical-cyclone-michaung-105377307,https://abcnews.go.com/International/wireStory/6-people-died-heavy-rains-tropical-cyclone-michaung-105377307,0,abcnews.go.com,At least 6 people have died as heavy rains from Tropical Cyclone Michaung hit India's coasts,Torrential rain and strong winds lashing India’s southern and eastern coasts have killed at least six people as states there braced for a powerful storm expected to make landfall later Tuesday,https://i.abcnewsfe.com/a/953b8fd9-a0fd-474a-8246-653a7a69179b/wirestory_3f1c3ff0a2f75578da5f8a815843ef1d_16x9.jpg?w=992,2023-12-05T04:14:45Z,https://web.archive.org/web/20231205050520/https://abcnews.go.com/International/wireStory/6-people-died-heavy-rains-tropical-cyclone-michaung-105377307,"NEW DELHI -- Torrential rains and strong winds lashing India's southern and eastern coasts have killed at least six people, officials said, as states there braced for a powerful storm expected to mak… [+1768 chars]",,en,landfall,Tropical Cyclone,random,,,
https://economictimes.indiatimes.com/news/et-tv/cyclone-michaung-imd-dg-m-mohapatra-on-impact-of-cyclone-on-andhra-coast/videoshow/105745721.cms,https://economictimes.indiatimes.com/news/et-tv/cyclone-michaung-imd-dg-m-mohapatra-on-impact-of-cyclone-on-andhra-coast/videoshow/105745721.cms,0,economictimes.indiatimes.com,Cyclone Michaung: IMD DG M Mohapatra on impact of cyclone on Andhra coast,Tamil Nadu and Andhra Pradesh states in the south and Odisha in the east braced for flooding as authorities issued warnings for Tropical Cyclone Michaung. It's likely to hit the southern coast on Tuesday with maximum sustained winds of 90-100 kph (56-62 mph) …,"https://img.etimg.com/thumb/msid-105745721,width-1070,height-580,overlay-economictimes/photo.jpg",2023-12-05T05:51:21Z,,Tamil Nadu and Andhra Pradesh states in the south and Odisha in the east braced for flooding as authorities issued warnings for Tropical Cyclone Michaung. It's likely to hit the southern coast on Tue… [+283 chars],,en,cyclone,Tropical Cyclone,random,,,
https://timesofindia.indiatimes.com/etimes/trending/as-michaung-wreaks-havoc-a-look-at-the-7-most-devastating-cyclones-in-the-past/articleshow/105752163.cms,https://timesofindia.indiatimes.com/etimes/trending/as-michaung-wreaks-havoc-a-look-at-the-7-most-devastating-cyclones-in-the-past/articleshow/105752163.cms,0,timesofindia.indiatimes.com,7 most devastating cyclones in history,"Cyclone Michaung hits Chennai, causing heavy rain, flooding, and chaos. Streets are waterlogged, and the airport has submerged runways and canceled flights. Chennai braces for impact as the severe cyclonic storm approaches. The city, with its 12 million resid…","https://static.toiimg.com/thumb/msid-105752163,width-1070,height-580,imgsize-233534,resizemode-6,overlay-toi_sw,pt-32,y_pad-40/photo.jpg",2023-12-05T09:30:00Z,,"Cyclone Michaung wreaks havoc in the city of Chennai, causing heavy rain, flooding, and chaos. As the severe cyclonic storm approaches India's coastline, Chennai, with its 12 million residents, brace… [+2788 chars]",,en,cyclone,Tropical Cyclone,random,,,
