index,url,valid,domain,title,description,image,published,archive,content,quote,language,term,topic,feed,country,ipcc,continent
https://www.cbsnews.com/news/alaska-airlifting-hundreds-from-coastal-villages-devastated-by-flooding-kipnuk-kwigillingok/,https://www.cbsnews.com/news/alaska-airlifting-hundreds-from-coastal-villages-devastated-by-flooding-kipnuk-kwigillingok/,0,www.cbsnews.com,Alaska airlifting hundreds from coastal villages devastated by flooding,The storm brought record water levels to two low-lying communities and washed away homes — some with people inside.,https://assets2.cbsnewsstatic.com/hub/i/r/2025/10/16/394e46c5-9608-42dc-89cf-9e85efb32193/thumbnail/1200x630/d08fc26f54b1b798abaae83aa444193b/ap25288670254700.jpg,2025-10-16T04:26:00Z,,One of the most significant airlifts in Alaska history was underway Wednesday to move hundreds of people from coastal villages ravaged by high surf and strong winds from the remnants of Typhoon Halon… [+5160 chars],,en,coastal flooding,Flood,random,,,
https://www.yahoo.com/lifestyle/articles/stormcation-dramatic-faroe-islands-where-063307138.html,https://www.yahoo.com/lifestyle/articles/stormcation-dramatic-faroe-islands-where-063307138.html,0,www.yahoo.com,"Take a 'stormcation' in the dramatic Faroe Islands, where James Bond died","The tiny Faroe Islands in the north Atlantic could be a poor choice for travelers with vertigo, seasickness or a fear of enclosed spaces.  There are...",https://s.yimg.com/ny/api/res/1.2/cbpvgCF_frhELSpKOYBBFQ--/YXBwaWQ9aGlnaGxhbmRlcjt3PTEyMDA7aD05MDA7Y2Y9d2VicA--/https://media.zenfs.com/en/ap.org/129fe3060a777cd7a6070605e998807c,2025-10-16T06:33:07Z,,"KALSOY ISLAND, Faroe Islands (AP) The tiny Faroe Islands in the north Atlantic could be a poor choice for travelers with vertigo, seasickness or a fear of enclosed spaces. There are crumbling cliffs,… [+4750 chars]",,en,storm,Storm,random,,,
https://phys.org/news/2025-10-experts-reveal-climate-drove-extreme.html,https://phys.org/news/2025-10-experts-reveal-climate-drove-extreme.html,0,phys.org,"Experts reveal climate change drove extreme wildfire seasons across the Americas, making burned areas much larger","Human-driven climate change made wildfires in parts of South America and Southern California many times larger and more destructive, according to an annual assessment by international experts.",https://scx2.b-cdn.net/gfx/news/hires/2023/wildfire-4.jpg,2025-10-16T08:37:05Z,,"Human-driven climate change made wildfires in parts of South America and Southern California many times larger and more destructive, according to an annual assessment by international experts.
Accor… [+8277 chars]",,en,wildfire,Wildfire,random,,,
https://journals.plos.org/plosntds/article?id=10.1371/journal.pntd.0013448,https://journals.plos.org/plosntds/article?id=10.1371/journal.pntd.0013448,0,journals.plos.org,Risk assessment and mitigation evaluation of future yellow fever outbreaks under different climate scenarios: Insight from a case study of Brazil,"Author summary Yellow Fever is a disease that can be transmitted between humans and mosquitoes, and its spread is often exacerbated by increasing temperature and precipitation patterns. We develop a mathematical model of Yellow Fever transmission in Southeast…",https://journals.plos.org/plosntds/article/figure/image?id=10.1371/journal.pntd.0013448.g011&size=inline,2025-10-16T14:00:00Z,,"Abstract
Background: Yellow Fever (YF), a disease typically transmitted to humans by infected mosquitoes, is endemic to regions such as South America. Climate change plays a crucial role in exacerba… [+41110 chars]",,en,Precipitation Brazil,Precipitation,wmo,Brazil,SAM,South-America
https://phys.org/news/2025-10-warmer-weather-winters-north-america.html,https://phys.org/news/2025-10-warmer-weather-winters-north-america.html,0,phys.org,Warmer weather is leading to vanishing winters in North America's Great Lakes,"Fifty years ago, winter didn't just visit the Great Lakes—it took up residence. If you blinked too slowly, your eyelashes froze together. Standing on the ice at the edge of Lake Superior, just after an early January snowstorm, everything was white and still, …",https://scx2.b-cdn.net/gfx/news/hires/2019/greatlakes.jpg,2025-10-16T16:02:05Z,,"Fifty years ago, winter didn't just visit the Great Lakesit took up residence. If you blinked too slowly, your eyelashes froze together. Standing on the ice at the edge of Lake Superior, just after a… [+6752 chars]",,en,snowstorm,Snow&Ice,random,,,
https://www.bostonherald.com/2025/10/16/anti-terrorism-funds-nyc/,https://www.bostonherald.com/2025/10/16/anti-terrorism-funds-nyc/,0,www.bostonherald.com,"Judge blocks Trump cuts, restores $34 million in anti-terror funds for New York City transit system",The judge had previously issued an order temporarily freezing the move.,https://www.bostonherald.com/wp-content/uploads/2025/10/Anti-Terrorism_Funds-New_York_City_70258_73882e.jpg?w=1024&h=682,2025-10-16T17:31:49Z,,"NEW YORK (AP) A federal judge has permanently blocked the Trump administration from withholding nearly $34 million in funding earmarked to protect New Yorks transit system from terrorist attacks.
Ju… [+1626 chars]",,en,freezing,Snow&Ice,random,,,
https://economictimes.indiatimes.com/news/sports/women-world-cup-2025-sri-lanka-vs-south-africa-women-pitch-report-of-today-match-sl-w-vs-sa-w-weather-forecast-updates-today-match/articleshow/124622536.cms,https://economictimes.indiatimes.com/news/sports/women-world-cup-2025-sri-lanka-vs-south-africa-women-pitch-report-of-today-match-sl-w-vs-sa-w-weather-forecast-updates-today-match/articleshow/124622536.cms,0,economictimes.indiatimes.com,Sri Lanka vs South Africa World Cup 2025 match: Check pitch report and weather forecast for the match,"SL W vs SA W Pitch Weather Report: Rain threatens to disrupt the Women's ODI World Cup 2025 fixture between Sri Lanka and South Africa in Colombo. South Africa, in strong form with three consecutive wins, faces a winless Sri Lanka. Scattered thunderstorms wit…","https://img.etimg.com/thumb/msid-124622565,width-1200,height-630,imgsize-174212,overlay-economictimes/articleshow.jpg",2025-10-17T06:57:49Z,,"Sri Lanka and South Africa are set to face each other in a Womens ODI World Cup 2025 league-stage fixture on Friday, 17 October, at the R. Premadasa International Cricket Stadium in Colombo. However,… [+1545 chars]",,en,Rain South Africa,Precipitation,wmo,South Africa,WSAF,Africa
https://www.forbes.com/sites/jamiehailstone/2025/10/17/why-wildfires-and-super-pollutants-have-become-a-vicious-circle/,https://www.forbes.com/sites/jamiehailstone/2025/10/17/why-wildfires-and-super-pollutants-have-become-a-vicious-circle/,0,www.forbes.com,Why Wildfires And Super Pollutants Have Become A ‘Vicious Circle’,"Clean Air Fund chief executive Jane Burston said climate change creates an increased risk of wildfires, which then increases the impact of climate change.",https://imageio.forbes.com/specials-images/imageserve/68f1f840e2b19841868925f7/0x0.jpg?format=jpg&height=900&width=1600&fit=bounds,2025-10-17T08:11:34Z,,"CALIFORNIA, UNITED STATES - JANUARY 8: A house in on fire as residents try to escape the site in Pacific Palisades, California, Los Angeles, United States on January 8, 2025. A fast-moving wildfire h… [+4400 chars]",,en,wildfire,Wildfire,random,,,
https://www.theatlantic.com/photography/archive/2025/10/photos-of-the-week/684573/,https://www.theatlantic.com/photography/archive/2025/10/photos-of-the-week/684573/,0,www.theatlantic.com,"Photos of the Week: Cave Lights, Mountain Shepherd, Snowbirds Formation","Images from around the world, featuring events from the past seven days, including major storm damage in coastal Alaska, a scene from São Paulo Fashion Week, a 700-year-old mosque in Mali, a Radio City Rockettes rehearsal in Manhattan, and much more",https://cdn.theatlantic.com/thumbor/jt23B0wVqpYZbGFw9WJXLMC3RCc=/5x294:4529x2650/1200x625/media/img/mt/2025/10/a01_G_2240186022/original.jpg,2025-10-17T12:00:00Z,,"Patrick Pleul / DPA / Getty
Purple Phacelia blossoms bloom in a field in front of autumn-colored trees in the Oder-Spree district of Brandenburg, Germany, on October 12, 2025.
Dominika Zarzycka / S… [+5696 chars]",,en,Storm Alaska,Storm,fema,United States,NWN,North-America
https://www.usatoday.com/story/news/weather/2025/10/17/hurricane-center-forecasters-eye-developing-system-in-the-atlantic/86745732007/,https://www.usatoday.com/story/news/weather/2025/10/17/hurricane-center-forecasters-eye-developing-system-in-the-atlantic/86745732007/,0,www.usatoday.com,Late October hurricane outlook warns of tropical trouble,A tropical wave in the central Atlantic Ocean shows signs of organizing as it makes its way west toward the Caribbean Sea.,https://media.zenfs.com/en/usa_today_news_641/e52a05bd559e97df650b38ca9f4348e0,2025-10-17T15:23:27Z,,"The 2025 Atlantic hurricane season might have at least one more trick up its sleeve.
A tropical wave in the central Atlantic Ocean shows signs of organizing as it makes its way west toward the Carib… [+3907 chars]",,en,hurricane,Tropical Cyclone,random,,,
https://biztoc.com/x/2027e3c1ee798601,https://biztoc.com/x/2027e3c1ee798601,0,biztoc.com,Coffee Prices Slightly Lower on Rain Forecasts for Brazil and Vietnam,,https://biztoc.com/cdn/950/og.png,2025-10-17T16:02:27Z,,"{ window.open(this.href, '_blank'); }, 200); return false;""&gt;Why did Porsche appoint new CEO from McLaren? { window.open(this.href, '_blank'); }, 200); return false;""&gt;What triggered U.S. regiona… [+737 chars]",,en,Rain Brazil,Precipitation,wmo,Brazil,SAM,South-America
https://abcnews.go.com/US/video/airlift-evacuates-hundreds-alaska-after-flooding-typhoon-126624164,https://abcnews.go.com/US/video/airlift-evacuates-hundreds-alaska-after-flooding-typhoon-126624164,0,abcnews.go.com,WATCH: Airlift evacuates hundreds in Alaska after flooding from typhoon,"The largest airlift in Alaska’s history is taking place after a massive storm surge and winds up to 100 mph, fueled by Typhoon Halong, left at least one person dead and two people missing.",https://i.abcnewsfe.com/a/182cc612-032e-4287-aec9-a04d14262cd1/251017_gma_social_typhoon_hpMain_9x16.jpg?w=992,2025-10-17T17:44:01Z,,"<ul><li>Ex-Trump adviser John Bolton pleads not guilty to classified documents charges
</li><li>John Bolton indictment is 'strong' side of the coin, legal analyst says
</li><li>Protesters arrested … [+4611 chars]",,en,Typhoon Halong,Storm,eonet,,NPO,Pacific Ocean
https://timesofindia.indiatimes.com/education/news/pennsylvania-schools-are-struggling-to-keep-the-lights-on-amid-budget-impasse-heres-whats-happening/articleshow/124660154.cms,https://timesofindia.indiatimes.com/education/news/pennsylvania-schools-are-struggling-to-keep-the-lights-on-amid-budget-impasse-heres-whats-happening/articleshow/124660154.cms,0,timesofindia.indiatimes.com,Pennsylvania schools are struggling to 'keep the lights on' amid budget impasse: Here’s what’s happening,"Pennsylvania school districts are facing severe financial strain as a months-long state budget impasse stalls over $3.5 billion in education funding. Many schools are borrowing money, freezing hiring, and delaying repairs to stay afloat. Education leaders war…","https://static.toiimg.com/thumb/msid-124660249,width-1070,height-580,imgsize-74098,resizemode-75,overlay-toi_sw,pt-32,y_pad-40/photo.jpg",2025-10-18T08:22:43Z,,"<ul><li>News</li>
<li>Education News</li>
<li>News</li>
<li>Pennsylvania schools are struggling to 'keep the lights on' amid budget impasse: Heres whats happening</li></ul>
Pennsylvania school di… [+3781 chars]",,en,freezing,Snow&Ice,random,,,
https://www.bbc.com/sport/cricket/articles/cj0er78m0gvo,https://www.bbc.com/sport/cricket/articles/cj0er78m0gvo,0,www.bbc.com,NZ abandonment puts Pakistan on brink of elimination,Pakistan are on the brink of elimination from the World Cup after their match against New Zealand was abandoned because of rain.,https://ichef.bbci.co.uk/ace/branded_sport/1200/cpsprodpb/f9e7/live/85e76790-ac33-11f0-b3b3-c99a905ae914.jpg,2025-10-18T16:27:51Z,,"Pakistan are on the brink of elimination from the World Cup after their match against New Zealand was abandoned because of rain.
The tournament's bottom side are yet to win in five games, and suffer… [+1668 chars]",,en,Rain New Zealand,Precipitation,wmo,New Zealand,NZ,Oceania
https://phys.org/news/2025-10-bigger-hotter-faster-extreme-blazes.html,https://phys.org/news/2025-10-bigger-hotter-faster-extreme-blazes.html,0,phys.org,"'Bigger, hotter, faster': Extreme blazes drive rise in CO₂ fire emissions","Rampant wildfires in the Americas drove a jump in global greenhouse gas emissions from fires in the year to February, new research found Thursday, warning that climate change was fanning the flames.",https://scx2.b-cdn.net/gfx/news/2025/wildfires-fuelled-by-c.jpg,2025-10-18T17:10:01Z,,"Rampant wildfires in the Americas drove a jump in global greenhouse gas emissions from fires in the year to February, new research found Thursday, warning that climate change was fanning the flames.… [+3284 chars]",,en,wildfire,Wildfire,random,,,
https://cointelegraph.com/news/stablecoins-central-business-digital-currencies,https://cointelegraph.com/news/stablecoins-central-business-digital-currencies,0,cointelegraph.com,Stablecoins are really 'central business digital currencies' — VC,"Privately-issued stablecoins feature the same risks of freezing and surveillance inherent to central bank digital currencies, Jeremy Kranz told Cointelegraph.","https://images.cointelegraph.com/cdn-cgi/image/format=auto,onerror=redirect,quality=90,width=1200/https://s3.cointelegraph.com/uploads/2025-10/0199b523-a38f-78e0-80ad-610fe6882865",2025-10-18T17:58:43Z,,"Investors should exercise discernment when considering privately-issued stablecoins, which carry all the risks of a central bank digital currency (CBDC) plus their own unique risks, according to Jere… [+2680 chars]",,en,freezing,Snow&Ice,random,,,
https://www.aljazeera.com/news/2025/10/19/five-dead-two-missing-as-tropical-storm-fengshen-soaks-philippines,https://www.aljazeera.com/news/2025/10/19/five-dead-two-missing-as-tropical-storm-fengshen-soaks-philippines,0,www.aljazeera.com,"Five dead, two missing as Tropical Storm Fengshen soaks Philippines","Heavy flooding reported in several central Philippine islands, including Samar and Panay, forcing thousands to evacuate.",https://www.aljazeera.com/wp-content/uploads/2025/10/2025-10-04T133855Z_2120736150_RC2Q4HAG7HH2_RTRMADP_3_ASIA-WEATHER-PHILIPPINES-1760858122.jpg?resize=1920%2C1440,2025-10-19T07:40:23Z,,"At least five people have been killed and two reported missing as Tropical Storm Fengshen sweeps through the Philippines, triggering heavy flooding on the main island of Luzon and a vast landslide on… [+2866 chars]",,en,Flooding Philippines,Flood,wmo,Philippines,SEA,Asia
https://www.globenewswire.com/news-release/2025/10/20/3169224/0/en/Churchill-Resources-Provides-Update-on-Fall-Drilling-Trenching-Program-at-Frost-Cove-Antimony-Mine-Massive-Stibnite-Seams-Discovered.html,https://www.globenewswire.com/news-release/2025/10/20/3169224/0/en/Churchill-Resources-Provides-Update-on-Fall-Drilling-Trenching-Program-at-Frost-Cove-Antimony-Mine-Massive-Stibnite-Seams-Discovered.html,0,www.globenewswire.com,Churchill Resources Provides Update on Fall Drilling & Trenching Program at Frost Cove Antimony Mine; Massive Stibnite Seams Discovered,"TORONTO, Oct. 20, 2025 (GLOBE NEWSWIRE) -- Churchill Resources Inc. (“Churchill” or the “Company”) (TSXV: CRI) is pleased to provide an update on its ongoing exploration at the Black Raven Property in Central Newfoundland, host to the historic Frost Cove Anti…",https://ml.globenewswire.com/Resource/Download/a39509b7-a667-45b0-be96-7e868fda479b,2025-10-20T11:00:00Z,,"TORONTO, Oct. 20, 2025 (GLOBE NEWSWIRE) -- Churchill Resources Inc. (Churchill or the Company) (TSXV: CRI) is pleased to provide an update on its ongoing exploration at the Black Raven Property in Ce… [+12348 chars]",,en,frost,Snow&Ice,random,,,
https://financialpost.com/globe-newswire/churchill-resources-provides-update-on-fall-drilling-massive-stibnite-seams-discovered,https://financialpost.com/globe-newswire/churchill-resources-provides-update-on-fall-drilling-massive-stibnite-seams-discovered,0,financialpost.com,Churchill Resources Provides Update on Fall Drilling & Trenching Program at Frost Cove Antimony Mine; Massive Stibnite Seams Discovered,"TORONTO, Oct. 20, 2025 (GLOBE NEWSWIRE) — Churchill Resources Inc. (“Churchill” or the “Company”) (TSXV: CRI) is pleased to provide an update on its ongoing exploration at the Black Raven Property in Central Newfoundland, host to the historic Frost Cove Antim…",https://smartcdn.gprod.postmedia.digital/financialpost/wp-content/uploads/2025/10/figure-1-19.jpeg,2025-10-20T11:04:21Z,,Metallurgical studies of composite Frost Cove antimony vein material continue at SGS Lakefield and have demonstrated excellent antimony recoveries from conventional gravity flotation flowsheet techni… [+3658 chars],,en,frost,Snow&Ice,random,,,
https://financialpost.com/pmn/business-wire-news-releases-pmn/navacord-partners-with-cyberwrite-to-enhance-cyber-insurance-growth-across-the-canadian-market,https://financialpost.com/pmn/business-wire-news-releases-pmn/navacord-partners-with-cyberwrite-to-enhance-cyber-insurance-growth-across-the-canadian-market,0,financialpost.com,Navacord Partners with Cyberwrite to Enhance Cyber Insurance Growth Across The Canadian Market,"NEW YORK — Cyberwrite, a leading provider of cyber insurance technologies, has been selected by Navacord Corp., one of Canada’s largest and fastest-growing multi-line insurance brokerages and financial services firms, to provide brokers with a cyber risk quan…",,2025-10-20T13:48:08Z,,"NEW YORK Cyberwrite, a leading provider of cyber insurance technologies, has been selected by Navacord Corp., one of Canadas largest and fastest-growing multi-line insurance brokerages and financial … [+6744 chars]",,en,Ice Canada,Snow&Ice,wmo,Canada,NEN,North-America
https://www.bostonherald.com/2025/10/20/faroe-islands-stormcation/,https://www.bostonherald.com/2025/10/20/faroe-islands-stormcation/,0,www.bostonherald.com,"Take a ‘stormcation’ in the dramatic Faroe Islands, where James Bond died",A growing number of travelers are arriving to explore the inhospitable landscapes.,https://www.bostonherald.com/wp-content/uploads/2025/10/Faroe_Islands_Travel_01016-1.jpg?w=1024&h=768,2025-10-20T16:33:44Z,,"By CARA ANNA
KALSOY ISLAND, Faroe Islands (AP) The tiny Faroe Islands in the north Atlantic could be a poor choice for travelers with vertigo, seasickness or a fear of enclosed spaces. There are cru… [+5224 chars]",,en,storm,Storm,random,,,
https://www.abc.net.au/news/2025-10-21/winds-wild-storms-record-heat-for-south-east-australia-weather/105912462,https://www.abc.net.au/news/2025-10-21/winds-wild-storms-record-heat-for-south-east-australia-weather/105912462,0,www.abc.net.au,"Wild winds, storms and record heat to blast south-east Australia","From record October heat to dangerous thunderstorms and gale force winds, the next 36 hours could bring extreme weather across south-east Australia.",https://live-production.wcms.abc-cdn.net.au/a9959bc06f077fb1c2aace0e0ed5828a?impolicy=wcms_watermark_news&cropH=909&cropW=1616&xPos=0&yPos=77&width=862&height=485&imformat=generic,2025-10-20T19:06:44Z,,"The next 36 hours will serve up a smorgasbord of extreme weather across south-east Australia, from record October heat to dangerous thunderstorms and gale force winds.
The majority of severe weather… [+5549 chars]",,en,Storm Australia,Storm,wmo,Australia,CAU,Oceania
https://dailycaller.com/2025/10/20/atmospheric-rivers-northwest-flooding-rain-heavy-snow/,https://dailycaller.com/2025/10/20/atmospheric-rivers-northwest-flooding-rain-heavy-snow/,0,dailycaller.com,"Atmospheric Rivers To Blast Pacific Northwest With Flooding Rain, Heavy Snow","This week will see an active pattern get ratcheted up in the Pacific Northwest as the region will get blasted with atmospheric rivers, unleashing rain and snow.","https://images.dailycaller.com/image/width=1280,height=549,fit=cover,format=webp,f=auto/https://cdn01.dailycaller.com/wp-content/uploads/2025/10/GettyImages-1986231877-scaled-e1761002063648.jpg",2025-10-20T23:21:10Z,,This week will see an active pattern get ratcheted up in the Pacific Northwest as the region will get blasted with atmospheric rivers that could potentially unleash up to a foot of rainfall for areas… [+2094 chars],,en,river flooding,Flood,random,,,
https://oilprice.com/Energy/Energy-General/Chinas-Battery-Giants-Flood-Overseas-Markets-As-Exports-Surge-220.html,https://oilprice.com/Energy/Energy-General/Chinas-Battery-Giants-Flood-Overseas-Markets-As-Exports-Surge-220.html,0,oilprice.com,China’s Battery Giants Flood Overseas Markets As Exports Surge 220%,"Last year, China's battery industry average utilization rate cratered to just a third of maximum capacity amid severe overcapacity following years of massive investment and expansion. This put smaller manufacturers under severe pressure and fueled further ind…",https://d32r1sh890xpii.cloudfront.net/article/718x300/2025-10-20_opuvb5nl9z.jpg,2025-10-21T00:00:00Z,,"The U.S. Department of Energys…
Europe's power grids are struggling…
General Motors announced a $1.6…
By Alex Kimani - Oct 20, 2025, 7:00 PM CDTLast year, China's battery industry average utilizat… [+6120 chars]",,en,Flood China,Flood,wmo,China,EAS,Asia
https://finance.yahoo.com/news/china-battery-giants-flood-overseas-000000330.html,https://finance.yahoo.com/news/china-battery-giants-flood-overseas-000000330.html,0,finance.yahoo.com,China’s Battery Giants Flood Overseas Markets As Exports Surge 220%,"After last year’s severe overcapacity slump, Chinese battery firms secured about 200 overseas orders totaling 186 GWh in H1 2025.",https://media.zenfs.com/en/oilprice.com/db0e98350c5192f0ddfd41dd8ea15a2b,2025-10-21T00:00:00Z,,"Last year, China's battery industry average utilization rate cratered to just a third of maximum capacity amid severe overcapacity following years of massive investment and expansion. This put smalle… [+6355 chars]",,en,Flood China,Flood,wmo,China,EAS,Asia
https://dailycaller.com/2025/10/21/video-invest-98l-melissa-caribbean-tropical-storm-hurricane/,https://dailycaller.com/2025/10/21/video-invest-98l-melissa-caribbean-tropical-storm-hurricane/,0,dailycaller.com,"Video Shows Inside Look Of Invest 98L, Potential Melissa As It Develops In Caribbean","A tropical system, designated by the NHC as Invest 98L, is currently over the eastern Caribbean Sea, and generating disorganized thunderstorms and showers.","https://images.dailycaller.com/image/width=1280,height=549,fit=cover,format=webp,f=auto/https://cdn01.dailycaller.com/wp-content/uploads/2025/10/GettyImages-1628730650-scaled-e1761020647778.jpg",2025-10-21T04:37:55Z,,"According to the National Hurricane Center (NHC), a tropical depression could develop this week in the Caribbean.
A tropical system, designated by the NHC as Invest 98L, is currently over the easter… [+2042 chars]",,en,Tropical Storm Melissa,Tropical Cyclone,eonet,,CAR,North-America
https://www.legit.ng/entertainment/nollywood/1679520-iyabo-ojo-daughter-juma-jux-rakeem-heartwarming-storm-nigeria-fans-drool/,https://www.legit.ng/entertainment/nollywood/1679520-iyabo-ojo-daughter-juma-jux-rakeem-heartwarming-storm-nigeria-fans-drool/,0,www.legit.ng,"Iyabo Ojo Gives Daughter, Juma Jux and Rakeem Heartwarming Welcome As They Storm Nigeria, Fans Drool","Iyabo Ojo has shared a video of the kind of welcome she gave her daughter, Juma Jux and their son. Traditional drummers, assorted food and drinks were provided.",https://cdn.legit.ng/images/1200x675/cb50764223854324.jpeg?v=1,2025-10-21T06:02:28Z,,"<ul><li>Iyabo Ojo has shared a video showing how she welcomed her daughter, Tanzanian husband, and son back to Nigeria</li><li>In the clip, traditional dancers and drummers were seen at the actress's… [+3577 chars]",,en,storm,Storm,random,,,
https://financialpost.com/pmn/business-pmn/erdogan-travels-to-qatar-seeking-to-buy-24-used-eurofighters,https://financialpost.com/pmn/business-pmn/erdogan-travels-to-qatar-seeking-to-buy-24-used-eurofighters,0,financialpost.com,"Erdogan Travels to Qatar, Seeking to Buy 24 Used Eurofighters",Turkish President Recep Tayyip Erdogan is set to visit Qatar this week with a request to buy 24 used Eurofighter Typhoon jets to modernize his country’s air force.,,2025-10-21T08:59:53Z,,"(Bloomberg) Turkish President Recep Tayyip Erdogan is set to visit Qatar this week with a request to buy 24 used Eurofighter Typhoon jets to modernize his countrys air force.
THIS CONTENT IS RESERVE… [+4511 chars]",,en,typhoon,Tropical Cyclone,random,,,
https://www.fox13news.com/news/tropical-storm-melissa-likely-form-caribbean-tuesday,https://www.fox13news.com/news/tropical-storm-melissa-likely-form-caribbean-tuesday,0,www.fox13news.com,Tropical Storm Melissa forms in Caribbean,"Tropical Storm Melissa, the 13th named storm of the 2025 Atlantic hurricane season, formed on Tuesday morning in the Caribbean.",https://s.yimg.com/ny/api/res/1.2/zFhTGQSn4UuAvwbpq_fDfw--/YXBwaWQ9aGlnaGxhbmRlcjt3PTEyMDA7aD02NzU7Y2Y9d2VicA--/https://media.zenfs.com/en/wtvt_fox_local_articles_521/e5596d2c555b2d689bce4ce349562d31,2025-10-21T11:11:59Z,,"The Brief
<ul><li>Tropical Storm Melissa formed on Tuesday morning.
</li><li>A hurricane watch has been issued for the southern peninsula of Haiti from the border with the Dominican Republic to Por… [+1183 chars]",,en,hurricane,Tropical Cyclone,random,,,
