index,url,valid,domain,title,description,image,published,archive,content,quote,language,term,topic,feed,country,ipcc,continent
https://www.nbcnews.com/science/tsunamis/tsunami-warning-system-loses-alaska-earthquake-stations-rcna242182,https://www.nbcnews.com/science/tsunamis/tsunami-warning-system-loses-alaska-earthquake-stations-rcna242182,0,www.nbcnews.com,"U.S. tsunami warning system, reeling from funding and staffing cuts, is dealt another blow","Nine earthquake monitoring stations in Alaska are set to go dark, leaving tsunami forecasters without important data to assess risks for the West Coast.","https://media-cldnry.s-nbcnews.com/image/upload/t_nbcnews-fp-1200-630,f_auto,q_auto:best/rockcms/2025-11/251105-tsunami-evacuation-mn-1440-14cc7f.jpg",2025-11-08T11:00:00Z,,"Nine seismic stations in Alaska are set to go dark this month, leaving tsunami forecasters without important data used to determine whether an earthquake will send a destructive wave barreling toward… [+7764 chars]",,en,Tsunami Alaska,Tsunami,usgs,Alaska,NWN,North-America
https://www.aljazeera.com/sports/2025/11/8/india-win-t20-series-against-australia-after-washout-in-fifth-match,https://www.aljazeera.com/sports/2025/11/8/india-win-t20-series-against-australia-after-washout-in-fifth-match,0,www.aljazeera.com,India win T20 series against Australia after washout in fifth match,Final T20 of the five-match series was abandoned after 4.5 overs as thunderstorm and rain forced players off the field.,https://www.aljazeera.com/wp-content/uploads/2025/11/AP25312369945146-1762602421.jpg?resize=1920%2C1440,2025-11-08T12:05:06Z,,"India have claimed a 2-1 win in the five-match T20 series against Australia after the final match was abandoned due to rain after just 4.5 overs in Brisbane.
After losing the toss and being sent in … [+1787 chars]",,en,thunderstorm,Thunderstorm,random,,,
https://ca.news.yahoo.com/punjab-floods-amid-inaction-from-indian-government-canadian-sikhs-raise-millions-to-help-rebuild-132338565.html,https://ca.news.yahoo.com/punjab-floods-amid-inaction-from-indian-government-canadian-sikhs-raise-millions-to-help-rebuild-132338565.html,0,ca.news.yahoo.com,"Punjab floods: Amid inaction from Indian government, Canadian Sikhs raise millions to help rebuild","Lawyer and journalist Jaskaran Sandhu says ""this is a natural disaster that the government has an immense role in manufacturing"" as historic flood exposes...",https://s.yimg.com/ny/api/res/1.2/ko08wJC8umsJAINz33I_Bw--/YXBwaWQ9aGlnaGxhbmRlcjt3PTEyMDA7aD04MDA7Y2Y9d2VicA--/https://s.yimg.com/os/creatr-uploaded-images/2025-11/9d0876a0-bcb7-11f0-97f5-77901f94ebfa,2025-11-08T13:23:38Z,,"This past August, Punjab, India experienced the worst flooding from monsoon rains in the area in over four decades precipitating a statewide crisis that submerged 1,400 villages in 13 districts. At l… [+9585 chars]",,en,Flood India,Flood,wmo,India,SAS,Asia
https://www.bbc.com/news/articles/cq509yj82y8o,https://www.bbc.com/news/articles/cq509yj82y8o,0,www.bbc.com,New typhoon bears down on Philippines days after deadly storm,Filipinos are bracing for the arrival of a new typhoon after one earlier this week left more than 200 people dead.,https://ichef.bbci.co.uk/news/1024/branded_news/3665/live/41b39b30-bca9-11f0-9886-b3acf9644cc5.jpg,2025-11-08T13:56:35Z,,"Dozens of families in Remedios T Romualde, on the island of Mindanao, are among those who have been evacuated ahead of the typhoon's arrival
The Philippines is bracing for the arrival of another pot… [+3604 chars]",,en,Typhoon Philippines,Tropical Cyclone,wmo,Philippines,SEA,Asia
https://phys.org/news/2025-11-tropical-cyclones-globally-people-died.html,https://phys.org/news/2025-11-tropical-cyclones-globally-people-died.html,0,phys.org,We studied 217 tropical cyclones globally to see how people died. Our findings might surprise you,"Tropical cyclones—also known as hurricanes, typhoons or storms, depending on their location and intensity—are among the world's most destructive and costly climate disasters.",https://scx2.b-cdn.net/gfx/news/hires/2022/tropical-cyclones.jpg,2025-11-08T15:20:01Z,,"Tropical cyclonesalso known as hurricanes, typhoons or storms, depending on their location and intensityare among the world's most destructive and costly climate disasters.
Their direct physical imp… [+5919 chars]",,en,tropical storm,Tropical Cyclone,random,,,
https://freerepublic.com/focus/f-news/4351480/posts,https://freerepublic.com/focus/f-news/4351480/posts,0,freerepublic.com,"Climate summit hears from countries suffering from harms, destruction linked to global warming","BELEM, Brazil (AP) — Officials from countries most vulnerable to global warming offered searing dispatches of life on the front line of a warming planet Friday, as world leaders gathered on the edge of the Amazon rainforest for the annual United Nations clima…",,2025-11-08T19:24:08Z,,"Skip to comments.
Climate summit hears from countries suffering from harms, destruction linked to global warmingThe Associated Press ^
 | November 8, 2025
 | BY ISABEL DEBRE AND MAURICIO SAVARESE… [+3086 chars]",,en,Rain Brazil,Precipitation,wmo,Brazil,SAM,South-America
https://indianexpress.com/article/trending/trending-in-india/indian-man-in-us-helps-paralysed-woman-stuck-in-rain-viral-video-10355406/,https://indianexpress.com/article/trending/trending-in-india/indian-man-in-us-helps-paralysed-woman-stuck-in-rain-viral-video-10355406/,0,indianexpress.com,"Indian man in US helps paralysed woman stuck in rain, wins hearts: ‘Be like him’","The woman, struggling with physical challenges and the weather, tells him that she wants to go to her daughter’s house.",https://images.indianexpress.com/2025/11/Indian-man-helping-US-woman.jpg,2025-11-09T11:28:49Z,,"With growing backlash against Indians living abroad for reasons like poor civic sense, public decency, and theft incidents, a heartwarming video of an Indian man helping a paralysed woman in the Unit… [+1412 chars]",,en,Rain India,Precipitation,wmo,India,SAS,Asia
https://financialpost.com/pmn/business-pmn/snow-set-to-wallop-chicago-as-cold-blast-aims-for-east-coast,https://financialpost.com/pmn/business-pmn/snow-set-to-wallop-chicago-as-cold-blast-aims-for-east-coast,0,financialpost.com,Snow Set to Wallop Chicago as Cold Blast Aims for East Coast,"Heavy snow will drop on Chicago late Sunday into Monday’s commute, further snarling air travel already disrupted by the US government shutdown and ushering in a cold blast that will bring near-freezing temperatures to New York City and as deep as Florida and …",,2025-11-09T15:05:54Z,,"(Bloomberg) Heavy snow will drop on Chicago late Sunday into Mondays commute, further snarling air travel already disrupted by the US government shutdown and ushering in a cold blast that will bring … [+4412 chars]",,en,Freezing Mo He City,Snow&Ice,wmo,China,EAS,Asia
https://www.irishtimes.com/environment/2025/11/09/weather-ireland-heavy-rain-forecast-for-next-week-as-met-eireann-issues-warning/,https://www.irishtimes.com/environment/2025/11/09/weather-ireland-heavy-rain-forecast-for-next-week-as-met-eireann-issues-warning/,0,www.irishtimes.com,Weather Ireland: Heavy rain forecast for next week as Met Éireann issues warning,Status yellow rain warning issued from Monday night until Tuesday midday,https://www.irishtimes.com/resizer/v2/GDQDYHHWL5DGLF6QJMGYOEOKOM.JPG?smart=true&auth=68a189637599d660182803776cb7b5560d64ef9b470aad37cf9dba55d29ef6f1&width=1200&height=630,2025-11-09T15:38:53Z,,"There will be heavy rain and localised flooding in many parts of the country next week as conditions turn wet and blustery, particularly in the South.
While most of the country saw mild and bright c… [+1344 chars]",,en,Rain Ning er,Precipitation,wmo,China,EAS,Asia
https://www.cbc.ca/news/canada/british-columbia/wind-rain-warning-environment-canada-9.6972707,https://www.cbc.ca/news/canada/british-columbia/wind-rain-warning-environment-canada-9.6972707,0,www.cbc.ca,"Strong wind and rain warnings in place for Haida Gwaii, B.C. North Coast and north Vancouver Island","Environment Canada has issued wind and rainfall warnings for parts of B.C.’s north and central coast, with forecasters warning of damaging gusts and heavy downpours through Sunday.","https://i.cbc.ca/ais/ddd4d17a-8d44-4b59-b4e0-c0b03ced7c1d,1761246038045/full/max/0/default.jpg?im=Crop%2Crect%3D%280%2C172%2C3300%2C1856%29%3BResize%3D620",2025-11-09T16:36:20Z,,"Environment Canada has issued wind and rainfall warnings for parts of B.C.s north and central coast, with forecasters warning of damaging gusts and heavy downpours through Sunday.
The strongest wind… [+1640 chars]",,en,Downpour Canada,Precipitation,wmo,Canada,NEN,North-America
https://timesofindia.indiatimes.com/city/ranchi/cold-wave-conditions-expected-in-six-districts-of-ranchi-imd-issues-yellow-alert/articleshow/125207240.cms,https://timesofindia.indiatimes.com/city/ranchi/cold-wave-conditions-expected-in-six-districts-of-ranchi-imd-issues-yellow-alert/articleshow/125207240.cms,0,timesofindia.indiatimes.com,"Cold Wave Conditions Expected in Six Districts of Ranchi, IMD Issues Yellow Alert","The IMD has predicted cold wave conditions in isolated pockets of north-western Jharkhand on Monday and Tuesday, issuing a yellow alert for six districts. Minimum temperatures are expected to drop by 2-3 degrees Celsius, falling below 10 degrees Celsius due t…","https://static.toiimg.com/thumb/msid-125207240,width-1070,height-580,imgsize-null,resizemode-75,overlay-toi_sw,pt-32,y_pad-40/photo.jpg",2025-11-09T18:47:48Z,,"<ul><li>News</li>
<li>Cold Wave Conditions Expected in Six Districts of Ranchi, IMD Issues Yellow Alert</li></ul>
The IMD has predicted cold wave conditions in isolated pockets of north-western Jha… [+3410 chars]",,en,cold wave,Cold Wave,random,,,
https://financialpost.com/pmn/first-snowfall-of-season-hits-southern-ontario-and-quebec,https://financialpost.com/pmn/first-snowfall-of-season-hits-southern-ontario-and-quebec,0,financialpost.com,First snowfall of season hits southern Ontario and Quebec,"TORONTO — Several parts of southern Ontario and Quebec saw their first snowfall of the season and special weather statements from Environment Canada on Sunday. The federal weather agency issued special weather statements from London, Ont., in the province’s s…",,2025-11-10T01:20:49Z,,"TORONTO Several parts of southern Ontario and Quebec saw their first snowfall of the season and special weather statements from Environment Canada on Sunday.
THIS CONTENT IS RESERVED FOR SUBSCRIBERS… [+4229 chars]",,en,Snow Canada,Snow&Ice,wmo,Canada,NEN,North-America
https://nypost.com/2025/11/09/us-news/nyc-long-island-to-start-week-under-freeze-watch-as-temperatures-set-to-plummet-during-polar-vortex/,https://nypost.com/2025/11/09/us-news/nyc-long-island-to-start-week-under-freeze-watch-as-temperatures-set-to-plummet-during-polar-vortex/,0,nypost.com,"NYC, Long Island to start week under freeze watch as temperatures set to plummet during polar vortex","Big Apple residents should dress warmly, cover up exposed skin, and take extra care while walking, biking, or driving due to slick conditions.",https://nypost.com/wp-content/uploads/sites/2/2025/11/freeze-comp-1.jpg?quality=75&strip=all&w=1200,2025-11-10T03:45:35Z,,"Bundle up!
Forecasters have placed New York City, Long Island, and parts of New Jersey under a freeze watch as unseasonably bone-chilling temperatures are expected to blanket the East Coast early th… [+2577 chars]",,en,temperature plummet,Cold Wave,random,,,
https://thehockeynews.com/nhl/vancouver-canucks/game-day/canucks-tie-game-late-but-fall-5-4-in-overtime-to-the-avalanche,https://thehockeynews.com/nhl/vancouver-canucks/game-day/canucks-tie-game-late-but-fall-5-4-in-overtime-to-the-avalanche,0,thehockeynews.com,Canucks Tie Game Late But Fall 5-4 In Overtime To The Avalanche,The Vancouver Canucks fell 5-4 in overtime to the Colorado Avalanche.,https://deweb-519a7.b-cdn.net/post-images/3c2f9253-f92f-489c-9f87-cd65c9f8e647.jpeg,2025-11-10T06:19:23Z,,"The Vancouver Canucks fought hard but came up just short as they fell 5-4 in overtime to the Colorado Avalanche. Linus Karlsson, Kiefer Sherwood, and Drew O'Connor scored while Jake DeBrusk tied the … [+4564 chars]",,en,avalanche,Snow&Ice,random,,,
https://www.independent.ie/weather/met-eireann-extends-rain-warning-to-seven-counties-as-overnight-temperatures-to-drop-to-1c/a180530057.html,https://www.independent.ie/weather/met-eireann-extends-rain-warning-to-seven-counties-as-overnight-temperatures-to-drop-to-1c/a180530057.html,0,www.independent.ie,"Met Éireann extends rain warning to seven counties, as overnight temperatures to drop to 1C",Met Éireann has issued a Status Yellow rain warning for seven counties tomorrow.,https://focus.independent.ie/thumbor/ybxgwsfh9YAQfPTNc_T4niU_EdQ=/0x1:3234x2157/629x0/prod-mh-ireland/db63c10a-75db-4c44-b185-6e5a4ffbc5a4/1c87e978-13f3-4431-a07e-72abf6c6c397/db63c10a-75db-4c44-b185-6e5a4ffbc5a4.jpg,2025-11-10T08:33:41Z,,"Status Yellow rain warning for Cork, Kerry, Waterford, Wexford, Carlow, Kilkenny and Wicklow tomorrowWarning in place overnight from midnight, further extended until 6pm tomorrowMet Éireann has issue… [+1852 chars]",,en,Rain Ning er,Precipitation,wmo,China,EAS,Asia
https://www.irishtimes.com/ireland/2025/11/10/status-yellow-warning-issued-as-heavy-rain-forecast-for-many-areas/,https://www.irishtimes.com/ireland/2025/11/10/status-yellow-warning-issued-as-heavy-rain-forecast-for-many-areas/,0,www.irishtimes.com,Status yellow warning issued as heavy rain forecast for many areas,Met Éireann warns of possible flooding in seven counties,https://www.irishtimes.com/resizer/v2/GDXZZGP3ONHTLOMVN3N567VPQQ.jpg?smart=true&auth=3cfc9c529116ced4361ebabd237794b2b9b88b619dd412852d6a858f15fe831e&width=1200&height=630,2025-11-10T11:43:27Z,,"Met Éireann has issued a status yellow rain warning for seven counties from Tuesday.
The warning is set to come into effect from 12am to 6pm in Carlow, Kilkenny, Wexford, Wicklow, Cork, Kerry and Wa… [+1551 chars]",,en,heavy rain,Precipitation,random,,,
https://www.nbcnews.com/news/us-news/shutdown-deal-arctic-blast-storm-season-morning-rundown-rcna242952,https://www.nbcnews.com/news/us-news/shutdown-deal-arctic-blast-storm-season-morning-rundown-rcna242952,0,www.nbcnews.com,Shutdown deal in sight and Arctic blast kicks off storm season: Morning Rundown,An end to the shutdown is in sight after Senators clear a key vote for a deal. An Arctic blast dumps snow on the Midwest. And recapping Chargers vs. Steelers.,"https://media-cldnry.s-nbcnews.com/image/upload/t_nbcnews-fp-1200-630,f_auto,q_auto:best/rockcms/2025-11/251104-government-shutdown-capitol-lr-6cef1e.jpg",2025-11-10T12:16:18Z,,In todays newsletter: An end to the shutdown could be in sight after senators clear a key vote for a deal. An Arctic blast leaves more than 105 million Americans under winter weather bulletins. And t… [+7077 chars],,en,storm,Storm,random,,,
https://economictimes.indiatimes.com/news/india/first-cold-wave-hits-delhi-as-temperatures-drop-to-99c/articleshow/125227333.cms,https://economictimes.indiatimes.com/news/india/first-cold-wave-hits-delhi-as-temperatures-drop-to-99c/articleshow/125227333.cms,0,economictimes.indiatimes.com,Mercury dips to 9.9 deg Celsius in Delhi; start of cold wave,"Delhi experienced its first cold wave of the season as temperatures dropped significantly, with Aya Nagar recording 9.9 degrees Celsius. The India Meteorological Department predicts these cold wave conditions will persist in isolated areas until November 12. …","https://img.etimg.com/thumb/msid-125227372,width-1200,height-630,imgsize-1417749,overlay-economictimes/articleshow.jpg",2025-11-10T14:58:53Z,,"New Delhi: Delhi recorded its first cold wave of the season on Monday, with temperatures plunging to 9.9 degrees Celsius at the Aya Nagar station.The weather department has predicted that cold wave c… [+1480 chars]",,en,Cold Wave India,Cold Wave,wmo,India,SAS,Asia
http://foreignpolicy.com/2025/11/10/extreme-weather-southeast-asia-typhoon-philippines/,http://foreignpolicy.com/2025/11/10/extreme-weather-southeast-asia-typhoon-philippines/,0,foreignpolicy.com,Why Extreme Weather Hits Southeast Asia So Hard,The Philippines has been battered by back-to-back typhoons.,https://foreignpolicy.com/wp-content/uploads/2025/11/typhoon-philippines-GettyImages-2245244178.jpg?w=1000,2025-11-10T21:30:05Z,,"Welcome to Foreign Policys Southeast Asia Brief.
The highlights this week: Back-to-back typhoons once again batter the region, an Indonesian school is attacked, a controversial rapper is caught up i… [+10673 chars]",,en,typhoon,Tropical Cyclone,random,,,
https://www.bbc.com/news/articles/c3rjyxv9472o,https://www.bbc.com/news/articles/c3rjyxv9472o,0,www.bbc.com,Six dead after second typhoon in a week hits the Philippines,Fung-wong was the 21st typhoon to hit the South East Asian nation this year.,https://ichef.bbci.co.uk/news/1024/branded_news/5f75/live/7df53250-beb3-11f0-8456-eff94716b162.jpg,2025-11-11T04:05:40Z,,"At least six people have died after a super typhoon barrelled through the Philippines, mere days after an earlier storm left more than 200 people dead.
Super typhoon Fung-wong brought floods and lan… [+2340 chars]",,en,typhoon,Tropical Cyclone,random,,,
https://www.digitaljournal.com/world/philippines-digs-out-from-typhoon-fung-wong-as-death-toll-climbs-to-18/article,https://www.digitaljournal.com/world/philippines-digs-out-from-typhoon-fung-wong-as-death-toll-climbs-to-18/article,0,www.digitaljournal.com,Philippines digs out from Typhoon Fung-wong as death toll climbs to 18,"Rescuers using backhoes and chainsaws began digging the Philippines out from the devastation of Typhoon Fung-wong on Tuesday, as floodwaters receded in hundreds of villages and the storm’s death toll climbed to 18. Fung-wong, which displaced 1.4 million peopl…",https://www.digitaljournal.com/wp-content/uploads/2025/11/c92e3ba4a29ee7c5ebc4964206a548181d67f36b.jpg,2025-11-11T04:57:20Z,,"A road under construction in Cagayan province's Tuguegarao City is surrounded by floodwaters after Typhoon Fung-wong slammed into the Philippines this week - Copyright AFP John Dimain
Rescuers using… [+4086 chars]",,en,typhoon,Tropical Cyclone,random,,,
https://www.thejournal.ie/philippines-super-typhoon-death-toll-6870587-Nov2025/,https://www.thejournal.ie/philippines-super-typhoon-death-toll-6870587-Nov2025/,0,www.thejournal.ie,Death toll Rescue efforts underway after super typhoon Fung-wong kills 18 in Philippines,Rescuers are struggling to reach cut-off towns as landslides and floods have left widespread devastation across northern provinces.,https://img2.thejournal.ie/article/6870587/river/?height=400&version=6870588,2025-11-11T06:49:18Z,,"RESCUERS USING BACKHOES and chainsaws have begun digging the Philippines out from the devastation of Typhoon Fung-wong today, as floodwaters receded in hundreds of villages and the storms death toll … [+3952 chars]",,en,Typhoon Philippines,Tropical Cyclone,wmo,Philippines,SEA,Asia
https://www.aljazeera.com/news/2025/11/11/typhoon-fung-wong-leaves-philippines-with-10-dead-1-4-million-displaced,https://www.aljazeera.com/news/2025/11/11/typhoon-fung-wong-leaves-philippines-with-10-dead-1-4-million-displaced,0,www.aljazeera.com,"Typhoon Fung-wong leaves Philippines with 10 dead, 1.4 million displaced",The super typhoon has left devastation in the Philippines just days after another typhoon killed 232 people.,https://www.aljazeera.com/wp-content/uploads/2025/11/ap_6912b9419d7d3-1762834753.jpg?resize=1920%2C1440,2025-11-11T06:50:12Z,,"Typhoon Fung-wong has moved away from the northwestern Philippines after carving out a trail of devastation, leaving at least 10 people dead and 1.4 million displaced.
Known in the Philippines as Su… [+3274 chars]",,en,typhoon,Tropical Cyclone,random,,,
https://timesofindia.indiatimes.com/education/news/delhi-air-quality-worsens-will-schools-shift-to-hybrid-under-grap-stage-iii/articleshow/125243470.cms,https://timesofindia.indiatimes.com/education/news/delhi-air-quality-worsens-will-schools-shift-to-hybrid-under-grap-stage-iii/articleshow/125243470.cms,0,timesofindia.indiatimes.com,Delhi air quality worsens: Will schools shift to hybrid under GRAP Stage III?,"Delhi’s air quality has plunged into the ‘severe’ category, prompting authorities to enforce Stage III of the Graded Response Action Plan (GRAP) as the AQI jumped from 362 to 425. Calm winds and cold weather trapped pollutants, affecting residents’ health. Un…","https://static.toiimg.com/thumb/msid-125243446,width-1070,height-580,imgsize-5792,resizemode-75,overlay-toi_sw,pt-32,y_pad-40/photo.jpg",2025-11-11T07:31:25Z,,"<ul><li>News</li>
<li>Delhi air quality worsens: Will schools shift to hybrid under GRAP Stage III?</li></ul>
Delhis air quality has plunged into the severe category, prompting authorities to enfor… [+3625 chars]",,en,severe weather,Thunderstorm,random,,,
https://www.nbcnews.com/world/asia/storm-approaches-taiwan-causing-18-deaths-destruction-philippines-rcna243158,https://www.nbcnews.com/world/asia/storm-approaches-taiwan-causing-18-deaths-destruction-philippines-rcna243158,0,www.nbcnews.com,Storm approaches Taiwan after causing 18 deaths and destruction in the Philippines,"Typhoon Fung-wong blew out of the northwestern Philippines on Monday after causing floods, landslides, power outages and at least 18 deaths.","https://media-cldnry.s-nbcnews.com/image/upload/t_nbcnews-fp-1200-630,f_auto,q_auto:best/rockcms/2025-11/251111-Philippines-3-rs-c61cd7.jpg",2025-11-11T07:42:11Z,,"MANILA, Philippines Typhoon Fung-wong blew out of the northwestern Philippines on Monday after causing floods, landslides, power outages and at least 18 deaths.
The typhoon weakened into a tropical … [+3193 chars]",,en,typhoon,Tropical Cyclone,random,,,
https://www.thestar.com.my/news/nation/2025/11/11/metmalaysia-issues-advisory-on-tropical-storm-fung-wong,https://www.thestar.com.my/news/nation/2025/11/11/metmalaysia-issues-advisory-on-tropical-storm-fung-wong,0,www.thestar.com.my,MetMalaysia issues advisory on tropical storm Fung Wong,"KOTA KINABALU: The Malaysian Meteorological Department (MetMalaysia) has issued an advisory regarding the severe tropical storm Fung Wong, detected at 8am at latitude 19.8°N and longitude 117.9°E, approximately 335km northwest of Laoag City, Philippines. Read…",https://apicms.thestar.com.my/uploads/images/2025/11/11/3616696.jpg,2025-11-11T07:53:00Z,,"KOTA KINABALU: The Malaysian Meteorological Department (MetMalaysia) has issued an advisory regarding the severe tropical storm Fung Wong, detected at 8am at latitude 19.8°N and longitude 117.9°E, ap… [+537 chars]",,en,tropical storm,Tropical Cyclone,random,,,
https://abcnews.go.com/International/wireStory/taiwan-evacuates-thousands-ahead-tropical-storm-fung-wong-127405338,https://abcnews.go.com/International/wireStory/taiwan-evacuates-thousands-ahead-tropical-storm-fung-wong-127405338,0,abcnews.go.com,Taiwan evacuates thousands ahead of tropical storm after deaths in the Philippines,"Taiwan has evacuated more than 3,000 people and closed schools and offices ahead of tropical storm Fung-wong",https://i.abcnewsfe.com/a/bf781c95-ad65-4058-9aaa-979772e4a7c8/wirestory_9e1e11220779b25af27b7c8e2d24a3d5_16x9.jpg?w=1600,2025-11-11T08:13:55Z,,"TAIPEI, Taiwan -- Taiwan evacuated more than 3,000 people from vulnerable areas and closed schools and offices on Tuesday ahead of the arrival of tropical storm Fung-wong, which killed at least 18 pe… [+2176 chars]",,en,Tropical Storm Fung Wong,Tropical Cyclone,eonet,,NPO,Pacific Ocean
https://www.aljazeera.com/video/quotable/2025/11/11/typhoon-fung-wong-a-devastating-blow-to-the-philippines,https://www.aljazeera.com/video/quotable/2025/11/11/typhoon-fung-wong-a-devastating-blow-to-the-philippines,0,www.aljazeera.com,Typhoon Fung-wong a “devastating blow” to the Philippines,"&quot;It&#039;s not just infrastructure that&#039;s been hit, it&#039;s really the people&#039;s ability to recover and rebuild their lives.&quot;",https://www.aljazeera.com/wp-content/uploads/2025/11/HORIZONTAL-THUMB-1762867043.png?resize=1920%2C1080&quality=80,2025-11-11T13:23:07Z,,"Quotable
Read moreJessilou Morigo-Tanguilan of Plan International Philippines explains how Typhoon Fung-wong has affected millions of people in the Philippines, leaving behind a path of destruction.",,en,typhoon,Tropical Cyclone,random,,,
https://biztoc.com/x/c34caaafd5c47509,https://biztoc.com/x/c34caaafd5c47509,0,biztoc.com,"As Typhoons Lash Southeast Asia, COP30 Hunts Adaptation Finance","Just days after the Philippines battled Typhoon Kalmaegi — a storm that killed 224 people and destroyed homes and livelihoods of thousands of others — the country braced for yet another super storm on Sunday.
And as it made landfall, Super Typhoon Fung-Wong d…",https://biztoc.com/cdn/950/og.png,2025-11-11T15:49:52Z,,Just days after the Philippines battled Typhoon Kalmaegi a storm that killed 224 people and destroyed homes and livelihoods of thousands of others the country braced for yet another super storm on Su… [+146 chars],,en,typhoon,Tropical Cyclone,random,,,
