index,url,valid,domain,title,description,image,published,archive,content,quote,language,term,topic,feed,country,ipcc,continent
https://www.channelnewsasia.com/east-asia/china-storms-dead-hubei-guangxi-typhoon-bavi-6236716,https://www.channelnewsasia.com/east-asia/china-storms-dead-hubei-guangxi-typhoon-bavi-6236716,0,www.channelnewsasia.com,Storms kill at least eight in central China as Typhoon Bavi looms offshore,"BEIJING: At least eight people were killed after thunderstorms battered central China's Hubei Province, state media said on Tuesday (Jul 7), as forecasters warned of more torrential rain across various pa","https://dam.mediacorp.sg/image/upload/s--DOnELQcX--/c_crop,h_900,w_1600,x_0,y_15/c_fill,g_auto,h_676,w_1200/fl_relative,g_south_east,l_mediacorp:cna:watermark:2024-04:reuters_1,w_0.1/f_auto,q_auto/v1/mediacorp/cna/image/2026/07/01/2026-06-08t083940z_683439900_rc2gplaikhda_rtrmadp_3_northkorea-china.jpg?itok=UGyGsAKd",2026-07-07T01:27:33Z,,"BEIJING: At least eight people were killed after thunderstorms battered central China's Hubei Province, state media said on Tuesday (Jul 7), as forecasters warned of more torrential rain across vario… [+1264 chars]",,en,Typhoon China,Tropical Cyclone,wmo,China,EAS,Asia
https://www.cnet.com/home/energy-and-utilities/summer-thermostat-temperature-political-debate-department-energy-pages-disappear/,https://www.cnet.com/home/energy-and-utilities/summer-thermostat-temperature-political-debate-department-energy-pages-disappear/,0,www.cnet.com,Even Your Summer Thermostat Temperature Has Become a Political Debate,The White House appears to have removed the Department of Energy's consumer guidance on indoor temperatures during the hottest days.,https://www.cnet.com/a/img/resize/9bc358d35e96bb83bd1e3b645921c54d465977d9/hub/2026/07/07/19284e93-56a0-42a5-955c-c28b9847c3e5/gettyimages-2283753833.jpg?auto=webp&fit=crop&height=675&width=1200,2026-07-07T01:30:35Z,,"How hot is it?
So hot, amid a record-breaking heatwave, that even talking about the temperature on your thermostat is making people angry. And, apparently, making the Department of Energy website pa… [+4174 chars]",,en,hottest summer,Heat Wave,random,,,
https://economictimes.indiatimes.com/news/international/world-news/storms-kill-at-least-8-in-china-as-typhoon-bavi-looms-offshore/articleshow/132228177.cms,https://economictimes.indiatimes.com/news/international/world-news/storms-kill-at-least-8-in-china-as-typhoon-bavi-looms-offshore/articleshow/132228177.cms,0,economictimes.indiatimes.com,Storms kill at least 8 in China as Typhoon Bavi looms offshore,"Severe thunderstorms and high winds have killed at least eight people in China's Hubei Province. Forecasters are warning of more torrential rain and tornadoes across several other regions. Extremely heavy rainfall is expected in Guangxi, Jiangsu, and Shandong…","https://img.etimg.com/thumb/msid-132228451,width-1200,height-630,imgsize-183678,overlay-economictimes/articleshow.jpg",2026-07-07T01:58:52Z,,"Beijing: At least eight people were killed after thunderstorms battered central China's Hubei Province, state media said on Tuesday, as forecasters warned of more torrential rain across various parts… [+1267 chars]",,en,Torrential Rain Ning er,Precipitation,wmo,China,EAS,Asia
https://www.archdaily.com/1042916/architecture-in-the-andes-how-altitude-shapes-design-decisions,https://www.archdaily.com/1042916/architecture-in-the-andes-how-altitude-shapes-design-decisions,0,www.archdaily.com,Architecture in the Andes: How Altitude Shapes Design Decisions,"The Andes are often understood as a continuous mountain range, yet they encompass a wide range of climates and ecosystems. In Ecuador, Peru, Bolivia, Colombia, and Chile, páramos, dry highlands, temperate valleys, and snow-covered landscapes can exist within …",https://images.adsttc.com/media/images/6a44/4fe1/8481/2b01/8af5/1a96/large_jpg/architecture-in-the-andes-how-altitude-shapes-design-decisions_2.jpg?1782861803,2026-07-07T07:30:00Z,,"Rumilahua House / Luis Lopez Lopez y Emilio Lopez Herrera. Image © Sebastian Crespo
The Andes are often understood as a continuous mountain range, yet they encompass a wide range of climates and eco… [+818 chars]",,en,Snow Chile,Snow&Ice,wmo,Chile,SWS,South-America
https://www.yahoo.com/news/articles/storms-kill-least-eight-central-010932330.html,https://www.yahoo.com/news/articles/storms-kill-least-eight-central-010932330.html,0,www.yahoo.com,Tornadoes wreak havoc across central China as Typhoon Bavi looms offshore,"By Joe Cash BEIJING, July 7 (Reuters) - Two tornadoes wrought devastation in central China's Hubei province, killing at least 11 people, as winds of up to 14...",https://s.yimg.com/lo/mysterio/api/4d9532e0e539cb220b2ebc8ecabfd1aaa063bf3352aed3a712aaec8eb9821dec/lightyear_networkapi/resizefill_w800_h450;quality_80;format_webp/https:%2F%2Fmedia.zenfs.com%2Fen%2Freuters.com%2F60e7f30504d24ff5306133251c7d8955,2026-07-07T07:30:58Z,,"By Joe Cash
BEIJING, July 7 (Reuters) - Two tornadoes wrought devastation in central China's Hubei province, killing at least 11 people, as winds of up to 149 kph (93 mph) overturned cars and ripped… [+3271 chars]",,en,Typhoon China,Tropical Cyclone,wmo,China,EAS,Asia
https://www.nakedcapitalism.com/2026/07/links-7-7-2026.html,https://www.nakedcapitalism.com/2026/07/links-7-7-2026.html,0,www.nakedcapitalism.com,Links 7/7/2026,"Our blue dailly links: shop cats, moar extreme weather, NATO freakout as Russia pounds Ukraine, EU LNG shortage? Germany v. AfD, India typhoid, Cuba grid fail, EU digitgal passport, JD Vance Trump diss, AI debt worries, BNPL as crisis trigger? Saylor sells Bi…",https://www.nakedcapitalism.com/wp-content/uploads/2026/07/Screenshot-2026-07-07-at-1.13.50 PM.png,2026-07-07T10:59:47Z,,"Through the Eyes of Shop Cats Sixth Tone (guurst)
I Thought This Was a Literary Myth Until I Checked Classical Literature (Micael T)
Sciencing With a Primate Brain: Reflections on the Nature of Sci… [+11355 chars]",,en,Rain Russia,Precipitation,wmo,Russia,ESB,Europe
https://timesofindia.indiatimes.com/city/mysuru/heavy-downpour-leaves-trail-of-damage/articleshow/132240902.cms,https://timesofindia.indiatimes.com/city/mysuru/heavy-downpour-leaves-trail-of-damage/articleshow/132240902.cms,0,timesofindia.indiatimes.com,Heavy downpour leaves trail of damage,"Heavy rain disrupts life in Chikkamagaluru and Hassan’s Malnad; landslides, house damage and rising rivers reported, schools closed, helplines issued.","https://static.toiimg.com/thumb/msid-132240901,width-1280,height-720,resizemode-6,overlay-toi_sw,pt-32,y_pad-600/photo.jpg",2026-07-07T13:14:59Z,,"<ul><li>News</li>
<li>Heavy downpour leaves trail of damage</li></ul>
Follow Us On Social Media
Shilpa Shinde says Bhabiji producer 'begged' her return, targets Akanksha on Lock Upp 2AB de Villier… [+2933 chars]",,en,landslide,Landslide,random,,,
https://gothamist.com/news/nycs-lifeline-energy-source-has-gone-down-twice-so-far-this-month,https://gothamist.com/news/nycs-lifeline-energy-source-has-gone-down-twice-so-far-this-month,0,gothamist.com,NYC's 'lifeline' energy source has gone down twice so far this month,"A woman carries a box fan in midtown Manhattan during a heatwave in New York on July 3,
 

Amid a heat wave, New York City’s $6 billion power lines are offline for a second time since full operation at the beginning of this month. [ more › ]",https://api-prod.gothamist.com/images/358024/fill-1200x650|format-webp|webpquality-85/,2026-07-07T20:44:40Z,,"New York's multibillion-dollar power line from Canada, which was supposed to be up and running this month, has already melted down twice in the first days of July.
The $6 billion project is supposed… [+2960 chars]",,en,heat,Heat Wave,random,,,
https://economictimes.indiatimes.com/news/international/world-news/earthquake-of-magnitude-5-0-strikes-china/articleshow/132251831.cms,https://economictimes.indiatimes.com/news/international/world-news/earthquake-of-magnitude-5-0-strikes-china/articleshow/132251831.cms,0,economictimes.indiatimes.com,"Earthquake of magnitude 5.0 strikes China, emergency response underway",China earthquake: A magnitude 5.0 earthquake struck China's Sichuan region shortly after a landslide. Rescue operations concluded after 33 people were buried in Gansu province. State media reported that the death toll from the landslide rose to 21. All trappe…,"https://img.etimg.com/thumb/msid-132251865,width-1200,height-630,imgsize-23330,overlay-economictimes/articleshow.jpg",2026-07-08T02:23:11Z,,"An earthquake of magnitude 5.0 struck the Sichuan Province in Southwest China, Reuters reported, citing GFZ. The tremors have left two people with minor injuries, according to Global Times.The epicen… [+988 chars]",,en,Landslide China,Landslide,wmo,China,EAS,Asia
https://peoplesreview.com.np/2026/07/08/messis-argentina-makes-great-escape-as-egypt-cries-foul-over-controversial-refereeing/,https://peoplesreview.com.np/2026/07/08/messis-argentina-makes-great-escape-as-egypt-cries-foul-over-controversial-refereeing/,0,peoplesreview.com.np,Messi’s Argentina makes great escape as Egypt cries foul over controversial refereeing,"New Jersey, July 8: Defending champions Argentina survived a major scare and a storm of refereeing controversy to edge Egypt 3,2 in a dramatic FIFA World Cup Round of 16 clash, while Switzerland beat Colombia on penalties to set up a quarter-final showdown wi…",https://peoplesreview.com.np/wp-content/uploads/2026/07/sco.jpg,2026-07-08T02:35:00Z,,"New Jersey, July 8: Defending champions Argentina survived a major scare and a storm of refereeing controversy to edge Egypt 3,2 in a dramatic FIFA World Cup Round of 16 clash, while Switzerland beat… [+4149 chars]",,en,Storm Switzerland,Storm,wmo,Switzerland,WCE,Europe
https://punchng.com/fg-condoles-china-over-gansu-landslide/,https://punchng.com/fg-condoles-china-over-gansu-landslide/,0,punchng.com,FG condoles China over Gansu landslide,"Nigeria’s Federal Government expresses deep condolences to China following the devastating Gansu landslide, which claimed at least 21 lives. Read more.

Read More: https://punchng.com/fg-condoles-china-over-gansu-landslide/",https://punchng.com/wp-content/uploads/2026/06/Minister.webp,2026-07-08T17:52:12Z,,"The Federal Government has expressed sympathy to the Government and people of China following the devastating landslide that struck Tanchang County in Gansu Province, killing at least 21 people.
In … [+1858 chars]",,en,Landslide China,Landslide,wmo,China,EAS,Asia
https://www.aljazeera.com/news/2026/7/10/philippines-landslides-kill-15-as-typhoon-bavi-threatens-region,https://www.aljazeera.com/news/2026/7/10/philippines-landslides-kill-15-as-typhoon-bavi-threatens-region,0,www.aljazeera.com,Philippines landslides kill 15 as Typhoon Bavi threatens region,Typhoon Bavi is intensifying seasonal monsoon rains across the region as it moves towards Taiwan and China.,https://www.aljazeera.com/wp-content/uploads/2026/07/afp_6a4a7e69900b-1783266921.jpg?resize=1920%2C1440,2026-07-10T12:49:14Z,,"More than a dozen people have been killed in landslides in the Philippines as Typhoon Bavi bears down on the region.
A landslide early on Friday killed 10 people as it hit Malapatan in the southern … [+1783 chars]",,en,landslide,Landslide,random,,,
https://www.theatlantic.com/photography/2026/07/photos-of-the-week-rabbit-beach-puffin-census-wild-horses/687855/,https://www.theatlantic.com/photography/2026/07/photos-of-the-week-rabbit-beach-puffin-census-wild-horses/687855/,0,www.theatlantic.com,"Photos of the Week: Rabbit Beach, Puffin Census, Wild Horses","An electronic-music festival in Germany, World Cup watch parties around the world, the running of the bulls in Spain, cave exploration in China, a heat wave in southern Europe, and much more",https://cdn.theatlantic.com/thumbor/ptwwxGIkRuQbllKvrZv6oOzH3f8=/8x848:5998x3968/1200x625/media/img/mt/2026/07/a01_UP1EM7706SPBL/original.jpg,2026-07-10T13:00:00Z,,"Mike Blake / Reuters
Marseel Bahnan, originally from Iraq, poses with her face painted in the colors of the U.S. flag during a World Cup watch party in San Diego, California, as the United States pl… [+5590 chars]",,en,Heat Wave Germany,Heat Wave,wmo,Germany,WCE,Europe
https://www.bbc.com/news/articles/c892kj08qezo?xtor=AL-72-%5Bpartner%5D-%5Byahoo.north.america%5D-%5Bheadline%5D-%5Bnews%5D-%5Bbizdev%5D-%5Bisapi%5D,https://www.bbc.com/news/articles/c892kj08qezo?xtor=AL-72-%5Bpartner%5D-%5Byahoo.north.america%5D-%5Bheadline%5D-%5Bnews%5D-%5Bbizdev%5D-%5Bisapi%5D,0,www.bbc.com,How can Jersey adapt to a changing climate?,"This year has already had three heatwaves and record temperatures, with warnings of more to come.",https://s.yimg.com/lo/mysterio/api/b5617baa385f3ac583d721fd005d82ffea83fe326efe3c1f349af35c2141ae6a/lightyear_networkapi/resizefill_w1000_h563;quality_80;format_webp/https:%2F%2Fmedia.zenfs.com%2Fen%2Fbbc_us_articles_995%2F59cabd5c09625a659c8c5db0b39d5663,2026-07-11T07:05:48Z,,"Before July and August, traditionally Jersey's two hottest months, had started, the island had already experienced a pair of heatwaves and record temperatures.
Climate change caused by humans has ma… [+6976 chars]",,en,heat wave,Heat Wave,random,,,
https://www.dw.com/en/typhoon-bavi-china-taiwan-and-japan-face-disruption-after-17-killed-in-philippines/a-77914270,https://www.dw.com/en/typhoon-bavi-china-taiwan-and-japan-face-disruption-after-17-killed-in-philippines/a-77914270,0,www.dw.com,"Typhoon Bavi: China, Taiwan and Japan face disruption after 17 killed in Philippines","Bavi has forced hundreds of thousands to evacuate in China, knocked out power in Japan and Taiwan and triggered deadly landslides in the Philippines.",https://static.dw.com/image/77918139_6.jpg,2026-07-11T08:21:00Z,,"Typhoon Bavi made landfall in China's eastern province of Zhejiang late Saturday night, state media reported.
Over 1.7 million people had been evacuated as the country braced for Bavi, which is expe… [+2402 chars]",,en,Landslide China,Landslide,wmo,China,EAS,Asia
https://www.dw.com/en/typhoon-bavi-taiwan-japan-and-china-face-disruption-after-17-killed-in-philippines/a-77914270,https://www.dw.com/en/typhoon-bavi-taiwan-japan-and-china-face-disruption-after-17-killed-in-philippines/a-77914270,0,www.dw.com,"Typhoon Bavi: Taiwan, Japan and China face disruption after 17 killed in Philippines","The storm has triggered deadly landslides in the Philippines, knocked out power in Japan and Taiwan, and forced hundreds of thousands to evacuate in China ahead of its expected landfall.",https://static.dw.com/image/77914162_6.jpg,2026-07-11T08:21:00Z,,"Typhoon Bavi caused severe disruption across East Asia on Saturday, as it battered Japan's southern islands with heavy rain and strong winds, and brought life in Taiwan to a near standstill.
Bavi ca… [+3263 chars]",,en,Landslide China,Landslide,wmo,China,EAS,Asia
https://www.nakedcapitalism.com/2026/07/links-7-11-2026.html,https://www.nakedcapitalism.com/2026/07/links-7-11-2026.html,0,www.nakedcapitalism.com,Links 7/11/2026,"Today's therapeutic daily links: Is booze over? heat waves, new US deadline for Iran, Japan bond worries, China strategic use of rare eartihs ban, German car jobs collapse, US pressure on Israel? spying cars, ICE killing, inflation, AI to produce tech depress…",https://www.nakedcapitalism.com/wp-content/uploads/2026/07/Screenshot-2026-07-11-at-4.41.50 PM.png,2026-07-11T10:55:28Z,,"Passersby Can’t Believe Who They Spot Sharing A Picnic Table In Alaska The Dodo
Passenger partly sucked from Ryanair plane during flight DW. doug c: “Boeing 737.”
The Hobbits Mysteriously Disappear… [+10529 chars]",,en,Heat Wave Israel,Heat Wave,wmo,Israel,MED,Asia
https://www.irishtimes.com/world/asia-pacific/2026/07/11/china-evacuates-more-than-one-million-people-as-region-braces-for-typhoon-bavi/,https://www.irishtimes.com/world/asia-pacific/2026/07/11/china-evacuates-more-than-one-million-people-as-region-braces-for-typhoon-bavi/,0,www.irishtimes.com,China evacuates more than one million people as region braces for Typhoon Bavi,At least 17 killed in landslides set off by intense rains in southern Philippines,https://www.irishtimes.com/resizer/v2/72QWYVK4NZDI7ANCVMDVX6KD5Q.jpg?smart=true&auth=f893248bd69f42259f291b54fe77f8c6ca20ed91697d263448ff12a04ecdec50&width=1200&height=630,2026-07-11T12:08:15Z,,"Chinese authorities evacuated more than one million people on Saturday and issued high alerts as eastern China braced for Typhoon Bavi, which has brought strong winds and rain to Japans southern isla… [+3062 chars]",,en,Landslide China,Landslide,wmo,China,EAS,Asia
https://www.dw.com/en/typhoon-bavi-hits-china-after-battering-taiwan-japan/a-77914270,https://www.dw.com/en/typhoon-bavi-hits-china-after-battering-taiwan-japan/a-77914270,0,www.dw.com,"Typhoon Bavi hits China after battering Taiwan, Japan","Bavi has forced hundreds of thousands to evacuate in China, knocked out power in Japan and Taiwan, and triggered deadly landslides in the Philippines. Typhoon Bavi made landfall in China's eastern province of Zhejiang late Saturday night, state media reported…",https://static.dw.com/image/77918139_6.jpg,2026-07-11T17:02:00Z,,"Typhoon Bavi made landfall in China's eastern province of Zhejiang late Saturday night, state media reported.
Over 1.7 million people had been evacuated as the country braced for Bavi, which is expe… [+2402 chars]",,en,Landslide China,Landslide,wmo,China,EAS,Asia
https://www.cnn.com/2026/07/11/americas/chile-santiago-ski-snow-intl-latam,https://www.cnn.com/2026/07/11/americas/chile-santiago-ski-snow-intl-latam,0,www.cnn.com,This summer ski destination in the Andes isn’t getting enough snow,The classic postcard images of the Chilean capital of Santiago surrounded by the snow-covered Andes in winter now seem like pictures from the past.,https://s.yimg.com/lo/mysterio/api/76be4df58805107990fc4a823e49c2b948c9e692bc30c165712f78878230007d/lightyear_networkapi/resizefill_w1200;quality_80;format_webp/https:%2F%2Fmedia.zenfs.com%2Fen%2Fcnn_articles_875%2F990560a7c24f44af399c96de0d78a416,2026-07-11T19:18:07Z,,"The classic postcard images of the Chilean capital of Santiago surrounded by the snow-covered Andes in winter now seem like pictures from the past.
A yearslong drought that has plagued the country h… [+2920 chars]",,en,Snow Chile,Snow&Ice,wmo,Chile,SWS,South-America
https://www.cbc.ca/news/science/europe-heat-excess-deaths-9.7267829,https://www.cbc.ca/news/science/europe-heat-excess-deaths-9.7267829,0,www.cbc.ca,"Europe recorded 10,000 excess deaths during late-June heat wave, data shows","European countries reported more than 10,000 excess deaths during the record-breaking heat wave that engulfed the west of the continent in late June,  official data shows.","https://i.cbc.ca/ais/2b8df34d-1fc2-4600-b53f-bdaff083f750,1783941695037/full/max/0/default.jpg?im=Crop%2Crect%3D%280%2C305%2C5866%2C3299%29%3BResize%3D620",2026-07-13T11:45:36Z,,"European countries reported more than 10,000 excess deaths during the record-breaking heat wave that engulfed the west of the continent in late June, official data shows.
The vast majority more than… [+2928 chars]",,en,heat,Heat Wave,random,,,
https://abcnews.com/International/thousands-died-england-wales-recent-heat-wave-report/story?id=134714480,https://abcnews.com/International/thousands-died-england-wales-recent-heat-wave-report/story?id=134714480,0,abcnews.com,Thousands died in England and Wales from recent heat waves: Report,"The total number of deaths exceeds 2,700.",https://s.yimg.com/lo/mysterio/api/3bb0fbc5eca5e6dea36e310e23f76adb068a52138c8d1fd359d272452e797740/lightyear_networkapi/resizefill_w1200;quality_80;format_webp/https:%2F%2Fmedia.zenfs.com%2Fen%2Fus.abcnews.go.com%2Fa47b80b02d7bb84449b549acaf725767,2026-07-13T18:14:00Z,,"More than 2,700 people are estimated to have died in England and Wales in recent months as a result of heat-related causes, a new report has found.
The excess deaths occurred as a result of heat wav… [+4400 chars]",,en,heat,Heat Wave,random,,,
https://www.scientificamerican.com/article/why-have-their-been-so-many-record-breaking-heat-waves-this-summer/,https://www.scientificamerican.com/article/why-have-their-been-so-many-record-breaking-heat-waves-this-summer/,0,www.scientificamerican.com,Why have their been so many record-breaking heat waves this summer?,Record-breaking heat waves are beginning to blur together—here’s why and what’s making them so unbearable,https://static.scientificamerican.com/dam/asset/0b641a28-9a98-4805-b2c9-82bc83974e1f/heat-index.png?m=1783977773.783&w=1200,2026-07-13T21:05:00Z,,"Temperatures across the western and central U.S. are smashing records: On Sunday Billings, Mont., set a new all-time high of 111 degrees Fahrenheit (nearly 44 degrees Celsius), Salt Lake City and She… [+3682 chars]",,en,heat,Heat Wave,random,,,
