index,url,valid,domain,title,description,image,published,archive,content,quote,language,term,topic,feed,country,ipcc,continent
https://www.irishtimes.com/environment/2025/01/05/ireland-weather-update-warnings-remain-in-place-as-snow-sleet-and-rain-moves-across-country/,https://www.irishtimes.com/environment/2025/01/05/ireland-weather-update-warnings-remain-in-place-as-snow-sleet-and-rain-moves-across-country/,0,www.irishtimes.com,"Ireland weather update: Warnings remain in place as snow, sleet and rain moves across country","Cold conditions set to take hold and last well into next week due to snow, sleet and rain combined with plummeting temperatures",https://www.irishtimes.com/resizer/v2/6IHRPQBWVOAVXV6TGS4FL42WAQ.jpg?smart=true&auth=1b146ca273a28413d610efe8d907f8d98e428e1af78d22d2a905d547aa0b2056&width=1200&height=630,2025-01-05T07:52:06Z,,"Met Éireann has said that heavy snow and easterly winds could lead to drifts in some areas in the coming days with the cold conditions set to take hold and last well into next week.
Widespread snow,… [+3096 chars]",,en,Snow Ireland,Snow&Ice,wmo,Ireland,NEU,Europe
https://www.irishtimes.com/ireland/2025/01/05/ireland-weather-update-heavy-snow-in-parts-as-met-eireann-forecasts-wintry-conditions-to-spread-across-country/,https://www.irishtimes.com/ireland/2025/01/05/ireland-weather-update-heavy-snow-in-parts-as-met-eireann-forecasts-wintry-conditions-to-spread-across-country/,0,www.irishtimes.com,Ireland weather update: Heavy snow in parts as Met Éireann forecasts wintry conditions to spread across country,"Weather warnings remain in place with 28,000 without power and some roads impassable",https://www.irishtimes.com/resizer/v2/VHOC5DXPOAVTGLTKTXKYZP44LY.jpg?smart=true&auth=0079ec6ac84d4242c446502cf3d6ae8c2dd75b95aa145f095084f7506ccdd3c3&width=1200&height=630,2025-01-05T09:23:07Z,http://archive.md/20250105121758/https://www.irishtimes.com/ireland/2025/01/05/ireland-weather-update-heavy-snow-in-parts-as-met-eireann-forecasts-wintry-conditions-to-spread-across-country/,"Main points
<ul><li>Much of the south of the country woke up to heavy snowfall this morning with up to 10cm reported in some areas</li><li>A Status Orange rain and snow warning is in place for Cork,… [+2764 chars]",,en,Snow Ireland,Snow&Ice,wmo,Ireland,NEU,Europe
https://www.independent.ie/irish-news/cold-snap-transport-disruption-and-28000-without-power-after-overnight-snow-as-cold-weather-warning-extended-to-thursday/a674165905.html,https://www.independent.ie/irish-news/cold-snap-transport-disruption-and-28000-without-power-after-overnight-snow-as-cold-weather-warning-extended-to-thursday/a674165905.html,0,www.independent.ie,"Cold snap: Transport disruption and 28,000 without power after overnight snow, as cold weather warning extended to Thursday",With the cold snap bringing snow to parts of Ireland there is significant disruption for many people.,https://focus.independent.ie/thumbor/sd-TvNtvvd2ebXXx3Pfzy4zB9D8=/60x0:735x450/629x0/prod-mh-ireland/7e9d0530-1e58-4d60-9a85-5cfd6940516a/aa853dc0-7c40-4b58-90d1-de882ba910a7/video/video.jpg,2025-01-05T10:50:00Z,,"Thousands are without power this morning and some public transport services have been cancelled as the country wakes up to snow, sleet, heavy rain and bitterly cold temperatures.A multi-hazard weathe… [+6004 chars]",,en,Snow Ireland,Snow&Ice,wmo,Ireland,NEU,Europe
https://www.bbc.com/news/articles/c8j9d1rg4p4o?xtor=AL-72-%5Bpartner%5D-%5Byahoo.north.america%5D-%5Bheadline%5D-%5Bnews%5D-%5Bbizdev%5D-%5Bisapi%5D,https://www.bbc.com/news/articles/c8j9d1rg4p4o?xtor=AL-72-%5Bpartner%5D-%5Byahoo.north.america%5D-%5Bheadline%5D-%5Bnews%5D-%5Bbizdev%5D-%5Bisapi%5D,0,www.bbc.com,Thousands without power as cold snap continues across island,"In Northern Ireland, a number of yellow weather warnings for ice and snow have been issued.",https://s.yimg.com/ny/api/res/1.2/z.A00jIRTloQh3FdLKDVPg--/YXBwaWQ9aGlnaGxhbmRlcjt3PTEyMDA7aD04MDI-/https://media.zenfs.com/en/bbc_us_articles_995/f643fffe0498b690a31f33b973d15651,2025-01-05T11:56:37Z,,"Yahoo is using AI to generate takeaways from this article. This means the info may not always match what's in the article. Reporting mistakes helps us improve the experience.Generate Key Takeaways
N… [+5329 chars]",,en,Ice Ireland,Snow&Ice,wmo,Ireland,NEU,Europe
https://www.independent.ie/irish-news/cold-snap-travel-disruption-in-north-munster-thousands-without-power-and-water-schools-to-make-decisions-on-reopening/a674165905.html,https://www.independent.ie/irish-news/cold-snap-travel-disruption-in-north-munster-thousands-without-power-and-water-schools-to-make-decisions-on-reopening/a674165905.html,0,www.independent.ie,"Cold snap: Travel disruption in north Munster, thousands without power and water, schools to make decisions on reopening",With the cold snap bringing snow to parts of Ireland there is significant disruption for many people.,https://focus.independent.ie/thumbor/lnxLyJZ2G6C-M_MhIyb5zYZnHdE=/60x0:735x450/629x0/prod-mh-ireland/0c81c9d5-589f-4955-8e35-7685d4b9aad8/b5c4f78a-7c8c-4b99-923c-1e058bae361f/video/video.jpg,2025-01-05T13:20:00Z,,"Major disruption in UKHeavy snow and freezing rain brought widespread disruption across Europe on Sunday, particularly in the U.K. and Germany, with several major airports forced to suspend flights
… [+2460 chars]",,en,Snow Ireland,Snow&Ice,wmo,Ireland,NEU,Europe
https://wattsupwiththat.com/2025/01/05/climate-bombshell-new-evidence-reveals-30-year-global-drop-in-hurricane-frequency-and-power/,https://wattsupwiththat.com/2025/01/05/climate-bombshell-new-evidence-reveals-30-year-global-drop-in-hurricane-frequency-and-power/,0,wattsupwiththat.com,Climate Bombshell: New Evidence Reveals 30 Year Global Drop in Hurricane Frequency and Power,"“A less charitable explanation is that there is a systematic effort underway to contest and undermine actual climate science, including the assessments of the IPCC, in order to present a picture of reality that is simply false in support of climate advocacy. …",https://i0.wp.com/wattsupwiththat.com/wp-content/uploads/2025/01/hurricane2.webp?fit=1024%2C512&ssl=1,2025-01-05T14:00:00Z,,"From THE DAILY SCEPTIC
by Chris Morrison
Last month a small but powerful cyclone named Chido made landfall in Mayotte before sweeping into Mozambique, causing considerable damage and leading to the… [+6222 chars]",,en,hurricane,Tropical Cyclone,random,,,
https://legalinsurrection.com/2025/01/mystery-volcano-that-lowered-global-temperatures-nearly-2-degrees-fahrenheit-in-1831-identified/,https://legalinsurrection.com/2025/01/mystery-volcano-that-lowered-global-temperatures-nearly-2-degrees-fahrenheit-in-1831-identified/,0,legalinsurrection.com,‘Mystery Volcano’ that Lowered Global Temperatures Nearly 2 degrees Fahrenheit in 1831 Identified,"Meanwhile ""Great Rift"" volcano in Ethiopia erupts after seismic swarm, leading to evacuations.
The post ‘Mystery Volcano’ that Lowered Global Temperatures Nearly 2 degrees Fahrenheit in 1831 Identified first appeared on Le·gal In·sur·rec·tion.",https://legalinsurrection.com/wp-content/uploads/2025/01/LI-003-Ethiopian-Volcano.png,2025-01-05T14:00:07Z,,"Whenever I write about climate change, I often note that volcanoes can have significant impacts on the global climate.
A new example has been recently revealed, as a ‘mystery volcano’ that erupted i… [+3811 chars]",,en,volcano,Volcano,random,,,
https://wattsupwiththat.com/2025/01/05/mystery-volcano-that-lowered-global-temperatures-nearly-2-degrees-fahrenheit-in-1831-identified/,https://wattsupwiththat.com/2025/01/05/mystery-volcano-that-lowered-global-temperatures-nearly-2-degrees-fahrenheit-in-1831-identified/,0,wattsupwiththat.com,‘Mystery Volcano’ that Lowered Global Temperatures Nearly 2 degrees Fahrenheit in 1831 Identified,"To find the volcano, researchers compared the chemistry of microscopic shards of ash extracted from ice cores drilled in Greenland with samples from the Zavaritskii caldera. They determined it was a perfect match.",https://i0.wp.com/wattsupwiththat.com/wp-content/uploads/2025/01/great-rift-volcano-ethiopa.webp?fit=1024%2C512&ssl=1,2025-01-05T22:00:00Z,,"Meanwhile Great Rift volcano in Ethiopia erupts after seismic swarm, leading to evacuations.
From Legal Insurrection
Posted by Leslie Eastman 
Whenever I write about climate change, I often note t… [+3820 chars]",,en,volcano,Volcano,random,,,
https://www.yahoo.com/news/melting-snow-heavy-rain-lead-100231151.html,https://www.yahoo.com/news/melting-snow-heavy-rain-lead-100231151.html,0,www.yahoo.com,"Melting snow, heavy rain lead Germany's Moselle river to overflow",Persistent heavy rain and melting snow due to milder temperatures caused Germany's Moselle river to overflow on Monday. The flood forecasting centre in the...,https://media.zenfs.com/en/dpa_international_526/d15e82ecd7fb5ef0092c4aa03e5e6610,2025-01-06T10:02:31Z,,"Persistent heavy rain and melting snow due to milder temperatures caused Germany's Moselle river to overflow on Monday.
The flood forecasting centre in the western state of Rhineland-Palatinate said… [+593 chars]",,en,Snow Germany,Snow&Ice,eswd,Germany,WCE,Europe
https://www.sciencedaily.com/releases/2025/01/250106133458.htm,https://www.sciencedaily.com/releases/2025/01/250106133458.htm,0,www.sciencedaily.com,Climate extremes in 2024 'wreaking havoc' on the global water cycle,"2024 was another year of record-breaking temperatures, driving the global water cycle to new climate extremes and contributing to ferocious floods and crippling droughts, a new report shows. The report found rising temperatures are changing the way water move…",https://www.sciencedaily.com/images/scidaily-icon.png,2025-01-06T18:34:58Z,,"2024 was another year of record-breaking temperatures, driving the global water cycle to new climate extremes and contributing to ferocious floods and crippling droughts, a new report led by The Aust… [+4246 chars]",,en,drought,Drought,random,,,
https://www.newsweek.com/saudi-videos-show-flooded-mecca-2010941,https://www.newsweek.com/saudi-videos-show-flooded-mecca-2010941,0,www.newsweek.com,Saudi Videos Show Flooded Mecca,"The Islamic holy city of Mecca has flooded along with other Saudi Arabian cities after heavy rainfall earlier this week, as seen in videos on social media.",https://d.newsweek.com/en/full/2558327/people-gather-mecca-haji-pilgrimage.jpg,2025-01-07T14:54:24Z,,"Satellite images show that Mecca, a holy city according to Islam, has flooded after Saudi Arabia was hit with torrential rains due to a storm on Monday that swept away cars and caused havoc, the Saud… [+3630 chars]",,en,Rain Saudi Arabia,Precipitation,wmo,Saudi Arabia,ARP,Asia
https://brobible.com/culture/article/tan-hill-inn-british-pub-people-stuck-snowstorm-videos/,https://brobible.com/culture/article/tan-hill-inn-british-pub-people-stuck-snowstorm-videos/,0,brobible.com,23 People Stuck Inside ‘Britain’s Highest Pub’ For Days After Snowstorm Were Living The Dream (Video),"No one really wants to get stuck inside for days on end thanks to a snowstorm, but a bar is probably one of the best places you can end up if you find yourself dealing with that situation. That’s the scenario dozens of people at what is marketed as “Britain’s…",https://brobible.com/wp-content/uploads/2025/01/tan-hill-inn-british-pub.jpg,2025-01-07T16:54:58Z,,"Getty Image
No one really wants to get stuck inside for days on end thanks to a snowstorm, but a bar is probably one of the best places you can end up if you find yourself dealing with that situatio… [+2092 chars]",,en,snowstorm,Snow&Ice,random,,,
https://www.smithsonianmag.com/smart-news/scientists-find-the-mysterious-source-of-the-massive-1831-volcanic-eruption-that-cooled-earth-and-made-the-sun-appear-blue-180985784/,https://www.smithsonianmag.com/smart-news/scientists-find-the-mysterious-source-of-the-massive-1831-volcanic-eruption-that-cooled-earth-and-made-the-sun-appear-blue-180985784/,0,www.smithsonianmag.com,Scientists Find the Mysterious Source of the Massive 1831 Volcanic Eruption That Cooled Earth and Made the Sun Appear Blue,"The climate-altering eruption came from the Zavaritskii volcano on an uninhabited island in the Pacific that once hosted a Soviet submarine base, according to a new study",https://th-thumbnailer.cdn-si-edu.com/6K21MFYeaLM1lMjmHMo1aR0eVY0=/fit-in/1200x0/filters:focal(375x250:376x251)/https%3A%2F%2Ftf-cmsv2-smithsonianmag-media.s3.amazonaws.com%2Ffiler_public%2F63%2F42%2F63424f65-7908-46dc-ae87-44a21ba79073%2Fpicture-2-e1736266120650.jpg,2025-01-08T16:47:43Z,https://web.archive.org/web/20250108200237/https://www.smithsonianmag.com/smart-news/scientists-find-the-mysterious-source-of-the-massive-1831-volcanic-eruption-that-cooled-earth-and-made-the-sun-appear-blue-180985784/,"The eruption at Zavaritskii volcano created a nearly two-mile-wide caldera with layers of red, black and white from previous eruptive deposits.
 Oleg Dirksen
In the summer of 1831, an enormous volc… [+5570 chars]",,en,volcano eruption,Volcano,random,,,
https://www.caring.com/resources/older-adults-risk-preparation-for-extreme-weather-events/,https://www.caring.com/resources/older-adults-risk-preparation-for-extreme-weather-events/,0,www.caring.com,Extreme weather events put older adults at risk. Here's how they can prepare.,"Over the past two decades, extreme weather events and record-breaking temperatures fueled by climate change have put more lives at risk. In the United States and around the world, hurricanes, tornadoes, floods, and heat waves have become more frequent, intens…",https://analytics.stacker.com/tracking/1f3f472e-5a19-44c5-94c9-cc1b324ba040/pixel.gif?source=feed,2025-01-08T21:02:46Z,,"Over the past two decades, extreme weather events and record-breaking temperatures fueled by climate change have put more lives at risk. In the United States and around the world, hurricanes, tornado… [+7685 chars]",,en,Hurricane United States,Tropical Cyclone,wmo,United States,CNA,North-America
https://theconversation.com/how-heat-storage-technologies-could-keep-canadas-roads-and-bridges-ice-free-all-winter-long-245419,https://theconversation.com/how-heat-storage-technologies-could-keep-canadas-roads-and-bridges-ice-free-all-winter-long-245419,0,theconversation.com,How heat storage technologies could keep Canada’s roads and bridges ice-free all winter long,Storing the sun’s energy underground could help keep Canada’s roads ice-free in the winter months as a safer and cheaper alternative to plows and salt.,https://images.theconversation.com/files/641264/original/file-20250108-19-7tcnjl.JPG?ixlib=rb-4.1.0&rect=0%2C288%2C3847%2C1920&q=45&auto=format&w=1356&h=668&fit=crop,2025-01-08T21:13:58Z,,"For decades, Canadian cities and towns have combated ice and snow with salt and plows. This approach, however, comes at a steep cost. Traditional techniques damage roads, harm the environment and are… [+6375 chars]",,en,Ice Canada,Snow&Ice,wmo,Canada,NEN,North-America
https://biztoc.com/x/010cfc719f01ae23,https://biztoc.com/x/010cfc719f01ae23,0,biztoc.com,Beagle Refusing To Go Potty in Snow Has Internet in Stitches,"A dog owner from the United Kingdom has filmed his beagle's reaction to waking up in the snow, and internet users can't cope with it.
The viral video, shared on TikTok on Sunday under the username @milothebeagleboy, shows the poster opening his front door to …",https://biztoc.com/cdn/010cfc719f01ae23_s.webp,2025-01-10T14:43:34Z,,"A dog owner from the United Kingdom has filmed his beagle's reaction to waking up in the snow, and internet users can't cope with it.The viral video, shared on TikTok on Sunday under the username @mi… [+143 chars]",,en,Snow United Kingdom,Snow&Ice,wmo,United Kingdom,NEU,Europe
https://www.abc.net.au/news/2025-01-11/climate-illnesses-a-new-worrying-reality-for-australians/104655176,https://www.abc.net.au/news/2025-01-11/climate-illnesses-a-new-worrying-reality-for-australians/104655176,0,www.abc.net.au,"Climate change is making us sick, from gastro outbreaks to eco-anxiety","Climate scientists are already recording a steady change in global temperatures, and experts warn cases of gastro, mosquito-borne illness and heat stroke are soon to follow.",https://live-production.wcms.abc-cdn.net.au/121d1fdb3037cca74ba8121afbdedb80?impolicy=wcms_watermark_news&cropH=385&cropW=684&xPos=0&yPos=9&width=862&height=485&imformat=generic,2025-01-10T20:03:32Z,,"It's the crisis that could cost health authorities upwards of $6 billion and cause an extra 250,000 deaths per year by 2030.The World Health Organization (WHO) says climate change has emerged as a ""f… [+13687 chars]",,en,record heat,Heat Wave,random,,,
