index,url,valid,domain,title,description,image,published,archive,content,quote,language,term,topic,feed,country,ipcc,continent
https://economictimes.indiatimes.com/news/india/himachal-records-wettest-october-in-20-years-receives-173-above-normal-rainfall-imd/articleshow/125009073.cms,https://economictimes.indiatimes.com/news/india/himachal-records-wettest-october-in-20-years-receives-173-above-normal-rainfall-imd/articleshow/125009073.cms,0,economictimes.indiatimes.com,Himachal records wettest October in 20 years; receives 173% above normal rainfall: IMD,"Himachal Pradesh recorded its wettest October in two decades, with rainfall 173% above normal. Sirmaur, Kangra, and Solan districts received the highest precipitation, while Naina Devi and Solan experienced extremely heavy rainfall. The state anticipates ligh…","https://img.etimg.com/thumb/msid-125009081,width-1200,height-630,imgsize-24260,overlay-economictimes/articleshow.jpg",2025-11-01T03:14:48Z,,"Himachal Pradesh experienced its wettest October in two decades, recording 68.5 mm of rainfall this year, 173% above the normal average of 25.1 mm, according to the monthly report issued by the India… [+1661 chars]",,en,record rainfall,Precipitation,random,,,
https://www.abc.net.au/news/2025-11-01/qld-thunderstorms-hit-south-east-saturday/105961034,https://www.abc.net.au/news/2025-11-01/qld-thunderstorms-hit-south-east-saturday/105961034,0,www.abc.net.au,Breaking: Nine centimetre hail hits south-east Queensland with more storms forecast,Hailstones of up to nine centimetres in diameter have been reported west of Warwick on the Southern Downs as south-east Queensland is warned to prepare for more storm activity.,https://live-production.wcms.abc-cdn.net.au/ebd73190156e17e8cd6e75f30cc75cc4?impolicy=wcms_watermark_news&cropH=1152&cropW=2048&xPos=0&yPos=384&width=862&height=485&imformat=generic,2025-11-01T04:18:15Z,,"Parts of south-east Queensland have been hit by giant hailstones, heavy rainfall and damaging winds, with the region on alert for more storm activity on Saturday afternoon
At Pratten, west of Warwic… [+1847 chars]",,en,hailstone,Thunderstorm,random,,,
https://indianexpress.com/article/india/himachal-pradesh-highest-october-rain-since-2005-10339398/,https://indianexpress.com/article/india/himachal-pradesh-highest-october-rain-since-2005-10339398/,0,indianexpress.com,Himachal Pradesh gets highest October rain in two decades,"Himachal Pradesh recorded its wettest October in 20 years with the rainfall 173% above normal, according to the IMD. Bilaspur, Sirmaur, and Kangra saw the highest precipitation levels this month.",https://images.indianexpress.com/2025/11/Himachal-Pradesh-rain.png,2025-11-01T05:43:00Z,,"Highest October rainfall in Himachal Pradesh: Himachal Pradesh has received the highest rainfall in October in two decades, the India Meteorological Department (IMD) said. Himachal recorded a total r… [+2598 chars]",,en,record rainfall,Precipitation,random,,,
https://www.cbc.ca/news/science/hurricane-melissa-climate-change-9.6960554,https://www.cbc.ca/news/science/hurricane-melissa-climate-change-9.6960554,0,www.cbc.ca,How much of a role did climate change play with Hurricane Melissa?,"Millions of people across the Caribbean are trying to deal with the devastating effects of Hurricane Melissa, which tore through the region this week, slamming into Jamaica as a Category 5 storm. Now, several groups have done a rapid analysis to determine wha…","https://i.cbc.ca/ais/fa41c082-3508-4705-b172-cf746f756752,1761854107929/full/max/0/default.jpg?im=Crop%2Crect%3D%280%2C186%2C2805%2C1577%29%3BResize%3D620",2025-11-01T08:00:00Z,,"Millions of people across the Caribbean are trying to deal with the devastating effects of Hurricane Melissa, which tore through the region this week.
Like so many storms of late, Melissa underwent … [+5041 chars]",,en,Storm Jamaica,Storm,wmo,Jamaica,CAR,North-America
https://www.nakedcapitalism.com/2025/11/links-11-1-2025.html,https://www.nakedcapitalism.com/2025/11/links-11-1-2025.html,0,www.nakedcapitalism.com,Links 11/1/2025,"Our rowdy daily links: Plastic surgery violence, US trade defeat v. China, Venezuela, Aussie subprime, ghost ICE vehicles, Reeves wants Brits all in, moar debt worries, Pharma loots Pentagon, map of US debt stress, threat to deport Cenk over Israel, jobs rece…",https://www.nakedcapitalism.com/wp-content/uploads/2025/11/Screenshot-2025-11-01-at-11.54.17 AM.png,2025-11-01T10:55:45Z,,"The violence of facelifts Unherd
3I/ATLAS Just Got Bluer Than the Sun and Nobody Knows Why
3I/ATLAS is changing fast. As it hit perihelion on October 29 the interstellar object rapidly brightened a… [+9447 chars]",,en,Ice China,Snow&Ice,wmo,China,EAS,Asia
https://www.wired.com/story/climate-change-made-hurricane-melissa-four-times-more-likely-study-suggests/,https://www.wired.com/story/climate-change-made-hurricane-melissa-four-times-more-likely-study-suggests/,0,www.wired.com,"Climate Change Made Hurricane Melissa 4 Times More Likely, Study Suggests",Unusually warm ocean temperatures fueled one of the worst hurricanes on record. New research finds climate change increased the storm’s likelihood.,"https://media.wired.com/photos/6904ade560b82c8ef03c4d77/191:100/w_1280,c_limit/GettyImages-2243471161.jpg",2025-11-01T12:00:00Z,,"This story originally appeared on Inside Climate News and is part of the Climate Desk collaboration.
Fueled by unusually warm waters, Hurricane Melissa this week turned into one of the strongest Atl… [+2836 chars]",,en,hurricane,Tropical Cyclone,random,,,
https://economictimes.indiatimes.com/news/india/climate-change-has-started-showing-its-adverse-impact-on-gujarat-other-states-are-at-risk-studies/articleshow/125018721.cms,https://economictimes.indiatimes.com/news/india/climate-change-has-started-showing-its-adverse-impact-on-gujarat-other-states-are-at-risk-studies/articleshow/125018721.cms,0,economictimes.indiatimes.com,Climate change has started showing its adverse impact on Gujarat. Other states are at risk: Studies,Gujarat is experiencing severe climate change impacts. Unseasonal rains have caused significant farmer losses. Environmentalists link this to decades of neglect. India ranks high globally for climate risk. Gujarat is among the top at-risk regions. Rainfall pa…,"https://img.etimg.com/thumb/msid-125018772,width-1200,height-630,imgsize-16216,overlay-economictimes/articleshow.jpg",2025-11-01T15:08:39Z,,"As the unseasonal rain continues to lash Gujarat, the state has received average 3.30 inches of rainfall in October, the highest in last ten years. While the untimely rain has spelt massive loss for … [+3648 chars]",,en,Rain India,Precipitation,wmo,India,SAS,Asia
https://www.channelnewsasia.com/sport/chelsea-win-1-0-spurs-joao-pedro-ends-goal-drought-5440016,https://www.channelnewsasia.com/sport/chelsea-win-1-0-spurs-joao-pedro-ends-goal-drought-5440016,0,www.channelnewsasia.com,Chelsea win 1-0 at Spurs as Joao Pedro ends goal drought,"LONDON :Chelsea beat hosts Tottenham Hotspur 1-0 in the Premier League on Saturday with Brazil striker Joao Pedro scoring the only goal of the game and getting back on the scoresheet for the first time since August.Enzo Maresca's men, stung by last weekend's …","https://dam.mediacorp.sg/image/upload/s--rwB8vIyF--/c_fill,g_auto,h_676,w_1200/fl_relative,g_south_east,l_mediacorp:cna:watermark:2024-04:reuters_1,w_0.1/f_auto,q_auto/v1/one-cms/core/2025-11-01T194001Z_1_LYNXMPELA01IN_RTROPTP_3_SOCCER-ENGLAND-TOT-CHE.JPG?itok=xUkQUxdl",2025-11-01T19:40:01Z,,LONDON :Chelsea beat hosts Tottenham Hotspur 1-0 in the Premier League on Saturday with Brazil striker Joao Pedro scoring the only goal of the game and getting back on the scoresheet for the first ti… [+515 chars],,en,Drought Brazil,Drought,wmo,Brazil,SAM,South-America
https://theaviationist.com/2025/11/01/b-29-strategic-operations-japan-part-2/,https://theaviationist.com/2025/11/01/b-29-strategic-operations-japan-part-2/,0,theaviationist.com,B-29 Strategic Operations against Japan Part 2: Island Operations,"Originally struggling to achieve success in the China Burma India Theater, the Boeing B-29 Superfortress made its mark once tactics were changed and incendiaries were used. Originally operating out of the China Burma India Theater with disappointing results, …",https://theaviationist.com/wp-content/uploads/2025/10/B292_1.jpg,2025-11-01T20:09:09Z,,"Originally operating out of the China Burma India Theater with disappointing results, costly losses, and constant supply issues, the Boeing B-29 Superfortress was struggling to achieve success in its… [+39712 chars]",,en,heat,Heat Wave,random,,,
https://japantoday.com/category/sports/england-powers-past-the-wallabies-25-7-in-the-rain,https://japantoday.com/category/sports/england-powers-past-the-wallabies-25-7-in-the-rain,0,japantoday.com,England powers past Wallabies 25-7 in the rain,"England finally beat one of the southern hemisphere heavyweights under coach Steve Borthwick when Australia succumbed 25-7 at rainy Twickenham on Saturday. Borthwick's rising England had knocked off Ireland and France but none of Australia, South Africa or Ne…",,2025-11-01T21:49:21Z,,"England finally beat one of the southern hemisphere heavyweights under coach Steve Borthwick when Australia succumbed 25-7 at rainy Twickenham on Saturday.
Borthwick's rising England had knocked off… [+2893 chars]",,en,Rain South Africa,Precipitation,wmo,South Africa,WSAF,Africa
https://www.nzherald.co.nz/sport/rugby/all-blacks/all-blacks-v-ireland-scott-robertsons-side-storm-home-in-chicago-to-keep-grand-slam-dream-alive/4VVHXC7D2NBRFLHGPH33WFDRF4/,https://www.nzherald.co.nz/sport/rugby/all-blacks/all-blacks-v-ireland-scott-robertsons-side-storm-home-in-chicago-to-keep-grand-slam-dream-alive/4VVHXC7D2NBRFLHGPH33WFDRF4/,0,www.nzherald.co.nz,All Blacks v Ireland: Scott Robertson’s side storm home in Chicago to keep Grand Slam dream alive,Three late tries sealed victory after the All Blacks trailed for an hour.,https://www.nzherald.co.nz/resizer/v2/27MYZBEEJ5CGTK67OWLNWK4IJY.jpg?auth=16d641114ef525429ea3de18245bf32265e5e66c5da6b16559c1247462427db5&width=1200&height=675&quality=70&smart=true,2025-11-01T22:29:22Z,,"For much of this contest, the All Blacks produced an error-riddled and ill-disciplined performance.
Ireland were well short of their best, too, but they did enough to feast on the All Blacks mistake… [+4908 chars]",,en,storm,Storm,random,,,
https://biztoc.com/x/08eb990e62960351,https://biztoc.com/x/08eb990e62960351,0,biztoc.com,4.1-magnitude earthquake strikes Chile,"A quake with a magnitude of 4.1 struck Chile, the United States Geological Survey (USGS) reported.The incident occurred 130 kilometers east-southeast of Vallenar, in the region of Atacama, Chile, whic...",https://biztoc.com/cdn/08eb990e62960351_s.webp,2025-11-02T02:45:12Z,,"A quake with a magnitude of 4.1 struck Chile, the United States Geological Survey (USGS) reported.The incident occurred 130 kilometers east-southeast of Vallenar, in the region of Atacama, Chile, whi… [+69 chars]",,en,Earthquake Chile,Earthquake,usgs,Chile,SWS,South-America
https://dailycaller.com/2025/11/02/southeast-coastal-storm-rain-flooding-low-pressure-weather/,https://dailycaller.com/2025/11/02/southeast-coastal-storm-rain-flooding-low-pressure-weather/,0,dailycaller.com,"Southeast Could Get Blasted With Coastal Storm To Bring Heavy Rain, Flooding","The Southeastern United States could potentially be getting hit with another coastal storm, only days following a different system that brought rain and wind.","https://images.dailycaller.com/image/width=1280,height=549,fit=cover,format=webp,f=auto/https://cdn01.dailycaller.com/wp-content/uploads/2025/11/GettyImages-2174061614-scaled-e1762059777326.jpg",2025-11-02T05:27:05Z,,"The Southeastern United States could potentially be getting hit with another coastal storm, only days following a different system that brought heavy rain, powerful winds and coastal flooding to a lo… [+1438 chars]",,en,Flooding United States,Flood,wmo,United States,CNA,North-America
https://biztoc.com/x/a90d1549e4f0efbd,https://biztoc.com/x/a90d1549e4f0efbd,0,biztoc.com,"Jamaican farms reel from Hurricane Melissa, fueling fears of food shortages",,https://biztoc.com/cdn/a90d1549e4f0efbd_s.webp,2025-11-02T11:12:50Z,,"{ window.open(this.href, '_blank'); }, 200); return false;""&gt;How is the government shutdown affecting SNAP benefits? { window.open(this.href, '_blank'); }, 200); return false;""&gt;Why did Berkshire… [+791 chars]",,en,Hurricane Melissa Jamaica,Tropical Cyclone,cmeter,Jamaica,CAR,North-America
https://www.bbc.com/news/articles/c1e34p92q0vo,https://www.bbc.com/news/articles/c1e34p92q0vo,0,www.bbc.com,Hurricane Melissa death toll rises to 28 in Jamaica,PM Andrew Holness warns of reports of possible fatalities still to be verified - suggesting the figure may yet rise.,https://ichef.bbci.co.uk/news/1024/branded_news/fd15/live/3ad7d090-b7d3-11f0-b2a1-6f537f66f9aa.jpg,2025-11-02T11:37:48Z,,"The number of people killed in Jamaica as a result of Hurricane Melissa has risen to 28, the Caribbean nation's prime minister has announced.
Andrew Holness confirmed nine other deaths on Saturday, … [+2616 chars]",,en,Hurricane Melissa Jamaica,Tropical Cyclone,cmeter,Jamaica,CAR,North-America
https://rollingout.com/2025/11/02/3-2-earthquake-surprise-to-california/,https://rollingout.com/2025/11/02/3-2-earthquake-surprise-to-california/,0,rollingout.com,3.2 earthquake delivers chilling surprise to California,"California residents experienced another reminder of the state’s seismic activity when a 3.2 magnitude earthquake struck near Santa Barbara Island early Sunday morning. The tremor, detected by the U.S. Geological Survey, shook the coastal region at 1:04 a.m.,…",https://rollingout.com/wp-content/uploads/2025/08/shutterstock_2291066021-scaled.jpg,2025-11-02T13:46:30Z,,"California residents experienced another reminder of the state’s seismic activity when a 3.2 magnitude earthquake struck near Santa Barbara Island early Sunday morning. The tremor, detected by the U.… [+4775 chars]",,en,earthquake,Earthquake,random,,,
https://www.bbc.com/news/articles/cpv11w8ez10o,https://www.bbc.com/news/articles/cpv11w8ez10o,0,www.bbc.com,'We have no idea what lies ahead': Aid struggles to reach Jamaican towns devastated by hurricane,Jamaicans are struggling to access clean drinking water and food days after Hurricane Melissa hit.,https://ichef.bbci.co.uk/news/1024/branded_news/4a63/live/e0caa6d0-b805-11f0-8f42-c1f60875a777.jpg,2025-11-02T16:11:31Z,,"Brandon Drennonin Westmoreland, Jamaica
A town just outside of Whitehouse in Westmoreland Parish sits in ruins
Five days after Hurricane Melissa pummelled into western Jamaica with record force, re… [+5749 chars]",,en,Hurricane Melissa Jamaica,Tropical Cyclone,cmeter,Jamaica,CAR,North-America
https://www.abc.net.au/news/2025-11-03/storm-damaged-powerline-killed-brisbane-man/105888900,https://www.abc.net.au/news/2025-11-03/storm-damaged-powerline-killed-brisbane-man/105888900,0,www.abc.net.au,A storm-damaged powerline killed Manendra. What could have been different?,The death of a Brisbane man after a storm shone a spotlight on the dangers of overhead powerlines in a storm-prone state.,https://live-production.wcms.abc-cdn.net.au/8855a74b288ad9acb8d8eed58dbfc357?impolicy=wcms_watermark_news&cropH=788&cropW=1400&xPos=0&yPos=26&width=862&height=485&imformat=generic,2025-11-02T19:38:53Z,,"When Manendra Kopparthi tragically removed a fallen branch on a wet Queensland road, he was repeating a good-citizen ethos for which the 30-year-old was renowned.
This was the kind of guy whom, his … [+13162 chars]",,en,storm,Storm,random,,,
https://economictimes.indiatimes.com/news/international/us/khabarovsk-submarine-and-poseidon-drone-can-trigger-massive-radioactive-tsunamis-floods-wipe-out-entire-coastal-cities-russias-new-nuclear-submarine-and-unmanned-underwater-weapon-explained-launch-nuclear-deterrence-strategy-undersea-warfare-sevmash-shipyard-in-severodvinsk/articleshow/125041809.cms,https://economictimes.indiatimes.com/news/international/us/khabarovsk-submarine-and-poseidon-drone-can-trigger-massive-radioactive-tsunamis-floods-wipe-out-entire-coastal-cities-russias-new-nuclear-submarine-and-unmanned-underwater-weapon-explained-launch-nuclear-deterrence-strategy-undersea-warfare-sevmash-shipyard-in-severodvinsk/articleshow/125041809.cms,0,economictimes.indiatimes.com,"Khabarovsk submarine and Poseidon drone can trigger massive radioactive tsunamis, floods, wipe out entire coastal cities? Russia’s new nuclear submarine and unmanned underwater weapon explained","Khabarovsk submarine and Poseidon drone can trigger massive radioactive tsunamis, floods and wipe out entire coastal cities? Russia has launched its new Khabarovsk nuclear submarine designed to carry Poseidon underwater drones. This report explains its launch…","https://img.etimg.com/thumb/msid-125041826,width-1200,height-630,imgsize-59078,overlay-economictimes/articleshow.jpg",2025-11-02T21:01:16Z,,"Khabarovsk submarine and Poseidon drone can trigger massive radioactive tsunamis, floods and wipe out entire coastal cities according to reports following Russias latest nuclear submarine launch. The… [+5193 chars]",,en,Flood Russia,Flood,wmo,Russia,ESB,Europe
https://www.abc.net.au/news/2025-11-03/storms-giant-hail-hits-south-east-queensland-weather-bom/105963838,https://www.abc.net.au/news/2025-11-03/storms-giant-hail-hits-south-east-queensland-weather-bom/105963838,0,www.abc.net.au,South-east Queensland hit by two consecutive days of giant hail,"Hundreds of residents remain without power after Saturday's wild storms, while others are tallying the cost of giant hail to their properties, cars and homes.",https://live-production.wcms.abc-cdn.net.au/7220f841cf2f166d77b091e3f82605ee?impolicy=wcms_watermark_news&cropH=1152&cropW=2048&xPos=0&yPos=192&width=862&height=485&imformat=generic,2025-11-02T21:37:23Z,,"South-east and southern Queensland residents are being warned of the possibility of more storms to come, after parts of the region were lashed by giant hail over the weekend.
Bureau of Meteorology s… [+2504 chars]",,en,storm,Storm,random,,,
https://dailycaller.com/2025/11/02/atmospheric-river-storms-pacific-northwest-rain-flooding-weather/,https://dailycaller.com/2025/11/02/atmospheric-river-storms-pacific-northwest-rain-flooding-weather/,0,dailycaller.com,"Forecasts Show Atmospheric River Storms Slamming Pacific Northwest With Heavy Rain, Flooding","When it comes to November, it's the Pacific Northwest's wettest month of the season, and like clockwork, atmospheric river-style storms are in the forecast.","https://images.dailycaller.com/image/width=1280,height=549,fit=cover,format=webp,f=auto/https://cdn01.dailycaller.com/wp-content/uploads/2025/11/GettyImages-1986521421-scaled-e1762118714437.jpg",2025-11-02T21:54:57Z,,"When it comes to November, it’s usually the Pacific Northwest’s wettest month of the season, and like clockwork, multiple atmospheric river-style storms are in the forecast to begin the first full we… [+2657 chars]",,en,river flooding,Flood,random,,,
https://www.abc.net.au/news/2025-11-03/melbourne-cup-time-how-to-watch-weather-forecast/105964240,https://www.abc.net.au/news/2025-11-03/melbourne-cup-time-how-to-watch-weather-forecast/105964240,0,www.abc.net.au,What time is the Melbourne Cup? How to watch and the weather forecast,"Rain in Melbourne is set to play a factor in Australia's most famous horse race, with Flemington Racecourse predicted to be rated a Soft 7 or Heavy 8 for Tuesday's Melbourne Cup.",https://live-production.wcms.abc-cdn.net.au/46d700823c59c18d67c5babf745ba4db?impolicy=wcms_watermark_news&cropH=2799&cropW=4976&xPos=0&yPos=524&width=862&height=485&imformat=generic,2025-11-03T00:37:59Z,,"Rain in Melbourne is set to play a factor in Australia's most famous horse race, with Flemington Racecourse predicted to be rated a Soft 7 or Heavy 8 for Tuesday's Melbourne Cup.
Meanwhile, the pre-… [+2734 chars]",,en,heavy rain,Precipitation,random,,,
https://www.abc.net.au/news/2025-11-03/fierce-storm-moves-lashes-central-australia/105964766,https://www.abc.net.au/news/2025-11-03/fierce-storm-moves-lashes-central-australia/105964766,0,www.abc.net.au,Power restored after Alice Springs lashed by 'fierce' storm,A severe thunderstorm brought down trees and cut power for several hours in Alice Springs.,https://live-production.wcms.abc-cdn.net.au/484ebbbd4f18f695ec1fc5fae2407145?impolicy=wcms_watermark_news&cropH=496&cropW=882&xPos=39&yPos=0&width=862&height=485&imformat=generic,2025-11-03T03:31:12Z,,"A severe thunderstorm has brought down trees and cut power for several hours in Alice Springs.
Residents across town and surrounding areas, including Santa Teresa, were without power for hours befor… [+3277 chars]",,en,storm,Storm,random,,,
https://en.protothema.gr/2025/11/03/the-tragedy-of-crete-and-the-parody-of-elta-karystianous-wave-zappeion-becomes-houston-kimberlys-table-no-30-and-the-cold-cuts-match/,https://en.protothema.gr/2025/11/03/the-tragedy-of-crete-and-the-parody-of-elta-karystianous-wave-zappeion-becomes-houston-kimberlys-table-no-30-and-the-cold-cuts-match/,0,en.protothema.gr,"The tragedy of Crete and the parody of ELTA, Karystianou’s Wave, Zappeion becomes Houston, Kimberly’s table no. 30 and the cold cuts match","Diamantis Diamantidis, the two tankers and the Houthis
The post The tragedy of Crete and the parody of ELTA, Karystianou’s Wave, Zappeion becomes Houston, Kimberly’s table no. 30 and the cold cuts match appeared first on ProtoThema English.",https://en.protothema.gr/wp-content/uploads/2024/06/ProtothemaEn.png,2025-11-03T07:50:35Z,,"Hello, the barbarities that took place in Crete the day before yesterday I think shook all of Greece and reminded us of the bad side of Greece that of course continues to exist as well as the timeles… [+22618 chars]",,en,cold wave,Cold Wave,random,,,
https://grist.org/indigenous/native-alaska-villages-were-already-on-the-frontlines-of-climate-change-then-a-typhoon-hit/,https://grist.org/indigenous/native-alaska-villages-were-already-on-the-frontlines-of-climate-change-then-a-typhoon-hit/,0,grist.org,Native Alaska villages were already on the frontlines of climate change. Then a typhoon hit.,"As Typhoon Halong swept through western Alaska, it laid bare how centuries-old policies made Native villages particularly vulnerable to climate change.",https://grist.org/wp-content/uploads/2025/10/AP25286797276397-e1761946526322.jpg?quality=75&strip=all,2025-11-03T09:30:00Z,,"A week after Typhoon Halong passed through Japan in early October, its remnants crossed the Pacific and struck western Alaska. Nearly 50 Alaska Native communities across the Yukon-Kuskokwim Delta nea… [+5683 chars]",,en,typhoon,Tropical Cyclone,random,,,
https://www.irishtimes.com/ireland/2025/11/03/unsettled-weather-for-week-ahead-with-rain-warnings-in-west/,https://www.irishtimes.com/ireland/2025/11/03/unsettled-weather-for-week-ahead-with-rain-warnings-in-west/,0,www.irishtimes.com,Unsettled weather for week ahead with rain warnings in west,"Met Éireann forecasts dull, blustery and wet days ahead, with temperatures to remain mild",https://www.irishtimes.com/resizer/v2/5ZWNZJMOV2VG6DAXXTMEADPOCA.JPG?smart=true&auth=3db3972b11fec26e0418ceef1b3ec48f5d902c2c26e689897bba16fe73241417&width=1200&height=630,2025-11-03T10:13:09Z,,"The weather in Ireland this week will be largely unsettled with blustery and wet conditions across the country.
Met Éireann has issued a status-yellow rain warning for Clare, Kerry, Galway and Mayo … [+1021 chars]",,en,Rain Ning er,Precipitation,wmo,China,EAS,Asia
https://www.yahoo.com/news/articles/india-power-generation-suffers-sharpest-104425214.html,https://www.yahoo.com/news/articles/india-power-generation-suffers-sharpest-104425214.html,0,www.yahoo.com,India’s Power Generation Suffers Sharpest Drop Since 2020,"India’s power generation fell 6% year-on-year in October, the steepest decline since 2020, as rain and holidays curbed industrial demand even as renewable...",https://media.zenfs.com/en/oilprice.com/a320d2675c2606ec6331044bc0570435,2025-11-03T10:44:25Z,,Power generation in India plunged by 6% in October from a year earlier – the sharpest drop since the Covid lockdowns in 2020 – as lower industrial demand due to holidays and unusually rainy weather d… [+2200 chars],,en,Rain India,Precipitation,wmo,India,SAS,Asia
https://newatlas.com/ski-snowboard/snowtunnel-indoor-ski-rotating/,https://newatlas.com/ski-snowboard/snowtunnel-indoor-ski-rotating/,0,newatlas.com,Giant rotating hamster wheels aim to 'revolutionize' indoor skiing,"An Australian company is preparing to roll out a series of giant, rotating ski barrels designed to make the experience of carving endless fresh snow available to city folk without a long drive. We talk to Snowtunnel co-founder and CEO Scott Kessler.Continue R…",https://assets.newatlas.com/dims4/default/6228d3f/2147483647/strip/true/crop/1920x1008+0+36/resize/1200x630!/quality/90/?url=https%3A%2F%2Fnewatlas-brightspot.s3.amazonaws.com%2Fd9%2F9f%2F71d8166a489c9e7fd185a52354fd%2Fstill-1-tunnel.jpg&na.image_optimisation=0,2025-11-03T12:27:00Z,,"An Australian company is preparing to roll out a series of giant, rotating ski barrels designed to make the experience of carving endless fresh snow available to city folk without a long drive. We ta… [+6694 chars]",,en,Snow Australia,Snow&Ice,wmo,Australia,CAU,Oceania
