index,url,valid,domain,title,description,image,published,archive,content,quote,language,term,topic,feed,country,ipcc,continent
https://economictimes.indiatimes.com/news/how-to/japan-tsunami-what-is-tsunami-their-causes-and-the-3-biggest-tsunamis-ever/articleshow/106449103.cms,https://economictimes.indiatimes.com/news/how-to/japan-tsunami-what-is-tsunami-their-causes-and-the-3-biggest-tsunamis-ever/articleshow/106449103.cms,0,economictimes.indiatimes.com,"Japan Tsunami: What is Tsunami, their causes and the 3 biggest Tsunamis ever?","Japan Earthquake and Tsunami: As Japan faces the threat of another tsunami following the recent 7.4-magnitude earthquake, it is a stark reminder of the unpredictable forces that shape our planet. Understanding the causes and historical precedents of tsunamis …","https://img.etimg.com/thumb/msid-106449370,width-1200,height-630,imgsize-30988,overlay-economictimes/photo.jpg",2024-01-01T09:14:25Z,,"Japan Earthquake and Tsunami: Japan, a country situated in a seismically active region, has once again found itself grappling with the aftermath of a powerful earthquake. An earthquake measuring 7.6 … [+2494 chars]",,en,Tsunami Japan,Tsunami,usgs,Japan,EAS,Asia
https://www.foxnews.com/world/japan-lowers-tsunami-warning-earthquakes-rock-region-government-warns-lingering-waves,https://www.foxnews.com/world/japan-lowers-tsunami-warning-earthquakes-rock-region-government-warns-lingering-waves,0,www.foxnews.com,"Japan lowers tsunami warning after earthquakes rock region, but government warns of lingering waves","Japan is downgrading its tsunami warning after several earthquakes, including one a magnitude of 7.6, rocked the west coast of Japan's main island, Honshu.",https://static.foxnews.com/foxnews.com/content/uploads/2024/01/Japan-2.jpg,2024-01-01T20:35:33Z,,"After a series of major earthquakes rocked Japan on Monday, the government downgraded its highest-level tsunami alert but warned residents not to return home as deadly waves and aftershocks could sti… [+3200 chars]",,en,Tsunami Japan,Tsunami,usgs,Japan,EAS,Asia
https://www.news.com.au/technology/environment/ses-responds-to-hundreds-of-callouts-following-rain-deluge/news-story/e65c147e67e95a09708c7cce596b1762,https://www.news.com.au/technology/environment/ses-responds-to-hundreds-of-callouts-following-rain-deluge/news-story/e65c147e67e95a09708c7cce596b1762,0,www.news.com.au,Weather: SES responds to hundreds of call-outs following rain deluge,"Large parts of Australia’s east coast continue to be lashed with rainfall as dangerous floodwaters surge, trapping residents and causing widespread flood warnings.",https://content.api.news/v3/images/bin/3deae5cd83afdbae18a689be6ce85346,2024-01-02T02:23:25Z,https://web.archive.org/web/20240102000405/https://www.news.com.au/technology/environment/ses-responds-to-hundreds-of-callouts-following-rain-deluge/news-story/e65c147e67e95a09708c7cce596b1762,"Large parts of Australia’s east coast continue to be lashed with rainfall as dangerous floodwaters surge, trapping residents and causing widespread flood warnings.
The Bureau of Meteorology has fore… [+7073 chars]",,en,Flood Australia,Precipitation,floodlist,Australia,CAU,Oceania
https://www.irishtimes.com/environment/climate-crisis/2024/01/02/storm-season-how-are-they-named-and-is-ireland-seeing-more-than-before/,https://www.irishtimes.com/environment/climate-crisis/2024/01/02/storm-season-how-are-they-named-and-is-ireland-seeing-more-than-before/,0,www.irishtimes.com,Storm season: How are they named and is Ireland seeing more than before?,Storms are occurring with a frequency unprecedented since storm naming began in 2015,https://www.irishtimes.com/resizer/pjKqJPt0lhlD0CHiVklpvvCDTKY=/1200x630/filters:format(jpg):quality(70)/cloudfront-eu-central-1.images.arcpublishing.com/irishtimes/HIBBCEK7NJB4RHP2SAZHGNAR3I.jpg,2024-01-02T05:00:00Z,https://web.archive.org/web/20240102145404/https://www.irishtimes.com/environment/climate-crisis/2024/01/02/storm-season-how-are-they-named-and-is-ireland-seeing-more-than-before/,"Ireland is experiencing a sustained period of storminess with seven named storms in just four months, including storm Gerrit which hit hard between Christmas and the new year.
The storm season is ch… [+7602 chars]",,en,storm,Storm,random,,,
https://www.news24.com/sport/cricket/proteas/test-match-man-bedingham-happy-to-bed-in-for-proteas-as-new-zealand-tour-storm-threatens-20240102,https://www.news24.com/sport/cricket/proteas/test-match-man-bedingham-happy-to-bed-in-for-proteas-as-new-zealand-tour-storm-threatens-20240102,0,www.news24.com,News24 | Test-match man Bedingham happy to bed in for Proteas as New Zealand tour storm threatens,Proteas batter David Bedingham will be part of the Proteas group that will head to New Zealand for two Tests and it's an opportunity he is grateful for.,https://cdn.24.co.za/files/Cms/General/d/10047/7598ae6b60304ed28227dce55d34a031.jpg,2024-01-02T07:50:28Z,,"It's hard to think that while eyes, ears and hearts should be focusing, and rightfully so, on the first post-Covid-19 New Year's Test with big crowds as India comes to town, the big cricket conversat… [+464 chars]",,en,Storm New Zealand,Storm,wmo,New Zealand,NZ,Oceania
https://timesofindia.indiatimes.com/world/rest-of-world/thousands-evacuated-following-indonesia-volcano-eruption/articleshow/106483306.cms,https://timesofindia.indiatimes.com/world/rest-of-world/thousands-evacuated-following-indonesia-volcano-eruption/articleshow/106483306.cms,0,timesofindia.indiatimes.com,Thousands evacuated following Indonesia volcano eruption,"Over 2,000 residents have been evacuated to temporary shelters due to increased volcanic activities in Mount Lewotobi Laki-Laki in eastern Indonesia. The volcano has erupted multiple times recently, with the latest eruption spewing volcanic ash 1.5 kilometers…","https://static.toiimg.com/thumb/msid-106483425,width-1070,height-580,imgsize-724840,resizemode-75,overlay-toi_sw,pt-32,y_pad-40/photo.jpg",2024-01-02T09:44:50Z,,Animals who eat their own babies,,en,volcano eruption,Volcano,random,,,
https://allafrica.com/stories/202401020367.html,https://allafrica.com/stories/202401020367.html,0,allafrica.com,The Brewing Red Sea Storm,"[Reporter] In the centuries and thousands of years before the advent of European civilization, the Red Sea and the Indian Ocean and its chokepoints always played pivotal roles in linking the civilizations of the East to that of Africa, (mostly the Horn of Afr…",https://cdn08.allafrica.com/static/images/structure/aa-logo-rgba-no-text-square.png,2024-01-02T10:39:55Z,,"In the centuries and thousands of years before the advent of European civilization, the Red Sea and the Indian Ocean and its chokepoints always played pivotal roles in linking the civilizations of th… [+10037 chars]",,en,Storm Horn,Storm,wmo,Austria,WCE,Europe
https://www.channelnewsasia.com/asia/thousands-evacuated-following-indonesia-volcano-eruption-4020986,https://www.channelnewsasia.com/asia/thousands-evacuated-following-indonesia-volcano-eruption-4020986,0,www.channelnewsasia.com,Thousands evacuated following Indonesia volcano eruption,"MAUMERE: More than 2,000 residents have been evacuated to temporary shelters amid heightened volcanic activities in a volcano in eastern Indonesia, a local official said on Tuesday (Jan 2). Mount Lewotobi Laki-Laki in East Nusa Tenggara province has erupted s…","https://onecms-res.cloudinary.com/image/upload/s--z4CgAj0O--/fl_relative,g_south_east,l_mediacorp:cna:watermark:2023-11:afp_watermark_14112023,w_0.1/f_auto,q_auto/c_fill,g_auto,h_676,w_1200/v1/mediacorp/cna/image/2024/01/02/000_349c8q2.jpg?itok=_tucn0zr",2024-01-02T10:52:28Z,,"MAUMERE: More than 2,000 residents have been evacuated to temporary shelters amid heightened volcanic activities in a volcano in eastern Indonesia, a local official said on Tuesday (Jan 2).
Mount Le… [+1665 chars]",,en,Volcano Indonesia,Volcano,eonet,Indonesia,SEA,Asia
https://www.bostonherald.com/2024/01/02/finland-and-sweden-set-this-winters-cold-records-as-temperature-plummets-below-minus-40/,https://www.bostonherald.com/2024/01/02/finland-and-sweden-set-this-winters-cold-records-as-temperature-plummets-below-minus-40/,0,www.bostonherald.com,Finland and Sweden set this winter’s cold records as temperature plummets below minus 40,Finland and Sweden recorded the coldest temperatures of the winter Tuesday as thermometers plummeted to minus 40 degrees Celsius (minus 40 Fahrenheit) as a result of a cold spell prevailing in the Nordic region.,https://www.bostonherald.com/wp-content/uploads/2024/01/Nordics_Weather_Cold_Spell_47520.jpg?w=1024&h=682,2024-01-02T11:39:48Z,,"By JARI TANNER (Associated Press)
HELSINKI (AP) Finland and Sweden recorded the coldest temperatures of the winter Tuesday as thermometers plummeted to minus 40 degrees Celsius (minus 40 Fahrenheit)… [+1914 chars]",,en,record cold,Cold Wave,random,,,
https://www.nakedcapitalism.com/2024/01/links-1-2-2024.html,https://www.nakedcapitalism.com/2024/01/links-1-2-2024.html,0,www.nakedcapitalism.com,Links 1/2/2024,"Our piquant daily lins: deer disease :-(, Ice Age children, travel risk map, moar Covid, redwood regrowth, US muscles Netherlands over China trade, SKorea opposition leader stabbed, Gaza infantry reduction, Russian shelline, evil uBlacklist, Assange hearing, …",https://www.nakedcapitalism.com/wp-content/uploads/2024/01/00-yawning-0780.jpg,2024-01-02T11:55:27Z,,"Dear patient readers,
Thanks SO MUCH for your speedy responses to our micro-mini fundraiser. We now have enough cash in the till to pay for more moderation. It’s gratifying to start off 2024 with yo… [+7766 chars]",,en,Ice China,Snow&Ice,wmo,China,EAS,Asia
https://www.bbc.co.uk/news/world-asia-67862306,https://www.bbc.co.uk/news/world-asia-67862306,0,www.bbc.co.uk,How Japan’s powerful earthquakes have shifted the land,The country has shifted more than a metre to the west following the earthquake this week.,https://ichef.bbci.co.uk/news/1024/branded_news/A38C/production/_132186814_6eea3347a8074cd8c9b96bdad5fe37dad93766840_537_5616_31595616x3159.jpg,2024-01-02T14:06:03Z,,"The power of the magnitude 7.5 quake in Japan can be seen in just how much the ground moved. 
It rose up by more than 4m (13ft) in places and moved sideways by over a metre. 
Earthquake-prone Japan… [+2692 chars]",,en,earthquake,Earthquake,random,,,
https://theweek.com/environment/japans-earthquake-compare-others-across-the-world,https://theweek.com/environment/japans-earthquake-compare-others-across-the-world,0,theweek.com,How did Japan's earthquake compare to others across the world?,"Relatively low death toll a testament to country's preparedness, say experts",https://cdn.mos.cms.futurecdn.net/XS5Z7zozHrWuwmY65pso8J-1200-80.jpg,2024-01-02T14:24:07Z,,"The death toll from the latest major earthquake to hit Japan is expected to rise even though fears of a 2004-style mega tsunami or 2011 Fukushima meltdown are receding.
The Japan Meteorological Agen… [+4568 chars]",,en,Earthquake Japan,Earthquake,usgs,Japan,EAS,Asia
https://www.dw.com/en/japan-earthquake-how-can-buildings-be-more-resilient/a-66793800,https://www.dw.com/en/japan-earthquake-how-can-buildings-be-more-resilient/a-66793800,0,www.dw.com,Japan earthquake: How can buildings be more resilient?,"When earthquakes occur, the resulting building collapses, no the tremors themselves, are what lead to high death tolls. How should buildings be constructed to prevent deaths and injuries?",https://static.dw.com/image/67873326_6.jpg,2024-01-03T10:01:00Z,,"The primary cause of death in an earthquake is not the shaking ground but crumbling roofs, crashing walls and collapsing buildings.  
This has been the case historically, even in Japan, where earthq… [+5498 chars]",,en,Earthquake Ie,Earthquake,usgs,Japan,EAS,Asia
https://www.bostonglobe.com/2024/01/03/world/extreme-cold-grips-nordics-breaking-25-year-record-sweden-coldest-january-night/,https://www.bostonglobe.com/2024/01/03/world/extreme-cold-grips-nordics-breaking-25-year-record-sweden-coldest-january-night/,0,www.bostonglobe.com,"Extreme cold grips the Nordics, breaking a 25-year record in Sweden for the coldest January night","Temperatures have fallen below minus 40 degrees Celsius in the Nordic region for a second day in a row, breaking a 25-year-old record for the coldest January night in Sweden as a cold spell grips the area.",https://bostonglobe-prod.cdn.arcpublishing.com/resizer/jDKX6rslCHaLyaSLyBrD8KbR-LA=/506x0/cloudfront-us-east-1.images.arcpublishing.com/bostonglobe/OIZLYQFRU7EKSNCHHANAH6JQKQ.jpg,2024-01-03T10:13:04Z,https://web.archive.org/web/20240103103646/https://www.bostonglobe.com/2024/01/03/world/extreme-cold-grips-nordics-breaking-25-year-record-sweden-coldest-january-night/,"COPENHAGEN, Denmark (AP) Temperatures fell below minus 40 degrees Celsius (minus 40 degrees Fahrenheit) in the Nordic region for a second day in a row Wednesday, breaking a 25-year-old record for the… [+1309 chars]",,en,record cold,Cold Wave,random,,,
https://www.newsweek.com/winter-weather-alerts-7-states-snow-west-coast-great-lakes-1857301,https://www.newsweek.com/winter-weather-alerts-7-states-snow-west-coast-great-lakes-1857301,0,www.newsweek.com,Winter Weather Alerts for 8 States as Mountain Snow Hits West Coast,"Heavy snow, rain and high surf are expected across the West Coast.",https://d.newsweek.com/en/full/2330655/snow-los-angeles.jpg,2024-01-03T11:10:19Z,,"Winter weather alerts are in place for parts of eight U.S. states as meteorologists predict an ""energetic"" jet stream will continue to bring snow and rain over the west while lake-effect snowfall con… [+3445 chars]",,en,heavy rain,Precipitation,random,,,
https://www.bbc.co.uk/news/uk-england-dorset-67872723,https://www.bbc.co.uk/news/uk-england-dorset-67872723,0,www.bbc.co.uk,Storm Henk: London Eye passenger describes roof hatch scare,David Nock and his family were mid-ride when a hatch blew open in their pod during Storm Henk.,https://ichef.bbci.co.uk/news/1024/branded_news/34ED/production/_132194531_p0h2rbkc.jpg,2024-01-03T12:50:49Z,,"Media caption, After getting off the London Eye, David Nock filmed the pod he was in with the hatch open
A London Eye passenger has described the ""harrowing"" moment a roof hatch began to blow off in… [+2662 chars]",,en,storm,Storm,random,,,
https://www.breitbart.com/europe/2024/01/03/sweden-records-coldest-january-evening-in-25-years/,https://www.breitbart.com/europe/2024/01/03/sweden-records-coldest-january-evening-in-25-years/,0,www.breitbart.com,Sweden Records Coldest January Evening in 25 Years,"Extreme cold and snowstorms disrupting transportation and closing schools in Scandinavia, as Sweden saw its coldest January night in 25 years.",https://media.breitbart.com/media/2024/01/GettyImages-1896850726-1-640x335.jpg,2024-01-03T13:11:21Z,https://web.archive.org/web/20240103132313/https://www.breitbart.com/europe/2024/01/03/sweden-records-coldest-january-evening-in-25-years/,"COPENHAGEN, Denmark (AP) – Europe experienced stark weather contrasts on Wednesday, with extreme cold and snowstorms disrupting transportation and closing schools in Scandinavia while strong winds an… [+3080 chars]",,en,Storm Sweden,Storm,meteo,Sweden,NEU,Europe
https://newatlas.com/architecture/icehotel-34-sweden/,https://newatlas.com/architecture/icehotel-34-sweden/,0,newatlas.com,Sweden's Icehotel opens for winter with fantastical frozen art,"Every December, Sweden's Icehotel hosts chilly hotel rooms that are decorated with wonderfully creative ice sculptures. This year's selection of frozen art is as stunning as always and ranges from intricate nature scenes to abstract forms depicting the birth …",https://assets.newatlas.com/dims4/default/e8fa431/2147483647/strip/true/crop/3000x1575+0+326/resize/1200x630!/quality/90/?url=http%3A%2F%2Fnewatlas-brightspot.s3.amazonaws.com%2Ff1%2Fab%2F340aad1c4a9680f0f8f612386cc4%2Fnebulass-child-deluxe-art-suite-by-edmund-chan-taitien-tan.%20ICEHOTEL%2034%2C%20Photo%20by%20-%20Asaf%20Kliger1--.jpg&na.image_optimisation=0,2024-01-03T14:17:57Z,,"Every December, Sweden's Icehotel hosts chilly hotel rooms that are decorated with wonderfully creative ice sculptures. This year's selection of frozen art is as stunning as always and ranges from in… [+1993 chars]",,en,Ice Sweden,Snow&Ice,wmo,Sweden,NEU,Europe
https://techxplore.com/news/2024-01-offshore-farms-seafood-production-breeze.html,https://techxplore.com/news/2024-01-offshore-farms-seafood-production-breeze.html,0,techxplore.com,"On offshore wind farms, seafood production may be a breeze","Off the coasts of Belgium, Denmark, Germany and the Netherlands dozens of wind farms whir away, helping Europe switch to renewable energy from fossil fuels.",https://scx2.b-cdn.net/gfx/news/hires/2022/offshore-wind-farm.jpg,2024-01-03T14:20:05Z,https://web.archive.org/web/20240103150718/https://techxplore.com/news/2024-01-offshore-farms-seafood-production-breeze.html,"Off the coasts of Belgium, Denmark, Germany and the Netherlands dozens of wind farms whir away, helping Europe switch to renewable energy from fossil fuels.
Some of those wind farms are also helping… [+7601 chars]",,en,Wind Netherlands,Storm,meteo,Netherlands,NEU,Europe
https://sputnikglobe.com/20240103/as-slose-partners-china-russia-will-build-up-strong-momentum-of-cooperation-in-2024-1115959291.html,https://sputnikglobe.com/20240103/as-slose-partners-china-russia-will-build-up-strong-momentum-of-cooperation-in-2024-1115959291.html,0,sputnikglobe.com,"As Сlose Partners, China, Russia Will Build Up Strong Momentum of Cooperation in 2024","Boosted by Russia's loosened visa policy, Chinese tourists are flocking to Russia's snow-clad northern cities in record numbers, as travel between the two countries are expected to continue to flourish in 2024.",https://cdn1.img.sputnikglobe.com/images/sharing/article/eng/1115959291.jpg?11149980941704293241,2024-01-03T14:47:20Z,,"Get the latest news from around the world, live coverage, off-beat stories, features and analysis.
https://sputnikglobe.com/20240103/as-slose-partners-china-russia-will-build-up-strong-momentum-of-c… [+11354 chars]",,en,Snow Russia,Snow&Ice,wmo,Russia,ESB,Europe
https://www.thestar.com.my/news/world/2024/01/03/northwest-europe-struggles-with-floods-and-snow-after-latest-atlantic-storm,https://www.thestar.com.my/news/world/2024/01/03/northwest-europe-struggles-with-floods-and-snow-after-latest-atlantic-storm,0,www.thestar.com.my,Northwest Europe struggles with floods and snow after latest Atlantic storm,"ARQUES, France (Reuters) - Parts of northwestern Europe struggled on Wednesday to cope with the impact of the latest in a series of Atlantic storms which dumped rain or snow on already saturated ground, while northern Scandinavia experienced extreme cold. Rea…",https://apicms.thestar.com.my/uploads/images/2024/01/03/2472557.jpg,2024-01-03T15:54:00Z,,"ARQUES, France (Reuters) - Parts of northwestern Europe struggled on Wednesday to cope with the impact of the latest in a series of Atlantic storms which dumped rain or snow on already saturated grou… [+2256 chars]",,en,Snow France,Snow&Ice,wmo,France,WCE,Europe
https://www.marketscreener.com/news/latest/Flooding-batters-parts-of-France-Germany-45668111/,https://www.marketscreener.com/news/latest/Flooding-batters-parts-of-France-Germany-45668111/,0,www.marketscreener.com,"Flooding batters parts of France, Germany","(marketscreener.com) STORY: In northern France, rescue crews helped evacuate residents from inundated homes in the town of Arques in the Pas-de-Calais department, a region that had flooded for the second time in two months after heavy rainfall.https://www.mar…",https://www.marketscreener.com/images/twitter_MS_fdnoir.png,2024-01-03T16:10:26Z,,"STORY: In northern France, rescue crews helped evacuate residents from inundated homes in the town of Arques in the Pas-de-Calais department, a region that had flooded for the second time in two mont… [+630 chars]",,en,Rain France,Precipitation,wmo,France,WCE,Europe
https://phys.org/news/2024-01-japan-latest-earthquake-couldve-worse.html,https://phys.org/news/2024-01-japan-latest-earthquake-couldve-worse.html,0,phys.org,"Japan's latest earthquake could've been much worse, but the country spends money to 'keep people safe'","On the first day of 2024, a 7.5 magnitude earthquake struck Japan, killing at least 57 people and destroying thousands of homes.",https://scx2.b-cdn.net/gfx/news/hires/2024/japan-houses.jpg,2024-01-03T16:56:04Z,,"On the first day of 2024, a 7.5 magnitude earthquake struck Japan, killing at least 57 people and destroying thousands of homes.
This is not the first time the East Asian nation has weathered such a… [+5545 chars]",,en,Earthquake Japan,Earthquake,usgs,Japan,EAS,Asia
https://economictimes.indiatimes.com/news/international/uk/extreme-cold-grips-nordic-countries-as-floods-hit-western-europe/articleshow/106523755.cms,https://economictimes.indiatimes.com/news/international/uk/extreme-cold-grips-nordic-countries-as-floods-hit-western-europe/articleshow/106523755.cms,0,economictimes.indiatimes.com,Extreme cold grips Nordic countries as floods hit western Europe,"For the second consecutive day, temperatures plummeted below minus 40 degrees Celsius (minus 40 degrees Fahrenheit) in the Nordic region. In Kvikkjokk-Arrenjarka, Swedish Lapland, the mercury hit a bone-chilling minus 43.6 C (minus 46.5 F), marking the lowest…","https://img.etimg.com/thumb/msid-106524106,width-1200,height-630,imgsize-202164,overlay-economictimes/photo.jpg",2024-01-03T16:59:12Z,,"Europe encountered dramatic weather disparities on Wednesday, as severe cold and snowstorms wreaked havoc in Scandinavia, while strong winds and heavy rain led to flooding and tragic consequences in … [+2553 chars]",,en,temperature plummet,Cold Wave,random,,,
https://www.dw.com/en/extreme-cold-temperatures-drop-below-minus-40-c-in-sweden/a-67881860,https://www.dw.com/en/extreme-cold-temperatures-drop-below-minus-40-c-in-sweden/a-67881860,0,www.dw.com,Extreme cold: Temperatures drop below minus 40 C in Sweden,"A frigid cold wave has swept Sweden and Finland, with temperatures in northern Sweden plunging to record lows. Rail and road traffic were substantially affected, with Norway and Denmark also impacted.",https://static.dw.com/image/67884359_6.jpg,2024-01-03T17:00:00Z,https://web.archive.org/web/20240103172414/https://www.dw.com/en/extreme-cold-temperatures-drop-below-minus-40-c-in-sweden/a-67881860,"Sweden recorded some of their coldest temperatures of the winter for a second day in a row Wednesday when thermometers plummeted as low as minus 40 degrees Celsius (minus 40 Fahrenheit).
The Swedish… [+2690 chars]",,en,record cold,Cold Wave,random,,,
https://www.dw.com/en/turkey-earthquakes-trial-over-collapsed-hotel-begins/a-67884130,https://www.dw.com/en/turkey-earthquakes-trial-over-collapsed-hotel-begins/a-67884130,0,www.dw.com,Turkey earthquakes: Trial over collapsed hotel begins,"A hotel owner is among those facing criminal charges over a fatal building collapse during the Turkish earthquakes last year. Prosecutors say the Grand Islas Hotel was shoddily built, leading to dozens being killed.",https://static.dw.com/image/67883988_6.jpg,2024-01-03T17:15:00Z,,"The first major criminal trial linked to the construction of buildings that collapsed in two massive earthquakes in Turkey last February started on Wednesday.
The four-star Grand Isias Hotel in the … [+1704 chars]",,en,Earthquake Turkey,Earthquake,usgs,Turkey,MED,Asia
https://www.businessinsider.com/finland-sweden-cold-celsius-fahrenheit-same-temperature-degrees-2024-1,https://www.businessinsider.com/finland-sweden-cold-celsius-fahrenheit-same-temperature-degrees-2024-1,0,www.businessinsider.com,It's so cold in Finland right now that Celsius and Fahrenheit are the same,Finland and Sweden recorded their coldest temperatures of the winter on Tuesday.,https://i.insider.com/65959ec31c5c7b8c9a0da7f0?width=1200&format=jpeg,2024-01-03T17:55:35Z,https://web.archive.org/web/20240104011417/https://www.businessinsider.com/finland-sweden-cold-celsius-fahrenheit-same-temperature-degrees-2024-1,"Finnish capital Helsinki is buried under snow this week, as a cold snap hit the country, sending temperatures plummeting.ALESSANDRO RAMPAZZO/ Getty Images
<ul><li>It's really, really, really cold in… [+2125 chars]",,en,record cold,Cold Wave,random,,,
https://www.voanews.com/a/extreme-cold-grips-nordic-countries-as-floods-hit-western-europe-/7425328.html,https://www.voanews.com/a/extreme-cold-grips-nordic-countries-as-floods-hit-western-europe-/7425328.html,0,www.voanews.com,Extreme Cold Grips Nordic Countries as Floods Hit Western Europe,"COPENHAGEN, Denmark — Europe experienced stark weather contrasts on Wednesday, with extreme cold and snowstorms disrupting transportation and closing schools in Scandinavia while strong winds and heavy rain in western Europe caused flooding and at least one d…",https://gdb.voanews.com/E7C5CA4E-A7A1-4349-9DB3-9FDA00EA9CC2.jpg,2024-01-03T19:42:06Z,,"COPENHAGEN, Denmark  Europe experienced stark weather contrasts on Wednesday, with extreme cold and snowstorms disrupting transportation and closing schools in Scandinavia while strong winds and heav… [+3107 chars]",,en,Wind Denmark,Storm,meteo,Denmark,NEU,Europe
