index,url,valid,domain,title,description,image,published,archive,content,quote,language,term,topic,feed,country,ipcc,continent
https://japantoday.com/category/features/environment/extreme-cold-grips-the-nordics-breaking-a-25-year-record-in-sweden-for-the-coldest-january-night,https://japantoday.com/category/features/environment/extreme-cold-grips-the-nordics-breaking-a-25-year-record-in-sweden-for-the-coldest-january-night,0,japantoday.com,Extreme cold grips the Nordics as floods hit to south,"Temperatures fell below minus 40 degrees Celsius in the Nordic region for a second day in a row Wednesday, with the coldest January temperature recorded in Sweden in 25 years. In Kvikkjokk-Årrenjarka in Swedish Lapland, the mercury dropped to minus 43.6 C, th…",,2024-01-03T22:02:19Z,,"Temperatures fell below minus 40 degrees Celsius in the Nordic region for a second day in a row Wednesday, with the coldest January temperature recorded in Sweden in 25 years.
In Kvikkjokk-Årrenjark… [+2081 chars]",,en,Flood Sweden,Flood,wmo,Sweden,NEU,Europe
https://en.antaranews.com/news/302358/earthquake-govt-to-prioritize-repair-of-sumedang-hospital-school,https://en.antaranews.com/news/302358/earthquake-govt-to-prioritize-repair-of-sumedang-hospital-school,0,en.antaranews.com,"Earthquake: Govt to prioritize repair of Sumedang hospital, school",Indonesia's Public Works and Housing Minister Basuki Hadimuljono stated that his ministry would prioritize the repair of Sumedang Public Hospital and SMAN 1 school buildings in the aftermath of a series of recent shallow ...,https://cdn.antaranews.com/cache/1200x800/2024/01/03/WhatsApp-Image-2024-01-03-at-22.28.46.jpg,2024-01-04T04:55:30Z,,"In general, structures of the buildings still look good, but we find several cracks. Therefore, we need to retrofit and beautify the buildings
Jakarta (ANTARA) - Indonesia's Public Works and Housing… [+3175 chars]",,en,Earthquake Indonesia,Earthquake,usgs,Indonesia,SEA,Asia
https://www.bostonglobe.com/2024/01/04/nation/major-storm-sweeping-us-is-expected-bring-heavy-rain-snow-east-coast-this-weekend/,https://www.bostonglobe.com/2024/01/04/nation/major-storm-sweeping-us-is-expected-bring-heavy-rain-snow-east-coast-this-weekend/,0,www.bostonglobe.com,"A major storm sweeping the US is expected to bring heavy rain, snow to East Coast this weekend",A winter weather system moving through the US is expected to wallop the East Coast this weekend with a mix of snow and freezing rain.,https://bostonglobe-prod.cdn.arcpublishing.com/resizer/1svbXC2f50JWzOuY4SnX31n7rYM=/506x0/cloudfront-us-east-1.images.arcpublishing.com/bostonglobe/L2DDRUIYLH2OAUAOSOLIBRCZVY.jpg,2024-01-04T05:12:52Z,,NEW YORK (AP) A winter weather system moving through the U.S. is expected to wallop the East Coast this weekend with a mix of snow and freezing rain from the southern Appalachians to the Northeast al… [+1132 chars],,en,heavy rain,Precipitation,random,,,
https://www.euronews.com/2024/01/04/europe-hit-by-extreme-cold-storms-and-flooding,https://www.euronews.com/2024/01/04/europe-hit-by-extreme-cold-storms-and-flooding,0,www.euronews.com,"Europe hit by extreme cold, storms and flooding","Some of the lowest temparatures so far this winter were recorded in the Nordic countries, Baltics and Russia on Wednesday.",https://static.euronews.com/articles/stories/08/14/99/00/1200x675_cmsv2_1c879553-31d2-5c60-a845-2501e722119e-8149900.jpg,2024-01-04T05:42:59Z,,"Some of the lowest temparatures so far this winter were recorded in the Nordic countries, Baltics and Russia on Wednesday. 
 Europe experienced stark weather contrasts on Wednesday, with extreme col… [+3468 chars]",,en,Storm Russia,Storm,wmo,Russia,ESB,Europe
https://consent.yahoo.com/v2/collectConsent?sessionId=1_cc-session_42627771-e74e-469b-98be-021a68a8b245,https://consent.yahoo.com/v2/collectConsent?sessionId=1_cc-session_42627771-e74e-469b-98be-021a68a8b245,0,consent.yahoo.com,"Hundreds of motorists stuck in snow overnight in southern Sweden, Denmark",,,2024-01-04T11:25:38Z,,"Si vous cliquez sur « Tout accepter », nos partenaires (y compris 243 qui font partie du Cadre de transparence et de consentement dIAB) et nous utiliserons également des témoins et vos données person… [+982 chars]",,en,Snow Denmark,Snow&Ice,wmo,Denmark,NEU,Europe
https://economictimes.indiatimes.com/news/international/uk/extreme-cold-grips-nordic-countries-snowstorms-disrupt-travel-and-schools/articleshow/106548811.cms,https://economictimes.indiatimes.com/news/international/uk/extreme-cold-grips-nordic-countries-snowstorms-disrupt-travel-and-schools/articleshow/106548811.cms,0,economictimes.indiatimes.com,Extreme cold grips Nordic countries; snowstorms disrupt travel and schools,"In northern Sweden, temperatures plummeted below -40C for the second consecutive day on Wednesday. On Tuesday night, Kvikkjokk-Årrenjarka in Swedish Lapland recorded -43.6C, marking the lowest January temperature in the country in 25 years.","https://img.etimg.com/thumb/msid-106548833,width-1200,height-630,imgsize-308304,overlay-economictimes/photo.jpg",2024-01-04T12:23:58Z,,"In Sweden, where exceptionally low temperatures have been registered this week, rescue services and the military collaborated on Thursday morning to extricate passengers from approximately 1,000 vehi… [+2507 chars]",,en,Storm Sweden,Storm,meteo,Sweden,NEU,Europe
https://www.insurancejournal.com/news/international/2024/01/04/754331.htm,https://www.insurancejournal.com/news/international/2024/01/04/754331.htm,0,www.insurancejournal.com,"January’s Property Cat Renewals See Biggest Price Hikes in Turkey, Italy and US","While the reinsurance market indeed stabilized during the January 2024 reinsurance renewals (from the chaotic January renewals of last year), buyers with loss-affected programs experienced further upward pressure on retentions and prices, according to reinsur…",https://www.insurancejournal.com/app/uploads/2024/01/supercell-thunderstorm-in-american-plains-52267417-bigstock-scaled.jpg,2024-01-04T13:15:10Z,,"While the reinsurance market indeed stabilized during the January 2024 reinsurance renewals (from the chaotic January renewals of last year), buyers with loss-affected programs experienced further up… [+4767 chars]",,en,Ice Italy,Snow&Ice,wmo,Italy,MED,Europe
https://abcnews.go.com/International/video/eyewitness-captures-harrowing-escape-landslide-japan-quake-106097662,https://abcnews.go.com/International/video/eyewitness-captures-harrowing-escape-landslide-japan-quake-106097662,0,abcnews.go.com,WATCH: Eyewitness captures harrowing escape from landslide following Japan quake,Terrifying eyewitness footage shows Wajima residents escaping from a landslide after a deadly earthquake struck the Japanese city.,https://i.abcnewsfe.com/a/bada947f-a44d-432b-9d41-06a25fe9085c/240104_abc_social_japan_landslide1_hpMain_16x9.jpg?w=992,2024-01-04T13:16:24Z,,"<ul><li>Whats next for Russia? 
</li><li>What comes next after Texas school shooting?
</li><li>What's next for abortion rights in America?
</li><li>The new battle for voting rights
</li><li>How w… [+2284 chars]",,en,landslide,Landslide,random,,,
https://www.nationalobserver.com/2024/01/04/news/thousands-without-power-nordic-countries-floods-swamp-germany,https://www.nationalobserver.com/2024/01/04/news/thousands-without-power-nordic-countries-floods-swamp-germany,0,www.nationalobserver.com,Thousands without power in Nordic countries while floods swamp Germany,"Extremely cold temperatures compounded by gale-force winds and snow wreaked havoc across the Nordic region on Thursday, leaving thousands without power while others braved the cold for hours stuck in their cars along clogged highways.",https://www.nationalobserver.com/sites/nationalobserver.com/files/styles/nat_social/public/img/2024/01/04/2024010406018-65969231ab0e128c09868df6jpeg.jpg?itok=rFQbhfLD,2024-01-04T13:28:20Z,,"Extremely cold temperatures compounded by gale-force winds and snow wreaked havoc across the Nordic region Thursday, leaving thousands without power while others braved the cold for hours stuck in th… [+3539 chars]",,en,Wind Germany,Storm,meteo,Germany,WCE,Europe
https://www.nbcnews.com/news/weather/winter-wonderland-wet-roadways-will-see-rain-snow-weekend-winter-storm-rcna132239,https://www.nbcnews.com/news/weather/winter-wonderland-wet-roadways-will-see-rain-snow-weekend-winter-storm-rcna132239,0,www.nbcnews.com,Winter wonderland or wet roadways? Who will see more rain than snow with the weekend winter storm?,"Whether it’s rain, snow or a wintry mix, one thing is certain: It’ll be a messy weekend for the East Coast.","https://media-cldnry.s-nbcnews.com/image/upload/t_nbcnews-fp-1200-630,f_auto,q_auto:best/rockcms/2024-01/240104-noaa-weather-mn-0940-37192e.jpg",2024-01-04T16:59:55Z,,"Whether its rain, snow or a wintry mix, one thing is certain: Itll be a messy weekend for the East Coast. 
On Thursday morning, the storm system that is expected to affect the East Coast was out Wes… [+3399 chars]",,en,storm,Storm,random,,,
https://www.pcgamer.com/final-fantasy-14-suspends-player-housing-demolition-across-japanese-servers-following-major-earthquake/,https://www.pcgamer.com/final-fantasy-14-suspends-player-housing-demolition-across-japanese-servers-following-major-earthquake/,0,www.pcgamer.com,"Final Fantasy 14 suspends player housing demolition across Japanese servers, following major earthquake","The earthquake struck the Noto Peninsula on New Year's Day, while rescue attempts are ongoing.",https://cdn.mos.cms.futurecdn.net/QouQLXav7ZFL7ezRJ6DTyL-1200-80.png,2024-01-04T17:06:02Z,,"Square Enix has suspended its housing demolition process in Final Fantasy 14, following an earthquake in the Noto Peninsula of Japan on New Year's Day. The 7.6 magnitude earthquake has left thousands… [+1812 chars]",,en,earthquake,Earthquake,random,,,
https://www.insurancejournal.com/news/international/2024/01/04/754410.htm,https://www.insurancejournal.com/news/international/2024/01/04/754410.htm,0,www.insurancejournal.com,Extreme Cold Grips Nordic Countries as Floods Hit Western Europe,"Europe experienced stark weather contrasts on Wednesday, with extreme cold and snowstorms disrupting transportation and closing schools in Scandinavia while strong winds and heavy rain in western Europe caused flooding and at least one death. Temperatures fel…",https://www.insurancejournal.com/app/uploads/2024/01/people-rescued-from-houseboats-in-northampton-england-AP-scaled.jpg,2024-01-04T17:24:35Z,,"Europe experienced stark weather contrasts on Wednesday, with extreme cold and snowstorms disrupting transportation and closing schools in Scandinavia while strong winds and heavy rain in western Eur… [+3657 chars]",,en,heavy rain,Precipitation,random,,,
https://www.irishtimes.com/business/2024/01/04/public-finances-2023-may-go-down-as-tax-sweet-spot-but-storm-clouds-loom/,https://www.irishtimes.com/business/2024/01/04/public-finances-2023-may-go-down-as-tax-sweet-spot-but-storm-clouds-loom/,0,www.irishtimes.com,Public finances: 2023 may go down as tax sweet spot but storm clouds loom,Department’s record exchequer numbers for the year just ended may be as good as it gets,https://www.irishtimes.com/resizer/Vde0TQreOyUHCXiEjh_MHbop3I4=/1200x630/filters:format(jpg):quality(70)/cloudfront-eu-central-1.images.arcpublishing.com/irishtimes/6YQWYMKEASYDGRKYSLLRDYJCSQ.jpg,2024-01-04T19:02:36Z,,"Last year marked the third consecutive year of record-breaking Irish tax yields, with 88.1 billion collected and a near record general government surplus of 7.8 billion, equivalent to almost 3 per ce… [+2398 chars]",,en,storm,Storm,random,,,
https://thegatewithbriancohen.com/winter-storm-to-affect-northeastern-united-states-january-2024-travel-alert/,https://thegatewithbriancohen.com/winter-storm-to-affect-northeastern-united-states-january-2024-travel-alert/,0,thegatewithbriancohen.com,Winter Storm to Affect Northeastern United States: January 2024 Travel Alert,"Due to the latest weather system, consider ensuring that you have alternate travel plans ready to be implemented because a winter storm to affect northeastern United States January 2024 — and a small portion of southeastern Canada will be affected as well.
Th…",https://thegatewithbriancohen.com/wp-content/uploads/2024/01/US-28.png,2024-01-05T01:03:43Z,,"Due to the latest weather system, consider ensuring that you have alternate travel plans ready to be implemented because a winter storm to affect northeastern United States January 2024 and a small p… [+4704 chars]",,en,Storm Canada,Storm,wmo,Canada,NEN,North-America
https://www.abc.net.au/news/2024-01-05/extreme-cold-leaves-thousands-without-power-in-nordic-countries/103287512,https://www.abc.net.au/news/2024-01-05/extreme-cold-leaves-thousands-without-power-in-nordic-countries/103287512,0,www.abc.net.au,Extreme cold leaves thousands without power in northern Europe as floods persist in Germany and France,"Extremely cold temperatures, snow and gale-force winds wreak havoc across the Nordic region, while heavy rain continues to cause more flooding in Germany, France and the Netherlands.",https://live-production.wcms.abc-cdn.net.au/c477659b55f607058fe11926a7ea7809?impolicy=wcms_crop_resize&cropH=2285&cropW=4063&xPos=0&yPos=212&width=862&height=485,2024-01-05T01:37:43Z,,"Extremely cold temperatures compounded by gale-force winds and snow have wreaked havoc across the Nordic region, leaving thousands without power while others braved the cold for hours stuck in cars a… [+5416 chars]",,en,Rain Germany,Precipitation,meteo,Germany,NEU,Europe
https://www.ibtimes.com/year-brazil-high-court-judge-blames-bolsonaro-jan-8-riots-3721561,https://www.ibtimes.com/year-brazil-high-court-judge-blames-bolsonaro-jan-8-riots-3721561,0,www.ibtimes.com,"A Year On, Brazil High Court Judge Blames Bolsonaro For Jan 8 Riots","A year after Jair Bolsonaro supporters stormed the seat of power in Brazil, the senior justice on the country's Supreme Court says the far-right ex-president bears ""unequivocal"" responsibility for the unrest.",https://d.ibtimes.com/en/full/4504989/january-8-2023-riot-brasilia-supporters-far-right-former-president-jair-bolsonaro-stunned.jpg,2024-01-05T02:00:29Z,,"A year after Jair Bolsonaro supporters stormed the seat of power in Brazil, the senior justice on the country's Supreme Court says the far-right ex-president bears ""unequivocal"" responsibility for th… [+4417 chars]",,en,Storm Brazil,Storm,wmo,Brazil,SAM,South-America
https://www.voanews.com/a/extreme-cold-leaves-thousands-without-power-in-nordic-countries-/7427617.html,https://www.voanews.com/a/extreme-cold-leaves-thousands-without-power-in-nordic-countries-/7427617.html,0,www.voanews.com,Extreme Cold Leaves Thousands Without Power in Nordic Countries,"COPENHAGEN, Denmark — Extremely cold temperatures compounded by gale-force winds and snow wreaked havoc across the Nordic region Thursday, leaving thousands without power while others braved the cold for hours stuck in their cars along clogged highways.


Hea…",https://gdb.voanews.com/2B74691B-33F3-416F-9D5C-3852C3848360.jpg,2024-01-05T04:26:25Z,,"COPENHAGEN, Denmark  Extremely cold temperatures compounded by gale-force winds and snow wreaked havoc across the Nordic region Thursday, leaving thousands without power while others braved the cold … [+4100 chars]",,en,Snow Denmark,Snow&Ice,wmo,Denmark,NEU,Europe
https://nation.africa/kenya/business/kenya-s-spending-on-food-imports-exceeds-machinery-by-sh61bn-4482310,https://nation.africa/kenya/business/kenya-s-spending-on-food-imports-exceeds-machinery-by-sh61bn-4482310,0,nation.africa,Kenya’s spending on food imports exceeds machinery by Sh61bn,<p>Food production in Kenya was hampered by drought and high prices of inputs.</p>,https://nation.africa/resource/image/4482320/landscape_ratio3x2/1200/800/e7570e2917ff6602e44cc73f7017f315/xO/imported-maize.jpg,2024-01-05T04:40:33Z,,"Kenyas expenditure on food imports jumped by nearly Sh100 billion in the 12 months to September 2023, underlining the devastating impact of prolonged drought and disruptions in global supply chains o… [+2054 chars]",,en,drought,Drought,random,,,
https://omny.fm/shows/bloomberg-daybreak/winter-snowstorm-wall-street-braces-for-jobs-repor,https://omny.fm/shows/bloomberg-daybreak/winter-snowstorm-wall-street-braces-for-jobs-repor,0,omny.fm,Winter Snowstorm Ahead; Wall Street Braces for Jobs Report; Blinken to Visit Middle East,"On today's podcast:
1) New York City and Boston are straddling the line between what could be a snowy weekend or just a lot of rainhttps://www.bloomberg.com/news/articles/2024-01-04/us-east-coast-braces-for-weekend-snow-or-rain-weather-watch from a system swe…",https://omny.fm/shows/bloomberg-daybreak/winter-snowstorm-wall-street-braces-for-jobs-repor/image.jpg?t=1673277911&size=wideShare,2024-01-05T10:37:10Z,https://web.archive.org/web/20240105113751/https://omny.fm/shows/bloomberg-daybreak/winter-snowstorm-wall-street-braces-for-jobs-repor,"On today's podcast:
1) New York City and Boston are straddling the line between what could be a snowy weekend or just a lot of rainhttps://www.bloomberg.com/news/articles/2024-01-04/us-east-coast-br… [+24034 chars]",,en,storm,Storm,random,,,
https://www.newsweek.com/winter-storm-warning-7-states-heavy-snow-texas-1858028,https://www.newsweek.com/winter-storm-warning-7-states-heavy-snow-texas-1858028,0,www.newsweek.com,Winter Storm Warnings Issued for 7 States With Snow To Hit Texas,The West Coast and Great Plains will see two precipitation-laden storms into the weekend.,https://d.newsweek.com/en/full/2331721/snow-texas.jpg,2024-01-05T12:04:27Z,,"Winter storm warnings are in place for parts of seven states as meteorologists predict a ""dynamic storm system"" will bring snow to the Great Plains, with snowfall expected in the Texas panhandle.
Th… [+3924 chars]",,en,storm,Storm,random,,,
https://www.bostonglobe.com/2024/01/05/metro/massachusetts-storm-watch-in-effect/,https://www.bostonglobe.com/2024/01/05/metro/massachusetts-storm-watch-in-effect/,0,www.bostonglobe.com,"Winter storm watch in effect for most of Mass., R.I.","A powerful storm system that could drop as much as a foot of snow in some parts of Massachusetts, Rhode Island, and Connecticut is expected to arrive Saturday evening, the National Weather Service said Friday.",https://bostonglobe-prod.cdn.arcpublishing.com/resizer/Wa_yUaDazgoO6wGGrhP2mpMbN7E=/506x0/cloudfront-us-east-1.images.arcpublishing.com/bostonglobe/7QBQITHXHUX7AI5Q3VGZ7OXVQY.jpg,2024-01-05T12:20:42Z,,"A powerful storm system that could drop as much as a foot of snow in some parts of Massachusetts, Rhode Island, and Connecticut is expected to arrive Saturday evening and dominate the area for the re… [+2281 chars]",,en,Storm Rhode Island,Storm,fema,United States,ENA,North-America
https://www.celebitchy.com/851703/prince_frederik_mary_were_apparently_frosty_with_one_another_at_an_event/,https://www.celebitchy.com/851703/prince_frederik_mary_were_apparently_frosty_with_one_another_at_an_event/,0,www.celebitchy.com,Prince Frederik & Mary were apparently ‘frosty’ with one another at an event,"These photos are from Wednesday, at a New Year’s reception in Denmark’s Christiansborg Palace. Queen Margrethe attended, as did Prince Frederik and Princess Mary. They will not officially be king and queen until January 14th. Rumors have been circulating all …",,2024-01-05T13:00:46Z,,"These photos are from Wednesday, at a New Years reception in Denmarks Christiansborg Palace. Queen Margrethe attended, as did Prince Frederik and Princess Mary. They will not officially be king and q… [+5369 chars]",,en,Frost Denmark,Snow&Ice,wmo,Denmark,NEU,Europe
https://www.atlasobscura.com/articles/natural-wonders-atlas-obscura-podcast-episodes,https://www.atlasobscura.com/articles/natural-wonders-atlas-obscura-podcast-episodes,0,www.atlasobscura.com,5 of Our Favorite Podcast Episodes Celebrating Earth's Natural Wonders,"From everlasting lightning storms to magnificent bioluminescence, these classic episodes will delight and intrigue you. Everywhere we look in the world, there's something awe-inspiring, and we love exploring natural phenomena wherever they happen. Take a look…",https://img.atlasobscura.com/ACmkNkb4c-XkEwFH84aHXezFd7z5OF3eXQE9UA6SBcU/rt:fit/w:600/q:81/sm:1/scp:1/ar:1/aHR0cHM6Ly9hdGxh/cy1kZXYuczMuYW1h/em9uYXdzLmNvbS91/cGxvYWRzL2Fzc2V0/cy9jNDUxYzE2Ny04/YTlkLTRhODMtODJk/Mi00N2UwYjdmNzQ0/MjlkZTRlNzg5Yjkw/NTBmYTAxY2VfZjg1/NjJkZjMtMmNiYi00/OTViLThiZjEtZDkz/ZTFiMGE1MTA5Mjhj/MWUyNmNjMzNjMGRi/Njk1X1JlbGFtcGFn/b19kZWxfY2F0YXR1/bWJvX29ic2VydmFk/b19kZXNkZV9iYWNo/YXF1ZXJvLTMuanBn.jpg,2024-01-05T16:00:00Z,,"Everywhere we look in the world, there’s something awe-inspiring, and we love exploring natural phenomena wherever they happen. Take a look back at some our favorite wild wonders through this collect… [+1189 chars]",,en,storm,Storm,random,,,
https://www.globalresearch.ca/christmas-week-palestine-coming-storm-upon-us/5844344,https://www.globalresearch.ca/christmas-week-palestine-coming-storm-upon-us/5844344,0,www.globalresearch.ca,In 2023 Bethlehem Was a Solemn Ghost Town: The Coming Storm Is Upon Us. The Irreversible Destruction of Western Civilization is Underway”,"All Global Research articles can be read in 51 languages by activating the Translate Website button below the author’s name (only available in desktop version).
To receive Global Research’s Daily Newsletter (selected articles), click here.
Click the share but…",https://www.globalresearch.ca/wp-content/uploads/2023/12/us-hegemony-israel-palestine.jpg,2024-01-05T16:55:21Z,,"All Global Research articles can be read in 51 languages by activating the Translate Website button below the authors name (only available in desktop version).
To receive Global Researchs Daily News… [+9410 chars]",,en,storm,Storm,random,,,
https://cleantechnica.com/2024/01/05/involuntary-test-of-camper-mode-in-one-of-denmarks-200000-evs/,https://cleantechnica.com/2024/01/05/involuntary-test-of-camper-mode-in-one-of-denmarks-200000-evs/,0,cleantechnica.com,"A Test Of Camper Mode In A Blizzard In One Of Denmark’s 200,000 EVs","My wait for the 2023 numbers for auto sales in Denmark got interrupted by a blizzard so violent in my ... [continued]
The post A Test Of Camper Mode In A Blizzard In One Of Denmark’s 200,000 EVs appeared first on CleanTechnica.",https://cleantechnica.com/wp-content/uploads/2024/01/m3_blizzard_1.jpeg,2024-01-05T17:05:20Z,https://web.archive.org/web/20240105185715/https://cleantechnica.com/2024/01/05/involuntary-test-of-camper-mode-in-one-of-denmarks-200000-evs/,"Sign up for daily news updates from CleanTechnica on email. Or follow us on Google News!
My wait for the 2023 numbers for auto sales in Denmark got interrupted by a blizzard so violent in my part of… [+4299 chars]",,en,blizzard,Storm,random,,,
https://www.thestar.com.my/news/world/2024/01/06/drought-in-northern-ethiopia-affects-18-mln-people,https://www.thestar.com.my/news/world/2024/01/06/drought-in-northern-ethiopia-affects-18-mln-people,0,www.thestar.com.my,Drought in northern Ethiopia affects 1.8 mln people,"ADDIS ABABA, Jan. 5 (Xinhua) -- Drought conditions in Ethiopia's northern region of Amhara have affected more than 1.8 million people, an Ethiopian official said Friday. Read full story",https://cdn.thestar.com.my/Themes/img/newTsol_logo_socmedia.png,2024-01-05T17:19:00Z,,"ADDIS ABABA, Jan. 5 (Xinhua) -- Drought conditions in Ethiopia's northern region of Amhara have affected more than 1.8 million people, an Ethiopian official said Friday.
 Tesfaw Batabl, commissioner… [+791 chars]",,en,drought,Drought,random,,,
https://www.nbcnews.com/news/weather/winter-storm-northeast-mid-atlantic-hazards-30-million-people-rcna132468,https://www.nbcnews.com/news/weather/winter-storm-northeast-mid-atlantic-hazards-30-million-people-rcna132468,0,www.nbcnews.com,Northeast bracing for first major winter storm of the season,More than 30 million people are under winter alerts as the Northeast braces for its first significant winter storm of the season.,"https://media-cldnry.s-nbcnews.com/image/upload/t_nbcnews-fp-1200-630,f_auto,q_auto:best/rockcms/2024-01/20240105-winter-storm-sj-1008-0ba8cd.jpg",2024-01-05T17:27:42Z,http://wayback.archive-it.org/all/20240108005104/https://www.nbcnews.com/news/weather/winter-storm-northeast-mid-atlantic-hazards-30-million-people-rcna132468,"More than 30 million people are under winter alerts as the Northeast braces for its first major winter storm of the season. Snow, ice and gusty winds will make for hazardous conditions this weekend f… [+5597 chars]",,en,storm,Storm,random,,,
https://www.marketwatch.com/story/retailers-could-suffer-perfect-storm-of-red-sea-and-panama-canal-disruption-says-logistics-expert-93027161,https://www.marketwatch.com/story/retailers-could-suffer-perfect-storm-of-red-sea-and-panama-canal-disruption-says-logistics-expert-93027161,0,www.marketwatch.com,"Retailers could suffer ‘perfect storm’ of Red Sea and Panama Canal disruption, says logistics expert","Global supply chains are under pressure from the Houthi attacks in the Red Sea and the Panama Canal drought, says logistics expert Mike Giambrone",https://images.mktw.net/im-93650097/social,2024-01-05T18:23:00Z,,"The Houthi attacks on cargo ships in the Red Sea and the drought afflicting the Panama Canal have created a perfect storm of disruption in global shipping, according to Mike Giambrone, an account exe… [+5399 chars]",,en,storm,Storm,random,,,
