index,url,valid,domain,title,description,image,published,archive,content,quote,language,term,topic,feed,country,ipcc,continent
https://www.cnn.com/2024/01/10/us/5-things-to-know-for-jan-10-gop-debate-winter-storm-boeing-israel-ecuador/index.html,https://www.cnn.com/2024/01/10/us/5-things-to-know-for-jan-10-gop-debate-winter-storm-boeing-israel-ecuador/index.html,0,www.cnn.com,"5 things to know for Jan. 10: GOP debate, Winter storm, Boeing, Israel, Ecuador | CNN","5 things to know for Jan. 10: GOP debate, Winter storm, Boeing, Israel, Ecuador | CNNcnn.com","https://media.cnn.com/api/v1/images/stellar/prod/240109220918-02-nikki-haley-ron-desantis-split.jpg?c=16x9&q=w_800,c_fill",2024-01-10T13:48:22Z,,"Meta is rolling out new restrictions for teenage Facebook and Instagram users, including hiding search results for certain terms. This comes as social media platforms have faced a litany of criticism… [+5800 chars]",,en,Storm Ecuador,Storm,wmo,Ecuador,NWS,South-America
https://phys.org/news/2024-01-worsened-global-droughts-wildfires.html,https://phys.org/news/2024-01-worsened-global-droughts-wildfires.html,0,phys.org,"Record heat in 2023 worsened global droughts, floods and wildfires","Record heat across the world profoundly impacted the global water cycle in 2023, contributing to severe storms, floods, megadroughts and bushfires, new research from The Australian National University (ANU) shows.",https://scx2.b-cdn.net/gfx/news/2024/record-heat-in-2023-wo.jpg,2024-01-10T21:20:01Z,,"Record heat across the world profoundly impacted the global water cycle in 2023, contributing to severe storms, floods, megadroughts and bushfires, new research from The Australian National Universit… [+4531 chars]",,en,flood Australia,Flood,aidr,Australia,SAU,Oceania
https://www.france24.com/en/live-news/20240111-world-cup-stars-morocco-seek-end-to-48-year-african-trophy-drought,https://www.france24.com/en/live-news/20240111-world-cup-stars-morocco-seek-end-to-48-year-african-trophy-drought,0,www.france24.com,World Cup stars Morocco seek end to 48-year African trophy drought,"In the second and last tournament decided by a mini-league, Morocco snatched a late 1-1 draw with Guinea to finish first in Ethiopia. 

As Moroccans celebrated conquering Africa then, few could have imagined that 48 years later the Atlas Lions would still be …",https://s.france24.com/media/display/70e19d2e-b037-11ee-8fab-005056bfb2b6/w:1280/p:16x9/46efe8b3f1e63fda7c6f84f1a37ff141dda3e83f.jpg,2024-01-11T04:11:07Z,,Abidjan (AFP) Morocco coach Walid Regragui was just five months and 20 days old when the country won the Africa Cup of Nations for the only time in 1976. In the second and last tournament decided by … [+3163 chars],,en,drought,Drought,random,,,
https://www.ibtimes.com/world-cup-stars-morocco-seek-end-48-year-african-trophy-drought-3721849,https://www.ibtimes.com/world-cup-stars-morocco-seek-end-48-year-african-trophy-drought-3721849,0,www.ibtimes.com,World Cup Stars Morocco Seek End To 48-year African Trophy Drought,Morocco coach Walid Regragui was just five months and 20 days old when the country won the Africa Cup of Nations for the only time in 1976.,https://d.ibtimes.com/en/full/4505641/morocco-coach-walid-regragui-speaks-press-conference-ivory-coast.jpg,2024-01-11T04:15:24Z,,"Morocco coach Walid Regragui was just five months and 20 days old when the country won the Africa Cup of Nations for the only time in 1976.
In the second and last tournament decided by a mini-league… [+3132 chars]",,en,Drought Morocco,Drought,edo,Morocco,MED,Africa
https://www.forbes.com/sites/sanammahoozi/2024/01/11/irans-next-door-neighbor-accused-of-stealing-rain-clouds-as-severe-drought-sweeps-through-the-country/,https://www.forbes.com/sites/sanammahoozi/2024/01/11/irans-next-door-neighbor-accused-of-stealing-rain-clouds-as-severe-drought-sweeps-through-the-country/,0,www.forbes.com,Iran’s Next-Door Neighbor Accused Of Stealing Rain Clouds As Severe Drought Sweeps Through The Country,"What seems to be a stark difference in rainfall and snowfall patterns between two neighboring countries, has since raised questions among Iranians as to why.",https://imageio.forbes.com/specials-images/imageserve/65a05a024d7216bc9ae06242/0x0.jpg?format=jpg&height=900&width=1600&fit=bounds,2024-01-12T00:00:38Z,,"11/01/2023 Urmia, Iran. A view of Lake Urmia, one of the largest saltwater lakes in the world, which ... [+] is located in the northwest of Iran, while the drought has affected the entire country and… [+8788 chars]",,en,Drought Iran,Drought,edo,Iran,WCA,Asia
https://www.ndtv.com/offbeat/video-of-electric-blue-flame-erupting-from-a-volcano-goes-viral-4848036,https://www.ndtv.com/offbeat/video-of-electric-blue-flame-erupting-from-a-volcano-goes-viral-4848036,0,www.ndtv.com,Video Of Electric Blue Flame Erupting From A Volcano Goes Viral,"The Kawah Ijen volcano in Indonesia is like any other, but the blue lava phenomenon is caused by abundance of sulphur pockets in the rock.",https://c.ndtvimg.com/2024-01/72sk0p9o_indonesia-blue-lava_625x300_12_January_24.jpeg?ver-20231203.06,2024-01-12T07:48:00Z,,"The unusual blue glow of the volcano has gone viral.
A stunning video of electric-blue flames erupting from a volcano in Indonesia has surprised social media users. The phenomenon is unique, accordi… [+2513 chars]",,en,Volcano Indonesia,Volcano,eonet,Indonesia,SEA,Asia
https://www.thestar.com.my/news/world/2024/01/13/prolonged-drought-challenges-humanitarian-response-in-ethiopia-un,https://www.thestar.com.my/news/world/2024/01/13/prolonged-drought-challenges-humanitarian-response-in-ethiopia-un,0,www.thestar.com.my,Prolonged drought challenges humanitarian response in Ethiopia: UN,"ADDIS ABABA, Jan. 12 (Xinhua) -- The prolonged drought has challenged the humanitarian response in Ethiopia as the drought situation worsened in the last months of 2023, the United Nations High Commissioner for Refugees (UNHCR) has said. Read full story",https://cdn.thestar.com.my/Themes/img/newTsol_logo_socmedia.png,2024-01-12T18:22:00Z,,"ADDIS ABABA, Jan. 12 (Xinhua) -- The prolonged drought has challenged the humanitarian response in Ethiopia as the drought situation worsened in the last months of 2023, the United Nations High Commi… [+2260 chars]",,en,drought,Drought,random,,,
https://news.sky.com/story/snow-set-to-cause-disruption-as-britain-braces-for-week-of-freezing-temperatures-13047965,https://news.sky.com/story/snow-set-to-cause-disruption-as-britain-braces-for-week-of-freezing-temperatures-13047965,0,news.sky.com,Snow set to cause disruption as Britain braces for week of freezing temperatures,Snow is set to hit parts of Scotland today before spreading south next week as cold air from the Arctic brings freezing temperatures.,https://e3.365dm.com/24/01/1600x900/skynews-ben-nevis-golden-harvest_6418978.jpg?20240112075646,2024-01-14T03:01:00Z,,"Snow is set to hit parts of Scotland today before spreading south next week as cold air from the Arctic brings freezing temperatures.
Up to 5cm of snow is expected in places by the end of Sunday, ca… [+1362 chars]",,en,freezing,Snow&Ice,random,,,
https://www.independent.ie/irish-news/snow-showers-likely-with-sub-zero-temperatures-to-last-the-week-met-eireann-warns-of-icy-roads/a921135801.html,https://www.independent.ie/irish-news/snow-showers-likely-with-sub-zero-temperatures-to-last-the-week-met-eireann-warns-of-icy-roads/a921135801.html,0,www.independent.ie,"Snow showers likely with sub-zero temperatures to last the week, Met Éireann warns of icy roads","Ireland could be in for snow tomorrow, with motorists being warned of potentially icy stretches on their morning and evening commute this week.",https://focus.independent.ie/thumbor/Bm2HE1XipmKCPZDas4u7LqQ8Byc=/60x0:735x450/675x450/prod-mh-ireland/c7406a84-33f4-46ed-9969-d0966f820c0f/bf2182b6-3de1-4fff-9c8b-5050150c4c44/video/video.jpg,2024-01-15T02:30:00Z,,"Motorists being warned of potentially icy stretches on their morning and evening commute this weekSnow could hit Ireland on TuesdayIreland could be in for snow tomorrow, with motorists being warned o… [+2825 chars]",,en,Snow Ireland,Snow&Ice,wmo,Ireland,NEU,Europe
https://news.sky.com/story/uk-weather-severe-alert-on-the-roads-as-freezing-temperatures-and-snow-forecast-13048657,https://news.sky.com/story/uk-weather-severe-alert-on-the-roads-as-freezing-temperatures-and-snow-forecast-13048657,0,news.sky.com,'Severe' alert on the roads as freezing temperatures and snow hit UK,"Drivers could end up stranded or delayed this week as freezing temperatures hit the UK - with National Highways issuing a ""severe weather alert"" for snow.",https://e3.365dm.com/24/01/1600x900/skynews-kent-snow-weather_6421850.jpg?20240115040113,2024-01-15T03:38:00Z,,"Drivers could end up stranded or delayed this week as freezing temperatures hit the UK - with National Highways issuing a ""severe weather alert"" for snow.
The travel warning covers northwest England… [+1856 chars]",,en,freezing,Snow&Ice,random,,,
https://www.irishtimes.com/ireland/2024/01/15/snow-ice-and-freezing-temperatures-forecast-for-week-ahead-as-winter-bites/,https://www.irishtimes.com/ireland/2024/01/15/snow-ice-and-freezing-temperatures-forecast-for-week-ahead-as-winter-bites/,0,www.irishtimes.com,"Snow, ice and freezing temperatures forecast for week ahead as winter bites",Wind chill factor will make it feel like minus 8 in places as Arctic air hits country,https://www.irishtimes.com/resizer/Zezq5fRJGeaE8uCEKYZTnurQhLs=/1200x630/filters:format(jpg):quality(70)/cloudfront-eu-central-1.images.arcpublishing.com/irishtimes/NODQQKTW5VDVNNOK6CX6CEJABI.JPEG,2024-01-15T09:01:38Z,,"A bitterly cold week is in store with freezing temperatures made worse by the wind chill factor.
A status yellow low temperature/ice warning is in place for all 32 counties from 7pm on Sunday night … [+1678 chars]",,en,freezing,Snow&Ice,random,,,
https://www.bostonglobe.com/2024/01/15/metro/more-snow-fall-new-england-tuesday-likely-impacting-morning-commute/,https://www.bostonglobe.com/2024/01/15/metro/more-snow-fall-new-england-tuesday-likely-impacting-morning-commute/,0,www.bostonglobe.com,"More snow to fall in New England on Tuesday, likely impacting morning commute","This is going to be the coldest seven-day stretch we’ve seen so far this winter, with temperatures staying below freezing most hours.",https://bostonglobe-prod.cdn.arcpublishing.com/resizer/SCn9IdvGush7Fc1Yy9pmO-2GnTI=/506x0/cloudfront-us-east-1.images.arcpublishing.com/bostonglobe/T2JRRKBDYXZ42INNTJ2ZUKYIUM.jpg,2024-01-15T11:38:20Z,,"It seems like we are not streaming together very many days without precipitation, and this week is no exception. On Sunday, we had snow squalls in the afternoon, and Saturday saw a strong storm with … [+2852 chars]",,en,coldest day,Cold Wave,random,,,
https://www.thejournal.ie/weather-ireland-29-6272917-Jan2024/,https://www.thejournal.ie/weather-ireland-29-6272917-Jan2024/,0,www.thejournal.ie,Sleet and snow for parts of the country today as temperatures to drop to - 4 tonight,A number of weather warnings are in place.,https://img2.thejournal.ie/article/6272917/river/?height=400&version=6272927,2024-01-16T08:34:24Z,,"IRELAND IS DUE for another very cold day, with temperatures to drop below freezing again tonight. 
A number of weather warnings are in place from Met Éireann. 
This morning frost and ice will gradu… [+2402 chars]",,en,sleet,Snow&Ice,random,,,
https://www.abc.net.au/news/2024-01-17/nsw-victoria-canberra-tasmania-storms-summer-rain/103325940,https://www.abc.net.au/news/2024-01-17/nsw-victoria-canberra-tasmania-storms-summer-rain/103325940,0,www.abc.net.au,Mid-summer soaking continues as 'life threatening flash flooding' possible from Wednesday storms,Large parts of Australia are under a severe storm risk on Wednesday with likely severe storms in southern NSW and north-east Victoria.,https://live-production.wcms.abc-cdn.net.au/951d717b7a172a10482410b41fbd095c?impolicy=wcms_crop_resize&cropH=2416&cropW=4295&xPos=0&yPos=224&width=862&height=485,2024-01-16T18:17:59Z,,"Thunderstorms are forecast today for all Australian capitals except Adelaide and Perth, continuing the wet start to 2024 across the majority of northern and eastern Australia.
The Bureau of Meteorol… [+3870 chars]",,en,flash flood South Australia,Flood,acwe,Australia,SAU,Oceania
https://www.bbc.co.uk/news/world-africa-67986200,https://www.bbc.co.uk/news/world-africa-67986200,0,www.bbc.co.uk,Ethiopia hunger: About 225 starve to death in Tigray - officials,There are fears that a famine is looming in the drought-hit and war-scarred Ethiopian region.,https://ichef.bbci.co.uk/news/1024/branded_news/610B/production/_132334842_8fa77122-5c6a-4764-906c-a38bb3d6958a.jpg,2024-01-16T20:05:43Z,,"More than 200 people have starved to death since July in Edaga Arbi town, in Ethiopia's drought-hit and war-scarred Tigray region, local authorities say.
Another 16 have died in nearby Adwa town.
O… [+2562 chars]",,en,Drought Ethiopia,Drought,edo,Ethiopia,NEAF,Africa
https://www.bbc.com/news/world-africa-67986200,https://www.bbc.com/news/world-africa-67986200,0,www.bbc.com,Ethiopia hunger: About 225 starve to death in Tigray - officials,There are fears that a famine is looming in the drought-hit and war-scarred Ethiopian region.,https://ichef.bbci.co.uk/news/1024/branded_news/610B/production/_132334842_8fa77122-5c6a-4764-906c-a38bb3d6958a.jpg,2024-01-16T20:05:43Z,,"By Kalkidan Yibeltal &amp; Natasha BootyBBC News, Addis Ababa and London
Crops are failing and residents say food aid has dwindled
More than 200 people have starved to death since July in Edaga Arb… [+3432 chars]",,en,drought,Drought,random,,,
https://www.bbc.co.uk/news/uk-england-london-67993950,https://www.bbc.co.uk/news/uk-england-london-67993950,0,www.bbc.co.uk,Climate change: London is underprepared for extreme weather,"The capital is at risk from rising sea levels, flooding, heat, drought and wildfires, a report says.",https://ichef.bbci.co.uk/news/1024/branded_news/697C/production/_132340072_e19697db2736df5d83b6d790c910f27f8954bdc0.jpg,2024-01-17T06:13:21Z,,"London is ""underprepared"" for the impact of climate change such as severe flooding and extreme heat, a climate research group has found.
The London Climate Resilience Review has also said this lack … [+4934 chars]",,en,flooding,Flood,random,,,
