index,url,valid,domain,title,description,image,published,archive,content,quote,language,term,topic,feed,country,ipcc,continent
https://www.ladbible.com/news/world-news/spain-floods-2024-images-death-toll-216584-20241101,https://www.ladbible.com/news/world-news/spain-floods-2024-images-death-toll-216584-20241101,0,www.ladbible.com,Death toll rises above 150 as frightening images reveal destruction from Spain’s deadliest flood in decades,"Images reveal the aftermath of the devastating floods across Spain, with the Valencia region among the worst affected, as the death toll passes 150.",https://images.ladbible.com/resize?type=webp&quality=70&width=1200&fit=contain&gravity=auto&url=https://images.ladbiblegroup.com/v3/assets/bltcd74acc1d0a99f3a/blt24d6bcd793ffdc64/67249eba514e9e51a5a7cc58/spain-flooding-incident.png,2024-11-01T09:52:50Z,,"Frightening images have revealed the true destructive impact of the deadly floods which have devastated Spain.
Heavy rainfall across the Mediterranean country has led to a major flooding disaster, w… [+2559 chars]",,en,Flood Spain,Flood,cmeter,Spain,MED,Europe
https://www.cbsnews.com/news/spain-floods-deaths-maps-satellite-images-valencia-impact-resident-anger-response/,https://www.cbsnews.com/news/spain-floods-deaths-maps-satellite-images-valencia-impact-resident-anger-response/,0,www.cbsnews.com,"Maps, satellite images reveal Spain flood impact as death toll hits 205","""Entire houses have disappeared,"" says a local mayor in Spain's flood-battered Valencia region. ""We don't know if there were people inside.""",https://assets3.cbsnewsstatic.com/hub/i/r/2024/11/01/61c57c0f-e1b4-495e-af66-772b5803fa99/thumbnail/1200x630/ce701f498d946c63bc4d8620ca9044a9/spain-floods-2181556168.jpg?v=379420b9063a2aadbcd559df18e2d1ae,2024-11-01T15:23:00Z,,"Chiva, Spain — The death toll from historic flash floods in Spain climbed to at least 205 people Friday, with many more believed to be missing, as the initial shock gave way to anger, frustration and… [+7832 chars]",,en,Flood Spain,Flood,cmeter,Spain,MED,Europe
https://www.aljazeera.com/news/2024/11/1/death-toll-from-spain-floods-passes-200-as-rescue-teams-search-for-missing,https://www.aljazeera.com/news/2024/11/1/death-toll-from-spain-floods-passes-200-as-rescue-teams-search-for-missing,0,www.aljazeera.com,Death toll from Spain floods passes 200 as rescue teams search for missing,"Spain's worst natural disaster in decades leaves many communities without power, water and aid.",https://www.aljazeera.com/wp-content/uploads/2024/10/AFP__20241030__36L88H9__v1__Preview__SpainFloods-1730364956.jpg?resize=1200%2C630,2024-11-01T15:45:47Z,,"Rescuers in Spain are battling to reach areas still cut off due to heavy rains as the death toll from catastrophic floods rose to 205 in Europes worst weather disaster in five decades.
In Valencia, … [+3333 chars]",,en,Flood Spain,Flood,cmeter,Spain,MED,Europe
https://foreignpolicy.com/2024/11/01/foreign-policy-news-quiz-japan-spain-floods-ethiopia-botswana-argentina-north-korea/,https://foreignpolicy.com/2024/11/01/foreign-policy-news-quiz-japan-spain-floods-ethiopia-botswana-argentina-north-korea/,0,foreignpolicy.com,What in the World?,"Test yourself on the week of Oct. 26: Botswana votes, Colombia hosts a U.N. conference, and torrential rainfall hits Spain.",https://foreignpolicy.com/wp-content/uploads/2024/11/Diwali-Nepal-dogs-GettyImages-2181491957.jpg?w=1000,2024-11-01T18:45:35Z,,"1. Which long-ruling Japanese political party lost its parliamentary majority in general elections over the weekend?
Komeito
Constitutional Democratic Party
Liberal Democratic Party
Japan Innovat… [+4221 chars]",,en,Rain Spain,Precipitation,wmo,Spain,MED,Europe
https://japantoday.com/category/world/spain-flood-deaths-top-200-more-troops-join-rescue,https://japantoday.com/category/world/spain-flood-deaths-top-200-more-troops-join-rescue,0,japantoday.com,Spain flood deaths top 200,"Rescuers raised the death toll in Spain's worst floods for a generation to 205 on Friday and fears grew for the dozens missing as hopes of finding survivors faded. The floods that have tossed vehicles, collapsed bridges and covered towns with mud since Tuesda…",,2024-11-01T21:43:51Z,,"Rescuers raised the death toll in Spain's worst floods for a generation to 205 on Friday and fears grew for the dozens missing as hopes of finding survivors faded.
The floods that have tossed vehicl… [+4331 chars]",,en,Flood VI,Flood,fema,United States,,
https://www.vox.com/politics/381791/harris-trump-election-day-questions-answered,https://www.vox.com/politics/381791/harris-trump-election-day-questions-answered,0,www.vox.com,"What counts as a landslide? Your biggest election questions, answered.","With just days until the 2024 presidential election, there’s still a lot of uncertainty. But Vox is here to help you navigate through it. Last week, we asked for your lingering questions about the upcoming election. We then turned to senior correspondent Eric…",https://platform.vox.com/wp-content/uploads/sites/2/2024/11/gettyimages-2181612592.jpg?quality=90&strip=all&crop=0%2C10.732984293194%2C100%2C78.534031413613&w=1200,2024-11-01T22:17:19Z,http://archive.md/20241104170443/https://www.vox.com/politics/381791/harris-trump-election-day-questions-answered,"With just days until the 2024 presidential election, theres still a lot of uncertainty. But Vox is here to help you navigate through it.
Last week, we asked for your lingering questions about the up… [+11325 chars]",,en,landslide,Landslide,random,,,
https://wattsupwiththat.com/2024/11/02/the-geological-record-of-climate-change-and-why-todays-increase-in-atmospheric-co2-is-the-result-of-global-warming-not-the-cause/,https://wattsupwiththat.com/2024/11/02/the-geological-record-of-climate-change-and-why-todays-increase-in-atmospheric-co2-is-the-result-of-global-warming-not-the-cause/,0,wattsupwiththat.com,"The Geological Record of Climate Change and Why Today’s Increase in Atmospheric CO2 Is the Result of Global Warming, Not the Cause","The climate is changing, and the geological record of climate change clearly shows that (a) we live in an unusually cold climate, (b) recent warming is neither dangerous or unusual, and (c) the main drivers of climate change are the sun, the oceans, and plate…",https://i0.wp.com/wattsupwiththat.com/wp-content/uploads/2024/11/charlesrotter_a_scene_during_the_Phanerozoic_midjourney.webp?fit=1024%2C512&ssl=1,2024-11-02T09:00:00Z,,"David Shelley*
The climate is changing, and the geological record of climate change clearly shows that (a) we live in an unusually cold climate, (b) recent warming is neither dangerous or unusual, a… [+39852 chars]",,en,record cold,Cold Wave,random,,,
https://www.rt.com/news/606851-spain-floods-valencia-videos/,https://www.rt.com/news/606851-spain-floods-valencia-videos/,0,www.rt.com,Spain flood death toll surpasses 200 (VIDEOS),"Almost 2,000 people remain missing after the worst natural disaster in decades hits eastern Spain Read Full Article at RT.com",https://mf.b37mrtl.ru/files/2024.11/article/672491f0203027028b23e50d.png,2024-11-02T12:32:09Z,,"The death toll from floods in Spain has surpassed 200, officials reported on Saturday, after record-breaking rainfall in the eastern province of Valencia caused widespread devastation.
It is “reason… [+2066 chars]",,en,Flood VI,Flood,fema,United States,,
https://www.cbc.ca/news/world/spain-deadly-floods-cleanup-1.7371935,https://www.cbc.ca/news/world/spain-deadly-floods-cleanup-1.7371935,0,www.cbc.ca,"Thousands of soldiers, volunteers join cleanup efforts after Spain flooding kills more than 200","As a large crowd of people gathered for cleanup efforts, Spain's prime minister announced Saturday that his government is sending 10,000 soldiers and police officers to its eastern region of Valencia amid mounting criticism over the government's response to c…",https://i.cbc.ca/1.7371936.1730541567!/fileImage/httpImage/image.jpg_gen/derivatives/16x9_620/aptopix-spain-floods.jpg,2024-11-02T13:28:23Z,,An arts and science centre that normally plays host to opera performances was transformed on Saturday into the nerve centre for a massive cleanup operation after catastrophic floods this week in east… [+4114 chars],,en,Flood Spain,Flood,cmeter,Spain,MED,Europe
https://www.the-sun.com/news/12804729/mass-grave-flooded-car-park-valencia/,https://www.the-sun.com/news/12804729/mass-grave-flooded-car-park-valencia/,0,www.the-sun.com,"Fears of 'mass grave' after Spain floods; 2,000 missing...",A FLOODED underground car park in Valencia has sparked fears of a “mass grave” as torrential rain batters the holiday island of Majorca. The number of people killed by the devastating f…,https://www.the-sun.com/wp-content/uploads/sites/6/2024/11/newspress-collage-s0qcejbrm-1730540764429.jpg?1730526783&strip=all&quality=100&w=1920&h=1080&crop=1,2024-11-02T14:34:36Z,http://archive.md/20241103055325/http://www.the-sun.com/news/12804729/mass-grave-flooded-car-park-valencia/,"A FLOODED underground car park in Valencia has sparked fears of a ""mass grave"" as torrential rain batters the holiday island of Majorca.
The number of people killed by the devastating floods has ris… [+14769 chars]",,en,Torrential Rain Spain,Precipitation,wmo,Spain,MED,Europe
https://www.ilounge.com/news/cook-pledges-relief-towards-spain-flash-floods,https://www.ilounge.com/news/cook-pledges-relief-towards-spain-flash-floods,0,www.ilounge.com,Cook pledges relief towards Spain flash floods,"Apple CEO Tim Cook recently said that the company will be making a donation to Spain’s relief efforts after the flash floods. In a social media post, Cook said that ‘we’re thinking of all those impacted by the devastating flash floods in the region of Valenci…",https://www.ilounge.com/wp-content/uploads/2024/11/Apple-CEO-Tim-Cook.png,2024-11-02T18:22:03Z,,"Apple CEO Tim Cook recently said that the company will be making a donation to Spain’s relief efforts after the flash floods.
In a social media post, Cook said that ‘we’re thinking of all those impa… [+667 chars]",,en,Flood Spain,Flood,cmeter,Spain,MED,Europe
https://brobible.com/sports/article/formula-1-qualifying-rain-out-rule-set-grid/,https://brobible.com/sports/article/formula-1-qualifying-rain-out-rule-set-grid/,0,brobible.com,Formula 1 Caught In Sticky Situation With No Rule For How To Set Grid In Case Of Rain Out,"Saturday’s qualifying for the Formula 1 Brazilian Grand Prix in Sao Paolo was wiped out due to torrential rains, and now the series finds itself in a precarious position. After heavy rains delayed the start of the session, which was set to begin at 3 p.m. loc…",https://brobible.com/wp-content/uploads/2024/11/Red-Bull-Formula-1.jpg,2024-11-02T20:32:39Z,,"Getty Image
Saturday’s qualifying for the Formula 1 Brazilian Grand Prix in Sao Paolo was wiped out due to torrential rains, and now the series finds itself in a precarious position.
After heavy ra… [+2485 chars]",,en,Rain Brazil,Precipitation,wmo,Brazil,SAM,South-America
https://consent.yahoo.com/v2/collectConsent?sessionId=1_cc-session_983d5409-496b-459d-90d3-03b38496cab8,https://consent.yahoo.com/v2/collectConsent?sessionId=1_cc-session_983d5409-496b-459d-90d3-03b38496cab8,0,consent.yahoo.com,Woman freed from car after three days as Spain flood deaths reach 211,,,2024-11-02T21:43:13Z,,"If you click 'Accept all', we and our partners, including 237 who are part of the IAB Transparency &amp; Consent Framework, will also store and/or access information on a device (in other words, use … [+678 chars]",,en,Flood Spain,Flood,cmeter,Spain,MED,Europe
https://biztoc.com/x/838bb29deb57e804,https://biztoc.com/x/838bb29deb57e804,0,biztoc.com,Spain mounts biggest peacetime disaster recovery operation as death toll reaches 214,The tragedy is already Europe's worst flood-related disaster since 1967 when at least 500 people died in Portugal.,https://biztoc.com/cdn/838bb29deb57e804_s.webp,2024-11-03T06:17:28Z,,"The tragedy is already Europe's worst flood-related disaster since 1967 when at least 500 people died in Portugal.
This story appeared on euractiv.com, 2024-11-03 06:07:36.",,en,Flood Spain,Flood,cmeter,Spain,MED,Europe
https://www.cbc.ca/news/science/climate-managed-retreat-1.7369294,https://www.cbc.ca/news/science/climate-managed-retreat-1.7369294,0,www.cbc.ca,"Rebuild or retreat? Repeat flooding forces tough decisions on homeowners, governments","Floods bring damage and destruction to homes, roads and entire communities. When they recede, repairing and rebuilding can be difficult and costly. One option is not to rebuild, but retreat to safety instead. When is that warranted? Where and how is it happen…",https://i.cbc.ca/1.7369484.1730391432!/cpImage/httpImage/image.jpg_gen/derivatives/16x9_620/flood-buyouts.jpg,2024-11-03T09:00:00Z,,"Spain
, the south coast of B.C.
 and the southeastern U.S. are all cleaning up after torrential flooding this past month. Rebuilding will be difficult and costly.
As of last week, Florida's back-t… [+9938 chars]",,en,flooding,Flood,random,,,
https://www.cnet.com/tech/services-and-software/how-to-watch-and-stream-the-2024-sao-paulo-gp/,https://www.cnet.com/tech/services-and-software/how-to-watch-and-stream-the-2024-sao-paulo-gp/,0,www.cnet.com,How to Watch and Stream the 2024 Sao Paulo GP,Torrential rain means today's in Brazil has been rescheduled.,https://www.cnet.com/a/img/resize/311f2282decf217ed2981afa718ce48d5e7af75a/hub/2024/11/03/5ab916bf-8e1c-4284-af4d-564c62d31fb0/gettyimages-2181832341.jpg?auto=webp&fit=crop&height=675&width=1200,2024-11-03T12:00:16Z,,"With plenty of drama before the race has even begun, today's Sao Paulo GP in Brazil looks set to be a memorable one in the battle for the Driver's Championship. 
McLaren's Lando Norris come out on t… [+7136 chars]",,en,Rain Brazil,Precipitation,wmo,Brazil,SAM,South-America
https://www.theverge.com/2024/11/3/24285366/migration-climate-change-biden-election-trump-harris,https://www.theverge.com/2024/11/3/24285366/migration-climate-change-biden-election-trump-harris,0,www.theverge.com,US immigration policy has a huge blind spot: climate change,"Storms, flooding, and drought displace millions of people, but the US still lacks legal protections for climate migrants.",https://cdn.vox-cdn.com/thumbor/Vrb8_rRc9VxCHepC5a5xo8EMtkg=/0x0:6000x4000/1200x628/filters:focal(3000x2000:3001x2001)/cdn.vox-cdn.com/uploads/chorus_asset/file/25709978/Credit__Luis_Yan_ez___ED_DSC00150.jpg,2024-11-03T14:00:00Z,,"Joe Biden raised hopes that the US would finally plan for climate-displaced migrants. Today, its still a glaring hole in climate and immigration policy. 
ByJustine Calma and Gaby Del Valle
If you b… [+13038 chars]",,en,flooding,Flood,random,,,
https://www.cbc.ca/news/world/spain-deadly-floods-protest-1.7372312,https://www.cbc.ca/news/world/spain-deadly-floods-protest-1.7372312,0,www.cbc.ca,Protesters yell and throw mud at Spain's king after devastating flooding,Spain's King Felipe VI and top government officials were pelted with mud by enraged flood survivors on Sunday during the first visit by the country's leaders to the centre of the suffering.,https://i.cbc.ca/1.7372323.1730642771!/fileImage/httpImage/image.JPG_gen/derivatives/16x9_620/europe-weather-spain-storm.JPG,2024-11-03T15:09:12Z,,"Spain's King Felipe VI and top government officials were pelted with mud by enraged flood survivors on Sunday during the first visit by the country's leaders to the centre of the suffering.
Prime Mi… [+3244 chars]",,en,Flood Spain,Flood,cmeter,Spain,MED,Europe
https://consent.yahoo.com/v2/collectConsent?sessionId=1_cc-session_09d2484a-9975-4348-b4dd-cbb183e0e59c,https://consent.yahoo.com/v2/collectConsent?sessionId=1_cc-session_09d2484a-9975-4348-b4dd-cbb183e0e59c,0,consent.yahoo.com,"Pope Francis calls for a stop to wars, prays for Spain flood victims",,,2024-11-03T18:24:30Z,,"If you click 'Accept all', we and our partners, including 237 who are part of the IAB Transparency &amp; Consent Framework, will also store and/or access information on a device (in other words, use … [+678 chars]",,en,Flood VI,Flood,fema,United States,,
https://www.catholicnewsagency.com/news/260243/pope-francis-prays-angelus-at-vatican-the-heart-of-our-faith-is-love,https://www.catholicnewsagency.com/news/260243/pope-francis-prays-angelus-at-vatican-the-heart-of-our-faith-is-love,0,www.catholicnewsagency.com,Pope Francis: The heart of our faith is love,"At the Angelus on Nov. 3, 2024, Pope Francis asked for prayers for Valencia, a region in southeast Spain, which was hit by devastating flash flooding in late October. / Credit: Vatican Media

Vatican City, Nov 3, 2024 / 13:35 pm (CNA).
Pope Francis on Sunday …",https://www.catholicnewsagency.com/storage/image/tom3399.jpg?jpg,2024-11-03T18:35:00Z,https://web.archive.org/web/20241104025126/https://www.catholicnewsagency.com/news/260243/pope-francis-prays-angelus-at-vatican-the-heart-of-our-faith-is-love,"Vatican City, Nov 3, 2024 / 13:35 pm
Pope Francis on Sunday spoke about Jesus teaching that all things must be done with love, something, he said, that is essential for the faith of each person.
Ev… [+3154 chars]",,en,Flooding s,Flood,emdat,Spain,MED,Europe
https://time.com/7171799/oklahoma-storms-injuries-thousands-without-power/,https://time.com/7171799/oklahoma-storms-injuries-thousands-without-power/,0,time.com,Severe Storms in Oklahoma Injure at Least 11 People and Leave Thousands Without Power,"Severe storms and tornadoes battered Oklahoma early Sunday, tossing cars and ripping roofs off buildings in the middle of the night.",https://api.time.com/wp-content/uploads/2024/11/AP24308658954270.jpg?quality=85&w=1200&h=628&crop=1,2024-11-03T19:18:18Z,,"OKLAHOMA CITY Severe storms and tornadoes battered Oklahoma early Sunday, tossing cars and ripping roofs off buildings in the middle of the night and leaving tens of thousands of homes and businesses… [+3207 chars]",,en,tornado,Storm,random,,,
https://www.usatoday.com/story/news/nation/2024/11/03/caribbean-storm-could-threaten-gulf-coast/76034701007/,https://www.usatoday.com/story/news/nation/2024/11/03/caribbean-storm-could-threaten-gulf-coast/76034701007/,0,www.usatoday.com,Hurricane season still swirling: Rafael could threaten US later this week,Gulf Coast residents are urged to be aware of a system expected to become a tropical storm and possibly a hurricane.,https://s.yimg.com/ny/api/res/1.2/gkUJL0GUVSb486gLCb1RLA--/YXBwaWQ9aGlnaGxhbmRlcjt3PTEyMDA7aD05Nzk-/https://media.zenfs.com/en/usa_today_news_641/0dd7147286bd9720edf9621bb7b6830f,2024-11-03T22:28:26Z,https://web.archive.org/web/20241104060207/https://www.usatoday.com/story/news/nation/2024/11/03/caribbean-storm-could-threaten-gulf-coast/76034701007/,"A November surprise?
As Americans focus their attention on Tuesdays election, weather experts are keeping a close eye on a low-pressure system in the western Caribbean that figures to impact the U.S… [+3568 chars]",,en,storm,Storm,random,,,
https://www.cbsnews.com/news/tropical-storm-rafael-potential-18-jamaica-cayman-islands/,https://www.cbsnews.com/news/tropical-storm-rafael-potential-18-jamaica-cayman-islands/,0,www.cbsnews.com,Weather system in Caribbean expected to become tropical storm,"A weather system in the Caribbean is expected to become a tropical storm on Monday, the National Hurricane Center said.",https://assets2.cbsnewsstatic.com/hub/i/r/2024/11/03/fa110be5-5576-4bf6-85c6-79bb11801e18/thumbnail/1200x630/d43bde61b6659f149c9000a432dbfb5a/cyclone-18.png?v=379420b9063a2aadbcd559df18e2d1ae,2024-11-03T23:43:01Z,https://web.archive.org/web/20241107083319/https://www.cbsnews.com/news/tropical-storm-rafael-potential-18-jamaica-cayman-islands/,"A weather system in the southwestern Caribbean is expected to develop and strengthen this week, prompting a tropical storm warning for Jamaica and a hurricane watch for the Cayman Islands to be issue… [+1273 chars]",,en,storm,Storm,random,,,
https://www.voanews.com/a/oklahoma-storms-injure-at-least-11-and-leave-thousands-without-power-/7850299.html,https://www.voanews.com/a/oklahoma-storms-injure-at-least-11-and-leave-thousands-without-power-/7850299.html,0,www.voanews.com,Oklahoma storms injure at least 11 and leave thousands without power,"OKLAHOMA CITY — Severe storms and tornadoes battered Oklahoma early Sunday, tossing cars and ripping roofs off buildings in the middle of the night and leaving tens of thousands of homes and businesses without power. Among numerous injuries, 11 people require…",https://gdb.voanews.com/D65F48F5-1B59-425B-9362-C28200D0E160.jpg,2024-11-04T06:16:31Z,,"OKLAHOMA CITY  Severe storms and tornadoes battered Oklahoma early Sunday, tossing cars and ripping roofs off buildings in the middle of the night and leaving tens of thousands of homes and businesse… [+2460 chars]",,en,storm,Storm,random,,,
https://www.dw.com/en/why-are-volcanoes-common-in-the-pacific-ring-of-fire/a-36676363,https://www.dw.com/en/why-are-volcanoes-common-in-the-pacific-ring-of-fire/a-36676363,0,www.dw.com,Why are volcanoes common in the Pacific Ring of Fire?,The Pacific Ring of Fire is a string of volcanoes. Earthquakes and eruptions are a constant threat as Indonesia's Mount Lewotobi Laki Laki shows.,https://static.dw.com/image/61154663_6.jpg,2024-11-04T07:49:00Z,,"How big is the Pacific Ring of Fire?
The Ring of Fire dominates the Pacific Ocean. It's a string of at least 450 active and dormant volcanoes that form a semi-circle, or horse shoe, around the Phili… [+3834 chars]",,en,volcano,Volcano,random,,,
https://biztoc.com/x/87938f344e5972de,https://biztoc.com/x/87938f344e5972de,0,biztoc.com,"Tropical Storm Rafael Could Form Today, Head Toward Florida",The low-pressure system will form over Jamaica today and possibly move with heavy rainfall to Florida over the course of the week.,https://biztoc.com/cdn/807/og.png,2024-11-04T09:28:31Z,,"The low-pressure system will form over Jamaica today and possibly move with heavy rainfall to Florida over the course of the week.
This story appeared on newsweek.com, 2024-11-04 09:18:58.",,en,Storm Jamaica,Storm,wmo,Jamaica,CAR,North-America
https://www.wfla.com/weather/tracking-the-tropics/disturbance-in-the-caribbean-expected-to-become-a-tropical-storm-today-nhc/,https://www.wfla.com/weather/tracking-the-tropics/disturbance-in-the-caribbean-expected-to-become-a-tropical-storm-today-nhc/,0,www.wfla.com,Tropical Storm Rafael forms in Caribbean; part of Florida under Tropical Storm Watch,"Tropical Depression Eighteen formed in the Caribbean on Monday and is expected to strengthen into a tropical storm, the National Hurricane Center said.",https://media.zenfs.com/en/wfla_article_174/976ecdee0285f4600489782b8da3f790,2024-11-04T10:10:34Z,,"This story has been archived and will no longer be updated. For updates on this system, click here.
TAMPA, Fla. (WFLA) Tropical Storm Rafael formed in the Caribbean on Monday, the National Hurricane… [+1651 chars]",,en,Storm Florida,Storm,fema,United States,ENA,North-America
https://phys.org/news/2024-11-spain-dreads-deaths.html,https://phys.org/news/2024-11-spain-dreads-deaths.html,0,phys.org,Spain dreads more flood deaths as more rain expected,"Spanish rescuers plunged into inundated garages to find bodies on Monday, a day after furious crowds heckled and hurled mud at the king and the prime minister following devastating floods.",https://scx2.b-cdn.net/gfx/news/2024/forensic-teams-firefig.jpg,2024-11-04T10:50:52Z,,"Spanish rescuers plunged into inundated garages to find bodies on Monday, a day after furious crowds heckled and hurled mud at the king and the prime minister following devastating floods.
The toll … [+3382 chars]",,en,Flood Spain,Flood,cmeter,Spain,MED,Europe
https://www.cbsnews.com/news/spain-flooding-valencia-king-felipe-extreme-rainfall-hits-barcelona/,https://www.cbsnews.com/news/spain-flooding-valencia-king-felipe-extreme-rainfall-hits-barcelona/,0,www.cbsnews.com,"Spain's flooding nightmare goes on as ""extreme"" rain hits Barcelona","The flash flood-inducing rains that killed more than 210 people in Spain's Valencia region have moved north, snarling air and rail traffic in Barcelona.",https://assets3.cbsnewsstatic.com/hub/i/r/2024/11/04/f95a7dd2-d0d8-43de-ae88-d66214289aba/thumbnail/1200x630/555a595466c84f8658f9de19b6c724fc/spain-floods-2182175800.jpg?v=379420b9063a2aadbcd559df18e2d1ae,2024-11-04T11:53:57Z,http://archive.md/20241104232647/https://www.cbsnews.com/news/spain-flooding-valencia-king-felipe-extreme-rainfall-hits-barcelona/,"Barcelona, Spain — The recurrent storms in eastern Spain that led to massive flooding last week and killed at least 217 people, almost all of them in the eastern Valencia region, dumped rain further … [+3474 chars]",,en,Flood Spain,Flood,cmeter,Spain,MED,Europe
https://www.abc.net.au/news/2024-11-05/spanish-troops-sent-to-valencia-protests-planned/104560400,https://www.abc.net.au/news/2024-11-05/spanish-troops-sent-to-valencia-protests-planned/104560400,0,www.abc.net.au,Spain deploys more troops to flood zone as authorities warn of landslides and more flooding,"The army sent a total of about 7,500 soldiers over the weekend to help distribute food and water, clean up streets and guard against looters.",https://live-production.wcms.abc-cdn.net.au/319ef84ed4913dee047da278a6bb3fb6?impolicy=wcms_watermark_news&cropH=2268&cropW=4032&xPos=0&yPos=378&width=862&height=485&imformat=generic,2024-11-04T13:18:13Z,,More soldiers have been sent to Spain's flood-hit east on Monday where rescuers have scoured underground carparks for bodies and protests bubbled over the government's handling of a disaster that has… [+3465 chars],,en,Flood Spain,Flood,cmeter,Spain,MED,Europe
