index,url,valid,domain,title,description,image,published,archive,content,quote,language,term,topic,feed,country,ipcc,continent
https://www.thestar.com.my/news/world/2023/10/01/australia-swelters-through-039scorching039-heat-lifting-bushfire-risk,https://www.thestar.com.my/news/world/2023/10/01/australia-swelters-through-039scorching039-heat-lifting-bushfire-risk,0,www.thestar.com.my,Australia swelters through 'scorching' heat lifting bushfire risk,SYDNEY (Reuters) - Australia's southeast on Sunday sweltered in a heat wave that raised the risk of bushfires and prompted authorities to issue fire bans for large swaths of New South Wales state. Read full story,https://apicms.thestar.com.my/uploads/images/2023/10/01/2312801.jpg,2023-10-01T00:33:00Z,,"SYDNEY (Reuters) - Australia's southeast on Sunday sweltered in a heat wave that raised the risk of bushfires and prompted authorities to issue fire bans for large swaths of New South Wales state.
T… [+1290 chars]",,en,Heat Wave Australia,Heat Wave,acwe,Australia,CAU,Oceania
https://www.ndtv.com/world-news/australia-reels-under-sweltering-heat-amid-bushfire-threats-4439425,https://www.ndtv.com/world-news/australia-reels-under-sweltering-heat-amid-bushfire-threats-4439425,0,www.ndtv.com,Australia Reels Under Sweltering Heat Amid Bushfire Threats,Australia's southeast on Sunday sweltered in a heat wave that raised the risk of bushfires and prompted authorities to issue fire bans for large swaths of New South Wales state.,https://c.ndtvimg.com/2023-10/8uadu4ro_australia-bushfire-_625x300_01_October_23.jpg,2023-10-01T02:11:00Z,,"State Emergency Services Minister said the ""scorching"" heat lifted the risk for bushfires.
Sydney: Australia's southeast on Sunday sweltered in a heat wave that raised the risk of bushfires and prom… [+1428 chars]",,en,heat,Heat Wave,random,,,
https://japantoday.com/category/world/australia-swelters-through-%27scorching%27-heat-lifting-bushfire-risk,https://japantoday.com/category/world/australia-swelters-through-%27scorching%27-heat-lifting-bushfire-risk,0,japantoday.com,Australia swelters through scorching heat lifting bushfire risk,Australia's southeast on Sunday sweltered in a heat wave that raised the risk of bushfires and prompted authorities to issue fire bans for large swaths of New South Wales state. The nation's weather forecaster said temperatures would be up to 12 degrees Celsi…,,2023-10-01T04:05:04Z,,"Australia's southeast on Sunday sweltered in a heat wave that raised the risk of bushfires and prompted authorities to issue fire bans for large swaths of New South Wales state.
The nation's weather… [+1176 chars]",,en,heat,Heat Wave,random,,,
https://www.channelnewsasia.com/world/australia-scorching-heat-bushfire-risk-3811856,https://www.channelnewsasia.com/world/australia-scorching-heat-bushfire-risk-3811856,0,www.channelnewsasia.com,Australia swelters through 'scorching' heat lifting bushfire risk,SYDNEY: Australia's southeast on Sunday (Oct 1) sweltered in a heat wave that raised the risk of bushfires and prompted authorities to issue fire bans for large swaths of New South Wales state. The nation's weather forecaster said temperatures would be up to …,"https://onecms-res.cloudinary.com/image/upload/s--eyAVKNMd--/fl_relative,g_south_east,l_one-cms:core:watermark:reuters,w_0.1/f_auto,q_auto/c_fill,g_auto,h_676,w_1200/v1/one-cms/core/2023-10-01t002941z_1_lynxnpej900br_rtroptp_3_australia-weather.jpg?itok=TLhI8GDe",2023-10-01T04:28:00Z,,"SYDNEY: Australia's southeast on Sunday (Oct 1) sweltered in a heat wave that raised the risk of bushfires and prompted authorities to issue fire bans for large swaths of New South Wales state.
The … [+1213 chars]",,en,Heat Wave New South Wales,Heat Wave,acwe,Australia,EAU,Oceania
https://economictimes.indiatimes.com/news/environment/global-warming/australia-swelters-through-scorching-heat-lifting-bushfire-risk/articleshow/104080191.cms,https://economictimes.indiatimes.com/news/environment/global-warming/australia-swelters-through-scorching-heat-lifting-bushfire-risk/articleshow/104080191.cms,0,economictimes.indiatimes.com,Australia swelters through 'scorching' heat lifting bushfire risk,"Australia's southeast is experiencing a heatwave, increasing the risk of bushfires and prompting fire bans. Temperatures are expected to be up to 12 degrees Celsius above average in some areas, with Sydney reaching 36 degrees Celsius. The heatwave is a result…","https://img.etimg.com/thumb/msid-104080278,width-1200,height-630,imgsize-116332,overlay-economictimes/photo.jpg",2023-10-01T04:42:45Z,,SYDNEY: Australia's southeast on Sunday sweltered in a heat wave that raised the risk of bushfires and led authorities to issue fire bans for large swathes of New South Wales state.The nation's weath… [+1580 chars],,en,Bushfire South Australia,Heat Wave,acwe,Australia,CAU,Oceania
https://www.americanthinker.com/blog/2023/10/new_york_officials_blame_climate_change_for_its_deluge_damage_instead_of_their_own_filthy_sewers.html,https://www.americanthinker.com/blog/2023/10/new_york_officials_blame_climate_change_for_its_deluge_damage_instead_of_their_own_filthy_sewers.html,0,www.americanthinker.com,New York officials blame climate change for its deluge damage instead of their own filthy sewers,"Got a filthy sewer problem?

Global warming to the rescue.

That's the situation in New York City, where torrential rain has caused flooding not seen since Superstorm Sandy in 2012 (they blamed global warming for that one, too), and Hurr...",https://www.americanthinker.com/images/bucket/2023-10/249187.jpg,2023-10-01T05:00:00Z,,"Got a filthy sewer problem?
Global warming to the rescue.
That's the situation in New York City, where torrential rain has caused flooding not seen since Superstorm Sandy in 2012 (they blamed globa… [+7582 chars]",,en,storm,Storm,random,,,
https://biztoc.com/x/78c4dc1363f86b6c,https://biztoc.com/x/78c4dc1363f86b6c,0,biztoc.com,Australia swelters through 'scorching' heat lifting bushfire risk,Australia's southeast on Sunday sweltered in a heat wave that raised the risk of bushfires and led authorities to issue fire bans for large swathes of New South Wales state. The nation's weather forecaster said temperatures would be up to 12 degrees Celsius (…,https://c.biztoc.com/p/78c4dc1363f86b6c/s.webp,2023-10-01T07:20:06Z,,Australia's southeast on Sunday sweltered in a heat wave that raised the risk of bushfires and led authorities to issue fire bans for large swathes of New South Wales state.The nation's weather forec… [+293 chars],,en,heat,Heat Wave,random,,,
https://www.voanews.com/a/libya-s-eastern-government-postpones-derna-reconstruction-conference/7292064.html,https://www.voanews.com/a/libya-s-eastern-government-postpones-derna-reconstruction-conference/7292064.html,0,www.voanews.com,Libya's Eastern Government Postpones Derna Reconstruction Conference,"Libya's eastern authorities Sunday announced the postponement of a reconstruction conference for the flood-hit city of Derna that had been planned for October 10 but was met with international skepticism.


The event was put off until November 1-2 to ""offer t…",https://gdb.voanews.com/01000000-0a00-0242-a310-08dbbdb8bc87_cx0_cy4_cw0_w1200_r1.jpg,2023-10-01T10:57:48Z,,"Benghazi, Libya  Libya's eastern authorities Sunday announced the postponement of a reconstruction conference for the flood-hit city of Derna that had been planned for October 10 but was met with int… [+2683 chars]",,en,Flood Libya,Flood,floodlist,Libya,SAH,Africa
https://www.dailydot.com/news/flooded-basement-rent-increase-4000-dollars/,https://www.dailydot.com/news/flooded-basement-rent-increase-4000-dollars/,0,www.dailydot.com,"‘I can’t believe landlords get away with this’: Tenant wakes up to a flooded laundry room. They just raised her rent to $4,000 a month","While rental costs may be increasing substantially across the United States, renters find the accommodation they get rarely lives up to its high price tag.


For example, one tenant of a “luxury” apartment building claimed that the building’s yard was frequen…",https://uploads.dailydot.com/2023/10/Flooded-Apartment.jpg?auto=compress&fm=pjpg,2023-10-01T14:07:36Z,,"While rental costs may be increasing substantially across the United States, renters find the accommodation they get rarely lives up to its high price tag.
For example, one tenant of a luxury apartm… [+2229 chars]",,en,Flood United States,Flood,wmo,United States,CNA,North-America
https://www.nhc.noaa.gov/refresh/graphics_at3+shtml/145850.shtml?cone,https://www.nhc.noaa.gov/refresh/graphics_at3+shtml/145850.shtml?cone,0,www.nhc.noaa.gov,Tropical Storm Rina Graphics,"5-Day Uncertainty Track last updated Sun, 01 Oct 2023 14:58:50 GMT

 
Wind Speed Probabilities last updated Sun, 01 Oct 2023 14:58:51 GMT",,2023-10-01T14:58:50Z,http://wayback.archive-it.org/all/20231001215943/https://www.nhc.noaa.gov/refresh/graphics_at3+shtml/145850.shtml?cone,"Coastal Watches/Warnings and Forecast Cone for Storm Center
* If the storm is forecast to dissipate within 3 days, the ""Full Forecast"" and ""3 day"" graphic will be identical
Click Here for a 5-day C… [+2926 chars]",,en,tropical storm,Tropical Cyclone,random,,,
https://www.thejournal.ie/heat-dome-europe-weather-forecast-6183920-Oct2023/,https://www.thejournal.ie/heat-dome-europe-weather-forecast-6183920-Oct2023/,0,www.thejournal.ie,Europe to experience another heat wave this week as warm Irish temperatures forecast,Met Éireann is forecasting highs in the mid teens with mostly dry conditions and occasional showers tomorrow.,https://img2.thejournal.ie/article/6183920/river/?height=400&version=6183935,2023-10-01T16:22:31Z,,"EUROPE IS FACING into yet another heatwave this coming week as a heat dome is expected to form over parts of western Europe. 
The areas underneath the forecast heat dome include southern France and … [+1112 chars]",,en,heat,Heat Wave,random,,,
https://nypost.com/2023/10/01/atlantic-hurricane-season-still-dangerous-to-us-in-october/,https://nypost.com/2023/10/01/atlantic-hurricane-season-still-dangerous-to-us-in-october/,0,nypost.com,Atlantic hurricane season will be still dangerous to US in October,"Even though the climatological peak of hurricane season – Sept. 10 – was weeks ago, residents living along the East and Gulf coasts shouldn't let their guard down in October.",https://nypost.com/wp-content/uploads/sites/2/2023/10/NYPICHPDPICT000053252298.jpg?quality=75&strip=all&w=1024,2023-10-01T16:40:14Z,,"Even though the climatological peak of hurricane season Sept. 10 was weeks ago, residents living along the East and Gulf coasts of the U.S. shouldn’t let their guard down in October.
October ranks a… [+3408 chars]",,en,hurricane,Tropical Cyclone,random,,,
https://ca.news.yahoo.com/u-says-guatemala-ministry-interfering-184344305.html,https://ca.news.yahoo.com/u-says-guatemala-ministry-interfering-184344305.html,0,ca.news.yahoo.com,U.S. says Guatemala ministry is interfering in election transition of power,"The U.S. State Department said on Sunday it is ""gravely concerned"" that Guatemala's Public Ministry is trying to undermine the transfer of power to President-elect Bernardo Arevalo, who recorded a landslide victory in August. The ministry, which functions sim…",https://media.zenfs.com/en/reuters.com/96dc413743e6bc7ea40339c0b65d6024,2023-10-01T18:43:44Z,,"By Sofia Menchu
GUATEMALA CITY (Reuters) - The U.S. State Department said on Sunday it is ""gravely concerned"" that Guatemala's Public Ministry is trying to undermine the transfer of power to Preside… [+1746 chars]",,en,Land Slide Guatemala,Landslide,relief,Guatemala,SCA,North-America
https://www.channelnewsasia.com/world/us-says-guatemala-ministry-interfering-election-transition-power-3812976,https://www.channelnewsasia.com/world/us-says-guatemala-ministry-interfering-election-transition-power-3812976,0,www.channelnewsasia.com,US says Guatemala ministry is interfering in election transition of power,"GUATEMALA CITY: The US State Department said on Sunday (Oct 1) it is ""gravely concerned"" that Guatemala's Public Ministry is trying to undermine the transfer of power to President-elect Bernardo Arevalo, who recorded a landslide victory in August. The ministr…","https://onecms-res.cloudinary.com/image/upload/s--JlacU6S5--/fl_relative,g_south_east,l_one-cms:core:watermark:reuters,w_0.1/f_auto,q_auto/c_fill,g_auto,h_676,w_1200/v1/one-cms/core/2023-09-13t005344z_2_lynxmpej8c00n_rtroptp_3_guatemala-election.jpg?itok=a-52BCL3",2023-10-01T22:14:50Z,,"GUATEMALA CITY: The US State Department said on Sunday (Oct 1) it is ""gravely concerned"" that Guatemala's Public Ministry is trying to undermine the transfer of power to President-elect Bernardo Arev… [+1673 chars]",,en,Land Slide Guatemala,Landslide,relief,Guatemala,SCA,North-America
https://www.nationalgeographic.com/travel/article/off-season-dangers-in-national-parks-you-need-to-know,https://www.nationalgeographic.com/travel/article/off-season-dangers-in-national-parks-you-need-to-know,0,www.nationalgeographic.com,Ready to plan your fall hike? Read this safety advice first.,"With dangers ranging from forest fires to avalanches, off-season adventures require advance prep and adventure smarts.",https://i.natgeofe.com/n/e8d1fcbc-6077-4585-b0a0-74268c8277b3/NationalGeographic_2444015_16x9.jpg?w=1200,2023-10-02T00:00:00Z,,"Many hikers view autumn as a mild, benign period beyond the summer scorch and winter freeze. They often underrate the risks of venturing into forests, mountains, and deserts during this shoulder seas… [+5110 chars]",,en,avalanche,Snow&Ice,random,,,
https://www.denverpost.com/2023/10/01/avalanche-preseason-win-dallas-stars/,https://www.denverpost.com/2023/10/01/avalanche-preseason-win-dallas-stars/,0,www.denverpost.com,Avalanche new-look top line shines in preseason win,The best players in Colorado's lineup during its final home preseason game Sunday night all looked ready for the ones that count.,https://www.denverpost.com/wp-content/uploads/2023/10/AP23275078100026.jpg?w=1024&h=683,2023-10-02T03:30:17Z,,"The best players in Colorado’s lineup during its final home preseason game Sunday night all looked ready for the ones that count.
Both power-play units scored a goal and the Avs had little trouble w… [+3076 chars]",,en,avalanche,Snow&Ice,random,,,
https://allafrica.com/stories/202310020045.html,https://allafrica.com/stories/202310020045.html,0,allafrica.com,Kenya: Changing Climate Realities - Flooding in New York City and the Looming Risks of El Nino in Kenya,"[Capital FM] Today, Global Warming is increasingly rising at unprecedented scale with countries around the world, both in the Global South and the Global North continue to confront the unfolding realities of the devastating impacts of climate change.",https://cdn08.allafrica.com/static/images/structure/aa-logo-rgba-no-text-square.png,2023-10-02T05:41:01Z,,"Today, Global Warming is increasingly rising at unprecedented scale with countries around the world, both in the Global South and the Global North continue to confront the unfolding realities of the … [+5060 chars]",,en,Flood Kenya,Flood,relief,Kenya,SEAF,Africa
https://www.autocar.co.uk/car-news/business-dealership%2C-sales-and-marketing/why-do-chinese-cars-cost-so-much-more-europe,https://www.autocar.co.uk/car-news/business-dealership%2C-sales-and-marketing/why-do-chinese-cars-cost-so-much-more-europe,0,www.autocar.co.uk,Why do Chinese cars cost so much more in Europe?,"Ora, Nio, MG, and BYD are just some of the Chinese brands that has expanded into Europe and the UK


MG 4, priced at £26,695 here, costs as little as £16,423 in its home country, and others follow similar price gaps

Cars in China are almost obscenely cheap; …",https://www.autocar.co.uk/sites/autocar.co.uk/files/images/car-reviews/first-drives/legacy/chinese_cars_nio_ora_byd_mg.png,2023-10-02T07:01:46Z,,"Cars in China are almost obscenely cheap; the same model over here costs up to double as much for the same specification.
Almost two-thirds of Chinese automotive exports to the UK are electric cars,… [+255 chars]",,en,Ice China,Snow&Ice,wmo,China,EAS,Asia
https://www.jpost.com/science/article-761279,https://www.jpost.com/science/article-761279,0,www.jpost.com,Suffering from severe psoriasis? You are at higher risk of heart disease,"Attacks can be triggered by stress, tobacco, heavy drinking of alcohol, infections like strep throat, cold and dry weather, bad sunburn, and some medications.","https://images.jpost.com/image/upload/f_auto,fl_lossy/c_fill,g_faces:center,h_407,w_690/548421",2023-10-02T07:18:08Z,,"Psoriasis, an autoimmune disease that causes a rash with itchy, scaly patches – most commonly on the knees, elbows, trunk, and scalp – is suffered by some 125 million people worldwide (two or three p… [+3519 chars]",,en,severe weather,Thunderstorm,random,,,
https://www.nakedcapitalism.com/2023/10/city-caught-flat-footed-on-flood-as-deluge-dredges-up-past-lessons.html,https://www.nakedcapitalism.com/2023/10/city-caught-flat-footed-on-flood-as-deluge-dredges-up-past-lessons.html,0,www.nakedcapitalism.com,City Caught Flat-Footed on Flood as Deluge Dredges Up Past Lessons,"New York City parents, public officials and climate advocates all say the mayor and his team were ill-prepared for the effects of a storm that was on the radar days before.",,2023-10-02T09:00:31Z,,"By Katie Honan and Samantha Maldonado, The City. This article was originally published by THE CITY.
Record rainfall soaked New York on Friday, disrupting public transportation and schools while floo… [+12088 chars]",,en,Storm York,Storm,wmo,United States,CNA,North-America
https://newsonjapan.com/html/newsdesk/article/138771.php,https://newsonjapan.com/html/newsdesk/article/138771.php,0,newsonjapan.com,"Japan had hottest September ever, following scorching summer","Weather officials in Japan say average temperatures in September were the highest since recordkeeping began 125 years ago.
 (NHK)",https://i2.ytimg.com/vi/QEQ0Nx2dQ0Y/mqdefault.jpg,2023-10-02T14:52:53Z,,"TOKYO, Oct 02 (NHK) -
 Weather officials in Japan say average temperatures in September were the highest since recordkeeping began 125 years ago.
Average temperatures this summer, from June to Augu… [+1759 chars]",,en,hottest year,Heat Wave,random,,,
https://phys.org/news/2023-10-thunderstorms-clumping-vapor-scientists-future.html,https://phys.org/news/2023-10-thunderstorms-clumping-vapor-scientists-future.html,0,phys.org,Thunderstorms clumping together: How understanding water vapor helps scientists predict future climate change,"A team of international scientists from the U.S., France, Germany, and Ethiopia recently published cutting-edge climate research on how thunderstorms can ""clump"" together and how that influences the Earth's climate. This led to the discovery that this clumpin…",https://scx2.b-cdn.net/gfx/news/hires/2023/thunderstorms-clumping-1.jpg,2023-10-02T16:16:06Z,,"A team of international scientists from the U.S., France, Germany, and Ethiopia recently published cutting-edge climate research on how thunderstorms can ""clump"" together and how that influences the … [+5755 chars]",,en,Thunderstorm France,Thunderstorm,meteo,France,SAH,Africa
https://mondoweiss.net/2023/10/dispelling-the-hasbara-fog/,https://mondoweiss.net/2023/10/dispelling-the-hasbara-fog/,0,mondoweiss.net,Dispelling the hasbara fog,"A new guide seeks to disarm and counter “Israelspeak,” the web of misleading cliches and tropes that have driven Zionist narratives deep into the American consciousness.",https://mondoweiss.net/wp-content/uploads/2023/10/260923_Jericho_MJ_0017.jpg,2023-10-02T16:27:37Z,,"WHEN THEY SPEAK ISRAELA Guide to Clarity in Conversations About Israelby Alex McDonald 156 pp. Great Tree Publishing, $12.95
Someday, maybe quite soon, Americans are going to start asking more quest… [+10368 chars]",,en,Fog Israel,Fog,wmo,Israel,MED,Asia
https://www.engadget.com/nordvpn-review-a-bit-too-overhyped-for-the-price-163100341.html,https://www.engadget.com/nordvpn-review-a-bit-too-overhyped-for-the-price-163100341.html,0,www.engadget.com,NordVPN review: A bit too overhyped for the price,"You may know NordVPN from its popular ambassador program, taking social media by storm as influencers sign up to make money advertising the virtual private network. But despite its popularity, it didn’t make the list of the nine top providers we published in …",https://s.yimg.com/uu/api/res/1.2/yw8c_kauvMP4zDMVwmvPlw--~B/Zmk9ZmlsbDtoPTYzMDtweW9mZj0wO3c9MTIwMDthcHBpZD15dGFjaHlvbg--/https://media-mbst-pub-ue1.s3.amazonaws.com/creatr-uploaded-images/2023-09/f85ca380-5f05-11ee-b7b7-a916f4096614.cf.jpg,2023-10-02T16:30:00Z,,"You may know NordVPN from its popular ambassador program, taking social media by storm as influencers sign up to make money advertising the virtual private network. But despite its popularity, it did… [+3326 chars]",,en,Storm ,Storm,wmo,Argentina,SES,South-America
https://www.advocate.com/politics/george-santos-husband-dianne-feinstein,https://www.advocate.com/politics/george-santos-husband-dianne-feinstein,0,www.advocate.com,George Santos Really Wants You to Meet His Husband,"The passing of veteran California Democratic U.S. Sen. Dianne Feinstein Friday has led to an unexpected social media storm surrounding out embattled Republican U.S. Rep. George Santos of New York, who casually mentioned his “husband Matt” in a tribute tweet t…",https://www.advocate.com/media-library/george-santos-and-matheus-gerard.jpg?id=47853885&width=1200&height=600&coordinates=0%2C0%2C0%2C78,2023-10-02T17:00:05Z,,"The passing of veteran California Democratic U.S. Sen. Dianne Feinstein Friday has led to an unexpected social media storm surrounding out embattled Republican U.S. Rep. George Santos of New York, wh… [+4642 chars]",,en,Storm Ida,Storm,wmo,United States,CNA,North-America
https://www.channelnewsasia.com/sport/moeen-fires-england-world-cup-warm-win-over-bangladesh-3815336,https://www.channelnewsasia.com/sport/moeen-fires-england-world-cup-warm-win-over-bangladesh-3815336,0,www.channelnewsasia.com,Moeen fires England to World Cup warm-up win over Bangladesh,":Moeen Ali smashed a quickfire half century to guide champions England to a four-wicket victory over Bangladesh in a rain-affected World Cup warm-up game in Guwahati on Monday.Chasing a revised target of 197 in 37 overs following a lengthy rain interruption, …","https://onecms-res.cloudinary.com/image/upload/s--Wcoko5Tn--/fl_relative,g_south_east,l_one-cms:core:watermark:reuters,w_0.1/f_auto,q_auto/c_fill,g_auto,h_676,w_1200/v1/one-cms/core/2023-10-02t170124z_1_lynxnpej910tp_rtroptp_3_cricket-odi-eng-nzl.jpg?itok=kbSfLFAR",2023-10-02T17:01:24Z,,":Moeen Ali smashed a quickfire half century to guide champions England to a four-wicket victory over Bangladesh in a rain-affected World Cup warm-up game in Guwahati on Monday.
Chasing a revised tar… [+2638 chars]",,en,Rain ,Precipitation,wmo,Argentina,SES,South-America
https://www.channelnewsasia.com/sport/new-zealand-beat-south-africa-seven-runs-rain-hit-world-cup-warm-3815336,https://www.channelnewsasia.com/sport/new-zealand-beat-south-africa-seven-runs-rain-hit-world-cup-warm-3815336,0,www.channelnewsasia.com,New Zealand beat South Africa by seven runs in rain-hit World Cup warm-up,"Devon Conway scored a half-century to guide New Zealand to a seven-run victory over South Africa in a rain-affected World Cup warm-up game on Monday.Chasing 322 for victory, South Africa were 211 for four with 13 overs left when the rain came, leaving them st…","https://onecms-res.cloudinary.com/image/upload/s--Wcoko5Tn--/fl_relative,g_south_east,l_one-cms:core:watermark:reuters,w_0.1/f_auto,q_auto/c_fill,g_auto,h_676,w_1200/v1/one-cms/core/2023-10-02t170124z_1_lynxnpej910tp_rtroptp_3_cricket-odi-eng-nzl.jpg?itok=kbSfLFAR",2023-10-02T17:01:24Z,,"Devon Conway scored a half-century to guide New Zealand to a seven-run victory over South Africa in a rain-affected World Cup warm-up game on Monday.
Chasing 322 for victory, South Africa were 211 f… [+1200 chars]",,en,Rain New Zealand,Precipitation,wmo,New Zealand,NZ,Oceania
https://biztoc.com/x/31d4256889bcf7c2,https://biztoc.com/x/31d4256889bcf7c2,0,biztoc.com,U.S. State Dept says Guatemala is interfering with election transfer of power,"GUATEMALA CITY — The U.S. State Department said on Sunday it is “gravely concerned” that Guatemala’s Public Ministry is trying to undermine the transfer of power to President-elect Bernardo Arévalo, who recorded a landslide victory in August. The ministry, wh…",https://c.biztoc.com/p/31d4256889bcf7c2/s.webp,2023-10-02T17:17:16Z,,"GUATEMALA CITY The U.S. State Department said on Sunday it is gravely concerned that Guatemalas Public Ministry is trying to undermine the transfer of power to President-elect Bernardo Arévalo, who r… [+326 chars]",,en,Landslide Guatemala,Landslide,relief,Guatemala,SCA,North-America
https://www.joblo.com/wish-trailer-record/,https://www.joblo.com/wish-trailer-record/,0,www.joblo.com,Wish trailer breaks Disney’s viewership record as the most-watched preview since 2019’s Frozen II,"Disney's Wish trailer is the studio's most-watched preview for an animated feature since 2019's Frozen II took the world by storm.
The post Wish trailer breaks Disney’s viewership record as the most-watched preview since 2019’s Frozen II appeared first on JoB…",https://www.joblo.com/wp-content/uploads/2023/10/wish_trailer_record_disney.jpg,2023-10-02T17:56:25Z,,"Disney’s Wish trailer is the studio’s most-watched preview for an animated feature since 2019’s Frozen II took the world by storm.
Walt Disney Animation‘s Wish is making dreams come true for the Hou… [+2409 chars]",,en,storm,Storm,random,,,
