index,url,valid,domain,title,description,image,published,archive,content,quote,language,term,topic,feed,country,ipcc,continent
https://www.nbcnews.com/weather/winter-weather/winter-alerts-millions-freezing-rain-threatens-power-outages-rcna190952,https://www.nbcnews.com/weather/winter-weather/winter-alerts-millions-freezing-rain-threatens-power-outages-rcna190952,0,www.nbcnews.com,Winter alerts for millions as freezing rain threatens power outages and travel danger,"Winter weather alerts were in place for some 100 million people across 22 states from Nebraska to Massachusetts Thursday as a series of winter storms descend on northern and eastern states, bringing snow, sleet and freezing rain.","https://media-cldnry.s-nbcnews.com/image/upload/t_nbcnews-fp-1200-630,f_auto,q_auto:best/rockcms/2025-02/250206-noaa-winter-storm-midwest-mb-1051-4d3e6b.jpg",2025-02-06T11:47:55Z,http://archive.md/20250206123117/https://www.nbcnews.com/weather/winter-weather/winter-alerts-millions-freezing-rain-threatens-power-outages-rcna190952,"Winter weather alerts were in place for some 100 million people across 22 states from Nebraska to Massachusetts Thursday as a series of winter storms descend on northern and eastern states, bringing … [+2254 chars]",,en,freezing,Snow&Ice,random,,,
https://www.cbc.ca/news/canada/toronto/toronto-gta-freezing-drizzle-advisory-environment-canada-1.7452104,https://www.cbc.ca/news/canada/toronto/toronto-gta-freezing-drizzle-advisory-environment-canada-1.7452104,0,www.cbc.ca,"Toronto, GTA under freezing drizzle advisory on Thursday: Environment Canada","Freezing drizzle is expected in Toronto and the GTA on Thursday, continuing from the morning into the early afternoon, Environment Canada said. The federal weather agency issued a weather advisory on Thursday morning, saying the freezing drizzle will be mixed…",https://i.cbc.ca/1.4620604.1703289241!/fileImage/httpImage/image.jpg_gen/derivatives/16x9_1180/toronto-freezing-rain.jpg?im=Resize%3D620,2025-02-06T15:11:54Z,,"Freezing drizzle is expected in Toronto and the GTA on Thursday, continuing from the morning into the early afternoon, Environment Canada said. 
The federal weather agency issued a weather advisory … [+732 chars]",,en,freezing,Snow&Ice,random,,,
https://www.irishtimes.com/ireland/2025/02/06/storm-eowyn-eu-aid-response-to-ireland-was-immediate-says-commissioner/,https://www.irishtimes.com/ireland/2025/02/06/storm-eowyn-eu-aid-response-to-ireland-was-immediate-says-commissioner/,0,www.irishtimes.com,"Storm Éowyn: EU aid response to Ireland was ‘immediate’, says commissioner",Government requested power generators under emergency EU scheme on Saturday after ‘unprecedented’ storm,https://www.irishtimes.com/resizer/v2/3ZFR2AJN6XBS5CTIFPT5HBN4YY.jpg?smart=true&auth=9dd243d64bb45c1201bd49f35ab033e03382abf624c73c2e5b1f5596720d9283&width=1200&height=630,2025-02-06T17:00:27Z,,"The first power generators arrived by sea from Denmark, another came from Luxembourg and a dozen were flown in to Dublin Airport from Poland on a Romanian military aircraft.
Storm Éowyn had done hug… [+3458 chars]",,en,Storm Ireland,Storm,wmo,Ireland,NEU,Europe
https://www.cbc.ca/news/canada/montreal/montreal-snowstorm-snow-removal-1.7452767,https://www.cbc.ca/news/canada/montreal/montreal-snowstorm-snow-removal-1.7452767,0,www.cbc.ca,Winter storm causes multiple collisions as Montreal gears up for snow removal,A snowstorm in the Montreal area Thursday afternoon caused multiple collisions on Highway 10. The city began snow-clearing operations and is preparing for more snow and freezing drizzle over the coming days.,https://i.cbc.ca/1.7452786.1738880531!/fileImage/httpImage/image.jpeg_gen/derivatives/16x9_1180/crash.jpeg?im=Resize%3D620,2025-02-06T22:56:14Z,,"Near whiteout snowstorm conditions Thursday afternoon led to multi-vehicle collisions in the Montreal area.
At the same time, Montreal began snow clearing and is preparing for five to six days of re… [+2979 chars]",,en,freezing,Snow&Ice,random,,,
https://www.globenewswire.com/news-release/2025/02/07/3022733/0/en/Frozen-Food-Market-to-Reach-US-722-5-Billion-by-2033-Astute-Analytica.html,https://www.globenewswire.com/news-release/2025/02/07/3022733/0/en/Frozen-Food-Market-to-Reach-US-722-5-Billion-by-2033-Astute-Analytica.html,0,www.globenewswire.com,Frozen Food Market to Reach US$ 722.5 Billion by 2033: Astute Analytica,"The frozen food industry is undergoing a considerable transformation fueled by technological innovations and shifts in consumer lifestyles. Advances in freezing technologies have transformed food preservation techniques, allowing manufacturers to enhance prod…",https://ml.globenewswire.com/Resource/Download/a77988df-ad1a-4619-9a4e-367c858dc70e,2025-02-07T12:40:00Z,,"New Delhi, Feb. 07, 2025 (GLOBE NEWSWIRE) -- According to recent findings from Astute Analytica, the global frozen food market size is expected to reach US$ 722.5 billion by 2033 from US$ 450.1 billi… [+12104 chars]",,en,freezing,Snow&Ice,random,,,
