index,url,valid,domain,title,description,image,published,archive,content,quote,language,term,topic,feed,country,ipcc,continent
http://www.wwe.com/videos/thea-hail-vs-jacy-jayne-nxt-spring-breakin-highlights-april-30-2024,http://www.wwe.com/videos/thea-hail-vs-jacy-jayne-nxt-spring-breakin-highlights-april-30-2024,0,www.wwe.com,"Thea Hail vs. Jacy Jayne: NXT Spring Breakin’ highlights, April 30, 2024","Thea Hail looks to prove herself against her former friend, the villainous Jacy Jayne. Catch WWE action on Peacock, WWE Network, FOX, USA Network, Sony India and more. #WWENXT",https://www.wwe.com/f/styles/og_image/public/2024/04/20240430_NXT_Thea_Jacy--9a4d9561eb79266a925857b19eac023f.jpg,2024-05-01T01:34:00Z,,"Skip to main content
Raw exclusives: May 19, 2014
Summer Rae avoids the questions: WWE.com Exclusive, May 19, 2014
Daniel Bryan reacts to Triple H's comments about his neck injury
Sheamus vs. Ces… [+641 chars]",,en,Hail India,Thunderstorm,wmo,India,SAS,Asia
https://theconversation.com/kenyas-devastating-floods-expose-decades-of-poor-urban-planning-and-bad-land-management-229015,https://theconversation.com/kenyas-devastating-floods-expose-decades-of-poor-urban-planning-and-bad-land-management-229015,0,theconversation.com,Kenya’s devastating floods expose decades of poor urban planning and bad land management,There’s been an increase in the amount of runoff generated from rainfall as land is altered by settlement and deforestation.,https://images.theconversation.com/files/591199/original/file-20240430-18-huzgaf.jpg?ixlib=rb-4.1.0&q=45&auto=format&w=1356&h=668&fit=crop,2024-05-01T09:17:13Z,,Floods in Kenya killed at least 169 people between March and April 2024. The most catastrophic of these deaths occurred after a flash flood swept through a rural village killing 42 people. Death and … [+5762 chars],,en,Rain Kenya,Precipitation,wmo,Kenya,SEAF,Africa
https://phys.org/news/2024-05-kenya-devastating-expose-decades-poor.html,https://phys.org/news/2024-05-kenya-devastating-expose-decades-poor.html,0,phys.org,Kenya's devastating floods expose decades of poor urban planning and bad land management,"Floods in Kenya killed at least 169 people between March and April 2024. The most catastrophic of these deaths occurred after a flash flood swept through a rural village killing 42 people. Death and destruction have also occurred in the capital, Nairobi, a st…",https://scx2.b-cdn.net/gfx/news/hires/2024/flood-kenya.jpg,2024-05-01T14:46:04Z,,"This article has been reviewed according to Science X's 
editorial process
and policies.
Editors have highlighted
the following attributes while ensuring the content's credibility:
fact-checked… [+6046 chars]",,en,Flood Kenya,Flood,relief,Kenya,SEAF,Africa
https://www.irishtimes.com/world/africa/2024/05/01/kenya-flooding-death-toll-rises-to-181-with-homes-and-roads-destroyed/,https://www.irishtimes.com/world/africa/2024/05/01/kenya-flooding-death-toll-rises-to-181-with-homes-and-roads-destroyed/,0,www.irishtimes.com,Kenya: Flooding death toll rises to 181 with homes and roads destroyed,Dozens more killed in neighbouring Tanzania and Burundi as torrential rain washes away infrastructure,https://www.irishtimes.com/resizer/64_iIUNSqUXzONAFqKKTQrnWTAk=/1200x630/filters:format(jpg):quality(70)/cloudfront-eu-central-1.images.arcpublishing.com/irishtimes/OE3D6B4AJVD7PBINZY7EQMLQPM.jpg,2024-05-01T15:04:44Z,,"Floods and landslides across Kenya have killed 181 people since March, with hundreds of thousands forced to leave their homes, the government and Red Cross said on Wednesday, as dozens more were kill… [+1746 chars]",,en,Flood Burundi,Flood,relief,Burundi,SEAF,Africa
https://www.startribune.com/heavy-rains-in-brazils-south-kill-at-least-8-people-leave-21-missing-civil-defense-says/600363021/,https://www.startribune.com/heavy-rains-in-brazils-south-kill-at-least-8-people-leave-21-missing-civil-defense-says/600363021/,0,www.startribune.com,"Heavy rains in Brazil's south kill at least 8 people, leave 21 missing, civil defense says","Heavy rains in Brazil's southern Rio Grande do Sul state have killed at least eight people and left 21 missing since Monday, the country's civil defense said Wednesday.",https://www.startribune.com/static/img/branding/logos/strib-social-card.png?d=1713369823,2024-05-01T15:19:04Z,,"RIO DE JANEIRO Heavy rains in Brazil's southern Rio Grande do Sul state have killed at least eight people and left 21 missing since Monday, the country's civil defense said Wednesday.
An additional … [+1375 chars]",,en,heavy rain,Precipitation,random,,,
https://abcnews.go.com/International/wireStory/heavy-rains-brazils-south-kill-8-people-leave-109827342,https://abcnews.go.com/International/wireStory/heavy-rains-brazils-south-kill-8-people-leave-109827342,0,abcnews.go.com,"Heavy rains in Brazil’s south kill at least 8 people, leave 21 missing, civil defense says",Heavy rains in Brazil’s southern Rio Grande do Sul state have killed at least eight people and left 21 missing since Monday,https://s.abcnews.com/images/US/abc_news_default_2000x2000_update_16x9_992.jpg,2024-05-01T15:34:03Z,,"RIO DE JANEIRO -- Heavy rains in Brazils southern Rio Grande do Sul state have killed at least eight people and left 21 missing since Monday, the country's civil defense said Wednesday.
An additiona… [+1377 chars]",,en,Rain Brazil,Precipitation,wmo,Brazil,SAM,South-America
https://www.foxnews.com/world/heavy-rains-leave-10-dead-southern-brazil,https://www.foxnews.com/world/heavy-rains-leave-10-dead-southern-brazil,0,www.foxnews.com,Heavy rains leave at least 10 dead in southern Brazil,"Heavy rains in Brazil's Rio Grande do Sul state have left at least 10 people dead and 21 others missing since Monday, according to national authorities.",https://static.foxnews.com/foxnews.com/content/uploads/2024/05/brazilian_flag.jpg,2024-05-01T21:08:38Z,,"Heavy rains in Brazils southern Rio Grande do Sul state have killed at least 10 people and left 21 missing since Monday, the country's civil defense said Wednesday.
An additional 11 people were inju… [+1785 chars]",,en,Rain Brazil,Precipitation,wmo,Brazil,SAM,South-America
https://www.foxnews.com/us/tourists-airlifted-kenyan-reserve-freak-floods-continue,https://www.foxnews.com/us/tourists-airlifted-kenyan-reserve-freak-floods-continue,0,www.foxnews.com,Tourists airlifted from Kenyan reserve as freak floods continue,Tourists were evacuated by air Wednesday from the Maasai Mara national reserve in Kenya as devastating flash floods continued encroaching on the African nation.,https://static.foxnews.com/foxnews.com/content/uploads/2024/05/kenya_flooding.jpg,2024-05-01T22:24:50Z,,"Tourists were evacuated by air from Kenya's Maasai Mara national reserve Wednesday after more than a dozen hotels, lodges and camps were flooded as heavy rains battered the country.
Tourist accommod… [+1589 chars]",,en,Flash Flood Kenya,Precipitation,relief,Kenya,SEAF,Africa
https://www.rt.com/africa/596868-kenya-flood-death-toll-increases/,https://www.rt.com/africa/596868-kenya-flood-death-toll-increases/,0,www.rt.com,Death toll in flooded Kenya climbs above 180,Kenya’s government has warned of further disruption in the country; 181 have died due to torrential rain Read Full Article at RT.com,https://mf.b37mrtl.ru/files/2024.05/article/663363c385f54032cc5a2d9e.jpg,2024-05-02T10:12:29Z,,"More than 180 people have been killed and thousands of others displaced amid heavy flooding and landslide disasters across Kenya since March, the East African nation’s government and the Red Cross re… [+2006 chars]",,en,Flood Kenya,Flood,relief,Kenya,SEAF,Africa
https://www.ibtimes.com/kenya-floods-death-toll-rises-188-heavy-rains-persist-3731101,https://www.ibtimes.com/kenya-floods-death-toll-rises-188-heavy-rains-persist-3731101,0,www.ibtimes.com,Kenya Floods Death Toll Rises To 188 As Heavy Rains Persist,"The number of people who have lost their lives in devastating floods in Kenya since March has risen to 188, with dozens still missing, the interior ministry said on Thursday.",https://d.ibtimes.com/en/full/4524339/nairobi-slum-mathare-suffered-heavy-flooding.jpg,2024-05-02T11:21:10Z,,"The number of people who have lost their lives in devastating floods in Kenya since March has risen to 188, with dozens still missing, the interior ministry said on Thursday.
Torrential rains in Ken… [+3679 chars]",,en,Flood Kenya,Flood,relief,Kenya,SEAF,Africa
https://phys.org/news/2024-05-kenya-death-toll-heavy-persist.html,https://phys.org/news/2024-05-kenya-death-toll-heavy-persist.html,0,phys.org,Kenya floods death toll rises to 188 as heavy rains persist,"The number of people who have lost their lives in devastating floods in Kenya since March has risen to 188, with dozens still missing, the interior ministry said on Thursday.",https://scx2.b-cdn.net/gfx/news/2024/dozens-of-villagers-di.jpg,2024-05-02T11:57:43Z,,"The number of people who have lost their lives in devastating floods in Kenya since March has risen to 188, with dozens still missing, the interior ministry said on Thursday.
Torrential rains in Ken… [+4049 chars]",,en,Flood Kenya,Flood,relief,Kenya,SEAF,Africa
https://www.voanews.com/a/kenya-floods-death-toll-rises-to-188-as-heavy-rains-persist-/7594872.html,https://www.voanews.com/a/kenya-floods-death-toll-rises-to-188-as-heavy-rains-persist-/7594872.html,0,www.voanews.com,Kenya floods death toll rises to 188 as heavy rains persist,"Nairobi — The number of people who have lost their lives in devastating floods in Kenya since March has risen to 188, with dozens still missing, the interior ministry said on Thursday.



Torrential rains in Kenya and other countries in East Africa have cause…",https://gdb.voanews.com/4EB92904-2E67-430A-887F-3AA53B63D628.jpg,2024-05-02T12:37:10Z,,"Nairobi  The number of people who have lost their lives in devastating floods in Kenya since March has risen to 188, with dozens still missing, the interior ministry said on Thursday.
Torrential rai… [+3786 chars]",,en,Flood Kenya,Flood,relief,Kenya,SEAF,Africa
https://punchng.com/kenya-floods-death-toll-tops-200-as-cyclone-approaches/,https://punchng.com/kenya-floods-death-toll-tops-200-as-cyclone-approaches/,0,punchng.com,Kenya floods death toll tops 200 as cyclone approaches,"The death toll from flood-related incidents in Kenya has crossed 200 since March, the interior ministry said Friday, as a cyclone barrelled towards the Tanzanian coast. Torrential rains have lashed much of East Africa, triggering flooding and landslides that …",https://cdn.punchng.com/wp-content/uploads/2024/05/03104249/flooood.jpg,2024-05-03T06:00:08Z,https://web.archive.org/web/20240503103439/https://punchng.com/kenya-floods-death-toll-tops-200-as-cyclone-approaches/,"The death toll from flood-related incidents in Kenya has crossed 200 since March, the interior ministry said Friday, as a cyclone barrelled towards the Tanzanian coast.
Torrential rains have lashed … [+1901 chars]",,en,Land Slide Tanzania,Landslide,relief,Tanzania,SEAF,Africa
https://www.aljazeera.com/news/2024/5/3/kenya-tanzania-brace-for-cyclone-hidaya-amid-heavy-rain-and-floods,https://www.aljazeera.com/news/2024/5/3/kenya-tanzania-brace-for-cyclone-hidaya-amid-heavy-rain-and-floods,0,www.aljazeera.com,"Kenya, Tanzania brace for Cyclone Hidaya as flood death toll rises",Kenyan government orders mandatory evacuations for residents near 178 dams and water reservoirs in 33 counties.,https://www.aljazeera.com/wp-content/uploads/2024/05/AFP__20240430__34QK3MG__v2__HighRes__TopshotKenyaWeatherFloods-1714721586.jpg?resize=1920%2C1440,2024-05-03T09:01:23Z,,"Kenya and Tanzania have been bracing for a cyclone on the heels of torrential rains and floods that have devastated East Africa, killing nearly 400 people and forcing tens of thousands from their hom… [+4108 chars]",,en,Flood Tanzania,Flood,relief,Tanzania,SEAF,Africa
https://www.ibtimes.com/kenya-floods-death-toll-tops-200-cyclone-approaches-3731184,https://www.ibtimes.com/kenya-floods-death-toll-tops-200-cyclone-approaches-3731184,0,www.ibtimes.com,Kenya Floods Death Toll Tops 200 As Cyclone Approaches,"Torrential rains have lashed much of East Africa, triggering flooding and landslides that has destroyed crops, swallowed homes, and displaced hundreds of thousands of people.",https://d.ibtimes.com/en/full/4524460/torrential-rains-have-lashed-much-east-africa-triggering-flooding-landslides.jpg,2024-05-03T09:25:55Z,,"The death toll from flood-related incidents in Kenya has crossed 200 since March, the interior ministry said Friday, as a cyclone barreled towards the Tanzanian coast.
Torrential rains have lashed m… [+1893 chars]",,en,flooding,Flood,random,,,
https://phys.org/news/2024-05-kenya-death-toll-tops-cyclone.html,https://phys.org/news/2024-05-kenya-death-toll-tops-cyclone.html,0,phys.org,Kenya floods death toll tops 200 as cyclone approaches,"The death toll from flood-related incidents in Kenya has crossed 200 since March, the interior ministry said Friday, as a cyclone barrelled towards the Tanzanian coast.",https://scx2.b-cdn.net/gfx/news/2024/torrential-rains-have.jpg,2024-05-03T10:11:07Z,,"The death toll from flood-related incidents in Kenya has crossed 200 since March, the interior ministry said Friday, as a cyclone barrelled towards the Tanzanian coast.
Torrential rains have lashed … [+2305 chars]",,en,Flood Tanzania,Flood,relief,Tanzania,SEAF,Africa
https://www.digitaljournal.com/world/kenya-floods-death-toll-tops-200-as-cyclone-approaches-2/article,https://www.digitaljournal.com/world/kenya-floods-death-toll-tops-200-as-cyclone-approaches-2/article,0,www.digitaljournal.com,Kenya floods death toll tops 200 as cyclone approaches,"The death toll from flood-related incidents in Kenya has crossed 200 since March, the interior ministry said Friday, as a cyclone barrelled towards the Tanzanian coast. Torrential rains have lashed East Africa, triggering flooding and landslides that has dest…",https://www.digitaljournal.com/wp-content/uploads/2024/05/3767664cb5f032547c335ccbe8fde5affcad087e-1.jpg,2024-05-03T10:34:59Z,https://web.archive.org/web/20240503133904/https://www.digitaljournal.com/world/kenya-floods-death-toll-tops-200-as-cyclone-approaches-2/article,"Torrential rains have lashed much of East Africa, triggering flooding and landslides - Copyright AFP MIGUEL MEDINA
The death toll from flood-related incidents in Kenya has crossed 200 since March, t… [+3143 chars]",,en,Landslide Tanzania,Landslide,relief,Tanzania,SEAF,Africa
https://financialpost.com/pmn/business-pmn/drought-to-deluge-eastern-africa-bears-brunt-of-climate-change,https://financialpost.com/pmn/business-pmn/drought-to-deluge-eastern-africa-bears-brunt-of-climate-change,0,financialpost.com,Drought to Deluge: Eastern Africa Bears Brunt of Climate Change,"East Africa is bracing for more deadly floods, as torrential rain after years of biting drought deliver a brutal reminder of the threat posed by extreme weather brought about by climate change.",https://smartcdn.gprod.postmedia.digital/financialpost/wp-content/uploads/2024/05/776137770.jpg,2024-05-03T11:58:43Z,https://web.archive.org/web/20240503150426/https://financialpost.com/pmn/business-pmn/drought-to-deluge-eastern-africa-bears-brunt-of-climate-change,"East Africa is bracing for more floods, as torrential rain after years of drought deliver a reminder of the threat created by climate change.
Author of the article:
Residents cross floodwater in th… [+6938 chars]",,en,drought,Drought,random,,,
https://www.startribune.com/kenya-president-postpones-reopening-of-schools-as-flood-related-deaths-pass-200/600363493/,https://www.startribune.com/kenya-president-postpones-reopening-of-schools-as-flood-related-deaths-pass-200/600363493/,0,www.startribune.com,Kenya president postpones reopening of schools as flood-related deaths pass 200,"Kenyan President William Ruto has postponed next week's planned reopening of schools until further notice, as heavy rains and floods that have killed more than 200 people continue.",https://www.startribune.com/static/img/branding/logos/strib-social-card.png?d=1714669916,2024-05-03T12:30:10Z,https://web.archive.org/web/20240503125155/https://www.startribune.com/kenya-president-postpones-reopening-of-schools-as-flood-related-deaths-pass-200/600363493/,"NAIROBI, Kenya Kenyan President William Ruto has postponed next week's planned reopening of schools until further notice, as heavy rains and floods that have killed more than 200 people continue.
Th… [+1453 chars]",,en,Flood Kenya,Flood,relief,Kenya,SEAF,Africa
https://phys.org/news/2024-05-kenya-braces-cyclone.html,https://phys.org/news/2024-05-kenya-braces-cyclone.html,0,phys.org,Kenya on alert as it braces for first-ever cyclone,Kenyan President William Ruto put the flood-ravaged country on high alert on Friday and postponed the reopening of schools indefinitely as the nation braced for its first-ever cyclone.,https://scx2.b-cdn.net/gfx/news/2024/so-far-some-210-people.jpg,2024-05-03T13:40:01Z,https://web.archive.org/web/20240503134141/https://phys.org/news/2024-05-kenya-braces-cyclone.html,"Kenyan President William Ruto put the flood-ravaged country on high alert on Friday and postponed the reopening of schools indefinitely as the nation braced for its first-ever cyclone.
Torrential ra… [+4028 chars]",,en,Flood Kenya,Flood,relief,Kenya,SEAF,Africa
https://english.khabarhub.com/2024/03/353842/,https://english.khabarhub.com/2024/03/353842/,0,english.khabarhub.com,Kenya floods death toll tops 200 as cyclone approaches,"NAIROBI, KENYA: The death toll from flood-related incidents in Kenya has crossed 200 since March, the interior ministry said Friday, as a cyclone barreled towards the Tanzanian coast. Torrential rains have lashed East Africa, triggering flooding and landslide…",https://english.khabarhub.com/wp-content/uploads/2024/05/kenya-flood-.jpg,2024-05-03T13:45:44Z,https://web.archive.org/web/20240503134556/https://english.khabarhub.com/2024/03/353842/,"People gather on a bridge where a woman's body was retrieved, after floodwater washed away houses, in Kamuchiri Village Mai Mahiu, Nakuru County, Kenya, April 30, 2024/APNAIROBI, KENYA: The death tol… [+3182 chars]",,en,Land Slide Tanzania,Landslide,relief,Tanzania,SEAF,Africa
https://www.dw.com/en/managing-africas-natural-disasters-takes-on-urgency/a-68985169,https://www.dw.com/en/managing-africas-natural-disasters-takes-on-urgency/a-68985169,0,www.dw.com,Managing Africa's natural disasters takes on urgency,"Africa is particularly vulnerable to suffering natural disasters, such as floods, severe storms and droughts. These are not only crippling economies and people's livelihoods but also costing lives across the continent.",https://static.dw.com/image/68944929_6.jpg,2024-05-03T13:50:00Z,,"After the worst drought in decades, East Africa is now being pounded by heavy rains. At least 180 people have died in floods and landslides in Kenya since the rainy season began in mid-March, with hu… [+5619 chars]",,en,drought,Drought,random,,,
https://japantoday.com/category/world/kenya-president-postpones-reopening-of-schools-as-flood-related-deaths-pass-200,https://japantoday.com/category/world/kenya-president-postpones-reopening-of-schools-as-flood-related-deaths-pass-200,0,japantoday.com,Kenya president postpones reopening of schools as flood-related deaths pass 200,"Kenyan President William Ruto has postponed next week’s planned reopening of schools until further notice, as heavy rains and floods that have killed more than 200 people continue. The president in his state of the nation address on Friday said that “meteorol…",,2024-05-03T21:56:09Z,https://web.archive.org/web/20240503225216/https://japantoday.com/category/world/kenya-president-postpones-reopening-of-schools-as-flood-related-deaths-pass-200,"Kenyan President William Ruto has postponed next weeks planned reopening of schools until further notice, as heavy rains and floods that have killed more than 200 people continue.
The president in h… [+1588 chars]",,en,Flood Kenya,Flood,relief,Kenya,SEAF,Africa
https://www.voanews.com/a/tropical-cyclone-threatens-to-worsen-humanitarian-crisis-in-flooded-east-africa/7597906.html,https://www.voanews.com/a/tropical-cyclone-threatens-to-worsen-humanitarian-crisis-in-flooded-east-africa/7597906.html,0,www.voanews.com,Tropical cyclone threatens to worsen humanitarian crisis in flooded East Africa,"GENEVA — The World Meteorological Organization warns that Tropical Cyclone Hidaya, which is projected to make landfall in Tanzania and Kenya this weekend, threatens to worsen the humanitarian crisis triggered by torrential rains in these and other heavily flo…",https://gdb.voanews.com/0251AA56-1CD6-44DB-9E30-1E227514C13D.jpg,2024-05-04T14:28:28Z,https://web.archive.org/web/20240504144306/https://www.voanews.com/a/tropical-cyclone-threatens-to-worsen-humanitarian-crisis-in-flooded-east-africa/7597906.html,"GENEVA  The World Meteorological Organization warns that Tropical Cyclone Hidaya, which is projected to make landfall in Tanzania and Kenya this weekend, threatens to worsen the humanitarian crisis t… [+4932 chars]",,en,Tropical Cyclone Hidaya,Tropical Cyclone,eonet,,SEAF,Africa
https://www.ibtimes.com/cyclone-bears-down-flood-hit-kenya-tanzania-3731248,https://www.ibtimes.com/cyclone-bears-down-flood-hit-kenya-tanzania-3731248,0,www.ibtimes.com,"Cyclone Bears Down On Flood-hit Kenya, Tanzania",Beaches were deserted and many shops closed on Saturday as heavy rains and winds from a tropical cyclone buffeted coastal areas of Tanzania and Kenya.,https://d.ibtimes.com/en/full/4524594/least-155-people-have-died-floods-tanzania-government-said-last-month.jpg,2024-05-04T15:27:09Z,https://web.archive.org/web/20240506003905/https://www.ibtimes.com/cyclone-bears-down-flood-hit-kenya-tanzania-3731248,"Beaches were deserted and many shops closed on Saturday as heavy rains and winds from a tropical cyclone buffeted coastal areas of Tanzania and Kenya.
Both countries have gone on alert for Tropical … [+3970 chars]",,en,Flood Kenya,Flood,relief,Kenya,SEAF,Africa
https://phys.org/news/2024-05-cyclone-kenya-tanzania.html,https://phys.org/news/2024-05-cyclone-kenya-tanzania.html,0,phys.org,"Cyclone bears down on flood-hit Kenya, Tanzania",Beaches were deserted and many shops closed on Saturday as heavy rains and winds from a tropical cyclone buffeted coastal areas of Tanzania and Kenya.,https://scx2.b-cdn.net/gfx/news/2024/at-least-155-people-ha.jpg,2024-05-05T19:47:14Z,https://web.archive.org/web/20240505195736/https://phys.org/news/2024-05-cyclone-kenya-tanzania.html,"Beaches were deserted and many shops closed on Saturday as heavy rains and winds from a tropical cyclone buffeted coastal areas of Tanzania and Kenya.
Both countries have gone on alert for Tropical … [+4093 chars]",,en,Flood Tanzania,Flood,relief,Tanzania,SEAF,Africa
