index,url,valid,domain,title,description,image,published,archive,content,quote,language,term,topic,feed,country,ipcc,continent
https://www.ibtimes.com/fresh-rains-pound-brazils-flood-hit-south-evacuations-double-3731715,https://www.ibtimes.com/fresh-rains-pound-brazils-flood-hit-south-evacuations-double-3731715,0,www.ibtimes.com,Fresh Rains Pound Brazil's Flood-hit South As Evacuations Double,"The skies opened once again Friday in southern Brazil, offering little respite for those whose homes have been swallowed by floodwaters, while the number of people forced to evacuate doubled in 24 hours.",https://d.ibtimes.com/en/full/4525491/state-capital-porto-alegre-home-14-million-inhabitants-tried-resume-certain-normalcy.jpg,2024-05-10T18:36:19Z,,"The skies opened once again Friday in southern Brazil, offering little respite for those whose homes have been swallowed by floodwaters, while the number of people forced to evacuate doubled in 24 ho… [+3025 chars]",,en,Rain Brazil,Precipitation,wmo,Brazil,SAM,South-America
https://www.foxnews.com/world/taliban-reports-50-dead-flash-floods-wreak-havoc-northern-afghanistan,https://www.foxnews.com/world/taliban-reports-50-dead-flash-floods-wreak-havoc-northern-afghanistan,0,www.foxnews.com,Taliban reports at least 50 dead as flash floods wreak havoc in northern Afghanistan,"Flash floods triggered by seasonal rains in northern Afghanistan's Baghlan province have left at least 50 people dead, according to the Taliban.",https://static.foxnews.com/foxnews.com/content/uploads/2024/05/Afghanistan.jpg,2024-05-10T20:06:08Z,,"Flash floods from seasonal rains in Baghlan province in northern Afghanistan killed at least 50 people on Friday, a Taliban official said.
The floods also caused losses to homes and property in seve… [+1065 chars]",,en,Flash Flood Afghanistan,Precipitation,relief,Afghanistan,WCA,Asia
https://www.ndtv.com/world-news/northern-lights-aurora-borealis-cover-europe-us-australia-after-strongest-solar-storm-in-2-decades-5638170,https://www.ndtv.com/world-news/northern-lights-aurora-borealis-cover-europe-us-australia-after-strongest-solar-storm-in-2-decades-5638170,0,www.ndtv.com,Glimpses Of Northern Lights After Strongest Solar Storm In 2 Decades,"The event was attributed to an ""extreme"" geomagnetic storm, which struck Earth making the Northern Lights visible in certain parts of the world.",https://c.ndtvimg.com/2024-05/lkvb00f_northern-lights_625x300_11_May_24.jpeg?ver-20240506.08,2024-05-11T06:09:52Z,,"Northern lights or aurora borealis illuminate the night sky over Vienna during a geomagnetic storm
The northern lights made a stunning appearance across the world on Friday after the most powerful s… [+3697 chars]",,en,storm,Storm,random,,,
https://www.cbc.ca/news/politics/wildfires-climate-military-canada-1.7200878,https://www.cbc.ca/news/politics/wildfires-climate-military-canada-1.7200878,0,www.cbc.ca,Ottawa turns to civilian first responders as another dire wildfire season approaches,"Instead of sending in the troops to deal with what promises to be another dangerous wildfire season, Public Safety Canada is testing the capabilities of a civilian-led firefighting force as first responders and relief providers.",https://i.cbc.ca/1.7156501.1711552098!/fileImage/httpImage/image.JPG_gen/derivatives/16x9_620/wildfires-bc-20230818.JPG,2024-05-11T08:00:00Z,,"Instead of sending in the troops to deal with what promises to be another dangerous wildfire season, Public Safety Canada is testing the capabilities of civilian-led first responders and relief provi… [+4412 chars]",,en,wildfire,Wildfire,random,,,
https://www.aljazeera.com/news/2024/5/11/awe-and-alarm-as-extreme-solar-storm-hits-earth,https://www.aljazeera.com/news/2024/5/11/awe-and-alarm-as-extreme-solar-storm-hits-earth,0,www.aljazeera.com,Awe and alarm as ‘extreme’ solar storm hits Earth,"Weather experts warn of potential disruptions to power grids, communications as sun's outburst continues in coming days.",https://www.aljazeera.com/wp-content/uploads/2024/05/GettyImages-2152392423-1715412383.jpg?resize=1200%2C675,2024-05-11T08:20:40Z,,"The most powerful solar storm in more than 20 years has struck Earths atmosphere, triggering warnings over the potential disruption to power grids and satellite communications while also producing sp… [+3461 chars]",,en,storm,Storm,random,,,
https://www.ibtimes.com.au/first-extreme-solar-storm-20-years-brings-spectacular-auroras-1848006,https://www.ibtimes.com.au/first-extreme-solar-storm-20-years-brings-spectacular-auroras-1848006,0,www.ibtimes.com.au,First 'Extreme' Solar Storm In 20 Years Brings Spectacular Auroras,"The most powerful solar storm in more than two decades struck Earth on Friday, triggering spectacular celestial light shows from Tasmania to Britain -- and threatening possible disruptions to satellites and power grids as it persists into the weekend.",https://d.ibtimes.com.au/en/full/1849347/solar-storm-could-bring-auroras-also-known-northern-lights-southern-lights-depending.jpg,2024-05-11T08:30:28Z,,"The most powerful solar storm in more than two decades struck Earth on Friday, triggering spectacular celestial light shows from Tasmania to Britain -- and threatening possible disruptions to satelli… [+4772 chars]",,en,Storm Ning er,Storm,wmo,China,EAS,Asia
https://phys.org/news/2024-05-fresh-pound-brazil-south-evacuations.html,https://phys.org/news/2024-05-fresh-pound-brazil-south-evacuations.html,0,phys.org,Fresh rains pound Brazil's flood-hit south as evacuations double,"The skies opened once again Friday in southern Brazil, offering little respite for those whose homes have been swallowed by floodwaters, while the number of people forced to evacuate doubled in 24 hours.",https://scx2.b-cdn.net/gfx/news/2024/residents-of-the-state.jpg,2024-05-11T08:35:29Z,,"The skies opened once again Friday in southern Brazil, offering little respite for those whose homes have been swallowed by floodwaters, while the number of people forced to evacuate doubled in 24 ho… [+3290 chars]",,en,Rain Brazil,Precipitation,wmo,Brazil,SAM,South-America
https://www.newsweek.com/power-warning-issued-first-extreme-geomagnetic-storm-hits-20-years-1899539,https://www.newsweek.com/power-warning-issued-first-extreme-geomagnetic-storm-hits-20-years-1899539,0,www.newsweek.com,Power Warning Issued As First 'Extreme' Geomagnetic Storm Hits in 20 Years,"The NOAA Space Weather Prediction Center warned that a severe geomagnetic storm could disrupt mobile phone networks, GPS satellites and power grids in the U.S.",https://d.newsweek.com/en/full/2391588/northern-lights-canada.jpg,2024-05-11T09:02:21Z,,"A severe geomagnetic storm which has made sightings of the Northern lights possible in places that rarely witness it has also prompted power warnings, as officials fear it could wreak havoc on mobile… [+3505 chars]",,en,storm,Storm,random,,,
https://www.independent.ie/weather/northern-lights-may-be-visible-across-ireland-again-tonight-as-stunning-pictures-show-effect-of-rare-solar-storm/a1588834864.html,https://www.independent.ie/weather/northern-lights-may-be-visible-across-ireland-again-tonight-as-stunning-pictures-show-effect-of-rare-solar-storm/a1588834864.html,0,www.independent.ie,Northern Lights may be visible across Ireland again tonight as stunning pictures show effect of rare solar storm,"The Northern Lights put on a stunning display for people across Ireland on Friday night, with the aurora borealis visible in many parts of the country – and there’s a chance it could happen again tonight.",https://focus.independent.ie/thumbor/fWUuBIqTjgxNlZOS5tiv07-VVnM=/60x0:735x450/629x0/prod-mh-ireland/2fe21b09-a0db-4462-9895-f94e9aa21a86/5176382d-e7d7-4928-ac80-68f7ae08210f/video/video.jpg,2024-05-11T10:21:00Z,,"The Northern Lights put on a stunning display for people across Ireland on Friday night, with the aurora borealis visible in many parts of the country and theres a chance it could happen again tonigh… [+2798 chars]",,en,Storm Ning er,Storm,wmo,China,EAS,Asia
https://news.sky.com/story/strongest-solar-storm-in-decades-hits-earth-as-northern-lights-to-return-to-parts-of-uk-tonight-13133384,https://news.sky.com/story/strongest-solar-storm-in-decades-hits-earth-as-northern-lights-to-return-to-parts-of-uk-tonight-13133384,0,news.sky.com,Strongest solar storm in decades hits Earth - as Northern Lights to return to parts of UK tonight,"Earth has been rocked by the first extreme geomagnetic storm in two decades, creating a spectacular light show in UK skies and other parts of the Northern Hemisphere - but also posing a threat to communication networks, navigation systems and power grids.",https://e3.365dm.com/24/05/1600x900/skynews-edinburgh-northern_6550132.jpg?20240511130548,2024-05-11T11:35:00Z,,"Earth has been rocked by the first extreme geomagnetic storm in two decades, creating a spectacular light show in UK skies and other parts of the Northern Hemisphere - but also posing a threat to com… [+3474 chars]",,en,storm,Storm,random,,,
https://www.voanews.com/a/un-reports-300-deaths-from-flash-floods-in-northern-afghanistan/7607131.html,https://www.voanews.com/a/un-reports-300-deaths-from-flash-floods-in-northern-afghanistan/7607131.html,0,www.voanews.com,UN reports 300 deaths from flash floods in northern Afghanistan,"ISLAMABAD — The United Nations and Taliban authorities said Saturday that the death toll from flash floods following heavy seasonal rains in Afghanistan’s northern Baghlan province had risen to a least 300.


The U.N. World Food Program said the flooding dest…",https://gdb.voanews.com/48710D3B-BA72-43E4-81E7-698D9ECD0054.jpg,2024-05-11T12:03:30Z,,ISLAMABAD  The United Nations and Taliban authorities said Saturday that the death toll from flash floods following heavy seasonal rains in Afghanistans northern Baghlan province had risen to a least… [+3993 chars],,en,heavy rain,Precipitation,random,,,
https://www.newser.com/story/350213/the-sky-put-on-quite-a-show-last-night.html,https://www.newser.com/story/350213/the-sky-put-on-quite-a-show-last-night.html,0,www.newser.com,The Sky Put On Quite a Show Last Night,"An unusually strong solar storm hitting Earth produced stunning displays of color in the skies across the Northern Hemisphere early Saturday, with no immediate reports of disruptions to power and communications. The US National Oceanic and Atmospheric Adminis…",https://img2-azrcdn.newser.com/image/1534323-12-20240511075502.jpeg,2024-05-11T12:30:00Z,,"An unusually strong solar storm hitting Earth produced stunning displays of color in the skies across the Northern Hemisphere early Saturday, with no immediate reports of disruptions to power and com… [+2428 chars]",,en,Storm Ning er,Storm,wmo,China,EAS,Asia
https://apnews.com/article/solar-storm-flares-eruption-sun-fc23251025efc2d20dc128dc0b6a7c68,https://apnews.com/article/solar-storm-flares-eruption-sun-fc23251025efc2d20dc128dc0b6a7c68,0,apnews.com,SOLAR STORM HITS EARTH...,"An unusually strong solar storm hitting Earth produced stunning displays of color in the skies across the Northern Hemisphere, with no immediate reports of disruptions to power and communications. The U.S. National Oceanic and Atmospheric Administration issue…",https://dims.apnews.com/dims4/default/5076a71/2147483647/strip/true/crop/3994x2247+0+208/resize/1440x810!/quality/90/?url=https%3A%2F%2Fassets.apnews.com%2F1f%2F8e%2F60ba584e4f6cf80b59a0f6689a86%2Fb1f63f255f1544eeb0138d482b877424,2024-05-11T13:00:06Z,,"CAPE CANAVERAL, Fla. (AP) An unusually strong solar storm hitting Earth produced stunning displays of color in the skies across the Northern Hemisphere early Saturday, with no immediate reports of di… [+4537 chars]",,en,storm,Storm,random,,,
https://www.channelnewsasia.com/world/more-300-dead-afghanistan-flash-floods-4329041,https://www.channelnewsasia.com/world/more-300-dead-afghanistan-flash-floods-4329041,0,www.channelnewsasia.com,More than 300 dead in Afghanistan flash floods,"LAQAYI, Afghanistan: More than 300 people were killed in flash floods that ripped through multiple Afghan provinces, the World Food Programme said on Saturday (May 11), as authorities declared a state of emergency and rushed to rescue the injured. Heavy rains…","https://onecms-res.cloudinary.com/image/upload/s--JFqQgcpE--/fl_relative,g_south_east,l_mediacorp:cna:watermark:2023-11:afp_watermark_14112023,w_0.1/f_auto,q_auto/c_fill,g_auto,h_676,w_1200/v1/one-cms/core/03aa4729ccb0672743597950521b67e4b54e106e.jpg?itok=Xd_MVR4k",2024-05-11T13:00:16Z,,"LAQAYI, Afghanistan: More than 300 people were killed in flash floods that ripped through multiple Afghan provinces, the World Food Programme said on Saturday (May 11), as authorities declared a stat… [+3950 chars]",,en,Flash Flood Afghanistan,Flood,relief,Afghanistan,WCA,Asia
https://time.com/6977133/solar-storm-earth-lights-northern-hemisphere-pictures/,https://time.com/6977133/solar-storm-earth-lights-northern-hemisphere-pictures/,0,time.com,"Solar Storm Hits Earth, Resulting in Colorful Light Shows Across Northern Hemisphere",An unusually strong solar storm hitting Earth produced stunning displays of color in the skies across the Northern Hemisphere.,https://api.time.com/wp-content/uploads/2024/05/AP24132132453833.jpg?quality=85&w=1200&h=628&crop=1,2024-05-11T13:16:38Z,,"CAPE CANAVERAL, Fla. An unusually strong solar storm hitting Earth produced stunning displays of color in the skies across the Northern Hemisphere early Saturday, with no immediate reports of disrupt… [+4115 chars]",,en,Storm Ning er,Storm,wmo,China,EAS,Asia
https://economictimes.indiatimes.com/news/international/world-news/first-extreme-solar-storm-in-20-years-brings-spectacular-auroras/articleshow/110038114.cms,https://economictimes.indiatimes.com/news/international/world-news/first-extreme-solar-storm-in-20-years-brings-spectacular-auroras/articleshow/110038114.cms,0,economictimes.indiatimes.com,First 'extreme' solar storm in 20 years brings spectacular auroras,Powerful solar storms caused celestial light shows and threats to satellites and power grids. Social media shared aurora pictures. Tasmania and Europe experienced spectacular skies. Starlink's Elon Musk commented on the storm. University of Reading's Mathew O…,"https://img.etimg.com/thumb/msid-110038121,width-1200,height-630,imgsize-44908,overlay-economictimes/photo.jpg",2024-05-11T13:23:26Z,,"Earth was set to be struck by more powerful solar storms on Saturday, a day after the most power events in two decades triggered spectacular celestial light shows from Tasmania to Britain and threate… [+4449 chars]",,en,storm,Storm,random,,,
https://arstechnica.com/space/2024/05/noaa-says-extreme-solar-storm-will-persist-through-the-weekend/,https://arstechnica.com/space/2024/05/noaa-says-extreme-solar-storm-will-persist-through-the-weekend/,0,arstechnica.com,NOAA says ‘extreme’ Solar storm will persist through the weekend,So far disruptions from the geomagnetic storm appear to be manageable.,https://cdn.arstechnica.net/wp-content/uploads/2024/05/image0-760x380.jpeg,2024-05-11T13:44:43Z,,"Enlarge/ Pink lights appear in the sky above College Station, Texas.
2
After a night of stunning auroras across much of the United States and Europe on Friday, a severe geomagnetic storm is likely … [+2929 chars]",,en,storm,Storm,random,,,
https://www.news24.com/news24/southafrica/news/gansbaai-photographer-captures-rare-southern-lights-sighting-in-sa-20240511,https://www.news24.com/news24/southafrica/news/gansbaai-photographer-captures-rare-southern-lights-sighting-in-sa-20240511,0,www.news24.com,News24 | Gansbaai photographer captures rare southern lights sighting in SA,"South Africa may be far south, but some lucky people managed to see the colourful space storm that was more visible to the planet's northern inhabitants, according to the SA National Space Agency.",https://cdn.24.co.za/files/Cms/General/d/11731/81a4a6b8c38a43c0b2c17df220233f2a.jpg,2024-05-11T14:06:13Z,,"South Africa may be far south, but some lucky people managed to see the colourful space storm that was more visible to the planet's northern inhabitants, according to the SA National Space Agency (Sa… [+346 chars]",,en,storm,Storm,random,,,
https://news.sky.com/story/flash-floods-kill-at-least-300-in-afghanistan-after-heavy-seasonal-rains-13133644,https://news.sky.com/story/flash-floods-kill-at-least-300-in-afghanistan-after-heavy-seasonal-rains-13133644,0,news.sky.com,Flash floods kill at least 300 in Afghanistan,"At least 300 people have been killed in flash floods in northern Afghanistan, according to the UN food agency.",https://e3.365dm.com/24/05/1600x900/skynews-afghanistan-baghlan_6550489.jpg?20240511153931,2024-05-11T14:25:00Z,,"At least 300 people have been killed in flash floods in northern Afghanistan, according to the UN food agency.
Heavy seasonal rains have also destroyed more than a thousand houses leaving many witho… [+2537 chars]",,en,Flash Flood Afghanistan,Precipitation,relief,Afghanistan,WCA,Asia
https://www.ktvu.com/news/solar-storm-hits-earth-producing-colorful-light-shows-over-east-bay,https://www.ktvu.com/news/solar-storm-hits-earth-producing-colorful-light-shows-over-east-bay,0,www.ktvu.com,"Solar storm hits Earth, producing colorful light shows over East Bay",An unusually strong solar storm hitting Earth produced stunning displays of color in the skies across the Bay Area and the Northern Hemisphere early Saturday.,https://images.foxtv.com/static.ktvu.com/www.ktvu.com/content/uploads/2024/05/1280/720/image-2.jpg?ve=1&tl=1,2024-05-11T15:00:39Z,,"OAKLEY, Calif. - An unusually strong solar storm hitting Earth produced stunning displays of color in the skies across the Bay Area and the Northern Hemisphere early Saturday. 
There were no immedia… [+3604 chars]",,en,storm,Storm,random,,,
https://www.bbc.co.uk/news/world-us-canada-68996062,https://www.bbc.co.uk/news/world-us-canada-68996062,0,www.bbc.co.uk,Thousands evacuated due to British Columbia wildfire,"Fort McMurray residents in neighbouring Alberta, Canada are also under an evacuation alert due to a blaze.",https://ichef.bbci.co.uk/news/1024/branded_news/7B6F/production/_133299513_4c8964c4-30ba-4037-b642-b129f818bc91.jpg,2024-05-11T15:07:53Z,,"Thousands of Canadians have been ordered to leave from their homes in Fort Nelson, British Columbia due to the threat of a wildfire. 
The blaze began on Friday night and was described by officials a… [+2676 chars]",,en,Wildfire Canada,Wildfire,esawfa,Canada,NEN,North-America
https://consent.yahoo.com/v2/collectConsent?sessionId=1_cc-session_d90f6365-48a4-47c0-b308-0c23479a2b68,https://consent.yahoo.com/v2/collectConsent?sessionId=1_cc-session_d90f6365-48a4-47c0-b308-0c23479a2b68,0,consent.yahoo.com,"Thousands told to evacuate due to British Columbia, Canada wildfire",,,2024-05-11T15:07:54Z,,"If you click 'Accept all', we and our partners, including 238 who are part of the IAB Transparency &amp; Consent Framework, will also store and/or access information on a device (in other words, use … [+678 chars]",,en,Wildfire Canada,Wildfire,esawfa,Canada,NEN,North-America
https://www.wnd.com/2024/05/powerful-geomagnetic-storm-reaches-earth/,https://www.wnd.com/2024/05/powerful-geomagnetic-storm-reaches-earth/,0,www.wnd.com,Powerful geomagnetic storm reaches Earth,"(NEW YORK POST) – The powerful geomagnetic storm that will make the northern lights visible to much of the US has been upgraded to a Level 5, the National Oceanic and Atmospheric announced in an updated warning. “Extreme” G5 conditions reached Earth from the …",https://www.wnd.com/wp-content/uploads/2015/05/solar_flare.jpg,2024-05-11T15:07:56Z,,"(NEW YORK POST) The powerful geomagnetic storm that will make the northern lights visible to much of the US has been upgraded to a Level 5, the National Oceanic and Atmospheric announced in an update… [+929 chars]",,en,storm,Storm,random,,,
https://www.tmz.com/2024/05/11/bill-nye-northern-lights-aurora-borealis-solar-storm-danger/,https://www.tmz.com/2024/05/11/bill-nye-northern-lights-aurora-borealis-solar-storm-danger/,0,www.tmz.com,"Northern Lights On Amazing Display All Over U.S., Bill Nye Issues Warning","Long before the 4th of July, the skies over America are filling with beautiful colors, courtesy of a massive solar storm -- but before you get too awestruck by the beauty ... Bill Nye the Science Guy has a warning. The Northern Lights, or Aurora…",https://imagez.tmz.com/image/cd/16by9/2024/05/11/cde996251c89482ead9dbd5e69d5722f_xl.jpg,2024-05-11T15:08:25Z,,"Long before the 4th of July, the skies over America are filling with beautiful colors, courtesy of a massive solar storm -- but before you get too awestruck by the beauty ... Bill Nye the Science Guy… [+1728 chars]",,en,storm,Storm,random,,,
https://www.breitbart.com/europe/2024/05/11/pictures-strong-solar-storm-sparks-aurora-lights-show-across-northern-hemisphere/,https://www.breitbart.com/europe/2024/05/11/pictures-strong-solar-storm-sparks-aurora-lights-show-across-northern-hemisphere/,0,www.breitbart.com,Pictures: Strong Solar Storm Sparks Aurora Lights Show Across Northern Hemisphere,"An unusually strong solar storm hitting Earth produced stunning displays of color in the skies across the Northern Hemisphere early Saturday.
The post Pictures: Strong Solar Storm Sparks Aurora Lights Show Across Northern Hemisphere appeared first on Breitbar…",https://media.breitbart.com/media/2024/05/AP24131838993789-1-640x335.jpg,2024-05-11T15:49:43Z,,"CAPE CANAVERAL, Fla. (AP) – An unusually strong solar storm hitting Earth produced stunning displays of color in the skies across the Northern Hemisphere early Saturday, with no immediate reports of … [+4765 chars]",,en,Storm Ning er,Storm,wmo,China,EAS,Asia
https://www.ibtimes.com.au/more-300-dead-afghanistan-flash-floods-wfp-1848008,https://www.ibtimes.com.au/more-300-dead-afghanistan-flash-floods-wfp-1848008,0,www.ibtimes.com.au,More Than 300 Dead In Afghanistan Flash Floods: WFP,"More than 300 people were killed in flash floods that ripped through multiple Afghan provinces, the UN's World Food Programme said Saturday, as authorities declared a state of emergency and rushed to rescue the injured.",https://d.ibtimes.com.au/en/full/1849354/floods-afghanistans-baghlan-province-have-killed-more-200-people-iom-says.jpg,2024-05-11T20:33:25Z,,"More than 300 people were killed in flash floods that ripped through multiple Afghan provinces, the UN's World Food Programme said Saturday, as authorities declared a state of emergency and rushed to… [+4609 chars]",,en,Flash Flood Afghanistan,Precipitation,relief,Afghanistan,WCA,Asia
https://www.upi.com/Top_News/World-News/2024/05/11/canada-wildfire/1551715462098/,https://www.upi.com/Top_News/World-News/2024/05/11/canada-wildfire/1551715462098/,0,www.upi.com,Wildfire in British Columbia prompts evacuations,"Officials in western Canada ordered the evacuation Saturday of thousands of residents in response to a wildfire that's grown to about 4,200 acres in size.",https://media.zenfs.com/en/united_press_international_articles_356/b90ad63b9d6190cd6d2515067da858f5,2024-05-11T23:12:38Z,,"May 11 (UPI) -- Officials in western Canada ordered the evacuation Saturday of thousands of residents in response to a wildfire that's grown to about 4,200 acres in size.
The British Columbia govern… [+1509 chars]",,en,Wildfire Canada,Wildfire,esawfa,Canada,NEN,North-America
https://english.khabarhub.com/2024/12/355187/,https://english.khabarhub.com/2024/12/355187/,0,english.khabarhub.com,Death toll from floods in Brazil’s south climbs to at least 136,"RIO DE JANEIRO: The death toll from heavy rains in Brazil’s Rio Grande do Sul state has climbed to 136, the local civil defense government body said, up from 126 the previous day, while another 125 people remain unaccounted for. Storms and floods battering th…",https://i0.wp.com/english.khabarhub.com/wp-content/uploads/2024/05/Brazil_FloodsAP.jpg?fit=1023%2C575&ssl=1,2024-05-12T03:45:21Z,,"A man rows a boat on a street flooded by heavy rains, in Sao Leopoldo, Rio Grande do Sul state, Brazil/Photo: APRIO DE JANEIRO: The death toll from heavy rains in Brazil’s Rio Grande do Sul state has… [+1203 chars]",,en,Rain Brazil,Precipitation,wmo,Brazil,SAM,South-America
https://www.globalsecurity.org/military/library/news/2024/05/mil-240511-voa03.htm,https://www.globalsecurity.org/military/library/news/2024/05/mil-240511-voa03.htm,0,www.globalsecurity.org,UN reports 300 deaths from flash floods in northern Afghanistan,The United Nations and Taliban authorities said Saturday that the death toll from flash floods following heavy seasonal rains in Afghanistan's northern Baghlan province had risen to a least 300.,,2024-05-12T07:46:54Z,,"By Ayaz Gul May 11, 2024
The United Nations and Taliban authorities said Saturday that the death toll from flash floods following heavy seasonal rains in Afghanistan's northern Baghlan province had … [+4141 chars]",,en,Flash Flood Afghanistan,Precipitation,relief,Afghanistan,WCA,Asia
https://www.voanews.com/a/afghan-officials-put-flood-toll-at-315/7607825.html,https://www.voanews.com/a/afghan-officials-put-flood-toll-at-315/7607825.html,0,www.voanews.com,Afghan officials put flood toll at 315,"Islamabad, Pakistan — Afghan officials said Sunday that the death toll from Friday’s flash floods in the northern Baghlan province had risen to at least 315, with more than 1,600 people injured.


The refugee ministry announced the latest casualties through s…",https://gdb.voanews.com/A56D4C82-3FE1-4CCA-B820-66E03F270F70.jpg,2024-05-12T10:49:52Z,,"Islamabad, Pakistan  Afghan officials said Sunday that the death toll from Fridays flash floods in the northern Baghlan province had risen to at least 315, with more than 1,600 people injured.
The r… [+2931 chars]",,en,Flash Flood Pakistan,Precipitation,relief,Pakistan,SAS,Asia
