index,url,valid,domain,title,description,image,published,archive,content,quote,language,term,topic,feed,country,ipcc,continent
https://www.independent.ie/irish-news/status-orange-snow-and-ice-warning-issued-for-eight-counties-and-separate-orange-alert-for-cork-and-kerry/a1336722433.html,https://www.independent.ie/irish-news/status-orange-snow-and-ice-warning-issued-for-eight-counties-and-separate-orange-alert-for-cork-and-kerry/a1336722433.html,0,www.independent.ie,Status Orange snow and ice warning issued for eight counties and separate Orange alert for Cork and Kerry,A Status Orange snow and ice warning has been issued for eight counties while a separate Status Orange rain and snow warning has also been issued for Cork and Kerry this weekend.,https://focus.independent.ie/thumbor/Sc2mU2ZOwMWfc0t6v9PlztqGgkE=/60x0:735x450/629x0/prod-mh-ireland/ca13830c-6bb2-4de1-9d40-436f3fb09687/92e9dc6a-93b1-4949-8050-afacd3d073fa/video/video.jpg,2025-01-03T17:11:00Z,https://web.archive.org/web/20250104015010/https://www.independent.ie/irish-news/status-orange-snow-and-ice-warning-issued-for-eight-counties-and-separate-orange-alert-for-cork-and-kerry/a1336722433.html,A Status Orange snow and ice warning has been issued for eight counties while a separate Status Orange rain and snow warning has also been issued for Cork and Kerry this weekend.Weather conditions ar… [+5742 chars],,en,Snow Cork Kerry,Snow&Ice,wmo,Ireland,NEU,Europe
https://www.abc.net.au/news/2025-01-04/victoria-on-high-alert-with-sweltering-heatwave/104780930,https://www.abc.net.au/news/2025-01-04/victoria-on-high-alert-with-sweltering-heatwave/104780930,0,www.abc.net.au,Total fire ban declared as firefighters prepare for heatwave conditions in Victoria,"Authorities have declared a total fire ban for parts of western Victoria near where an out-of-control bushfire continues to burn, ahead of a heatwave engulfing the state this weekend.",https://live-production.wcms.abc-cdn.net.au/fb66c447a4bade9fe2d36fc93df38b1c?impolicy=wcms_watermark_news&cropH=1152&cropW=2048&xPos=0&yPos=192&width=862&height=485&imformat=generic,2025-01-03T18:30:00Z,,"Authorities have declared a total fire ban for parts of western Victoria near where an out-of-control bushfire continues to burn, ahead of a heatwave engulfing the state this weekend.
The Bureau of … [+3911 chars]",,en,bushfire,Wildfire,random,,,
https://www.nbcnews.com/weather/storms/major-winter-storms-wallop-two-thirds-us-bring-heavy-snow-hazardous-ic-rcna186181,https://www.nbcnews.com/weather/storms/major-winter-storms-wallop-two-thirds-us-bring-heavy-snow-hazardous-ic-rcna186181,0,www.nbcnews.com,"Major winter storms to wallop two-thirds of U.S., could bring heavy snow and hazardous ice",Most of the eastern two-thirds of the U.S. is expected to bear the brunt of winter storms this weekend through to early next week.,"https://media-cldnry.s-nbcnews.com/image/upload/t_nbcnews-fp-1200-630,f_auto,q_auto:best/rockcms/2025-01/250103-snow-pennsylvania-mn-1550-eeb345.jpg",2025-01-03T21:21:41Z,https://web.archive.org/web/20250103221355/https://www.nbcnews.com/weather/storms/major-winter-storms-wallop-two-thirds-us-bring-heavy-snow-hazardous-ic-rcna186181,"Most of the eastern two-thirds of the U.S. is expected to bear the brunt of winter storms this weekend through to early next week. 
Before the major system hits, however, light snow fell across port… [+2525 chars]",,en,storm,Storm,random,,,
https://www.sciencealert.com/scientists-discover-mystery-volcano-that-cooled-the-globe-in-1831,https://www.sciencealert.com/scientists-discover-mystery-volcano-that-cooled-the-globe-in-1831,0,www.sciencealert.com,Scientists Discover Mystery Volcano That Cooled The Globe in 1831,"In 1831, somewhere on Earth's surface, a portal to the underworld appeared.",https://www.sciencealert.com/images/2025/01/ice-cores.jpg,2025-01-03T21:55:20Z,https://web.archive.org/web/20250103221827/https://www.sciencealert.com/scientists-discover-mystery-volcano-that-cooled-the-globe-in-1831,"In 1831, somewhere on Earth's surface, a portal to the underworld appeared.
A massive volcano opened wide its jaws and belched forth so much ash and smoke that the skies dimmed, cooling the Northern… [+3727 chars]",,en,volcano,Volcano,random,,,
https://www.mentalfloss.com/mystery-volcano-1813-identified,https://www.mentalfloss.com/mystery-volcano-1813-identified,0,www.mentalfloss.com,Solved: The 200-Old Mystery Behind a Colossal Volcanic Eruption,Scientists have long suspected that a gigantic eruption was behind the strange atmospheric phenomena of 1831. Scientists have finally figured out which volcano blew its top.,"https://images2.minutemediacdn.com/image/upload/c_crop,w_2000,h_1125,x_0,y_95/v1735936123/images/voltaxMediaLibrary/mmsport/mentalfloss/01jgpxp76z005dwn0bj4.jpg",2025-01-03T22:03:00Z,http://archive.md/20250106225738/https://www.mentalfloss.com/mystery-volcano-1813-identified,"The sun, observed through the dense fog, appeared as a pale whitish-blue disc, wrote one observer in Palermo, Sicily, on August 8, 1831. Two days later, a person in Saint-Sever, France, noted that th… [+3215 chars]",,en,volcano,Volcano,random,,,
https://www.cbc.ca/sports/hockey/canada-host-iihf-womens-hockey-tournnaments-hockey-canada-1.7422947,https://www.cbc.ca/sports/hockey/canada-host-iihf-womens-hockey-tournnaments-hockey-canada-1.7422947,0,www.cbc.ca,Canada to host 5 IIHF women's hockey tournaments over 5 years,"Canada will host five major international women's hockey tournaments between 2026 and 2030, Hockey Canada and the International Ice Hockey Federation announced Friday.",https://i.cbc.ca/1.7341386.1727967247!/fileImage/httpImage/image.jpg_gen/derivatives/16x9_1180/hockey-canada-summit-240111-1180.jpg?im=Resize%3D620,2025-01-03T22:22:16Z,,"Canada will host five major international women's hockey tournaments between 2026 and 2030, Hockey Canada and the International Ice Hockey Federation announced Friday.
Canada will host the world wom… [+1288 chars]",,en,Ice Canada,Snow&Ice,wmo,Canada,NEN,North-America
https://news.sky.com/story/uk-weather-warnings-for-snow-and-freezing-rain-across-large-parts-of-the-country-this-weekend-13283427,https://news.sky.com/story/uk-weather-warnings-for-snow-and-freezing-rain-across-large-parts-of-the-country-this-weekend-13283427,0,news.sky.com,Warnings for snow and freezing rain across the UK over the weekend,"Warnings have been issued for heavy snow and freezing rain over the weekend, with icy weather expected to cause disruption across large parts of the UK.",https://e3.365dm.com/25/01/1600x900/skynews-edinburgh-weather-snow_6790871.jpg?20250103232126,2025-01-04T00:01:00Z,https://web.archive.org/web/20250104022151/https://news.sky.com/story/uk-weather-warnings-for-snow-and-freezing-rain-across-large-parts-of-the-country-this-weekend-13283427,"Warnings have been issued for heavy snow and freezing rain over the weekend, with icy weather expected to cause disruption across large parts of the UK.
Two amber and two yellow alerts have been iss… [+4428 chars]",,en,freezing,Snow&Ice,random,,,
https://www.voanews.com/a/winter-storms-to-hit-much-of-us-with-snow-ice-biting-cold/7923866.html,https://www.voanews.com/a/winter-storms-to-hit-much-of-us-with-snow-ice-biting-cold/7923866.html,0,www.voanews.com,"Winter storms to hit much of US with snow, ice, biting cold","A strong snow and ice storm followed by brutally cold conditions will soon smack the eastern two-thirds of the United States as frigid air escapes the Arctic, plunging as far south as Florida, meteorologists said.


Starting Saturday, millions of people are g…",https://gdb.voanews.com/578D9E38-9D51-46CD-9C74-65EFD061D9EC.jpg,2025-01-04T00:10:36Z,,"A strong snow and ice storm followed by brutally cold conditions will soon smack the eastern two-thirds of the United States as frigid air escapes the Arctic, plunging as far south as Florida, meteor… [+3802 chars]",,en,Snow United States,Snow&Ice,wmo,United States,CNA,North-America
https://www.cbsnews.com/news/winter-storm-snow-ice-cold-eastern-us/,https://www.cbsnews.com/news/winter-storm-snow-ice-cold-eastern-us/,0,www.cbsnews.com,"Powerful winter storm to bring snowy, icy conditions to Midwest, Mid-Atlantic","Starting Saturday, millions of people are going to be hit by moderate to heavy snow from Kansas City to Washington, forecasters say.",https://assets1.cbsnewsstatic.com/hub/i/r/2025/01/03/a6e3eb67-4221-4392-be83-0e5bcb1b8e17/thumbnail/1200x630/d998758db77d7abd874751b01415b27a/gettyimages-2191733939.jpg?v=fa9977353833f46f40b07abcd9d5240b,2025-01-04T00:12:31Z,https://web.archive.org/web/20250104001846/https://www.cbsnews.com/news/winter-storm-snow-ice-cold-eastern-us/,"Next Weather: WBZ Evening Forecast For January 3, 2025 
Next Weather: WBZ Evening Forecast For January 3, 202503:13
A strong snow and ice storm followed by brutally cold conditions will soon smack … [+4831 chars]",,en,Snow Fu an City,Snow&Ice,wmo,China,EAS,Asia
https://www.thestar.com.my/news/world/2025/01/04/australia039s-southeast-sweats-through-heatwave-facing-bushfire-risk,https://www.thestar.com.my/news/world/2025/01/04/australia039s-southeast-sweats-through-heatwave-facing-bushfire-risk,0,www.thestar.com.my,"Australia's southeast sweats through heatwave, facing bushfire risk",SYDNEY (Reuters) - Australia's southeast on Saturday sweltered in a heat wave that raised the risk of bushfires and led authorities to issue fire bans for large parts of Victoria state. Read full story,https://cdn.thestar.com.my/Themes/img/newTsol_logo_socmedia.png,2025-01-04T00:27:00Z,,"SYDNEY (Reuters) - Australia's southeast on Saturday sweltered in a heat wave that raised the risk of bushfires and led authorities to issue fire bans for large parts of Victoria state.
Australia fa… [+1315 chars]",,en,Bushfire Australia,Wildfire,esawfa,Australia,CAU,Oceania
https://7news.com.au/news/victorians-sweltering-as-experts-warn-heat-wave-will-get-worse-before-it-gets-better--c-17280790,https://7news.com.au/news/victorians-sweltering-as-experts-warn-heat-wave-will-get-worse-before-it-gets-better--c-17280790,0,7news.com.au,Victorians sweltering as experts warn heat wave will get worse before it gets better,Victorians sweltering as experts warn heat wave will get worse before it gets better7news.com.au,https://images.7news.com.au/publication/C-17280790/7ad48979690358e6f59032ed566f208513eb38e0-16x9-x0y0w2000h1125.jpg?imwidth=1200,2025-01-04T02:10:53Z,,"A severe heat wave warning has been issued for large parts of Victoria, as experts warn the worst is yet to come.
The Bureau of Meteorology first issued the warning on Wednesday, which includes majo… [+1357 chars]",,en,heat wave Victoria,Heat Wave,acwe,Australia,SAU,Oceania
https://www.independent.ie/irish-news/over-10cm-of-snow-likely-as-met-eireann-issues-status-orange-alert-ahead-of-arctic-blast/a142054128.html,https://www.independent.ie/irish-news/over-10cm-of-snow-likely-as-met-eireann-issues-status-orange-alert-ahead-of-arctic-blast/a142054128.html,0,www.independent.ie,Over 10cm of snow likely as Met Éireann issues Status Orange alert ahead of Arctic blast,Ireland will see over 10cm of snowfall across south Leinster and north Munster this weekend as the country is set to experience its worst Arctic weather for almost seven years.,https://focus.independent.ie/thumbor/Sc2mU2ZOwMWfc0t6v9PlztqGgkE=/60x0:735x450/629x0/prod-mh-ireland/ca13830c-6bb2-4de1-9d40-436f3fb09687/92e9dc6a-93b1-4949-8050-afacd3d073fa/video/video.jpg,2025-01-04T02:30:00Z,https://web.archive.org/web/20250104091125/https://www.independent.ie/irish-news/over-10cm-of-snow-likely-as-met-eireann-issues-status-orange-alert-ahead-of-arctic-blast/a142054128.html,Ireland will see over 10cm of snowfall across south Leinster and north Munster this weekend as the country is set to experience its worst Arctic weather for almost seven years.Not since Storm Emma or… [+6654 chars],,en,Snow Ireland,Snow&Ice,wmo,Ireland,NEU,Europe
https://www.independent.ie/irish-news/arctic-blast-over-10cm-of-snow-likely-as-status-orange-warnings-set-for-ten-counties-ahead-of-multi-hazard-weather-event/a142054128.html,https://www.independent.ie/irish-news/arctic-blast-over-10cm-of-snow-likely-as-status-orange-warnings-set-for-ten-counties-ahead-of-multi-hazard-weather-event/a142054128.html,0,www.independent.ie,Arctic blast: Over 10cm of snow likely as Status Orange warnings set for ten counties ahead of ‘multi-hazard weather event’,Ireland will see over 10cm of snowfall across south Leinster and north Munster this weekend as the country is set to experience its worst Arctic weather for almost seven years.,https://focus.independent.ie/thumbor/Sc2mU2ZOwMWfc0t6v9PlztqGgkE=/60x0:735x450/629x0/prod-mh-ireland/ca13830c-6bb2-4de1-9d40-436f3fb09687/92e9dc6a-93b1-4949-8050-afacd3d073fa/video/video.jpg,2025-01-04T02:30:00Z,,"Weather warnings in place across the country from later today, with Status Orange alerts from 5pm in Cork and Kerry (for rain and snow) and in Carlow, Kilkenny, Laois, Offaly, Wicklow, Clare, Limeric… [+7267 chars]",,en,Snow Ireland,Snow&Ice,wmo,Ireland,NEU,Europe
https://www.irishtimes.com/environment/2025/01/04/what-is-this-curious-creature-found-on-shore-after-storm-ashley/,https://www.irishtimes.com/environment/2025/01/04/what-is-this-curious-creature-found-on-shore-after-storm-ashley/,0,www.irishtimes.com,What is this curious creature found on shore after Storm Ashley?,"Éanna Ní Lamhna on fungus lining a lakeside path,  a plant used as a laxative and diuretic, and unsegmented thunderworms",https://www.irishtimes.com/resizer/v2/HOLAFFCMFNDUXESGWZR2VNJZ34.jpg?smart=true&auth=1134f9fa3584074d467046367c44acdcb46b1c18ff210f8215de180db2f53587&width=1200&height=630,2025-01-04T04:53:00Z,,"This was found on the shore at Sandmount Beara by Anne Needecker after Storm Ashley. Is it a form of sea cucumber? Barry Sullivan, Co Cork 
This amazing looking creature is a young sea hare, Aplysia… [+3306 chars]",,en,storm,Storm,random,,,
https://www.irishtimes.com/ireland/2025/01/04/ireland-weather-update-met-eireann-forecasts-significant-snowfall-as-orange-warnings-extended-to-10-counties/,https://www.irishtimes.com/ireland/2025/01/04/ireland-weather-update-met-eireann-forecasts-significant-snowfall-as-orange-warnings-extended-to-10-counties/,0,www.irishtimes.com,Ireland weather update: Met Éireann forecasts ‘significant snowfall’ as orange warnings extended to 10 counties,Forecaster predicts sub-zero temperatures and ‘very disruptive and impactful’ over coming weekend,https://www.irishtimes.com/resizer/v2/RTVKCNREDBJUTO2M7ETVM4H2BA.jpg?smart=true&auth=322caa686c0a605b13e64b45dc0cf8ae78c27b62a27da9836719ee9c973b96c7&width=1200&height=630,2025-01-04T06:20:36Z,http://archive.md/20250104064342/https://www.irishtimes.com/ireland/2025/01/04/ireland-weather-update-met-eireann-forecasts-significant-snowfall-as-orange-warnings-extended-to-10-counties/,"Snow, ice and heavy rain are set to sweep over Ireland this weekend with two distinct status orange weather alerts issued for a combined total of 10 counties from Saturday afternoon.
Met Éireann is … [+2782 chars]",,en,Snow Ireland,Snow&Ice,wmo,Ireland,NEU,Europe
https://www.independent.ie/irish-news/taoiseach-briefed-on-severe-cold-snap-as-over-10cm-of-snow-likely-during-status-orange-weather-warning/a142054128.html,https://www.independent.ie/irish-news/taoiseach-briefed-on-severe-cold-snap-as-over-10cm-of-snow-likely-during-status-orange-weather-warning/a142054128.html,0,www.independent.ie,Taoiseach briefed on ‘severe cold snap’ as over 10cm of snow likely during Status Orange weather warning,Ireland will see over 10cm of snowfall across south Leinster and north Munster this weekend as the country is set to experience its worst Arctic weather for almost seven years.,https://focus.independent.ie/thumbor/RLCzACPTxmfLmL02X1yfssnv1Ew=/60x0:735x450/629x0/prod-mh-ireland/48676515-483f-409e-89be-e9e306edda59/5f24ad15-ac70-4267-9e22-2c4437dd4366/video/video.jpg,2025-01-04T08:35:00Z,https://web.archive.org/web/20250104151644/https://www.independent.ie/irish-news/taoiseach-briefed-on-severe-cold-snap-as-over-10cm-of-snow-likely-during-status-orange-weather-warning/a142054128.html,"Weather warnings in place across the country from later today, with Status Orange alerts from 5pm in Cork, Kerry and Waterford (for rain and snow) and in Carlow, Kilkenny, Laois, Offaly, Wicklow, Cla… [+9083 chars]",,en,Snow Ireland,Snow&Ice,wmo,Ireland,NEU,Europe
https://economictimes.indiatimes.com/news/international/global-trends/winter-storm-us-major-winter-storms-brutal-wind-chills-snowfall-chilly-winds-to-wallop-two-third-of-us-which-regions-will-be-hit-all-you-need-to-know/articleshow/116938362.cms,https://economictimes.indiatimes.com/news/international/global-trends/winter-storm-us-major-winter-storms-brutal-wind-chills-snowfall-chilly-winds-to-wallop-two-third-of-us-which-regions-will-be-hit-all-you-need-to-know/articleshow/116938362.cms,0,economictimes.indiatimes.com,"Major winter storms, brutal wind chills to wallop two-third of US. Which regions will be hit? All you need to know",US Winter storm: The National Weather Service says a major winter storm is forecast to produce heavy snow and significant ice starting in the central US and moving east. Hundreds of millions of people in the eastern two-thirds of the country will experience d…,"https://img.etimg.com/thumb/msid-116938420,width-1200,height-630,imgsize-2256791,overlay-economictimes/articleshow.jpg",2025-01-04T09:06:14Z,https://web.archive.org/web/20250104100418/https://economictimes.indiatimes.com/news/international/global-trends/winter-storm-us-major-winter-storms-brutal-wind-chills-snowfall-chilly-winds-to-wallop-two-third-of-us-which-regions-will-be-hit-all-you-need-to-know/articleshow/116938362.cms,"The United States of America is bracing for heavy snow, hazardous ice and frigid temperatures starting this weekend that could last for several days, forecasters have warned. Most of the eastern two-… [+4390 chars]",,en,Storm Eastern region,Storm,wmo,North Macedonia,MED,Europe
https://www.irishtimes.com/ireland/2025/01/04/ireland-weather-update-latest-snow-warning-met-eireann-forecast/,https://www.irishtimes.com/ireland/2025/01/04/ireland-weather-update-latest-snow-warning-met-eireann-forecast/,0,www.irishtimes.com,Ireland weather update: Met Éireann warns of ‘significant snowfall’ as country braces for ‘multi-hazard weather event’,Orange weather warnings are due to come into place at 5pm on Saturday with up to 10cm of snow expected in some areas,https://www.irishtimes.com/resizer/v2/3NQWJLAW6LAA75JYB6OFYN2W5E.jpg?smart=true&auth=b7665d65b91aa58ecfa01d39e4aaf6a58465ed01d26d6f02b7340607bb48c160&width=1200&height=630,2025-01-04T09:29:29Z,https://web.archive.org/web/20250104110334/https://www.irishtimes.com/ireland/2025/01/04/ireland-weather-update-latest-snow-warning-met-eireann-forecast/,"Main points
<ul><li>Snow, ice and heavy rain are set to sweep over Ireland this weekend with two status orange weather alerts issued by Met Éireann</li><li>A 24-hour orange snow and ice warning come… [+1585 chars]",,en,Snow Ireland,Snow&Ice,wmo,Ireland,NEU,Europe
https://www.independent.ie/weather/from-defrosting-your-car-to-heating-your-home-10-tips-to-get-through-arctic-airmass-causing-cold-snap-in-ireland/a333511954.html,https://www.independent.ie/weather/from-defrosting-your-car-to-heating-your-home-10-tips-to-get-through-arctic-airmass-causing-cold-snap-in-ireland/a333511954.html,0,www.independent.ie,From defrosting your car to heating your home – 10 tips to get through Arctic Airmass causing cold snap in Ireland,"Temperatures are set to plummet to as low as -10C in the coming days, with Met Éireann warning of an Arctic airmass to pass over the country.",https://focus.independent.ie/thumbor/wBa5yW3jmK8HB_L-2y9wyrYEE6g=/60x0:735x450/629x0/prod-mh-ireland/b148af54-c1f7-4cc6-9840-ad9d954b7aed/16e38ba4-fe01-4ab5-859f-99fbe559f27b/video/video.jpg,2025-01-04T09:30:00Z,https://web.archive.org/web/20250104114925/https://www.independent.ie/weather/from-defrosting-your-car-to-heating-your-home-10-tips-to-get-through-arctic-airmass-causing-cold-snap-in-ireland/a333511954.html,"Temperatures are set to plummet to as low as -10C in the coming days, with Met Éireann warning of an Arctic airmass to pass over the country.As well as the freezing temperatures, we can expect heavy … [+3910 chars]",,en,Frost Ireland,Snow&Ice,wmo,Ireland,NEU,Europe
https://www.newsweek.com/ohio-polar-vortex-weather-storm-blair-2009667,https://www.newsweek.com/ohio-polar-vortex-weather-storm-blair-2009667,0,www.newsweek.com,Ohio Polar Vortex Forecast: Midwest To Be Consumed by Cold Snap,"Storm Blair is expected to move through Ohio on Sunday, bringing snow and sleet accumulations of between 5 and 9 inches on Sunday and into Monday night.",https://d.newsweek.com/en/full/2556356/snow.jpg,2025-01-04T13:08:06Z,https://web.archive.org/web/20250104171319/https://www.newsweek.com/ohio-polar-vortex-weather-storm-blair-2009667,"A polar vortex is set to plunge the Midwest into a deep freeze, with Ohio bracing for some of the coldest temperatures of the season.
Why It Matters
So far, this winter has seen one of the warmest … [+3676 chars]",,en,sleet,Snow&Ice,random,,,
https://www.bbc.com/news/articles/ckg9xr11m2jo,https://www.bbc.com/news/articles/ckg9xr11m2jo,0,www.bbc.com,Amber warning in place as UK braces for snow disruption,"Freezing rain is also expected, as forecasters warn of hazardous travel conditions.",https://ichef.bbci.co.uk/news/1024/branded_news/5bdc/live/f9d4ccf0-cabc-11ef-9fd6-0be88a764111.jpg,2025-01-04T18:48:28Z,https://web.archive.org/web/20250104192244/https://www.bbc.com/news/articles/ckg9xr11m2jo,"Snow and ice warnings issued for parts of UK
Heavy snow and freezing rain are set to bring considerable disruption across the UK, with an amber weather warning now in force.
Parts of northern Engla… [+3857 chars]",,en,freezing,Snow&Ice,random,,,
https://www.upi.com/Top_News/US/2025/01/04/major-winter-storm/8521736013144/,https://www.upi.com/Top_News/US/2025/01/04/major-winter-storm/8521736013144/,0,www.upi.com,"Major winter storm could cause severe travel delays, impact 62M over 3 days","The National Weather Services is predicting a major winter storm stretching 1,300 miles across the central United States and impacting up to 62 million from ...",https://media.zenfs.com/en/united_press_international_articles_356/e2c7aceb209c81fb5b6b83eb18f308a7,2025-01-04T20:34:29Z,https://web.archive.org/web/20250104200049/https://www.upi.com/Top_News/US/2025/01/04/major-winter-storm/8521736013144/,"Yahoo is using AI to generate takeaways from this article. This means the info may not always match what's in the article. Reporting mistakes helps us improve the experience.Generate Key Takeaways
J… [+3377 chars]",,en,Ice United States,Snow&Ice,wmo,United States,CNA,North-America
https://www.abc.net.au/news/2025-01-05/2003-canberra-bushfire-lessons-how-to-care-for-horses/104758414,https://www.abc.net.au/news/2025-01-05/2003-canberra-bushfire-lessons-how-to-care-for-horses/104758414,0,www.abc.net.au,'We could have died': Horse owners urged to plan for bushfires,"Many lessons came from the 2003 Canberra firestorm, including how to better care for horses during a bushfire emergency. This summer, horse owners are being urged to have emergency safety plans in place for their animals.",https://live-production.wcms.abc-cdn.net.au/704c6d18232ef9b048a29a4855e43286?impolicy=wcms_watermark_news&cropH=1841&cropW=3272&xPos=0&yPos=30&width=862&height=485&imformat=generic,2025-01-04T21:20:31Z,,"Like many people who experienced the 2003 Canberra bushfires, horse owner Jane Hedges's memories of the event are apocalyptic.
""The fire just roared up that hill there; just roared up it, it was so … [+9794 chars]",,en,bushfire,Wildfire,random,,,
https://www.dw.com/en/germany-braces-for-extreme-weather-and-disruptions/a-71218228,https://www.dw.com/en/germany-braces-for-extreme-weather-and-disruptions/a-71218228,0,www.dw.com,Germany braces for extreme weather and disruptions,Forecasters warned of treacherous conditions that could cause flight and other delays. Meanwhile the UK and US are also dealing with severe wintry conditions,https://static.dw.com/image/71218271_6.jpg,2025-01-04T23:24:00Z,https://web.archive.org/web/20250105010601/https://www.dw.com/en/germany-braces-for-extreme-weather-and-disruptions/a-71218228,"Large parts of Germany are facing heavy snow, black ice, freezing rain and strong winds, which are expected to hit the country overnight on Saturday and into Sunday, the German Meteorological Service… [+1907 chars]",,en,Severe Weather Germany,Thunderstorm,wmo,Germany,WCE,Europe
https://economictimes.indiatimes.com/news/international/world-news/australias-southeast-braces-for-extreme-fire-danger-amid-intense-heatwave/articleshow/116957407.cms,https://economictimes.indiatimes.com/news/international/world-news/australias-southeast-braces-for-extreme-fire-danger-amid-intense-heatwave/articleshow/116957407.cms,0,economictimes.indiatimes.com,Australia's southeast braces for extreme fire danger amid intense heatwave,"Australia's southeast faced an intense heatwave on Sunday, raising bushfire risks and prompting authorities to issue fire bans in Victoria. Temperatures could reach up to 45 degrees Celsius in some parts of the state. Firefighters are already battling blazes …","https://img.etimg.com/thumb/msid-116957421,width-1200,height-630,imgsize-101924,overlay-economictimes/articleshow.jpg",2025-01-05T03:17:40Z,,"Artificial Intelligence(AI)
AI and Analytics based Business Strategy
By - Tanusree De, Managing Director- Accenture Technology Lead, Trustworthy AI Center of Excellence: ATCI
View Program",,en,bushfire Victoria,Wildfire,acwe,Australia,SAU,Oceania
