index,url,valid,domain,title,description,image,published,archive,content,quote,language,term,topic,feed,country,ipcc,continent
https://slashdot.org/firehose.pl?op=view&amp;id=173725830,https://slashdot.org/firehose.pl?op=view&amp;id=173725830,0,slashdot.org,Power blackouts hit Tanzania as Cyclone Hidaya intensifies toward the country's coastline - The Associated Press,Power blackouts hit Tanzania as Cyclone Hidaya intensifies toward the country's coastlineThe Associated Press A rare tropical cyclone landfall is on tap for Tanzania Yale Climate ConnectionsYale Climate Connections Historic tropical cyclone threatens Tanzania…,,2024-05-04T12:33:26Z,,Sign up for the Slashdot newsletter! OR check out the new Slashdot job board to browse remote jobs or jobs in your areaDo you develop on GitHub? You can keep using GitHub but automatically sync your … [+268 chars],,en,landfall,Tropical Cyclone,random,,,
https://english.khabarhub.com/2024/04/354015/,https://english.khabarhub.com/2024/04/354015/,0,english.khabarhub.com,What’s behind the catastrophic rainfall in Kenya,"NAIROBI, KENYA: The torrential rains and deadly floods that have hit Kenya since March have been some of the most catastrophic in the country in recent years. At least 169 people have died due to the heavy rains, with at least 91 missing, according to the lat…",https://english.khabarhub.com/wp-content/uploads/2024/05/Screenshot-2024-05-04-175946.jpg,2024-05-04T13:15:35Z,,"Children flee floodwaters that wreaked havoc at Mororo, at the border of Tana River and Garissa counties, Kenya, April 28, 2024/AP
NAIROBI, KENYA: The torrential rains and deadly floods that have hi… [+3833 chars]",,en,Flood Kenya,Flood,relief,Kenya,SEAF,Africa
https://www.voanews.com/a/tropical-cyclone-threatens-to-worsen-humanitarian-crisis-in-flooded-east-africa/7597906.html,https://www.voanews.com/a/tropical-cyclone-threatens-to-worsen-humanitarian-crisis-in-flooded-east-africa/7597906.html,0,www.voanews.com,Tropical cyclone threatens to worsen humanitarian crisis in flooded East Africa,"GENEVA — The World Meteorological Organization warns that Tropical Cyclone Hidaya, which is projected to make landfall in Tanzania and Kenya this weekend, threatens to worsen the humanitarian crisis triggered by torrential rains in these and other heavily flo…",https://gdb.voanews.com/0251AA56-1CD6-44DB-9E30-1E227514C13D.jpg,2024-05-04T14:28:28Z,https://web.archive.org/web/20240504144306/https://www.voanews.com/a/tropical-cyclone-threatens-to-worsen-humanitarian-crisis-in-flooded-east-africa/7597906.html,"GENEVA  The World Meteorological Organization warns that Tropical Cyclone Hidaya, which is projected to make landfall in Tanzania and Kenya this weekend, threatens to worsen the humanitarian crisis t… [+4932 chars]",,en,Tropical Cyclone Hidaya,Tropical Cyclone,eonet,,SEAF,Africa
https://www.digitaljournal.com/world/cyclone-bears-down-on-flood-hit-kenya-tanzania/article,https://www.digitaljournal.com/world/cyclone-bears-down-on-flood-hit-kenya-tanzania/article,0,www.digitaljournal.com,"Cyclone bears down on flood-hit Kenya, Tanzania","Beaches were deserted and many shops closed on Saturday as heavy rains and winds from a tropical cyclone buffeted coastal areas of Tanzania and Kenya.  Both countries have gone on alert for Tropical Cyclone Hidaya, after weeks of torrential rains and floods t…",https://www.digitaljournal.com/wp-content/uploads/2024/05/feae602c8ffa4a16dde4a1a2d85ad1f5fbef131a.jpg,2024-05-04T15:24:58Z,https://web.archive.org/web/20240504192028/https://www.digitaljournal.com/world/cyclone-bears-down-on-flood-hit-kenya-tanzania/article,"At least 155 people have died in floods in Tanzania, the government said last month - Copyright AFP Lillian SUWANRUMPHA
Beaches were deserted and many shops closed on Saturday as heavy rains and win… [+3845 chars]",,en,Tropical Cyclone Hidaya,Tropical Cyclone,eonet,,SEAF,Africa
https://www.digitaljournal.com/world/death-toll-in-southern-brazil-flood-rises-to-56/article,https://www.digitaljournal.com/world/death-toll-in-southern-brazil-flood-rises-to-56/article,0,www.digitaljournal.com,Death toll in southern Brazil flood rises to 56,"The death toll from floods and mudslides triggered by torrential storms in southern Brazil has climbed to 56 people, with 74 injured and another 67 missing, the country’s civil defense agency said Saturday. Fast-rising water levels in the state of Rio Grande …",https://www.digitaljournal.com/wp-content/uploads/2024/05/11880969081a7c480ef7b48b72a84708a5f630e4.jpg,2024-05-04T15:24:59Z,,"Aerial view of people walking through a flooded street at the Navegantes neighborhood in Porto Alegre, Rio da Grande do State, Brazil - Copyright AFP Lillian SUWANRUMPHA
The death toll from floods a… [+2846 chars]",,en,storm,Storm,random,,,
https://www.ibtimes.com/cyclone-bears-down-flood-hit-kenya-tanzania-3731248,https://www.ibtimes.com/cyclone-bears-down-flood-hit-kenya-tanzania-3731248,0,www.ibtimes.com,"Cyclone Bears Down On Flood-hit Kenya, Tanzania",Beaches were deserted and many shops closed on Saturday as heavy rains and winds from a tropical cyclone buffeted coastal areas of Tanzania and Kenya.,https://d.ibtimes.com/en/full/4524594/least-155-people-have-died-floods-tanzania-government-said-last-month.jpg,2024-05-04T15:27:09Z,https://web.archive.org/web/20240506003905/https://www.ibtimes.com/cyclone-bears-down-flood-hit-kenya-tanzania-3731248,"Beaches were deserted and many shops closed on Saturday as heavy rains and winds from a tropical cyclone buffeted coastal areas of Tanzania and Kenya.
Both countries have gone on alert for Tropical … [+3970 chars]",,en,Flood Kenya,Flood,relief,Kenya,SEAF,Africa
https://www.thestar.com.my/news/world/2024/05/05/death-toll-from-rains-in-southern-brazil-climbs-to-57-some-70-still-missing,https://www.thestar.com.my/news/world/2024/05/05/death-toll-from-rains-in-southern-brazil-climbs-to-57-some-70-still-missing,0,www.thestar.com.my,"Death toll from rains in southern Brazil climbs to 57, some 70 still missing","SAO PAULO (Reuters) -The death toll from rains in Brazil's southernmost state of Rio Grande do Sul rose to 57, local authorities said on Saturday afternoon, while dozens still have not been accounted for. Read full story",https://apicms.thestar.com.my/uploads/images/2024/05/05/2677444.jpg,2024-05-04T16:27:00Z,,"SAO PAULO (Reuters) -The death toll from rains in Brazil's southernmost state of Rio Grande do Sul rose to 57, local authorities said on Saturday afternoon, while dozens still have not been accounted… [+1738 chars]",,en,Rain Brazil,Precipitation,wmo,Brazil,SAM,South-America
https://www.irishtimes.com/world/americas/2024/05/04/rising-death-toll-from-rains-in-brazil-as-floods-destroy-roads-and-bridges/,https://www.irishtimes.com/world/americas/2024/05/04/rising-death-toll-from-rains-in-brazil-as-floods-destroy-roads-and-bridges/,0,www.irishtimes.com,Rising death toll from rains in Brazil as floods destroy roads and bridges,"More than 32,000 people displaced with storms triggering landslides",https://www.irishtimes.com/resizer/ovK154wkj7NYrjKU73AbzpxGHSs=/1200x630/filters:format(jpg):quality(70)/cloudfront-eu-central-1.images.arcpublishing.com/irishtimes/47OSUOSOJQBJL2AYN3QSKPOO54.jpg,2024-05-04T16:45:11Z,,"The death toll from rains in Brazils southernmost state of Rio Grande do Sul rose to 57, local authorities said on Saturday afternoon, while dozens still have not been accounted for.
Rio Grande do S… [+1720 chars]",,en,Rain Brazil,Precipitation,wmo,Brazil,SAM,South-America
https://www.ndtv.com/world-news/brazil-rainfall-57-killed-after-heavy-rains-in-brazil-dozens-still-missing-5589805,https://www.ndtv.com/world-news/brazil-rainfall-57-killed-after-heavy-rains-in-brazil-dozens-still-missing-5589805,0,www.ndtv.com,"57 Killed After Heavy Rains In Brazil, Dozens Still Missing","The death count from rains in Brazil's southernmost state of Rio Grande do Sul rose to 57, local authorities said on Saturday afternoon, while dozens still have not been accounted for.",https://c.ndtvimg.com/2024-05/e383kok8_brazil-rain_625x300_04_May_24.jpeg?ver-20240430.08,2024-05-04T18:05:16Z,,"Floods destroyed roads and bridges in several regions of the state (File)
Sao Paulo: The death count from rains in Brazil's southernmost state of Rio Grande do Sul rose to 57, local authorities said… [+1852 chars]",,en,heavy rain,Precipitation,random,,,
https://www.voanews.com/a/flooding-death-toll-in-brazil-climbs-to-57-dozens-missing-/7598067.html,https://www.voanews.com/a/flooding-death-toll-in-brazil-climbs-to-57-dozens-missing-/7598067.html,0,www.voanews.com,"Flooding death toll in Brazil climbs to 57, dozens missing","sao paulo, brazil — The death toll from rains in Brazil's southernmost state of Rio Grande do Sul rose to 57, local authorities said Saturday afternoon, while dozens still have not been accounted for. 


Rio Grande do Sul's civil defense authority said 67 peo…",https://gdb.voanews.com/57EA2427-A7A8-42F9-882F-5AAF3917E025.jpg,2024-05-04T18:25:39Z,,"sao paulo, brazil  The death toll from rains in Brazil's southernmost state of Rio Grande do Sul rose to 57, local authorities said Saturday afternoon, while dozens still have not been accounted for.… [+1661 chars]",,en,Rain Brazil,Precipitation,wmo,Brazil,SAM,South-America
https://thehillstimes.in/international/southern-brazil-has-been-hit-by-the-worst-floods-in-more-than-80-years-at-least-39-people-have-died,https://thehillstimes.in/international/southern-brazil-has-been-hit-by-the-worst-floods-in-more-than-80-years-at-least-39-people-have-died,0,thehillstimes.in,Southern Brazil has been hit by the worst floods in more than 80 years. At least 39 people have died,"SAO PAULO (AP) — Heavy rains in the southern Brazilian state of Rio Grande do Sul killed 39 people, with another 68 still missing, the state civil defense agency said on Friday, as record-breaking floods devastated cities and forced thousands to leave their h…",https://thehillstimes.in/wp-content/uploads/2024/05/7-5.jpg,2024-05-04T19:00:14Z,,"SAO PAULO (AP) Heavy rains in the southern Brazilian state of Rio Grande do Sul killed 39 people, with another 68 still missing, the state civil defense agency said on Friday, as record-breaking floo… [+4139 chars]",,en,Rain Brazil,Precipitation,wmo,Brazil,SAM,South-America
https://www.ndtv.com/world-news/brazil-floods-rains-lost-everything-70-000-forced-from-homes-as-deadly-floods-hit-brazil-5590904,https://www.ndtv.com/world-news/brazil-floods-rains-lost-everything-70-000-forced-from-homes-as-deadly-floods-hit-brazil-5590904,0,www.ndtv.com,"""Lost Everything"": 70,000 Forced From Homes As Deadly Floods Hit Brazil","Nearly 70,000 people have been forced from their homes amid deadly flooding, mudslides and torrential storms in southern Brazil, with the major city of Porto Alegre particularly hard-hit, the country's civil defense agency said Saturday.",https://c.ndtvimg.com/2024-05/066bucmo_brazil-floods_625x300_05_May_24.jpeg?ver-20240430.08,2024-05-04T23:52:49Z,,"Residents struggled in chaotic conditions to find their way to safety
Porto Alegre: Nearly 70,000 people have been forced from their homes amid deadly flooding, mudslides and torrential storms in so… [+4136 chars]",,en,Storm Brazil,Storm,wmo,Brazil,SAM,South-America
https://www.voanews.com/a/tanzania-says-cyclone-no-longer-a-threat-/7598509.html,https://www.voanews.com/a/tanzania-says-cyclone-no-longer-a-threat-/7598509.html,0,www.voanews.com,Tanzania says cyclone no longer a threat,"Dar es Salaam, Tanzania — Tanzania said a cyclone that made landfall on Saturday has lost its strength and was no longer a threat to the country.   


Tropical Cyclone Hidaya had triggered heavy rains and winds as it rolled towards Tanzania and neighboring Ke…",https://gdb.voanews.com/01000000-0aff-0242-3135-08dc6cee05f9_w1200_r1.jpg,2024-05-05T10:29:21Z,https://web.archive.org/web/20240505105410/https://www.voanews.com/a/tanzania-says-cyclone-no-longer-a-threat-/7598509.html,"Dar es Salaam, Tanzania  Tanzania said a cyclone that made landfall on Saturday has lost its strength and was no longer a threat to the country. 
Tropical Cyclone Hidaya had triggered heavy rains an… [+1110 chars]",,en,Tropical Cyclone Hidaya,Tropical Cyclone,eonet,,SEAF,Africa
https://www.voanews.com/a/kenya-floods-death-toll-at-228-as-crisis-persists/7598540.html,https://www.voanews.com/a/kenya-floods-death-toll-at-228-as-crisis-persists/7598540.html,0,www.voanews.com,Kenya floods death toll at 228 as crisis persists,"Nairobi — Kenya said Sunday that the death toll from weeks of devastating rains and floods had risen to 228 and warned that there was no sign of a let-up in the crisis.


While Kenya and neighboring Tanzania escaped major damage from a tropical cyclone that w…",https://gdb.voanews.com/2972E3B0-5B0A-42F3-9B93-BEB167492245.jpg,2024-05-05T12:01:28Z,https://web.archive.org/web/20240505125339/https://www.voanews.com/a/kenya-floods-death-toll-at-228-as-crisis-persists/7598540.html,"Nairobi  Kenya said Sunday that the death toll from weeks of devastating rains and floods had risen to 228 and warned that there was no sign of a let-up in the crisis.
While Kenya and neighboring Ta… [+3322 chars]",,en,cyclone,Tropical Cyclone,random,,,
https://www.thestar.com.my/news/world/2024/05/06/tanzania039s-southern-highway-shut-down-after-4-bridges-washed-away-by-flash-floods,https://www.thestar.com.my/news/world/2024/05/06/tanzania039s-southern-highway-shut-down-after-4-bridges-washed-away-by-flash-floods,0,www.thestar.com.my,Tanzania's southern highway shut down after 4 bridges washed away by flash floods,"DAR ES SALAAM, May 5 (Xinhua) -- Tanzania's 396-kilometer highway connecting the port city of Dar es Salaam and southern regions of Lindi and Mtwara was shut down on Sunday after flash floods washed away at least four main bridges, said an official. Read full…",https://cdn.thestar.com.my/Themes/img/newTsol_logo_socmedia.png,2024-05-05T17:43:00Z,https://web.archive.org/web/20240505185321/https://www.thestar.com.my/news/world/2024/05/06/tanzania039s-southern-highway-shut-down-after-4-bridges-washed-away-by-flash-floods,"DAR ES SALAAM, May 5 (Xinhua) -- Tanzania's 396-kilometer highway connecting the port city of Dar es Salaam and southern regions of Lindi and Mtwara was shut down on Sunday after flash floods washed … [+1078 chars]",,en,Flash Flood Tanzania,Precipitation,relief,Tanzania,SEAF,Africa
https://phys.org/news/2024-05-cyclone-kenya-tanzania.html,https://phys.org/news/2024-05-cyclone-kenya-tanzania.html,0,phys.org,"Cyclone bears down on flood-hit Kenya, Tanzania",Beaches were deserted and many shops closed on Saturday as heavy rains and winds from a tropical cyclone buffeted coastal areas of Tanzania and Kenya.,https://scx2.b-cdn.net/gfx/news/2024/at-least-155-people-ha.jpg,2024-05-05T19:47:14Z,https://web.archive.org/web/20240505195736/https://phys.org/news/2024-05-cyclone-kenya-tanzania.html,"Beaches were deserted and many shops closed on Saturday as heavy rains and winds from a tropical cyclone buffeted coastal areas of Tanzania and Kenya.
Both countries have gone on alert for Tropical … [+4093 chars]",,en,Flood Tanzania,Flood,relief,Tanzania,SEAF,Africa
https://www.globalsecurity.org/military/library/news/2024/05/mil-240504-voa02.htm,https://www.globalsecurity.org/military/library/news/2024/05/mil-240504-voa02.htm,0,www.globalsecurity.org,Tropical cyclone threatens to worsen humanitarian crisis in flooded East Africa,"The World Meteorological Organization warns that Tropical Cyclone Hidaya, which is projected to make landfall in Tanzania and Kenya this weekend, threatens to worsen the humanitarian crisis triggered by torrential rains in these and other heavily flooded coun…",,2024-05-06T06:27:29Z,,"By Lisa Schlein May 04, 2024
The World Meteorological Organization warns that Tropical Cyclone Hidaya, which is projected to make landfall in Tanzania and Kenya this weekend, threatens to worsen the… [+5102 chars]",,en,cyclone,Tropical Cyclone,random,,,
https://www.insurancejournal.com/news/international/2024/05/06/772932.htm,https://www.insurancejournal.com/news/international/2024/05/06/772932.htm,0,www.insurancejournal.com,"Southern Brazil Hit by Worst Floods in Over 80 Years, Killing at Least 39 People","Heavy rains in the southern Brazilian state of Rio Grande do Sul killed 39 people, with another 68 still missing, the state civil defense agency said Friday, as record-breaking floods devastated cities and forced thousands to leave their homes. It …",https://www.insurancejournal.com/app/uploads/2024/05/streets-flooded-after-heavy-rains-in-brazil-AP-scaled.jpg,2024-05-06T07:50:28Z,,"Heavy rains in the southern Brazilian state of Rio Grande do Sul killed 39 people, with another 68 still missing, the state civil defense agency said Friday, as record-breaking floods devastated citi… [+4310 chars]",,en,Rain Brazil,Precipitation,wmo,Brazil,SAM,South-America
https://newrepublic.com/article/181197/climate-crisis-transforming-families-parenting,https://newrepublic.com/article/181197/climate-crisis-transforming-families-parenting,0,newrepublic.com,The Climate Crisis Is Already Transforming the Family,"In the summer of 2020, fires swallowed up huge swaths of the Western United States. Entire landscapes dissolved into an unearthly glow of orange and yellow. Skies over Oregon and California simmered a sickly tangerine. Wildfires roared through China, India, B…",https://images.newrepublic.com/03437703e61abb570b9775038f32ebfeeac3f76a.jpeg?w=1200&h=630&crop=faces&fit=crop&fm=jpg,2024-05-06T10:00:00Z,http://archive.md/20240506135412/https://newrepublic.com/article/181197/climate-crisis-transforming-families-parenting,"Then there are the movements centered on womens identities as mothers: Argentinas Mothers of the Plaza de Mayo, the Vietnam-era Another Mother for Peace, Mothers Against Drunk Driving. More recently,… [+1879 chars]",,en,Wildfire China,Wildfire,wmo,China,EAS,Asia
https://www.techspot.com/news/102877-german-police-hail-takedown-europe-largest-call-center.html,https://www.techspot.com/news/102877-german-police-hail-takedown-europe-largest-call-center.html,0,www.techspot.com,"German police hail takedown of Europe's ""largest"" call center scam network in operation Pandora","The sting, supported by Europol, nabbed 21 individuals believed to be running an enormous criminal network that swindled untold numbers of victims through a variety of scams – from impersonating police to peddling bogus investments and romance fraud. The scam…",https://www.techspot.com/images2/news/bigimage/2024/05/2024-05-06-image.png,2024-05-06T11:55:00Z,,"In a nutshell: Law enforcement agencies across Europe and the Middle East just took down the ""largest call center fraud scheme in Europe,"" as a German minister described it. In a massive coordinated … [+2773 chars]",,en,hail,Thunderstorm,random,,,
https://financialpost.com/pmn/business-pmn/for-farmers-watching-and-waiting-is-a-spring-planting-ritual-climate-change-is-adding-to-anxiety,https://financialpost.com/pmn/business-pmn/for-farmers-watching-and-waiting-is-a-spring-planting-ritual-climate-change-is-adding-to-anxiety,0,financialpost.com,"For farmers, watching and waiting is a spring planting ritual. Climate change is adding to anxiety","SABINA, Ohio (AP) — It was just after dark as Ross Woodruff hopped into a truck to haul soybean seeds out to his brother, Mark, whose planter had run out. It was the first day they could plant after heavy rains two weeks earlier left much of their 9,000 acres…",,2024-05-06T13:40:14Z,,"Author of the article:
Article content
SABINA, Ohio (AP) It was just after dark as Ross Woodruff hopped into a truck to haul soybean seeds out to his brother, Mark, whose planter had run out. It wa… [+9866 chars]",,en,heavy rain,Precipitation,random,,,
https://www.cbsnews.com/video/major-cyclone-slams-tanzania-and-kenya/,https://www.cbsnews.com/video/major-cyclone-slams-tanzania-and-kenya/,0,www.cbsnews.com,Major cyclone slams Tanzania and Kenya,"Tanzania and Kenya are dealing with the aftermath of a major cyclone that brought heavy rain and high winds, adding to the weeks of deadly flooding throughout the region. Anne Soy, senior Africa correspondent for CBS News' partners at BBC News, has more.",https://assets2.cbsnewsstatic.com/hub/i/r/2024/05/06/2dd87336-dec4-4ae9-8892-b67fb2c3a607/thumbnail/1200x630/ad5a4cb07c0d8a3e60fa1971189bf3bd/cbsn-fusion-major-cyclone-slams-tanzania-and-kenya-thumbnail.jpg?v=1d6c78a71b7b6252b543a329b3a5744d,2024-05-06T21:13:00Z,,"Watch CBS News
Copyright ©2024 CBS Interactive Inc. All rights reserved.
Get browser notifications for breaking news, live events, and exclusive reporting.
Not NowTurn On",,en,Flood Kenya,Flood,relief,Kenya,SEAF,Africa
https://www.foxnews.com/us/millions-people-oklahoma-southern-kansas-risk-tornadoes-severe-thunderstorms,https://www.foxnews.com/us/millions-people-oklahoma-southern-kansas-risk-tornadoes-severe-thunderstorms,0,www.foxnews.com,"Millions of people across Oklahoma, southern Kansas at risk of tornadoes and severe thunderstorms",Long-track tornados and baseball-sized hail are among the threats facing millions in the central U.S.; forecasters have issued a rare high risk warning for southern Kansas and central Oklahoma.,https://static.foxnews.com/foxnews.com/content/uploads/2024/05/Severe-Weather-1.jpg,2024-05-06T21:38:41Z,,"Millions of people in the central United States must brace themselves for powerful storms that may include long-track tornadoes, hurricane-force winds and baseball-sized hail, forecasters said Monday… [+5281 chars]",,en,tornado,Storm,random,,,
https://www.edsurge.com/news/2024-05-07-to-serve-bilingual-students-this-future-teacher-will-draw-on-her-own-experience,https://www.edsurge.com/news/2024-05-07-to-serve-bilingual-students-this-future-teacher-will-draw-on-her-own-experience,0,www.edsurge.com,"To Serve Bilingual Students, This Future Teacher Will Draw on Her Own Experience","Viridiana Martinez’s family immigrated twice when she was in elementary school — once, from Mexico to Canada, and a second time to the United States. ...",https://edsurge.imgix.net/uploads/post/image/15852/Shutterstock_1669351468-1714752998.jpg?auto=compress%2Cformat&w=1024&h=512&fit=crop,2024-05-07T09:15:00Z,,"Viridiana Martinezs family immigrated twice when she was in elementary school once, from Mexico to Canada, and a second time to the United States. With each move, she had to learn a new language and … [+8025 chars]",,en,Ice Canada,Snow&Ice,wmo,Canada,NEN,North-America
https://www.cbc.ca/news/canada/calgary/some-alberta-farmers-might-get-a-perfect-storm-but-the-downpour-s-not-good-news-for-all-1.7196120,https://www.cbc.ca/news/canada/calgary/some-alberta-farmers-might-get-a-perfect-storm-but-the-downpour-s-not-good-news-for-all-1.7196120,0,www.cbc.ca,"Some Alberta farmers might get a perfect storm, but the downpour's not good news for all",Environment and Climate Change Canada is expecting a “ton” of rain for eastern central and southern Alberta over Tuesday and Wednesday.,https://i.cbc.ca/1.6935393.1691950622!/cpImage/httpImage/image.jpg_gen/derivatives/16x9_620/climate-irrigation-20230813.jpg,2024-05-07T12:17:17Z,,"Environment and Climate Change Canada is expecting a ""ton"" of rain for eastern, central and southern Alberta. 
Meteorologist Alysa Pederson said some communities in the southern part of the province… [+3519 chars]",,en,Downpour Canada,Precipitation,wmo,Canada,NEN,North-America
https://economictimes.indiatimes.com/news/international/us/us-weather-severe-weather-conditions-of-level-3-declared-13-million-people-may-be-hit-hard/articleshow/109924767.cms,https://economictimes.indiatimes.com/news/international/us/us-weather-severe-weather-conditions-of-level-3-declared-13-million-people-may-be-hit-hard/articleshow/109924767.cms,0,economictimes.indiatimes.com,"US Weather: Severe weather conditions of level 3 declared, 13 million people may be hit hard","NOAA's Storm Prediction Center has declared Level 3 out of 5 risk of severe weather for parts of Indiana, Ohio and Kentucky that may affect 13 million people. The cities most likely to be hit include Indianapolis in Indiana, Columbus and Cincinnati in Ohio an…","https://img.etimg.com/thumb/msid-109925461,width-1200,height-630,imgsize-146626,overlay-economictimes/photo.jpg",2024-05-07T15:37:45Z,,"(Catch all the US News, UK News, Canada News, International Breaking News Events, and Latest News Updates on The Economic Times.)
Download The Economic Times News App to get Daily International News… [+8 chars]",,en,severe weather,Thunderstorm,random,,,
https://www.bostonherald.com/2024/05/07/from-flooding-in-brazil-and-houston-to-brutal-heat-in-asia-extreme-weather-seems-nearly-everywhere/,https://www.bostonherald.com/2024/05/07/from-flooding-in-brazil-and-houston-to-brutal-heat-in-asia-extreme-weather-seems-nearly-everywhere/,0,www.bostonherald.com,"From flooding in Brazil and Houston to brutal heat in Asia, extreme weather seems nearly everywhere","By SETH BORENSTEIN, SUMAN NAISHADHAM, SIBI ARASU and FABIANO MAISONNAVE (Associated Press) In sweltering Brazil, worst-ever flooding killed dozens of people and paralyzed a city of about 4 million people. Voters and politicians in the world’s largest election…",https://www.bostonherald.com/wp-content/uploads/2024/05/Climate_World_Weather_Extremes_93266.jpg?w=1024&h=684,2024-05-07T18:35:13Z,,"By SETH BORENSTEIN, SUMAN NAISHADHAM, SIBI ARASU and FABIANO MAISONNAVE (Associated Press)
In sweltering Brazil, worst-ever flooding killed dozens of people and paralyzed a city of about 4 million p… [+6553 chars]",,en,flooding,Flood,random,,,
