index,url,valid,domain,title,description,image,published,archive,content,quote,language,term,topic,feed,country,ipcc,continent
https://www.pbs.org/newshour/show/july-3-2026-pbs-news-hour-full-episode,https://www.pbs.org/newshour/show/july-3-2026-pbs-news-hour-full-episode,0,www.pbs.org,"July 3, 2026 - PBS News Hour full episode","Friday on the News Hour, record-breaking heat bakes the central and eastern United States ahead of July Fourth celebrations. African soldiers lured by promises of high pay end up on the front lines of the war with Ukraine. One year since the deadly flood at C…",https://d3i6fh83elv35t.cloudfront.net/static/2026/07/2026-07-03T133514Z_1176010763_MT1USATODAY29319054_RTRMADP_3_A-TRAFFIC-SIGN-REMINDS-PEOPLE-TO-STAY-COOL-IN-OVER-90-DEGREE-1024x683.jpg,2026-07-04T00:01:47Z,,"Friday on the News Hour, record-breaking heat bakes the central and eastern United States ahead of July Fourth celebrations. African soldiers lured by promises of high pay end up on the front lines o… [+197 chars]",,en,Flood United States,Flood,wmo,United States,CNA,North-America
https://slickdeals.net/f/19719849-coleman-snap-n-go-45-quart-collapsible-hard-cooler-153-99-free-s-h-at-amazon,https://slickdeals.net/f/19719849-coleman-snap-n-go-45-quart-collapsible-hard-cooler-153-99-free-s-h-at-amazon,0,slickdeals.net,Coleman Snap 'N Go 45-Quart Collapsible Hard Cooler $153.99 + Free S&H at Amazon (2 replies),"Amazon.com has Coleman Snap 'N Go 45-Quart Collapsible Hard Cooler, Portable Hard-Sided Cooler with Waterproof Removable Liner, Spacing-Saving & Quick Set Up, 55 Hours Cold for $153.99.  Ship",https://slickdeals.net/attachment/2/9/8/1/5/7/1/1/450x450/20895804.thumb,2026-07-04T04:51:05Z,,"This collaborative space allows users to contribute additional information, tips, and insights to enhance the original deal post. Feel free to share your knowledge and help fellow shoppers make infor… [+26 chars]",,en,cold snap,Cold Wave,random,,,
https://economictimes.indiatimes.com/news/india/yellow-alert-in-delhi-thunderstorms-rain-to-continue-till-july-9-says-imd/articleshow/132177798.cms,https://economictimes.indiatimes.com/news/india/yellow-alert-in-delhi-thunderstorms-rain-to-continue-till-july-9-says-imd/articleshow/132177798.cms,0,economictimes.indiatimes.com,"Yellow alert in Delhi: Thunderstorms, rain to continue till July 9, says IMD","Delhi experienced scattered showers on Saturday amidst humid conditions, with an overcast sky and 77% relative humidity. The IMD has issued a yellow alert for light to moderate rain, thunderstorms, and lightning, with winds up to 40 kmph expected. Temperature…","https://img.etimg.com/thumb/msid-132177886,width-1200,height-630,imgsize-9146,overlay-economictimes/articleshow.jpg",2026-07-04T08:42:54Z,,"Parts of the national capital witnessed rain on Saturday, offering some respite even as humid conditions continued to trouble residents. Skies stayed overcast through much of the day, with morning hu… [+1414 chars]",,en,thunderstorm,Thunderstorm,random,,,
https://www.aljazeera.com/news/2026/7/4/america250-how-the-us-heatwave-will-affect-fourth-of-july-celebrations,https://www.aljazeera.com/news/2026/7/4/america250-how-the-us-heatwave-will-affect-fourth-of-july-celebrations,0,www.aljazeera.com,America250: How the US heatwave will affect Fourth of July celebrations,"From Washington to LA, how plans to mark the United States' 250th anniversary could be disrupted by extreme heat.",https://www.aljazeera.com/wp-content/uploads/2026/07/ap_6a47fbd98b180-1783102425.jpg?resize=1920%2C1440,2026-07-04T11:00:47Z,,"The United States is about to celebrate its 250th birthday, but as millions across the country prepare to gather this weekend for parades, concerts and festivals, an intense heat wave has settled ove… [+6896 chars]",,en,Heat Wave heatwave,Heat Wave,wmo,India,SAS,Asia
https://abcnews.com/US/1-million-power-country-us-blanketed-heatwave/story?id=134467508,https://abcnews.com/US/1-million-power-country-us-blanketed-heatwave/story?id=134467508,0,abcnews.com,Almost 1 million without power across the country as US is blanketed by heatwave,"As America begins to celebrate its 250th birthday on Saturday, there are nearly 1 million outages being reported across multiple states.",https://i.abcnewsfe.com/a/63bd3121-e50a-4e2f-8d54-012a36126911/us-heatwave-america-250_1783161612353_hpMain_16x9.jpg?w=1600,2026-07-04T11:02:05Z,,"As America begins to celebrate its 250th birthday on Saturday, there are nearly 1 million outages being reported across multiple states.
The current total of 956, 388 homes, according to tracking si… [+1957 chars]",,en,Heat Wave heatwave,Heat Wave,wmo,India,SAS,Asia
https://www.sportingnews.com/us/soccer/news/england-mexico-world-cup-history-1970-1986-maradona-azteca/8f6264e23d1857ec52b1c3f9,https://www.sportingnews.com/us/soccer/news/england-mexico-world-cup-history-1970-1986-maradona-azteca/8f6264e23d1857ec52b1c3f9,0,www.sportingnews.com,"England's unfortunate World Cup history in Mexico: Revisiting 1970, 1986 and Diego Maradona's Hand of God",England are back in Mexico for a World Cup match. Facing the in-form hosts at altitude amid storm warnings feels about par for the course.,https://s.yimg.com/os/en/the_sporting_news_articles_584/5436a2903c8ba3a5a47bfd104f3b68f4,2026-07-04T15:01:45Z,,"England's unfortunate World Cup history in Mexico: Revisiting 1970, 1986 and Diego Maradona's Hand of God originally appeared on The Sporting News. Add The Sporting News as a Preferred Source by clic… [+5489 chars]",,en,storm,Storm,random,,,
https://www.snopes.com/collections/heat-wave-fact-checks/,https://www.snopes.com/collections/heat-wave-fact-checks/,0,www.snopes.com,11 heat wave fact checks from our archives,We've fact-checked misguided rumors meant to keep you safe in hot weather and alleged images of objects melting during heat waves.,https://mediaproxy.snopes.com/width/1200/https://media.snopes.com/2026/07/heat_wave_collection_feature.png,2026-07-04T18:00:00Z,,"Brice, Makini, et al. ""Record Heatwave Disrupts Europe as France Warns Death Toll to Rise."" Reuters, 28 June 2026, www.reuters.com/business/environment/france-records-1000-excess-deaths-during-record… [+385 chars]",,en,heat wave,Heat Wave,random,,,
https://punchng.com/residents-must-become-active-participants-in-flood-control-lagos-com-for-environment-wahab/,https://punchng.com/residents-must-become-active-participants-in-flood-control-lagos-com-for-environment-wahab/,0,punchng.com,"Residents must become active participants in flood control – Lagos Com. for Environment, Wahab","Lagos Commissioner for Environment, Tokunbo Wahab, explains why residents must actively participate in flood control efforts to mitigate flash flooding in

Read More: https://punchng.com/residents-must-become-active-participants-in-flood-control-lagos-com-for…",https://punchng.com/wp-content/uploads/2026/06/OIP-36.webp,2026-07-04T23:51:05Z,,"The Commissioner for Environment and Water Resources, Tokunbo Wahab, spoke with DARE AKOGUN on why the state continues to witness flash flooding, ongoing investments in drainage infrastructure, enfor… [+11363 chars]",,en,flash flood,Flood,random,,,
https://economictimes.indiatimes.com/news/new-updates/delhi-noida-gurgaon-ghaziabad-rain-forecast-today-imd-predicts-rain-thunderstorms-strong-winds-and-increasing-rainfall-activity-till-july-9/articleshow/132191666.cms,https://economictimes.indiatimes.com/news/new-updates/delhi-noida-gurgaon-ghaziabad-rain-forecast-today-imd-predicts-rain-thunderstorms-strong-winds-and-increasing-rainfall-activity-till-july-9/articleshow/132191666.cms,0,economictimes.indiatimes.com,"Delhi, Noida, Gurgaon, Ghaziabad rain forecast today: IMD predicts rain, thunderstorms, strong winds and increasing rainfall activity till July 9","Delhi, Noida, Gurugram rain today: Delhi-NCR residents should brace for increased rainfall and thunderstorms over the next few days. The India Meteorological Department forecasts active monsoon conditions bringing cloudy skies, intermittent showers, and gusty…","https://img.etimg.com/thumb/msid-132191688,width-1200,height-630,imgsize-666058,overlay-economictimes/articleshow.jpg",2026-07-05T06:19:37Z,,Residents across Delhi-NCR may need to keep umbrellas handy over the next few days as the India Meteorological Department (IMD) has forecast a gradual increase in rainfall activity across the region.… [+4436 chars],,en,Thunderstorm India,Thunderstorm,wmo,India,SAS,Asia
https://spacedaily.com/d-in-1914-the-british-explorer-ernest-shackleton-set-sail-from-london-for-antarctica-with-28-men-and-a-ship-called-the-endurance-and-22-months-later-after-the-ship-was-crushed-by-pack-ice-an/,https://spacedaily.com/d-in-1914-the-british-explorer-ernest-shackleton-set-sail-from-london-for-antarctica-with-28-men-and-a-ship-called-the-endurance-and-22-months-later-after-the-ship-was-crushed-by-pack-ice-an/,0,spacedaily.com,"In 1914, the British explorer Ernest Shackleton set sail from London for Antarctica with 28 men and a ship called the Endurance — and 22 months later, after the ship was crushed by pack ice and the men had lived on drifting ice floes and a barren island for nearly two years, every one of them came home alive","On Saturday, 8 August 1914 — five days after the British declaration of war against the German Empire that would produce the subsequent four-year catastrophe of the First World War, and following a specific one-word instruction from the First Lord of the Admi…",https://spacedaily.com/wp-content/uploads/2026/07/Posts-1600840-2026-07-05T105640.051.png,2026-07-05T09:15:16Z,,"On Saturday, 8 August 1914 five days after the British declaration of war against the German Empire that would produce the subsequent four-year catastrophe of the First World War, and following a spe… [+9330 chars]",,en,ice floe,Snow&Ice,random,,,
https://economictimes.indiatimes.com/news/international/global-trends/heavy-rains-leave-5-dead-in-chinas-north-while-tropical-storm-maysak-hits-south-vietnam/articleshow/132193880.cms,https://economictimes.indiatimes.com/news/international/global-trends/heavy-rains-leave-5-dead-in-chinas-north-while-tropical-storm-maysak-hits-south-vietnam/articleshow/132193880.cms,0,economictimes.indiatimes.com,"Heavy rains leave 5 dead in China's north while Tropical Storm Maysak hits south, Vietnam","Northern China is grappling with the aftermath of heavy rains, which have tragically claimed five lives due to flash floods and drowning incidents. Meanwhile, Tropical Storm Maysak has brought significant disruption to the south, submerging vehicles and forci…","https://img.etimg.com/thumb/msid-132193915,width-1200,height-630,imgsize-354988,overlay-economictimes/articleshow.jpg",2026-07-05T10:19:56Z,,"Beijing: Heavy rains have left five people dead in northern China while a tropical storm toppled trees and submerged cars in the nation's south, state media reported Sunday.Two villagers died in a mo… [+1929 chars]",,en,heavy rain,Precipitation,random,,,
https://theconversation.com/historical-records-reveal-how-canadas-weather-has-changed-over-the-centuries-286023,https://theconversation.com/historical-records-reveal-how-canadas-weather-has-changed-over-the-centuries-286023,0,theconversation.com,Historical records reveal how Canada’s weather has changed over the centuries,"With weather records dating back hundreds of years, it’s possible to track everything from sudden downpours that led to flash floods to the slow changes that occur over centuries.",https://images.theconversation.com/files/745199/original/file-20260630-57-5mb0s2.jpg?ixlib=rb-4.1.0&rect=0%2C749%2C2964%2C1482&q=45&auto=format&w=1356&h=668&fit=crop,2026-07-05T13:46:30Z,,"Tornadoes, floods, wildfires and storms have all been in the news recently, and all are taken as harbingers of a coming climate catastrophe. The word “unprecedented” is often used in such reports, bu… [+5219 chars]",,en,Flood Canada,Flood,wmo,Canada,NEN,North-America
https://www.psychologytoday.com/us/blog/child-sleep-from-zzzs-to-as/202607/sleep-in-a-heatwave,https://www.psychologytoday.com/us/blog/child-sleep-from-zzzs-to-as/202607/sleep-in-a-heatwave,0,www.psychologytoday.com,Sleep in a Heatwave,"This summer, temperatures and humidity have broken records. Here's what research has shown about how our sleep is affected.",https://cdn2.psychologytoday.com/assets/styles/manual_crop_1_91_1_1528x800/public/field_blog_entry_images/2026-07/img_6694.jpeg.jpg?itok=-qdoqw5W,2026-07-05T21:46:13Z,,"The summer of 2026 has been setting records for high temperatures and heat-related deaths in Europe and the U.S. Older adults and those with chronic health problems are affected most, but everyone is… [+2778 chars]",,en,record heat,Heat Wave,random,,,
https://slashdot.org/firehose.pl?op=view&amp;id=184323400,https://slashdot.org/firehose.pl?op=view&amp;id=184323400,0,slashdot.org,World Cup 2026: England players' sleep undisturbed by Mexico fans letting off fireworks outside hotel - BBC,World Cup 2026: England players' sleep undisturbed by Mexico fans letting off fireworks outside hotelBBC World Cup Daily live: Mexico fans try to give England sleepless night; Brazil face NorwayESPN Mexico v England: storm delays arrival of teams at stadium b…,,2026-07-05T22:52:07Z,,The Fine Print: The following comments are owned by whoever posted them. We are not responsible for them in any way.,,en,Storm Norway,Storm,wmo,Norway,NEU,Europe
https://slashdot.org/firehose.pl?op=view&amp;id=184323766,https://slashdot.org/firehose.pl?op=view&amp;id=184323766,0,slashdot.org,Sunday night’s England-Mexico game in Mexico City figures to be massive - NBC Sports,Sunday night’s England-Mexico game in Mexico City figures to be massiveNBC Sports World Cup Daily live: Mexico fans try to give England sleepless night; Brazil face NorwayESPN Mexico v England: storm delays arrival of teams at stadium before World Cup 2026 la…,,2026-07-05T23:32:11Z,,"I THINK THEY SHOULD CONTINUE the policy of not giving a Nobel Prize for
paneling.
-- Jack Handley, The New Mexican, 1988.",,en,Storm Norway,Storm,wmo,Norway,NEU,Europe
https://www.foxsports.com/stories/soccer/england-weathers-storm-10-men-beat-mexico-advance-world-cup-quarterfinals,https://www.foxsports.com/stories/soccer/england-weathers-storm-10-men-beat-mexico-advance-world-cup-quarterfinals,0,www.foxsports.com,"England Weathers Storm With 10 Men To Beat Mexico, Advance To World Cup Quarterfinals",England is through to the 2026 FIFA World Cup quarterfinals after going down to 10 men and holding on for a 3-2 win against Mexico at Mexico City Stadium on Sunday.,https://a57.foxsports.com/statics.foxsports.com/www.foxsports.com/content/uploads/2026/07/1408/814/32ddf287-kane1.jpg?ve=1&tl=1,2026-07-06T03:04:32Z,,"England is through to the 2026 FIFA World Cup quarterfinals after going down to 10 men and holding on for a 3-2 win against Mexico at Mexico City Stadium on Sunday.
England got off to a dream start … [+1299 chars]",,en,storm,Storm,random,,,
https://www.channelnewsasia.com/sport/ten-man-england-beat-battling-mexico-3-2-in-last-16-thriller-6234186,https://www.channelnewsasia.com/sport/ten-man-england-beat-battling-mexico-3-2-in-last-16-thriller-6234186,0,www.channelnewsasia.com,Ten-man England beat battling Mexico 3-2 in last-16 thriller,"MEXICO CITY, July 5 : Ten-man England weathered a Mexico storm at the Azteca Stadium to reach the World Cup quarter-finals for the third straight time with a rip-roaring 3-2 victory over the co-hosts on Sunday thanks to a Jude Bellingham double and Harry Kane…","https://dam.mediacorp.sg/image/upload/s--yavYy1S9--/c_fill,g_auto,h_676,w_1200/fl_relative,g_south_east,l_mediacorp:cna:watermark:2024-04:reuters_1,w_0.1/f_auto,q_auto/v1/one-cms/core/2026-07-06T032733Z_1_LYNXMPEM6507M_RTROPTP_3_SOCCER-WORLDCUP-MEX-ENG.JPG?itok=zLiUY5k_",2026-07-06T03:27:33Z,,"MEXICO CITY, July 5 : Ten-man England weathered a Mexico storm at the Azteca Stadium to reach the World Cup quarter-finals for the third straight time with a rip-roaring 3-2 victory over the co-hosts… [+2145 chars]",,en,storm,Storm,random,,,
https://economictimes.indiatimes.com/news/new-updates/weather-today-and-tomorrow-july-6-7-delhi-gujarat-maharashtra-rajasthan-mp-odisha-kerala-on-high-alert-as-imd-warns-of-heavy-to-extremely-heavy-rainfall-thunderstorms-and-lightning-across-india/articleshow/132207126.cms,https://economictimes.indiatimes.com/news/new-updates/weather-today-and-tomorrow-july-6-7-delhi-gujarat-maharashtra-rajasthan-mp-odisha-kerala-on-high-alert-as-imd-warns-of-heavy-to-extremely-heavy-rainfall-thunderstorms-and-lightning-across-india/articleshow/132207126.cms,0,economictimes.indiatimes.com,"Weather Today and Tomorrow (July 6-7): Delhi, Gujarat, Maharashtra, Rajasthan, MP, Odisha, Kerala on high alert as IMD warns of heavy to extremely heavy rainfall, thunderstorms and lightning across India","Weather Today and Tomorrow: India's southwest monsoon is intensifying, with the IMD issuing multiple rainfall alerts for July 6-7. Heavy to extremely heavy downpours are expected across Gujarat, Maharashtra, Madhya Pradesh, Rajasthan, Kerala, Karnataka, and H…","https://img.etimg.com/thumb/msid-132207391,width-1200,height-630,imgsize-125466,overlay-economictimes/articleshow.jpg",2026-07-06T04:32:19Z,,"Weather Today and Tomorrow: India's southwest monsoon is highly active now, and the India Meteorological Department (IMD) has issued multiple rainfall alerts for July 6 and July 7 (Monday and Tuesday… [+6614 chars]",,en,Thunderstorm India,Thunderstorm,wmo,India,SAS,Asia
https://www.thelocal.se/20260706/today-in-sweden-a-roundup-of-the-latest-news-on-monday-251,https://www.thelocal.se/20260706/today-in-sweden-a-roundup-of-the-latest-news-on-monday-251,0,www.thelocal.se,Today in Sweden: A roundup of the latest news on Monday,"Police scour CCTV for clues after Uppsala fatal shooting – and over 10,000 lightning strikes recorded as severe thunderstorms batter Sweden. Here's the latest news.",https://assets.thelocal.com/cdn-cgi/rs:fit:1200/quality:75/plain/https://apiwp.thelocal.com/wp-content/uploads/2026/07/watermarks-logo-sdlrP1sn2U7e64_NormalHires.jpg@webp,2026-07-06T04:34:33Z,,"Police scour CCTV for clues after Uppsala fatal shooting and over 10,000 lightning strikes recorded as severe thunderstorms batter Sweden. Here's the latest news.
 Police scour CCTV for clues after … [+9280 chars]",,en,thunderstorm,Thunderstorm,random,,,
https://www.gov.uk/government/news/foreign-secretary-chatham-house-essay-britains-place-in-the-new-world-order,https://www.gov.uk/government/news/foreign-secretary-chatham-house-essay-britains-place-in-the-new-world-order,0,www.gov.uk,Foreign Secretary Chatham House essay: Britain’s place in the new world order,"We are facing a storm of geopolitical instability, economic coercion, AI and climate change – and it’s likely to get worse. But by working more closely with Europe and seeking greater cooperation outside the big trading blocs, Britain can build global allianc…",https://www.gov.uk/assets/frontend/govuk-opengraph-image-4196a4d6333cf92aaf720047f56cfd91b3532d7635fc21ebcf0d5897df6b5f77.png,2026-07-06T11:53:52Z,,"The world is more dangerous than it has been for decades, and families across the United Kingdom are feeling the impact. War has returned to Europe, pushing up energy bills at home. A closed strait 3… [+19173 chars]",,en,storm,Storm,random,,,
https://www.dw.com/en/is-africa-ready-for-el-nino-drought-floods/a-77826694,https://www.dw.com/en/is-africa-ready-for-el-nino-drought-floods/a-77826694,0,www.dw.com,Is Africa ready for El Nino?,"Experts warn the El Nino climate phenomenon could bring drought, floods and displacement to parts of Africa later this year. Are governments prepared?",https://static.dw.com/image/75915517_6.jpg,2026-07-06T13:59:00Z,,The United Nations Food and Agriculture Organization (FAO) and the World Food Programme (WFP) have appealed for over $200 million in funds to help protect 8.8 million people across 22 high-risk count… [+7757 chars],,en,drought,Drought,random,,,
https://www.dw.com/en/el-nino-is-africa-ready-for-the-perfect-storm/a-77826694,https://www.dw.com/en/el-nino-is-africa-ready-for-the-perfect-storm/a-77826694,0,www.dw.com,El Nino: Is Africa ready for the perfect storm?,"A strong El Nino expected later this year could bring drought, floods and displacement to parts of Africa. Experts say the warnings are clear, but question whether governments can act before disaster strikes.",https://static.dw.com/image/75915517_6.jpg,2026-07-06T13:59:00Z,,The United Nations Food and Agriculture Organization (FAO) and the World Food Programme (WFP) have appealed for over $200 million in funds to help protect 8.8 million people across 22 high-risk count… [+7757 chars],,en,Flood Lea NM,Flood,wmo,United States,CNA,North-America
https://www.rt.com/news/642634-europe-heat-economy-cost/,https://www.rt.com/news/642634-europe-heat-economy-cost/,0,www.rt.com,The cost of heat: Why Europe’s economy is melting,"Europe’s record heat is disrupting industry, transport and energy markets, while climate-related losses could cut the EU’s GDP by up to 7% and household incomes by 3%",https://mf.b37mrtl.ru/files/2026.07/article/6a4bb61b85f54004020c9744.jpg,2026-07-06T15:36:57Z,,"Western Europe has been enduring another record-breaking heat wave, with temperatures topping 40C in several countries. France, the UK, Germany and Switzerland have all seen their hottest June temper… [+6433 chars]",,en,record heat,Heat Wave,random,,,
https://www.vanguardngr.com/2026/07/brazil-federation-defends-ref-criticised-by-trump-in-balogun-storm/,https://www.vanguardngr.com/2026/07/brazil-federation-defends-ref-criticised-by-trump-in-balogun-storm/,0,www.vanguardngr.com,Brazil federation defends ref criticised by Trump in Balogun storm,"Brazil's football federation on Monday defended the integrity of a referee who US President Donald Trump said was ""a little bit suspect"", amid a furore over FIFA's reversal of a red card given to US striker Folarin Balogun.
The post Brazil federation defends …",https://cdn.vanguardngr.com/wp-content/uploads/2026/05/Balogun.jpg,2026-07-06T17:41:30Z,,"Brazil’s football federation on Monday defended the integrity of a referee who US President Donald Trump said was “a little bit suspect”, amid a furore over FIFA’s reversal of a red card given to US … [+229 chars]",,en,storm,Storm,random,,,
https://gothamist.com/news/nyc-nj-report-death-toll-from-historic-heat-wave,https://gothamist.com/news/nyc-nj-report-death-toll-from-historic-heat-wave,0,gothamist.com,"NYC, NJ report death toll from historic heat wave","A woman wipes sweat from her face as she walks through Midtown Manhattan during a heat wave in New York City on July 3, 2026.
 

In New Jersey alone, the number of deaths reached 29. [ more › ]",https://api-prod.gothamist.com/images/358006/fill-1200x650|format-webp|webpquality-85/,2026-07-06T20:02:04Z,,"Three New Yorkers died in their homes from heat-related illness over the weekend, at the tail end of a historic heatwave, according to the mayors office. The heat wave lasted from Wednesday through S… [+1580 chars]",,en,heat wave,Heat Wave,random,,,
https://wealthofgeeks.com/england-wags-celebrate-dramatic-mexico-win-after-braving-storms-at-world-cup-clash/,https://wealthofgeeks.com/england-wags-celebrate-dramatic-mexico-win-after-braving-storms-at-world-cup-clash/,0,wealthofgeeks.com,England WAGs Celebrate Dramatic Mexico Win After Braving Storms at World Cup Clash,England’s WAGs had their own dramatic night in Mexico as the Three Lions survived a storm-hit World Cup thriller and booked a place in the ... Read More,https://s.yimg.com/lo/mysterio/api/91601e7438a8a2ef44081910f78cc44570463e076cab2e1b1ba24524f0d306ad/lightyear_networkapi/resizefill_w1200;quality_80;format_webp/https:%2F%2Fmedia.zenfs.com%2Fen%2Fwealth_of_geeks_188%2F2b4a74f4e063ed5ed1304ecc43b1f268,2026-07-06T20:07:28Z,,"England's WAGs had their own dramatic night in Mexico as the Three Lions survived a storm-hit World Cup thriller and booked a place in the quarter-finals.
The Mirror reported that the England player… [+2098 chars]",,en,storm,Storm,random,,,
https://www.wonkette.com/p/trumps-july-4-sees-crowds-as-small,https://www.wonkette.com/p/trumps-july-4-sees-crowds-as-small,0,www.wonkette.com,Trump's July 4 Sees Crowds As Small As His Tiny Hands,"The president's 4th included extreme heat and Nazis. Yeah, that tracks.","https://substackcdn.com/image/fetch/$s_!Mgzu!,w_1200,h_675,c_fill,f_jpg,q_auto:good,fl_progressive:steep,g_auto/https%3A%2F%2Fsubstack-post-media.s3.amazonaws.com%2Fpublic%2Fimages%2F12fbd90a-0cff-4645-bbb2-ea7d1985dac6_1024x699.jpeg",2026-07-06T20:21:03Z,,How was everyones July 4 holiday? Hot? Humid? Filled with friends and family and mass consumption of artery-clogging food and joy and unbreathable air thanks to the Trump administration turning the a… [+6056 chars],,en,heat,Heat Wave,random,,,
https://wattsupwiththat.com/2026/07/06/europes-crisis-is-energy-poverty-not-a-heat-wave/,https://wattsupwiththat.com/2026/07/06/europes-crisis-is-energy-poverty-not-a-heat-wave/,0,wattsupwiththat.com,"Europe’s Crisis Is Energy Poverty, Not a Heat Wave","It is time to wake up from this fear-induced coma. The public manipulation has placed a massive premium on the cost of electricity, heating, and cooling.
The post Europe’s Crisis Is Energy Poverty, Not a Heat Wave appeared first on Watts Up With That?.",https://i0.wp.com/wattsupwiththat.com/wp-content/uploads/2026/07/bogitw-channel-3547224.webp?fit=1024%2C512&quality=75&ssl=1,2026-07-06T21:00:00Z,,"By Vijay Jayaraj
When temperatures elevate in Europe, political rhetoric rises even faster. Within days of the June 2026 heat wave, familiar voices rushed to assign blame. John Kerry, speaking to th… [+4599 chars]",,en,heat wave,Heat Wave,random,,,
