index,url,valid,domain,title,description,image,published,archive,content,quote,language,term,topic,feed,country,ipcc,continent
https://www.fox6now.com/weather/rain-snow-expected-saturday-night-another-system-next-week,https://www.fox6now.com/weather/rain-snow-expected-saturday-night-another-system-next-week,0,www.fox6now.com,Rain and snow expected Saturday night; another system next week,Rain and snow expected Saturday night; another system next weekfox6now.com,https://images.foxtv.com/static.fox6now.com/www.fox6now.com/content/uploads/2023/12/1280/720/web-4am.jpg?ve=1&tl=1,2023-12-02T18:14:08Z,,"MILWAUKEE - Mother Nature brought rain near the lake and snow inland on Friday, Dec. 1. Snow totals were light, with most areas accumulating several tenths of an inch.
This was the first of three qu… [+1600 chars]",,en,Rain,Precipitation,wmo,Argentina,SES,South-America
https://slashdot.org/firehose.pl?op=view&amp;id=172351933,https://slashdot.org/firehose.pl?op=view&amp;id=172351933,0,slashdot.org,Map: 7.6-Magnitude Earthquake Strikes the Philippine Sea - The New York Times,Map: 7.6-Magnitude Earthquake Strikes the Philippine SeaThe New York Times 7.6 magnitude earthquake strikes off the southern Philippines and tsunami warnings are issuedYahoo News People run as earthquake hits the PhilippinesReuters Philippines earthquakes: Mi…,,2023-12-02T19:53:30Z,,Sign up for the Slashdot newsletter! OR check out the new Slashdot job board to browse remote jobs or jobs in your areaDo you develop on GitHub? You can keep using GitHub but automatically sync your … [+268 chars],,en,Tsunami Philippines,Tsunami,usgs,Philippines,SEA,Asia
https://www.voanews.com/a/strong-quake-in-philippines-triggers-tsunami-warnings-and-evacuations-/7381784.html,https://www.voanews.com/a/strong-quake-in-philippines-triggers-tsunami-warnings-and-evacuations-/7381784.html,0,www.voanews.com,"Strong Quake in Philippines Triggers Evacuations, Tsunami Warnings","Evacuations were underway in the Philippines after a quake of at least magnitude 7.5 struck the southern region of Mindanao on Saturday, triggering tsunami warnings in the country and in Japan, though a U.S. agency said the risk of large waves had passed. 

T…",https://gdb.voanews.com/7788254D-C57A-41A2-8A9A-59047A181DA2.jpg,2023-12-02T20:04:18Z,,"manila, Philippines  Evacuations were underway in the Philippines after a quake of at least magnitude 7.5 struck the southern region of Mindanao on Saturday, triggering tsunami warnings in the countr… [+2860 chars]",,en,Tsunami Mindanao Philippines,Tsunami,usgs,,SEA,Asia
https://www.fox6now.com/weather/wisconsin-rain-snow-saturday,https://www.fox6now.com/weather/wisconsin-rain-snow-saturday,0,www.fox6now.com,"Rain, snow expected Saturday night; another system next week",Another winter weather system arrives Saturday night. Whether you see rain or snow could depend on where you are.,https://images.foxtv.com/static.fox6now.com/www.fox6now.com/content/uploads/2023/12/1280/720/web-4am.jpg?ve=1&tl=1,2023-12-02T21:43:53Z,,"MILWAUKEE - Mother Nature brought rain near the lake and snow inland on Friday, Dec. 1. Snow totals were light, with most areas accumulating several tenths of an inch.
This was the first of three qu… [+2302 chars]",,en,Rain,Precipitation,wmo,Argentina,SES,South-America
https://www.spacedaily.com/reports/Historic_1872_Chapman_Silverman_Storm_A_Window_into_Solar_Impact_on_Modern_Technology_999.html,https://www.spacedaily.com/reports/Historic_1872_Chapman_Silverman_Storm_A_Window_into_Solar_Impact_on_Modern_Technology_999.html,0,www.spacedaily.com,1872 Chapman-Silverman Storm: A window into solar impact on modern life,"Nagoya, Japan (SPX) Dec 04, 2023


In early November of this year, the night skies were adorned with aurora borealis, visible as far south as Italy and Texas, signaling the impacts of a solar coronal mass ejection on Earth's magnetic field and atmosphere. Thi…",https://www.spxdaily.com/images-hg/japanese-auroral-drawing-okazaki-february-1872-solar-storm-hg.jpg,2023-12-03T03:30:30Z,https://web.archive.org/web/20231205123225/https://www.spacedaily.com/reports/Historic_1872_Chapman_Silverman_Storm_A_Window_into_Solar_Impact_on_Modern_Technology_999.html,"1872 Chapman-Silverman Storm: A window into solar impact on modern lifeby Riko SeiboNagoya, Japan (SPX) Dec 04, 2023
In early November of this year, the night skies were adorned with aurora borealis… [+3983 chars]",,en,Storm Italy,Storm,meteo,Italy,MED,Europe
https://newsnextbd.com/bangladesh-warns-maritime-ports-over-cyclone-michaung/,https://newsnextbd.com/bangladesh-warns-maritime-ports-over-cyclone-michaung/,0,newsnextbd.com,Bangladesh warns maritime ports over cyclone Michaung,"Staff Correspondent, Dhaka – Bangladesh has advised maritime ports against a tropical cyclone that was brewing in the Bay of Bengal. The cyclone Michaung was located about 1575 kilometers southwest of Bangladesh’s major port of Chittagong on Sunday morning, a…",https://newsnextbd.com/wp-content/uploads/2023/12/Cyclone-Michaung-.jpg,2023-12-03T08:12:41Z,,"Staff Correspondent, Dhaka Bangladesh has advised maritime ports against a tropical cyclone that was brewing in the Bay of Bengal.
The cyclone Michaung was located about 1575 kilometers southwest of… [+746 chars]",,en,cyclone,Tropical Cyclone,random,,,
https://www.bbc.co.uk/news/world-africa-67607597,https://www.bbc.co.uk/news/world-africa-67607597,0,www.bbc.co.uk,Tanzania floods: Heavy rain and landslides kill 47 in Hanang district,The president sends in security forces after 47 die and 80 are wounded in Hanang district.,https://ichef.bbci.co.uk/news/1024/branded_news/2E23/production/_131911811_1000461026.jpg,2023-12-03T17:24:42Z,https://web.archive.org/web/20231203180626/https://www.bbc.co.uk/news/world-africa-67607597,"Severe flooding and landslides have killed at least 47 people and wounded 80 others in northern Tanzania, local officials say.
It happened near the slopes of Mount Hanang, where President Samia Hass… [+719 chars]",,en,Rain Tanzania,Precipitation,wmo,Tanzania,SEAF,Africa
https://punchng.com/at-least-47-dead-85-injured-in-tanzania-landslides/,https://punchng.com/at-least-47-dead-85-injured-in-tanzania-landslides/,0,punchng.com,"At least 47 dead, 85 injured in Tanzania landslides","No fewer than 47 people were killed and 85 others injured in landslides caused by flooding in northern Tanzania, a local official announced Sunday, with warnings the toll would rise. Heavy rain on Saturday hit the town of Katesh, some 300 kilometres (186 mile…",https://cdn.punchng.com/wp-content/uploads/2017/08/24101607/Landslide2.jpg,2023-12-03T19:36:38Z,https://web.archive.org/web/20231205122427/https://punchng.com/at-least-47-dead-85-injured-in-tanzania-landslides/,"No fewer than 47 people were killed and 85 others injured in landslides caused by flooding in northern Tanzania, a local official announced Sunday, with warnings the toll would rise.
Heavy rain on S… [+1419 chars]",,en,Flood,Flood,wmo,Barbados,CAR,North-America
https://www.ndtv.com/world-news/47-killed-85-injured-in-landslides-caused-by-flooding-in-tanzania-official-4631045,https://www.ndtv.com/world-news/47-killed-85-injured-in-landslides-caused-by-flooding-in-tanzania-official-4631045,0,www.ndtv.com,47 Killed In Landslides Caused By Flooding In Tanzania: Official,"At least 47 people were killed and 85 others injured in landslides caused by flooding in northern Tanzania, a local official announced Sunday, with warnings the toll would rise.",https://c.ndtvimg.com/2023-05/brt1qhk8_flood-generic-unsplash_625x300_03_May_23.jpg,2023-12-03T19:59:43Z,https://web.archive.org/web/20231205122305/https://www.ndtv.com/world-news/47-killed-85-injured-in-landslides-caused-by-flooding-in-tanzania-official-4631045,"East Africa has been hit for weeks by torrential rain and flooding linked to the El Nino
Dodoma, Tanzania: At least 47 people were killed and 85 others injured in landslides caused by flooding in no… [+1646 chars]",,en,Flood,Flood,wmo,Barbados,CAR,North-America
https://www.aljazeera.com/news/2023/12/3/floods-landslides-kill-dozens-in-northern-tanzania,https://www.aljazeera.com/news/2023/12/3/floods-landslides-kill-dozens-in-northern-tanzania,0,www.aljazeera.com,"Floods, landslides kill dozens in northern Tanzania",East Africa has been hit for weeks by torrential rain and flooding linked to the El Nino weather phenomenon.,https://www.aljazeera.com/wp-content/uploads/2023/12/east-africa-1701632777.jpeg?resize=1920%2C1440,2023-12-03T20:38:30Z,https://web.archive.org/web/20231203231254/https://www.aljazeera.com/news/2023/12/3/floods-landslides-kill-dozens-in-northern-tanzania,"At least 47 people have been killed and 85 others injured in landslides caused by flooding in northern Tanzania, says a local official, with warnings the toll could rise.
Heavy rain on Saturday hit … [+2760 chars]",,en,Flood,Flood,wmo,Barbados,CAR,North-America
https://www.abc.net.au/news/2023-12-04/tanzanian-landslides-kill-dozens/103183786,https://www.abc.net.au/news/2023-12-04/tanzanian-landslides-kill-dozens/103183786,0,www.abc.net.au,At least 47 people killed in Tanzanian landslides following torrential rain,"Dozens have been killed in landslides caused by heavy rain in northern Tanzania, with fears the death toll will continue to rise.",https://live-production.wcms.abc-cdn.net.au/ea1424e3b68ca85841b6305fb4941fae?impolicy=wcms_crop_resize&cropH=341&cropW=607&xPos=0&yPos=72&width=862&height=485,2023-12-03T23:28:35Z,https://web.archive.org/web/20231203233252/https://www.abc.net.au/news/2023-12-04/tanzanian-landslides-kill-dozens/103183786,"At least 47 people are dead and 85 others have been injured in landslides caused by flooding in northern Tanzania and there are warnings the death toll is likely to rise. 
<ul><li>Heavy rain hit the… [+1332 chars]",,en,torrential rain,Precipitation,random,,,
https://www.cbsnews.com/news/atmospheric-rivers-forecast-pacific-northwest-portland-oregon-washington/,https://www.cbsnews.com/news/atmospheric-rivers-forecast-pacific-northwest-portland-oregon-washington/,0,www.cbsnews.com,Atmospheric rivers forecast for Pacific Northwest next week,The National Weather Service on Saturday issued a flood watch ​for most of southwest Washington and northwest Oregon that will remain in place until Wednesday afternoon.,https://assets3.cbsnewsstatic.com/hub/i/r/2023/12/03/81094120-7e30-44d1-9b54-2bf066a63ec1/thumbnail/1200x630/dee2be492cc612345bc8444551281fe2/krtx-0.gif?v=2a3c5d91939c9bf28fa0bc6fdfacfdd4,2023-12-04T00:05:46Z,,"Atmospheric rivers are expected in the Pacific Northwest next week as heavy rainfall continues to deluge the region. 
The National Weather Service on Saturday issued a flood watch for most of southw… [+1286 chars]",,en,Flood,Flood,wmo,Barbados,CAR,North-America
https://biztoc.com/x/a530e4618ec22b42,https://biztoc.com/x/a530e4618ec22b42,0,biztoc.com,Floods kill more than 20 people in northern Tanzania,"DAR ES SALAAM, Dec 3 (Reuters) - At least 20 people have been killed by floods after heavy rain in the Manyara region of northern Tanzania, the ministry of health said on Sunday. Severe flooding caused by the El Nino weather phenomenon has killed hundreds of …",https://c.biztoc.com/p/a530e4618ec22b42/s.webp,2023-12-04T02:08:26Z,,"DAR ES SALAAM, Dec 3 (Reuters) - At least 20 people have been killed by floods after heavy rain in the Manyara region of northern Tanzania, the ministry of health said on Sunday.Severe flooding cause… [+303 chars]",,en,Rain Tanzania,Precipitation,wmo,Tanzania,SEAF,Africa
https://www.voanews.com/a/tanzania-flood-landslide-death-toll-jumps-to-47/7383049.html,https://www.voanews.com/a/tanzania-flood-landslide-death-toll-jumps-to-47/7383049.html,0,www.voanews.com,"Tanzania flood, landslide death toll jumps to 47","The number of people killed by floods and landslides in northern Tanzania has jumped to 47, with another 85 people injured, following torrential rain, a senior government official said.

Severe flooding caused by a combination of the El Nino and Indian Ocean …",https://gdb.voanews.com/2CE538FF-16F8-47CF-916C-893F7DC606AB.jpg,2023-12-04T03:30:45Z,https://web.archive.org/web/20231204080316/https://www.voanews.com/a/tanzania-flood-landslide-death-toll-jumps-to-47/7383049.html,"DAR ES SALAAM, Tanzania  The number of people killed by floods and landslides in northern Tanzania has jumped to 47, with another 85 people injured, following torrential rain, a senior government off… [+984 chars]",,en,Torrential Rain India,Precipitation,wmo,India,SAS,Asia
https://www.voanews.com/a/floods-kill-more-than-20-people-in-northern-tanzania/7383049.html,https://www.voanews.com/a/floods-kill-more-than-20-people-in-northern-tanzania/7383049.html,0,www.voanews.com,Floods Kill More Than 20 People in Northern Tanzania,"At least 20 people have been killed by floods after heavy rain in the Manyara region of northern Tanzania, the ministry of health said on Sunday.

Severe flooding caused by the El Nino weather phenomenon has killed hundreds of people in Kenya and Somalia in r…",https://gdb.voanews.com/91D52AB5-5D9C-48E3-814F-110FF3421FD8.jpg,2023-12-04T03:30:45Z,https://web.archive.org/web/20231204040437/https://www.voanews.com/a/floods-kill-more-than-20-people-in-northern-tanzania/7383049.html,"DAR ES SALAAM, Tanzania  At least 20 people have been killed by floods after heavy rain in the Manyara region of northern Tanzania, the ministry of health said on Sunday.
Severe flooding caused by t… [+1095 chars]",,en,Rain,Precipitation,wmo,Argentina,SES,South-America
https://www.cbc.ca/news/canada/british-columbia/heavy-rain-south-coast-1.7047928,https://www.cbc.ca/news/canada/british-columbia/heavy-rain-south-coast-1.7047928,0,www.cbc.ca,Atmospheric river to bring heavy rain to B.C. South Coast Monday,A special weather statement notes the Lower Mainland up to Pemberton will receive 50 to 70 mm of rain while parts of Vancouver Islandc ould see up to 150 mm over the course of the day.,https://i.cbc.ca/1.7047997.1701661788!/cumulusImage/httpImage/image.jpg_gen/derivatives/16x9_620/atmospheric-river.jpg,2023-12-04T05:15:18Z,,"Environment Canada is warning a heavy rain storm that it's calling an atmospheric river will fall on B.C.'s South Coast Monday. 
A special weather statement notes the Lower Mainland up to Pemberton … [+2040 chars]",,en,Rain,Precipitation,wmo,Argentina,SES,South-America
https://www.cbc.ca/news/canada/new-brunswick/nb-peat-industry-troubled-bad-weather-1.7044671,https://www.cbc.ca/news/canada/new-brunswick/nb-peat-industry-troubled-bad-weather-1.7044671,0,www.cbc.ca,New Brunswick's peatlands: A little-known industry troubled by rainy weather,"The organic soil underneath the surface of bogs is a big business in northeast New Brunswick, processed and shipped around the world as a starter for everything from roses to tomatoes.",https://i.cbc.ca/1.7045074.1701368001!/fileImage/httpImage/image.JPG_gen/derivatives/16x9_620/peatlands.JPG,2023-12-04T10:00:00Z,,"On a gusty fall day on Lamèque Island, Jean-Yves Daigle treads across a sprawling bog, a blend of soggy red, white and green vegetation.
He stops and kneels down, tearing a large handful of nutrient… [+6386 chars]",,en,Rain,Precipitation,wmo,Argentina,SES,South-America
https://www.forbes.com/sites/angelalei/2023/12/04/66north-launches-new-fragrance-with-fischersund-perfumery/,https://www.forbes.com/sites/angelalei/2023/12/04/66north-launches-new-fragrance-with-fischersund-perfumery/,0,www.forbes.com,66°North Launches New Fragrance With Fischersund Perfumery,"Collaborating for the second time, 66°North and Fischersund launch their new “Jöklalykt” fragrance, drawing much-needed attention to Icelandic glaciers.",https://imageio.forbes.com/specials-images/imageserve/656b5034f7fca64d5d59579a/0x0.jpg?format=jpg&height=900&width=1600&fit=bounds,2023-12-04T10:48:26Z,,"66°North Launches Fragrance With Fischersund Perfumery
Courtesy of 66°North
Collaborating for the second time,66°North and Fischersund launch their new Jöklalykt fragrance. An ode to Icelandic glac… [+2321 chars]",,en,Ice Iceland,Snow&Ice,wmo,Iceland,GIC,Europe
https://www.latimes.com/environment/story/2023-12-04/after-mild-fire-year-southern-california-crews-look-ahead,https://www.latimes.com/environment/story/2023-12-04/after-mild-fire-year-southern-california-crews-look-ahead,0,www.latimes.com,"After a mild fire year, Southern California crews look ahead to 2024","This year's rains kept fire conditions to a minimum, but also spurred new vegetation that could burn in 2024.",https://ca-times.brightspotcdn.com/dims4/default/716d761/2147483647/strip/true/crop/4645x2439+0+405/resize/1200x630!/quality/75/?url=https%3A%2F%2Fcalifornia-times-brightspot.s3.amazonaws.com%2Ff3%2Fed%2Fefce46d44960a5a26697a84e0262%2F1380756-me-forest-service-burn-mt-baldy014-ls.jpg,2023-12-04T11:00:59Z,,"On a cool, cloudy morning one day last week, Albert Rivas approached a pile of dry wood in the Angeles National Forest and set it on fire.
The pile roared to life, and within minutes, it was spewing… [+7746 chars]",,en,Rain,Precipitation,wmo,Argentina,SES,South-America
https://www.businesstoday.in/latest/trends/story/cyclone-michaung-who-named-it-how-do-cyclones-get-their-names-check-details-here-408150-2023-12-04,https://www.businesstoday.in/latest/trends/story/cyclone-michaung-who-named-it-how-do-cyclones-get-their-names-check-details-here-408150-2023-12-04,0,www.businesstoday.in,Cyclone Michaung: Who named it? How do cyclones get their names? Check details here,"After the severe effects of the Michaung cyclone started affecting the state in several ways, multiple flights to and fro from Chennai were cancelled, and many flights were diverted to avoid extreme weather conditions due to cyclone Michaung",https://akm-img-a-in.tosshub.com/businesstoday/images/story/202312/ezgif-sixteen_nine_51.jpg,2023-12-04T11:30:34Z,https://web.archive.org/web/20231204114738/https://www.businesstoday.in/latest/trends/story/cyclone-michaung-who-named-it-how-do-cyclones-get-their-names-check-details-here-408150-2023-12-04,"After heavy rainfall disrupted the everyday livelihood of people in Chennai and left a large portion of the city submerged in rainwater, the people in the city were forced to stay indoors. This state… [+2145 chars]",,en,cyclone,Tropical Cyclone,random,,,
https://www.nationalobserver.com/2023/12/04/news/atmospheric-river-storm-will-bring-heavy-rain-southern-bc-environment-canada-says,https://www.nationalobserver.com/2023/12/04/news/atmospheric-river-storm-will-bring-heavy-rain-southern-bc-environment-canada-says,0,www.nationalobserver.com,"Atmospheric river storm will bring heavy rain to southern B.C., Environment Canada says",Environment Canada says a heavy rain storm it's calling an atmospheric river is forecast to hit southern British Columbia on Monday.,https://www.nationalobserver.com/sites/nationalobserver.com/files/styles/nat_social/public/img/2023/12/03/20231203141220-656cd53fb3178b95c9ce176bjpeg.jpg?itok=9Y7GWGD1,2023-12-04T11:52:37Z,https://web.archive.org/web/20231204130516/https://www.nationalobserver.com/2023/12/04/news/atmospheric-river-storm-will-bring-heavy-rain-southern-bc-environment-canada-says,"Environment Canada says a heavy rain storm it's calling an atmospheric river is forecast to hit southern British Columbia Monday.
The agency says the storm will bring heavy rain and snow at higher e… [+597 chars]",,en,Rain Canada,Precipitation,wmo,Canada,NEN,North-America
https://www.scientificamerican.com/article/a-huge-italian-volcano-could-be-ready-to-erupt/,https://www.scientificamerican.com/article/a-huge-italian-volcano-could-be-ready-to-erupt/,0,www.scientificamerican.com,A Huge Italian Volcano Could Be Ready to Erupt,"Italy’s Campi Flegrei volcano has caused thousands of recent earthquakes and pushed up the ground, worrying 1.3 million residents",https://static.scientificamerican.com/sciam/cache/file/E1B78955-6F89-4240-AC756134F17B6BAC_source.jpeg?w=1200,2023-12-04T12:00:00Z,https://web.archive.org/web/20231205031223/https://www.scientificamerican.com/article/a-huge-italian-volcano-could-be-ready-to-erupt/,"On the night of October 2 a worrisome earthquake shook the towns above Campi Flegrei, a huge, long-dormant volcano immediately west of Naples, whipping local media and authorities into a frenzy. Jour… [+9659 chars]",,en,Earthquake CA,Earthquake,usgs,CA,NCA,North-America
https://indianexpress.com/article/explained/cyclone-michaung-intensifies-9054156/,https://indianexpress.com/article/explained/cyclone-michaung-intensifies-9054156/,0,indianexpress.com,Cyclone Michaung intensifies into ‘severe’ cyclonic storm: Everything you need to know,"Cyclone Michaung is expected to travel parallel and close to the south Andhra Pradesh coast till Monday. Later, it will cross the south Andhra Pradesh coast, close to Bapatla, sometime on Tuesday.",https://images.indianexpress.com/2023/12/cylcone.jpg,2023-12-04T12:00:35Z,https://web.archive.org/web/20231204130641/https://indianexpress.com/article/explained/cyclone-michaung-intensifies-9054156/,"Cyclone Michaung over west-central and coastal south Andhra Pradesh has intensified into a severe cyclonic storm, and is expected to make landfall near the states Bapatla district on the morning of D… [+4434 chars]",,en,cyclone,Tropical Cyclone,random,,,
https://www.cbsnews.com/news/cyclone-michaung-chennai-india-flooding-airport-video-cars-swept-down-streets/,https://www.cbsnews.com/news/cyclone-michaung-chennai-india-flooding-airport-video-cars-swept-down-streets/,0,www.cbsnews.com,"Cars swept away, Chennai airport flooded as cyclone churns toward India","Videos from Chennai, South India, show cars being carried off and airport workers checking planes in almost knee-deep water as Cyclone Michaung bears down.",https://assets3.cbsnewsstatic.com/hub/i/r/2023/12/04/29c1ceee-68ad-4e91-ab59-9f05c1e13916/thumbnail/1200x630/5c89fa3a4a12cb28ec2f3341518b6d00/chennai-india-cyclone-michaung.jpg?v=2a3c5d91939c9bf28fa0bc6fdfacfdd4,2023-12-04T13:03:59Z,https://web.archive.org/web/20231204131526/https://www.cbsnews.com/news/cyclone-michaung-chennai-india-flooding-airport-video-cars-swept-down-streets/,New Delhi — Heavy rain and flooding brought by the approaching Cyclone Michaung snarled life in the South Indian city of Chennai Monday. Streets in most parts of the city — home to some 12 million pe… [+2841 chars],,en,cyclone,Tropical Cyclone,random,,,
https://dailycaller.com/2023/12/04/47-dead-85-injured-landslides-rain-destroy-tanzania/,https://dailycaller.com/2023/12/04/47-dead-85-injured-landslides-rain-destroy-tanzania/,0,dailycaller.com,"47 Dead, 85 Injured After Landslides And Rain Destroy Northern Part Of Country","A landslide in northern Tanzania has killed 47 and left injured, authorities said Monday.",https://cdn01.dailycaller.com/wp-content/uploads/2023/12/Screenshot-2023-12-04-085408-fotor-202312048560-e1701698209117.png,2023-12-04T15:09:52Z,https://web.archive.org/web/20231205043813/https://dailycaller.com/2023/12/04/47-dead-85-injured-landslides-rain-destroy-tanzania/,"A landslide in northern Tanzania has killed 47 and left at least 85 others injured, authorities said Monday.
As a result, the government dispatched the military to help rescue the hundreds of people… [+1918 chars]",,en,Rain,Precipitation,wmo,Argentina,SES,South-America
https://indianexpress.com/article/upsc-current-affairs/upsc-key-4th-december-2023-coal-phase-out-cyclone-michaung-and-all-india-judicial-service-9054408/,https://indianexpress.com/article/upsc-current-affairs/upsc-key-4th-december-2023-coal-phase-out-cyclone-michaung-and-all-india-judicial-service-9054408/,0,indianexpress.com,"UPSC Key—4th December, 2023: Coal phase-out, Cyclone Michaung and All India Judicial Service","Exclusive for Subscribers from Monday to Friday: Why “phase-out” of coal to “phase-down” of Coal and India’s stand on renewable energy are relevant to the UPSC Exam? What significance do topics like Indian military personnel in Maldives, Classification of cyc…",https://images.indianexpress.com/2023/12/UPSC-Key-4th-Dec.png,2023-12-04T15:17:49Z,https://web.archive.org/web/20231205022255/https://indianexpress.com/article/upsc-current-affairs/upsc-key-4th-december-2023-coal-phase-out-cyclone-michaung-and-all-india-judicial-service-9054408/,"Coal phase-out in COP28 pledge, India refrains from endorsing it
Syllabus:
Preliminary Examination: General issues on Environmental ecology, Bio-diversity and Climate Change
Mains Examination: Gen… [+29580 chars]",,en,cyclone,Tropical Cyclone,random,,,
https://www.france24.com/en/tv-shows/eye-on-africa/20231204-tanzania-flood-deaths-rise-to-at-least-60-after-torrential-rain,https://www.france24.com/en/tv-shows/eye-on-africa/20231204-tanzania-flood-deaths-rise-to-at-least-60-after-torrential-rain,0,www.france24.com,Tanzania flood deaths rise to at least 60 after torrential rain,In tonight's edition: Hundreds of lives have been lost across East Africa as it is battered by torrential rain and flooding. The drive for more green infrastructure across Africa gets a 175 million dollar boost at the COP 28 summit. Uganda's planning on crack…,https://s.france24.com/media/display/6400f142-92e9-11ee-891c-005056bf30b7/w:1280/p:16x9/ANGL231204-2146-Live.jpg,2023-12-04T22:09:42Z,https://web.archive.org/web/20231204224414/http://www.france24.com/en/tv-shows/eye-on-africa/20231204-tanzania-flood-deaths-rise-to-at-least-60-after-torrential-rain,"Issued on: 04/12/2023 - 23:09
In tonight's edition: Hundreds of lives have been lost across East Africa as it is battered by torrential rain and flooding. The drive for more green infrastructure acr… [+197 chars]",,en,Torrential Rain Tanzania,Precipitation,wmo,Tanzania,SEAF,Africa
