index,url,valid,domain,title,description,image,published,archive,content,quote,language,term,topic,feed,country,ipcc,continent
https://www.abc.net.au/news/2026-03-26/seasons-clash-polar-blast-summer-cyclone-australia-weather/106496192,https://www.abc.net.au/news/2026-03-26/seasons-clash-polar-blast-summer-cyclone-australia-weather/106496192,0,www.abc.net.au,Summer cyclone and winter storm as Australia's weather turns unseasonal,A clash of seasons is developing on Australia's weather map this week as a tropical cyclone tracks towards the WA west coast and a cold polar blast with thunderstorms forms over the east.,https://live-production.wcms.abc-cdn.net.au/6a6bdec0bbff85d20c492b8be17348f9?impolicy=wcms_watermark_news&cropH=1152&cropW=2048&xPos=0&yPos=384&width=862&height=485&imformat=generic,2026-03-25T18:54:10Z,,"A clash of seasons is developing on Australia's weather map this week.
As a tropical cyclone tracks towards the WA west coast, a cold polar blast with thunderstorms, gales and snow is developing ove… [+5988 chars]",,en,cold weather Australia,Cold Wave,acwe,Australia,CAU,Oceania
https://www.cbsnews.com/news/arctic-sea-ice-hits-lowest-winter-level-heat-records/,https://www.cbsnews.com/news/arctic-sea-ice-hits-lowest-winter-level-heat-records/,0,www.cbsnews.com,Arctic sea ice hits lowest winter level as heat records are shattered worldwide,"Arctic sea ice levels are crucial to Earth's climate because, without the ice reflecting sunlight, more heat energy goes into the oceans.",https://assets1.cbsnewsstatic.com/hub/i/r/2025/12/17/7df7dc51-bc2c-4bf3-a484-e9b1b6f426d1/thumbnail/1200x630/dce5e311dde70e9bd5603edb9b552624/gettyimages-2244807372.jpg,2026-03-27T18:36:25Z,,"Vital Arctic sea ice shrank to basically tie its lowest measured level for the winter, the season when ice grows, as a warming Earth shattered records across the continents.
Arctic sea ice levels, e… [+4827 chars]",,en,record heat,Heat Wave,random,,,
https://www.pbs.org/newshour/science/arctic-sea-ice-shrank-to-tie-its-lowest-winter-level-as-unprecedented-heat-shatters-records-globally,https://www.pbs.org/newshour/science/arctic-sea-ice-shrank-to-tie-its-lowest-winter-level-as-unprecedented-heat-shatters-records-globally,0,www.pbs.org,Arctic sea ice shrank to tie its lowest winter level as unprecedented heat shatters records globally,"Vital Arctic sea ice shrank to tie its lowest measured level for the winter, the season when ice grows, as a warming Earth shattered records across the continents.",https://d3i6fh83elv35t.cloudfront.net/static/2026/03/2026-02-04T120814Z_1135621528_RC2RBJAWP97L_RTRMADP_3_CLIMATE-CHANGE-GREENLAND-1024x683.jpg,2026-03-28T19:26:35Z,,"WASHINGTON (AP) Vital Arctic sea ice shrank to tie its lowest measured level for the winter, the season when ice grows, as a warming Earth shattered records across the continents.
WATCH: Ice sheets … [+4379 chars]",,en,record heat,Heat Wave,random,,,
https://theconversation.com/what-caused-the-blood-red-skies-in-western-australia-a-weather-expert-explains-279557,https://theconversation.com/what-caused-the-blood-red-skies-in-western-australia-a-weather-expert-explains-279557,0,theconversation.com,What caused the blood red skies in Western Australia? A weather expert explains,The northwest of Australia is one of only a few places in the world that experience tropical cyclones in the desert.,https://images.theconversation.com/files/727254/original/file-20260331-57-5b4hsu.jpg?ixlib=rb-4.1.0&rect=0%2C0%2C4000%2C2000&q=45&auto=format&w=1356&h=668&fit=crop,2026-03-31T03:24:32Z,,The apocalyptic red skies in Western Australia have generated considerable international media attention. Crimson dust whipped up by the strong outer winds of Severe Tropical Cyclone Narelle created … [+5031 chars],,en,cyclone Australia,Tropical Cyclone,aidr,Australia,EAU,Oceania
https://www.insurancejournal.com/news/international/2026/03/31/864043.htm,https://www.insurancejournal.com/news/international/2026/03/31/864043.htm,0,www.insurancejournal.com,Arctic Sea Ice Hits Lowest Winter Level as Unprecedented Heat Smashes Global Records,"Vital Arctic sea ice shrank to tie its lowest measured level for the winter, the season when ice grows, as a warming Earth shattered records across the continents. Arctic sea ice levels, especially in the summer, are crucial to Earth’s …",https://www.insurancejournal.com/app/uploads/2026/03/pieces-of-ice-near-nuuk-greenland-AP-scaled.jpg,2026-03-31T13:14:11Z,,"Vital Arctic sea ice shrank to tie its lowest measured level for the winter, the season when ice grows, as a warming Earth shattered records across the continents.
Arctic sea ice levels, especially … [+4448 chars]",,en,record heat,Heat Wave,random,,,
