index,url,valid,domain,title,description,image,published,archive,content,quote,language,term,topic,feed,country,ipcc,continent
https://www.nzherald.co.nz/nz/ryan-bridge-reacts-as-tiktok-fans-swoon-over-viral-earthquake-broadcast/KMCJDRVHIJBH7BCMP2XK5FFV4Q/,https://www.nzherald.co.nz/nz/ryan-bridge-reacts-as-tiktok-fans-swoon-over-viral-earthquake-broadcast/KMCJDRVHIJBH7BCMP2XK5FFV4Q/,0,www.nzherald.co.nz,Ryan Bridge reacts as TikTok fans swoon over viral earthquake broadcast,"The clip of Ryan Bridge has drawn nearly 910,000 views on TikTok.",https://www.nzherald.co.nz/resizer/v2/YH4W55P4YRGINGSHZTDSBH2LRU.JPG?auth=72500de59136c4f1aaa8631cb9dee4a5995eb903c7e6876f52226333470aedae&width=1200&height=675&quality=70&focal=1456%2C540&smart=false,2025-10-01T07:00:00Z,,"New Zealand, youve been holding out on us, another said.
Another lamented, We dont have reporters like this in Canada.
The barrage of admiration came as a shock to Kiwis, who are used to seeing Bri… [+2022 chars]",,en,earthquake,Earthquake,random,,,
https://www.aljazeera.com/news/2025/10/1/deadly-earthquake-hits-philippines-what-we-know-so-far,https://www.aljazeera.com/news/2025/10/1/deadly-earthquake-hits-philippines-what-we-know-so-far,0,www.aljazeera.com,Deadly earthquake hits Philippines: What we know so far,Local authorities say nearly 70 people have been killed and hospitals in the Cebu province are overwhelmed.,https://www.aljazeera.com/wp-content/uploads/2025/10/AFP__20251001__77BP4FG__v2__HighRes__TopshotPhilippinesQuake-1759305174.jpg?resize=1920%2C1440,2025-10-01T09:43:11Z,,"A magnitude 6.9 earthquake hit the central Philippines late on Tuesday night, killing at least 69 people and injuring more than 140, according to local authorities.
Here is more about what happened … [+6941 chars]",,en,Earthquake Philippines,Earthquake,usgs,Philippines,SEA,Asia
https://www.tmz.com/2025/10/01/thomas-markle-not-trapped-earthquake-philippines/,https://www.tmz.com/2025/10/01/thomas-markle-not-trapped-earthquake-philippines/,0,www.tmz.com,"Thomas Markle Not Trapped After Philippines Earthquake, Despite Claims","Meghan Markle's dad, Thomas, wants to set the record straight after claims he was left helpless in the Philippines during this week's earthquake -- cause he tells TMZ he's safe and mobile. Thomas tells TMZ ... he's safe in his hotel room, and in no…",https://imagez.tmz.com/image/ce/16by9/2025/10/01/cedd313ba7404f418786ffc435ef04ce_xl.jpg,2025-10-01T18:00:37Z,,"Meghan Markle's dad, Thomas,wants to set the record straight after claims he was left helpless in the Philippines during this week's earthquake -- cause he tells TMZ he's safe and mobile.
Thomas tel… [+935 chars]",,en,Earthquake Philippines,Earthquake,usgs,Philippines,SEA,Asia
https://www.ibtimes.com/meghan-markles-dad-trapped-philippines-after-69-quake-half-sisters-post-sparks-concern-3785225,https://www.ibtimes.com/meghan-markles-dad-trapped-philippines-after-69-quake-half-sisters-post-sparks-concern-3785225,0,www.ibtimes.com,Is Meghan Markle's Dad Trapped In The Philippines After 6.9 Quake? Half-Sister's Post Sparks Concern,Meghan Markle's father Thomas Markle confirms he is safe in Cebu after daughter Samantha claimed he was trapped during deadly 6.9 earthquake in Philippines.,https://d.ibtimes.com/en/full/4625228/thomas-markle-meghan-markle.png,2025-10-02T10:43:05Z,,Confusion rippled across social media this week after claims suggested Meghan Markle's father had become trapped on the 19th floor of a building in the Philippines following a deadly 6.9 magnitude ea… [+3595 chars],,en,earthquake,Earthquake,random,,,
https://www.channelnewsasia.com/sport/australia-nzealand-shoot-rugby-championship-silverware-in-perth-finale-5381966,https://www.channelnewsasia.com/sport/australia-nzealand-shoot-rugby-championship-silverware-in-perth-finale-5381966,0,www.channelnewsasia.com,"Australia, N.Zealand shoot for Rugby Championship silverware in Perth finale","Australia and New Zealand meet again at a sold-out Perth Stadium on Saturday, a week after a bruising battle at Eden Park, hoping to lay claim to the Rugby Championship trophy, if only temporarily.The champagne will be on ice for the victors, though, with Sou…","https://dam.mediacorp.sg/image/upload/s--VP5fQiqM--/c_fill,g_auto,h_676,w_1200/fl_relative,g_south_east,l_mediacorp:cna:watermark:2024-04:reuters_1,w_0.1/f_auto,q_auto/v1/one-cms/core/2025-10-02T111239Z_1_LYNXNPEL910FK_RTROPTP_3_RUGBY-UNION-CHAMPIONSHIP-AUS-NZL.JPG?itok=kX6p13qR",2025-10-02T11:12:39Z,,"Australia and New Zealand meet again at a sold-out Perth Stadium on Saturday, a week after a bruising battle at Eden Park, hoping to lay claim to the Rugby Championship trophy, if only temporarily.
… [+3051 chars]",,en,Ice Australia,Snow&Ice,wmo,Australia,CAU,Oceania
https://www.celebitchy.com/943466/samantha_markle_calls_out_tmz_the_daily_mail_for_the_thomas_is_fine_stories/,https://www.celebitchy.com/943466/samantha_markle_calls_out_tmz_the_daily_mail_for_the_thomas_is_fine_stories/,0,www.celebitchy.com,Samantha Markle calls out TMZ & the Daily Mail for the ‘Thomas is fine’ stories,"This week, Samantha Markle popped up online to claim that her father, Thomas Markle, was stuck in a building in the Philippines following a massive earthquake in the country. Samantha put the blame squarely on the Duchess of Sussex’s shoulders, because clearl…",,2025-10-03T11:15:02Z,,"This week, Samantha Markle popped up online to claim that her father, Thomas Markle, was stuck in a building in the Philippines following a massive earthquake in the country. Samantha put the blame s… [+4805 chars]",,en,Earthquake Philippines,Earthquake,usgs,Philippines,SEA,Asia
https://biztoc.com/x/864a4832f9d7f0f4,https://biztoc.com/x/864a4832f9d7f0f4,0,biztoc.com,Inside the uranium plant at the center of U.S. plans to expand nuclear power,"EUNICE, NEW MEXICO — Paul Lorskulsint was a shift manager at a brand new uranium enrichment facility deep in the American Southwest when catastrophe struck Japan in 2011.
A massive tsunami and earthquake had caused a severe accident at the Fukushima Daiichi N…",https://biztoc.com/cdn/864a4832f9d7f0f4_s.webp,2025-10-04T12:53:51Z,,"EUNICE, NEW MEXICO Paul Lorskulsint was a shift manager at a brand new uranium enrichment facility deep in the American Southwest when catastrophe struck Japan in 2011.A massive tsunami and earthquak… [+140 chars]",,en,Earthquake Japan,Earthquake,usgs,Japan,EAS,Asia
https://oilprice.com/Energy/Energy-General/Copper-Markets-in-Crisis-After-a-Year-of-Disruptions.html,https://oilprice.com/Energy/Energy-General/Copper-Markets-in-Crisis-After-a-Year-of-Disruptions.html,0,oilprice.com,Copper Markets in Crisis After a Year of Disruptions,"The global copper market has had quite the year. On September 8, approximately 800,000 tons of wet material flooded multiple levels of the Grasberg Block Cave mine in Papua, Indonesia, leading to the suspension of all underground operations. It was just one m…",https://d32r1sh890xpii.cloudfront.net/article/718x300/2025-10-06_jcavtzgbsc.jpg,2025-10-06T18:00:00Z,,"Russias government plans to boost…
Crude oil futures posted their…
Ukraine battles relentless Russian strikes…
By Metal Miner - Oct 06, 2025, 1:00 PM CDTThe global copper market has had quite the … [+4503 chars]",,en,Flood Indonesia,Flood,cmeter,Indonesia,SEA,Asia
