index,url,valid,domain,title,description,image,published,archive,content,quote,language,term,topic,feed,country,ipcc,continent
https://www.nzherald.co.nz/nz/ryan-bridge-reacts-as-tiktok-fans-swoon-over-viral-earthquake-broadcast/KMCJDRVHIJBH7BCMP2XK5FFV4Q/,https://www.nzherald.co.nz/nz/ryan-bridge-reacts-as-tiktok-fans-swoon-over-viral-earthquake-broadcast/KMCJDRVHIJBH7BCMP2XK5FFV4Q/,0,www.nzherald.co.nz,Ryan Bridge reacts as TikTok fans swoon over viral earthquake broadcast,"The clip of Ryan Bridge has drawn nearly 910,000 views on TikTok.",https://www.nzherald.co.nz/resizer/v2/YH4W55P4YRGINGSHZTDSBH2LRU.JPG?auth=72500de59136c4f1aaa8631cb9dee4a5995eb903c7e6876f52226333470aedae&width=1200&height=675&quality=70&focal=1456%2C540&smart=false,2025-10-01T07:00:00Z,,"New Zealand, youve been holding out on us, another said.
Another lamented, We dont have reporters like this in Canada.
The barrage of admiration came as a shock to Kiwis, who are used to seeing Bri… [+2022 chars]",,en,earthquake,Earthquake,random,,,
https://www.aljazeera.com/news/2025/10/1/deadly-earthquake-hits-philippines-what-we-know-so-far,https://www.aljazeera.com/news/2025/10/1/deadly-earthquake-hits-philippines-what-we-know-so-far,0,www.aljazeera.com,Deadly earthquake hits Philippines: What we know so far,Local authorities say nearly 70 people have been killed and hospitals in the Cebu province are overwhelmed.,https://www.aljazeera.com/wp-content/uploads/2025/10/AFP__20251001__77BP4FG__v2__HighRes__TopshotPhilippinesQuake-1759305174.jpg?resize=1920%2C1440,2025-10-01T09:43:11Z,,"A magnitude 6.9 earthquake hit the central Philippines late on Tuesday night, killing at least 69 people and injuring more than 140, according to local authorities.
Here is more about what happened … [+6941 chars]",,en,Earthquake Philippines,Earthquake,usgs,Philippines,SEA,Asia
