index,url,valid,domain,title,description,image,published,archive,content,quote,language,term,topic,feed,country,ipcc,continent
https://www.rollingstone.com/politics/political-commentary/michael-mann-book-excerpt-our-fragile-moment-1234848619/,https://www.rollingstone.com/politics/political-commentary/michael-mann-book-excerpt-our-fragile-moment-1234848619/,0,www.rollingstone.com,"Extreme Heat, Palm Trees and Crocodiles in Wyoming and the Craziest Climate Crisis Theory of Them All",In an excerpt from his new book 'Our Fragile Moment' renowned climate scientist Michael Mann explains the dangers of our rapidly warming future by looking into the lesson of our planet's past,https://www.rollingstone.com/wp-content/uploads/2023/10/extreme-heat-excerpt.jpg?w=1600&h=900&crop=1,2023-10-08T14:00:00Z,,"After having witnessed the warmest summer on record, many are understandably wondering just how hot it could get? Perhaps there are some clues in Earth’s past. If we’re looking for a paleo-analog for… [+24663 chars]",,en,heat,Heat Wave,random,,,
https://www.abc.net.au/news/2023-10-09/australia-severe-weather-outlook-2023/102950616,https://www.abc.net.au/news/2023-10-09/australia-severe-weather-outlook-2023/102950616,0,www.abc.net.au,What's in store for the severe-weather season?,"The Bureau of Meteorology has just released its outlook for the coming season, detailing the risk of tropical cyclones, floods, heatwaves, fires and storms.",https://live-production.wcms.abc-cdn.net.au/8f307b8bf03273c30e4907cf45d4bb70?impolicy=wcms_crop_resize&cropH=1400&cropW=2486&xPos=14&yPos=235&width=862&height=485,2023-10-09T03:54:14Z,,"It's been a summer of extremes across the northern hemisphere now the Bureau of Meteorology has released its severe-weather outlook, flagging an increased risk of heatwaves and bushfires, but fewer c… [+3934 chars]",,en,heat,Heat Wave,random,,,
https://www.bbc.co.uk/sport/africa/67016173,https://www.bbc.co.uk/sport/africa/67016173,0,www.bbc.co.uk,Victor Osimhen: Super Eagle flies high and nets again but Napoli defeated by Fiorentina,Nigeria's Victor Osimhen scores again for Napoli in Serie A as the Super Eagle continues to fly high despite rumbling Tiktok storm.,https://ichef.bbci.co.uk/live-experience/cps/624/cpsprodpb/0702/production/_131349710_gettyimages-1707575163.jpg,2023-10-09T12:12:50Z,,"Victor Osimhen scored 31 goals in helping Napoli to the Serie A title last season
Nigeria striker Victor Osimhen was on the score sheet again for Napoli on Sunday but the Serie A champion's title de… [+4844 chars]",,en,storm,Storm,random,,,
https://thepointsguy.com/guide/how-to-prevent-bedbugs-when-traveling/,https://thepointsguy.com/guide/how-to-prevent-bedbugs-when-traveling/,0,thepointsguy.com,How to prevent bedbugs when traveling,"French officials are attempting to quell Paris‘ bedbug problem ahead of the 2024 Paris Olympics after footage claiming the appearance of bedbugs across France — in Airbnbs, on public transportation and at movie theaters — has gone viral on social media. It’s …",https://thepointsguy.global.ssl.fastly.net/us/originals/2023/10/GettyImages-1556778298.jpg,2023-10-09T12:30:53Z,,"French officials are attempting to quell Paris' bedbug problem ahead of the 2024 Paris Olympics after footage claiming the appearance of bedbugs across France in Airbnbs, on public transportation and… [+9618 chars]",,en,heat,Heat Wave,random,,,
https://phys.org/news/2023-10-climate-driven-extreme-earth-hot-humans.html,https://phys.org/news/2023-10-climate-driven-extreme-earth-hot-humans.html,0,phys.org,Climate-driven extreme heat may make parts of Earth too hot for humans,"If global temperatures increase by 1° Celsius (C) or more than current levels, each year billions of people will be exposed to heat and humidity so extreme they will be unable to naturally cool themselves, according to interdisciplinary research from the Penn…",https://scx2.b-cdn.net/gfx/news/hires/2023/climate-driven-extreme.jpg,2023-10-09T19:00:01Z,,"If global temperatures increase by 1° Celsius (C) or more than current levels, each year billions of people will be exposed to heat and humidity so extreme they will be unable to naturally cool thems… [+10432 chars]",,en,heat,Heat Wave,random,,,
https://www.americanthinker.com/blog/2023/10/climate_experts_assure_us_they_werent_wrong_it_was_just_a_miracle_year.html,https://www.americanthinker.com/blog/2023/10/climate_experts_assure_us_they_werent_wrong_it_was_just_a_miracle_year.html,0,www.americanthinker.com,"Climate ‘experts’ assure us they weren’t wrong, it was just a ‘miracle’ year","Before the record wet winter which saw torrential downpour and floods, the “experts” were predicting a continuous dangerous drought—but the inaccuracy wasn’t because they were wrong, it was simply a miracle! From a Los Angeles...",https://www.americanthinker.com/images/bucket/2023-10/249377.jpg,2023-10-10T05:00:00Z,,"Before the record wet winter which saw torrential downpour and floods, the “experts” were predicting a continuous dangerous drought—but the inaccuracy wasn’t because they were wrong, it was simply a … [+3397 chars]",,en,drought,Drought,random,,,
https://www.moneycontrol.com/news/world/one-bond-market-is-defying-the-global-selloff-with-record-returns-11508261.html,https://www.moneycontrol.com/news/world/one-bond-market-is-defying-the-global-selloff-with-record-returns-11508261.html,0,www.moneycontrol.com,One bond market is defying the global selloff with record returns,Investors in the $40 billion market for so-called cat bonds have literally been sitting out the storm to reap returns as high as 16% this year.,https://images.moneycontrol.com/static-mcnews/2023/10/Bond-market-770x433.jpg,2023-10-10T07:57:58Z,,"As bond markets everywhere get battered by a cocktail of higher interest rates, deficit angst and hawkish central bankers, one class of debt instrument is handing creditors double-digit returns: cata… [+5440 chars]",,en,Storm ,Storm,wmo,Argentina,SES,South-America
https://www.marketscreener.com/quote/stock/NICKEL-28-CAPITAL-CORP-76576846/news/Ramu-Pauses-Operations-Following-Earthquake-in-Madang-Province-45027953/,https://www.marketscreener.com/quote/stock/NICKEL-28-CAPITAL-CORP-76576846/news/Ramu-Pauses-Operations-Following-Earthquake-in-Madang-Province-45027953/,0,www.marketscreener.com,Ramu Pauses Operations Following Earthquake in Madang Province,"(marketscreener.com) 
Nickel 28 Capital Corp. announces that on October 7, 2023 at approximately 18:34 local time an earthquake of magnitude 6.7 struck Papua New Guinea with the epicenter approximately 5 km to the south of Ramu Mine’s Basumuk HPAL plant . Imm…",https://www.marketscreener.com/images/twitter_MS_fdnoir.png,2023-10-10T11:04:01Z,,"Nickel 28 Capital Corp. (Nickel 28 or the Company) (TSXV: NKL) (FSE: 3JC0) announces that on October 7, 2023 at approximately 18:34 local time an earthquake of magnitude 6.7 struck Papua New Guinea (… [+3654 chars]",,en,Earthquake Papua New Guinea,Earthquake,usgs,Papua New Guinea,EPO,Pacific Ocean
https://www.dw.com/en/extreme-weather-is-climate-change-always-to-blame/a-66881959,https://www.dw.com/en/extreme-weather-is-climate-change-always-to-blame/a-66881959,0,www.dw.com,Extreme weather: Is climate change always to blame?,"As extreme heatwaves, storms and wildfires increase in severity and frequency, weather attribution studies can determine whether they are linked to human-caused climate change. It's complicated. From prolonged periods of extreme heat in South America, coast-t…",https://static.dw.com/image/67050826_6.jpg,2023-10-10T15:04:00Z,,"From prolonged periods of extreme heat in South America, coast-to-coast Canadian wildfires and biblical flooding in Libya, catastrophic  weather events have dominated global headlines over recent mon… [+7526 chars]",,en,storm,Storm,random,,,
https://www.smithsonianmag.com/smart-news/at-least-125-river-dolphins-have-died-amid-drought-and-heat-in-brazilian-amazon-180983036/,https://www.smithsonianmag.com/smart-news/at-least-125-river-dolphins-have-died-amid-drought-and-heat-in-brazilian-amazon-180983036/,0,www.smithsonianmag.com,At Least 125 River Dolphins Have Died Amid Drought and Heat in Brazilian Amazon,"Though the pink animals' cause of death is not confirmed, temperatures in the remote Lake Tefé reached 102 degrees Fahrenheit in late September",https://th-thumbnailer.cdn-si-edu.com/5BEt2I9p0j-HPteA4rlIzxZ_wPs=/fit-in/1600x0/filters:focal(2784x1856:2785x1857)/https%3A%2F%2Ftf-cmsv2-smithsonianmag-media.s3.amazonaws.com%2Ffiler_public%2F2d%2F18%2F2d183180-e9ff-4736-99c9-f1725cfeac79%2Fbotos-encalhados-miguel-monteiro-15.jpg,2023-10-10T19:10:24Z,,"Researchers are still trying to confirm the cause of death, but they suspect the high water temperatures are to blame.
 Miguel Monteiro / Mamirauá Institute
At least 125 river dolphins have died in… [+4376 chars]",,en,drought,Drought,random,,,
https://www.abc.net.au/news/2023-10-11/woodgate-beach-erosion-prompts-flooding-fears/102952944,https://www.abc.net.au/news/2023-10-11/woodgate-beach-erosion-prompts-flooding-fears/102952944,0,www.abc.net.au,Coastal houses at risk of flooding as town's foreshore 'one big storm' away from collapsing,Approvals to fix a dangerously eroded Queensland beach drag out as residents fear their slice of paradise is slipping away into the ocean.,https://live-production.wcms.abc-cdn.net.au/d6223681e676ae0fbca56eeadcc64406?impolicy=wcms_crop_resize&cropH=2268&cropW=4032&xPos=0&yPos=611&width=862&height=485,2023-10-10T19:35:26Z,,"Woodgate Beach is a time capsule of years gone by where there are no high-rises, only modest holiday homes, a fish and chip shop and a general store. 
Key points:
<ul><li>The council says erosion h… [+4944 chars]",,en,coastal flooding,Storm Surge,random,,,
https://phys.org/news/2023-10-rainwater-cities-feet.html,https://phys.org/news/2023-10-rainwater-cities-feet.html,0,phys.org,Rainwater in cities causes more troubles than wet feet,Researchers are looking at how to tackle pollutants in urban runoff and overflowing sewers.,https://scx2.b-cdn.net/gfx/news/hires/2023/rainwater-in-cities-ca.jpg,2023-10-10T20:18:05Z,,"Researchers are looking at how to tackle pollutants in urban runoff and overflowing sewers.
Near the medieval Belgian city of Ghent, in the municipality of Wetteren, researchers are trying to reduce… [+6386 chars]",,en,Rain ,Precipitation,wmo,Argentina,SES,South-America
https://www.voanews.com/a/malawi-begins-free-food-distribution-to-hunger-stricken-citizens/7305170.html,https://www.voanews.com/a/malawi-begins-free-food-distribution-to-hunger-stricken-citizens/7305170.html,0,www.voanews.com,Malawi Begins Free Food Distribution to Hunger-Stricken Citizens,"Malawi has started distributing free corn and cash to more than 4 million people facing food shortages largely because of the impact of Cyclone Freddy, which washed away thousands of hectares of crops in March. The move is in response to a recent report that …",https://gdb.voanews.com/01000000-c0a8-0242-93f4-08dbc9cd2bf5_cx0_cy6_cw0_w1200_r1.jpg,2023-10-10T20:37:33Z,,"Blantyre  Malawi has started distributing free corn and cash to more than 4 million people facing food shortages largely because of the impact of Cyclone Freddy, which washed away thousands of hectar… [+2464 chars]",,en,cyclone,Tropical Cyclone,random,,,
https://economictimes.indiatimes.com/news/international/world-news/magnitude-6-3-earthquake-hits-western-afghanistan-usgs/articleshow/104328263.cms,https://economictimes.indiatimes.com/news/international/world-news/magnitude-6-3-earthquake-hits-western-afghanistan-usgs/articleshow/104328263.cms,0,economictimes.indiatimes.com,Magnitude 6.3 earthquake hits western Afghanistan: USGS,"The quake occurred at a shallow depth at around 05:10 am local time (00:40 GMT), with its epicentre about 29 kilometres north of the city of Herat, the United States Geological Survey said.","https://img.etimg.com/thumb/msid-104328282,width-1200,height-630,imgsize-21778,overlay-economictimes/photo.jpg",2023-10-11T02:12:57Z,,"A magnitude 6.3 earthquake struck western Afghanistan on Wednesday, hitting an area where more than 2,000 people were killed after a series of similar tremors on the weekend.The quake occurred at a s… [+2375 chars]",,en,Earthquake United States,Earthquake,usgs,United States,WNA,North-America
https://www.aljazeera.com/news/2023/10/11/extremely-dangerous-hurricane-lidia-crashes-into-mexicos-pacific-coast,https://www.aljazeera.com/news/2023/10/11/extremely-dangerous-hurricane-lidia-crashes-into-mexicos-pacific-coast,0,www.aljazeera.com,‘Extremely dangerous’ Hurricane Lidia crashes into Mexico’s Pacific coast,Lidia made landfall near the popular beach resort of Puerto Vallarta amid warnings of floods and a storm surge.,https://www.aljazeera.com/wp-content/uploads/2023/10/2023-10-10T211426Z_1839990018_RC2XP3A697RG_RTRMADP_3_STORM-LIDIA-1696996581.jpg?resize=1920%2C1440,2023-10-11T04:26:45Z,,"Hurricane Lidia has crashed into Mexicos Pacific coast as an extremely dangerous Category 4 storm, killing at least one person as residents sought shelter from torrential rain and powerful winds.
Li… [+2865 chars]",,en,storm surge,Storm Surge,random,,,
https://www.globalsecurity.org/military/library/news/2023/10/mil-231010-voa14.htm,https://www.globalsecurity.org/military/library/news/2023/10/mil-231010-voa14.htm,0,www.globalsecurity.org,Malawi Begins Free Food Distribution to Hunger-Stricken Citizens,"Malawi has started distributing free corn and cash to more than 4 million people facing food shortages largely because of the impact of Cyclone Freddy, which washed away thousands of hectares of crops in March. The move is in response to a recent report that …",,2023-10-11T09:16:12Z,,"By Lameck Masina October 10, 2023
Malawi has started distributing free corn and cash to more than 4 million people facing food shortages largely because of the impact of Cyclone Freddy, which washed… [+2606 chars]",,en,Cyclone Malawi,Tropical Cyclone,relief,Malawi,ESAF,Africa
https://biztoc.com/x/56783cd5611edcb9,https://biztoc.com/x/56783cd5611edcb9,0,biztoc.com,Immediate aid and sustainable solutions: how the Red Cross is bringing relief to drought-stricken Kenya,"In the Horn of Africa, drought, global price rises, conflict and the extreme weather brought on by the climate crisis have converged to create an almost unprecedented situation. According to the UN, the current drought in the region has already killed an esti…",https://c.biztoc.com/p/56783cd5611edcb9/s.webp,2023-10-11T14:40:06Z,,"In the Horn of Africa, drought, global price rises, conflict and the extreme weather brought on by the climate crisis have converged to create an almost unprecedented situation. According to the UN, … [+304 chars]",,en,drought,Drought,random,,,
https://www.archaeology.org/news/11825-231011-amazon-lidar-earthworks,https://www.archaeology.org/news/11825-231011-amazon-lidar-earthworks,0,www.archaeology.org,Lidar Detects Earthworks in the Amazon,"SÃO JOSÉ DOS CAMPOS, BRAZIL—Science reports that a new survey of lidar data suggests that thousands of sites containing evidence of human activity lie undiscovered in the Amazon rain forest. Researchers led by Vinicius Peripato, a remote sensing scientist at …",,2023-10-11T18:35:53Z,,"Lidar Detects Earthworks in the Amazon
Wednesday, October 11, 2023
SÃO JOSÉ DOS CAMPOS, BRAZILScience reports that a new survey of lidar data suggests that thousands of sites containing evidence of… [+821 chars]",,en,Rain ,Precipitation,wmo,Argentina,SES,South-America
https://www.nzherald.co.nz/nz/niwa-outlook-what-is-nzs-risk-of-tropical-cyclones-this-season/W24OSDX5YVE7DD3XQWQYO4VSOI/,https://www.nzherald.co.nz/nz/niwa-outlook-what-is-nzs-risk-of-tropical-cyclones-this-season/W24OSDX5YVE7DD3XQWQYO4VSOI/,0,www.nzherald.co.nz,Niwa outlook: What is NZ’s risk of tropical cyclones this season?,Last cyclone season brought NZ's costliest storm. What does the next one hold for us?,https://www.nzherald.co.nz/resizer/LLfS8shU5fVMnCyYuUH8RTt-L3U=/1200x675/smart/filters:quality(70)/cloudfront-ap-southeast-2.images.arcpublishing.com/nzme/RTSDCOUA2FHDBIZIZD34CR4RWI.jpg,2023-10-11T23:35:47Z,,"Niwas just-issued outlook for 2023-24 picks a normal-to-reduced risk for New Zealands neighbourhood, which typically receives at least one unwelcome visit from a cyclone system each November-to-April… [+5714 chars]",,en,Storm ,Storm,wmo,Argentina,SES,South-America
https://www.thestar.com.my/news/nation/2023/10/12/threats-to-national-food-security-likely-as-el-nino-returns-say-experts,https://www.thestar.com.my/news/nation/2023/10/12/threats-to-national-food-security-likely-as-el-nino-returns-say-experts,0,www.thestar.com.my,"Threats to national food security likely as El Nino returns, say experts","KUALA LUMPUR: El Nino, a naturally occurring climate pattern, is back after seven years, with experts warning that it may bring extreme weather from droughts to floods and record-breaking temperatures. Read full story",https://apicms.thestar.com.my/uploads/images/2023/10/12/2331632.jpeg,2023-10-12T03:17:00Z,,"KUALA LUMPUR: El Nino, a naturally occurring climate pattern, is back after seven years, with experts warning that it may bring extreme weather from droughts to floods and record-breaking temperature… [+12301 chars]",,en,drought,Drought,random,,,
https://www.globenewswire.com/news-release/2023/10/12/2758929/0/en/Enefit-Green-production-data-September-and-Q3-2023.html,https://www.globenewswire.com/news-release/2023/10/12/2758929/0/en/Enefit-Green-production-data-September-and-Q3-2023.html,0,www.globenewswire.com,Enefit Green production data – September and Q3 2023,"Enefit Green produced 94.7 GWh of electricity in September, which is 67.9% more than in the same period last year.      September’s production result...",https://ml-eu.globenewswire.com/Resource/Download/a7c2edda-51b4-4851-b968-261249123dc1,2023-10-12T06:00:00Z,,"Enefit Green produced 94.7 GWh of electricity in September, which is 67.9% more than in the same period last year.
Septembers production result was most affected by the 54.6% increase in wind energy… [+6065 chars]",,en,M 4.7,Earthquake,usgs,,NPO,Pacific Ocean
https://allafrica.com/stories/202310120126.html,https://allafrica.com/stories/202310120126.html,0,allafrica.com,Malawi Begins Free Food Distribution to Hunger-Stricken Citizens,"[VOA] Blantyre -- Malawi has started distributing free corn and cash to more than 4 million people facing food shortages largely because of the impact of Cyclone Freddy, which washed away thousands of hectares of crops in March. The move is in response to a r…",https://cdn08.allafrica.com/static/images/structure/aa-logo-rgba-no-text-square.png,2023-10-12T07:46:16Z,,"Blantyre — Malawi has started distributing free corn and cash to more than 4 million people facing food shortages largely because of the impact of Cyclone Freddy, which washed away thousands of hecta… [+2850 chars]",,en,Cyclone Malawi,Tropical Cyclone,relief,Malawi,ESAF,Africa
https://www.dw.com/en/tackling-the-global-water-crisis-as-the-climate-breaks-down/a-67068235,https://www.dw.com/en/tackling-the-global-water-crisis-as-the-climate-breaks-down/a-67068235,0,www.dw.com,Tackling the global water crisis as the climate breaks down,"Climate change is having disparate effects on global water cycles, with floods in some regions and droughts in others. Besides phasing out fossil fuels, responding to this requires improved cooperation on water data.",https://static.dw.com/image/67069218_6.jpg,2023-10-12T08:06:00Z,,"Water security for millions of people is at risk as climate change and human activities throw hydrological cycles into chaos, according to a new report from the World Meteorological Organization publ… [+5952 chars]",,en,drought,Drought,random,,,
https://www.cnn.com/2023/10/12/weather/us-storm-severe-weekend-weather-climate/index.html,https://www.cnn.com/2023/10/12/weather/us-storm-severe-weekend-weather-climate/index.html,0,www.cnn.com,"Powerful cross-country storm to deliver snow, severe weather and heavy rain","A powerful storm will traverse nearly 1,500 miles of the US through the weekend and unload snow, severe thunderstorms and flooding rain along its path, culminating in the eighth consecutive dreary weekend in parts of the Northeast.","https://media.cnn.com/api/v1/images/stellar/prod/231012111435-storm-snapshot-thursday-sunday-central-northeast-101223.jpg?c=16x9&q=w_800,c_fill",2023-10-12T17:08:58Z,,"A powerful storm will traverse nearly 1,500 miles of the US through the weekend and unload snow, severe thunderstorms and flooding rain along its path, culminating in the eighth consecutive dreary we… [+2802 chars]",,en,flooding,Flood,random,,,
https://www.independent.ie/sport/rugby/rugby-world-cup/new-zealand-axe-star-wing-mark-telea-as-team-named-for-rugby-world-cup-quarter-final-clash-with-ireland/a1017507619.html,https://www.independent.ie/sport/rugby/rugby-world-cup/new-zealand-axe-star-wing-mark-telea-as-team-named-for-rugby-world-cup-quarter-final-clash-with-ireland/a1017507619.html,0,www.independent.ie,New Zealand axe star wing Mark Telea as team named for Rugby World Cup quarter-final clash with Ireland,New Zealand have been engulfed in a disciplinary storm on the eve of their Rugby World Cup quarter-final against Ireland after coach Ian Foster revealed he'd dropped star winger Mark Telea for disciplinary reasons.,https://focus.independent.ie/thumbor/x-z62xlLp7J7AP-scE24frTIDLc=/0x72:2767x1914/2767x1842/prod-mh-ireland/281e7da2-036f-4dfa-81fc-d644c2ace87c/5a2291e5-2da9-4b9e-81b4-8c5eda306bc8/281e7da2-036f-4dfa-81fc-d644c2ace87c.jpg,2023-10-12T17:26:07Z,,"All Blacks in disciplinary storm as Telea dropped for protocol breach in favour of Leicester Fainga'anuku
New Zealand have been engulfed in a disciplinary storm on the eve of their Rugby World Cup q… [+2654 chars]",,en,Storm LeD,Storm,wmo,Norway,NEU,Europe
https://www.iphoneincanada.ca/2023/10/12/google-ai-efforts-to-tackle-climate-change/,https://www.iphoneincanada.ca/2023/10/12/google-ai-efforts-to-tackle-climate-change/,0,www.iphoneincanada.ca,Google Spotlights its AI-Powered Efforts to Tackle Climate Change,"At its ""Sustainable with Google"" event, Google has highlighted how it is using AI to combat the growing threats of floods, wildfires, and extreme heat.
The post Google Spotlights its AI-Powered Efforts to Tackle Climate Change first appeared on iPhone in Cana…",https://cdn.iphoneincanada.ca/wp-content/uploads/2017/09/iic-logo-1.svg,2023-10-12T18:09:37Z,,"At its “Sustainable with Google” event, Google has highlighted how it is using artificial intelligence (AI) to combat the growing threats of floods, wildfires, and extreme heat.
Climate change is al… [+2459 chars]",,en,heat,Heat Wave,random,,,
https://biztoc.com/x/60a6869ad9a0e5fe,https://biztoc.com/x/60a6869ad9a0e5fe,0,biztoc.com,"IMF and World Bank are urged to boost funding for African nations facing conflict, climate change","Many poor countries in Africa face the harshest effects of climate change: severe droughts, vicious heat and dry land, but also unpredictable rain and devastating flooding. The shocks worsen conflict and upend livelihoods because many people are farmers — wor…",https://c.biztoc.com/p/60a6869ad9a0e5fe/s.webp,2023-10-12T19:52:07Z,,"Many poor countries in Africa face the harshest effects of climate change: severe droughts, vicious heat and dry land, but also unpredictable rain and devastating flooding. The shocks worsen conflict… [+277 chars]",,en,flooding,Flood,random,,,
https://www.voanews.com/a/wildfire-smoke-taints-air-for-millions-in-brazil-/7309053.html,https://www.voanews.com/a/wildfire-smoke-taints-air-for-millions-in-brazil-/7309053.html,0,www.voanews.com,Wildfire Smoke Taints Air for Millions in Brazil,"Thick smoke has enveloped extensive areas of the Brazilian Amazon on Thursday as the region grapples with a surge in wildfires and a historic drought.


In Manaus, a city of 2 million, air quality ranked among the worst globally, leading to the suspension of …",https://gdb.voanews.com/01000000-0aff-0242-9c94-08dbcb95b496_cx0_cy8_cw0_w1200_r1.jpg,2023-10-13T02:40:59Z,,"BRASILIA, Brazil  Thick smoke has enveloped extensive areas of the Brazilian Amazon on Thursday as the region grapples with a surge in wildfires and a historic drought.
In Manaus, a city of 2 millio… [+2078 chars]",,en,Wildfire Brazil,Wildfire,esawfa,Brazil,SAM,South-America
https://www.marketscreener.com/quote/future/CORN-FUTURE-ZC-CBE-C1-16213/news/Brazil-shipping-agents-warn-clients-drought-disrupting-corn-shipping-on-barges-45062691/,https://www.marketscreener.com/quote/future/CORN-FUTURE-ZC-CBE-C1-16213/news/Brazil-shipping-agents-warn-clients-drought-disrupting-corn-shipping-on-barges-45062691/,0,www.marketscreener.com,Brazil shipping agents warn clients drought disrupting corn shipping on barges,"(marketscreener.com) A severe drought is disrupting barge traffic on the Tapajos river in the Amazon rainforest, shipping agencies told clients this week as Brazil enters the final months of 2023's corn export season.https://www.marketscreener.com/quote/futur…",https://www.marketscreener.com/images/reuters/2017-02-06T041324Z_1_LYNXMPED1508H_RTROPTP_2_CHINA-CORN-STOCKPILE.JPG,2023-10-13T19:07:27Z,,"SAO PAULO (Reuters) - A severe drought is disrupting barge traffic on the Tapajos river in the Amazon rainforest, shipping agencies told clients this week as Brazil enters the final months of 2023's … [+2105 chars]",,en,Drought Brazil,Drought,wmo,Brazil,SAM,South-America
