index,url,valid,domain,title,description,image,published,archive,content,quote,language,term,topic,feed,country,ipcc,continent
https://www.startribune.com/kremlin-critics-say-russia-is-targeting-its-foes-abroad-with-killings-poisonings-and-harassment/600363435/,https://www.startribune.com/kremlin-critics-say-russia-is-targeting-its-foes-abroad-with-killings-poisonings-and-harassment/600363435/,0,www.startribune.com,"Kremlin critics say Russia is targeting its foes abroad with killings, poisonings and harassment",The military defector was killed in a hail of gunfire and then run over by a car in Spain. The opposition figure was struck repeatedly with a hammer in Lithuania. The journalist fell ill from a suspected poisoning in Germany.,https://www.startribune.com/static/img/branding/logos/strib-social-card.png?d=1714669916,2024-05-03T04:05:05Z,,The military defector was killed in a hail of gunfire and then run over by a car in Spain. The opposition figure was struck repeatedly with a hammer in Lithuania. The journalist fell ill from a suspe… [+8282 chars],,en,hail,Thunderstorm,random,,,
https://www.counterpunch.org/2024/05/03/the-heats-on-big-time/,https://www.counterpunch.org/2024/05/03/the-heats-on-big-time/,0,www.counterpunch.org,The Heat’s On – Big Time!,"“Nearly nineteen thousand (19,000) weather stations have notched record high temperatures since Jan. 1.” (Source: Earth’s Record Hot Streak Might be a Sign of a New Climate Era, The Washington Post, April 19, 2024) A blistering start to the 2024 year is break…",https://www.counterpunch.org/wp-content/uploads/2024/05/matt-palmer-TmETG2KY59M-unsplash-scaled.jpg,2024-05-03T05:56:39Z,http://archive.md/20240506031859/https://www.counterpunch.org/2024/05/03/the-heats-on-big-time/,"Image by Matt Palmer.
Nearly nineteen thousand (19,000) weather stations have notched record high temperatures since Jan. 1. (Source: Earths Record Hot Streak Might be a Sign of a New Climate Era, T… [+9264 chars]",,en,record heat,Heat Wave,random,,,
https://punchng.com/kenya-floods-death-toll-tops-200-as-cyclone-approaches/,https://punchng.com/kenya-floods-death-toll-tops-200-as-cyclone-approaches/,0,punchng.com,Kenya floods death toll tops 200 as cyclone approaches,"The death toll from flood-related incidents in Kenya has crossed 200 since March, the interior ministry said Friday, as a cyclone barrelled towards the Tanzanian coast. Torrential rains have lashed much of East Africa, triggering flooding and landslides that …",https://cdn.punchng.com/wp-content/uploads/2024/05/03104249/flooood.jpg,2024-05-03T06:00:08Z,https://web.archive.org/web/20240503103439/https://punchng.com/kenya-floods-death-toll-tops-200-as-cyclone-approaches/,"The death toll from flood-related incidents in Kenya has crossed 200 since March, the interior ministry said Friday, as a cyclone barrelled towards the Tanzanian coast.
Torrential rains have lashed … [+1901 chars]",,en,Land Slide Tanzania,Landslide,relief,Tanzania,SEAF,Africa
 https://en.setopati.com/International/163009 , https://en.setopati.com/International/163009 ,0,en.setopati.com,"Kremlin critics say Russia targeting its foes abroad with killings, poisonings and harassment",The military defector was killed in a hail of gunfire and then run over by a car in Spain. The opposition figure was struck repeatedly with a hammer in Lithuania. The journalist fell ill from a suspected poisoning in Germany.,https://en.setopati.com/uploads/posts/Leonid-Volkov-1714726157.jpeg,2024-05-03T08:49:33Z,,The military defector was killed in a hail of gunfire and then run over by a car in Spain. The opposition figure was struck repeatedly with a hammer in Lithuania. The journalist fell ill from a suspe… [+8253 chars],,en,hail,Thunderstorm,random,,,
https://www.aljazeera.com/news/2024/5/3/kenya-tanzania-brace-for-cyclone-hidaya-amid-heavy-rain-and-floods,https://www.aljazeera.com/news/2024/5/3/kenya-tanzania-brace-for-cyclone-hidaya-amid-heavy-rain-and-floods,0,www.aljazeera.com,"Kenya, Tanzania brace for Cyclone Hidaya as flood death toll rises",Kenyan government orders mandatory evacuations for residents near 178 dams and water reservoirs in 33 counties.,https://www.aljazeera.com/wp-content/uploads/2024/05/AFP__20240430__34QK3MG__v2__HighRes__TopshotKenyaWeatherFloods-1714721586.jpg?resize=1920%2C1440,2024-05-03T09:01:23Z,,"Kenya and Tanzania have been bracing for a cyclone on the heels of torrential rains and floods that have devastated East Africa, killing nearly 400 people and forcing tens of thousands from their hom… [+4108 chars]",,en,Flood Tanzania,Flood,relief,Tanzania,SEAF,Africa
https://www.ibtimes.com/kenya-floods-death-toll-tops-200-cyclone-approaches-3731184,https://www.ibtimes.com/kenya-floods-death-toll-tops-200-cyclone-approaches-3731184,0,www.ibtimes.com,Kenya Floods Death Toll Tops 200 As Cyclone Approaches,"Torrential rains have lashed much of East Africa, triggering flooding and landslides that has destroyed crops, swallowed homes, and displaced hundreds of thousands of people.",https://d.ibtimes.com/en/full/4524460/torrential-rains-have-lashed-much-east-africa-triggering-flooding-landslides.jpg,2024-05-03T09:25:55Z,,"The death toll from flood-related incidents in Kenya has crossed 200 since March, the interior ministry said Friday, as a cyclone barreled towards the Tanzanian coast.
Torrential rains have lashed m… [+1893 chars]",,en,flooding,Flood,random,,,
https://phys.org/news/2024-05-kenya-death-toll-tops-cyclone.html,https://phys.org/news/2024-05-kenya-death-toll-tops-cyclone.html,0,phys.org,Kenya floods death toll tops 200 as cyclone approaches,"The death toll from flood-related incidents in Kenya has crossed 200 since March, the interior ministry said Friday, as a cyclone barrelled towards the Tanzanian coast.",https://scx2.b-cdn.net/gfx/news/2024/torrential-rains-have.jpg,2024-05-03T10:11:07Z,,"The death toll from flood-related incidents in Kenya has crossed 200 since March, the interior ministry said Friday, as a cyclone barrelled towards the Tanzanian coast.
Torrential rains have lashed … [+2305 chars]",,en,Flood Tanzania,Flood,relief,Tanzania,SEAF,Africa
https://www.digitaljournal.com/world/kenya-floods-death-toll-tops-200-as-cyclone-approaches-2/article,https://www.digitaljournal.com/world/kenya-floods-death-toll-tops-200-as-cyclone-approaches-2/article,0,www.digitaljournal.com,Kenya floods death toll tops 200 as cyclone approaches,"The death toll from flood-related incidents in Kenya has crossed 200 since March, the interior ministry said Friday, as a cyclone barrelled towards the Tanzanian coast. Torrential rains have lashed East Africa, triggering flooding and landslides that has dest…",https://www.digitaljournal.com/wp-content/uploads/2024/05/3767664cb5f032547c335ccbe8fde5affcad087e-1.jpg,2024-05-03T10:34:59Z,https://web.archive.org/web/20240503133904/https://www.digitaljournal.com/world/kenya-floods-death-toll-tops-200-as-cyclone-approaches-2/article,"Torrential rains have lashed much of East Africa, triggering flooding and landslides - Copyright AFP MIGUEL MEDINA
The death toll from flood-related incidents in Kenya has crossed 200 since March, t… [+3143 chars]",,en,Landslide Tanzania,Landslide,relief,Tanzania,SEAF,Africa
https://www.voanews.com/a/kenya-floods-death-toll-tops-200-as-cyclone-approaches/7596415.html,https://www.voanews.com/a/kenya-floods-death-toll-tops-200-as-cyclone-approaches/7596415.html,0,www.voanews.com,Kenya floods death toll tops 200 as cyclone approaches,"Nairobi, Kenya — The death toll from flood-related incidents in Kenya has crossed 200 since March, the interior ministry said Friday, as a cyclone barreled towards the Tanzanian coast.  


Torrential rains have lashed East Africa, triggering flooding and land…",https://gdb.voanews.com/01000000-0aff-0242-4ea7-08dc6b645e87_w1200_r1.jpg,2024-05-03T11:31:02Z,,"Nairobi, Kenya  The death toll from flood-related incidents in Kenya has crossed 200 since March, the interior ministry said Friday, as a cyclone barreled towards the Tanzanian coast. 
Torrential ra… [+3027 chars]",,en,Flood Tanzania,Flood,relief,Tanzania,SEAF,Africa
https://financialpost.com/pmn/business-pmn/drought-to-deluge-eastern-africa-bears-brunt-of-climate-change,https://financialpost.com/pmn/business-pmn/drought-to-deluge-eastern-africa-bears-brunt-of-climate-change,0,financialpost.com,Drought to Deluge: Eastern Africa Bears Brunt of Climate Change,"East Africa is bracing for more deadly floods, as torrential rain after years of biting drought deliver a brutal reminder of the threat posed by extreme weather brought about by climate change.",https://smartcdn.gprod.postmedia.digital/financialpost/wp-content/uploads/2024/05/776137770.jpg,2024-05-03T11:58:43Z,https://web.archive.org/web/20240503150426/https://financialpost.com/pmn/business-pmn/drought-to-deluge-eastern-africa-bears-brunt-of-climate-change,"East Africa is bracing for more floods, as torrential rain after years of drought deliver a reminder of the threat created by climate change.
Author of the article:
Residents cross floodwater in th… [+6938 chars]",,en,drought,Drought,random,,,
https://www.startribune.com/kenya-president-postpones-reopening-of-schools-as-flood-related-deaths-pass-200/600363493/,https://www.startribune.com/kenya-president-postpones-reopening-of-schools-as-flood-related-deaths-pass-200/600363493/,0,www.startribune.com,Kenya president postpones reopening of schools as flood-related deaths pass 200,"Kenyan President William Ruto has postponed next week's planned reopening of schools until further notice, as heavy rains and floods that have killed more than 200 people continue.",https://www.startribune.com/static/img/branding/logos/strib-social-card.png?d=1714669916,2024-05-03T12:30:10Z,https://web.archive.org/web/20240503125155/https://www.startribune.com/kenya-president-postpones-reopening-of-schools-as-flood-related-deaths-pass-200/600363493/,"NAIROBI, Kenya Kenyan President William Ruto has postponed next week's planned reopening of schools until further notice, as heavy rains and floods that have killed more than 200 people continue.
Th… [+1453 chars]",,en,Flood Kenya,Flood,relief,Kenya,SEAF,Africa
https://phys.org/news/2024-05-kenya-braces-cyclone.html,https://phys.org/news/2024-05-kenya-braces-cyclone.html,0,phys.org,Kenya on alert as it braces for first-ever cyclone,Kenyan President William Ruto put the flood-ravaged country on high alert on Friday and postponed the reopening of schools indefinitely as the nation braced for its first-ever cyclone.,https://scx2.b-cdn.net/gfx/news/2024/so-far-some-210-people.jpg,2024-05-03T13:40:01Z,https://web.archive.org/web/20240503134141/https://phys.org/news/2024-05-kenya-braces-cyclone.html,"Kenyan President William Ruto put the flood-ravaged country on high alert on Friday and postponed the reopening of schools indefinitely as the nation braced for its first-ever cyclone.
Torrential ra… [+4028 chars]",,en,Flood Kenya,Flood,relief,Kenya,SEAF,Africa
https://english.khabarhub.com/2024/03/353842/,https://english.khabarhub.com/2024/03/353842/,0,english.khabarhub.com,Kenya floods death toll tops 200 as cyclone approaches,"NAIROBI, KENYA: The death toll from flood-related incidents in Kenya has crossed 200 since March, the interior ministry said Friday, as a cyclone barreled towards the Tanzanian coast. Torrential rains have lashed East Africa, triggering flooding and landslide…",https://english.khabarhub.com/wp-content/uploads/2024/05/kenya-flood-.jpg,2024-05-03T13:45:44Z,https://web.archive.org/web/20240503134556/https://english.khabarhub.com/2024/03/353842/,"People gather on a bridge where a woman's body was retrieved, after floodwater washed away houses, in Kamuchiri Village Mai Mahiu, Nakuru County, Kenya, April 30, 2024/APNAIROBI, KENYA: The death tol… [+3182 chars]",,en,Land Slide Tanzania,Landslide,relief,Tanzania,SEAF,Africa
https://www.dw.com/en/managing-africas-natural-disasters-takes-on-urgency/a-68985169,https://www.dw.com/en/managing-africas-natural-disasters-takes-on-urgency/a-68985169,0,www.dw.com,Managing Africa's natural disasters takes on urgency,"Africa is particularly vulnerable to suffering natural disasters, such as floods, severe storms and droughts. These are not only crippling economies and people's livelihoods but also costing lives across the continent.",https://static.dw.com/image/68944929_6.jpg,2024-05-03T13:50:00Z,,"After the worst drought in decades, East Africa is now being pounded by heavy rains. At least 180 people have died in floods and landslides in Kenya since the rainy season began in mid-March, with hu… [+5619 chars]",,en,drought,Drought,random,,,
https://www.dw.com/en/kenya-cyclone-hidaya-threatens-flood-hit-region/a-68991443,https://www.dw.com/en/kenya-cyclone-hidaya-threatens-flood-hit-region/a-68991443,0,www.dw.com,Kenya: Cyclone Hidaya threatens flood-hit region,"More than 200 people have died in Kenya and thousands have been displaced due to heavy rains since March. With powerful Cyclone Hidaya expected to make landfall this weekend, more people may have to leave their homes. Flash floods and heavy rains in Kenya tha…",https://static.dw.com/image/68985800_6.jpg,2024-05-03T15:09:00Z,,"Flash floods and heavy rains in Kenya that began in the middle of March have killed more than 200 people, the country's Interior Ministry said on Friday.
It said 22 were killed in the last 24 hours.… [+1993 chars]",,en,Flood Kenya,Flood,relief,Kenya,SEAF,Africa
https://instapundit.com/645432/,https://instapundit.com/645432/,0,instapundit.com,"NO, SEVERE WEATHER IS NOT INCREASING: It’s not every day that a conservative think tank like Canada’","NO, SEVERE WEATHER IS NOT INCREASING: It’s not every day that a conservative think tank like Canada’s Fraser Institute and the National Geographic Society agree on a major issue in the climate change debate. Plus, have a look at my latest PJMedia column to le…",https://instapundit.com/wp-content/themes/instapundit/images/opengraph-default.png,2024-05-03T17:11:53Z,,"NO, SEVERE WEATHER IS NOT INCREASING: It’s not every day that a conservative think tank like Canada’s Fraser Institute and the National Geographic Society agree on a major issue in the climate change… [+139 chars]",,en,Severe Weather Canada,Thunderstorm,wmo,Canada,NEN,North-America
https://www.bbc.co.uk/news/world-africa-68953965,https://www.bbc.co.uk/news/world-africa-68953965,0,www.bbc.co.uk,Homes demolished after Kenya flood evacuation order,Residents of a slum say the destruction of their homes caught them by surprise and they have nowhere to stay.,https://ichef.bbci.co.uk/news/1024/branded_news/14EB6/production/_133268658_kenya5.jpg,2024-05-03T18:28:41Z,,"Twisted scraps of metal, large splinters of wood and misplaced mattresses are all that remains of what were once people's homes in Mukuru Wa Reuben slum in the Kenyan capital. 
Across the wider Nair… [+4480 chars]",,en,Flood Kenya,Flood,relief,Kenya,SEAF,Africa
https://www.cbc.ca/news/canada/calgary/calgary-alberta-avalanche-warnings-kananaskis-country-1.7193356,https://www.cbc.ca/news/canada/calgary/calgary-alberta-avalanche-warnings-kananaskis-country-1.7193356,0,www.cbc.ca,Recent snowfall and expected warm weather raise avalanche risk in Kananaskis Country,"Recent snowfall has raised the risk of avalanches in Kananaskis Country, according to Avalanche Canada.",https://i.cbc.ca/1.7193527.1714762490!/fileImage/httpImage/image.jpg_gen/derivatives/16x9_620/avalanche-k-country.jpg,2024-05-03T19:07:21Z,,"Snowfall over the past week has raised the risk of avalanches in Kananaskis Country, according to Avalanche Canada.
The agency rated the danger level in the recreation area west of Calgary as high, … [+1633 chars]",,en,snow avalanche,Snow&Ice,random,,,
https://japantoday.com/category/world/kenya-president-postpones-reopening-of-schools-as-flood-related-deaths-pass-200,https://japantoday.com/category/world/kenya-president-postpones-reopening-of-schools-as-flood-related-deaths-pass-200,0,japantoday.com,Kenya president postpones reopening of schools as flood-related deaths pass 200,"Kenyan President William Ruto has postponed next week’s planned reopening of schools until further notice, as heavy rains and floods that have killed more than 200 people continue. The president in his state of the nation address on Friday said that “meteorol…",,2024-05-03T21:56:09Z,https://web.archive.org/web/20240503225216/https://japantoday.com/category/world/kenya-president-postpones-reopening-of-schools-as-flood-related-deaths-pass-200,"Kenyan President William Ruto has postponed next weeks planned reopening of schools until further notice, as heavy rains and floods that have killed more than 200 people continue.
The president in h… [+1588 chars]",,en,Flood Kenya,Flood,relief,Kenya,SEAF,Africa
https://www.digitaljournal.com/world/dams-strain-as-water-death-toll-keep-rising-in-south-brazil/article,https://www.digitaljournal.com/world/dams-strain-as-water-death-toll-keep-rising-in-south-brazil/article,0,www.digitaljournal.com,"Dams strain as water, death toll keep rising in south Brazil","The death toll from floods and mudslides triggered by torrential storms in southern Brazil climbed to 39 on Friday, officials said, as they warned of worse to come. As the rain kept beating down, rescuers in boats and planes searched for scores of people repo…",https://www.digitaljournal.com/wp-content/uploads/2024/05/ae4e5a327f7a447a95f9e1a7c105f5e1429591b2.jpg,2024-05-04T03:04:58Z,,"More than 350,000 people have suffered some form of property damage, according to authorities - Copyright AFP Anselmo Cunha
The death toll from floods and mudslides triggered by torrential storms in… [+3630 chars]",,en,Storm Brazil,Storm,wmo,Brazil,SAM,South-America
https://www.abc.net.au/news/2024-05-04/rains-in-southern-brazil-kill-at-least-39-68-still-missing/103804944,https://www.abc.net.au/news/2024-05-04/rains-in-southern-brazil-kill-at-least-39-68-still-missing/103804944,0,www.abc.net.au,"Flooding in Brazil kills 39 people with 68 still missing and 24,000 displaced",The storms also triggered landslides and the partial collapse of a dam structure at a small hydro-electric power plant.,https://live-production.wcms.abc-cdn.net.au/1040e94862b2da24bc830139d2506e4a?impolicy=wcms_watermark_news&cropH=2763&cropW=4912&xPos=0&yPos=275&width=862&height=485&imformat=generic,2024-05-04T03:39:18Z,,"<ul><li>In short: Floods in Rio Grande do Sul have killed 39 people with 68 still missing and 24,000 displaced. </li><li>In several towns, streets turned into rivers, with roads and bridges destroyed… [+2397 chars]",,en,storm,Storm,random,,,
https://abcnews.go.com/International/wireStory/ap-photos-south-southeast-asian-countries-cope-weekslong-109923024,https://abcnews.go.com/International/wireStory/ap-photos-south-southeast-asian-countries-cope-weekslong-109923024,0,abcnews.go.com,AP PHOTOS: South and Southeast Asian countries cope with a weekslong heat wave,"South and Southeast Asian countries have been coping with a weekslong heat wave rendering record high temperatures that have posed a severe health risk.

Umbrellas to shield against blazing sunlight are popular, air-conditioned malls are serving as urban oase…",https://i.abcnewsfe.com/a/8a5c1ed2-1688-4349-8551-cfeb8d592e91/wirestory_5c992950ed0a41606419e472a961b26e_16x9.jpg?w=1600,2024-05-04T04:06:52Z,,"South and Southeast Asian countries have been coping with a weekslong heat wave rendering record high temperatures that have posed a severe health risk.
Umbrellas to shield against blazing sunlight … [+2181 chars]",,en,heat,Heat Wave,random,,,
https://nation.africa/africa/news/tanzania-urges-precaution-as-cyclone-hidaya-intensifies-4612276,https://nation.africa/africa/news/tanzania-urges-precaution-as-cyclone-hidaya-intensifies-4612276,0,nation.africa,Tanzania Meteorological Authority urges precaution as Cyclone Hidaya intensifies,"<p>The authority says the cyclone is expected to persist until May 6, 2024, and weaken thereafter.</p>",https://nation.africa/resource/image/4612274/landscape_ratio3x2/1200/800/d9655411ef6f20addda647fe4b88b228/EN/hidaya.jpg,2024-05-04T04:14:42Z,,"The Tanzania Meteorological Authority (TMA) on Thursday cautioned people living in the country's coastal region of strong winds and heavy rainfall associated with Cyclone 'Hidaya.
Cyclone Hidaya com… [+1458 chars]",,en,cyclone,Tropical Cyclone,random,,,
https://www.voanews.com/a/what-s-behind-the-catastrophic-rainfall-in-kenya-/7596159.html,https://www.voanews.com/a/what-s-behind-the-catastrophic-rainfall-in-kenya-/7596159.html,0,www.voanews.com,What's behind the catastrophic rainfall in Kenya,"NAIROBI, Kenya — The torrential rains and deadly floods that have hit Kenya since March have been some of the most catastrophic in the country in recent years.


At least 169 people have died due to the heavy rains, with at least 91 missing, according to the …",https://gdb.voanews.com/4C8971F1-4519-465C-AA7A-F8191B31938C.jpg,2024-05-04T07:00:00Z,,"NAIROBI, Kenya  The torrential rains and deadly floods that have hit Kenya since March have been some of the most catastrophic in the country in recent years.
At least 169 people have died due to th… [+3691 chars]",,en,Flood Kenya,Flood,relief,Kenya,SEAF,Africa
https://phys.org/news/2024-05-vietnam-temperature.html,https://phys.org/news/2024-05-vietnam-temperature.html,0,phys.org,Vietnam temperature records tumble as heat wave scorches,"More than 100 temperature records fell across Vietnam in April, according to official data, as a deadly heat wave scorches South and Southeast Asia.",https://scx2.b-cdn.net/gfx/news/2024/a-boat-sits-on-a-dried.jpg,2024-05-04T08:16:01Z,,"More than 100 temperature records fell across Vietnam in April, according to official data, as a deadly heat wave scorches South and Southeast Asia.
Extreme heat has blasted Asia from India to the P… [+2683 chars]",,en,heat,Heat Wave,random,,,
https://phys.org/news/2024-05-strain-death-toll-south-brazil.html,https://phys.org/news/2024-05-strain-death-toll-south-brazil.html,0,phys.org,"Dams strain as water, death toll keep rising in south Brazil","The death toll from floods and mudslides triggered by torrential storms in southern Brazil climbed to 39 on Friday, officials said, as they warned of worse to come.",https://scx2.b-cdn.net/gfx/news/2024/more-than-350000-peopl.jpg,2024-05-04T08:20:01Z,,"The death toll from floods and mudslides triggered by torrential storms in southern Brazil climbed to 39 on Friday, officials said, as they warned of worse to come.
As the rain kept beating down, re… [+3916 chars]",,en,Storm Brazil,Storm,wmo,Brazil,SAM,South-America
https://www.nbcnews.com/news/world/southern-brazil-worst-floods-80-years-people-died-rcna150697,https://www.nbcnews.com/news/world/southern-brazil-worst-floods-80-years-people-died-rcna150697,0,www.nbcnews.com,Southern Brazil has been hit by the worst floods in more than 80 years. At least 39 people have died,"Heavy rains in the southern Brazilian state of Rio Grande do Sul killed 39 people, with another 68 still missing, the state civil defense agency said Friday, as record-breaking floods devastated cities and forced thousands to leave their homes.","https://media-cldnry.s-nbcnews.com/image/upload/t_nbcnews-fp-1200-630,f_auto,q_auto:best/rockcms/2024-05/240504-brazil-flood-04-aa-80381a.jpg",2024-05-04T08:51:32Z,,"SAO PAULO Heavy rains in the southern Brazilian state of Rio Grande do Sul killed 39 people, with another 68 still missing, the state civil defense agency said Friday, as record-breaking floods devas… [+4168 chars]",,en,heavy rain,Precipitation,random,,,
https://financialpost.com/pmn/business-pmn/hong-kong-issues-2024s-first-red-storm-signal-amid-flooding,https://financialpost.com/pmn/business-pmn/hong-kong-issues-2024s-first-red-storm-signal-amid-flooding,0,financialpost.com,Hong Kong Issues 2024’s First Red Storm Signal Amid Flooding,"Hong Kong issued its first red rainstorm warning of the year on Saturday as downpours caused flooding in areas of the territory, shutting roads and disrupting public transportation.",https://smartcdn.gprod.postmedia.digital/financialpost/wp-content/uploads/2024/05/776026384.jpg,2024-05-04T10:46:29Z,https://web.archive.org/web/20240506023736/https://financialpost.com/pmn/business-pmn/hong-kong-issues-2024s-first-red-storm-signal-amid-flooding/,"Hong Kong issued its first red rainstorm warning of the year on Saturday as downpours caused flooding in areas of the territory, shutting roads and disrupting public transportation.
Author of the ar… [+7810 chars]",,en,rainstorm,Precipitation,random,,,
https://www.cbsnews.com/news/tanzania-hit-by-power-blackouts-as-cyclone-hidaya-strengthens-toward-countrys-coastline/,https://www.cbsnews.com/news/tanzania-hit-by-power-blackouts-as-cyclone-hidaya-strengthens-toward-countrys-coastline/,0,www.cbsnews.com,Tanzania hit by power blackouts as Cyclone Hidaya strengthens,"In the past few weeks, flooding in Kenya and Tanzania killed hundreds after heavy rain during the region's monsoon season, officials said.",https://assets3.cbsnewsstatic.com/hub/i/r/2024/05/04/f84b602b-ce46-43a4-b181-094840d3762c/thumbnail/1200x630/31ec803aa169f194b2052a5d43a10a68/ap24116547677860.jpg?v=1d6c78a71b7b6252b543a329b3a5744d,2024-05-04T12:10:54Z,,"A major blackout hit most of Tanzania on Saturday as heavy rains and strong winds from Cyclone Hidaya lashed the country following weeks of flooding in the region.
Ferry services between Tanzania's … [+1247 chars]",,en,Flooding Kenya,Flood,relief,Kenya,SEAF,Africa
