index,url,valid,domain,title,description,image,published,archive,content,quote,language,term,topic,feed,country,ipcc,continent
https://www.abc.net.au/news/2023-10-03/australia-weather-heat-southern-states-rain-event-midweek/102925828,https://www.abc.net.au/news/2023-10-03/australia-weather-heat-southern-states-rain-event-midweek/102925828,0,www.abc.net.au,Hot weather continues to blast southern Australia ahead of major rain event midweek,"The frequent spells of early spring heat resulted in Australia's third warmest September on record since 1910, with a national temperature 2.4C above the climatological average.",https://live-production.wcms.abc-cdn.net.au/38b25fe706f0107aea4a8e1be1d3602d?impolicy=wcms_crop_resize&cropH=2812&cropW=4999&xPos=0&yPos=273&width=862&height=485,2023-10-02T18:00:02Z,,"Yet another round of spring heat is blasting south-east Australia ahead of a major midweek rain event and possibly even the first East Coast Low of 2023.
The latest burst of hot weather follows a ve… [+3917 chars]",,en,record heat,Heat Wave,random,,,
https://theweek.com/science/new-york-city-flooding-unprepared-climate-change,https://theweek.com/science/new-york-city-flooding-unprepared-climate-change,0,theweek.com,Why New York City was caught off guard by flash flooding,Is climate change moving too fast or are city leaders dragging their feet?,https://cdn.mos.cms.futurecdn.net/ysqdTd6xzAFPeRXGpsw9ai-1200-80.jpg,2023-10-02T18:01:29Z,,"A free daily digest of the biggest news stories of the day - and the best features from our website
Thank you for signing up to TheWeek. You will receive a verification email shortly.
There was a p… [+4941 chars]",,en,Flooding York,Flood,wmo,United States,CNA,North-America
https://jalopnik.com/hankooks-all-seasons-embarrass-most-dedicated-winter-ti-1850892218,https://jalopnik.com/hankooks-all-seasons-embarrass-most-dedicated-winter-ti-1850892218,0,jalopnik.com,Hankook's All-Seasons Embarrass Most Dedicated Winter Tires In Comparison Test,"Even if your car has all-wheel drive, if you live in an area where winter temperatures get below freezing, it’s a good idea to get a set of winter tires. Switching them out with your summer tires each fall and spring can be annoying, but it’s a lot less annoy…","https://i.kinja-img.com/image/upload/c_fill,f_auto,fl_progressive,g_center,h_675,pg_1,q_80,w_1200/c7fde7a7df98e175c0d606f4749090bb.jpg",2023-10-02T18:40:00Z,,"Even if your car has all-wheel drive, if you live in an area where winter temperatures get below freezing, its a good idea to get a set of winter tires. Switching them out with your summer tires each… [+1912 chars]",,en,freezing,Snow&Ice,random,,,
https://www.news24.com/sport/cricket/proteas-lose-to-new-zealand-england-thrash-bangladesh-in-cwc-warm-up-clashes-20231002,https://www.news24.com/sport/cricket/proteas-lose-to-new-zealand-england-thrash-bangladesh-in-cwc-warm-up-clashes-20231002,0,www.news24.com,"Sport | Proteas lose to New Zealand, England thrash Bangladesh in CWC warm-up clashes",England and New Zealand clinched rain-hit victories on Monday in their final World Cup warm-up matches before they clash on Thursday in the tournament opener.,https://cdn.24.co.za/files/Cms/General/d/7497/b164aa59e9ca4235a85299f4c6931a5d.jpg,2023-10-02T19:21:07Z,,"<ul><li>Rain interfered with both Cricket World Cup warm-up clashes played on Monday.</li><li>The Proteas, who were in a good position chasing New Zealand's 321 for 6, found themselves losing by 7 ru… [+2922 chars]",,en,Rain ,Precipitation,wmo,Argentina,SES,South-America
https://www.politico.com/news/2023/10/02/ukraine-looks-to-arm-itself-as-western-support-slips-00119528,https://www.politico.com/news/2023/10/02/ukraine-looks-to-arm-itself-as-western-support-slips-00119528,0,www.politico.com,‘It’s a survival issue’: Ukraine looks to arm itself as Western support slips,"Even as Russian bombs rain down, Kyiv seeks to show that it’s open for business.",https://static.politico.com/1a/00/13ba1319471480836c33c8d55f66/https-delivery-gettyimages.com/downloads/1241324227,2023-10-02T20:36:19Z,,"Its a survival issue, said Pavel Verkhniatskyi, managing partner at COSA Intelligence Solutions in Kyiv, since there is only so long Ukraine can expect to rely on donations from partners whose suppor… [+5939 chars]",,en,Rain Russia,Precipitation,wmo,Russia,ESB,Europe
https://www.channelnewsasia.com/sport/mudryk-and-broja-end-chelsea-goal-drought-2-0-win-fulham-3815801,https://www.channelnewsasia.com/sport/mudryk-and-broja-end-chelsea-goal-drought-2-0-win-fulham-3815801,0,www.channelnewsasia.com,Mudryk and Broja end Chelsea goal drought in 2-0 win at Fulham,LONDON :Chelsea finally found the net as they won 2-0 at neighbours Fulham in the Premier League on Monday with Mykhailo Mudryk scoring his first goal for the Blues and Armando Broja also on target as he celebrated his full return from injury.Mauricio Pochett…,"https://onecms-res.cloudinary.com/image/upload/s--9JCvrGfu--/fl_relative,g_south_east,l_one-cms:core:watermark:reuters,w_0.1/f_auto,q_auto/c_fill,g_auto,h_676,w_1200/v1/one-cms/core/2023-10-02t210341z_1_lynxnpej910ya_rtroptp_3_soccer-england-ful-che-report.jpg?itok=qaUj0TSu",2023-10-02T21:03:00Z,,LONDON :Chelsea finally found the net as they won 2-0 at neighbours Fulham in the Premier League on Monday with Mykhailo Mudryk scoring his first goal for the Blues and Armando Broja also on target a… [+2456 chars],,en,drought,Drought,random,,,
https://allthatsinteresting.com/greek-sheep-eat-cannabis,https://allthatsinteresting.com/greek-sheep-eat-cannabis,0,allthatsinteresting.com,Storm Forces Greek Sheep To Seek Refuge In A Greenhouse — Where They Ate 600 Pounds Of Marijuana,"Flooding caused by Storm Daniel has made it difficult for sheep to find fresh grass to feed on. 
The post Storm Forces Greek Sheep To Seek Refuge In A Greenhouse — Where They Ate 600 Pounds Of Marijuana appeared first on All That's Interesting.",https://allthatsinteresting.com/wordpress/wp-content/uploads/2023/10/high-sheep.jpeg,2023-10-02T21:45:57Z,,"Adobe ExpressA flock of sheep sought refuge from flooding and found themselves in a marijuana greenhouse.
A shepherd in Greece was recently surprised to find that his sheep were behaving oddly when … [+3394 chars]",,en,flooding,Flood,random,,,
https://www.npr.org/2023/10/02/1203097422/hurricane-idalia-pushed-flamingos-up-the-east-coast-some-people-hope-theyll-stay,https://www.npr.org/2023/10/02/1203097422/hurricane-idalia-pushed-flamingos-up-the-east-coast-some-people-hope-theyll-stay,0,www.npr.org,Hurricane Idalia pushed flamingos up the East Coast. Some people hope they'll stay,Hurricane Idalia brought some Flamingos from Mexico to the eastern United States. Now some hope the birds will stay and breed there.,https://media.npr.org/include/images/facebook-default-wide-s1400-c100.jpg,2023-10-02T21:58:24Z,,Hurricane Idalia brought some Flamingos from Mexico to the eastern United States. Now some hope the birds will stay and breed there.,,en,Hurricane Idalia,Tropical Cyclone,eonet,,SCA,North-America
https://thehillstimes.in/sports/india-make-quarters-in-all-six-team-events-campaign-ends-in-womens-individual-recurve-section,https://thehillstimes.in/sports/india-make-quarters-in-all-six-team-events-campaign-ends-in-womens-individual-recurve-section,0,thehillstimes.in,India Make Quarters In All Six Team Events; Campaign Ends In Women’s Individual Recurve Section,"Hangzhou, Oct 2 (PTI) Indian archers showed tenacity and authority in equal measure to storm into the quarterfinals in all the six team events of the Asian Games here on Monday. The Indians played five team elimination rounds and dropped just one set on way t…",https://thehillstimes.in/wp-content/uploads/2023/10/WhatsApp-Image-2023-10-02-at-11.39.14-PM.jpeg,2023-10-02T22:00:56Z,,"Hangzhou, Oct 2 (PTI) Indian archers showed tenacity and authority in equal measure to storm into the quarterfinals in all the six team events of the Asian Games here on Monday.
The Indians played f… [+5510 chars]",,en,Storm India,Storm,emdat,India,SAS,Asia
https://medicalxpress.com/news/2023-10-sobering-global-decade-long.html,https://medicalxpress.com/news/2023-10-sobering-global-decade-long.html,0,medicalxpress.com,"How floods kill, long after the water has gone: Sobering data from a global decade-long study","With New York's declared state of emergency following flash flooding, there is increasing concern such events will become more common globally.",https://scx2.b-cdn.net/gfx/news/hires/2017/flood.jpg,2023-10-02T22:35:15Z,,"With New York's declared state of emergency following flash flooding, there is increasing concern such events will become more common globally.
Now a study led by Monash University scientists in Aus… [+3835 chars]",,en,flooding,Flood,random,,,
https://economictimes.indiatimes.com/world/rest-of-world/bushfires-in-parts-of-southeast-australia-amid-spring-heatwave/articleshow/104116554.cms,https://economictimes.indiatimes.com/world/rest-of-world/bushfires-in-parts-of-southeast-australia-amid-spring-heatwave/articleshow/104116554.cms,0,economictimes.indiatimes.com,Bushfires in parts of southeast Australia amid spring heatwave,"Bushfires in Australia's Victoria state have tripled in size overnight due to high winds, prompting authorities to urge residents to evacuate. The fires have spread across 17,000 hectares of land and are proving difficult to contain. In Tasmania, residents ha…","https://img.etimg.com/thumb/msid-104116545,width-1200,height-630,imgsize-122656,overlay-economictimes/photo.jpg",2023-10-03T00:11:07Z,,SYDNEY: A bushfire in Australia's Victoria state more than trebled overnight and authorities urged residents in a remote part of Tasmania state to evacuate as a spring heatwave fanned fires across th… [+1647 chars],,en,Heat Wave Victoria,Heat Wave,acwe,Australia,SAU,Oceania
https://www.channelnewsasia.com/world/australia-wildfire-bushfire-heatwave-3816061,https://www.channelnewsasia.com/world/australia-wildfire-bushfire-heatwave-3816061,0,www.channelnewsasia.com,Bushfires in parts of southeast Australia amid spring heatwave,"SYDNEY: A bushfire in Australia's Victoria state more than trebled overnight and authorities urged residents in a remote part of Tasmania state to evacuate as a spring heatwave fanned fires across the country's southeast. Around 17,000 hectares were ablaze on…","https://onecms-res.cloudinary.com/image/upload/s--7LI2lEzc--/fl_relative,g_south_east,l_one-cms:core:watermark:reuters,w_0.1/f_auto,q_auto/c_fill,g_auto,h_676,w_1200/v1/one-cms/core/2023-09-20t003949z_1_lynxmpej8j00t_rtroptp_3_australia-weather.jpg?itok=-dlEn69Z",2023-10-03T00:28:11Z,,"Across the Bass Strait in Tasmania state, residents on the northern edge of Flinders Island were told to evacuate from an out-of-control bushfire.
Fires are being stoked by hot, dry winds across the… [+918 chars]",,en,Bushfire Tasmania,Heat Wave,acwe,Australia,SAU,Oceania
https://e.vnexpress.net/news/news/environment/mekong-delta-braces-for-severe-drought-river-salinity-4658565.html,https://e.vnexpress.net/news/news/environment/mekong-delta-braces-for-severe-drought-river-salinity-4658565.html,0,e.vnexpress.net,"Mekong Delta braces for severe drought, river salinity",The Mekong Delta region is scrambling to protect millions of hectares of crops from drought and saltwater intrusion that could be as severe as in 2016 and 2020.,https://vcdn1-english.vnecdn.net/2023/09/28/thicongcongtg84621695819650375-6764-5555-1695894788.jpg?w=680&h=0&q=100&dpr=1&fit=crop&s=p9LR5r8CeLRt_rlZtVBv5g,2023-10-03T00:35:35Z,,"At the end of September Nguyen Van Can, 50, of Hoa Luu Commune in Hau Giang Province's Long My District prepared to sow winter-spring rice in his three-hectare farm.
He said he was sowing earlier th… [+4012 chars]",,en,drought,Drought,random,,,
https://nypost.com/2023/10/02/first-october-storm-to-break-the-heat-after-severe-weather-in-western-central-us/,https://nypost.com/2023/10/02/first-october-storm-to-break-the-heat-after-severe-weather-in-western-central-us/,0,nypost.com,"First October storm to break the heat after blasting western, central US with snow, severe weather, heavy rain",Millions of Americans are experiencing the last taste of summer this week with record-breaking temperatures being reported in several cities across the US.,https://nypost.com/wp-content/uploads/sites/2/2023/10/WED-South-Flash-Flood-Outlook.png?w=1024,2023-10-03T00:44:53Z,,"Millions of Americans are experiencing the last taste of summer this week with record-breaking temperatures being reported in several cities across the US from the Midwest to the Northeast, but there… [+3678 chars]",,en,storm,Storm,random,,,
https://www.sciencedaily.com/releases/2023/10/231002211338.htm,https://www.sciencedaily.com/releases/2023/10/231002211338.htm,0,www.sciencedaily.com,"Improved mangrove conservation could yield cash, carbon, coastal benefits","A shift in the way we think about the benefits mangroves provide to coastal regions could yield significant economic and biodiversity gains and protect millions from flooding, research has revealed.",https://www.sciencedaily.com/images/scidaily-icon.png,2023-10-03T01:13:38Z,,"A shift in the way we think about the benefits mangroves provide to coastal regions could yield significant economic and biodiversity gains and protect millions from flooding, research has revealed.T… [+3122 chars]",,en,coastal flooding,Storm Surge,random,,,
https://www.jpost.com/international/article-761419,https://www.jpost.com/international/article-761419,0,www.jpost.com,'They're just meat': Russia deploys punishment battalions in echo of Stalin,"Storm-Z is an unofficial term used by Russian troops, combining a term for assault troops with the letter Z, adopted by the military as a symbol of their invasion of Ukraine.","https://images.jpost.com/image/upload/f_auto,fl_lossy/c_fill,g_faces:center,h_407,w_690/493765",2023-10-03T05:38:23Z,https://web.archive.org/web/20231003152329/https://www.jpost.com/international/article-761419,"Drunk recruits. Insubordinate soldiers. Convicts.
They're among hundreds of military and civilian offenders who've been pressed into Russian penal units known as ""Storm-Z"" squads and sent to the fro… [+10279 chars]",,en,storm,Storm,random,,,
https://www.naturalnews.com/2023-10-03-kiyosaki-advises-leveraging-debt-to-gain-real-assets.html,https://www.naturalnews.com/2023-10-03-kiyosaki-advises-leveraging-debt-to-gain-real-assets.html,0,www.naturalnews.com,"De-DOLLARIZATION: In new interview, Robert Kiyosaki advises leveraging debt to gain REAL ASSETS instead of investing in paper currency (that’s headed toward collapse)","For Japanese-American entrepreneur and famed author Robert Kiyosaki, Americans should veer away from being brainwashed that working for the paper dollar, saving and investing for it, would keep them afloat amid the economic collapse. He said that since the do…",https://www.naturalnews.com/wp-content/uploads/sites/91/2023/10/Sinking-Financial-Dollar-Economy.jpg,2023-10-03T06:00:00Z,,"For Japanese-American entrepreneur and famed author Robert Kiyosaki, Americans should veer away from being brainwashed that working for the paper dollar, saving and investing for it, would keep them … [+5487 chars]",,en,Rain ,Precipitation,wmo,Argentina,SES,South-America
https://www.channelnewsasia.com/asia/japan-sees-hottest-september-records-began-3816681,https://www.channelnewsasia.com/asia/japan-sees-hottest-september-records-began-3816681,0,www.channelnewsasia.com,Japan sees hottest September since records began,"TOKYO: Japan has seen its hottest September since records began 125 years ago, the weather agency said, in a year expected to be the warmest in human history. The scorching September's average temperature was 2.66 degrees Celsius higher than usual, the Japan …","https://onecms-res.cloudinary.com/image/upload/s--ohQhF9G6--/fl_relative,g_south_east,l_one-cms:core:watermark:afp_watermark,w_0.1/f_auto,q_auto/c_fill,g_auto,h_676,w_1200/v1/one-cms/core/335e2bb0f6f484c5a42be2735577bbb3c2e102eb.jpg?itok=hPbOrT7n",2023-10-03T06:05:00Z,,"TOKYO: Japan has seen its hottest September since records began 125 years ago, the weather agency said, in a year expected to be the warmest in human history.
The scorching September's average tempe… [+1820 chars]",,en,scorching temperature,Heat Wave,random,,,
https://phys.org/news/2023-10-japan-hottest-september-began.html,https://phys.org/news/2023-10-japan-hottest-september-began.html,0,phys.org,Japan sees hottest September since records began,"Japan has seen its hottest September since records began 125 years ago, the weather agency said, in a year expected to be the warmest in human history.",https://scx2.b-cdn.net/gfx/news/2023/japan-has-seen-its-hot.jpg,2023-10-03T08:09:28Z,,"Japan has seen its hottest September since records began 125 years ago, the weather agency said, in a year expected to be the warmest in human history.
The scorching September's average temperature … [+2164 chars]",,en,hottest year,Heat Wave,random,,,
https://lithub.com/daniel-gumbiner-on-wildfires-winemaking-and-writing-fiction/,https://lithub.com/daniel-gumbiner-on-wildfires-winemaking-and-writing-fiction/,0,lithub.com,"Daniel Gumbiner on Wildfires, Winemaking, and Writing Fiction","Fire season in California goes from the driest months of summer until the first rains come, if they come. (Traditionally October 31 was the date to circle.) It’s a time when people stay alert to rising winds, the smell of smoke, sirens and alerts signaling th…",https://s26162.pcdn.co/wp-content/uploads/2023/09/gumbiner.png,2023-10-03T08:10:46Z,,"Fire season in California goes from the driest months of summer until the first rains come, if they come. (Traditionally October 31 was the date to circle.) Its a time when people stay alert to risin… [+13827 chars]",,en,Wildfire ,Wildfire,emdat,Greece,MED,
https://www.cnn.com/2023/10/03/weather/hurricane-season-el-nino-ocean-temperatures-climate/index.html,https://www.cnn.com/2023/10/03/weather/hurricane-season-el-nino-ocean-temperatures-climate/index.html,0,www.cnn.com,"Rest of hurricane season in 'uncharted waters' because of El Niño, record ocean temperatures","Experts fear an already active hurricane season could come to an eventful and exceptional end as unusually warm, storm-boosting ocean temperatures and a slow-to-emerge El Niño combine.","https://media.cnn.com/api/v1/images/stellar/prod/231002123515-02-october-hurricane-season.jpg?c=16x9&q=w_800,c_fill",2023-10-03T08:35:12Z,,"Experts fear an already active hurricane season could come to an eventful and exceptional end as unusually warm, storm-boosting ocean temperatures and a slow-to-emerge El Niño combine. 
The Atlantic… [+3842 chars]",,en,Storm ,Storm,wmo,Argentina,SES,South-America
https://www.bmj.com/content/383/bmj.p2182,https://www.bmj.com/content/383/bmj.p2182,0,www.bmj.com,Health as loss and damage under a changing climate,"Loss of health and life should be a key consideration in reparation plans

This year has seen wildfires, flash flooding, and the warmest month on record,1 a likely “new normal” as the consequences of climate change—primarily driven by burning fossil fuels for…",https://www.bmj.com/sites/default/files/highwire/bmj/382/8400.cover-source.jpg,2023-10-03T09:26:23Z,,"<ol><li>Rita Issa, research fellow1 2, </li><li>Adelle Thomas, senior fellow3, </li><li>Noora Firaq, deputy chief executive4, </li><li>Arthur Wyns, fellow5</li></ol><ol><li>1School of Global Developm… [+1622 chars]",,en,flooding,Flood,random,,,
https://www.marketscreener.com/news/latest/In-Libya-s-devastated-Derna-families-still-search-for-the-missing--44970970/,https://www.marketscreener.com/news/latest/In-Libya-s-devastated-Derna-families-still-search-for-the-missing--44970970/,0,www.marketscreener.com,"In Libya's devastated Derna, families still search for the missing","(marketscreener.com) Since a huge flood swept away whole neighbourhoods of Libya's city of Derna last month, Abdulsalam al-Kadi has been searching for his father and brother. He doesn't expect to find them alive but he wants to bury them so he has a grave to …",https://img.zonebourse.com/reuters/2023-10/2023-10-03T093117Z_1_LYNXMPEJ92098_RTROPTP_3_LIBYA-STORM-MISSING.JPG,2023-10-03T09:34:14Z,,"DERNA, Libya (Reuters) - Since a huge flood swept away whole neighbourhoods of Libya's city of Derna last month, Abdulsalam al-Kadi has been searching for his father and brother. He doesn't expect to… [+3560 chars]",,en,Flood Libya,Flood,floodlist,Libya,SAH,Africa
https://www.spacedaily.com/reports/As_Earth_heats_up_rain_pours_down_999.html,https://www.spacedaily.com/reports/As_Earth_heats_up_rain_pours_down_999.html,0,www.spacedaily.com,"As Earth heats up, rain pours down","Washington DC (SPX) Sep 26, 2023


Earth's land masses have a higher chance of becoming wetter than drier as temperatures rise. In a new study, researchers found that co-occurring precipitation and heat extremes will become more frequent, severe and widesprea…",https://www.spxdaily.com/images-hg/global-wet-hot-dry-hot-events-2050-2099-chart-hg.jpg,2023-10-03T10:14:31Z,,"As Earth heats up, rain pours downby Staff WritersWashington DC (SPX) Sep 26, 2023
Earth's land masses have a higher chance of becoming wetter than drier as temperatures rise. In a new study, resear… [+3400 chars]",,en,Rain ,Precipitation,wmo,Argentina,SES,South-America
https://www.prnewswire.com/news-releases/enlightened-growth-leadership-awards-2023-driving-change-in-sustainability-301945222.html,https://www.prnewswire.com/news-releases/enlightened-growth-leadership-awards-2023-driving-change-in-sustainability-301945222.html,0,www.prnewswire.com,"Enlightened Growth Leadership Awards, 2023: Driving Change in Sustainability","SANTA CLARA, Calif., Oct. 3, 2023 /PRNewswire/ -- The Frost & Sullivan Institute is thrilled to present the highly anticipated 2023 Enlightened Growth Leadership Awards, an esteemed recognition that celebrates visionary companies shaping a sustainable future …",https://mma.prnewswire.com/media/2237288/Frost_and_Sullivan_2023_Enlightened_Growth_Leadership_Awards.jpg?p=facebook,2023-10-03T10:37:00Z,,"SANTA CLARA, Calif., Oct. 3, 2023 /PRNewswire/ -- The Frost &amp; Sullivan Institute is thrilled to present the highly anticipated 2023 Enlightened Growth Leadership Awards, an esteemed recognition t… [+3540 chars]",,en,frost,Snow&Ice,random,,,
https://www.news24.com/news24/africa/news/a-storm-caused-devastation-in-libya-but-politics-may-be-its-biggest-problem-in-the-aftermath-20231003,https://www.news24.com/news24/africa/news/a-storm-caused-devastation-in-libya-but-politics-may-be-its-biggest-problem-in-the-aftermath-20231003,0,www.news24.com,"News24 | A storm caused devastation in Libya, but politics may be its biggest problem in the aftermath",Libya's deep political divide may be the single biggest issue holding back recovery after Storm Daniel hit Derna.,https://cdn.24.co.za/files/Cms/General/d/3864/efe65c7b066a4a42aa521296c71f99a8.jpg,2023-10-03T11:38:01Z,,<ul><li>The UN has called for rival governments running Libya to work together to rebuild the country after a devastating storm.</li><li>More than 4 000 people were reported dead with about 8 500 una… [+4030 chars],,en,Storm ,Storm,wmo,Argentina,SES,South-America
https://www.businessinsider.com/russia-soldiers-who-drink-sent-to-punishment-battalions-die-report-2023-10,https://www.businessinsider.com/russia-soldiers-who-drink-sent-to-punishment-battalions-die-report-2023-10,0,www.businessinsider.com,"Russian soldiers who drink and break rules get sent to punishment battalions where they are likely to die fighting, report says",Russia set up its Storm Z program at the beginning of the year in an attempt to replace the Wagner Group .,https://i.insider.com/651bd4be42ecf94db4761d9b?width=1200&format=jpeg,2023-10-03T11:59:01Z,,"A video shows fighters from Russia's Storm-Z squad saying they will no longer fight in Ukraine, citing their treatment by their officers, on June 28, 2023.Gulagu.net/Reuters
<ul><li>Russian soldiers… [+3330 chars]",,en,Storm ,Storm,wmo,Argentina,SES,South-America
https://www.businessinsider.com/us-economic-outlook-jpmorgan-dimon-government-spending-geopolitics-russia-ukraine-2023-10,https://www.businessinsider.com/us-economic-outlook-jpmorgan-dimon-government-spending-geopolitics-russia-ukraine-2023-10,0,www.businessinsider.com,"Sunny days for the US economy could end abruptly if these 2 'storm clouds' hit, JPMorgan's Jamie Dimon warns","JPMorgan CEO Jamie Dimon says the US economy is doing well, but tighter financial conditions and fallout from the Russia-Ukraine war are key threats.",https://i.insider.com/5ec3f8a83ad86154d755511b?width=1200&format=jpeg,2023-10-03T12:44:42Z,,"JPMorgan CEO Jamie Dimon.Jeenah Moon/Reuters
<ul>
<li>The US economy is in good shape but there are ""storm clouds"" on the horizon, Jamie Dimon says.</li>
<li>The JPMorgan chief worries about the fal… [+2591 chars]",,en,storm,Storm,random,,,
