index,url,valid,domain,title,description,image,published,archive,content,quote,language,term,topic,feed,country,ipcc,continent
https://freebeacon.com/latest-news/theyre-just-meat-how-russia-uses-units-of-disposable-convicts-to-wage-war-on-ukraine/,https://freebeacon.com/latest-news/theyre-just-meat-how-russia-uses-units-of-disposable-convicts-to-wage-war-on-ukraine/,0,freebeacon.com,‘They’re Just Meat’: How Russia Uses Units of Disposable Convicts To Wage War on Ukraine,"Drunk recruits. Insubordinate soldiers. Convicts. They're among hundreds of military and civilian offenders who've been pressed into Russian penal units known as ""Storm-Z"" squads and sent to the frontlines in Ukraine this year.
The post ‘They’re Just Meat’: H…",https://freebeacon.com/wp-content/uploads/2023/08/2023-08-28T202427Z_3_LYNXMPEJ7R068_RTROPTP_4_UKRAINE-CRISIS-ROBOTYNE-scaled-e1693327197181.jpg,2023-10-03T13:50:56Z,http://wayback.archive-it.org/all/20231004225809/https://freebeacon.com/latest-news/theyre-just-meat-how-russia-uses-units-of-disposable-convicts-to-wage-war-on-ukraine/,"Drunk recruits. Insubordinate soldiers. Convicts.
They're among hundreds of military and civilian offenders who've been pressed into Russian penal units known as ""Storm-Z"" squads and sent to the fro… [+10329 chars]",,en,Storm Russia,Storm,wmo,Russia,ESB,Europe
https://nypost.com/2023/10/03/drunk-russian-troops-sent-to-die-in-punishment-squads/,https://nypost.com/2023/10/03/drunk-russian-troops-sent-to-die-in-punishment-squads/,0,nypost.com,"Drunk, unruly Russian troops sent to die on front lines in punishment squads: report","Russian commanders were said to have been using ""Storm-Z"" troops as cannon fodder.",https://nypost.com/wp-content/uploads/sites/2/2023/10/NYPICHPDPICT000055016649.jpg?quality=75&strip=all&w=1024,2023-10-03T17:47:45Z,https://web.archive.org/web/20231003175453/https://nypost.com/2023/10/03/drunk-russian-troops-sent-to-die-in-punishment-squads/,Russian soldiers fighting in Ukraine who are caught drinking or being insubordinate are forced into Storm-Z punishment squads and sent to the most dangerous parts of the front lines to face likely de… [+7171 chars],,en,storm,Storm,random,,,
https://biztoc.com/x/00a9dd45cf155acd,https://biztoc.com/x/00a9dd45cf155acd,0,biztoc.com,Drought-hit Thailand turns to cloud seeding to offset El Nino,"BANGKOK -- Thailand has launched rainmaking operations and taken other drought-fighting steps as it deals with a severe water shortage. Rainfall has been weak across the country due to climate change and the effects of the El Nino phenomenon, which brings dri…",https://c.biztoc.com/p/00a9dd45cf155acd/s.webp,2023-10-03T19:54:25Z,,BANGKOK -- Thailand has launched rainmaking operations and taken other drought-fighting steps as it deals with a severe water shortage.Rainfall has been weak across the country due to climate change … [+169 chars],,en,drought,Drought,random,,,
https://www.abc.net.au/news/2023-10-04/severe-storms-flooding-forecast-for-eastern-australia/102924948,https://www.abc.net.au/news/2023-10-04/severe-storms-flooding-forecast-for-eastern-australia/102924948,0,www.abc.net.au,"Dangerous wind, heavy rain, flooding forecast to hit eastern states as intense storm system deepens","Thunderstorms and heavy rain are forecast for parts of Victoria and New South Wales, dousing fires but bringing the threat of flash flooding, as a low pressure system intensifies over the eastern states.",https://live-production.wcms.abc-cdn.net.au/198ffa1aa9384bab3b047a1b8a8fe8ea?impolicy=wcms_crop_resize&cropH=191&cropW=340&xPos=0&yPos=19&width=862&height=485,2023-10-03T20:37:02Z,,"Widespread rain and thunderstorms, carrying the risk of flash flooding, have begun pouring over parts of Victoria and New South Wales, as a low pressure system intensifies over the eastern states. 
… [+6638 chars]",,en,Flooding New South Wales,Flooding,acwe,Australia,EAU,Oceania
https://www.thestar.com.my/news/world/2023/10/04/australia-state-swings-from-bush-fires-to-flash-flooding-in-24-hours,https://www.thestar.com.my/news/world/2023/10/04/australia-state-swings-from-bush-fires-to-flash-flooding-in-24-hours,0,www.thestar.com.my,Australia state swings from bush fires to flash flooding in 24 hours,"SYDNEY (Reuters) - Less than 24 hours since residents in parts of Australia's Victoria state fled bush fires, state authorities are now warning of flooding as heavy rain douses flames and lifts rivers in the southeastern state. Read full story",https://apicms.thestar.com.my/uploads/images/2023/10/04/2317799.jpg,2023-10-03T23:03:00Z,,"SYDNEY (Reuters) - Less than 24 hours since residents in parts of Australia's Victoria state fled bush fires, state authorities are now warning of flooding as heavy rain douses flames and lifts river… [+1631 chars]",,en,Flooding Victoria,Flooding,acwe,Australia,SAU,Oceania
https://biztoc.com/x/fcfc3a58af6abf8f,https://biztoc.com/x/fcfc3a58af6abf8f,0,biztoc.com,Tropical Storm Philippe Forecasted To Impact Maine Or Nova Scotia,"Tropical Storm Philippe Forecasted To Impact Maine Or Nova Scotia Several weeks after Tropical Storm Lee made landfall in the western part of Canada's Nova Scotia province, another storm is brewing in the Atlantic Basin, with computer models forecasting parts…",https://c.biztoc.com/p/fcfc3a58af6abf8f/s.webp,2023-10-04T03:18:07Z,,"Tropical Storm Philippe Forecasted To Impact Maine Or Nova Scotia 
Several weeks after Tropical Storm Lee made landfall in the western part of Canada's Nova Scotia province, another storm is brewing… [+297 chars]",,en,storm,Storm,random,,,
https://www.cnn.com/2023/10/04/world/nobel-peace-prize-preview-2023-intl/index.html,https://www.cnn.com/2023/10/04/world/nobel-peace-prize-preview-2023-intl/index.html,0,www.cnn.com,Nobel Peace Prize could give a glimmer of hope amid era of conflict and climate crisis,"The Nobel Peace Prize will be awarded in Norway on Friday, as Russia's brutal invasion of Ukraine rages on and other flashpoints threaten to ignite across the globe.","https://media.cnn.com/api/v1/images/stellar/prod/231003114741-04-nobel-peace-prize-preview-2023-medal-restricted.jpg?c=16x9&q=w_800,c_fill",2023-10-04T04:01:38Z,,"The Nobel Peace Prize will be awarded in Norway on Friday, as Russias brutal invasion of Ukraine rages on and other flashpoints threaten to ignite across the globe.
Given that many efforts to promot… [+6131 chars]",,en,Rain ,Precipitation,wmo,Argentina,SES,South-America
https://english.khabarhub.com/2023/04/320920/,https://english.khabarhub.com/2023/04/320920/,0,english.khabarhub.com,"Bajhang earthquake update: One killed, 135 houses destroyed","BAJHANG: An earthquake in Bajhang district in Nepal on Tuesday claimed one life. Gunamati Dhami, a 40-year-old resident of Jaiprithvi Municipality-11, Okhal, lost her life during the earthquake. According to Dipesh Chaudhary, a Police Inspector from the Distr…",https://english.khabarhub.com/wp-content/uploads/2023/10/Bajhang_Earthquake.png,2023-10-04T04:30:30Z,,"BAJHANG: An earthquake in Bajhang district in Nepal on Tuesday claimed one life.
Gunamati Dhami, a 40-year-old resident of Jaiprithvi Municipality-11, Okhal, lost her life during the earthquake.
Ac… [+560 chars]",,en,earthquake,Earthquake,random,,,
https://www.marketscreener.com/quote/index/TOPIX-INDEX-61714390/news/One-killed-in-landslide-after-earthquakes-rattle-Nepal-44977757/,https://www.marketscreener.com/quote/index/TOPIX-INDEX-61714390/news/One-killed-in-landslide-after-earthquakes-rattle-Nepal-44977757/,0,www.marketscreener.com,One killed in landslide after earthquakes rattle Nepal,"(marketscreener.com) Rescue workers in Nepal dug with shovels and their bare hands on Wednesday as they searched for a woman killed the previous day when she was swept away by a landslide triggered by an earthquake, police said.https://www.marketscreener.com/…",https://www.marketscreener.com/images/twitter_MS_fdnoir.png,2023-10-04T05:32:39Z,,KATHMANDU (Reuters) - Rescue workers in Nepal dug with shovels and their bare hands on Wednesday as they searched for a woman killed the previous day when she was swept away by a landslide triggered … [+788 chars],,en,Earthquake Nepal,Earthquake,relief,Nepal,TIB,Asia
https://allafrica.com/stories/202310040054.html,https://allafrica.com/stories/202310040054.html,0,allafrica.com,South Africa: Small-Scale Farmers Suffer Devastating Losses After Western Cape Floods,"[GroundUp] At a Genadendal farm, nearly 500 chickens drowned, and over 50 pigs are missing",https://cdn08.allafrica.com/static/images/structure/aa-logo-rgba-no-text-square.png,2023-10-04T05:49:01Z,,"At a Genadendal farm, nearly 500 chickens drowned, and over 50 pigs are missing 
Small scale, emerging farmer Johannes Arendse was only able to access his communal farm outside Genadendal for the fi… [+3645 chars]",,en,Flood South Africa,Precipitation,floodlist,South Africa,ESAF,Africa
https://www.juancole.com/2023/10/frankensteins-emergency-dangerous.html,https://www.juancole.com/2023/10/frankensteins-emergency-dangerous.html,0,www.juancole.com,Frankenstein’s Monster of a Climate Emergency: Dangerous Global September Heat Spike,"Ann Arbor (Informed Comment) - The data from scientific institutions around the world is pouring in here in the beginning of October, regarding September, 2023, and the consensus is that it was freakishly hot, unprecedentedly torrid, off-the-charts sweltering…",https://media.juancole.com/images/2023/10/Screenshot-2023-10-04-at-1.18.48-AM.png,2023-10-04T05:52:04Z,,"Ann Arbor (Informed Comment) – The data from scientific institutions around the world is pouring in here in the beginning of October, regarding September, 2023, and the consensus is that it was freak… [+5041 chars]",,en,heat,Heat Wave,random,,,
https://www.peoplesreview.com.np/2023/10/04/earthquake-jolts-west-nepal/,https://www.peoplesreview.com.np/2023/10/04/earthquake-jolts-west-nepal/,0,www.peoplesreview.com.np,Earthquake jolts West Nepal,"By Our Reporter
 
Multiple earthquakes shook Bajhang district on Tuesday, leaving 12 injured and one missing. The missing person is 40-year-old Gunamati Dhami who was carried away by a quake-induced landslide at Okhar, of Jayaprithvi Municipality–11.
The larg…",https://i0.wp.com/www.peoplesreview.com.np/wp-content/uploads/2020/09/earthquake.jpg?fit=300%2C168&ssl=1,2023-10-04T06:15:52Z,,"Editor-in-Chief: Pushpa Raj Pradhan
Consultant Editor Emeritus: Mana Ranjan Josse
Contributing Editor: Prof Dr Shashi P.B.B. Malla
Guest Editor: Yug Bahadur
Managing Editor: Sushma Shrestha
Chie… [+474 chars]",,en,Earthquake Nepal,Earthquake,relief,Nepal,TIB,Asia
https://www.aljazeera.com/news/2023/10/4/indian-army-searching-for-23-troops-who-went-missing-after-flash-flood,https://www.aljazeera.com/news/2023/10/4/indian-army-searching-for-23-troops-who-went-missing-after-flash-flood,0,www.aljazeera.com,Indian army searching for 23 soldiers who went missing after flash flood,A cloudburst over Lhonak Lake triggers flooding in a valley located in northeastern Sikkim state.,https://www.aljazeera.com/wp-content/uploads/2023/10/33XC4U4-highres-1696399603.jpg?resize=1920%2C1440,2023-10-04T07:24:57Z,http://wayback.archive-it.org/all/20231004163535/https://www.aljazeera.com/news/2023/10/4/indian-army-searching-for-23-troops-who-went-missing-after-flash-flood,"Heavy rain has hampered the search for 23 Indian soldiers who have gone missing after a flash flood in northeastern Sikkim state, with the capital city of Gangtok cut off by road, defence officials s… [+3201 chars]",,en,Flash Flood India,Precipitation,relief,India,SAS,Asia
https://www.peoplesreview.com.np/2023/10/04/king-expresses-deep-sorrow/,https://www.peoplesreview.com.np/2023/10/04/king-expresses-deep-sorrow/,0,www.peoplesreview.com.np,King expresses deep sorrow,"Kathmandu, 4 October: Former King Gyanendra has expressed deep sorrow over the huge damage caused by a powerful earthquake in Bajhang district.
The former King has urged the locals to remain alert as frequent aftershocks are hitting the area.
The King has als…",https://i0.wp.com/www.peoplesreview.com.np/wp-content/uploads/2022/06/Earthquake.jpg?fit=300%2C185&ssl=1,2023-10-04T07:51:44Z,,"Editor-in-Chief: Pushpa Raj Pradhan
Consultant Editor Emeritus: Mana Ranjan Josse
Contributing Editor: Prof Dr Shashi P.B.B. Malla
Guest Editor: Yug Bahadur
Managing Editor: Sushma Shrestha
Chie… [+474 chars]",,en,earthquake,Earthquake,random,,,
https://statetimes.in/panic-in-north-india-as-4-earthquakes-shake-nepal-in-an-hour/,https://statetimes.in/panic-in-north-india-as-4-earthquakes-shake-nepal-in-an-hour/,0,statetimes.in,Panic in north India as 4 earthquakes shake Nepal in an hour,"New Delhi: Four earthquakes, the strongest being of magnitude 6.2, jolted Nepal in quick succession on Tuesday with tremors reverberating through parts of north India, including Delhi-NCR, the National Centre for Seismology (NCS) said. An NCS official said th…",https://statetimes.in/wp-content/uploads/2023/10/earthquake-1-1024x628.jpg,2023-10-04T07:54:41Z,,"New Delhi: Four earthquakes, the strongest being of magnitude 6.2, jolted Nepal in quick succession on Tuesday with tremors reverberating through parts of north India, including Delhi-NCR, the Nation… [+4133 chars]",,en,Earthquake India,Earthquake,usgs,India,TIB,Asia
https://www.rediff.com/sports/report/squash-at-asian-games-dipika-harinder-storm-into-final-abhay-anahat-lose/20231004.htm,https://www.rediff.com/sports/report/squash-at-asian-games-dipika-harinder-storm-into-final-abhay-anahat-lose/20231004.htm,0,www.rediff.com,Squash at Asian Games: Dipika-Harinder storm into final,"The Indians won 7-11, 11-7, 11-9 against Hong Kong's Lee Ka Yi and Wong Chi Him.",https://im.rediff.com/sports/2023/oct/04squash-dipika-harry.jpg,2023-10-04T08:10:51Z,,"IMAGES: Dipika Pallikal and Harinder Pal Singh Sandhu. Photograph: Team India/X
The Indian duo of Dipika Pallikal and Harinder Pal Singh Sandhu rallied to enter the final of the mixed doubles squash… [+2276 chars]",,en,storm,Storm,random,,,
https://economictimes.indiatimes.com/news/india/are-tall-buildings-really-more-vulnerable-to-earthquakes-here-is-what-experts-say/articleshow/104157888.cms,https://economictimes.indiatimes.com/news/india/are-tall-buildings-really-more-vulnerable-to-earthquakes-here-is-what-experts-say/articleshow/104157888.cms,0,economictimes.indiatimes.com,Are tall buildings really more vulnerable to earthquakes? Here is what experts say,"A series of tremors hit Delhi-NCR after seismic disturbances were identified in Nepal. Seven quakes were recorded, with five classified as aftershocks. Panic ensued, but experts clarified that the height of a building does not necessarily make it more vulnera…","https://img.etimg.com/thumb/msid-104158296,width-1200,height-630,imgsize-1295101,overlay-economictimes/photo.jpg",2023-10-04T10:10:38Z,,"Delhi-NCR experienced a series of tremors on Tuesday afternoon, sending shockwaves through the region. The source of these seismic disturbances was identified in Nepal. Within a span of approximately… [+2465 chars]",,en,earthquake,Earthquake,random,,,
https://english.khabarhub.com/2023/04/320969/,https://english.khabarhub.com/2023/04/320969/,0,english.khabarhub.com,"Bajhang experiences series of quakes, and aftershocks","KATHMANDU: A series of earthquakes and aftershocks have continued in Bajhang district in Sudurpaschim Province since the 5.3 magnitude quake took place in the district on Tuesday, said the National Earthquake Monitoring and Research Centre (NEMRC), Lainchaur,…",https://english.khabarhub.com/wp-content/uploads/2023/10/Bajhang_Earthquake.png,2023-10-04T10:15:14Z,,"KATHMANDU: A series of earthquakes and aftershocks have continued in Bajhang district in Sudurpaschim Province since the 5.3 magnitude quake took place in the district on Tuesday, said the National E… [+1632 chars]",,en,M 5.3,Earthquake,usgs,,NPO,Pacific Ocean
https://biztoc.com/x/4fcb57c652dd58d2,https://biztoc.com/x/4fcb57c652dd58d2,0,biztoc.com,Australia state swings from bush fires to flash floods in 24 hours,"Less than 24 hours since residents in parts of Australia's Victoria state fled bush fires, authorities warned on Wednesday of flooding as heavy rain douses flames and swells rivers in the southeastern state. Flash flooding is expected through Wednesday aftern…",https://c.biztoc.com/p/4fcb57c652dd58d2/s.webp,2023-10-04T11:04:09Z,,"Less than 24 hours since residents in parts of Australia's Victoria state fled bush fires, authorities warned on Wednesday of flooding as heavy rain douses flames and swells rivers in the southeaster… [+311 chars]",,en,Flooding South Australia,Flooding,acwe,Australia,CAU,Oceania
https://www.prnewswire.com/news-releases/kia-america-honors-season-18-winner-of-americas-got-talent-301947217.html,https://www.prnewswire.com/news-releases/kia-america-honors-season-18-winner-of-americas-got-talent-301947217.html,0,www.prnewswire.com,"KIA AMERICA HONORS SEASON 18 WINNER OF ""AMERICA'S GOT TALENT""","Adrian Stoica & Hurricane awarded an all-new, all-electric Kia EV9 SUV as part of the prize package for winning America's favorite talent show IRVINE, Calif., Oct. 4, 2023 /PRNewswire/ -- For the fourth consecutive year, Kia America served as the official aut…",https://mma.prnewswire.com/media/2238658/Kia_America_Honors_Season_18_Winner_of_America_s_Got_Talent.jpg?p=facebook,2023-10-04T14:38:00Z,,"Adrian Stoica &amp; Hurricane awarded an all-new, all-electric Kia EV9 SUV as part of the prize package for winning America's favorite talent show
IRVINE, Calif., Oct. 4, 2023 /PRNewswire/ -- For th… [+1438 chars]",,en,hurricane,Tropical Cyclone,random,,,
https://www.bostonglobe.com/2023/10/04/metro/october-weather-forecast-boston/,https://www.bostonglobe.com/2023/10/04/metro/october-weather-forecast-boston/,0,www.bostonglobe.com,"Warm temperatures, sunny skies precede another wet weekend","A set of sunny, warm days might be the region's last glimpse of 80 degrees for the year, and a tropical storm brewing in the Caribbean threatens to bring rain and humidity to the weekend.",https://bostonglobe-prod.cdn.arcpublishing.com/resizer/Oooaylgx6R_lrECHP_yMBX1qFow=/506x0/cloudfront-us-east-1.images.arcpublishing.com/bostonglobe/C22LCDOQGRLI5AG3EFWJ6XB3ZA.jpg,2023-10-04T14:56:12Z,,"Wednesday brought about another warm and sunny start to the region. This should mark the second October day in a row that many places have reached 80 degrees.
Obviously at some point theres a final … [+2116 chars]",,en,Storm ,Storm,wmo,Argentina,SES,South-America
https://phys.org/news/2023-10-climate-marine-efforts-atlantic-canada.html,https://phys.org/news/2023-10-climate-marine-efforts-atlantic-canada.html,0,phys.org,Climate change challenges marine conservation efforts in Atlantic Canada,"Extreme ocean changes due to climate change are not an abstract or future scenario. This summer alone, 23 percent of the world's oceans experienced a heat wave, corresponding to an area roughly equivalent to the entire Atlantic Ocean.",https://scx2.b-cdn.net/gfx/news/hires/2020/marine.jpg,2023-10-04T14:58:04Z,,"Extreme ocean changes due to climate change are not an abstract or future scenario. This summer alone, 23 percent of the world's oceans experienced a heat wave, corresponding to an area roughly equiv… [+5784 chars]",,en,Heat Wave Canada,Heat Wave,wmo,Canada,NEN,North-America
https://phys.org/news/2023-10-economists-severely-underestimated-financial-climate.html,https://phys.org/news/2023-10-economists-severely-underestimated-financial-climate.html,0,phys.org,Have some economists severely underestimated the financial hit from climate change? Recent evidence suggests yes,"Scientists say severe climate change is now the greatest threat to humanity. Extreme weather is expected to upend lives and livelihoods, intensifying wildfires and pushing ecosystems towards collapse as ocean heat waves savage coral reefs. The threats are far…",https://scx2.b-cdn.net/gfx/news/hires/2023/have-some-economists-s.jpg,2023-10-04T15:08:04Z,,"Scientists say severe climate change is now the greatest threat to humanity. Extreme weather is expected to upend lives and livelihoods, intensifying wildfires and pushing ecosystems towards collapse… [+6854 chars]",,en,severe weather,Thunderstorm,random,,,
https://economictimes.indiatimes.com/news/india/nepal-quake-triggered-sikkim-disaster-scientists-to-find-out/articleshow/104166842.cms,https://economictimes.indiatimes.com/news/india/nepal-quake-triggered-sikkim-disaster-scientists-to-find-out/articleshow/104166842.cms,0,economictimes.indiatimes.com,Nepal quake triggered Sikkim disaster? Scientists to find out,"Scientists are investigating whether the recent earthquake in Nepal caused the south Lhonak lake to burst, leading to a flash flood in the Teesta river basin in Sikkim. The lake outburst also resulted in the breach of the Chungthang dam, the largest hydropowe…","https://img.etimg.com/thumb/msid-104166857,width-1200,height-630,imgsize-103640,overlay-economictimes/photo.jpg",2023-10-04T16:44:54Z,,"Scientists are exploring whether the strong earthquake that struck Nepal and the surrounding region on Tuesday is responsible for the south Lhonak lake outburst, which triggered a flash flood in the … [+6817 chars]",,en,Earthquake CA,Earthquake,usgs,CA,WNA,North-America
https://www.cnn.com/2023/10/04/weather/tropical-storm-philippe-northeast-flood-climate/index.html,https://www.cnn.com/2023/10/04/weather/tropical-storm-philippe-northeast-flood-climate/index.html,0,www.cnn.com,How Tropical Storm Philippe could muck up weather in the Northeast this weekend,"Tropical Storm Philippe will interact with a potent cold front this weekend and funnel tropical moisture across the Northeast, raising the risk of flooding rainfall in an area that has been soaked repeatedly in recent weeks.","https://media.cnn.com/api/v1/images/stellar/prod/231004123647-tropical-storm-philippe-100423.jpg?c=16x9&q=w_800,c_fill",2023-10-04T17:37:19Z,,"Tropical Storm Philippe will interact with a potent cold front this weekend and funnel tropical moisture across the Northeast, raising the risk of flooding rainfall in an area that has been soaked re… [+3072 chars]",,en,storm,Storm,random,,,
https://news.climate.columbia.edu/2023/10/04/study-identifies-jet-stream-pattern-that-locks-in-extreme-winter-cold-wet-spells/,https://news.climate.columbia.edu/2023/10/04/study-identifies-jet-stream-pattern-that-locks-in-extreme-winter-cold-wet-spells/,0,news.climate.columbia.edu,"Study Identifies Jet-Stream Pattern That Locks in Extreme Winter Cold, Wet Spells","Recently, scientists connected giant waves in the global jet stream to hot, dry spells gripping widely separated parts of the planet at the same time. Now they have done the same for winter weather.",https://news.climate.columbia.edu/wp-content/uploads/2023/08/Wave4_Temperatures-637x169.png,2023-10-04T17:39:45Z,,"Winter is comingeventually. And while the earth is warming, a new study suggests that the atmosphere is being pushed around in ways that cause long bouts of extreme winter cold or wet in some regions… [+5693 chars]",,en,cold spell,Cold Wave,random,,,
https://www.ndtv.com/world-news/6-3-magnitude-earthquake-hits-philippines-4450865,https://www.ndtv.com/world-news/6-3-magnitude-earthquake-hits-philippines-4450865,0,www.ndtv.com,6.3 Magnitude Earthquake Hits Philippines,"An earthquake of magnitude 6.3 on the Richer scale jolted the Philippines on Wednesday, the National Center of Seismology (NCS) informed through a post on social media.",https://i.ndtvimg.com/i/2017-09/earthquake-generic_650x400_71505899871.jpg,2023-10-04T17:57:16Z,,"Earlier in June, a deep earthquake shook parts of the Philippines (Representational)
Manila: An earthquake of magnitude 6.3 on the Richer scale jolted the Philippines on Wednesday, the National Cent… [+1346 chars]",,en,earthquake,Earthquake,random,,,
https://offgridsurvival.com/banks-sound-alarm-a-looming-economic-crisis-as-inflation-spirals-out-of-control/,https://offgridsurvival.com/banks-sound-alarm-a-looming-economic-crisis-as-inflation-spirals-out-of-control/,0,offgridsurvival.com,Red Flags Everywhere: U.S. Economic Collapse and Social Unrest Storm Ahead,"Red Flags Everywhere: U.S. Economic Collapse and Social Unrest Storm Ahead
America stands on the precipice of an economic collapse. Unaffordable homes, surging bond yields, an unprecedented rise in credit card losses, and a surge in bankruptcy filings are all…",https://offgridsurvival.com/wp-content/themes/church_10/images/2023/10/lawlessamerica.jpg,2023-10-04T18:38:23Z,,"With alarming reports showing inflation skyrocketing and that is even with the BS numbers they are admitting to — and a significant drop in income for US households, it’s becoming increasingly clear:… [+7750 chars]",,en,storm surge,Storm Surge,random,,,
https://www.sciencedaily.com/releases/2023/10/231004150554.htm,https://www.sciencedaily.com/releases/2023/10/231004150554.htm,0,www.sciencedaily.com,"Study identifies jet-stream pattern that locks in extreme winter cold, wet spells","Winter is coming—eventually. And while the earth is warming, a new study suggests that the atmosphere is being pushed around in ways that cause long bouts of extreme winter cold or wet in some regions. The study’s authors say they have identified giant meande…",https://www.sciencedaily.com/images/scidaily-icon.png,2023-10-04T19:05:54Z,,"Winter is coming -- eventually. And while the earth is warming, a new study suggests that the atmosphere is being pushed around in ways that cause long bouts of extreme winter cold or wet in some reg… [+5480 chars]",,en,cold spell,Cold Wave,random,,,
