index,url,valid,domain,title,description,image,published,archive,content,quote,language,term,topic,feed,country,ipcc,continent
https://www.aljazeera.com/news/2024/11/6/hurricane-rafael-becomes-a-category-2-storm-as-it-nears-cuba,https://www.aljazeera.com/news/2024/11/6/hurricane-rafael-becomes-a-category-2-storm-as-it-nears-cuba,0,www.aljazeera.com,Hurricane Rafael becomes a Category 2 storm as it nears Cuba,Rafael continues to strengthen and forecast to be near major Category 3 hurricane status at landfall in western Cuba.,https://www.aljazeera.com/wp-content/uploads/2024/11/2024-11-05T194831Z_365714265_RC25ZAAZPINA_RTRMADP_3_STORM-RAFAEL-CUBA-1730901548.jpg?resize=1920%2C1440,2024-11-06T14:52:35Z,https://web.archive.org/web/20241108230858/https://www.aljazeera.com/news/2024/11/6/hurricane-rafael-becomes-a-category-2-storm-as-it-nears-cuba,"Hurricane Rafael has intensified into a Category 2 hurricane just hours before it is forecast to make landfall in Cuba, according to the United States National Weather Service.
Hurricane Rafael is l… [+3014 chars]",,en,hurricane,Tropical Cyclone,random,,,
https://biztoc.com/x/39df16376415529b,https://biztoc.com/x/39df16376415529b,0,biztoc.com,Carnival Cruise and Royal Caribbean share new hurricane warnings,"While most of the nation was distracted by the election, Tropical Storm Rafael grew into Hurricane Rafael. Carnival Cruise Line's consulting meteorologist, Amy Sweezy, shared her thoughts on the growing storm on the morning of Nov. 6.
""Hi everybody. Meteorolo…",https://biztoc.com/cdn/39df16376415529b_s.webp,2024-11-06T15:18:53Z,,"While most of the nation was distracted by the election, Tropical Storm Rafael grew into Hurricane Rafael. Carnival Cruise Line's consulting meteorologist, Amy Sweezy, shared her thoughts on the grow… [+147 chars]",,en,Tropical Storm Rafael,Tropical Cyclone,eonet,,CAR,North-America
https://www.insurancejournal.com/news/southeast/2024/11/06/800297.htm,https://www.insurancejournal.com/news/southeast/2024/11/06/800297.htm,0,www.insurancejournal.com,Florida’s Citizens Suspends Binding on Policies as Another Storm Churns in the Gulf,"Florida’s state-created Citizens Property Insurance Corp., the largest insurer in the state, has suspended binding on policies, statewide, as yet another hurricane approaches from the Carribbean Sea and Gulf of Mexico. As of Monday, Nov. 4, “Agents may not bi…",https://www.insurancejournal.com/app/uploads/2024/11/Rafael.png,2024-11-06T15:49:17Z,,"Florida’s state-created Citizens Property Insurance Corp., the largest insurer in the state, has suspended binding on policies, statewide, as yet another hurricane approaches from the Carribbean Sea … [+995 chars]",,en,Storm Mexico,Storm,wmo,Mexico,NCA,North-America
https://www.commondreams.org/opinion/questions-for-2nd-trump-term,https://www.commondreams.org/opinion/questions-for-2nd-trump-term,0,www.commondreams.org,"As Always, It’s Up to Us: Questions for a Second Trump Presidency","Former U.S. President Donald Trump won a second term. Handily. I see, already, the overwhelming dread flooding my social media. After all, Americans elected a man who has bragged about grabbing women by the pussy, who has bred fear and hatred toward Central A…",https://www.commondreams.org/media-library/climate-protests-at-trump-rally.jpg?id=54282944&width=1200&height=600&coordinates=0%2C101%2C0%2C101,2024-11-06T16:10:00Z,,"Former U.S. President Donald Trump won a second term. Handily. I see, already, the overwhelming dread flooding my social media. After all, Americans elected a man who has bragged about grabbing women… [+5790 chars]",,en,Flooding s,Flood,emdat,Spain,MED,Europe
https://www.newsweek.com/hurricane-rafael-spaghetti-models-florida-warned-storm-conditions-1981352,https://www.newsweek.com/hurricane-rafael-spaghetti-models-florida-warned-storm-conditions-1981352,0,www.newsweek.com,Hurricane Rafael Spaghetti Models as Florida Warned of Storm Conditions,Rafael is expected to maintain hurricane intensity Thursday through Friday as it moves northwestward across the southeastern Gulf.,https://d.newsweek.com/en/full/2514260/spaghetti-model-em.png,2024-11-06T16:29:23Z,,"The National Hurricane Center (NHC) has issued an advisory warning residents across Florida to prepare for potential impacts as Hurricane Rafael approaches the state.
The storm, currently moving nor… [+3012 chars]",,en,hurricane,Tropical Cyclone,random,,,
https://www.miamiherald.com/news/weather/hurricane/article295145954.html,https://www.miamiherald.com/news/weather/hurricane/article295145954.html,0,www.miamiherald.com,"Latest update from the NHC on Category 3 Hurricane Rafael for Wednesday, Nov 6",Here’s the latest on Category 3 Hurricane Rafael,https://media.zenfs.com/en/miami_herald_mcclatchy_975/b9d75ee851bacb033f1b64da18df53f1,2024-11-06T18:18:01Z,,"Article first published: Wednesday, Nov. 6, 2024, 4 a.m. ET
Article last updated: Wednesday, Nov. 6, 2024, 1 p.m. ET
The National Hurricane Center's 1 pm Wednesday advisory reported that Category 3… [+4245 chars]",,en,hurricane,Tropical Cyclone,random,,,
https://www.newsweek.com/hurricane-rafael-texas-storm-forecast-amid-path-shift-1981523,https://www.newsweek.com/hurricane-rafael-texas-storm-forecast-amid-path-shift-1981523,0,www.newsweek.com,Will Hurricane Rafael Reach Texas? Storm Forecast Amid Path Shift,Hurricane Rafael is expected to become a major storm later Wednesday before hitting Cuba and then exiting into the Gulf of Mexico.,https://d.newsweek.com/en/full/2514440/will-hurricane-rafael-reach-texas-storm-forecast.png,2024-11-06T18:21:55Z,,"Hurricane Rafael's path has shifted slightly to the west, with the storm now taking aim at southern Texas after it enters the Gulf of Mexico later this week.
Rafael became a hurricane on Tuesday nig… [+3024 chars]",,en,hurricane,Tropical Cyclone,random,,,
https://www.the-sun.com/news/12837807/ufos-next-to-double-rainbow-before-spain-floods/,https://www.the-sun.com/news/12837807/ufos-next-to-double-rainbow-before-spain-floods/,0,www.the-sun.com,UFOs appear in sky above Spain next to double rainbow -- before deadly flash floods hit...,"UFOs appear in sky above Spain next to double rainbow -- before deadly flash floods hit...

 
 
 
 (Third column, 14th story, link)

 

 

 
 Related stories:Health concerns about NASA astronauts stranded on ISS after 'gaunt' new photo...",https://www.the-sun.com/wp-content/uploads/sites/6/2024/11/newspress-collage-4n0ukxr9j-1730903026955.jpg?1730895042&strip=all&quality=100&w=1920&h=1080&crop=1,2024-11-06T23:13:38Z,https://web.archive.org/web/20241106234356/https://www.the-sun.com/news/12837807/ufos-next-to-double-rainbow-before-spain-floods/,"THIS is the moment ominous 'UFOs' were spotted hovering next to a double rainbow in Spain - just before the devastating floods hit.
Ambiguous footage seems to show a cluster of unidentified lights w… [+3553 chars]",,en,flash flood,Flood,random,,,
https://time.com/7173663/world-temperature-record-hottest-year-ever-again/,https://time.com/7173663/world-temperature-record-hottest-year-ever-again/,0,time.com,The World Is Having Its Hottest Year Ever—Again,"Scientists say the long-term increase in temperatures, driven by the constant increase of greenhouse gases in the atmosphere, is a bad sign.",https://api.time.com/wp-content/uploads/2024/11/2024-hottest-year.jpg?quality=85&w=1200&h=628&crop=1,2024-11-07T05:00:00Z,https://web.archive.org/web/20241107064709/https://time.com/7173663/world-temperature-record-hottest-year-ever-again/,"For the second year in a row, Earth will almost certainly be the hottest its ever been. And for the first time, the globe this year reached more than 1.5 degrees Celsius (2.7 degrees Fahrenheit) of w… [+4337 chars]",,en,hottest year,Heat Wave,random,,,
https://www.ndtv.com/world-news/saudi-arabian-desert-sees-snowfall-for-the-first-time-in-history-check-photos-and-videos-6962851,https://www.ndtv.com/world-news/saudi-arabian-desert-sees-snowfall-for-the-first-time-in-history-check-photos-and-videos-6962851,0,www.ndtv.com,Watch: Saudi Arabian Desert Sees Snowfall For The First Time In History,This unprecedented phenomenon follows intense rain and hail storms that swept across the Kingdom.,https://c.ndtvimg.com/2024-11/1mab5o3g_saudi-arabian-desert-snowfall_625x300_07_November_24.jpeg,2024-11-07T06:03:44Z,http://archive.md/20241110043113/https://www.ndtv.com/world-news/saudi-arabian-desert-sees-snowfall-for-the-first-time-in-history-check-photos-and-videos-6962851,"In a groundbreaking weather event, Saudi Arabia's Al-Jawf region has experienced its first-ever recorded snowfall, transforming the arid desert landscape into a breathtaking winter wonderland. This u… [+2713 chars]",,en,Rain Saudi Arabia,Precipitation,wmo,Saudi Arabia,ARP,Asia
https://skepticalscience.com/new_research_2024_45.html,https://skepticalscience.com/new_research_2024_45.html,0,skepticalscience.com,Skeptical Science New Research for Week #45 2024,"Open access notables
Anthropogenic warming has ushered in an era of temperature-dominated droughts in the western United States, Zhuang et al., Science Advances:

Historically, meteorological drought in the western United States (WUS) has been driven primaril…",https://skepticalscience.com/public/assets/images/og/button_sks_200.jpg,2024-11-07T08:19:36Z,,"Posted on 7 November 2024 by Doug Bostrom, Marc Kodack
Open access notables
Anthropogenic warming has ushered in an era of temperature-dominated droughts in the western United States, Zhuang et al.… [+40194 chars]",,en,Drought United States,Drought,wmo,United States,CNA,North-America
https://www.voanews.com/a/european-climate-agency-says-this-will-likely-be-the-hottest-year-on-record----again-/7854854.html,https://www.voanews.com/a/european-climate-agency-says-this-will-likely-be-the-hottest-year-on-record----again-/7854854.html,0,www.voanews.com,European climate agency says this will likely be the hottest year on record -- again,"CHICAGO — For the second year in a row, Earth will almost certainly be the hottest it's ever been. And for the first time, the globe this year reached more than 1.5 degrees Celsius of warming compared to the pre-industrial average, the European climate agency…",https://gdb.voanews.com/4E3C9DE8-E098-47CB-89CC-1A02699A2B24.jpg,2024-11-07T08:30:09Z,,"CHICAGO  For the second year in a row, Earth will almost certainly be the hottest it's ever been. And for the first time, the globe this year reached more than 1.5 degrees Celsius of warming compared… [+4108 chars]",,en,hottest year,Heat Wave,random,,,
https://www.jpost.com/middle-east/iran-news/article-828031,https://www.jpost.com/middle-east/iran-news/article-828031,0,www.jpost.com,"Biden administration faces transition amid global conflicts, declining US influence","The wars in Ukraine and the Middle East are part of a broader shift in the world order. Russia, China, Iran, and other countries are trying to re-make the world order.","https://images.jpost.com/image/upload/f_auto,fl_lossy/c_fill,g_faces:center,h_407,w_690/631913",2024-11-07T14:15:46Z,http://archive.md/20241107143940/https://www.jpost.com/middle-east/iran-news/article-828031,The Biden administration is preparing for the transition to the incoming Trump administration. That transition will take place over the next two months. US President Joe Biden will leave office with … [+8497 chars],,en,Rain China,Precipitation,wmo,China,EAS,Asia
https://www.pbs.org/newshour/world/european-climate-agency-says-this-will-likely-be-the-hottest-year-on-record-again,https://www.pbs.org/newshour/world/european-climate-agency-says-this-will-likely-be-the-hottest-year-on-record-again,0,www.pbs.org,European climate agency says this will likely be the hottest year on record -- again,"A United Nations report this year said that since the mid-1800s on average, the world has already heated up 1.3 degrees Celsius (2.3 degrees Fahrenheit) -- up from previous estimates of 1.1 degrees (2 degrees Fahrenheit) or 1.2 degrees (2.2 degrees Fahrenheit…",https://d3i6fh83elv35t.cloudfront.net/static/2024/11/2024-07-19T005747Z_2144923389_RC2SX8ATXAJG_RTRMADP_3_CLIMATE-FLORIDA-HOMELESS-1024x683.jpg,2024-11-07T16:30:37Z,,"CHICAGO (AP) For the second year in a row, Earth will almost certainly be the hottest it’s ever been. And for the first time, the globe this year reached more than 1.5 degrees Celsius (2.7 degrees Fa… [+5456 chars]",,en,hottest year,Heat Wave,random,,,
https://www.bostonherald.com/2024/11/07/climate-change-hottest-year-ever/,https://www.bostonherald.com/2024/11/07/climate-change-hottest-year-ever/,0,www.bostonherald.com,European climate agency says this will likely be the hottest year on record — again,Scientists say this milestone in global temperature records should inspire ambition from countries at the upcoming UN climate change summit.,https://www.bostonherald.com/wp-content/uploads/2024/11/Climate_Hottest_Year_29036.jpg?w=1024&h=682,2024-11-07T16:31:16Z,,"By MELINA WALLING
CHICAGO (AP) — For the second year in a row, Earth will almost certainly be the hottest it’s ever been. And for the first time, the globe this year reached more than 1.5 degrees Ce… [+7209 chars]",,en,hottest year,Heat Wave,random,,,
https://www.space.com/the-universe/earth/noaa-satellites-watch-hurricane-rafael-make-landfall-in-cuba-video,https://www.space.com/the-universe/earth/noaa-satellites-watch-hurricane-rafael-make-landfall-in-cuba-video,0,www.space.com,NOAA satellites watch Hurricane Rafael make landfall in Cuba (video),"Rafael made landfall in Cuba Wednesday (Nov. 6), and NOAA's GOES satellites have been monitoring the storm every step of the way.",https://cdn.mos.cms.futurecdn.net/LMgYLggfp3VPWhyBnWCa9P-1200-80.gif,2024-11-07T21:33:31Z,http://wayback.archive-it.org/all/20241109083624/https://www.space.com/the-universe/earth/noaa-satellites-watch-hurricane-rafael-make-landfall-in-cuba-video,"As we go into the final days of November, the National Oceanic and Atmospheric Administration (NOAA)'s GOES-East satellite
 is busy keeping a watchful eye on what's now the 17th storm of the season.… [+3117 chars]",,en,Storm Cuba,Storm,emdat,Cuba,CAR,North-America
https://www.forbes.com/sites/davidaxe/2024/11/07/russian-and-north-korean-troops-storm-kursk-apparently-aiming-to-take-advantage-of-trumps-armistice-plan/,https://www.forbes.com/sites/davidaxe/2024/11/07/russian-and-north-korean-troops-storm-kursk-apparently-aiming-to-take-advantage-of-trumps-armistice-plan/,0,www.forbes.com,"Russian And North Korean Troops Storm Kursk, Apparently Aiming To Take Advantage Of Trump’s Armistice Plan",Trump’s plan appears to be unenforceable.,https://imageio.forbes.com/specials-images/imageserve/672d3f9ac18a059c9c13d904/0x0.jpg?format=jpg&height=900&width=1600&fit=bounds,2024-11-07T22:50:02Z,http://archive.md/20241108140159/https://www.forbes.com/sites/davidaxe/2024/11/07/russian-and-north-korean-troops-storm-kursk-apparently-aiming-to-take-advantage-of-trumps-armistice-plan/,"Russian marines and BTRs retreat during an October assault in Kursk.
Ukrainian defense ministry capture
Russian marines apparently backed by North Korean reinforcements threw themselves at Ukrainia… [+3282 chars]",,en,storm,Storm,random,,,
https://www.naturalnews.com/2024-11-08-ryan-routh-warns-trump-victory-end-democracy.html,https://www.naturalnews.com/2024-11-08-ryan-routh-warns-trump-victory-end-democracy.html,0,www.naturalnews.com,Would-be Trump assassin Ryan Routh warns from prison that victory for former president will spell “the end of democracy”,"The second guy who tried to kill President Trump earlier this year is warning America that “civil war” is next now that Trump has won a second term. Right before Trump actually won by a landslide, Ryan Wesley Routh wrote a letter to the Palm Beach Post from h…",https://www.naturalnews.com/wp-content/uploads/sites/91/2024/11/routh-stock.jpg,2024-11-08T06:00:00Z,https://web.archive.org/web/20241110024505/https://www.naturalnews.com/2024-11-08-ryan-routh-warns-trump-victory-end-democracy.html,"The second guy who tried to kill President Trump earlier this year is warning America that ""civil war"" is next now that Trump has won a second term.
Right before Trump actually won by a landslide, R… [+3225 chars]",,en,Landslide Ning er,Landslide,wmo,China,EAS,Asia
https://www.wnd.com/2024/11/2-things-that-should-happen-now-after-trump-landslide/,https://www.wnd.com/2024/11/2-things-that-should-happen-now-after-trump-landslide/,0,www.wnd.com,2 things that should happen now after Trump landslide,'This is going to be a great four years coming up. I can feel it. How about you?',https://www.wnd.com/wp-content/uploads/2024/11/donald-trump-called-47th-president-fox-news-jpg.jpg,2024-11-09T06:56:04Z,https://web.archive.org/web/20241109163301/https://www.wnd.com/2024/11/2-things-that-should-happen-now-after-trump-landslide/,"OK, first things first. I have to take a victory lap. Muhammad Ali said, “It’s not bragging if you can back it up.” I can back it up.
I was the only TV host in America to stick his neck on the line … [+5207 chars]",,en,landslide,Landslide,random,,,
https://www.digitaljournal.com/world/south-sudan-floods-affect-1-4-million-displace-379000-un/article,https://www.digitaljournal.com/world/south-sudan-floods-affect-1-4-million-displace-379000-un/article,0,www.digitaljournal.com,"South Sudan floods affect 1.4 million, displace 379,000: UN","Devastating flooding in South Sudan is affecting around 1.4 million people, with more than 379,000 displaced, according to a United Nations update that warned about an upsurge in malaria. Aid agencies have said that the world’s youngest country, highly vulner…",https://www.digitaljournal.com/wp-content/uploads/2024/11/ac339ff86b9c372cf013b7726d9832d4de8ca9dd.jpg,2024-11-09T08:43:15Z,https://web.archive.org/web/20241109162922/https://www.digitaljournal.com/world/south-sudan-floods-affect-1-4-million-displace-379000-un/article,"South Sudan is frequently hit by flooding - Copyright AFP Banaras KHAN
Devastating flooding in South Sudan is affecting around 1.4 million people, with more than 379,000 displaced, according to a Un… [+2432 chars]",,en,flooding,Flood,random,,,
https://timesofindia.indiatimes.com/world/rest-of-world/south-sudan-floods-affect-1-4-million-displace-379000-un/articleshow/115110305.cms,https://timesofindia.indiatimes.com/world/rest-of-world/south-sudan-floods-affect-1-4-million-displace-379000-un/articleshow/115110305.cms,0,timesofindia.indiatimes.com,"South Sudan floods affect 1.4 million, displace 379,000: UN","Devastating flooding in South Sudan is affecting around 1.4 million people, with more than 379,000 displaced, according to a United Nations update that warned about an upsurge in malaria. The United Nations Office for the Coordination of Humanitarian Affairs …","https://static.toiimg.com/thumb/msid-115110410,width-1070,height-580,imgsize-469205,resizemode-75,overlay-toi_sw,pt-32,y_pad-40/photo.jpg",2024-11-09T09:00:56Z,https://web.archive.org/web/20241109205438/https://timesofindia.indiatimes.com/world/rest-of-world/south-sudan-floods-affect-1-4-million-displace-379000-un/articleshow/115110305.cms,10 reasons why Indian Thali is considered the greenest,,en,Flooding s,Flood,emdat,Spain,MED,Europe
https://www.cnet.com/home/winter-storm-cheat-sheet-experts-tips-on-protecting-your-home/,https://www.cnet.com/home/winter-storm-cheat-sheet-experts-tips-on-protecting-your-home/,0,www.cnet.com,Winter Storm Cheat Sheet: Experts Tips On Protecting Your Home,"As winter blizzards bring snow and ice, here's everything you need to know about protecting your house from the cold.",https://www.cnet.com/a/img/resize/d9510b4310940088b395447428d5a30e4e026bc4/hub/2024/11/06/5b47b37c-37b0-4069-8738-f69699b6e3ee/gettyimages-157315002.jpg?auto=webp&fit=crop&height=675&width=1200,2024-11-09T13:00:00Z,,"Winter weather -- especially in the colder regions of the United States -- brings blizzards, snowstorms, windstorms and other problems for homeowners. These storms make trips to work or school a pain… [+1604 chars]",,en,blizzard,Storm,random,,,
https://zycrypto.com/shiba-inu-eyes-2000-bull-storm-as-trumps-win-mints-12000-new-crypto-millionaires/,https://zycrypto.com/shiba-inu-eyes-2000-bull-storm-as-trumps-win-mints-12000-new-crypto-millionaires/,0,zycrypto.com,"Shiba Inu Eyes 2000% Bull Storm as Trump’s Win Mints 12,000 New Crypto Millionaires",Shiba Inu (SHIB) might be gearing up for a notable leg-up thanks to the formation of a bullish pennant consolidation.,https://zycrypto.com/wp-content/uploads/2023/12/Shiba-Inu-Giant-Whales-Amass-Trillions-Of-Tokens-Amid-Outlook-For-New-SHIB-All-Time-High-Price.jpg,2024-11-09T14:42:26Z,,"Shiba Inu (SHIB) might be gearing up for a notable leg-up thanks to the formation of a bullish pennant consolidation. 
Renowned market analyst under the pseudonym World of Charts disclosed this deve… [+1352 chars]",,en,storm,Storm,random,,,
https://www.independent.ie/sport/soccer/international-soccer/heimir-hallgrimsson-players-mentality-will-elevate-ireland-results/a2027748817.html,https://www.independent.ie/sport/soccer/international-soccer/heimir-hallgrimsson-players-mentality-will-elevate-ireland-results/a2027748817.html,0,www.independent.ie,Heimir Hallgrimsson: Players’ mentality will elevate Ireland results,"Ahead of Heimir Hallgrimsson’s first game in charge of the Republic of Ireland, there was a media-led storm with unprecedented levels of insanity, delusion and sheer hatred, over whether the manager of an international team should sing that side’s national an…",https://focus.independent.ie/thumbor/d4tPm9MTzmKKOX6D8XBoP7WtH9Y=/199x15:3192x2009/629x0/prod-mh-ireland/2d8f561e-ae51-4417-b701-99d60ea89772/32252f9a-419b-4d5d-a709-9fa3552b7a51/2d8f561e-ae51-4417-b701-99d60ea89772.jpg,2024-11-10T02:30:00Z,,"Ahead of Heimir Hallgrimssons first game in charge of the Republic of Ireland, there was a media-led storm with unprecedented levels of insanity, delusion and sheer hatred, over whether the manager o… [+4676 chars]",,en,Storm LeD,Storm,wmo,Norway,NEU,Europe
https://www.thestar.com.my/news/world/2024/11/11/greek-fireman-dies-in-wildfire-in-northern-greece,https://www.thestar.com.my/news/world/2024/11/11/greek-fireman-dies-in-wildfire-in-northern-greece,0,www.thestar.com.my,Greek fireman dies in wildfire in northern Greece,"ATHENS, Nov. 10 (Xinhua) -- A 55-year-old Greek fireman died Sunday while battling a wildfire in northern Greece on the outskirts of Thessaloniki port city, Greece's Fire Brigade said. Read full story",https://cdn.thestar.com.my/Themes/img/newTsol_logo_socmedia.png,2024-11-10T19:26:00Z,,"ATHENS, Nov. 10 (Xinhua) -- A 55-year-old Greek fireman died Sunday while battling a wildfire in northern Greece on the outskirts of Thessaloniki port city, Greece's Fire Brigade said.
 The fire, wh… [+709 chars]",,en,Wild Fire Greece,Wildfire,effis,Greece,MED,Europe
https://www.cnn.com/2024/11/10/americas/earthquake-cuba-intl-latam/index.html,https://www.cnn.com/2024/11/10/americas/earthquake-cuba-intl-latam/index.html,0,www.cnn.com,6.8 magnitude earthquake strikes off coast of eastern Cuba | CNN,"A 6.8 magnitude earthquake struck off the coast of eastern Cuba on Sunday, causing material damage in several regions as the island continues to recover from widespread blackouts and the impact of two hurricanes over the past few weeks.","https://media.cnn.com/api/v1/images/stellar/prod/still-21114390-8872-331-still-copy.jpg?c=16x9&q=w_800,c_fill",2024-11-10T20:42:06Z,http://archive.md/20241110210142/https://www.cnn.com/2024/11/10/americas/earthquake-cuba-intl-latam/index.html,"A 6.8 magnitude earthquake struck off the coast of eastern Cuba on Sunday, causing material damage in several regions as the island continues to recover from widespread blackouts and the impact of tw… [+1873 chars]",,en,Earthquake Cuba,Earthquake,usgs,Cuba,CAR,North-America
https://freerepublic.com/focus/f-news/4277462/posts,https://freerepublic.com/focus/f-news/4277462/posts,0,freerepublic.com,Hundreds of Illegal Immigrants Storm NYC Streets Protesting Trump Win,"Hundreds of illegal immigrants are protesting President-elect Donald Trump’s election win as he promises to execute immigration laws on day one of his second term. On Saturday, massive groups of illegal aliens took to the streets to protest Trump’s pending im…",,2024-11-10T21:15:19Z,,"Skip to comments.
Hundreds of Illegal Immigrants Storm NYC Streets Protesting Trump WinTownhall ^
 | 11/9/2024
 | Sarah Arnold
Posted on 11/10/2024 1:15:19 PM PST by simpson96
Hundreds of illega… [+4968 chars]",,en,storm,Storm,random,,,
https://www.aljazeera.com/news/2024/11/10/earthquake-rocks-cuba-as-residents-struggle-to-recover-from-recent-storms,https://www.aljazeera.com/news/2024/11/10/earthquake-rocks-cuba-as-residents-struggle-to-recover-from-recent-storms,0,www.aljazeera.com,Earthquake rocks Cuba as residents struggle to recover from recent storms,Officials say efforts to assess damage are under way after 6.8-magnitude earthquake hits eastern Cuba.,https://www.aljazeera.com/wp-content/uploads/2024/11/AP24312648485082-1731278427.jpg?resize=1200%2C675,2024-11-10T23:05:06Z,,"A powerful earthquake has hit eastern Cuba, adding more problems to a country still reeling from a series of recent storms and blackouts.
The United States Geological Survey (USGS) reported on Sunda… [+2188 chars]",,en,storm,Storm,random,,,
