index,url,valid,domain,title,description,image,published,archive,content,quote,language,term,topic,feed,country,ipcc,continent
https://www.channelnewsasia.com/sport/mexico-vs-ecuador-world-cup-last-32-match-delayed-storms-6223231,https://www.channelnewsasia.com/sport/mexico-vs-ecuador-world-cup-last-32-match-delayed-storms-6223231,0,www.channelnewsasia.com,Mexico vs Ecuador World Cup last-32 match delayed by storms,"MEXICO CITY: The World Cup last-32 game between Mexico and Ecuador at the Estadio Azteca on Tuesday (Jun 30) has been delayed by heavy rain, a message on the stadium scoreboard said.""The match has been delayed,"" said the message, with the players not yet havi…","https://dam.mediacorp.sg/image/upload/s--qg4OPDn5--/c_crop,h_449,w_799,x_1,y_1/c_fill,g_auto,h_676,w_1200/fl_relative,g_south_east,l_mediacorp:cna:watermark:2024-04:reuters_1,w_0.1/f_auto,q_auto/v1/one-cms/core/2026-07-01T002856Z_1_LYNXMPEM601VS_RTROPTP_3_SOCCER-WORLDCUP-MEX-ECU.JPG?itok=9rQJdlSI",2026-07-01T00:28:00Z,,"MEXICO CITY: The World Cup last-32 game between Mexico and Ecuador at the Estadio Azteca on Tuesday (Jun 30) has been delayed by heavy rain, a message on the stadium scoreboard said.
""The match has … [+546 chars]",,en,heavy rain,Precipitation,random,,,
https://wattsupwiththat.com/2026/06/30/wrong-newsweek-europes-heat-deaths-are-a-policy-failure-not-a-climate-failure/,https://wattsupwiththat.com/2026/06/30/wrong-newsweek-europes-heat-deaths-are-a-policy-failure-not-a-climate-failure/,0,wattsupwiththat.com,"Wrong, Newsweek, Europe’s Heat Deaths Are a Policy Failure, not a Climate Failure","Europe’s recurring heat deaths are the predictable consequence of governments discouraging the very technology that has protected Americans, and elites in in their own countries, from deadly summer heat for generations.
The post Wrong, Newsweek, Europe’s Heat…",https://i0.wp.com/wattsupwiththat.com/wp-content/uploads/2026/06/newsweek-misleading-heatwave-Topaz-Gigapixel-2x-scale.webp?fit=1024%2C513&quality=75&ssl=1,2026-07-01T01:00:00Z,,"Newsweek claims in the recent article, Hundreds Die in Record-Breaking Europe Heat Wave: How Long Will It Last, that the current deadly European heat wave demonstrates the growing dangers of climate … [+7759 chars]",,en,heat,Heat Wave,random,,,
https://www.elpasotimes.com/story/sports/soccer/2026/06/30/mexico-vs-ecuador-delayed-by-lightning/90762295007/,https://www.elpasotimes.com/story/sports/soccer/2026/06/30/mexico-vs-ecuador-delayed-by-lightning/90762295007/,0,www.elpasotimes.com,Why is Mexico game delayed? Storm pushes back World Cup match vs. Ecuador,Severe weather at Estadio Azteca has delayed the Mexico vs. Ecuador World Cup match by one hour.,https://s.yimg.com/ny/api/res/1.2/xlR.aYAU4tqU0SG2QoJMsA--/YXBwaWQ9aGlnaGxhbmRlcjt3PTEyMDA7aD03OTg7Y2Y9d2VicA--/https://media.zenfs.com/en/the-el-paso-times/bb4f7aae24492beca08ddfc11a6172fd,2026-07-01T01:15:56Z,,"The Mexico vs. Ecuador round of 32 match at the FIFA World Cup at Estadio Azteca has been delayed by lightning and rain and is now projected to start an hour late at 8 p.m. MT/9 p.m. CT.
The storm s… [+666 chars]",,en,Storm Ecuador,Storm,wmo,Ecuador,NWS,South-America
https://biztoc.com/x/5106670c9147bb0b,https://biztoc.com/x/5106670c9147bb0b,0,biztoc.com,Mexico-Ecuador World Cup match delayed 1 hour by a storm in Mexico City,"Mexico-Ecuador World Cup match delayed 1 hour by a storm in Mexico City
Mexico-Ecuador World Cup match delayed 1 hour by a storm in Mexico City
MEXICO CITY (AP) — The match between Mexico and Ecuador for the round of 32 of the World Cup was delayed and will s…",https://biztoc.com/cdn/5106670c9147bb0b_s.webp,2026-07-01T01:26:34Z,,Mexico-Ecuador World Cup match delayed 1 hour by a storm in Mexico CityMexico-Ecuador World Cup match delayed 1 hour by a storm in Mexico CityMEXICO CITY (AP) The match between Mexico and Ecuador for… [+135 chars],,en,Storm Ecuador,Storm,wmo,Ecuador,NWS,South-America
https://www.hitc.com/fifa-reverse-decision-to-scrap-hydration-break-after-mexico-vs-ecuador-delayed-due-to-electrical-storm/,https://www.hitc.com/fifa-reverse-decision-to-scrap-hydration-break-after-mexico-vs-ecuador-delayed-due-to-electrical-storm/,0,www.hitc.com,FIFA reverse decision to scrap hydration break after Mexico vs Ecuador delayed due to electrical storm,"FIFA had confirmed that they would scrap the hydration break during Mexico’s World Cup round of 32 tie against Ecuador, only to reverse their decision moments later. Kick-off was delayed at the Azteca Stadium due to an electrical storm in the area that preven…",https://s.yimg.com/ny/api/res/1.2/ybcBhv.433cBoLnXP4ZvKA--/YXBwaWQ9aGlnaGxhbmRlcjt3PTEyMDA7aD04MDA7Y2Y9d2VicA--/https://media.zenfs.com/en/hitc_articles_832/98f968aa805ab774926247cad7f807aa,2026-07-01T01:51:55Z,,"FIFA had confirmed that they would scrap the hydration break during Mexicos World Cup round of 32 tie against Ecuador, only to reverse their decision moments later.
Kick-off was delayed at the Aztec… [+1318 chars]",,en,Storm Ecuador,Storm,wmo,Ecuador,NWS,South-America
https://economictimes.indiatimes.com/news/new-updates/imd-weather-update-yellow-alert-in-delhi-ncr-as-monsoon-advances-thunderstorms-alert-in-up-bihar-rajasthan-and-other-states/articleshow/132103940.cms,https://economictimes.indiatimes.com/news/new-updates/imd-weather-update-yellow-alert-in-delhi-ncr-as-monsoon-advances-thunderstorms-alert-in-up-bihar-rajasthan-and-other-states/articleshow/132103940.cms,0,economictimes.indiatimes.com,"IMD Weather Update: Yellow alert in Delhi-NCR as monsoon advances; thunderstorms alert in UP, Bihar, Rajasthan and other states","Delhi-NCR anticipates relief from heat with forecasts of light rain, thunderstorms, and gusty winds as the southwest monsoon advances. Several northern states, including Uttar Pradesh and Himachal Pradesh, are on alert for heavy rainfall and lightning.  Tempe…","https://img.etimg.com/thumb/msid-132103971,width-1200,height-630,imgsize-221704,overlay-economictimes/articleshow.jpg",2026-07-01T01:59:34Z,,"IMD Weather Update Today: Delhi-NCR woke up to a cloudy and humid morning on Tuesday, raising hopes of relief from the intense heat that has gripped the region for days. The India Meteorological Depa… [+6891 chars]",,en,thunderstorm,Thunderstorm,random,,,
https://cryptobriefing.com/fifa-delays-mexico-ecuador-world-cup-match/,https://cryptobriefing.com/fifa-delays-mexico-ecuador-world-cup-match/,0,cryptobriefing.com,FIFA delays Mexico vs. Ecuador World Cup match by one hour due to thunderstorms,"The delay highlights logistical challenges and safety concerns in hosting an expanded World Cup across diverse climates and altitudes.
The post FIFA delays Mexico vs. Ecuador World Cup match by one hour due to thunderstorms appeared first on Crypto Briefing.",https://static.cryptobriefing.com/wp-content/uploads/2026/06/30222436/our-month-in-ecuador-mitad-del-mundo-middle-of-the-earth-jen-800x420.jpeg,2026-07-01T02:24:44Z,,Severe lightning over Mexico City pushed the Round of 32 kickoff back as Ecuador's squad was already dealing with a grueling nine-hour travel day Weather doesn’t care about World Cup schedules. On Ju… [+1812 chars],,en,storm,Storm,random,,,
https://www.skysports.com/football/news/11095/13558814/world-cup-2026-mexico-2-0-ecuador-electric-hosts-storm-into-last-16-as-piero-hincapie-sees-red,https://www.skysports.com/football/news/11095/13558814/world-cup-2026-mexico-2-0-ecuador-electric-hosts-storm-into-last-16-as-piero-hincapie-sees-red,0,www.skysports.com,Mexico storm into World Cup last 16 to book potential England clash,A potential trip to the Azteca Stadium awaits England if they beat DR Congo on Wednesday after Mexico strolled past Ecuador 2-0 to reach the last 16 of the World Cup.,https://e0.365dm.com/26/07/1600x900/skysports-mexico-world-cup_7287027.jpg?20260701052724,2026-07-01T03:00:00Z,,"A potential trip to the Azteca Stadium awaits England if they beat DR Congo on Wednesday after Mexico strolled past Ecuador 2-0 to reach the last 16 of the World Cup.
Kick-off was delayed by an hour… [+1952 chars]",,en,Storm Ecuador,Storm,wmo,Ecuador,NWS,South-America
https://www.abc.net.au/news/2026-07-01/wet-wild-weather-hits-sa/106864298,https://www.abc.net.au/news/2026-07-01/wet-wild-weather-hits-sa/106864298,0,www.abc.net.au,More rain to follow overnight storm and 50k lightning strikes in parts of SA,Wet and wild weather is lashing parts of South Australia with the Bureau of Meteorology warning about wind risk during storms.,https://live-production.wcms.abc-cdn.net.au/7051edca73d090426aa08e78d782701c?impolicy=wcms_watermark_news&cropH=963&cropW=1712&xPos=208&yPos=364&width=862&height=485&imformat=generic,2026-07-01T03:23:43Z,,"Wet and wild weather is lashing parts of South Australia with the Bureau of Meteorology warning about wind risk during storms.
Bureau meteorologist Robert Urbaniak said 50,000 lightning strikes were… [+2865 chars]",,en,Storm Australia,Storm,wmo,Australia,CAU,Oceania
https://www.americanthinker.com/articles/2026/07/book-review-torched-by-jonathan-vigliotti/,https://www.americanthinker.com/articles/2026/07/book-review-torched-by-jonathan-vigliotti/,0,www.americanthinker.com,"Book Review: Torched, by Jonathan Vigliotti","Photo Credit:Book cover
 
 Book CoverFlames, firestorms, and abject Democrat failure are the clear and present themes throughout the CBS News correspondent’s brand new book.",https://images.americanthinker.com/wy/wymkbzx5hxeepqxtbqae_1200.jpg,2026-07-01T04:00:00Z,,"Flames, firestorms, and abject failure are the clear and present themes throughout CBS News correspondent Jonathan Vigliotti’s latest book, Torched.
Not just burned-out buildings and streets, not ju… [+7529 chars]",,en,storm,Storm,random,,,
https://onefootball.com/en/news/come-on-mexico-hosts-dominate-dump-out-ecuador-and-go-through-43080079,https://onefootball.com/en/news/come-on-mexico-hosts-dominate-dump-out-ecuador-and-go-through-43080079,0,onefootball.com,"Arriba Mexico! Hosts dominate, knock out Ecuador and advance! ","The mythical Azteca, which staged Brazil’s third World Cup title in 1970 and saw Maradona lead Argentina in 1986, lived through another historic chapter.Mexico ended a LONG winless drought in knocko...",https://s.yimg.com/lo/mysterio/api/29b9ddf988d1728c9ddb816d8893204ba5808755c8f40d3536977a36ea60f1df/lightyear_networkapi/resizefill_w1024_h707;quality_80;format_webp/https:%2F%2Fmedia.zenfs.com%2Fen%2Fonefootball_articles_802%2F0649b1d9ef5d8ff8b56b664ee8eb4101,2026-07-01T04:01:00Z,,"The mythical Azteca, which staged Brazil's third World Cup title in 1970 and saw Maradona lead Argentina in 1986, lived through another historic chapter.
Mexico ended a LONG winless drought in knock… [+2324 chars]",,en,Drought Brazil,Drought,edo,Brazil,SAM,South-America
https://consent.yahoo.com/v2/collectConsent?sessionId=1_cc-session_487079b9-cb83-446b-8cc7-6c30b184b294,https://consent.yahoo.com/v2/collectConsent?sessionId=1_cc-session_487079b9-cb83-446b-8cc7-6c30b184b294,0,consent.yahoo.com,"Fans storm World Cup fan festival in Mexico, police use pepper spray","Hundreds of people stormed a fan festival in the northern Mexican city of Monterrey ahead of World Cup co-hosts Mexico's knockout match against Ecuador in Mexico City, media reports said on Tuesday. Police used pepper spray, according to the reports.",,2026-07-01T04:35:26Z,,"If you click 'Accept all', we and our partners, including 249 who are part of the IAB Transparency &amp; Consent Framework, will also store and / or access information on a device (in other words, us… [+1046 chars]",,en,Storm Ecuador,Storm,wmo,Ecuador,NWS,South-America
https://www.irishtimes.com/sport/soccer/2026/07/01/world-cup-2026-france-dazzle-before-mexico-storm-forward-on-day-of-warnings/,https://www.irishtimes.com/sport/soccer/2026/07/01/world-cup-2026-france-dazzle-before-mexico-storm-forward-on-day-of-warnings/,0,www.irishtimes.com,France dazzle before Mexico storm forward,World Cup 2026: Norway victory adds to worrying augurs for World Cup’s challengers,https://www.irishtimes.com/resizer/v2/HGCUEOSKYO67XGTAHWWQ4M2O2E.jpg?smart=true&auth=2119c14d4eb62761c8ae1a6bb24318b3b3c12e80819cbd907ceba0375483cc70&width=1200&height=630,2026-07-01T06:37:15Z,,"With Sweden 3-0 down and stricken with a kind of vertigo, France manager Didier Deschamps provided a small palliative by substituting Kylian Mbappé and Michael Olise with five minutes of their last-3… [+3999 chars]",,en,Storm France,Storm,wmo,France,WCE,Europe
https://abcnews.com/International/wireStory/hospitals-europe-gearing-heat-wave-armed-lessons-134365897,https://abcnews.com/International/wireStory/hospitals-europe-gearing-heat-wave-armed-lessons-134365897,0,abcnews.com,Hospitals in Europe gear up for the next heat wave armed with lessons from this one,"In the wake of a historic heat wave across Europe, hospitals are already gearing up for the next one",https://i.abcnewsfe.com/a/3c68e38a-1174-4d82-b013-cdf16596f3bc/wirestory_d2c26b56abd848e1a8553a0d702ee0b3_16x9.jpg?w=1600,2026-07-01T07:39:10Z,,"ORSAY, France -- Ice. Urgently and in large quantities.
At a Paris-region hospital, emergency medics needed it to plunge patients into cold-water baths to speedily bring down their temperatures so t… [+4307 chars]",,en,heat,Heat Wave,random,,,
https://www.npr.org/2026/07/01/nx-s1-5875173/world-cup-heat-wave-dome-philadelphia-new-york-new-jersey,https://www.npr.org/2026/07/01/nx-s1-5875173/world-cup-heat-wave-dome-philadelphia-new-york-new-jersey,0,www.npr.org,World Cup's knockout rounds collide with a massive heat wave,"A major heat wave is affecting much of the eastern half of the United States this week, bringing dangerous conditions to multiple World Cup matches.",https://npr.brightspotcdn.com/dims3/default/strip/false/crop/5502x3095+0+115/resize/1400/quality/85/format/jpeg/?url=http%3A%2F%2Fnpr-brightspot.s3.amazonaws.com%2F01%2Ff2%2Fb7f10b4441548b4b2e2a820178de%2Fgettyimages-2283627467.jpg,2026-07-01T09:00:00Z,,"A massive heat wave is sending temperatures into the triple digits in much of the eastern United States, just as the World Cup enters the crucial knockout rounds.
Some areas are expected to set new … [+3245 chars]",,en,heat,Heat Wave,random,,,
https://gothamist.com/news/ac-water-bottles-common-sense-how-to-stay-cool-and-alive-during-the-nyc-heat-wave,https://gothamist.com/news/ac-water-bottles-common-sense-how-to-stay-cool-and-alive-during-the-nyc-heat-wave,0,gothamist.com,"AC, water bottles, common sense: How to stay cool and alive during the NYC heat wave","People spend time at Washington Square Park during hot weather in Manhattan on June 29, 2026.
 

Know the signs of heat-related illness and how to respond. [ more › ]",https://api-prod.gothamist.com/images/357926/fill-1200x650|format-webp|webpquality-85/,2026-07-01T10:30:58Z,,"On this hot July 4, it might be a good idea to swap that soda or beer for a bottle of water.
Staying hydrated is just one important way city officials and healthcare providers say New Yorkers can av… [+5565 chars]",,en,heat,Heat Wave,random,,,
https://www.nbcnews.com/science/climate-change/ocean-temperatures-hit-record-high-in-june-rcna352514,https://www.nbcnews.com/science/climate-change/ocean-temperatures-hit-record-high-in-june-rcna352514,0,www.nbcnews.com,"Ocean surface temperatures hit record high as world enters ‘uncharted territory,’ scientists warn","Temperatures on the ocean surface hit a record high in June, European scientists warned Wednesday, fueling fears of more dangerous heat waves this summer.","https://media-cldnry.s-nbcnews.com/image/upload/t_nbcnews-fp-1200-630,f_auto,q_auto:best/rockcms/2026-07/260701-heat-usa-rs-c69f8b.jpg",2026-07-01T11:01:56Z,,"According to Copernicus Climate Change Service and the Copernicus Marine Service, global ocean temperatures outside the polar regions hit record levels on June 21, surpassing levels for the time of t… [+2781 chars]",,en,record heat,Heat Wave,random,,,
https://www.dailymail.com/news/article-15944273/Europe-hit-deadly-weather-extremes-Forest-fire-kills-two-Greece-storms-claim-lives-east-Portugal-braces-44C-heat.html,https://www.dailymail.com/news/article-15944273/Europe-hit-deadly-weather-extremes-Forest-fire-kills-two-Greece-storms-claim-lives-east-Portugal-braces-44C-heat.html,0,www.dailymail.com,"Europe hit by deadly weather extremes: Forest fire kills two in Greece, storms claim lives in the east and Portugal braces for 44C heat","The heatwave was the most severe ever recorded in Europe, with temperature records broken across large parts of the continent.",https://i.dailymail.com/1s/2026/07/01/12/109716559-0-image-a-37_1782905657136.jpg,2026-07-01T11:37:37Z,,"Deadly weather has swept across Europe after last week's heatwave, with two people killed in a forest fire in Greece and storms claiming lives in Romania and Austria.
The heatwave was the most sever… [+7880 chars]",,en,Heat Wave Greece,Heat Wave,wmo,Greece,MED,Europe
https://www.cbc.ca/news/canada/canada-day-heatwave-festivities-9.7255107,https://www.cbc.ca/news/canada/canada-day-heatwave-festivities-9.7255107,0,www.cbc.ca,"From coast to coast to coast, most Canadians mark Canada Day in sweltering heat",Officials in many provinces are urging people to stay hydrated and check on vulnerable neighbours as communities kick off celebrations for Canada's 159th birthday.,"https://i.cbc.ca/ais/cbdd35c1-af33-4116-b79c-68e8972ccb8d,1782912748696/full/max/0/default.jpg?im=Crop%2Crect%3D%280%2C410%2C6500%2C3656%29%3BResize%3D620",2026-07-01T11:58:33Z,,"Canadians are marking Canada Day under scorching temperatures across much of Central Canada.
Officials in many provinces are urging people to stay hydrated and check on vulnerable neighbours as comm… [+6035 chars]",,en,heat,Heat Wave,random,,,
https://www.androidauthority.com/fable-5-back-3683475/,https://www.androidauthority.com/fable-5-back-3683475/,0,www.androidauthority.com,"Anthropic’s Fable 5 is back, and that’s no fairy tale","It's been three weeks since Fable 5 and Mythos 5 debuted, and it has been a whirlwind for both of them — but they're finally back!",https://www.androidauthority.com/wp-content/uploads/2023/12/claude-homepage.jpg,2026-07-01T18:31:18Z,,"<ul><li>Anthropic introduced its Fable 5 and Mythos 5 models last month, with advanced security research tools.</li><li>Even though Anthropic took major efforts to limit abuse potential, it still pul… [+2495 chars]",,en,whirlwind,Storm,random,,,
https://www.boredpanda.com/paris-deputy-blames-americans-for-europe-heat-wave/,https://www.boredpanda.com/paris-deputy-blames-americans-for-europe-heat-wave/,0,www.boredpanda.com,"Paris Deputy Mayor Blames Americans For Europe’s Climate Crisis As Heat Wave Casualty Toll Reaches 1,300","Paris deputy mayor blamed Americans for Europe’s heat wave, igniting a fierce climate responsibility debate.",https://static.boredpanda.com/blog/wp-content/uploads/2026/06/fb_image_6a4418b64b024.png,2026-07-01T21:20:55Z,,"As Europe continues to battle one of the worst heat waves in its history, a seniorParis official has sparked a heated debate by blaming Americans for helping fuel the climate crisis behind the extrem… [+6575 chars]",,en,heat,Heat Wave,random,,,
https://www.accuweather.com/en/weather-forecasts/fourth-of-july-week-furnace-dangerous-heat-dome-for-250-million-people/1906347,https://www.accuweather.com/en/weather-forecasts/fourth-of-july-week-furnace-dangerous-heat-dome-for-250-million-people/1906347,0,www.accuweather.com,UPDATE: HISTORIC HEAT BLAST FOR HOLIDAY WEEK...,"UPDATE: HISTORIC HEAT BLAST FOR HOLIDAY WEEK...

 
 
 
 (Third column, 16th story, link)

 

 

 
 Related stories:LIVE: TEMP MAP...
Power grids pushed to limit...",https://cms.accuweather.com/wp-content/uploads/2026/06/thu_nc.jpg?w=768,2026-07-01T22:58:42Z,,"A major heat wave will grip close to three dozen states in the days leading up to the Fourth of July and could put millions at risk for heat-related illness.
At a time when millions of Americans hav… [+5543 chars]",,en,heat,Heat Wave,random,,,
https://www.scmp.com/news/hong-kong/article/3359089/hong-kong-issues-no-1-typhoon-signal-thursday-morning,https://www.scmp.com/news/hong-kong/article/3359089/hong-kong-issues-no-1-typhoon-signal-thursday-morning,0,www.scmp.com,Hong Kong issues No 1 typhoon signal on Thursday morning,"This story has been made freely available as a public service to our readers. Please consider supporting SCMP’s journalism by subscribing.
The Hong Kong Observatory issued the No 1 typhoon signal at 7.40am on Thursday as an approaching tropical cyclone moved …",https://cdn.i-scmp.com/sites/default/files/styles/og_image_scmp_generic/public/d8/images/canvas/2026/07/02/67675ccb-3a81-423d-9421-7ac921a43304_be60794f.jpg?itok=SkIclbgi&v=1782951783,2026-07-02T00:23:11Z,,"This story has been made freely available as a public service to our readers. Please consider supporting SCMPs journalism bysubscribing.
The Hong Kong Observatory issued the No 1 typhoon signal at 7… [+932 chars]",,en,Typhoon Hong Kong,Tropical Cyclone,wmo,Hong Kong,EAS,Asia
https://abcnews.com/US/stretched-limit-heat-wave-prompts-us-electrical-grid/story?id=134369230,https://abcnews.com/US/stretched-limit-heat-wave-prompts-us-electrical-grid/story?id=134369230,0,abcnews.com,'Stretched to the limit': Heat wave prompts US electrical grid emergency,The U.S. Department of Energy has declared an emergency as a heat wave bears down on a huge part of the nation's electrical grid.,https://i.abcnewsfe.com/a/be20a1f9-066e-4e8f-a2ee-35c394ca013e/heat-wave-boston-gty-bh-260701_1782924816817_hpMain_16x9.jpg?w=1600,2026-07-02T02:21:28Z,,"With 160 million people in 30 states under alert for extreme temperatures, the U.S. Department of Energy has declared an emergency as a heat wave bears down on a huge part of the nation's electrical … [+4473 chars]",,en,heat wave,Heat Wave,random,,,
https://www.dailymail.com/news/article-15946411/winter-blast-australia-cold-tasmania-snow-temperatures-sydney-melbourne.html,https://www.dailymail.com/news/article-15946411/winter-blast-australia-cold-tasmania-snow-temperatures-sydney-melbourne.html,0,www.dailymail.com,Bitter polar blast to freeze millions of Aussies with snow dumps finally expected on our barren ski fields,A strong cold front lurking over the Great Australian Bight is surging towards Tasmania and the south-east mainland,https://i.dailymail.com/1s/2026/07/02/02/109736145-0-image-a-13_1782956394054.jpg,2026-07-02T03:01:28Z,,"Millions of Aussies are urged to rug up as a chilly winter blast sweeps across the nation this weekend, bringing freezing temperatures and snow.
Australia's south-east will feel the brunt of the con… [+5258 chars]",,en,Snow Australia,Snow&Ice,wmo,Australia,CAU,Oceania
https://www.nzherald.co.nz/nz/drought-unpicked-apples-and-freezing-winters-el-ninos-greatest-hits/KNIQWLH5Q5CMZOWOII34PWBLSA/,https://www.nzherald.co.nz/nz/drought-unpicked-apples-and-freezing-winters-el-ninos-greatest-hits/KNIQWLH5Q5CMZOWOII34PWBLSA/,0,www.nzherald.co.nz,"Drought, unpicked apples, and freezing winters: El Nino’s greatest hits",The 1997-98 event cost farmers an estimated $425m after widespread drought.,https://www.nzherald.co.nz/resizer/v2/ZS3B7DCJWZBB7DIL57OITTKOHM.jpg?auth=1276d814aaac1bcbde17926fd139222d06778c8a7456e1013874cda37f22387c&width=1200&height=675&quality=70&focal=2247%2C1551&smart=false,2026-07-02T05:32:52Z,,"But New Zealand sits thousands of kilometres away from the high-impact zone in the tropical Pacific, and so El Ninos effects are weaker and less predictable here than somewhere like Indonesia, which … [+5840 chars]",,en,freezing,Snow&Ice,random,,,
https://www.cbc.ca/news/canada/heat-wave-swimming-risk-canada-9.7253498,https://www.cbc.ca/news/canada/heat-wave-swimming-risk-canada-9.7253498,0,www.cbc.ca,Want to cool off with a dip in a river or lake? Here's how to stay safe,"After a rash of drowning deaths during Europe's ongoing record-breaking heat wave, advocates are urging Canadians to stay safe this Canada Day as they push for more public swimming access across the country.","https://i.cbc.ca/ais/d3d29923-3b1b-44ac-a846-ca130266d7da,1782851372621/full/max/0/default.jpg?im=Crop%2Crect%3D%280%2C226%2C5824%2C3276%29%3BResize%3D620",2026-07-02T08:00:00Z,,"After a rash of drowning deaths during Europe's record-breaking heat wave, advocates are urging Canadians to stay safe this summer as they push for more public swimming access across the country. 
F… [+5880 chars]",,en,heat wave,Heat Wave,random,,,
https://www.foxsports.com/stories/soccer/resilience-belief-steely-focus-how-usa-weathered-storm-gritty-world-cup-win,https://www.foxsports.com/stories/soccer/resilience-belief-steely-focus-how-usa-weathered-storm-gritty-world-cup-win,0,www.foxsports.com,"Resilience, Belief And 'Steely Focus': How USA Weathered Storm For Gritty World Cup Win",The USA showed its character in a gritty round of 32 win over Bosnia and Herzegovina.,https://a57.foxsports.com/statics.foxsports.com/www.foxsports.com/content/uploads/2026/07/1408/814/ream1.jpg?ve=1&tl=1,2026-07-02T08:09:15Z,,"SAN FRANCISCO BAY AREA STADIUM What does it say about this U.S. mens national team that it can lose its top striker and leading scorer to a red card, then band together for the final 36 minutes and n… [+4764 chars]",,en,storm,Storm,random,,,
