index,url,valid,domain,title,description,image,published,archive,content,quote,language,term,topic,feed,country,ipcc,continent
https://www.cnbc.com/2025/11/13/trump-tariffs-high-beef-prices.html,https://www.cnbc.com/2025/11/13/trump-tariffs-high-beef-prices.html,0,www.cnbc.com,Trump tariffs are helping drive U.S. beef prices to new highs,"President Trump's tariffs are adding to higher beef prices, along with drought and parasites in a stressed U.S. beef supply chain.",https://image.cnbcfm.com/api/v1/image/108225751-1763069191237-gettyimages-2226529539-jr_10110_x7mfbjw2.jpeg?v=1763069205&w=1920&h=1080,2025-11-13T22:01:13Z,,"President Donald Trump is blaming the meat packers and U.S. cattlemen for rising beef prices, but the tariffs on beef from Brazil, Australia, New Zealand, Uruguay, feed, farm equipment and machinery … [+5616 chars]",,en,drought,Drought,random,,,
https://www.rte.ie/news/business/2025/1114/1543923-eu-states-back-small-parcel-duties/,https://www.rte.ie/news/business/2025/1114/1543923-eu-states-back-small-parcel-duties/,0,www.rte.ie,EU states back small parcel duties to tackle China flood,EU finance ministers have agreed to scrap a bloc-wide duty exemption on low-value orders from the likes of retail giants Temu and Shein to help tackle a flood of cheap Chinese imports.,https://www.rte.ie/images/00236539-1600.jpg,2025-11-14T07:54:40Z,,"EU finance ministers have agreed to scrap a bloc-wide duty exemption on low-value orders from the likes of retail giants Temu and Shein to help tackle a flood of cheap Chinese imports.
There is curr… [+1632 chars]",,en,Flood China,Flood,wmo,China,EAS,Asia
https://www.haaretz.com/israel-news/2025-11-14/ty-article/.premium/eight-rescued-from-flooded-cars-amid-israels-first-major-winter-storm/0000019a-821a-d1cc-a9df-efde906c0000,https://www.haaretz.com/israel-news/2025-11-14/ty-article/.premium/eight-rescued-from-flooded-cars-amid-israels-first-major-winter-storm/0000019a-821a-d1cc-a9df-efde906c0000,0,www.haaretz.com,Eight rescued from flooded cars amid Israel's first major winter storm,Friday's storm caused power outages in central Israel's Light Rail and delays were caused in Israel Railways' train schedule,"https://img.haarets.co.il/bs/0000019a-821a-d1cc-a9df-efde906c0000/cd/89/71f1aefe4d35ad63d8327a93d139/788533.jpg?precrop=2400,1395,x0,y0&width=1200&height=630&cmsprod",2025-11-14T11:46:38Z,,"Heavy rain fell across Israel on Friday, mostly along the country's coast. The city of Ashkelon, located seven miles (11 kilometers) from Gaza, recorded 2.9 inches (73 mm) of rainfall since morning, … [+38 chars]",,en,Flood Israel,Flood,wmo,Israel,MED,Asia
https://www.rt.com/news/627800-massive-solar-storm-hits-earth/,https://www.rt.com/news/627800-massive-solar-storm-hits-earth/,0,www.rt.com,Record solar storm hits Earth (VIDEOS),"A major solar storm, the second most powerful in five years, has colored the skies over the Northern Hemisphere with the Aurora Borealis Read Full Article at RT.com",https://mf.b37mrtl.ru/files/2025.11/article/69173cc285f54033d63c295d.png,2025-11-14T15:51:15Z,,"A major solar storm rated the second most powerful in five years and lasting over forty hours hit the Earth this week, scientists from several countries have reported. The natural phenomenon has caus… [+2066 chars]",,en,storm,Storm,random,,,
https://www.bbc.com/news/articles/c4gw5xxej04o,https://www.bbc.com/news/articles/c4gw5xxej04o,0,www.bbc.com,Weather warnings in force as Storm Claudia brings heavy rain to UK,"The storm has brought flooding and downpours, with some areas expecting up to a month's worth of rain in a day.",https://ichef.bbci.co.uk/news/1024/branded_news/a7c5/live/c48b8af0-c171-11f0-8669-5560f5c90fbe.jpg,2025-11-14T18:36:28Z,,"Ruth Comerford and BBC Weather
Amber warnings from the Met Office for ""persistent and heavy"" rain are in force as Storm Claudia continues to move across the United Kingdom.
A wider yellow severe we… [+4410 chars]",,en,Flooding Ning er,Flood,wmo,China,EAS,Asia
https://www.npr.org/2025/11/14/nx-s1-5605864/jordan-prays-for-rain-as-drought-hits-olive-harvest,https://www.npr.org/2025/11/14/nx-s1-5605864/jordan-prays-for-rain-as-drought-hits-olive-harvest,0,www.npr.org,Jordan prays for rain as drought hits olive harvest,"As world leaders meet in Brazil to discuss climate change, Jordanians pray for rain.",https://media.npr.org/include/images/facebook-default-wide-s1400-c100.jpg,2025-11-14T21:04:30Z,,"As world leaders meet in Brazil to discuss climate change, Jordanians pray for rain.",,en,Drought Jordan,Drought,edo,Jordan,MED,Asia
https://www.abc.net.au/news/2025-11-15/qld-weather-wrap-saturday-storms-predicted-by-bom/106011002,https://www.abc.net.au/news/2025-11-15/qld-weather-wrap-saturday-storms-predicted-by-bom/106011002,0,www.abc.net.au,Another round of severe storms to hit SEQ this weekend,"Large hail, damaging winds and heavy rainfall are all on the cards, with another round of severe storms due to hit south-east Queensland.",https://live-production.wcms.abc-cdn.net.au/3fb3386a5d645fd2a8cf5fa4fc1d1c93?impolicy=wcms_watermark_news&cropH=1152&cropW=2048&xPos=0&yPos=192&width=862&height=485&imformat=generic,2025-11-14T21:07:06Z,,"Queenslanders are once again being warned to brace for severe thunderstorms with the possibility of more large hail across parts of the state this weekend.
The warning came after south-east Queensla… [+3294 chars]",,en,heavy rain Queensland,Precipitation,acwe,Australia,CAU,Oceania
https://www.aljazeera.com/news/2025/11/14/displaced-palestinian-families-suffer-as-heavy-rains-flood-gaza-tent-camps,https://www.aljazeera.com/news/2025/11/14/displaced-palestinian-families-suffer-as-heavy-rains-flood-gaza-tent-camps,0,www.aljazeera.com,Displaced Palestinian families suffer as heavy rains flood Gaza tent camps,Palestinians call for better tents and other supplies as Israel maintains restrictions on aid to war-ravaged Gaza Strip.,https://www.aljazeera.com/wp-content/uploads/2025/11/afp_691796ed8cf7-1763153645.jpg?resize=1920%2C1440,2025-11-14T22:16:58Z,,"Displaced Palestinians are reeling after heavy rains flooded their tents in makeshift displacement camps in Gaza City, as the United Nations warns that Israeli restrictions on aid have left hundreds … [+3363 chars]",,en,Flood Israel,Flood,wmo,Israel,MED,Asia
https://www.spacedaily.com/reports/MIT_Haystack_scientists_study_recent_geospace_storms_and_resulting_light_shows_999.html,https://www.spacedaily.com/reports/MIT_Haystack_scientists_study_recent_geospace_storms_and_resulting_light_shows_999.html,0,www.spacedaily.com,Haystack scientists study recent geospace storms and light shows,"Boston MA (SPX) Nov 15, 2025


The northern lights, or aurora borealis, one of nature's most spectacular visual shows, can be elusive. Conventional wisdom says that to see them, we need to travel to northern Canada or Alaska. However, in the past two years, N…",https://www.spxdaily.com/images-hg/aurora-near-poker-flats-alaska-hg.jpg,2025-11-15T09:46:55Z,,"by Nancy Wolfe Kotary and Philip J. EricksonBoston MA (SPX) Nov 15, 2025
The northern lights, or aurora borealis, one of nature's most spectacular visual shows, can be elusive. Conventional wisdom s… [+6444 chars]",,en,storm,Storm,random,,,
http://longreads.com/2025/11/15/bloomberg-great-wealth-transfer/,http://longreads.com/2025/11/15/bloomberg-great-wealth-transfer/,0,longreads.com,"Boomers Are Passing Down Fortunes — And Way, Way Too Much Stuff","""As the $90 trillion Great Wealth Transfer begins, millennials and Gen X aren’t just inheriting money. They’re being buried under an avalanche of baseball cards, fine china and collections of all sorts.""",,2025-11-15T12:00:00Z,,"My mother’s been cleaning out the rambling study in the house she shared with my late fatherwhich means that last week, I started researching how to ship a crate of records across the country. Next u… [+1773 chars]",,en,Avalanche China,Snow&Ice,wmo,China,EAS,Asia
https://www.abc.net.au/news/2025-11-16/gold-coast-schoolies-scaled-back-and-subdued/106012262,https://www.abc.net.au/news/2025-11-16/gold-coast-schoolies-scaled-back-and-subdued/106012262,0,www.abc.net.au,Gold Coast Schoolies celebrations set to be scaled back and subdued,Schoolies celebrations on the Gold Coast will look different this year due to beach erosion in the wake of Cyclone Alfred.,https://live-production.wcms.abc-cdn.net.au/55a5e09afd1d2978c4973edfa1540a7e?impolicy=wcms_watermark_news&cropH=844&cropW=1500&xPos=0&yPos=118&width=862&height=485&imformat=generic,2025-11-15T20:58:40Z,,"Schoolies celebrations on the Gold Coast will be scaled back for the first time this year due to ongoing beach erosion in the wake of Tropical Cyclone Alfred.
The state government and Gold Coast Cou… [+3991 chars]",,en,cyclone,Tropical Cyclone,random,,,
https://www.aljazeera.com/news/2025/11/15/palestinians-reel-under-winter-rains-as-israel-blocks-gaza-shelter-supplies,https://www.aljazeera.com/news/2025/11/15/palestinians-reel-under-winter-rains-as-israel-blocks-gaza-shelter-supplies,0,www.aljazeera.com,Palestinians reel under winter rains as Israel blocks Gaza shelter supplies,Palestinian families call for help as Israel's two-year military assault has left hundreds of thousands vulnerable.,https://www.aljazeera.com/wp-content/uploads/2025/11/afp_691796ed8cf7-1763153645.jpg?resize=1920%2C1440,2025-11-15T22:14:45Z,,"Cold temperatures and heavy rainfall have worsened already dire conditions for hundreds of thousands of displaced Palestinian families across the Gaza Strip, as Israel continues to block deliveries o… [+3210 chars]",,en,Rain Israel,Precipitation,wmo,Israel,MED,Asia
https://www.abc.net.au/news/2025-11-16/queensland-sunday-storms-heavy-rain-river-warnings/106014806,https://www.abc.net.au/news/2025-11-16/queensland-sunday-storms-heavy-rain-river-warnings/106014806,0,www.abc.net.au,Heavy rain forecast for parts of Queensland after two rescued from floodwaters,The Bureau of Meteorology says parts of Queensland and New South Wales will likely see smaller pockets of severe thunderstorm activity on Sunday.,https://live-production.wcms.abc-cdn.net.au/f4854ac3040adb39b6e000a92695a60d?impolicy=wcms_watermark_news&cropH=1080&cropW=1920&xPos=0&yPos=0&width=862&height=485&imformat=generic,2025-11-15T22:37:11Z,,"Thunderstorms and heavy rain are forecast for small parts of Queensland after two people were rescued from floodwaters on Saturday. 
Swiftwater rescue crews retrieved two people from vehicles stuck … [+1344 chars]",,en,Flood SOUTH,Flood,wmo,Malawi,ESAF,Africa
https://www.aljazeera.com/news/2025/11/16/enormous-evil-thousands-rally-in-the-philippines-over-corruption-scandal,https://www.aljazeera.com/news/2025/11/16/enormous-evil-thousands-rally-in-the-philippines-over-corruption-scandal,0,www.aljazeera.com,‘Enormous evil’: Thousands rally in the Philippines over corruption scandal,Protests come amid widespread anger over billions of pesos spent on substandard flood control projects.,https://www.aljazeera.com/wp-content/uploads/2025/11/AP25290418349449-1763272685.jpg?resize=1200%2C675,2025-11-16T07:21:40Z,,"Tens of thousands of people are gathering in the Philippines capital, Manila, demanding accountability over a corruption scandal linked to flood-control projects and top government officials, includi… [+3902 chars]",,en,Flood Philippines,Flood,wmo,Philippines,SEA,Asia
https://www.nakedcapitalism.com/2025/11/links-11-6-2025-2.html,https://www.nakedcapitalism.com/2025/11/links-11-6-2025-2.html,0,www.nakedcapitalism.com,Links 11/16/2025,"Our strategic daily links: undersea courtship, chemtrails, Venezuela tensions, China EV slowdown, crumbling parliament, Gaza horrors, Ukraine burning, vanishing privacy, Trumpishness, Musk world, hapless Democrats, immigration troubles, Mr. market, AI, and wr…",https://www.nakedcapitalism.com/wp-content/uploads/2025/11/Sea-otter-600.jpeg,2025-11-16T11:55:18Z,,"When researchers found this kind of mysterious underwater ‘crop circles’, they did not know the cause.
Then, they proved to be amazing artwork made by pufferfish to attract and win a mate. pic.twitt… [+8325 chars]",,en,Rain Ning er,Precipitation,wmo,China,EAS,Asia
https://www.aljazeera.com/news/2025/11/16/israel-kills-at-least-three-in-gaza-as-thousands-endure-heavy-flooding,https://www.aljazeera.com/news/2025/11/16/israel-kills-at-least-three-in-gaza-as-thousands-endure-heavy-flooding,0,www.aljazeera.com,"Israel kills at least three in Gaza, as thousands endure heavy flooding","As Gaza’s misery deepens, Israel’s Netanyahu reveals to cabinet that he is uncertain how long truce will hold.",https://www.aljazeera.com/wp-content/uploads/2025/11/AA-20251116-39722711-39722692-DISPLACED_FAMILIES_IN_DEIR_ALBALAH_STRUGGLE_WITH_SEVERE_SHELTER_SHORTAGES-1763299115.jpg?resize=1920%2C1440,2025-11-16T22:26:27Z,,"The Israeli military has killed at least three Palestinians in Gaza, as the coastal enclave reeled from heavy rains flooding shoddy makeshift tents housing thousands who have been denied adequate she… [+4809 chars]",,en,Flooding Israel,Flood,wmo,Israel,MED,Asia
https://economictimes.indiatimes.com/news/weather/chennai-weather-imd-issues-orange-alert-as-heavy-rain-strike-tamil-nadu-will-schools-remain-shut-today/articleshow/125374407.cms,https://economictimes.indiatimes.com/news/weather/chennai-weather-imd-issues-orange-alert-as-heavy-rain-strike-tamil-nadu-will-schools-remain-shut-today/articleshow/125374407.cms,0,economictimes.indiatimes.com,Chennai weather: IMD issues orange alert as heavy rains strike Tamil Nadu — Will schools remain shut today?,"The system, which is expected to move west-northwestwards in the next 24 hours, has already triggered thunderstorms in parts of the capital and intensified rainfall across southern Tamil Nadu. IMD forecasts heavy to very heavy rain in Chennai, Tiruvallur, Kan…","https://img.etimg.com/thumb/msid-125374416,width-1200,height-630,imgsize-16372,overlay-economictimes/articleshow.jpg",2025-11-17T02:21:34Z,,"Chennai is bracing for a sharp revival of the Northeast Monsoon on Monday, with the India Meteorological Department (IMD) issuing an orange alert for the city and several northern coastal districts. … [+2900 chars]",,en,heavy rain,Precipitation,random,,,
https://www.thehindubusinessline.com/economy/agri-business/isolated-heavy-rain-forecast-for-tamil-nadu-as-low-persists/article70289583.ece,https://www.thehindubusinessline.com/economy/agri-business/isolated-heavy-rain-forecast-for-tamil-nadu-as-low-persists/article70289583.ece,0,www.thehindubusinessline.com,Isolated heavy rain forecast for Tamil Nadu as ‘low’ persists,Isolated very heavy rainfall is likely over Tamil Nadu today as the previous day’s low-pressure area over south-west Bay of Bengal and adjoining Sri Lanka coast persisted. India Meteorological Department (IMD) said.,https://bl-i.thgim.com/public/incoming/2d1pd5/article70289569.ece/alternates/LANDSCAPE_1200/WeathrNov17am.jpg,2025-11-17T05:59:02Z,,Isolated very heavy rainfall is likely over Tamil Nadu today (Monday) as the previous days low-pressure area over south-west Bay of Bengal and adjoining Sri Lanka coast persisted. India Meteorologica… [+1996 chars],,en,Rain India,Precipitation,wmo,India,SAS,Asia
https://economictimes.indiatimes.com/news/india/delhi-shivers-at-9c-coldest-november-night-in-three-years-aqi-still-very-poor/articleshow/125379434.cms,https://economictimes.indiatimes.com/news/india/delhi-shivers-at-9c-coldest-november-night-in-three-years-aqi-still-very-poor/articleshow/125379434.cms,0,economictimes.indiatimes.com,"Delhi shivers at 9°C: Coldest November night in three years, AQI still 'very poor'","Delhi experienced its chilliest November night in three years, with temperatures dipping to 9°C. Despite meeting cold wave criteria at two stations, it hasn't been officially declared due to the requirement of two consecutive days. Clear skies and cold winds …","https://img.etimg.com/thumb/msid-125379439,width-1200,height-630,imgsize-15316,overlay-economictimes/articleshow.jpg",2025-11-17T07:21:24Z,,"The national capital experienced its chilliest November night in three years on Sunday, with the temperature at Safdarjung Delhis main weather station dipping to 9°C, which is 4.5 degrees below norma… [+2938 chars]",,en,coldest day,Cold Wave,random,,,
https://economictimes.indiatimes.com/news/india/cold-wave-warning-for-4-odisha-districts-g-udaygiri-coldest-place-in-state-at-5-4-degree-celsius/articleshow/125383684.cms,https://economictimes.indiatimes.com/news/india/cold-wave-warning-for-4-odisha-districts-g-udaygiri-coldest-place-in-state-at-5-4-degree-celsius/articleshow/125383684.cms,0,economictimes.indiatimes.com,"Cold wave warning for 4 Odisha districts, G Udaygiri coldest place in state at 5.4 degree Celsius","A chilling cold wave has enveloped Odisha, prompting the India Meteorological Department to alert several districts. G Udaygiri has plunged to a frigid 5.4 degrees Celsius, marking a stark reminder of winter's bite. Bhubaneswar is experiencing its coldest Nov…","https://img.etimg.com/thumb/msid-125383727,width-1200,height-630,imgsize-4228,overlay-economictimes/articleshow.jpg",2025-11-17T10:58:16Z,,"The IMD on Monday issued a cold wave warning for four districts, including Bhubaneswar, while G Udaygiri was the coldest place in the state at 5.4 degree Celsius.The IMD in its mid-day bulletin issue… [+1677 chars]",,en,Cold Wave Lin an District,Cold Wave,wmo,China,EAS,Asia
https://economictimes.indiatimes.com/news/new-updates/school-assembly-news-headlines-for-18th-november-top-national-international-sports-and-business-update/articleshow/125384122.cms,https://economictimes.indiatimes.com/news/new-updates/school-assembly-news-headlines-for-18th-november-top-national-international-sports-and-business-update/articleshow/125384122.cms,0,economictimes.indiatimes.com,"School Assembly News Headlines for 18th November: Top national, international, sports and business update",India and the US are nearing a trade deal. A cold wave is expected in Odisha. The Supreme Court has criticized Rajasthan for river pollution. Anil Ambani has again skipped an ED summons. Russia hopes for a Putin-Trump summit. Ousted Bangladesh PM Sheikh Hasin…,"https://img.etimg.com/thumb/msid-125384151,width-1200,height-630,imgsize-14776,overlay-economictimes/articleshow.jpg",2025-11-17T11:18:55Z,,"Heres your quick round-up of all the important news headlines for school assembly on 18 November 2025, covering national, international, and sports updates. These stories will help students stay info… [+3941 chars]",,en,cold wave,Cold Wave,random,,,
https://www.hurriyetdailynews.com/gaza-floods-cold-worsen-humanitarian-conditions-for-displaced-palestinians-215826,https://www.hurriyetdailynews.com/gaza-floods-cold-worsen-humanitarian-conditions-for-displaced-palestinians-215826,0,www.hurriyetdailynews.com,"Gaza floods, cold worsen humanitarian conditions for displaced Palestinians","Cold weather and steady downpours on Nov. 17 further deepened the already grim conditions for displaced Palestinian families in Gaza, with Israel still preventing tents and other essential shelter materials from entering the enclave.",https://image.hurimg.com/i/hurriyet/75/200x200/691b07c50234c1c0dd8057ea.jpg,2025-11-17T11:32:26Z,,"GAZA CITY
A Palestinian woman walks through a rainstorm past buildings destroyed in Israeli strikes in the Sheikh Radwan neighborhood of Gaza City, Friday, Nov. 14, 2025. (AP Photo/Jehad Alshrafi)
… [+2319 chars]",,en,Downpour Israel,Precipitation,wmo,Israel,MED,Asia
https://www.aljazeera.com/news/2025/11/17/whats-prompting-growing-anticorruption-protests-in-the-philippines,https://www.aljazeera.com/news/2025/11/17/whats-prompting-growing-anticorruption-protests-in-the-philippines,0,www.aljazeera.com,What’s prompting growing anticorruption protests in the Philippines?,Mass protests demand transparency in the government investigation of flood-related corruption scandal.,https://www.aljazeera.com/wp-content/uploads/2025/11/AFP__20251116__84769GM__v1__MidRes__PhilippinesPoliticsReligion-1763356877.jpg?resize=1200%2C630,2025-11-17T12:31:57Z,,"More than half a million Filipinos rallied in the capital Manila on Sunday to demand accountability for a government corruption scandal that has triggered a series of protests since August.
Sundays … [+9950 chars]",,en,Flood Philippines,Flood,wmo,Philippines,SEA,Asia
https://www.nzherald.co.nz/nz/weather-atmospheric-river-to-bring-heavy-rain-muggy-temperatures-for-much-of-new-zealand/I7LXZOY6XRFDXDMEAGXV7NKL7A/,https://www.nzherald.co.nz/nz/weather-atmospheric-river-to-bring-heavy-rain-muggy-temperatures-for-much-of-new-zealand/I7LXZOY6XRFDXDMEAGXV7NKL7A/,0,www.nzherald.co.nz,"Weather: Atmospheric river to bring heavy rain, muggy temperatures for much of New Zealand","""I would be shocked if anywhere on the North Island managed to skip out on rain.""",https://www.nzherald.co.nz/resizer/v2/TQVXD3JH5VCJ3JHMTGFXCIGVBE.png?auth=b1dc9496603e9fac1f11297d4137369d6861031c42fce1bebd7756ba3a69323c&width=1200&height=675&quality=70&focal=352%2C308&smart=false,2025-11-17T16:00:00Z,,"MetService forecaster Alec Holden told the Herald a lot of rain was spread across the North Island.
MetService has issued a series of heavy rain watches and warnings across the centre of the North I… [+1993 chars]",,en,Rain New Zealand,Precipitation,wmo,New Zealand,NZ,Oceania
https://typeforyou.org/automobile-insurance-cover/,https://typeforyou.org/automobile-insurance-cover/,0,typeforyou.org,Does Automobile Insurance Cover Natural Disaster Damage?,"Natural disasters in the United States are becoming more frequent, more unpredictable, and more destructive. From hurricanes on the East Coast to wildfires in California...",https://typeforyou.org/wp-content/uploads/2025/11/20251117_1850_Car-Insurance-Dilemma_simple_compose_01ka9be4z1fdk8s2nw1bnwsbxs-1-683x1024.png,2025-11-17T16:30:15Z,,"Natural disasters in the United States are becoming more frequent, more unpredictable, and more destructive. From hurricanes on the East Coast to wildfires in California to tornadoes sweeping through… [+11355 chars]",,en,Hurricane United States,Tropical Cyclone,wmo,United States,CNA,North-America
https://www.abc.net.au/news/2025-11-18/asx-market-sump-worst-since-liberation-day-tariffs-nov-16/106020676,https://www.abc.net.au/news/2025-11-18/asx-market-sump-worst-since-liberation-day-tariffs-nov-16/106020676,0,www.abc.net.au,Tech stocks lead $59bn ASX slump on 'perfect storm' of fears,"The Australian share market posts its worst one-day loss since the fallout from Donald Trump's Liberation Day tariff announcement in early April, with more than $59 billion wiped off the value of listed companies.",https://live-production.wcms.abc-cdn.net.au/53bd1a387addb50c1c51dba7b7498757?impolicy=wcms_watermark_news&cropH=3419&cropW=6079&xPos=471&yPos=265&width=862&height=485&imformat=generic,2025-11-17T20:52:35Z,,"The ASX 200 has fallen to its lowest point in almost five months, sliding as much as 2.16 per cent to an intraday low of 8,450 points, before finishing the day down 1.94 per cent at 8,469 points.
Th… [+18334 chars]",,en,storm,Storm,random,,,
https://www.abc.net.au/news/2025-11-18/tropical-low-cyclone-nt-bureau-of-meteorology-/106023036,https://www.abc.net.au/news/2025-11-18/tropical-low-cyclone-nt-bureau-of-meteorology-/106023036,0,www.abc.net.au,Category two cyclone predicted off NT coast by Thursday,"The Bureau of Meteorology has issued its first forecast track map for a tropical low over the NT, showing the system is expected to strengthen into a category two cyclone by Thursday night.",https://live-production.wcms.abc-cdn.net.au/02ce96f9dc39b2139631790825bde52a?impolicy=wcms_watermark_news&cropH=360&cropW=640&xPos=0&yPos=60&width=862&height=485&imformat=generic,2025-11-18T03:04:08Z,,"A tropical low sitting off the Northern Territory coast is forecast to become a category two cyclone by Thursday, the Bureau of Meteorology (BOM) says.
The BOM issued its first forecast track map fo… [+3510 chars]",,en,cyclone,Tropical Cyclone,random,,,
https://timesofindia.indiatimes.com/life-style/travel/imd-forecasts-persistent-rainfall-for-south-india-severe-cold-conditions-to-sweep-through-these-central-states/articleshow/125400419.cms,https://timesofindia.indiatimes.com/life-style/travel/imd-forecasts-persistent-rainfall-for-south-india-severe-cold-conditions-to-sweep-through-these-central-states/articleshow/125400419.cms,0,timesofindia.indiatimes.com,IMD forecasts persistent rainfall for south India; severe cold conditions to sweep through these central states,"Southern India is set to endure a wet spell with persistent rains and fierce thunderstorms until November 23, particularly affecting the Andaman & Nicobar Islands with expected heavy downpours. In contrast, a chilling cold wave will sweep across central India…","https://static.toiimg.com/thumb/msid-125400419,width-1070,height-580,imgsize-101262,resizemode-75,overlay-toi_sw,pt-32,y_pad-40/photo.jpg",2025-11-18T03:30:33Z,,"The most prolonged wet spell this week is expected over Tamil Nadu, Puducherry, and Karaikal, where light to moderate rain or thunderstorms are likely at most or many places every day from November 1… [+4391 chars]",,en,thunderstorm,Thunderstorm,random,,,
